Trial 291 finished with value: 161.60508833881377 and parameters: {'input_dropout': 0.0, 'hidden_layers': 9, 'hidden_units': 160, 'kernel_initializer': 'random_normal', 'hidden_activation': 'relu', 'hidden_dropout': 0.05, 'batch_norm': 'on', 'optimizer_type': 'adam', 'optimizer_lr': 0.0033209832270689804, 'batch_size': 96}. Best is trial 171 with value: 10.681659473072962.
Trial 292 finished with value: 11.487042908614521 and parameters: {'input_dropout': 0.0, 'hidden_layers': 9, 'hidden_units': 128, 'kernel_initializer': 'he_normal', 'hidden_activation': 'leaky_relu', 'hidden_dropout': 0.0, 'batch_norm': 'off', 'optimizer_type': 'adam', 'optimizer_lr': 0.0022370297766348903, 'batch_size': 96}. Best is trial 171 with value: 10.681659473072962.
Trial 293 finished with value: 15.29477362880574 and parameters: {'input_dropout': 0.0, 'hidden_layers': 9, 'hidden_units': 128, 'kernel_initializer': 'he_normal', 'hidden_activation': 'leaky_relu', 'hidden_dropout': 0.0, 'batch_norm': 'off', 'optimizer_type': 'adam', 'optimizer_lr': 0.002181515647258597, 'batch_size': 96}. Best is trial 171 with value: 10.681659473072962.
Trial 294 finished with value: 14.27445249677067 and parameters: {'input_dropout': 0.0, 'hidden_layers': 9, 'hidden_units': 128, 'kernel_initializer': 'he_normal', 'hidden_activation': 'leaky_relu', 'hidden_dropout': 0.0, 'batch_norm': 'on', 'optimizer_type': 'adam', 'optimizer_lr': 0.001939810598913551, 'batch_size': 96}. Best is trial 171 with value: 10.681659473072962.
Trial 295 finished with value: 8.730305301702867 and parameters: {'input_dropout': 0.0, 'hidden_layers': 9, 'hidden_units': 128, 'kernel_initializer': 'he_normal', 'hidden_activation': 'leaky_relu', 'hidden_dropout': 0.0, 'batch_norm': 'off', 'optimizer_type': 'adam', 'optimizer_lr': 0.0022900554769444055, 'batch_size': 96}. Best is trial 295 with value: 8.730305301702867.
Trial 296 finished with value: 14.976248702324192 and parameters: {'input_dropout': 0.0, 'hidden_layers': 9, 'hidden_units': 128, 'kernel_initializer': 'he_normal', 'hidden_activation': 'leaky_relu', 'hidden_dropout': 0.0, 'batch_norm': 'off', 'optimizer_type': 'adam', 'optimizer_lr': 0.002299490994411161, 'batch_size': 96}. Best is trial 295 with value: 8.730305301702867.
Trial 297 finished with value: 19.543882881407203 and parameters: {'input_dropout': 0.0, 'hidden_layers': 9, 'hidden_units': 128, 'kernel_initializer': 'he_normal', 'hidden_activation': 'leaky_relu', 'hidden_dropout': 0.0, 'batch_norm': 'off', 'optimizer_type': 'adam', 'optimizer_lr': 0.0020796710184346704, 'batch_size': 96}. Best is trial 295 with value: 8.730305301702867.
Trial 298 finished with value: 19.018517166443594 and parameters: {'input_dropout': 0.0, 'hidden_layers': 9, 'hidden_units': 128, 'kernel_initializer': 'he_normal', 'hidden_activation': 'leaky_relu', 'hidden_dropout': 0.0, 'batch_norm': 'off', 'optimizer_type': 'adam', 'optimizer_lr': 0.0023728826050914416, 'batch_size': 96}. Best is trial 295 with value: 8.730305301702867.
Trial 299 finished with value: 13.71359092383386 and parameters: {'input_dropout': 0.0, 'hidden_layers': 9, 'hidden_units': 128, 'kernel_initializer': 'he_normal', 'hidden_activation': 'leaky_relu', 'hidden_dropout': 0.0, 'batch_norm': 'off', 'optimizer_type': 'adam', 'optimizer_lr': 0.0022019366960150657, 'batch_size': 96}. Best is trial 295 with value: 8.730305301702867.
Trial 300 finished with value: 21.97309269994613 and parameters: {'input_dropout': 0.0, 'hidden_layers': 9, 'hidden_units': 128, 'kernel_initializer': 'he_normal', 'hidden_activation': 'leaky_relu', 'hidden_dropout': 0.0, 'batch_norm': 'off', 'optimizer_type': 'adam', 'optimizer_lr': 0.002301767311446997, 'batch_size': 96}. Best is trial 295 with value: 8.730305301702867.
Trial 301 finished with value: 214.41035137415673 and parameters: {'input_dropout': 0.0, 'hidden_layers': 9, 'hidden_units': 128, 'kernel_initializer': 'he_normal', 'hidden_activation': 'leaky_relu', 'hidden_dropout': 0.05, 'batch_norm': 'off', 'optimizer_type': 'adam', 'optimizer_lr': 0.002188729505134615, 'batch_size': 96}. Best is trial 295 with value: 8.730305301702867.
Trial 302 finished with value: 18.26165348026778 and parameters: {'input_dropout': 0.0, 'hidden_layers': 9, 'hidden_units': 128, 'kernel_initializer': 'he_normal', 'hidden_activation': 'leaky_relu', 'hidden_dropout': 0.0, 'batch_norm': 'off', 'optimizer_type': 'adam', 'optimizer_lr': 0.0025081223201446757, 'batch_size': 96}. Best is trial 295 with value: 8.730305301702867.
Trial 303 finished with value: 14.490421202337465 and parameters: {'input_dropout': 0.0, 'hidden_layers': 10, 'hidden_units': 128, 'kernel_initializer': 'he_normal', 'hidden_activation': 'leaky_relu', 'hidden_dropout': 0.0, 'batch_norm': 'off', 'optimizer_type': 'adam', 'optimizer_lr': 0.0023986533776350094, 'batch_size': 96}. Best is trial 295 with value: 8.730305301702867.
Trial 304 finished with value: 182.77249863419934 and parameters: {'input_dropout': 0.0, 'hidden_layers': 9, 'hidden_units': 128, 'kernel_initializer': 'he_normal', 'hidden_activation': 'leaky_relu', 'hidden_dropout': 0.0, 'batch_norm': 'off', 'optimizer_type': 'rmsprop', 'optimizer_lr': 0.0025523259178802903, 'batch_size': 96}. Best is trial 295 with value: 8.730305301702867.
Trial 305 finished with value: 18.000184759511583 and parameters: {'input_dropout': 0.0, 'hidden_layers': 9, 'hidden_units': 128, 'kernel_initializer': 'he_normal', 'hidden_activation': 'leaky_relu', 'hidden_dropout': 0.0, 'batch_norm': 'off', 'optimizer_type': 'adam', 'optimizer_lr': 0.002251590989004937, 'batch_size': 96}. Best is trial 295 with value: 8.730305301702867.
Trial 306 finished with value: 13.233148140201676 and parameters: {'input_dropout': 0.0, 'hidden_layers': 9, 'hidden_units': 128, 'kernel_initializer': 'he_normal', 'hidden_activation': 'leaky_relu', 'hidden_dropout': 0.0, 'batch_norm': 'off', 'optimizer_type': 'adam', 'optimizer_lr': 0.0024141985077522398, 'batch_size': 96}. Best is trial 295 with value: 8.730305301702867.
Trial 307 finished with value: 19.18439467086392 and parameters: {'input_dropout': 0.0, 'hidden_layers': 9, 'hidden_units': 128, 'kernel_initializer': 'he_normal', 'hidden_activation': 'leaky_relu', 'hidden_dropout': 0.0, 'batch_norm': 'off', 'optimizer_type': 'adam', 'optimizer_lr': 0.0007747340488832258, 'batch_size': 96}. Best is trial 295 with value: 8.730305301702867.
Trial 308 finished with value: 17.663739573126602 and parameters: {'input_dropout': 0.0, 'hidden_layers': 9, 'hidden_units': 128, 'kernel_initializer': 'he_normal', 'hidden_activation': 'leaky_relu', 'hidden_dropout': 0.0, 'batch_norm': 'off', 'optimizer_type': 'adam', 'optimizer_lr': 0.002661659895239054, 'batch_size': 96}. Best is trial 295 with value: 8.730305301702867.
Trial 309 finished with value: 16.959393626439642 and parameters: {'input_dropout': 0.0, 'hidden_layers': 9, 'hidden_units': 128, 'kernel_initializer': 'he_normal', 'hidden_activation': 'leaky_relu', 'hidden_dropout': 0.0, 'batch_norm': 'off', 'optimizer_type': 'adam', 'optimizer_lr': 0.0025276611054356893, 'batch_size': 96}. Best is trial 295 with value: 8.730305301702867.
Trial 310 finished with value: 24.860703624462168 and parameters: {'input_dropout': 0.0, 'hidden_layers': 9, 'hidden_units': 96, 'kernel_initializer': 'he_normal', 'hidden_activation': 'leaky_relu', 'hidden_dropout': 0.0, 'batch_norm': 'on', 'optimizer_type': 'adam', 'optimizer_lr': 0.0030444443903605584, 'batch_size': 96}. Best is trial 295 with value: 8.730305301702867.
Trial 311 finished with value: 15.00616214355781 and parameters: {'input_dropout': 0.0, 'hidden_layers': 9, 'hidden_units': 128, 'kernel_initializer': 'he_normal', 'hidden_activation': 'leaky_relu', 'hidden_dropout': 0.0, 'batch_norm': 'off', 'optimizer_type': 'adam', 'optimizer_lr': 0.0017966185904955885, 'batch_size': 96}. Best is trial 295 with value: 8.730305301702867.
Trial 312 finished with value: 28.97848324179914 and parameters: {'input_dropout': 0.0, 'hidden_layers': 9, 'hidden_units': 128, 'kernel_initializer': 'he_normal', 'hidden_activation': 'leaky_relu', 'hidden_dropout': 0.0, 'batch_norm': 'off', 'optimizer_type': 'adam', 'optimizer_lr': 0.0027916061206970716, 'batch_size': 96}. Best is trial 295 with value: 8.730305301702867.
Trial 313 finished with value: 49.280239703570366 and parameters: {'input_dropout': 0.0, 'hidden_layers': 10, 'hidden_units': 128, 'kernel_initializer': 'he_normal', 'hidden_activation': 'leaky_relu', 'hidden_dropout': 0.0, 'batch_norm': 'on', 'optimizer_type': 'adam', 'optimizer_lr': 0.0031763787860443304, 'batch_size': 96}. Best is trial 295 with value: 8.730305301702867.
Trial 314 finished with value: 399.2661082579834 and parameters: {'input_dropout': 0.1, 'hidden_layers': 9, 'hidden_units': 128, 'kernel_initializer': 'he_normal', 'hidden_activation': 'leaky_relu', 'hidden_dropout': 0.1, 'batch_norm': 'off', 'optimizer_type': 'adam', 'optimizer_lr': 0.002408043039804576, 'batch_size': 96}. Best is trial 295 with value: 8.730305301702867.
Trial 315 finished with value: 179.14014161188362 and parameters: {'input_dropout': 0.0, 'hidden_layers': 9, 'hidden_units': 128, 'kernel_initializer': 'he_normal', 'hidden_activation': 'leaky_relu', 'hidden_dropout': 0.15000000000000002, 'batch_norm': 'on', 'optimizer_type': 'adam', 'optimizer_lr': 0.0026326480178985624, 'batch_size': 96}. Best is trial 295 with value: 8.730305301702867.
Trial 316 finished with value: 17.004027159038323 and parameters: {'input_dropout': 0.0, 'hidden_layers': 9, 'hidden_units': 128, 'kernel_initializer': 'he_normal', 'hidden_activation': 'leaky_relu', 'hidden_dropout': 0.0, 'batch_norm': 'off', 'optimizer_type': 'adam', 'optimizer_lr': 0.002195055957762656, 'batch_size': 96}. Best is trial 295 with value: 8.730305301702867.
Trial 317 finished with value: 31.90979357798873 and parameters: {'input_dropout': 0.05, 'hidden_layers': 9, 'hidden_units': 128, 'kernel_initializer': 'he_normal', 'hidden_activation': 'leaky_relu', 'hidden_dropout': 0.0, 'batch_norm': 'off', 'optimizer_type': 'adam', 'optimizer_lr': 0.0028882448072275165, 'batch_size': 96}. Best is trial 295 with value: 8.730305301702867.
Trial 318 finished with value: 49.08946051463117 and parameters: {'input_dropout': 0.0, 'hidden_layers': 5, 'hidden_units': 128, 'kernel_initializer': 'random_normal', 'hidden_activation': 'leaky_relu', 'hidden_dropout': 0.0, 'batch_norm': 'on', 'optimizer_type': 'adam', 'optimizer_lr': 0.003610955026044016, 'batch_size': 96}. Best is trial 295 with value: 8.730305301702867.
Trial 319 finished with value: 49.633111978545095 and parameters: {'input_dropout': 0.0, 'hidden_layers': 3, 'hidden_units': 128, 'kernel_initializer': 'he_normal', 'hidden_activation': 'leaky_relu', 'hidden_dropout': 0.0, 'batch_norm': 'off', 'optimizer_type': 'adam', 'optimizer_lr': 0.0019509983479833143, 'batch_size': 96}. Best is trial 295 with value: 8.730305301702867.
Trial 320 finished with value: 20.98767812218657 and parameters: {'input_dropout': 0.0, 'hidden_layers': 9, 'hidden_units': 96, 'kernel_initializer': 'he_normal', 'hidden_activation': 'leaky_relu', 'hidden_dropout': 0.0, 'batch_norm': 'on', 'optimizer_type': 'adam', 'optimizer_lr': 0.0024312589637998316, 'batch_size': 128}. Best is trial 295 with value: 8.730305301702867.
Trial 321 finished with value: 22.797250942911063 and parameters: {'input_dropout': 0.0, 'hidden_layers': 9, 'hidden_units': 128, 'kernel_initializer': 'he_normal', 'hidden_activation': 'leaky_relu', 'hidden_dropout': 0.0, 'batch_norm': 'off', 'optimizer_type': 'adam', 'optimizer_lr': 0.0027119770660535324, 'batch_size': 96}. Best is trial 295 with value: 8.730305301702867.
Trial 322 finished with value: 23.40441515681325 and parameters: {'input_dropout': 0.0, 'hidden_layers': 9, 'hidden_units': 128, 'kernel_initializer': 'he_normal', 'hidden_activation': 'leaky_relu', 'hidden_dropout': 0.0, 'batch_norm': 'on', 'optimizer_type': 'rmsprop', 'optimizer_lr': 0.002113772813323527, 'batch_size': 96}. Best is trial 295 with value: 8.730305301702867.
Trial 323 finished with value: 15.014151681445327 and parameters: {'input_dropout': 0.0, 'hidden_layers': 9, 'hidden_units': 192, 'kernel_initializer': 'he_normal', 'hidden_activation': 'leaky_relu', 'hidden_dropout': 0.0, 'batch_norm': 'off', 'optimizer_type': 'adam', 'optimizer_lr': 0.002519737874426228, 'batch_size': 96}. Best is trial 295 with value: 8.730305301702867.
Trial 324 finished with value: 17.534968049482373 and parameters: {'input_dropout': 0.0, 'hidden_layers': 9, 'hidden_units': 128, 'kernel_initializer': 'he_normal', 'hidden_activation': 'leaky_relu', 'hidden_dropout': 0.0, 'batch_norm': 'off', 'optimizer_type': 'adam', 'optimizer_lr': 0.0029557570912867826, 'batch_size': 96}. Best is trial 295 with value: 8.730305301702867.
Trial 325 finished with value: 134.36202087822613 and parameters: {'input_dropout': 0.0, 'hidden_layers': 9, 'hidden_units': 128, 'kernel_initializer': 'he_normal', 'hidden_activation': 'leaky_relu', 'hidden_dropout': 0.05, 'batch_norm': 'on', 'optimizer_type': 'adam', 'optimizer_lr': 0.0023540271333061333, 'batch_size': 96}. Best is trial 295 with value: 8.730305301702867.
Trial 326 finished with value: 20.638091047402703 and parameters: {'input_dropout': 0.0, 'hidden_layers': 9, 'hidden_units': 128, 'kernel_initializer': 'he_normal', 'hidden_activation': 'leaky_relu', 'hidden_dropout': 0.0, 'batch_norm': 'off', 'optimizer_type': 'adam', 'optimizer_lr': 0.0027161432748796974, 'batch_size': 96}. Best is trial 295 with value: 8.730305301702867.
Trial 327 finished with value: 118.5112006855396 and parameters: {'input_dropout': 0.15000000000000002, 'hidden_layers': 9, 'hidden_units': 128, 'kernel_initializer': 'he_normal', 'hidden_activation': 'leaky_relu', 'hidden_dropout': 0.0, 'batch_norm': 'on', 'optimizer_type': 'adam', 'optimizer_lr': 0.003200779697927138, 'batch_size': 96}. Best is trial 295 with value: 8.730305301702867.
Trial 328 finished with value: 23.33611938751908 and parameters: {'input_dropout': 0.0, 'hidden_layers': 9, 'hidden_units': 128, 'kernel_initializer': 'he_normal', 'hidden_activation': 'leaky_relu', 'hidden_dropout': 0.0, 'batch_norm': 'off', 'optimizer_type': 'adam', 'optimizer_lr': 0.002532457193587525, 'batch_size': 96}. Best is trial 295 with value: 8.730305301702867.
Trial 329 finished with value: 19.58366170263042 and parameters: {'input_dropout': 0.0, 'hidden_layers': 9, 'hidden_units': 160, 'kernel_initializer': 'he_normal', 'hidden_activation': 'leaky_relu', 'hidden_dropout': 0.0, 'batch_norm': 'on', 'optimizer_type': 'adam', 'optimizer_lr': 0.0016151474916552228, 'batch_size': 96}. Best is trial 295 with value: 8.730305301702867.
Trial 330 finished with value: 18.931629685462728 and parameters: {'input_dropout': 0.0, 'hidden_layers': 9, 'hidden_units': 128, 'kernel_initializer': 'he_normal', 'hidden_activation': 'leaky_relu', 'hidden_dropout': 0.0, 'batch_norm': 'off', 'optimizer_type': 'adam', 'optimizer_lr': 0.002033626138543172, 'batch_size': 96}. Best is trial 295 with value: 8.730305301702867.
Trial 331 finished with value: 9.725614472120926 and parameters: {'input_dropout': 0.0, 'hidden_layers': 9, 'hidden_units': 160, 'kernel_initializer': 'he_normal', 'hidden_activation': 'leaky_relu', 'hidden_dropout': 0.0, 'batch_norm': 'off', 'optimizer_type': 'adam', 'optimizer_lr': 0.0014681778227851822, 'batch_size': 96}. Best is trial 295 with value: 8.730305301702867.
Trial 332 finished with value: 19.561066507640916 and parameters: {'input_dropout': 0.0, 'hidden_layers': 9, 'hidden_units': 128, 'kernel_initializer': 'he_normal', 'hidden_activation': 'leaky_relu', 'hidden_dropout': 0.0, 'batch_norm': 'off', 'optimizer_type': 'adam', 'optimizer_lr': 0.0011877544666725843, 'batch_size': 96}. Best is trial 295 with value: 8.730305301702867.
Trial 333 finished with value: 17.11272082998604 and parameters: {'input_dropout': 0.0, 'hidden_layers': 9, 'hidden_units': 160, 'kernel_initializer': 'he_normal', 'hidden_activation': 'leaky_relu', 'hidden_dropout': 0.0, 'batch_norm': 'off', 'optimizer_type': 'adam', 'optimizer_lr': 0.0013664522276718126, 'batch_size': 96}. Best is trial 295 with value: 8.730305301702867.
Trial 334 finished with value: 16.64693589267374 and parameters: {'input_dropout': 0.0, 'hidden_layers': 9, 'hidden_units': 160, 'kernel_initializer': 'he_normal', 'hidden_activation': 'leaky_relu', 'hidden_dropout': 0.0, 'batch_norm': 'off', 'optimizer_type': 'adam', 'optimizer_lr': 0.0028054005898333623, 'batch_size': 96}. Best is trial 295 with value: 8.730305301702867.
Trial 335 finished with value: 11.567749573819054 and parameters: {'input_dropout': 0.0, 'hidden_layers': 8, 'hidden_units': 128, 'kernel_initializer': 'he_normal', 'hidden_activation': 'leaky_relu', 'hidden_dropout': 0.0, 'batch_norm': 'off', 'optimizer_type': 'adam', 'optimizer_lr': 0.00150001327487515, 'batch_size': 96}. Best is trial 295 with value: 8.730305301702867.
Trial 336 finished with value: 16.659792861265387 and parameters: {'input_dropout': 0.0, 'hidden_layers': 10, 'hidden_units': 128, 'kernel_initializer': 'he_normal', 'hidden_activation': 'leaky_relu', 'hidden_dropout': 0.0, 'batch_norm': 'off', 'optimizer_type': 'adam', 'optimizer_lr': 0.003331528140163731, 'batch_size': 96}. Best is trial 295 with value: 8.730305301702867.
Trial 337 finished with value: 17.930251690079956 and parameters: {'input_dropout': 0.0, 'hidden_layers': 9, 'hidden_units': 128, 'kernel_initializer': 'he_normal', 'hidden_activation': 'leaky_relu', 'hidden_dropout': 0.0, 'batch_norm': 'off', 'optimizer_type': 'adam', 'optimizer_lr': 0.0011845705101139615, 'batch_size': 96}. Best is trial 295 with value: 8.730305301702867.
Trial 338 finished with value: 14.632907654390284 and parameters: {'input_dropout': 0.0, 'hidden_layers': 9, 'hidden_units': 128, 'kernel_initializer': 'he_normal', 'hidden_activation': 'leaky_relu', 'hidden_dropout': 0.0, 'batch_norm': 'off', 'optimizer_type': 'adam', 'optimizer_lr': 0.0013992723631500257, 'batch_size': 96}. Best is trial 295 with value: 8.730305301702867.
Trial 339 finished with value: 67.62625841295305 and parameters: {'input_dropout': 0.0, 'hidden_layers': 9, 'hidden_units': 128, 'kernel_initializer': 'random_normal', 'hidden_activation': 'leaky_relu', 'hidden_dropout': 0.0, 'batch_norm': 'off', 'optimizer_type': 'adam', 'optimizer_lr': 0.0037572419969343416, 'batch_size': 96}. Best is trial 295 with value: 8.730305301702867.
Trial 340 finished with value: 16.171283895600666 and parameters: {'input_dropout': 0.0, 'hidden_layers': 9, 'hidden_units': 160, 'kernel_initializer': 'he_normal', 'hidden_activation': 'leaky_relu', 'hidden_dropout': 0.0, 'batch_norm': 'off', 'optimizer_type': 'adam', 'optimizer_lr': 0.0034090301609938493, 'batch_size': 96}. Best is trial 295 with value: 8.730305301702867.
Trial 341 finished with value: 20.152685578990965 and parameters: {'input_dropout': 0.0, 'hidden_layers': 8, 'hidden_units': 160, 'kernel_initializer': 'he_normal', 'hidden_activation': 'leaky_relu', 'hidden_dropout': 0.0, 'batch_norm': 'off', 'optimizer_type': 'adam', 'optimizer_lr': 0.0012884168307045407, 'batch_size': 96}. Best is trial 295 with value: 8.730305301702867.
Trial 342 finished with value: 207.460141466324 and parameters: {'input_dropout': 0.0, 'hidden_layers': 9, 'hidden_units': 128, 'kernel_initializer': 'he_normal', 'hidden_activation': 'leaky_relu', 'hidden_dropout': 0.0, 'batch_norm': 'off', 'optimizer_type': 'rmsprop', 'optimizer_lr': 0.0014065436839811123, 'batch_size': 96}. Best is trial 295 with value: 8.730305301702867.
Trial 343 finished with value: 13.885640093518061 and parameters: {'input_dropout': 0.0, 'hidden_layers': 9, 'hidden_units': 160, 'kernel_initializer': 'he_normal', 'hidden_activation': 'leaky_relu', 'hidden_dropout': 0.0, 'batch_norm': 'off', 'optimizer_type': 'adam', 'optimizer_lr': 0.001290882952161806, 'batch_size': 96}. Best is trial 295 with value: 8.730305301702867.
Trial 344 finished with value: 218.83172246859 and parameters: {'input_dropout': 0.2, 'hidden_layers': 9, 'hidden_units': 160, 'kernel_initializer': 'he_normal', 'hidden_activation': 'leaky_relu', 'hidden_dropout': 0.0, 'batch_norm': 'off', 'optimizer_type': 'adam', 'optimizer_lr': 0.0012532542421675695, 'batch_size': 96}. Best is trial 295 with value: 8.730305301702867.
Trial 345 finished with value: 2409.79133318175 and parameters: {'input_dropout': 0.0, 'hidden_layers': 9, 'hidden_units': 160, 'kernel_initializer': 'he_normal', 'hidden_activation': 'leaky_relu', 'hidden_dropout': 0.25, 'batch_norm': 'off', 'optimizer_type': 'adam', 'optimizer_lr': 0.001507846498954748, 'batch_size': 96}. Best is trial 295 with value: 8.730305301702867.
Trial 346 finished with value: 14.229232847986506 and parameters: {'input_dropout': 0.0, 'hidden_layers': 9, 'hidden_units': 160, 'kernel_initializer': 'he_normal', 'hidden_activation': 'leaky_relu', 'hidden_dropout': 0.0, 'batch_norm': 'off', 'optimizer_type': 'adam', 'optimizer_lr': 0.0014632377068505562, 'batch_size': 96}. Best is trial 295 with value: 8.730305301702867.
Trial 347 finished with value: 20.65931643581569 and parameters: {'input_dropout': 0.0, 'hidden_layers': 7, 'hidden_units': 160, 'kernel_initializer': 'he_normal', 'hidden_activation': 'leaky_relu', 'hidden_dropout': 0.0, 'batch_norm': 'off', 'optimizer_type': 'adam', 'optimizer_lr': 0.0013133937216562386, 'batch_size': 96}. Best is trial 295 with value: 8.730305301702867.
Trial 348 finished with value: 13.258152231084184 and parameters: {'input_dropout': 0.0, 'hidden_layers': 9, 'hidden_units': 160, 'kernel_initializer': 'he_normal', 'hidden_activation': 'leaky_relu', 'hidden_dropout': 0.0, 'batch_norm': 'off', 'optimizer_type': 'adam', 'optimizer_lr': 0.0013078172170371968, 'batch_size': 96}. Best is trial 295 with value: 8.730305301702867.
