Trial 175 finished with value: 25.15558458011042 and parameters: {'input_dropout': 0.0, 'hidden_layers': 9, 'hidden_units': 128, 'kernel_initializer': 'he_normal', 'hidden_activation': 'leaky_relu', 'hidden_dropout': 0.0, 'batch_norm': 'off', 'optimizer_type': 'adam', 'optimizer_lr': 0.0022405807201650585, 'batch_size': 96}. Best is trial 171 with value: 10.681659473072962.
Trial 176 finished with value: 24.40475253405444 and parameters: {'input_dropout': 0.0, 'hidden_layers': 9, 'hidden_units': 128, 'kernel_initializer': 'he_normal', 'hidden_activation': 'leaky_relu', 'hidden_dropout': 0.0, 'batch_norm': 'off', 'optimizer_type': 'adam', 'optimizer_lr': 0.0029466490311371852, 'batch_size': 96}. Best is trial 171 with value: 10.681659473072962.
Trial 177 finished with value: 14.068089657050177 and parameters: {'input_dropout': 0.0, 'hidden_layers': 9, 'hidden_units': 160, 'kernel_initializer': 'he_normal', 'hidden_activation': 'leaky_relu', 'hidden_dropout': 0.0, 'batch_norm': 'on', 'optimizer_type': 'adam', 'optimizer_lr': 0.0018724805675795085, 'batch_size': 96}. Best is trial 171 with value: 10.681659473072962.
Trial 178 finished with value: 32.910647645601536 and parameters: {'input_dropout': 0.0, 'hidden_layers': 3, 'hidden_units': 160, 'kernel_initializer': 'he_normal', 'hidden_activation': 'leaky_relu', 'hidden_dropout': 0.0, 'batch_norm': 'on', 'optimizer_type': 'adam', 'optimizer_lr': 0.0017379389703173246, 'batch_size': 96}. Best is trial 171 with value: 10.681659473072962.
Trial 179 finished with value: 14.790728964935337 and parameters: {'input_dropout': 0.0, 'hidden_layers': 9, 'hidden_units': 160, 'kernel_initializer': 'he_normal', 'hidden_activation': 'leaky_relu', 'hidden_dropout': 0.0, 'batch_norm': 'on', 'optimizer_type': 'adam', 'optimizer_lr': 0.0027873607255600834, 'batch_size': 96}. Best is trial 171 with value: 10.681659473072962.
Trial 180 finished with value: 15.502799580415552 and parameters: {'input_dropout': 0.0, 'hidden_layers': 9, 'hidden_units': 160, 'kernel_initializer': 'he_normal', 'hidden_activation': 'leaky_relu', 'hidden_dropout': 0.0, 'batch_norm': 'on', 'optimizer_type': 'adam', 'optimizer_lr': 0.003216650230429559, 'batch_size': 96}. Best is trial 171 with value: 10.681659473072962.
Trial 181 finished with value: 27.833937760988377 and parameters: {'input_dropout': 0.0, 'hidden_layers': 9, 'hidden_units': 160, 'kernel_initializer': 'he_normal', 'hidden_activation': 'leaky_relu', 'hidden_dropout': 0.0, 'batch_norm': 'on', 'optimizer_type': 'adam', 'optimizer_lr': 0.0018923466899424947, 'batch_size': 96}. Best is trial 171 with value: 10.681659473072962.
Trial 182 finished with value: 12.221229418706614 and parameters: {'input_dropout': 0.0, 'hidden_layers': 9, 'hidden_units': 160, 'kernel_initializer': 'he_normal', 'hidden_activation': 'leaky_relu', 'hidden_dropout': 0.0, 'batch_norm': 'on', 'optimizer_type': 'adam', 'optimizer_lr': 0.0027755839705362233, 'batch_size': 96}. Best is trial 171 with value: 10.681659473072962.
Trial 183 finished with value: 20.52000215400634 and parameters: {'input_dropout': 0.0, 'hidden_layers': 9, 'hidden_units': 160, 'kernel_initializer': 'he_normal', 'hidden_activation': 'leaky_relu', 'hidden_dropout': 0.0, 'batch_norm': 'on', 'optimizer_type': 'adam', 'optimizer_lr': 0.0035704336580210695, 'batch_size': 96}. Best is trial 171 with value: 10.681659473072962.
Trial 184 finished with value: 99.14301002181624 and parameters: {'input_dropout': 0.0, 'hidden_layers': 9, 'hidden_units': 160, 'kernel_initializer': 'he_normal', 'hidden_activation': 'leaky_relu', 'hidden_dropout': 0.1, 'batch_norm': 'on', 'optimizer_type': 'adam', 'optimizer_lr': 0.0028352342848885553, 'batch_size': 96}. Best is trial 171 with value: 10.681659473072962.
Trial 185 finished with value: 17.93741593973849 and parameters: {'input_dropout': 0.0, 'hidden_layers': 9, 'hidden_units': 160, 'kernel_initializer': 'he_normal', 'hidden_activation': 'leaky_relu', 'hidden_dropout': 0.0, 'batch_norm': 'on', 'optimizer_type': 'adam', 'optimizer_lr': 0.0026994341323718384, 'batch_size': 96}. Best is trial 171 with value: 10.681659473072962.
Trial 186 finished with value: 146.91101205587432 and parameters: {'input_dropout': 0.0, 'hidden_layers': 9, 'hidden_units': 160, 'kernel_initializer': 'he_uniform', 'hidden_activation': 'leaky_relu', 'hidden_dropout': 0.15000000000000002, 'batch_norm': 'on', 'optimizer_type': 'adam', 'optimizer_lr': 0.003051209309189446, 'batch_size': 96}. Best is trial 171 with value: 10.681659473072962.
Trial 187 finished with value: 13.05929581781864 and parameters: {'input_dropout': 0.0, 'hidden_layers': 9, 'hidden_units': 160, 'kernel_initializer': 'he_normal', 'hidden_activation': 'leaky_relu', 'hidden_dropout': 0.0, 'batch_norm': 'on', 'optimizer_type': 'adam', 'optimizer_lr': 0.0025983194235169186, 'batch_size': 96}. Best is trial 171 with value: 10.681659473072962.
Trial 188 finished with value: 11.758736379890838 and parameters: {'input_dropout': 0.0, 'hidden_layers': 9, 'hidden_units': 160, 'kernel_initializer': 'he_normal', 'hidden_activation': 'leaky_relu', 'hidden_dropout': 0.0, 'batch_norm': 'on', 'optimizer_type': 'adam', 'optimizer_lr': 0.002601951776545245, 'batch_size': 96}. Best is trial 171 with value: 10.681659473072962.
Trial 189 finished with value: 13.953810444459087 and parameters: {'input_dropout': 0.0, 'hidden_layers': 9, 'hidden_units': 160, 'kernel_initializer': 'he_normal', 'hidden_activation': 'leaky_relu', 'hidden_dropout': 0.0, 'batch_norm': 'on', 'optimizer_type': 'adam', 'optimizer_lr': 0.002594240383935853, 'batch_size': 96}. Best is trial 171 with value: 10.681659473072962.
Trial 190 finished with value: 26.90681968245899 and parameters: {'input_dropout': 0.0, 'hidden_layers': 9, 'hidden_units': 160, 'kernel_initializer': 'he_normal', 'hidden_activation': 'leaky_relu', 'hidden_dropout': 0.0, 'batch_norm': 'on', 'optimizer_type': 'adam', 'optimizer_lr': 0.0025937524823877157, 'batch_size': 96}. Best is trial 171 with value: 10.681659473072962.
Trial 191 finished with value: 20.32086598976446 and parameters: {'input_dropout': 0.0, 'hidden_layers': 9, 'hidden_units': 160, 'kernel_initializer': 'he_normal', 'hidden_activation': 'leaky_relu', 'hidden_dropout': 0.0, 'batch_norm': 'on', 'optimizer_type': 'adam', 'optimizer_lr': 0.0028553056568056986, 'batch_size': 96}. Best is trial 171 with value: 10.681659473072962.
Trial 192 finished with value: 14.487555879902413 and parameters: {'input_dropout': 0.0, 'hidden_layers': 9, 'hidden_units': 160, 'kernel_initializer': 'he_normal', 'hidden_activation': 'leaky_relu', 'hidden_dropout': 0.0, 'batch_norm': 'on', 'optimizer_type': 'adam', 'optimizer_lr': 0.002466209814477512, 'batch_size': 96}. Best is trial 171 with value: 10.681659473072962.
Trial 193 finished with value: 103.5962272630693 and parameters: {'input_dropout': 0.15000000000000002, 'hidden_layers': 9, 'hidden_units': 160, 'kernel_initializer': 'he_normal', 'hidden_activation': 'leaky_relu', 'hidden_dropout': 0.0, 'batch_norm': 'on', 'optimizer_type': 'adam', 'optimizer_lr': 0.0025052602237015903, 'batch_size': 96}. Best is trial 171 with value: 10.681659473072962.
Trial 194 finished with value: 32.175306295946235 and parameters: {'input_dropout': 0.0, 'hidden_layers': 9, 'hidden_units': 160, 'kernel_initializer': 'he_normal', 'hidden_activation': 'leaky_relu', 'hidden_dropout': 0.0, 'batch_norm': 'on', 'optimizer_type': 'adam', 'optimizer_lr': 0.002640679755660671, 'batch_size': 96}. Best is trial 171 with value: 10.681659473072962.
Trial 195 finished with value: 28.867507597508247 and parameters: {'input_dropout': 0.0, 'hidden_layers': 9, 'hidden_units': 160, 'kernel_initializer': 'he_normal', 'hidden_activation': 'leaky_relu', 'hidden_dropout': 0.0, 'batch_norm': 'on', 'optimizer_type': 'adam', 'optimizer_lr': 0.0024575003087713575, 'batch_size': 96}. Best is trial 171 with value: 10.681659473072962.
Trial 196 finished with value: 16.96281515648216 and parameters: {'input_dropout': 0.0, 'hidden_layers': 9, 'hidden_units': 160, 'kernel_initializer': 'he_normal', 'hidden_activation': 'leaky_relu', 'hidden_dropout': 0.0, 'batch_norm': 'on', 'optimizer_type': 'adam', 'optimizer_lr': 0.0027752435673431683, 'batch_size': 96}. Best is trial 171 with value: 10.681659473072962.
Trial 197 finished with value: 41.43607503465594 and parameters: {'input_dropout': 0.0, 'hidden_layers': 9, 'hidden_units': 160, 'kernel_initializer': 'random_normal', 'hidden_activation': 'leaky_relu', 'hidden_dropout': 0.0, 'batch_norm': 'on', 'optimizer_type': 'adam', 'optimizer_lr': 0.0029607536903613466, 'batch_size': 96}. Best is trial 171 with value: 10.681659473072962.
Trial 198 finished with value: 15.839666780048487 and parameters: {'input_dropout': 0.0, 'hidden_layers': 9, 'hidden_units': 160, 'kernel_initializer': 'he_normal', 'hidden_activation': 'leaky_relu', 'hidden_dropout': 0.0, 'batch_norm': 'on', 'optimizer_type': 'adam', 'optimizer_lr': 0.0026721945512572843, 'batch_size': 96}. Best is trial 171 with value: 10.681659473072962.
Trial 199 finished with value: 113.92288909598795 and parameters: {'input_dropout': 0.2, 'hidden_layers': 9, 'hidden_units': 160, 'kernel_initializer': 'he_normal', 'hidden_activation': 'leaky_relu', 'hidden_dropout': 0.0, 'batch_norm': 'on', 'optimizer_type': 'adam', 'optimizer_lr': 0.002467189314883413, 'batch_size': 96}. Best is trial 171 with value: 10.681659473072962.
Trial 200 finished with value: 16.75652533392824 and parameters: {'input_dropout': 0.0, 'hidden_layers': 9, 'hidden_units': 160, 'kernel_initializer': 'he_normal', 'hidden_activation': 'leaky_relu', 'hidden_dropout': 0.0, 'batch_norm': 'on', 'optimizer_type': 'adam', 'optimizer_lr': 0.0030902821324761643, 'batch_size': 96}. Best is trial 171 with value: 10.681659473072962.
Trial 201 finished with value: 15.604727499151357 and parameters: {'input_dropout': 0.0, 'hidden_layers': 9, 'hidden_units': 160, 'kernel_initializer': 'he_normal', 'hidden_activation': 'leaky_relu', 'hidden_dropout': 0.0, 'batch_norm': 'on', 'optimizer_type': 'adam', 'optimizer_lr': 0.0023936726192981457, 'batch_size': 96}. Best is trial 171 with value: 10.681659473072962.
Trial 202 finished with value: 19.194966847656687 and parameters: {'input_dropout': 0.0, 'hidden_layers': 9, 'hidden_units': 128, 'kernel_initializer': 'he_normal', 'hidden_activation': 'leaky_relu', 'hidden_dropout': 0.0, 'batch_norm': 'on', 'optimizer_type': 'adam', 'optimizer_lr': 0.002135144186489973, 'batch_size': 96}. Best is trial 171 with value: 10.681659473072962.
Trial 203 finished with value: 16.752283809046332 and parameters: {'input_dropout': 0.0, 'hidden_layers': 9, 'hidden_units': 160, 'kernel_initializer': 'he_normal', 'hidden_activation': 'leaky_relu', 'hidden_dropout': 0.0, 'batch_norm': 'on', 'optimizer_type': 'adam', 'optimizer_lr': 0.002765120456965483, 'batch_size': 96}. Best is trial 171 with value: 10.681659473072962.
Trial 204 finished with value: 16.49830589993477 and parameters: {'input_dropout': 0.0, 'hidden_layers': 9, 'hidden_units': 128, 'kernel_initializer': 'he_normal', 'hidden_activation': 'leaky_relu', 'hidden_dropout': 0.0, 'batch_norm': 'on', 'optimizer_type': 'adam', 'optimizer_lr': 0.0025745954044983956, 'batch_size': 96}. Best is trial 171 with value: 10.681659473072962.
Trial 205 finished with value: 13.935368339039282 and parameters: {'input_dropout': 0.0, 'hidden_layers': 9, 'hidden_units': 128, 'kernel_initializer': 'he_normal', 'hidden_activation': 'leaky_relu', 'hidden_dropout': 0.0, 'batch_norm': 'on', 'optimizer_type': 'adam', 'optimizer_lr': 0.0023387914554080804, 'batch_size': 96}. Best is trial 171 with value: 10.681659473072962.
Trial 206 finished with value: 29.03903660474796 and parameters: {'input_dropout': 0.0, 'hidden_layers': 9, 'hidden_units': 160, 'kernel_initializer': 'he_normal', 'hidden_activation': 'leaky_relu', 'hidden_dropout': 0.0, 'batch_norm': 'on', 'optimizer_type': 'rmsprop', 'optimizer_lr': 0.002004031027417163, 'batch_size': 96}. Best is trial 171 with value: 10.681659473072962.
Trial 207 finished with value: 16.974918647688117 and parameters: {'input_dropout': 0.0, 'hidden_layers': 9, 'hidden_units': 128, 'kernel_initializer': 'he_normal', 'hidden_activation': 'leaky_relu', 'hidden_dropout': 0.0, 'batch_norm': 'on', 'optimizer_type': 'adam', 'optimizer_lr': 0.002599678587779744, 'batch_size': 96}. Best is trial 171 with value: 10.681659473072962.
Trial 208 finished with value: 60.13735001826103 and parameters: {'input_dropout': 0.0, 'hidden_layers': 9, 'hidden_units': 160, 'kernel_initializer': 'he_normal', 'hidden_activation': 'leaky_relu', 'hidden_dropout': 0.0, 'batch_norm': 'on', 'optimizer_type': 'adam', 'optimizer_lr': 0.0029322774213475984, 'batch_size': 96}. Best is trial 171 with value: 10.681659473072962.
Trial 209 finished with value: 27.83837018788334 and parameters: {'input_dropout': 0.0, 'hidden_layers': 9, 'hidden_units': 128, 'kernel_initializer': 'he_normal', 'hidden_activation': 'leaky_relu', 'hidden_dropout': 0.0, 'batch_norm': 'on', 'optimizer_type': 'adam', 'optimizer_lr': 0.0032848267808040913, 'batch_size': 96}. Best is trial 171 with value: 10.681659473072962.
Trial 210 finished with value: 16.798261920173726 and parameters: {'input_dropout': 0.0, 'hidden_layers': 9, 'hidden_units': 128, 'kernel_initializer': 'he_normal', 'hidden_activation': 'relu', 'hidden_dropout': 0.0, 'batch_norm': 'on', 'optimizer_type': 'adam', 'optimizer_lr': 0.002277099462119961, 'batch_size': 96}. Best is trial 171 with value: 10.681659473072962.
Trial 211 finished with value: 23.087416511218873 and parameters: {'input_dropout': 0.0, 'hidden_layers': 9, 'hidden_units': 128, 'kernel_initializer': 'he_normal', 'hidden_activation': 'leaky_relu', 'hidden_dropout': 0.0, 'batch_norm': 'on', 'optimizer_type': 'adam', 'optimizer_lr': 0.0024070610042951405, 'batch_size': 96}. Best is trial 171 with value: 10.681659473072962.
Trial 212 finished with value: 22.053021502051255 and parameters: {'input_dropout': 0.0, 'hidden_layers': 9, 'hidden_units': 128, 'kernel_initializer': 'he_normal', 'hidden_activation': 'leaky_relu', 'hidden_dropout': 0.0, 'batch_norm': 'on', 'optimizer_type': 'adam', 'optimizer_lr': 0.0027490655478359482, 'batch_size': 96}. Best is trial 171 with value: 10.681659473072962.
Trial 213 finished with value: 26.805481172112724 and parameters: {'input_dropout': 0.0, 'hidden_layers': 9, 'hidden_units': 128, 'kernel_initializer': 'he_normal', 'hidden_activation': 'leaky_relu', 'hidden_dropout': 0.0, 'batch_norm': 'on', 'optimizer_type': 'adam', 'optimizer_lr': 0.002382555164965823, 'batch_size': 96}. Best is trial 171 with value: 10.681659473072962.
Trial 214 finished with value: 18.51441230660216 and parameters: {'input_dropout': 0.0, 'hidden_layers': 9, 'hidden_units': 128, 'kernel_initializer': 'he_normal', 'hidden_activation': 'leaky_relu', 'hidden_dropout': 0.0, 'batch_norm': 'on', 'optimizer_type': 'adam', 'optimizer_lr': 0.0022084482691608555, 'batch_size': 96}. Best is trial 171 with value: 10.681659473072962.
Trial 215 finished with value: 12.970247686251792 and parameters: {'input_dropout': 0.0, 'hidden_layers': 9, 'hidden_units': 160, 'kernel_initializer': 'he_normal', 'hidden_activation': 'leaky_relu', 'hidden_dropout': 0.0, 'batch_norm': 'off', 'optimizer_type': 'adam', 'optimizer_lr': 0.0025399831571039444, 'batch_size': 96}. Best is trial 171 with value: 10.681659473072962.
Trial 216 finished with value: 14.841800190252055 and parameters: {'input_dropout': 0.0, 'hidden_layers': 9, 'hidden_units': 160, 'kernel_initializer': 'he_normal', 'hidden_activation': 'leaky_relu', 'hidden_dropout': 0.0, 'batch_norm': 'off', 'optimizer_type': 'adam', 'optimizer_lr': 0.002587275352846257, 'batch_size': 96}. Best is trial 171 with value: 10.681659473072962.
Trial 217 finished with value: 25.309763693050492 and parameters: {'input_dropout': 0.0, 'hidden_layers': 9, 'hidden_units': 160, 'kernel_initializer': 'he_normal', 'hidden_activation': 'leaky_relu', 'hidden_dropout': 0.0, 'batch_norm': 'on', 'optimizer_type': 'adam', 'optimizer_lr': 0.002854700838424552, 'batch_size': 96}. Best is trial 171 with value: 10.681659473072962.
Trial 218 finished with value: 25.592334909586175 and parameters: {'input_dropout': 0.0, 'hidden_layers': 9, 'hidden_units': 160, 'kernel_initializer': 'he_normal', 'hidden_activation': 'leaky_relu', 'hidden_dropout': 0.0, 'batch_norm': 'off', 'optimizer_type': 'adam', 'optimizer_lr': 0.002482632406873063, 'batch_size': 96}. Best is trial 171 with value: 10.681659473072962.
Trial 219 finished with value: 13.577874359098344 and parameters: {'input_dropout': 0.0, 'hidden_layers': 9, 'hidden_units': 160, 'kernel_initializer': 'he_normal', 'hidden_activation': 'relu', 'hidden_dropout': 0.0, 'batch_norm': 'off', 'optimizer_type': 'adam', 'optimizer_lr': 0.0027017973244292245, 'batch_size': 96}. Best is trial 171 with value: 10.681659473072962.
Trial 220 finished with value: 13.81486980728217 and parameters: {'input_dropout': 0.0, 'hidden_layers': 9, 'hidden_units': 160, 'kernel_initializer': 'he_normal', 'hidden_activation': 'relu', 'hidden_dropout': 0.0, 'batch_norm': 'on', 'optimizer_type': 'adam', 'optimizer_lr': 0.003057794201124539, 'batch_size': 96}. Best is trial 171 with value: 10.681659473072962.
Trial 221 finished with value: 20.419240355930896 and parameters: {'input_dropout': 0.0, 'hidden_layers': 9, 'hidden_units': 160, 'kernel_initializer': 'he_normal', 'hidden_activation': 'relu', 'hidden_dropout': 0.0, 'batch_norm': 'on', 'optimizer_type': 'adam', 'optimizer_lr': 0.0030737891778110592, 'batch_size': 96}. Best is trial 171 with value: 10.681659473072962.
Trial 222 finished with value: 26.46508829569753 and parameters: {'input_dropout': 0.0, 'hidden_layers': 5, 'hidden_units': 160, 'kernel_initializer': 'he_normal', 'hidden_activation': 'relu', 'hidden_dropout': 0.0, 'batch_norm': 'on', 'optimizer_type': 'adam', 'optimizer_lr': 0.0027244315527270068, 'batch_size': 96}. Best is trial 171 with value: 10.681659473072962.
Trial 223 finished with value: 13.65891340179149 and parameters: {'input_dropout': 0.0, 'hidden_layers': 9, 'hidden_units': 160, 'kernel_initializer': 'he_normal', 'hidden_activation': 'relu', 'hidden_dropout': 0.0, 'batch_norm': 'on', 'optimizer_type': 'adam', 'optimizer_lr': 0.002981434221622272, 'batch_size': 96}. Best is trial 171 with value: 10.681659473072962.
Trial 224 finished with value: 38.92867888742498 and parameters: {'input_dropout': 0.0, 'hidden_layers': 9, 'hidden_units': 160, 'kernel_initializer': 'he_normal', 'hidden_activation': 'relu', 'hidden_dropout': 0.0, 'batch_norm': 'on', 'optimizer_type': 'adam', 'optimizer_lr': 0.0032014568155997536, 'batch_size': 96}. Best is trial 171 with value: 10.681659473072962.
Trial 225 finished with value: 13.242632410832844 and parameters: {'input_dropout': 0.0, 'hidden_layers': 9, 'hidden_units': 160, 'kernel_initializer': 'he_uniform', 'hidden_activation': 'relu', 'hidden_dropout': 0.0, 'batch_norm': 'on', 'optimizer_type': 'adam', 'optimizer_lr': 0.0029382159319794213, 'batch_size': 96}. Best is trial 171 with value: 10.681659473072962.
Trial 226 finished with value: 97.82689663325549 and parameters: {'input_dropout': 0.0, 'hidden_layers': 9, 'hidden_units': 160, 'kernel_initializer': 'he_uniform', 'hidden_activation': 'relu', 'hidden_dropout': 0.0, 'batch_norm': 'on', 'optimizer_type': 'adam', 'optimizer_lr': 0.00297008297702762, 'batch_size': 96}. Best is trial 171 with value: 10.681659473072962.
Trial 227 finished with value: 28.73630570249974 and parameters: {'input_dropout': 0.0, 'hidden_layers': 9, 'hidden_units': 160, 'kernel_initializer': 'he_uniform', 'hidden_activation': 'relu', 'hidden_dropout': 0.0, 'batch_norm': 'on', 'optimizer_type': 'adam', 'optimizer_lr': 0.0033345345803109084, 'batch_size': 96}. Best is trial 171 with value: 10.681659473072962.
Trial 228 finished with value: 18.815280182319803 and parameters: {'input_dropout': 0.0, 'hidden_layers': 9, 'hidden_units': 160, 'kernel_initializer': 'he_uniform', 'hidden_activation': 'relu', 'hidden_dropout': 0.0, 'batch_norm': 'on', 'optimizer_type': 'adam', 'optimizer_lr': 0.0030314942694541864, 'batch_size': 96}. Best is trial 171 with value: 10.681659473072962.
Trial 229 finished with value: 50.94856796658408 and parameters: {'input_dropout': 0.0, 'hidden_layers': 9, 'hidden_units': 160, 'kernel_initializer': 'he_uniform', 'hidden_activation': 'relu', 'hidden_dropout': 0.0, 'batch_norm': 'on', 'optimizer_type': 'adam', 'optimizer_lr': 0.0025986658514795167, 'batch_size': 96}. Best is trial 171 with value: 10.681659473072962.
Trial 230 finished with value: 25.72859545250612 and parameters: {'input_dropout': 0.0, 'hidden_layers': 9, 'hidden_units': 160, 'kernel_initializer': 'he_uniform', 'hidden_activation': 'relu', 'hidden_dropout': 0.0, 'batch_norm': 'on', 'optimizer_type': 'adam', 'optimizer_lr': 0.002944950679537037, 'batch_size': 96}. Best is trial 171 with value: 10.681659473072962.
Trial 231 finished with value: 14.167025198142609 and parameters: {'input_dropout': 0.0, 'hidden_layers': 9, 'hidden_units': 160, 'kernel_initializer': 'he_normal', 'hidden_activation': 'relu', 'hidden_dropout': 0.0, 'batch_norm': 'on', 'optimizer_type': 'adam', 'optimizer_lr': 0.002756571903245835, 'batch_size': 96}. Best is trial 171 with value: 10.681659473072962.
Trial 232 finished with value: 25.987204361737597 and parameters: {'input_dropout': 0.0, 'hidden_layers': 9, 'hidden_units': 160, 'kernel_initializer': 'he_normal', 'hidden_activation': 'relu', 'hidden_dropout': 0.0, 'batch_norm': 'on', 'optimizer_type': 'adam', 'optimizer_lr': 0.0027064145226969676, 'batch_size': 96}. Best is trial 171 with value: 10.681659473072962.
