Trial 233 finished with value: 32.783787280330706 and parameters: {'input_dropout': 0.0, 'hidden_layers': 9, 'hidden_units': 160, 'kernel_initializer': 'he_normal', 'hidden_activation': 'relu', 'hidden_dropout': 0.0, 'batch_norm': 'on', 'optimizer_type': 'adam', 'optimizer_lr': 0.002854921626757661, 'batch_size': 96}. Best is trial 171 with value: 10.681659473072962.
Trial 234 finished with value: 17.361208304233465 and parameters: {'input_dropout': 0.0, 'hidden_layers': 9, 'hidden_units': 160, 'kernel_initializer': 'he_normal', 'hidden_activation': 'relu', 'hidden_dropout': 0.0, 'batch_norm': 'on', 'optimizer_type': 'adam', 'optimizer_lr': 0.0025089671447516876, 'batch_size': 96}. Best is trial 171 with value: 10.681659473072962.
Trial 235 finished with value: 50.35165593333605 and parameters: {'input_dropout': 0.0, 'hidden_layers': 9, 'hidden_units': 160, 'kernel_initializer': 'he_normal', 'hidden_activation': 'relu', 'hidden_dropout': 0.0, 'batch_norm': 'on', 'optimizer_type': 'adam', 'optimizer_lr': 0.0031990508709588326, 'batch_size': 96}. Best is trial 171 with value: 10.681659473072962.
Trial 236 finished with value: 39.11580150904269 and parameters: {'input_dropout': 0.1, 'hidden_layers': 9, 'hidden_units': 160, 'kernel_initializer': 'he_normal', 'hidden_activation': 'relu', 'hidden_dropout': 0.0, 'batch_norm': 'on', 'optimizer_type': 'adam', 'optimizer_lr': 0.0027043975516286337, 'batch_size': 96}. Best is trial 171 with value: 10.681659473072962.
Trial 237 finished with value: 35.082418920372554 and parameters: {'input_dropout': 0.0, 'hidden_layers': 9, 'hidden_units': 160, 'kernel_initializer': 'random_normal', 'hidden_activation': 'relu', 'hidden_dropout': 0.0, 'batch_norm': 'on', 'optimizer_type': 'adam', 'optimizer_lr': 0.002863253296123473, 'batch_size': 96}. Best is trial 171 with value: 10.681659473072962.
Trial 238 finished with value: 17.023958212289028 and parameters: {'input_dropout': 0.0, 'hidden_layers': 9, 'hidden_units': 160, 'kernel_initializer': 'he_normal', 'hidden_activation': 'relu', 'hidden_dropout': 0.0, 'batch_norm': 'on', 'optimizer_type': 'rmsprop', 'optimizer_lr': 0.0025351896891956604, 'batch_size': 96}. Best is trial 171 with value: 10.681659473072962.
Trial 239 finished with value: 44.56829997006586 and parameters: {'input_dropout': 0.0, 'hidden_layers': 9, 'hidden_units': 160, 'kernel_initializer': 'he_normal', 'hidden_activation': 'relu', 'hidden_dropout': 0.0, 'batch_norm': 'on', 'optimizer_type': 'adam', 'optimizer_lr': 0.0026362830421864645, 'batch_size': 96}. Best is trial 171 with value: 10.681659473072962.
Trial 240 finished with value: 15.486104702760805 and parameters: {'input_dropout': 0.0, 'hidden_layers': 9, 'hidden_units': 224, 'kernel_initializer': 'he_normal', 'hidden_activation': 'relu', 'hidden_dropout': 0.0, 'batch_norm': 'off', 'optimizer_type': 'adam', 'optimizer_lr': 0.003078374910591098, 'batch_size': 96}. Best is trial 171 with value: 10.681659473072962.
Trial 241 finished with value: 15.238380666805309 and parameters: {'input_dropout': 0.0, 'hidden_layers': 9, 'hidden_units': 160, 'kernel_initializer': 'he_normal', 'hidden_activation': 'relu', 'hidden_dropout': 0.0, 'batch_norm': 'on', 'optimizer_type': 'adam', 'optimizer_lr': 0.002799624835793585, 'batch_size': 96}. Best is trial 171 with value: 10.681659473072962.
Trial 242 finished with value: 11.149172366640274 and parameters: {'input_dropout': 0.0, 'hidden_layers': 9, 'hidden_units': 160, 'kernel_initializer': 'he_normal', 'hidden_activation': 'leaky_relu', 'hidden_dropout': 0.0, 'batch_norm': 'on', 'optimizer_type': 'adam', 'optimizer_lr': 0.0028529059409427744, 'batch_size': 96}. Best is trial 171 with value: 10.681659473072962.
Trial 243 finished with value: 21.365372345568584 and parameters: {'input_dropout': 0.0, 'hidden_layers': 9, 'hidden_units': 160, 'kernel_initializer': 'he_normal', 'hidden_activation': 'leaky_relu', 'hidden_dropout': 0.0, 'batch_norm': 'on', 'optimizer_type': 'adam', 'optimizer_lr': 0.0029428168502201183, 'batch_size': 96}. Best is trial 171 with value: 10.681659473072962.
Trial 244 finished with value: 145.94548607813704 and parameters: {'input_dropout': 0.0, 'hidden_layers': 9, 'hidden_units': 160, 'kernel_initializer': 'he_normal', 'hidden_activation': 'relu', 'hidden_dropout': 0.0, 'batch_norm': 'on', 'optimizer_type': 'adam', 'optimizer_lr': 0.002363495439128292, 'batch_size': 96}. Best is trial 171 with value: 10.681659473072962.
Trial 245 finished with value: 14.948920237806846 and parameters: {'input_dropout': 0.0, 'hidden_layers': 9, 'hidden_units': 160, 'kernel_initializer': 'he_normal', 'hidden_activation': 'leaky_relu', 'hidden_dropout': 0.0, 'batch_norm': 'on', 'optimizer_type': 'adam', 'optimizer_lr': 0.002624077409008474, 'batch_size': 96}. Best is trial 171 with value: 10.681659473072962.
Trial 246 finished with value: 16.87381562880043 and parameters: {'input_dropout': 0.0, 'hidden_layers': 9, 'hidden_units': 160, 'kernel_initializer': 'he_normal', 'hidden_activation': 'leaky_relu', 'hidden_dropout': 0.0, 'batch_norm': 'on', 'optimizer_type': 'adam', 'optimizer_lr': 0.001585937381088768, 'batch_size': 96}. Best is trial 171 with value: 10.681659473072962.
Trial 247 finished with value: 15.801048310921573 and parameters: {'input_dropout': 0.0, 'hidden_layers': 9, 'hidden_units': 160, 'kernel_initializer': 'he_normal', 'hidden_activation': 'leaky_relu', 'hidden_dropout': 0.0, 'batch_norm': 'off', 'optimizer_type': 'adam', 'optimizer_lr': 0.002479400334274885, 'batch_size': 96}. Best is trial 171 with value: 10.681659473072962.
Trial 248 finished with value: 31.962036513258443 and parameters: {'input_dropout': 0.0, 'hidden_layers': 9, 'hidden_units': 256, 'kernel_initializer': 'he_normal', 'hidden_activation': 'prelu', 'hidden_dropout': 0.0, 'batch_norm': 'on', 'optimizer_type': 'adam', 'optimizer_lr': 0.0031269173562804425, 'batch_size': 96}. Best is trial 171 with value: 10.681659473072962.
Trial 249 finished with value: 14.443373803548011 and parameters: {'input_dropout': 0.0, 'hidden_layers': 9, 'hidden_units': 160, 'kernel_initializer': 'he_uniform', 'hidden_activation': 'leaky_relu', 'hidden_dropout': 0.0, 'batch_norm': 'off', 'optimizer_type': 'adam', 'optimizer_lr': 0.002790156277074864, 'batch_size': 96}. Best is trial 171 with value: 10.681659473072962.
Trial 250 finished with value: 23.49004143561049 and parameters: {'input_dropout': 0.0, 'hidden_layers': 9, 'hidden_units': 160, 'kernel_initializer': 'he_uniform', 'hidden_activation': 'relu', 'hidden_dropout': 0.0, 'batch_norm': 'off', 'optimizer_type': 'adam', 'optimizer_lr': 0.002747562991025701, 'batch_size': 96}. Best is trial 171 with value: 10.681659473072962.
Trial 251 finished with value: 15.039543921398652 and parameters: {'input_dropout': 0.0, 'hidden_layers': 9, 'hidden_units': 160, 'kernel_initializer': 'he_uniform', 'hidden_activation': 'leaky_relu', 'hidden_dropout': 0.0, 'batch_norm': 'on', 'optimizer_type': 'adam', 'optimizer_lr': 0.0024536609049219888, 'batch_size': 96}. Best is trial 171 with value: 10.681659473072962.
Trial 252 finished with value: 19.94600872497653 and parameters: {'input_dropout': 0.0, 'hidden_layers': 9, 'hidden_units': 160, 'kernel_initializer': 'he_uniform', 'hidden_activation': 'leaky_relu', 'hidden_dropout': 0.0, 'batch_norm': 'off', 'optimizer_type': 'adam', 'optimizer_lr': 0.0026667520544101557, 'batch_size': 96}. Best is trial 171 with value: 10.681659473072962.
Trial 253 finished with value: 19.024739916168798 and parameters: {'input_dropout': 0.0, 'hidden_layers': 9, 'hidden_units': 160, 'kernel_initializer': 'he_uniform', 'hidden_activation': 'leaky_relu', 'hidden_dropout': 0.0, 'batch_norm': 'on', 'optimizer_type': 'adam', 'optimizer_lr': 0.0028547313205330173, 'batch_size': 96}. Best is trial 171 with value: 10.681659473072962.
Trial 254 finished with value: 14.108548973546071 and parameters: {'input_dropout': 0.0, 'hidden_layers': 9, 'hidden_units': 160, 'kernel_initializer': 'he_uniform', 'hidden_activation': 'relu', 'hidden_dropout': 0.0, 'batch_norm': 'off', 'optimizer_type': 'adam', 'optimizer_lr': 0.002314954203245226, 'batch_size': 96}. Best is trial 171 with value: 10.681659473072962.
Trial 255 finished with value: 18.4701703845115 and parameters: {'input_dropout': 0.0, 'hidden_layers': 9, 'hidden_units': 160, 'kernel_initializer': 'he_uniform', 'hidden_activation': 'relu', 'hidden_dropout': 0.0, 'batch_norm': 'off', 'optimizer_type': 'adam', 'optimizer_lr': 0.0022316080058174506, 'batch_size': 96}. Best is trial 171 with value: 10.681659473072962.
Trial 256 finished with value: 15.840975840906747 and parameters: {'input_dropout': 0.0, 'hidden_layers': 9, 'hidden_units': 160, 'kernel_initializer': 'he_uniform', 'hidden_activation': 'relu', 'hidden_dropout': 0.0, 'batch_norm': 'off', 'optimizer_type': 'adam', 'optimizer_lr': 0.0023266367447555107, 'batch_size': 96}. Best is trial 171 with value: 10.681659473072962.
Trial 257 finished with value: 17.220982782359282 and parameters: {'input_dropout': 0.0, 'hidden_layers': 9, 'hidden_units': 160, 'kernel_initializer': 'he_uniform', 'hidden_activation': 'relu', 'hidden_dropout': 0.0, 'batch_norm': 'off', 'optimizer_type': 'adam', 'optimizer_lr': 0.0028881204595427134, 'batch_size': 96}. Best is trial 171 with value: 10.681659473072962.
Trial 258 finished with value: 75.03007572546967 and parameters: {'input_dropout': 0.0, 'hidden_layers': 9, 'hidden_units': 160, 'kernel_initializer': 'he_uniform', 'hidden_activation': 'relu', 'hidden_dropout': 0.0, 'batch_norm': 'off', 'optimizer_type': 'adam', 'optimizer_lr': 0.0033777549001669685, 'batch_size': 96}. Best is trial 171 with value: 10.681659473072962.
Trial 259 finished with value: 18.10130669941282 and parameters: {'input_dropout': 0.0, 'hidden_layers': 6, 'hidden_units': 160, 'kernel_initializer': 'he_uniform', 'hidden_activation': 'relu', 'hidden_dropout': 0.0, 'batch_norm': 'off', 'optimizer_type': 'adam', 'optimizer_lr': 0.0026108919353242076, 'batch_size': 96}. Best is trial 171 with value: 10.681659473072962.
Trial 260 finished with value: 15.34919750382832 and parameters: {'input_dropout': 0.0, 'hidden_layers': 9, 'hidden_units': 160, 'kernel_initializer': 'he_uniform', 'hidden_activation': 'prelu', 'hidden_dropout': 0.0, 'batch_norm': 'off', 'optimizer_type': 'adam', 'optimizer_lr': 0.0027737548678763557, 'batch_size': 96}. Best is trial 171 with value: 10.681659473072962.
Trial 261 finished with value: 19.307597863398584 and parameters: {'input_dropout': 0.0, 'hidden_layers': 9, 'hidden_units': 160, 'kernel_initializer': 'he_uniform', 'hidden_activation': 'relu', 'hidden_dropout': 0.0, 'batch_norm': 'off', 'optimizer_type': 'adam', 'optimizer_lr': 0.002574344957479218, 'batch_size': 96}. Best is trial 171 with value: 10.681659473072962.
Trial 262 finished with value: 14.143212649308452 and parameters: {'input_dropout': 0.0, 'hidden_layers': 9, 'hidden_units': 128, 'kernel_initializer': 'he_normal', 'hidden_activation': 'relu', 'hidden_dropout': 0.0, 'batch_norm': 'off', 'optimizer_type': 'adam', 'optimizer_lr': 0.002065995487469106, 'batch_size': 96}. Best is trial 171 with value: 10.681659473072962.
Trial 263 finished with value: 11.916030206036469 and parameters: {'input_dropout': 0.0, 'hidden_layers': 9, 'hidden_units': 128, 'kernel_initializer': 'he_normal', 'hidden_activation': 'relu', 'hidden_dropout': 0.0, 'batch_norm': 'off', 'optimizer_type': 'adam', 'optimizer_lr': 0.0018544512542098505, 'batch_size': 96}. Best is trial 171 with value: 10.681659473072962.
Trial 264 finished with value: 1784.5583098030384 and parameters: {'input_dropout': 0.15000000000000002, 'hidden_layers': 9, 'hidden_units': 128, 'kernel_initializer': 'he_normal', 'hidden_activation': 'relu', 'hidden_dropout': 0.2, 'batch_norm': 'off', 'optimizer_type': 'rmsprop', 'optimizer_lr': 0.001877485455530044, 'batch_size': 96}. Best is trial 171 with value: 10.681659473072962.
Trial 265 finished with value: 22.454018989605665 and parameters: {'input_dropout': 0.0, 'hidden_layers': 9, 'hidden_units': 128, 'kernel_initializer': 'he_normal', 'hidden_activation': 'relu', 'hidden_dropout': 0.0, 'batch_norm': 'off', 'optimizer_type': 'adam', 'optimizer_lr': 0.0017035657711911576, 'batch_size': 96}. Best is trial 171 with value: 10.681659473072962.
Trial 266 finished with value: 20.587177053265425 and parameters: {'input_dropout': 0.0, 'hidden_layers': 9, 'hidden_units': 128, 'kernel_initializer': 'he_normal', 'hidden_activation': 'relu', 'hidden_dropout': 0.0, 'batch_norm': 'off', 'optimizer_type': 'adam', 'optimizer_lr': 0.0019837781701256656, 'batch_size': 96}. Best is trial 171 with value: 10.681659473072962.
Trial 267 finished with value: 30.49679520509468 and parameters: {'input_dropout': 0.0, 'hidden_layers': 9, 'hidden_units': 128, 'kernel_initializer': 'he_normal', 'hidden_activation': 'relu', 'hidden_dropout': 0.0, 'batch_norm': 'off', 'optimizer_type': 'adam', 'optimizer_lr': 0.001797961626438688, 'batch_size': 96}. Best is trial 171 with value: 10.681659473072962.
Trial 268 finished with value: 16.10334545436557 and parameters: {'input_dropout': 0.0, 'hidden_layers': 9, 'hidden_units': 128, 'kernel_initializer': 'he_normal', 'hidden_activation': 'relu', 'hidden_dropout': 0.0, 'batch_norm': 'off', 'optimizer_type': 'adam', 'optimizer_lr': 0.0019932829179061984, 'batch_size': 96}. Best is trial 171 with value: 10.681659473072962.
Trial 269 finished with value: 13.954293535290564 and parameters: {'input_dropout': 0.0, 'hidden_layers': 9, 'hidden_units': 128, 'kernel_initializer': 'he_normal', 'hidden_activation': 'relu', 'hidden_dropout': 0.0, 'batch_norm': 'off', 'optimizer_type': 'adam', 'optimizer_lr': 0.002093310044695949, 'batch_size': 96}. Best is trial 171 with value: 10.681659473072962.
Trial 270 finished with value: 15.309093477236805 and parameters: {'input_dropout': 0.0, 'hidden_layers': 9, 'hidden_units': 128, 'kernel_initializer': 'he_normal', 'hidden_activation': 'relu', 'hidden_dropout': 0.0, 'batch_norm': 'off', 'optimizer_type': 'adam', 'optimizer_lr': 0.0018746451900810291, 'batch_size': 96}. Best is trial 171 with value: 10.681659473072962.
Trial 271 finished with value: 24.85769259338168 and parameters: {'input_dropout': 0.0, 'hidden_layers': 9, 'hidden_units': 128, 'kernel_initializer': 'he_normal', 'hidden_activation': 'relu', 'hidden_dropout': 0.0, 'batch_norm': 'off', 'optimizer_type': 'adam', 'optimizer_lr': 0.0020719077150656373, 'batch_size': 96}. Best is trial 171 with value: 10.681659473072962.
Trial 272 finished with value: 76.02709204992377 and parameters: {'input_dropout': 0.0, 'hidden_layers': 4, 'hidden_units': 128, 'kernel_initializer': 'random_normal', 'hidden_activation': 'relu', 'hidden_dropout': 0.0, 'batch_norm': 'off', 'optimizer_type': 'adam', 'optimizer_lr': 0.0020432831943602695, 'batch_size': 96}. Best is trial 171 with value: 10.681659473072962.
Trial 273 finished with value: 466.27762014410433 and parameters: {'input_dropout': 0.0, 'hidden_layers': 9, 'hidden_units': 128, 'kernel_initializer': 'he_normal', 'hidden_activation': 'relu', 'hidden_dropout': 0.1, 'batch_norm': 'off', 'optimizer_type': 'adam', 'optimizer_lr': 0.0021518378139036513, 'batch_size': 96}. Best is trial 171 with value: 10.681659473072962.
Trial 274 finished with value: 15.066481628987846 and parameters: {'input_dropout': 0.0, 'hidden_layers': 9, 'hidden_units': 128, 'kernel_initializer': 'he_normal', 'hidden_activation': 'relu', 'hidden_dropout': 0.0, 'batch_norm': 'off', 'optimizer_type': 'adam', 'optimizer_lr': 0.002249496222590608, 'batch_size': 96}. Best is trial 171 with value: 10.681659473072962.
Trial 275 finished with value: 16.373466024501024 and parameters: {'input_dropout': 0.0, 'hidden_layers': 9, 'hidden_units': 128, 'kernel_initializer': 'he_normal', 'hidden_activation': 'relu', 'hidden_dropout': 0.0, 'batch_norm': 'off', 'optimizer_type': 'adam', 'optimizer_lr': 0.001819817735742573, 'batch_size': 96}. Best is trial 171 with value: 10.681659473072962.
Trial 276 finished with value: 22.58294848753429 and parameters: {'input_dropout': 0.0, 'hidden_layers': 9, 'hidden_units': 192, 'kernel_initializer': 'he_normal', 'hidden_activation': 'relu', 'hidden_dropout': 0.0, 'batch_norm': 'off', 'optimizer_type': 'adam', 'optimizer_lr': 0.0021500971514789554, 'batch_size': 128}. Best is trial 171 with value: 10.681659473072962.
Trial 277 finished with value: 16.914709245875482 and parameters: {'input_dropout': 0.0, 'hidden_layers': 9, 'hidden_units': 128, 'kernel_initializer': 'he_normal', 'hidden_activation': 'relu', 'hidden_dropout': 0.0, 'batch_norm': 'off', 'optimizer_type': 'adam', 'optimizer_lr': 0.00233056976326949, 'batch_size': 96}. Best is trial 171 with value: 10.681659473072962.
Trial 278 finished with value: 30.306022104542613 and parameters: {'input_dropout': 0.0, 'hidden_layers': 9, 'hidden_units': 128, 'kernel_initializer': 'he_normal', 'hidden_activation': 'relu', 'hidden_dropout': 0.0, 'batch_norm': 'off', 'optimizer_type': 'adam', 'optimizer_lr': 0.0068938697175049855, 'batch_size': 96}. Best is trial 171 with value: 10.681659473072962.
Trial 279 finished with value: 16.01631870798472 and parameters: {'input_dropout': 0.0, 'hidden_layers': 9, 'hidden_units': 128, 'kernel_initializer': 'he_normal', 'hidden_activation': 'relu', 'hidden_dropout': 0.0, 'batch_norm': 'on', 'optimizer_type': 'adam', 'optimizer_lr': 0.0019520574559867686, 'batch_size': 96}. Best is trial 171 with value: 10.681659473072962.
Trial 280 finished with value: 17.721743296273843 and parameters: {'input_dropout': 0.0, 'hidden_layers': 9, 'hidden_units': 128, 'kernel_initializer': 'he_normal', 'hidden_activation': 'relu', 'hidden_dropout': 0.0, 'batch_norm': 'off', 'optimizer_type': 'adam', 'optimizer_lr': 0.002395613436834854, 'batch_size': 96}. Best is trial 171 with value: 10.681659473072962.
Trial 281 finished with value: 51.4937161750116 and parameters: {'input_dropout': 0.1, 'hidden_layers': 9, 'hidden_units': 128, 'kernel_initializer': 'he_normal', 'hidden_activation': 'relu', 'hidden_dropout': 0.0, 'batch_norm': 'on', 'optimizer_type': 'adam', 'optimizer_lr': 0.001686131558539649, 'batch_size': 96}. Best is trial 171 with value: 10.681659473072962.
Trial 282 finished with value: 133.6080145237348 and parameters: {'input_dropout': 0.0, 'hidden_layers': 9, 'hidden_units': 160, 'kernel_initializer': 'he_normal', 'hidden_activation': 'relu', 'hidden_dropout': 0.0, 'batch_norm': 'off', 'optimizer_type': 'rmsprop', 'optimizer_lr': 0.0006467742137466083, 'batch_size': 96}. Best is trial 171 with value: 10.681659473072962.
Trial 283 finished with value: 18.309275318418344 and parameters: {'input_dropout': 0.0, 'hidden_layers': 9, 'hidden_units': 192, 'kernel_initializer': 'he_normal', 'hidden_activation': 'relu', 'hidden_dropout': 0.0, 'batch_norm': 'on', 'optimizer_type': 'adam', 'optimizer_lr': 0.002484794149572221, 'batch_size': 96}. Best is trial 171 with value: 10.681659473072962.
Trial 284 finished with value: 45.70234976936441 and parameters: {'input_dropout': 0.05, 'hidden_layers': 9, 'hidden_units': 160, 'kernel_initializer': 'he_normal', 'hidden_activation': 'relu', 'hidden_dropout': 0.0, 'batch_norm': 'off', 'optimizer_type': 'adam', 'optimizer_lr': 0.0022630136035242756, 'batch_size': 96}. Best is trial 171 with value: 10.681659473072962.
Trial 285 finished with value: 16.176930456433304 and parameters: {'input_dropout': 0.0, 'hidden_layers': 9, 'hidden_units': 128, 'kernel_initializer': 'he_normal', 'hidden_activation': 'relu', 'hidden_dropout': 0.0, 'batch_norm': 'on', 'optimizer_type': 'adam', 'optimizer_lr': 0.0020954865950427513, 'batch_size': 96}. Best is trial 171 with value: 10.681659473072962.
Trial 286 finished with value: 25.227309165502806 and parameters: {'input_dropout': 0.0, 'hidden_layers': 9, 'hidden_units': 160, 'kernel_initializer': 'he_normal', 'hidden_activation': 'leaky_relu', 'hidden_dropout': 0.0, 'batch_norm': 'off', 'optimizer_type': 'adam', 'optimizer_lr': 0.002630922689986903, 'batch_size': 96}. Best is trial 171 with value: 10.681659473072962.
Trial 287 finished with value: 188.09630338178619 and parameters: {'input_dropout': 0.0, 'hidden_layers': 9, 'hidden_units': 160, 'kernel_initializer': 'he_normal', 'hidden_activation': 'leaky_relu', 'hidden_dropout': 0.3, 'batch_norm': 'on', 'optimizer_type': 'adam', 'optimizer_lr': 0.0030728976328322534, 'batch_size': 96}. Best is trial 171 with value: 10.681659473072962.
Trial 288 finished with value: 19.364679267713296 and parameters: {'input_dropout': 0.0, 'hidden_layers': 9, 'hidden_units': 128, 'kernel_initializer': 'he_normal', 'hidden_activation': 'relu', 'hidden_dropout': 0.0, 'batch_norm': 'off', 'optimizer_type': 'adam', 'optimizer_lr': 0.0024778001400498966, 'batch_size': 96}. Best is trial 171 with value: 10.681659473072962.
Trial 289 finished with value: 25.006412927002117 and parameters: {'input_dropout': 0.0, 'hidden_layers': 10, 'hidden_units': 96, 'kernel_initializer': 'he_normal', 'hidden_activation': 'leaky_relu', 'hidden_dropout': 0.0, 'batch_norm': 'on', 'optimizer_type': 'adam', 'optimizer_lr': 0.002659802608810938, 'batch_size': 96}. Best is trial 171 with value: 10.681659473072962.
Trial 290 finished with value: 14.966236899156561 and parameters: {'input_dropout': 0.0, 'hidden_layers': 9, 'hidden_units': 224, 'kernel_initializer': 'he_normal', 'hidden_activation': 'leaky_relu', 'hidden_dropout': 0.0, 'batch_norm': 'off', 'optimizer_type': 'adam', 'optimizer_lr': 0.0029295648726853406, 'batch_size': 96}. Best is trial 171 with value: 10.681659473072962.
