Trial 349 finished with value: 16.218020101318206 and parameters: {'input_dropout': 0.0, 'hidden_layers': 9, 'hidden_units': 160, 'kernel_initializer': 'he_normal', 'hidden_activation': 'leaky_relu', 'hidden_dropout': 0.0, 'batch_norm': 'off', 'optimizer_type': 'adam', 'optimizer_lr': 0.0010814265997225413, 'batch_size': 96}. Best is trial 295 with value: 8.730305301702867.
Trial 350 finished with value: 638.2658784680449 and parameters: {'input_dropout': 0.0, 'hidden_layers': 9, 'hidden_units': 160, 'kernel_initializer': 'he_normal', 'hidden_activation': 'leaky_relu', 'hidden_dropout': 0.15000000000000002, 'batch_norm': 'off', 'optimizer_type': 'adam', 'optimizer_lr': 0.0013357201904587266, 'batch_size': 96}. Best is trial 295 with value: 8.730305301702867.
Trial 351 finished with value: 14.04442681712562 and parameters: {'input_dropout': 0.0, 'hidden_layers': 10, 'hidden_units': 160, 'kernel_initializer': 'he_normal', 'hidden_activation': 'leaky_relu', 'hidden_dropout': 0.0, 'batch_norm': 'off', 'optimizer_type': 'adam', 'optimizer_lr': 0.0011281374907410504, 'batch_size': 96}. Best is trial 295 with value: 8.730305301702867.
Trial 352 finished with value: 17.211705724701222 and parameters: {'input_dropout': 0.0, 'hidden_layers': 9, 'hidden_units': 160, 'kernel_initializer': 'he_normal', 'hidden_activation': 'leaky_relu', 'hidden_dropout': 0.0, 'batch_norm': 'off', 'optimizer_type': 'adam', 'optimizer_lr': 0.0012606837063161946, 'batch_size': 96}. Best is trial 295 with value: 8.730305301702867.
Trial 353 finished with value: 18.907373682215706 and parameters: {'input_dropout': 0.0, 'hidden_layers': 9, 'hidden_units': 160, 'kernel_initializer': 'he_normal', 'hidden_activation': 'leaky_relu', 'hidden_dropout': 0.0, 'batch_norm': 'off', 'optimizer_type': 'adam', 'optimizer_lr': 0.0015221173052672194, 'batch_size': 96}. Best is trial 295 with value: 8.730305301702867.
Trial 354 finished with value: 11.557033462295655 and parameters: {'input_dropout': 0.0, 'hidden_layers': 8, 'hidden_units': 160, 'kernel_initializer': 'he_normal', 'hidden_activation': 'leaky_relu', 'hidden_dropout': 0.0, 'batch_norm': 'off', 'optimizer_type': 'adam', 'optimizer_lr': 0.00141002319308152, 'batch_size': 96}. Best is trial 295 with value: 8.730305301702867.
Trial 355 finished with value: 159.98624109487082 and parameters: {'input_dropout': 0.0, 'hidden_layers': 7, 'hidden_units': 160, 'kernel_initializer': 'he_normal', 'hidden_activation': 'leaky_relu', 'hidden_dropout': 0.05, 'batch_norm': 'off', 'optimizer_type': 'adam', 'optimizer_lr': 0.0014230670762259974, 'batch_size': 96}. Best is trial 295 with value: 8.730305301702867.
Trial 356 finished with value: 20.13616149411748 and parameters: {'input_dropout': 0.0, 'hidden_layers': 8, 'hidden_units': 160, 'kernel_initializer': 'he_normal', 'hidden_activation': 'leaky_relu', 'hidden_dropout': 0.0, 'batch_norm': 'off', 'optimizer_type': 'adam', 'optimizer_lr': 0.0013333334908332902, 'batch_size': 96}. Best is trial 295 with value: 8.730305301702867.
Trial 357 finished with value: 21.510055293988913 and parameters: {'input_dropout': 0.0, 'hidden_layers': 8, 'hidden_units': 160, 'kernel_initializer': 'he_normal', 'hidden_activation': 'leaky_relu', 'hidden_dropout': 0.0, 'batch_norm': 'off', 'optimizer_type': 'adam', 'optimizer_lr': 0.001204201630348853, 'batch_size': 96}. Best is trial 295 with value: 8.730305301702867.
Trial 358 finished with value: 49.44827579219908 and parameters: {'input_dropout': 0.05, 'hidden_layers': 8, 'hidden_units': 160, 'kernel_initializer': 'he_normal', 'hidden_activation': 'leaky_relu', 'hidden_dropout': 0.0, 'batch_norm': 'off', 'optimizer_type': 'adam', 'optimizer_lr': 0.001431743455573825, 'batch_size': 96}. Best is trial 295 with value: 8.730305301702867.
Trial 359 finished with value: 607.994932791437 and parameters: {'input_dropout': 0.0, 'hidden_layers': 6, 'hidden_units': 160, 'kernel_initializer': 'he_normal', 'hidden_activation': 'leaky_relu', 'hidden_dropout': 0.25, 'batch_norm': 'off', 'optimizer_type': 'adam', 'optimizer_lr': 0.0015629665529569362, 'batch_size': 96}. Best is trial 295 with value: 8.730305301702867.
Trial 360 finished with value: 18.115993496685945 and parameters: {'input_dropout': 0.0, 'hidden_layers': 9, 'hidden_units': 160, 'kernel_initializer': 'he_normal', 'hidden_activation': 'leaky_relu', 'hidden_dropout': 0.0, 'batch_norm': 'off', 'optimizer_type': 'adam', 'optimizer_lr': 0.0013389542730496405, 'batch_size': 96}. Best is trial 295 with value: 8.730305301702867.
Trial 361 finished with value: 45.4255633414278 and parameters: {'input_dropout': 0.0, 'hidden_layers': 9, 'hidden_units': 160, 'kernel_initializer': 'random_normal', 'hidden_activation': 'leaky_relu', 'hidden_dropout': 0.0, 'batch_norm': 'off', 'optimizer_type': 'adam', 'optimizer_lr': 0.0012617919006311215, 'batch_size': 96}. Best is trial 295 with value: 8.730305301702867.
Trial 362 finished with value: 20.458465916466196 and parameters: {'input_dropout': 0.0, 'hidden_layers': 10, 'hidden_units': 160, 'kernel_initializer': 'he_normal', 'hidden_activation': 'leaky_relu', 'hidden_dropout': 0.0, 'batch_norm': 'off', 'optimizer_type': 'adam', 'optimizer_lr': 0.0015364058836989194, 'batch_size': 96}. Best is trial 295 with value: 8.730305301702867.
Trial 363 finished with value: 230.5027075241799 and parameters: {'input_dropout': 0.0, 'hidden_layers': 9, 'hidden_units': 160, 'kernel_initializer': 'he_normal', 'hidden_activation': 'leaky_relu', 'hidden_dropout': 0.0, 'batch_norm': 'off', 'optimizer_type': 'rmsprop', 'optimizer_lr': 0.0014734524014681813, 'batch_size': 96}. Best is trial 295 with value: 8.730305301702867.
Trial 364 finished with value: 15.793505399889716 and parameters: {'input_dropout': 0.0, 'hidden_layers': 8, 'hidden_units': 160, 'kernel_initializer': 'he_normal', 'hidden_activation': 'leaky_relu', 'hidden_dropout': 0.0, 'batch_norm': 'off', 'optimizer_type': 'adam', 'optimizer_lr': 0.0014185588615944823, 'batch_size': 96}. Best is trial 295 with value: 8.730305301702867.
Trial 365 finished with value: 19.336186612510456 and parameters: {'input_dropout': 0.0, 'hidden_layers': 9, 'hidden_units': 160, 'kernel_initializer': 'he_normal', 'hidden_activation': 'leaky_relu', 'hidden_dropout': 0.0, 'batch_norm': 'off', 'optimizer_type': 'adam', 'optimizer_lr': 0.0011676054795593269, 'batch_size': 96}. Best is trial 295 with value: 8.730305301702867.
Trial 366 finished with value: 17.635772220522455 and parameters: {'input_dropout': 0.0, 'hidden_layers': 9, 'hidden_units': 160, 'kernel_initializer': 'he_normal', 'hidden_activation': 'leaky_relu', 'hidden_dropout': 0.0, 'batch_norm': 'off', 'optimizer_type': 'adam', 'optimizer_lr': 0.0016658648277992393, 'batch_size': 96}. Best is trial 295 with value: 8.730305301702867.
Trial 367 finished with value: 21.47341038324027 and parameters: {'input_dropout': 0.0, 'hidden_layers': 7, 'hidden_units': 160, 'kernel_initializer': 'he_normal', 'hidden_activation': 'leaky_relu', 'hidden_dropout': 0.0, 'batch_norm': 'off', 'optimizer_type': 'adam', 'optimizer_lr': 0.0009842344486111444, 'batch_size': 96}. Best is trial 295 with value: 8.730305301702867.
Trial 368 finished with value: 23.012293043145988 and parameters: {'input_dropout': 0.0, 'hidden_layers': 9, 'hidden_units': 160, 'kernel_initializer': 'he_normal', 'hidden_activation': 'leaky_relu', 'hidden_dropout': 0.0, 'batch_norm': 'off', 'optimizer_type': 'adam', 'optimizer_lr': 0.0030774277441756696, 'batch_size': 96}. Best is trial 295 with value: 8.730305301702867.
Trial 369 finished with value: 14.382523838685007 and parameters: {'input_dropout': 0.0, 'hidden_layers': 9, 'hidden_units': 128, 'kernel_initializer': 'he_normal', 'hidden_activation': 'leaky_relu', 'hidden_dropout': 0.0, 'batch_norm': 'off', 'optimizer_type': 'adam', 'optimizer_lr': 0.0029635102374591035, 'batch_size': 96}. Best is trial 295 with value: 8.730305301702867.
Trial 370 finished with value: 13.415339967652448 and parameters: {'input_dropout': 0.0, 'hidden_layers': 9, 'hidden_units': 160, 'kernel_initializer': 'he_normal', 'hidden_activation': 'leaky_relu', 'hidden_dropout': 0.0, 'batch_norm': 'off', 'optimizer_type': 'adam', 'optimizer_lr': 0.002926866574879493, 'batch_size': 96}. Best is trial 295 with value: 8.730305301702867.
Trial 371 finished with value: 17.09355874615747 and parameters: {'input_dropout': 0.0, 'hidden_layers': 9, 'hidden_units': 128, 'kernel_initializer': 'he_normal', 'hidden_activation': 'leaky_relu', 'hidden_dropout': 0.0, 'batch_norm': 'off', 'optimizer_type': 'adam', 'optimizer_lr': 0.003072486713828543, 'batch_size': 96}. Best is trial 295 with value: 8.730305301702867.
Trial 372 finished with value: 23.41471282711804 and parameters: {'input_dropout': 0.0, 'hidden_layers': 9, 'hidden_units': 160, 'kernel_initializer': 'he_normal', 'hidden_activation': 'leaky_relu', 'hidden_dropout': 0.0, 'batch_norm': 'off', 'optimizer_type': 'adam', 'optimizer_lr': 0.0034944143149679787, 'batch_size': 96}. Best is trial 295 with value: 8.730305301702867.
Trial 373 finished with value: 14.801394663205334 and parameters: {'input_dropout': 0.0, 'hidden_layers': 9, 'hidden_units': 128, 'kernel_initializer': 'he_normal', 'hidden_activation': 'leaky_relu', 'hidden_dropout': 0.0, 'batch_norm': 'off', 'optimizer_type': 'adam', 'optimizer_lr': 0.0028663098933656888, 'batch_size': 96}. Best is trial 295 with value: 8.730305301702867.
Trial 374 finished with value: 19.05731326265327 and parameters: {'input_dropout': 0.0, 'hidden_layers': 9, 'hidden_units': 160, 'kernel_initializer': 'he_normal', 'hidden_activation': 'leaky_relu', 'hidden_dropout': 0.0, 'batch_norm': 'off', 'optimizer_type': 'adam', 'optimizer_lr': 0.0027623134431601355, 'batch_size': 96}. Best is trial 295 with value: 8.730305301702867.
Trial 375 finished with value: 26.397361293831032 and parameters: {'input_dropout': 0.0, 'hidden_layers': 9, 'hidden_units': 128, 'kernel_initializer': 'he_normal', 'hidden_activation': 'leaky_relu', 'hidden_dropout': 0.0, 'batch_norm': 'off', 'optimizer_type': 'adam', 'optimizer_lr': 0.0032643738981311126, 'batch_size': 128}. Best is trial 295 with value: 8.730305301702867.
Trial 376 finished with value: 19.728517002738645 and parameters: {'input_dropout': 0.0, 'hidden_layers': 9, 'hidden_units': 160, 'kernel_initializer': 'he_normal', 'hidden_activation': 'leaky_relu', 'hidden_dropout': 0.0, 'batch_norm': 'off', 'optimizer_type': 'adam', 'optimizer_lr': 0.003010791806180746, 'batch_size': 96}. Best is trial 295 with value: 8.730305301702867.
Trial 377 finished with value: 16.018777902583494 and parameters: {'input_dropout': 0.0, 'hidden_layers': 9, 'hidden_units': 128, 'kernel_initializer': 'he_normal', 'hidden_activation': 'leaky_relu', 'hidden_dropout': 0.0, 'batch_norm': 'off', 'optimizer_type': 'adam', 'optimizer_lr': 0.0026712214254806725, 'batch_size': 96}. Best is trial 295 with value: 8.730305301702867.
Trial 378 finished with value: 14.51759266291611 and parameters: {'input_dropout': 0.0, 'hidden_layers': 9, 'hidden_units': 160, 'kernel_initializer': 'he_normal', 'hidden_activation': 'leaky_relu', 'hidden_dropout': 0.0, 'batch_norm': 'off', 'optimizer_type': 'adam', 'optimizer_lr': 0.0031570536467511886, 'batch_size': 96}. Best is trial 295 with value: 8.730305301702867.
Trial 379 finished with value: 16.79511883368925 and parameters: {'input_dropout': 0.0, 'hidden_layers': 9, 'hidden_units': 128, 'kernel_initializer': 'he_normal', 'hidden_activation': 'leaky_relu', 'hidden_dropout': 0.0, 'batch_norm': 'off', 'optimizer_type': 'adam', 'optimizer_lr': 0.0028894595304753056, 'batch_size': 96}. Best is trial 295 with value: 8.730305301702867.
Trial 380 finished with value: 148.29872112193752 and parameters: {'input_dropout': 0.0, 'hidden_layers': 8, 'hidden_units': 160, 'kernel_initializer': 'he_normal', 'hidden_activation': 'leaky_relu', 'hidden_dropout': 0.05, 'batch_norm': 'off', 'optimizer_type': 'adam', 'optimizer_lr': 0.0025366195535829065, 'batch_size': 96}. Best is trial 295 with value: 8.730305301702867.
Trial 381 finished with value: 146.12860569656394 and parameters: {'input_dropout': 0.0, 'hidden_layers': 9, 'hidden_units': 128, 'kernel_initializer': 'random_normal', 'hidden_activation': 'leaky_relu', 'hidden_dropout': 0.0, 'batch_norm': 'off', 'optimizer_type': 'rmsprop', 'optimizer_lr': 0.0028403257226634828, 'batch_size': 96}. Best is trial 295 with value: 8.730305301702867.
Trial 382 finished with value: 15.12759020560032 and parameters: {'input_dropout': 0.0, 'hidden_layers': 9, 'hidden_units': 160, 'kernel_initializer': 'he_normal', 'hidden_activation': 'leaky_relu', 'hidden_dropout': 0.0, 'batch_norm': 'off', 'optimizer_type': 'adam', 'optimizer_lr': 0.002663068683880142, 'batch_size': 96}. Best is trial 295 with value: 8.730305301702867.
Trial 383 finished with value: 17.43016499270494 and parameters: {'input_dropout': 0.0, 'hidden_layers': 9, 'hidden_units': 128, 'kernel_initializer': 'he_normal', 'hidden_activation': 'leaky_relu', 'hidden_dropout': 0.0, 'batch_norm': 'off', 'optimizer_type': 'adam', 'optimizer_lr': 0.0015919411831247377, 'batch_size': 96}. Best is trial 295 with value: 8.730305301702867.
Trial 384 finished with value: 15.425142668809665 and parameters: {'input_dropout': 0.0, 'hidden_layers': 9, 'hidden_units': 160, 'kernel_initializer': 'he_normal', 'hidden_activation': 'leaky_relu', 'hidden_dropout': 0.0, 'batch_norm': 'off', 'optimizer_type': 'adam', 'optimizer_lr': 0.0029866196279253903, 'batch_size': 96}. Best is trial 295 with value: 8.730305301702867.
Trial 385 finished with value: 8.880043203469437 and parameters: {'input_dropout': 0.0, 'hidden_layers': 8, 'hidden_units': 128, 'kernel_initializer': 'he_normal', 'hidden_activation': 'leaky_relu', 'hidden_dropout': 0.0, 'batch_norm': 'off', 'optimizer_type': 'adam', 'optimizer_lr': 0.003231915252836298, 'batch_size': 96}. Best is trial 295 with value: 8.730305301702867.
Trial 386 finished with value: 18.894842470431723 and parameters: {'input_dropout': 0.0, 'hidden_layers': 8, 'hidden_units': 128, 'kernel_initializer': 'he_normal', 'hidden_activation': 'leaky_relu', 'hidden_dropout': 0.0, 'batch_norm': 'off', 'optimizer_type': 'adam', 'optimizer_lr': 0.0036387386888649055, 'batch_size': 96}. Best is trial 295 with value: 8.730305301702867.
Trial 387 finished with value: 15.285358896256248 and parameters: {'input_dropout': 0.0, 'hidden_layers': 8, 'hidden_units': 160, 'kernel_initializer': 'he_normal', 'hidden_activation': 'leaky_relu', 'hidden_dropout': 0.0, 'batch_norm': 'off', 'optimizer_type': 'adam', 'optimizer_lr': 0.003400198096950744, 'batch_size': 96}. Best is trial 295 with value: 8.730305301702867.
Trial 388 finished with value: 834.7598608505339 and parameters: {'input_dropout': 0.0, 'hidden_layers': 8, 'hidden_units': 128, 'kernel_initializer': 'he_normal', 'hidden_activation': 'leaky_relu', 'hidden_dropout': 0.2, 'batch_norm': 'off', 'optimizer_type': 'adam', 'optimizer_lr': 0.0031898555529810586, 'batch_size': 96}. Best is trial 295 with value: 8.730305301702867.
Trial 389 finished with value: 20.914279020406543 and parameters: {'input_dropout': 0.0, 'hidden_layers': 8, 'hidden_units': 96, 'kernel_initializer': 'he_normal', 'hidden_activation': 'leaky_relu', 'hidden_dropout': 0.0, 'batch_norm': 'off', 'optimizer_type': 'adam', 'optimizer_lr': 0.003229508015778664, 'batch_size': 96}. Best is trial 295 with value: 8.730305301702867.
Trial 390 finished with value: 14.128518503756963 and parameters: {'input_dropout': 0.0, 'hidden_layers': 8, 'hidden_units': 160, 'kernel_initializer': 'he_normal', 'hidden_activation': 'leaky_relu', 'hidden_dropout': 0.0, 'batch_norm': 'off', 'optimizer_type': 'adam', 'optimizer_lr': 0.003043825880435557, 'batch_size': 96}. Best is trial 295 with value: 8.730305301702867.
Trial 391 finished with value: 21.729771172706933 and parameters: {'input_dropout': 0.0, 'hidden_layers': 8, 'hidden_units': 128, 'kernel_initializer': 'he_uniform', 'hidden_activation': 'leaky_relu', 'hidden_dropout': 0.0, 'batch_norm': 'off', 'optimizer_type': 'adam', 'optimizer_lr': 0.002791428778538894, 'batch_size': 96}. Best is trial 295 with value: 8.730305301702867.
Trial 392 finished with value: 21.390008312372974 and parameters: {'input_dropout': 0.0, 'hidden_layers': 8, 'hidden_units': 160, 'kernel_initializer': 'he_normal', 'hidden_activation': 'leaky_relu', 'hidden_dropout': 0.0, 'batch_norm': 'on', 'optimizer_type': 'adam', 'optimizer_lr': 0.0034552778000042344, 'batch_size': 96}. Best is trial 295 with value: 8.730305301702867.
Trial 393 finished with value: 13.894733472112492 and parameters: {'input_dropout': 0.0, 'hidden_layers': 10, 'hidden_units': 128, 'kernel_initializer': 'he_normal', 'hidden_activation': 'leaky_relu', 'hidden_dropout': 0.0, 'batch_norm': 'off', 'optimizer_type': 'adam', 'optimizer_lr': 0.002899076125460655, 'batch_size': 96}. Best is trial 295 with value: 8.730305301702867.
Trial 394 finished with value: 21.945906832225567 and parameters: {'input_dropout': 0.0, 'hidden_layers': 9, 'hidden_units': 160, 'kernel_initializer': 'he_normal', 'hidden_activation': 'leaky_relu', 'hidden_dropout': 0.0, 'batch_norm': 'off', 'optimizer_type': 'adam', 'optimizer_lr': 0.0026637122886810647, 'batch_size': 96}. Best is trial 295 with value: 8.730305301702867.
Trial 395 finished with value: 85.74621938425189 and parameters: {'input_dropout': 0.15000000000000002, 'hidden_layers': 9, 'hidden_units': 160, 'kernel_initializer': 'he_normal', 'hidden_activation': 'leaky_relu', 'hidden_dropout': 0.0, 'batch_norm': 'on', 'optimizer_type': 'adam', 'optimizer_lr': 0.0038556238074473155, 'batch_size': 96}. Best is trial 295 with value: 8.730305301702867.
Trial 396 finished with value: 29.952851616592167 and parameters: {'input_dropout': 0.0, 'hidden_layers': 7, 'hidden_units': 128, 'kernel_initializer': 'he_normal', 'hidden_activation': 'leaky_relu', 'hidden_dropout': 0.0, 'batch_norm': 'off', 'optimizer_type': 'adam', 'optimizer_lr': 0.0032745405510964326, 'batch_size': 96}. Best is trial 295 with value: 8.730305301702867.
Trial 397 finished with value: 17.7732498557373 and parameters: {'input_dropout': 0.0, 'hidden_layers': 8, 'hidden_units': 160, 'kernel_initializer': 'he_normal', 'hidden_activation': 'leaky_relu', 'hidden_dropout': 0.0, 'batch_norm': 'off', 'optimizer_type': 'adam', 'optimizer_lr': 0.0029860231061863856, 'batch_size': 96}. Best is trial 295 with value: 8.730305301702867.
Trial 398 finished with value: 19.317253412667796 and parameters: {'input_dropout': 0.0, 'hidden_layers': 9, 'hidden_units': 128, 'kernel_initializer': 'he_normal', 'hidden_activation': 'leaky_relu', 'hidden_dropout': 0.0, 'batch_norm': 'on', 'optimizer_type': 'adam', 'optimizer_lr': 0.002507396025483443, 'batch_size': 96}. Best is trial 295 with value: 8.730305301702867.
Trial 399 finished with value: 12.162459267146048 and parameters: {'input_dropout': 0.0, 'hidden_layers': 9, 'hidden_units': 128, 'kernel_initializer': 'he_normal', 'hidden_activation': 'leaky_relu', 'hidden_dropout': 0.0, 'batch_norm': 'off', 'optimizer_type': 'adam', 'optimizer_lr': 0.0027403781967043116, 'batch_size': 96}. Best is trial 295 with value: 8.730305301702867.
Trial 400 finished with value: 180.19355362416817 and parameters: {'input_dropout': 0.0, 'hidden_layers': 9, 'hidden_units': 128, 'kernel_initializer': 'he_normal', 'hidden_activation': 'leaky_relu', 'hidden_dropout': 0.05, 'batch_norm': 'off', 'optimizer_type': 'adam', 'optimizer_lr': 0.0027220157412723356, 'batch_size': 96}. Best is trial 295 with value: 8.730305301702867.
Trial 401 finished with value: 200.88886443959052 and parameters: {'input_dropout': 0.0, 'hidden_layers': 9, 'hidden_units': 128, 'kernel_initializer': 'he_normal', 'hidden_activation': 'leaky_relu', 'hidden_dropout': 0.0, 'batch_norm': 'off', 'optimizer_type': 'rmsprop', 'optimizer_lr': 0.0025391697289183475, 'batch_size': 96}. Best is trial 295 with value: 8.730305301702867.
Trial 402 finished with value: 14.167766848490123 and parameters: {'input_dropout': 0.0, 'hidden_layers': 9, 'hidden_units': 128, 'kernel_initializer': 'he_uniform', 'hidden_activation': 'leaky_relu', 'hidden_dropout': 0.0, 'batch_norm': 'off', 'optimizer_type': 'adam', 'optimizer_lr': 0.002767758626350803, 'batch_size': 96}. Best is trial 295 with value: 8.730305301702867.
Trial 403 finished with value: 20.839875429153906 and parameters: {'input_dropout': 0.0, 'hidden_layers': 8, 'hidden_units': 128, 'kernel_initializer': 'he_normal', 'hidden_activation': 'leaky_relu', 'hidden_dropout': 0.0, 'batch_norm': 'off', 'optimizer_type': 'adam', 'optimizer_lr': 0.002467646724788775, 'batch_size': 96}. Best is trial 295 with value: 8.730305301702867.
Trial 404 finished with value: 65.99301700053016 and parameters: {'input_dropout': 0.0, 'hidden_layers': 9, 'hidden_units': 128, 'kernel_initializer': 'random_normal', 'hidden_activation': 'leaky_relu', 'hidden_dropout': 0.0, 'batch_norm': 'off', 'optimizer_type': 'adam', 'optimizer_lr': 0.0026526705395344572, 'batch_size': 96}. Best is trial 295 with value: 8.730305301702867.
Trial 405 finished with value: 17.583198149811395 and parameters: {'input_dropout': 0.0, 'hidden_layers': 9, 'hidden_units': 128, 'kernel_initializer': 'he_normal', 'hidden_activation': 'leaky_relu', 'hidden_dropout': 0.0, 'batch_norm': 'off', 'optimizer_type': 'adam', 'optimizer_lr': 0.0015118173632965488, 'batch_size': 96}. Best is trial 295 with value: 8.730305301702867.
Trial 406 finished with value: 22.206002074504713 and parameters: {'input_dropout': 0.0, 'hidden_layers': 9, 'hidden_units': 128, 'kernel_initializer': 'he_normal', 'hidden_activation': 'leaky_relu', 'hidden_dropout': 0.0, 'batch_norm': 'off', 'optimizer_type': 'adam', 'optimizer_lr': 0.0028548952784530307, 'batch_size': 96}. Best is trial 295 with value: 8.730305301702867.
