Trial 116 finished with value: 12.165678629755984 and parameters: {'input_dropout': 0.0, 'hidden_layers': 6, 'hidden_units': 192, 'kernel_initializer': 'he_uniform', 'hidden_activation': 'leaky_relu', 'hidden_dropout': 0.0, 'batch_norm': 'off', 'optimizer_type': 'adam', 'optimizer_lr': 0.001775806675574669, 'batch_size': 64}. Best is trial 72 with value: 11.985789281995453.
Trial 117 finished with value: 15.471479992851037 and parameters: {'input_dropout': 0.0, 'hidden_layers': 6, 'hidden_units': 192, 'kernel_initializer': 'he_uniform', 'hidden_activation': 'leaky_relu', 'hidden_dropout': 0.0, 'batch_norm': 'off', 'optimizer_type': 'adam', 'optimizer_lr': 0.0014818214443426726, 'batch_size': 64}. Best is trial 72 with value: 11.985789281995453.
Trial 118 finished with value: 161.40311267539178 and parameters: {'input_dropout': 0.0, 'hidden_layers': 9, 'hidden_units': 224, 'kernel_initializer': 'he_uniform', 'hidden_activation': 'leaky_relu', 'hidden_dropout': 0.0, 'batch_norm': 'off', 'optimizer_type': 'rmsprop', 'optimizer_lr': 0.00290915489905645, 'batch_size': 64}. Best is trial 72 with value: 11.985789281995453.
Trial 119 finished with value: 19.166542988284032 and parameters: {'input_dropout': 0.0, 'hidden_layers': 6, 'hidden_units': 160, 'kernel_initializer': 'he_uniform', 'hidden_activation': 'leaky_relu', 'hidden_dropout': 0.0, 'batch_norm': 'off', 'optimizer_type': 'adam', 'optimizer_lr': 0.0017686724754968212, 'batch_size': 64}. Best is trial 72 with value: 11.985789281995453.
Trial 120 finished with value: 139.96279773928268 and parameters: {'input_dropout': 0.05, 'hidden_layers': 6, 'hidden_units': 192, 'kernel_initializer': 'he_uniform', 'hidden_activation': 'leaky_relu', 'hidden_dropout': 0.05, 'batch_norm': 'off', 'optimizer_type': 'adam', 'optimizer_lr': 0.0010167704458314325, 'batch_size': 64}. Best is trial 72 with value: 11.985789281995453.
Trial 121 finished with value: 13.32219694712854 and parameters: {'input_dropout': 0.0, 'hidden_layers': 7, 'hidden_units': 224, 'kernel_initializer': 'he_uniform', 'hidden_activation': 'leaky_relu', 'hidden_dropout': 0.0, 'batch_norm': 'off', 'optimizer_type': 'adam', 'optimizer_lr': 0.0018786031284677967, 'batch_size': 64}. Best is trial 72 with value: 11.985789281995453.
Trial 122 finished with value: 16.692922970530038 and parameters: {'input_dropout': 0.0, 'hidden_layers': 7, 'hidden_units': 224, 'kernel_initializer': 'he_uniform', 'hidden_activation': 'leaky_relu', 'hidden_dropout': 0.0, 'batch_norm': 'off', 'optimizer_type': 'adam', 'optimizer_lr': 0.0020675169394049906, 'batch_size': 64}. Best is trial 72 with value: 11.985789281995453.
Trial 123 finished with value: 15.682918760987404 and parameters: {'input_dropout': 0.0, 'hidden_layers': 7, 'hidden_units': 224, 'kernel_initializer': 'he_uniform', 'hidden_activation': 'leaky_relu', 'hidden_dropout': 0.0, 'batch_norm': 'off', 'optimizer_type': 'adam', 'optimizer_lr': 0.0012710054277370844, 'batch_size': 64}. Best is trial 72 with value: 11.985789281995453.
Trial 124 finished with value: 21.934542402578977 and parameters: {'input_dropout': 0.0, 'hidden_layers': 6, 'hidden_units': 224, 'kernel_initializer': 'he_uniform', 'hidden_activation': 'leaky_relu', 'hidden_dropout': 0.0, 'batch_norm': 'off', 'optimizer_type': 'adam', 'optimizer_lr': 0.001534271051485557, 'batch_size': 64}. Best is trial 72 with value: 11.985789281995453.
Trial 125 finished with value: 20.33543276034425 and parameters: {'input_dropout': 0.0, 'hidden_layers': 7, 'hidden_units': 256, 'kernel_initializer': 'he_uniform', 'hidden_activation': 'leaky_relu', 'hidden_dropout': 0.0, 'batch_norm': 'off', 'optimizer_type': 'adam', 'optimizer_lr': 0.0018571841119495278, 'batch_size': 64}. Best is trial 72 with value: 11.985789281995453.
Trial 126 finished with value: 25.9202097158906 and parameters: {'input_dropout': 0.0, 'hidden_layers': 9, 'hidden_units': 224, 'kernel_initializer': 'random_normal', 'hidden_activation': 'leaky_relu', 'hidden_dropout': 0.0, 'batch_norm': 'off', 'optimizer_type': 'adam', 'optimizer_lr': 0.00258683408810836, 'batch_size': 64}. Best is trial 72 with value: 11.985789281995453.
Trial 127 finished with value: 103.84906271241262 and parameters: {'input_dropout': 0.1, 'hidden_layers': 7, 'hidden_units': 192, 'kernel_initializer': 'he_normal', 'hidden_activation': 'leaky_relu', 'hidden_dropout': 0.0, 'batch_norm': 'off', 'optimizer_type': 'adam', 'optimizer_lr': 0.0011301215778794053, 'batch_size': 64}. Best is trial 72 with value: 11.985789281995453.
Trial 128 finished with value: 22.486234389632394 and parameters: {'input_dropout': 0.0, 'hidden_layers': 6, 'hidden_units': 160, 'kernel_initializer': 'he_uniform', 'hidden_activation': 'leaky_relu', 'hidden_dropout': 0.0, 'batch_norm': 'off', 'optimizer_type': 'adam', 'optimizer_lr': 0.0008182584108849261, 'batch_size': 64}. Best is trial 72 with value: 11.985789281995453.
Trial 129 finished with value: 20.47758300524788 and parameters: {'input_dropout': 0.0, 'hidden_layers': 7, 'hidden_units': 256, 'kernel_initializer': 'he_uniform', 'hidden_activation': 'relu', 'hidden_dropout': 0.0, 'batch_norm': 'on', 'optimizer_type': 'adam', 'optimizer_lr': 0.0014855217914219402, 'batch_size': 64}. Best is trial 72 with value: 11.985789281995453.
Trial 130 finished with value: 245.18856429435846 and parameters: {'input_dropout': 0.0, 'hidden_layers': 6, 'hidden_units': 224, 'kernel_initializer': 'he_uniform', 'hidden_activation': 'leaky_relu', 'hidden_dropout': 0.05, 'batch_norm': 'off', 'optimizer_type': 'adam', 'optimizer_lr': 1.0464015132896448e-05, 'batch_size': 64}. Best is trial 72 with value: 11.985789281995453.
Trial 131 finished with value: 17.84458010244932 and parameters: {'input_dropout': 0.0, 'hidden_layers': 7, 'hidden_units': 192, 'kernel_initializer': 'he_uniform', 'hidden_activation': 'leaky_relu', 'hidden_dropout': 0.0, 'batch_norm': 'off', 'optimizer_type': 'adam', 'optimizer_lr': 0.0017337666919430789, 'batch_size': 64}. Best is trial 72 with value: 11.985789281995453.
Trial 132 finished with value: 19.70348128154943 and parameters: {'input_dropout': 0.0, 'hidden_layers': 8, 'hidden_units': 224, 'kernel_initializer': 'he_uniform', 'hidden_activation': 'leaky_relu', 'hidden_dropout': 0.0, 'batch_norm': 'off', 'optimizer_type': 'adam', 'optimizer_lr': 0.0021568892508504606, 'batch_size': 64}. Best is trial 72 with value: 11.985789281995453.
Trial 133 finished with value: 16.416993427831315 and parameters: {'input_dropout': 0.0, 'hidden_layers': 7, 'hidden_units': 160, 'kernel_initializer': 'he_uniform', 'hidden_activation': 'leaky_relu', 'hidden_dropout': 0.0, 'batch_norm': 'off', 'optimizer_type': 'adam', 'optimizer_lr': 0.00139090825389637, 'batch_size': 64}. Best is trial 72 with value: 11.985789281995453.
Trial 134 finished with value: 22.373684962483807 and parameters: {'input_dropout': 0.0, 'hidden_layers': 7, 'hidden_units': 224, 'kernel_initializer': 'he_uniform', 'hidden_activation': 'leaky_relu', 'hidden_dropout': 0.0, 'batch_norm': 'off', 'optimizer_type': 'adam', 'optimizer_lr': 0.0012373484686784666, 'batch_size': 64}. Best is trial 72 with value: 11.985789281995453.
Trial 135 finished with value: 14.237219107677323 and parameters: {'input_dropout': 0.0, 'hidden_layers': 10, 'hidden_units': 256, 'kernel_initializer': 'he_uniform', 'hidden_activation': 'leaky_relu', 'hidden_dropout': 0.0, 'batch_norm': 'off', 'optimizer_type': 'adam', 'optimizer_lr': 0.0018675738973165346, 'batch_size': 64}. Best is trial 72 with value: 11.985789281995453.
Trial 136 finished with value: 14.845676670966382 and parameters: {'input_dropout': 0.0, 'hidden_layers': 10, 'hidden_units': 256, 'kernel_initializer': 'he_uniform', 'hidden_activation': 'leaky_relu', 'hidden_dropout': 0.0, 'batch_norm': 'off', 'optimizer_type': 'adam', 'optimizer_lr': 0.00247302112863695, 'batch_size': 64}. Best is trial 72 with value: 11.985789281995453.
Trial 137 finished with value: 18.71400185484621 and parameters: {'input_dropout': 0.0, 'hidden_layers': 10, 'hidden_units': 256, 'kernel_initializer': 'he_uniform', 'hidden_activation': 'leaky_relu', 'hidden_dropout': 0.0, 'batch_norm': 'off', 'optimizer_type': 'adam', 'optimizer_lr': 0.002424861355513824, 'batch_size': 64}. Best is trial 72 with value: 11.985789281995453.
Trial 138 finished with value: 16.61049980907745 and parameters: {'input_dropout': 0.0, 'hidden_layers': 10, 'hidden_units': 256, 'kernel_initializer': 'he_uniform', 'hidden_activation': 'leaky_relu', 'hidden_dropout': 0.0, 'batch_norm': 'off', 'optimizer_type': 'adam', 'optimizer_lr': 0.003217963903564377, 'batch_size': 64}. Best is trial 72 with value: 11.985789281995453.
Trial 139 finished with value: 178.59850933795047 and parameters: {'input_dropout': 0.0, 'hidden_layers': 10, 'hidden_units': 256, 'kernel_initializer': 'he_uniform', 'hidden_activation': 'leaky_relu', 'hidden_dropout': 0.0, 'batch_norm': 'off', 'optimizer_type': 'rmsprop', 'optimizer_lr': 0.002757391716150473, 'batch_size': 64}. Best is trial 72 with value: 11.985789281995453.
Trial 140 finished with value: 16.408579225600274 and parameters: {'input_dropout': 0.0, 'hidden_layers': 10, 'hidden_units': 256, 'kernel_initializer': 'he_uniform', 'hidden_activation': 'leaky_relu', 'hidden_dropout': 0.0, 'batch_norm': 'off', 'optimizer_type': 'adam', 'optimizer_lr': 0.0019923964525545056, 'batch_size': 64}. Best is trial 72 with value: 11.985789281995453.
Trial 141 finished with value: 17.92616778374455 and parameters: {'input_dropout': 0.0, 'hidden_layers': 9, 'hidden_units': 256, 'kernel_initializer': 'he_uniform', 'hidden_activation': 'leaky_relu', 'hidden_dropout': 0.0, 'batch_norm': 'off', 'optimizer_type': 'adam', 'optimizer_lr': 0.0016095241094511742, 'batch_size': 64}. Best is trial 72 with value: 11.985789281995453.
Trial 142 finished with value: 15.785792804090812 and parameters: {'input_dropout': 0.0, 'hidden_layers': 10, 'hidden_units': 256, 'kernel_initializer': 'he_uniform', 'hidden_activation': 'leaky_relu', 'hidden_dropout': 0.0, 'batch_norm': 'off', 'optimizer_type': 'adam', 'optimizer_lr': 0.0010239608547104632, 'batch_size': 64}. Best is trial 72 with value: 11.985789281995453.
Trial 143 finished with value: 13.642205150833574 and parameters: {'input_dropout': 0.0, 'hidden_layers': 10, 'hidden_units': 256, 'kernel_initializer': 'he_uniform', 'hidden_activation': 'leaky_relu', 'hidden_dropout': 0.0, 'batch_norm': 'off', 'optimizer_type': 'adam', 'optimizer_lr': 0.0022595389114143617, 'batch_size': 64}. Best is trial 72 with value: 11.985789281995453.
Trial 144 finished with value: 21.6790909317699 and parameters: {'input_dropout': 0.0, 'hidden_layers': 10, 'hidden_units': 256, 'kernel_initializer': 'he_uniform', 'hidden_activation': 'leaky_relu', 'hidden_dropout': 0.0, 'batch_norm': 'off', 'optimizer_type': 'adam', 'optimizer_lr': 0.0022382168201612734, 'batch_size': 64}. Best is trial 72 with value: 11.985789281995453.
Trial 145 finished with value: 17.795086088504704 and parameters: {'input_dropout': 0.0, 'hidden_layers': 10, 'hidden_units': 256, 'kernel_initializer': 'he_uniform', 'hidden_activation': 'leaky_relu', 'hidden_dropout': 0.0, 'batch_norm': 'off', 'optimizer_type': 'adam', 'optimizer_lr': 0.0017824902785479556, 'batch_size': 64}. Best is trial 72 with value: 11.985789281995453.
Trial 146 finished with value: 14.884691506299374 and parameters: {'input_dropout': 0.0, 'hidden_layers': 6, 'hidden_units': 256, 'kernel_initializer': 'he_uniform', 'hidden_activation': 'leaky_relu', 'hidden_dropout': 0.0, 'batch_norm': 'off', 'optimizer_type': 'adam', 'optimizer_lr': 0.0013852356231470258, 'batch_size': 64}. Best is trial 72 with value: 11.985789281995453.
Trial 147 finished with value: 20.136508199794083 and parameters: {'input_dropout': 0.0, 'hidden_layers': 10, 'hidden_units': 256, 'kernel_initializer': 'he_uniform', 'hidden_activation': 'prelu', 'hidden_dropout': 0.0, 'batch_norm': 'off', 'optimizer_type': 'adam', 'optimizer_lr': 0.0024296017821364025, 'batch_size': 64}. Best is trial 72 with value: 11.985789281995453.
Trial 148 finished with value: 21.474823414262882 and parameters: {'input_dropout': 0.0, 'hidden_layers': 6, 'hidden_units': 256, 'kernel_initializer': 'he_uniform', 'hidden_activation': 'leaky_relu', 'hidden_dropout': 0.0, 'batch_norm': 'off', 'optimizer_type': 'adam', 'optimizer_lr': 0.0029087898269540527, 'batch_size': 64}. Best is trial 72 with value: 11.985789281995453.
Trial 149 finished with value: 292.1322809298551 and parameters: {'input_dropout': 0.0, 'hidden_layers': 7, 'hidden_units': 256, 'kernel_initializer': 'he_uniform', 'hidden_activation': 'leaky_relu', 'hidden_dropout': 0.15000000000000002, 'batch_norm': 'off', 'optimizer_type': 'adam', 'optimizer_lr': 0.001973804236174525, 'batch_size': 64}. Best is trial 72 with value: 11.985789281995453.
Trial 150 finished with value: 71.92824561580156 and parameters: {'input_dropout': 0.0, 'hidden_layers': 10, 'hidden_units': 256, 'kernel_initializer': 'random_normal', 'hidden_activation': 'leaky_relu', 'hidden_dropout': 0.0, 'batch_norm': 'on', 'optimizer_type': 'adam', 'optimizer_lr': 0.0016635367019251536, 'batch_size': 64}. Best is trial 72 with value: 11.985789281995453.
Trial 151 finished with value: 14.731597997579097 and parameters: {'input_dropout': 0.0, 'hidden_layers': 6, 'hidden_units': 256, 'kernel_initializer': 'he_uniform', 'hidden_activation': 'leaky_relu', 'hidden_dropout': 0.0, 'batch_norm': 'off', 'optimizer_type': 'adam', 'optimizer_lr': 0.0014667451827274638, 'batch_size': 64}. Best is trial 72 with value: 11.985789281995453.
Trial 152 finished with value: 13.799685975408241 and parameters: {'input_dropout': 0.0, 'hidden_layers': 6, 'hidden_units': 256, 'kernel_initializer': 'he_uniform', 'hidden_activation': 'leaky_relu', 'hidden_dropout': 0.0, 'batch_norm': 'off', 'optimizer_type': 'adam', 'optimizer_lr': 0.0012999621721170595, 'batch_size': 64}. Best is trial 72 with value: 11.985789281995453.
Trial 153 finished with value: 15.070371975835597 and parameters: {'input_dropout': 0.0, 'hidden_layers': 6, 'hidden_units': 256, 'kernel_initializer': 'he_uniform', 'hidden_activation': 'leaky_relu', 'hidden_dropout': 0.0, 'batch_norm': 'off', 'optimizer_type': 'adam', 'optimizer_lr': 0.0012482936908300112, 'batch_size': 64}. Best is trial 72 with value: 11.985789281995453.
Trial 154 finished with value: 12.54963251438901 and parameters: {'input_dropout': 0.0, 'hidden_layers': 6, 'hidden_units': 256, 'kernel_initializer': 'he_uniform', 'hidden_activation': 'leaky_relu', 'hidden_dropout': 0.0, 'batch_norm': 'off', 'optimizer_type': 'adam', 'optimizer_lr': 0.0014542848363335917, 'batch_size': 64}. Best is trial 72 with value: 11.985789281995453.
Trial 155 finished with value: 21.079998523472124 and parameters: {'input_dropout': 0.0, 'hidden_layers': 6, 'hidden_units': 224, 'kernel_initializer': 'he_uniform', 'hidden_activation': 'leaky_relu', 'hidden_dropout': 0.0, 'batch_norm': 'off', 'optimizer_type': 'adam', 'optimizer_lr': 0.001358853505871259, 'batch_size': 64}. Best is trial 72 with value: 11.985789281995453.
Trial 156 finished with value: 14.48437331686653 and parameters: {'input_dropout': 0.0, 'hidden_layers': 6, 'hidden_units': 160, 'kernel_initializer': 'he_normal', 'hidden_activation': 'leaky_relu', 'hidden_dropout': 0.0, 'batch_norm': 'off', 'optimizer_type': 'adam', 'optimizer_lr': 0.000914862538181842, 'batch_size': 64}. Best is trial 72 with value: 11.985789281995453.
Trial 157 finished with value: 983.3809919384468 and parameters: {'input_dropout': 0.0, 'hidden_layers': 6, 'hidden_units': 160, 'kernel_initializer': 'he_normal', 'hidden_activation': 'leaky_relu', 'hidden_dropout': 0.3, 'batch_norm': 'off', 'optimizer_type': 'adam', 'optimizer_lr': 0.000885029589122681, 'batch_size': 64}. Best is trial 72 with value: 11.985789281995453.
Trial 158 finished with value: 17.692847274448688 and parameters: {'input_dropout': 0.0, 'hidden_layers': 6, 'hidden_units': 160, 'kernel_initializer': 'he_normal', 'hidden_activation': 'relu', 'hidden_dropout': 0.0, 'batch_norm': 'off', 'optimizer_type': 'adam', 'optimizer_lr': 0.00067559002347936, 'batch_size': 64}. Best is trial 72 with value: 11.985789281995453.
Trial 159 finished with value: 35.07972846525154 and parameters: {'input_dropout': 0.0, 'hidden_layers': 6, 'hidden_units': 160, 'kernel_initializer': 'he_normal', 'hidden_activation': 'leaky_relu', 'hidden_dropout': 0.0, 'batch_norm': 'off', 'optimizer_type': 'adam', 'optimizer_lr': 0.001156651644910001, 'batch_size': 64}. Best is trial 72 with value: 11.985789281995453.
Trial 160 finished with value: 21.076523107055966 and parameters: {'input_dropout': 0.0, 'hidden_layers': 6, 'hidden_units': 128, 'kernel_initializer': 'he_normal', 'hidden_activation': 'leaky_relu', 'hidden_dropout': 0.0, 'batch_norm': 'off', 'optimizer_type': 'adam', 'optimizer_lr': 0.000970958793330292, 'batch_size': 64}. Best is trial 72 with value: 11.985789281995453.
Trial 161 finished with value: 18.83849173089334 and parameters: {'input_dropout': 0.0, 'hidden_layers': 6, 'hidden_units': 160, 'kernel_initializer': 'he_normal', 'hidden_activation': 'leaky_relu', 'hidden_dropout': 0.0, 'batch_norm': 'off', 'optimizer_type': 'adam', 'optimizer_lr': 0.0016229553851586083, 'batch_size': 64}. Best is trial 72 with value: 11.985789281995453.
Trial 162 finished with value: 20.373367090110417 and parameters: {'input_dropout': 0.0, 'hidden_layers': 6, 'hidden_units': 256, 'kernel_initializer': 'he_uniform', 'hidden_activation': 'leaky_relu', 'hidden_dropout': 0.0, 'batch_norm': 'off', 'optimizer_type': 'adam', 'optimizer_lr': 0.0013865357652333458, 'batch_size': 64}. Best is trial 72 with value: 11.985789281995453.
Trial 163 finished with value: 13.653376877625261 and parameters: {'input_dropout': 0.0, 'hidden_layers': 6, 'hidden_units': 192, 'kernel_initializer': 'he_uniform', 'hidden_activation': 'leaky_relu', 'hidden_dropout': 0.0, 'batch_norm': 'off', 'optimizer_type': 'adam', 'optimizer_lr': 0.001989425436675158, 'batch_size': 64}. Best is trial 72 with value: 11.985789281995453.
Trial 164 finished with value: 17.076925782310262 and parameters: {'input_dropout': 0.0, 'hidden_layers': 6, 'hidden_units': 192, 'kernel_initializer': 'he_uniform', 'hidden_activation': 'leaky_relu', 'hidden_dropout': 0.0, 'batch_norm': 'off', 'optimizer_type': 'adam', 'optimizer_lr': 0.001952968762500464, 'batch_size': 64}. Best is trial 72 with value: 11.985789281995453.
Trial 165 finished with value: 32.161514753410025 and parameters: {'input_dropout': 0.0, 'hidden_layers': 6, 'hidden_units': 192, 'kernel_initializer': 'he_uniform', 'hidden_activation': 'leaky_relu', 'hidden_dropout': 0.0, 'batch_norm': 'off', 'optimizer_type': 'adam', 'optimizer_lr': 0.0018078945346683302, 'batch_size': 64}. Best is trial 72 with value: 11.985789281995453.
Trial 166 finished with value: 242.02384297745076 and parameters: {'input_dropout': 0.0, 'hidden_layers': 6, 'hidden_units': 192, 'kernel_initializer': 'he_uniform', 'hidden_activation': 'leaky_relu', 'hidden_dropout': 0.0, 'batch_norm': 'off', 'optimizer_type': 'adam', 'optimizer_lr': 1.6513832241592728e-05, 'batch_size': 64}. Best is trial 72 with value: 11.985789281995453.
Trial 167 finished with value: 78.233358433857 and parameters: {'input_dropout': 0.0, 'hidden_layers': 6, 'hidden_units': 160, 'kernel_initializer': 'he_uniform', 'hidden_activation': 'leaky_relu', 'hidden_dropout': 0.0, 'batch_norm': 'off', 'optimizer_type': 'rmsprop', 'optimizer_lr': 0.0012518631303239825, 'batch_size': 64}. Best is trial 72 with value: 11.985789281995453.
Trial 168 finished with value: 16.07257531884777 and parameters: {'input_dropout': 0.0, 'hidden_layers': 7, 'hidden_units': 192, 'kernel_initializer': 'he_uniform', 'hidden_activation': 'leaky_relu', 'hidden_dropout': 0.0, 'batch_norm': 'off', 'optimizer_type': 'adam', 'optimizer_lr': 0.0011385915705245113, 'batch_size': 64}. Best is trial 72 with value: 11.985789281995453.
Trial 169 finished with value: 13.960597096938825 and parameters: {'input_dropout': 0.0, 'hidden_layers': 6, 'hidden_units': 224, 'kernel_initializer': 'he_uniform', 'hidden_activation': 'leaky_relu', 'hidden_dropout': 0.0, 'batch_norm': 'off', 'optimizer_type': 'adam', 'optimizer_lr': 0.0021201196490095936, 'batch_size': 64}. Best is trial 72 with value: 11.985789281995453.
Trial 170 finished with value: 21.444156871600423 and parameters: {'input_dropout': 0.0, 'hidden_layers': 6, 'hidden_units': 192, 'kernel_initializer': 'he_normal', 'hidden_activation': 'leaky_relu', 'hidden_dropout': 0.0, 'batch_norm': 'off', 'optimizer_type': 'adam', 'optimizer_lr': 0.002200289732746096, 'batch_size': 64}. Best is trial 72 with value: 11.985789281995453.
Trial 171 finished with value: 18.661824797347496 and parameters: {'input_dropout': 0.0, 'hidden_layers': 6, 'hidden_units': 224, 'kernel_initializer': 'he_uniform', 'hidden_activation': 'leaky_relu', 'hidden_dropout': 0.0, 'batch_norm': 'off', 'optimizer_type': 'adam', 'optimizer_lr': 0.0017009726771712935, 'batch_size': 64}. Best is trial 72 with value: 11.985789281995453.
Trial 172 finished with value: 25.160928977381328 and parameters: {'input_dropout': 0.0, 'hidden_layers': 6, 'hidden_units': 224, 'kernel_initializer': 'he_uniform', 'hidden_activation': 'leaky_relu', 'hidden_dropout': 0.0, 'batch_norm': 'off', 'optimizer_type': 'adam', 'optimizer_lr': 0.0021570478437420485, 'batch_size': 64}. Best is trial 72 with value: 11.985789281995453.
Trial 173 finished with value: 15.244392320961019 and parameters: {'input_dropout': 0.0, 'hidden_layers': 6, 'hidden_units': 224, 'kernel_initializer': 'he_uniform', 'hidden_activation': 'leaky_relu', 'hidden_dropout': 0.0, 'batch_norm': 'off', 'optimizer_type': 'adam', 'optimizer_lr': 0.0015081833464912887, 'batch_size': 64}. Best is trial 72 with value: 11.985789281995453.
