A new study created in RDB with name: SVR_52934
Trial 15 finished with value: 0.32914146066621913 and parameters: {'kernel': 'poly', 'l1_ratio': 0.9083813884007501}. Best is trial 13 with value: 0.7757848941562363.
Trial 1 finished with value: 0.42458892785305924 and parameters: {'kernel': 'sigmoid', 'l1_ratio': 0.8640686102574682}. Best is trial 13 with value: 0.7757848941562363.
Trial 16 finished with value: 0.42460003027766363 and parameters: {'kernel': 'sigmoid', 'l1_ratio': 0.6401834548166027}. Best is trial 13 with value: 0.7757848941562363.
Trial 10 finished with value: 0.42497220548473447 and parameters: {'kernel': 'sigmoid', 'l1_ratio': 0.10212016774151589}. Best is trial 13 with value: 0.7757848941562363.
Trial 17 finished with value: 0.7760381262220865 and parameters: {'kernel': 'linear', 'l1_ratio': 0.6127187277199883}. Best is trial 17 with value: 0.7760381262220865.
Trial 7 finished with value: 0.350907390701914 and parameters: {'kernel': 'rbf', 'l1_ratio': 0.26515827078773935}. Best is trial 17 with value: 0.7760381262220865.
Trial 2 finished with value: 0.4247128297532818 and parameters: {'kernel': 'sigmoid', 'l1_ratio': 0.3483742128419812}. Best is trial 17 with value: 0.7760381262220865.
Trial 4 finished with value: 0.35167215933464213 and parameters: {'kernel': 'rbf', 'l1_ratio': 0.47121101929703413}. Best is trial 17 with value: 0.7760381262220865.
Trial 9 finished with value: 0.352018270033417 and parameters: {'kernel': 'rbf', 'l1_ratio': 0.5543314578416313}. Best is trial 17 with value: 0.7760381262220865.
Trial 3 finished with value: 0.3293547512858152 and parameters: {'kernel': 'poly', 'l1_ratio': 0.750532891642391}. Best is trial 17 with value: 0.7760381262220865.
Trial 12 finished with value: 0.7753766764264605 and parameters: {'kernel': 'linear', 'l1_ratio': 0.9326480315605954}. Best is trial 17 with value: 0.7760381262220865.
Trial 8 finished with value: 0.3528358746709245 and parameters: {'kernel': 'rbf', 'l1_ratio': 0.7388971666789818}. Best is trial 17 with value: 0.7760381262220865.
Trial 0 finished with value: 0.3296206190425913 and parameters: {'kernel': 'poly', 'l1_ratio': 0.5347227706465538}. Best is trial 17 with value: 0.7760381262220865.
Trial 13 finished with value: 0.7757848941562363 and parameters: {'kernel': 'linear', 'l1_ratio': 0.4613613787542885}. Best is trial 17 with value: 0.7760381262220865.
Trial 11 finished with value: 0.4244556579901593 and parameters: {'kernel': 'sigmoid', 'l1_ratio': 0.902768972174753}. Best is trial 20 with value: 0.7766133825625564.
Trial 6 finished with value: 0.7760191216472508 and parameters: {'kernel': 'linear', 'l1_ratio': 0.5812482042371012}. Best is trial 20 with value: 0.7766133825625564.
Trial 5 finished with value: 0.32998688261474 and parameters: {'kernel': 'poly', 'l1_ratio': 0.1809005786104808}. Best is trial 20 with value: 0.7766133825625564.
Trial 14 finished with value: 0.7765621767168467 and parameters: {'kernel': 'linear', 'l1_ratio': 0.23534270000765556}. Best is trial 20 with value: 0.7766133825625564.
Trial 18 finished with value: 0.7757393442089742 and parameters: {'kernel': 'linear', 'l1_ratio': 0.4758642905862246}. Best is trial 20 with value: 0.7766133825625564.
Trial 20 finished with value: 0.7766133825625564 and parameters: {'kernel': 'linear', 'l1_ratio': 0.08909868727026715}. Best is trial 20 with value: 0.7766133825625564.
Trial 21 finished with value: 0.776418991394162 and parameters: {'kernel': 'linear', 'l1_ratio': 0.34158561113667885}. Best is trial 20 with value: 0.7766133825625564.
Trial 22 finished with value: 0.424375706959509 and parameters: {'kernel': 'sigmoid', 'l1_ratio': 0.5573344954188744}. Best is trial 20 with value: 0.7766133825625564.
Trial 24 finished with value: 0.7766078956672818 and parameters: {'kernel': 'linear', 'l1_ratio': 0.18335745993236507}. Best is trial 20 with value: 0.7766133825625564.
Trial 23 finished with value: 0.35119115937604317 and parameters: {'kernel': 'rbf', 'l1_ratio': 0.3651048439192299}. Best is trial 20 with value: 0.7766133825625564.
Trial 29 finished with value: 0.7759515656867091 and parameters: {'kernel': 'linear', 'l1_ratio': 0.5617977432577685}. Best is trial 20 with value: 0.7766133825625564.
Trial 25 finished with value: 0.7766048467152251 and parameters: {'kernel': 'linear', 'l1_ratio': 0.036417136821996765}. Best is trial 35 with value: 0.7766398380163929.
Trial 19 finished with value: 0.35068642650462256 and parameters: {'kernel': 'rbf', 'l1_ratio': 0.18664190162322047}. Best is trial 20 with value: 0.7766133825625564.
Trial 35 finished with value: 0.7766398380163929 and parameters: {'kernel': 'linear', 'l1_ratio': 0.09503885771586496}. Best is trial 35 with value: 0.7766398380163929.
Trial 28 finished with value: 0.42489530137647896 and parameters: {'kernel': 'sigmoid', 'l1_ratio': 0.025843824865884657}. Best is trial 35 with value: 0.7766398380163929.
Trial 26 finished with value: 0.32966986725741154 and parameters: {'kernel': 'poly', 'l1_ratio': 0.5135066939676}. Best is trial 35 with value: 0.7766398380163929.
Trial 33 finished with value: 0.32936174637851096 and parameters: {'kernel': 'poly', 'l1_ratio': 0.7425693373947709}. Best is trial 35 with value: 0.7766398380163929.
Trial 31 finished with value: 0.32976210208866963 and parameters: {'kernel': 'poly', 'l1_ratio': 0.4592424862146045}. Best is trial 35 with value: 0.7766398380163929.
Trial 32 finished with value: 0.4248927939796811 and parameters: {'kernel': 'sigmoid', 'l1_ratio': 0.26097533572945786}. Best is trial 35 with value: 0.7766398380163929.
Trial 38 finished with value: 0.32916482304165795 and parameters: {'kernel': 'poly', 'l1_ratio': 0.8812557212938106}. Best is trial 35 with value: 0.7766398380163929.
Trial 34 finished with value: 0.42481951264116 and parameters: {'kernel': 'sigmoid', 'l1_ratio': 0.29353048841184903}. Best is trial 35 with value: 0.7766398380163929.
Trial 30 finished with value: 0.35123099470396746 and parameters: {'kernel': 'rbf', 'l1_ratio': 0.3744042928804232}. Best is trial 35 with value: 0.7766398380163929.
Trial 27 finished with value: 0.776035525556537 and parameters: {'kernel': 'linear', 'l1_ratio': 0.7025580648013711}. Best is trial 35 with value: 0.7766398380163929.
Trial 36 finished with value: 0.4243858061990876 and parameters: {'kernel': 'sigmoid', 'l1_ratio': 0.5070001673643282}. Best is trial 35 with value: 0.7766398380163929.
Trial 40 finished with value: 0.7765902066445647 and parameters: {'kernel': 'linear', 'l1_ratio': 0.021522957439580215}. Best is trial 35 with value: 0.7766398380163929.
Trial 37 finished with value: 0.4246772101571926 and parameters: {'kernel': 'sigmoid', 'l1_ratio': 0.7944047057151422}. Best is trial 35 with value: 0.7766398380163929.
Trial 39 finished with value: 0.3298581275894491 and parameters: {'kernel': 'poly', 'l1_ratio': 0.3645442850766156}. Best is trial 35 with value: 0.7766398380163929.
