Trial 132 finished with value: 0.42409150180984356 and parameters: {'kernel': 'sigmoid', 'epsilon': 0.9804461619396322}. Best is trial 77 with value: 0.7766938646263746.
Trial 136 finished with value: 0.4244020423306326 and parameters: {'kernel': 'sigmoid', 'epsilon': 0.4785066159248531}. Best is trial 77 with value: 0.7766938646263746.
Trial 134 finished with value: 0.32926523116771167 and parameters: {'kernel': 'poly', 'epsilon': 0.819172304961016}. Best is trial 77 with value: 0.7766938646263746.
Trial 139 finished with value: 0.7765900012509026 and parameters: {'kernel': 'linear', 'epsilon': 0.14868673780759123}. Best is trial 77 with value: 0.7766938646263746.
Trial 128 finished with value: 0.4246700010740846 and parameters: {'kernel': 'sigmoid', 'epsilon': 0.8088037319115228}. Best is trial 77 with value: 0.7766938646263746.
Trial 135 finished with value: 0.424608429886281 and parameters: {'kernel': 'sigmoid', 'epsilon': 0.3742593795396316}. Best is trial 77 with value: 0.7766938646263746.
Trial 140 finished with value: 0.42440267374523905 and parameters: {'kernel': 'sigmoid', 'epsilon': 0.5195138729425574}. Best is trial 77 with value: 0.7766938646263746.
Trial 138 finished with value: 0.3534509253975105 and parameters: {'kernel': 'rbf', 'epsilon': 0.9280960131798536}. Best is trial 77 with value: 0.7766938646263746.
Trial 137 finished with value: 0.42437930767314685 and parameters: {'kernel': 'sigmoid', 'epsilon': 0.48732509799534707}. Best is trial 77 with value: 0.7766938646263746.
Trial 146 finished with value: 0.3292589098962125 and parameters: {'kernel': 'poly', 'epsilon': 0.823469458574518}. Best is trial 77 with value: 0.7766938646263746.
Trial 145 finished with value: 0.35262103697140923 and parameters: {'kernel': 'rbf', 'epsilon': 0.6857174215895475}. Best is trial 77 with value: 0.7766938646263746.
Trial 141 finished with value: 0.3526324540412286 and parameters: {'kernel': 'rbf', 'epsilon': 0.6887544917529592}. Best is trial 77 with value: 0.7766938646263746.
Trial 143 finished with value: 0.3291174738561709 and parameters: {'kernel': 'poly', 'epsilon': 0.9296375645016571}. Best is trial 77 with value: 0.7766938646263746.
Trial 150 finished with value: 0.3524204883202636 and parameters: {'kernel': 'rbf', 'epsilon': 0.6405086141502274}. Best is trial 77 with value: 0.7766938646263746.
Trial 147 finished with value: 0.32929842009396737 and parameters: {'kernel': 'poly', 'epsilon': 0.7993693814955157}. Best is trial 77 with value: 0.7766938646263746.
Trial 144 finished with value: 0.4244775622074545 and parameters: {'kernel': 'sigmoid', 'epsilon': 0.9286035244791463}. Best is trial 77 with value: 0.7766938646263746.
Trial 142 finished with value: 0.3512990268747739 and parameters: {'kernel': 'rbf', 'epsilon': 0.3908179053519736}. Best is trial 77 with value: 0.7766938646263746.
Trial 154 finished with value: 0.35083863852596825 and parameters: {'kernel': 'rbf', 'epsilon': 0.2405550103503128}. Best is trial 77 with value: 0.7766938646263746.
Trial 152 finished with value: 0.7763262706174913 and parameters: {'kernel': 'linear', 'epsilon': 0.3579685637501182}. Best is trial 77 with value: 0.7766938646263746.
Trial 148 finished with value: 0.7759078209316981 and parameters: {'kernel': 'linear', 'epsilon': 0.5503113446712684}. Best is trial 77 with value: 0.7766938646263746.
Trial 149 finished with value: 0.3291141314582809 and parameters: {'kernel': 'poly', 'epsilon': 0.9323769823757245}. Best is trial 77 with value: 0.7766938646263746.
Trial 151 finished with value: 0.3513961497890532 and parameters: {'kernel': 'rbf', 'epsilon': 0.4182862020727477}. Best is trial 77 with value: 0.7766938646263746.
Trial 155 finished with value: 0.7759046862449855 and parameters: {'kernel': 'linear', 'epsilon': 0.7894651292175783}. Best is trial 77 with value: 0.7766938646263746.
Trial 158 finished with value: 0.7760229784923768 and parameters: {'kernel': 'linear', 'epsilon': 0.5831041090070066}. Best is trial 77 with value: 0.7766938646263746.
Trial 157 finished with value: 0.3528617390422313 and parameters: {'kernel': 'rbf', 'epsilon': 0.7467073698706563}. Best is trial 77 with value: 0.7766938646263746.
Trial 153 finished with value: 0.42457781588762744 and parameters: {'kernel': 'sigmoid', 'epsilon': 0.8683511643233088}. Best is trial 77 with value: 0.7766938646263746.
Trial 161 finished with value: 0.4247539880811124 and parameters: {'kernel': 'sigmoid', 'epsilon': 0.7445174341102678}. Best is trial 77 with value: 0.7766938646263746.
Trial 160 finished with value: 0.4247888439859481 and parameters: {'kernel': 'sigmoid', 'epsilon': 0.7240529859907858}. Best is trial 77 with value: 0.7766938646263746.
Trial 166 finished with value: 0.42466210294685947 and parameters: {'kernel': 'sigmoid', 'epsilon': 0.8172438028382181}. Best is trial 77 with value: 0.7766938646263746.
Trial 165 finished with value: 0.42472034461874336 and parameters: {'kernel': 'sigmoid', 'epsilon': 0.7585165110415223}. Best is trial 77 with value: 0.7766938646263746.
Trial 163 finished with value: 0.35277617746370815 and parameters: {'kernel': 'rbf', 'epsilon': 0.7239330402609735}. Best is trial 77 with value: 0.7766938646263746.
Trial 156 finished with value: 0.42448846940122664 and parameters: {'kernel': 'sigmoid', 'epsilon': 0.9266210580233744}. Best is trial 77 with value: 0.7766938646263746.
Trial 159 finished with value: 0.42500466822869976 and parameters: {'kernel': 'sigmoid', 'epsilon': 0.14445081189848352}. Best is trial 77 with value: 0.7766938646263746.
Trial 164 finished with value: 0.42492899221775104 and parameters: {'kernel': 'sigmoid', 'epsilon': 0.242057061329509}. Best is trial 77 with value: 0.7766938646263746.
Trial 171 finished with value: 0.42499922681370783 and parameters: {'kernel': 'sigmoid', 'epsilon': 0.13544902165207118}. Best is trial 77 with value: 0.7766938646263746.
Trial 162 finished with value: 0.4250411266375037 and parameters: {'kernel': 'sigmoid', 'epsilon': 0.16309557245367323}. Best is trial 77 with value: 0.7766938646263746.
Trial 175 finished with value: 0.3519444965443824 and parameters: {'kernel': 'rbf', 'epsilon': 0.5376018938067482}. Best is trial 77 with value: 0.7766938646263746.
Trial 167 finished with value: 0.42431083982186113 and parameters: {'kernel': 'sigmoid', 'epsilon': 0.9546369817153353}. Best is trial 77 with value: 0.7766938646263746.
Trial 168 finished with value: 0.3299126364829144 and parameters: {'kernel': 'poly', 'epsilon': 0.3096212169430268}. Best is trial 77 with value: 0.7766938646263746.
Trial 179 finished with value: 0.3535462797858269 and parameters: {'kernel': 'rbf', 'epsilon': 0.9600589001953125}. Best is trial 77 with value: 0.7766938646263746.
Trial 177 finished with value: 0.3510161966875517 and parameters: {'kernel': 'rbf', 'epsilon': 0.31498428652730814}. Best is trial 77 with value: 0.7766938646263746.
Trial 172 finished with value: 0.7761560022508522 and parameters: {'kernel': 'linear', 'epsilon': 0.4002159962177442}. Best is trial 77 with value: 0.7766938646263746.
Trial 170 finished with value: 0.7762185375860025 and parameters: {'kernel': 'linear', 'epsilon': 0.37545156292910564}. Best is trial 77 with value: 0.7766938646263746.
Trial 178 finished with value: 0.32961114164531635 and parameters: {'kernel': 'poly', 'epsilon': 0.5386362752283709}. Best is trial 77 with value: 0.7766938646263746.
Trial 174 finished with value: 0.42466041318942677 and parameters: {'kernel': 'sigmoid', 'epsilon': 0.8232841837313116}. Best is trial 77 with value: 0.7766938646263746.
Trial 169 finished with value: 0.32994085392426836 and parameters: {'kernel': 'poly', 'epsilon': 0.2462610194118916}. Best is trial 77 with value: 0.7766938646263746.
Trial 180 finished with value: 0.4247078281295452 and parameters: {'kernel': 'sigmoid', 'epsilon': 0.781169562749468}. Best is trial 77 with value: 0.7766938646263746.
Trial 173 finished with value: 0.42479492124384244 and parameters: {'kernel': 'sigmoid', 'epsilon': 0.7150428133043983}. Best is trial 77 with value: 0.7766938646263746.
Trial 183 finished with value: 0.35193329984027016 and parameters: {'kernel': 'rbf', 'epsilon': 0.5347761197935357}. Best is trial 77 with value: 0.7766938646263746.
Trial 176 finished with value: 0.7766021808795909 and parameters: {'kernel': 'linear', 'epsilon': 0.02424784837314531}. Best is trial 77 with value: 0.7766938646263746.
Trial 185 finished with value: 0.7766377479371067 and parameters: {'kernel': 'linear', 'epsilon': 0.2961213097250911}. Best is trial 77 with value: 0.7766938646263746.
Trial 181 finished with value: 0.42443901699066344 and parameters: {'kernel': 'sigmoid', 'epsilon': 0.5927815739720669}. Best is trial 77 with value: 0.7766938646263746.
Trial 182 finished with value: 0.77571995627016 and parameters: {'kernel': 'linear', 'epsilon': 0.48592882998512843}. Best is trial 77 with value: 0.7766938646263746.
Trial 189 finished with value: 0.35085412251487813 and parameters: {'kernel': 'rbf', 'epsilon': 0.2466284359256784}. Best is trial 77 with value: 0.7766938646263746.
Trial 187 finished with value: 0.3299640735520343 and parameters: {'kernel': 'poly', 'epsilon': 0.22226958892075943}. Best is trial 77 with value: 0.7766938646263746.
Trial 191 finished with value: 0.3527424517780398 and parameters: {'kernel': 'rbf', 'epsilon': 0.7153700329275972}. Best is trial 77 with value: 0.7766938646263746.
Trial 188 finished with value: 0.42479638667776853 and parameters: {'kernel': 'sigmoid', 'epsilon': 0.3111129314419008}. Best is trial 77 with value: 0.7766938646263746.
Trial 190 finished with value: 0.3508864352175978 and parameters: {'kernel': 'rbf', 'epsilon': 0.2580131795788052}. Best is trial 77 with value: 0.7766938646263746.
Trial 193 finished with value: 0.3290141631944271 and parameters: {'kernel': 'poly', 'epsilon': 0.986965885245646}. Best is trial 196 with value: 0.7767177771476403.
Trial 194 finished with value: 0.42486433661923295 and parameters: {'kernel': 'sigmoid', 'epsilon': 0.27596782598300695}. Best is trial 196 with value: 0.7767177771476403.
Trial 195 finished with value: 0.35084582495552064 and parameters: {'kernel': 'rbf', 'epsilon': 0.2437570281901681}. Best is trial 196 with value: 0.7767177771476403.
Trial 198 finished with value: 0.3296750515760697 and parameters: {'kernel': 'poly', 'epsilon': 0.5110415377613311}. Best is trial 196 with value: 0.7767177771476403.
Trial 199 finished with value: 0.7766231682261739 and parameters: {'kernel': 'linear', 'epsilon': 0.20675972264136544}. Best is trial 196 with value: 0.7767177771476403.
Trial 186 finished with value: 0.35177568960504035 and parameters: {'kernel': 'rbf', 'epsilon': 0.49486244816949554}. Best is trial 196 with value: 0.7767177771476403.
Trial 196 finished with value: 0.7767177771476403 and parameters: {'kernel': 'linear', 'epsilon': 0.11124522790413083}. Best is trial 196 with value: 0.7767177771476403.
Trial 184 finished with value: 0.32968697613851605 and parameters: {'kernel': 'poly', 'epsilon': 0.5057163381763745}. Best is trial 196 with value: 0.7767177771476403.
Trial 197 finished with value: 0.4239318015044202 and parameters: {'kernel': 'sigmoid', 'epsilon': 0.9955186037498037}. Best is trial 196 with value: 0.7767177771476403.
Trial 192 finished with value: 0.7759913056844662 and parameters: {'kernel': 'linear', 'epsilon': 0.571878740421667}. Best is trial 196 with value: 0.7767177771476403.
