Trial 911 finished with value: 0.7765958365281092 and parameters: {'kernel': 'linear', 'epsilon': 0.054685383621677186}. Best is trial 149 with value: 0.7767469696771062.
Trial 919 finished with value: 0.3520901258530632 and parameters: {'kernel': 'rbf', 'epsilon': 0.5703840010200706}. Best is trial 149 with value: 0.7767469696771062.
Trial 896 finished with value: 0.32976258321792284 and parameters: {'kernel': 'poly', 'epsilon': 0.4584014348765798}. Best is trial 149 with value: 0.7767469696771062.
Trial 924 finished with value: 0.3507260947480556 and parameters: {'kernel': 'rbf', 'epsilon': 0.1990270339331376}. Best is trial 149 with value: 0.7767469696771062.
Trial 917 finished with value: 0.3293726135869903 and parameters: {'kernel': 'poly', 'epsilon': 0.729946948935612}. Best is trial 149 with value: 0.7767469696771062.
Trial 920 finished with value: 0.42439087904776385 and parameters: {'kernel': 'sigmoid', 'epsilon': 0.5104481552985799}. Best is trial 149 with value: 0.7767469696771062.
Trial 910 finished with value: 0.33006013431706166 and parameters: {'kernel': 'poly', 'epsilon': 0.06499073243465159}. Best is trial 149 with value: 0.7767469696771062.
Trial 916 finished with value: 0.42437879711328924 and parameters: {'kernel': 'sigmoid', 'epsilon': 0.488112024268896}. Best is trial 149 with value: 0.7767469696771062.
Trial 918 finished with value: 0.32942696308197494 and parameters: {'kernel': 'poly', 'epsilon': 0.6483093346391375}. Best is trial 149 with value: 0.7767469696771062.
Trial 914 finished with value: 0.7765183666382588 and parameters: {'kernel': 'linear', 'epsilon': 0.32385949063620567}. Best is trial 149 with value: 0.7767469696771062.
Trial 925 finished with value: 0.3509337927051786 and parameters: {'kernel': 'rbf', 'epsilon': 0.2737987001407183}. Best is trial 149 with value: 0.7767469696771062.
Trial 913 finished with value: 0.3506010600179635 and parameters: {'kernel': 'rbf', 'epsilon': 0.15270210656959293}. Best is trial 149 with value: 0.7767469696771062.
Trial 921 finished with value: 0.3292550305457724 and parameters: {'kernel': 'poly', 'epsilon': 0.8262843626177089}. Best is trial 149 with value: 0.7767469696771062.
Trial 923 finished with value: 0.4246202397187108 and parameters: {'kernel': 'sigmoid', 'epsilon': 0.36795794137742466}. Best is trial 149 with value: 0.7767469696771062.
Trial 922 finished with value: 0.35194803343656195 and parameters: {'kernel': 'rbf', 'epsilon': 0.538609076996733}. Best is trial 149 with value: 0.7767469696771062.
Trial 930 finished with value: 0.35194315626521727 and parameters: {'kernel': 'rbf', 'epsilon': 0.5372812354739733}. Best is trial 149 with value: 0.7767469696771062.
Trial 926 finished with value: 0.3532559874972119 and parameters: {'kernel': 'rbf', 'epsilon': 0.8646964312465443}. Best is trial 149 with value: 0.7767469696771062.
Trial 931 finished with value: 0.42441953444347263 and parameters: {'kernel': 'sigmoid', 'epsilon': 0.9386259823145198}. Best is trial 149 with value: 0.7767469696771062.
Trial 927 finished with value: 0.7751926382037319 and parameters: {'kernel': 'linear', 'epsilon': 0.9990967705707516}. Best is trial 149 with value: 0.7767469696771062.
Trial 938 finished with value: 0.32950427713577485 and parameters: {'kernel': 'poly', 'epsilon': 0.5883257419894806}. Best is trial 149 with value: 0.7767469696771062.
Trial 933 finished with value: 0.32937974166914963 and parameters: {'kernel': 'poly', 'epsilon': 0.7191684565131424}. Best is trial 149 with value: 0.7767469696771062.
Trial 928 finished with value: 0.32936282581206777 and parameters: {'kernel': 'poly', 'epsilon': 0.7403640597130795}. Best is trial 149 with value: 0.7767469696771062.
Trial 929 finished with value: 0.7760583490921684 and parameters: {'kernel': 'linear', 'epsilon': 0.6666345941773715}. Best is trial 149 with value: 0.7767469696771062.
Trial 934 finished with value: 0.3533773370005444 and parameters: {'kernel': 'rbf', 'epsilon': 0.9049771251209797}. Best is trial 149 with value: 0.7767469696771062.
Trial 932 finished with value: 0.42463724007701187 and parameters: {'kernel': 'sigmoid', 'epsilon': 0.8373983364875827}. Best is trial 149 with value: 0.7767469696771062.
Trial 944 finished with value: 0.776652955583835 and parameters: {'kernel': 'linear', 'epsilon': 0.09737783477727358}. Best is trial 149 with value: 0.7767469696771062.
Trial 937 finished with value: 0.4245350483905036 and parameters: {'kernel': 'sigmoid', 'epsilon': 0.39813828407009566}. Best is trial 149 with value: 0.7767469696771062.
Trial 945 finished with value: 0.3535665280693746 and parameters: {'kernel': 'rbf', 'epsilon': 0.9702304172180594}. Best is trial 149 with value: 0.7767469696771062.
Trial 935 finished with value: 0.3291473046592635 and parameters: {'kernel': 'poly', 'epsilon': 0.8971865077660254}. Best is trial 149 with value: 0.7767469696771062.
Trial 940 finished with value: 0.7753174694324008 and parameters: {'kernel': 'linear', 'epsilon': 0.9693644132974103}. Best is trial 149 with value: 0.7767469696771062.
Trial 939 finished with value: 0.7760599033110303 and parameters: {'kernel': 'linear', 'epsilon': 0.42291347854264727}. Best is trial 149 with value: 0.7767469696771062.
Trial 943 finished with value: 0.3531976276556892 and parameters: {'kernel': 'rbf', 'epsilon': 0.8385375047285232}. Best is trial 149 with value: 0.7767469696771062.
Trial 936 finished with value: 0.35170722359763434 and parameters: {'kernel': 'rbf', 'epsilon': 0.47921090237493014}. Best is trial 149 with value: 0.7767469696771062.
Trial 946 finished with value: 0.3299538071100974 and parameters: {'kernel': 'poly', 'epsilon': 0.22985205321817626}. Best is trial 149 with value: 0.7767469696771062.
Trial 949 finished with value: 0.4244634043033052 and parameters: {'kernel': 'sigmoid', 'epsilon': 0.8999051168155858}. Best is trial 149 with value: 0.7767469696771062.
Trial 951 finished with value: 0.4250199653049476 and parameters: {'kernel': 'sigmoid', 'epsilon': 0.15430152809706554}. Best is trial 149 with value: 0.7767469696771062.
Trial 942 finished with value: 0.3297683748842818 and parameters: {'kernel': 'poly', 'epsilon': 0.45243560358940926}. Best is trial 149 with value: 0.7767469696771062.
Trial 941 finished with value: 0.4247727890728353 and parameters: {'kernel': 'sigmoid', 'epsilon': 0.6912939834357809}. Best is trial 149 with value: 0.7767469696771062.
Trial 950 finished with value: 0.4243791236033744 and parameters: {'kernel': 'sigmoid', 'epsilon': 0.48760272528078497}. Best is trial 149 with value: 0.7767469696771062.
Trial 953 finished with value: 0.7761967701497193 and parameters: {'kernel': 'linear', 'epsilon': 0.3863068296850731}. Best is trial 149 with value: 0.7767469696771062.
Trial 948 finished with value: 0.42426237293987706 and parameters: {'kernel': 'sigmoid', 'epsilon': 0.9617643465708391}. Best is trial 149 with value: 0.7767469696771062.
Trial 952 finished with value: 0.3508057795986649 and parameters: {'kernel': 'rbf', 'epsilon': 0.22854435630274716}. Best is trial 149 with value: 0.7767469696771062.
Trial 956 finished with value: 0.7765873194218267 and parameters: {'kernel': 'linear', 'epsilon': 0.07151340964377273}. Best is trial 149 with value: 0.7767469696771062.
Trial 958 finished with value: 0.775904564853409 and parameters: {'kernel': 'linear', 'epsilon': 0.7888528659754401}. Best is trial 149 with value: 0.7767469696771062.
Trial 963 finished with value: 0.7760550540388248 and parameters: {'kernel': 'linear', 'epsilon': 0.6694019315172903}. Best is trial 149 with value: 0.7767469696771062.
Trial 947 finished with value: 0.3298467799860815 and parameters: {'kernel': 'poly', 'epsilon': 0.37637794811650527}. Best is trial 149 with value: 0.7767469696771062.
Trial 954 finished with value: 0.32939554338073357 and parameters: {'kernel': 'poly', 'epsilon': 0.696984992168429}. Best is trial 149 with value: 0.7767469696771062.
Trial 959 finished with value: 0.3532311384564273 and parameters: {'kernel': 'rbf', 'epsilon': 0.8536907622587474}. Best is trial 149 with value: 0.7767469696771062.
Trial 965 finished with value: 0.7760458003176705 and parameters: {'kernel': 'linear', 'epsilon': 0.6798915480590697}. Best is trial 149 with value: 0.7767469696771062.
Trial 961 finished with value: 0.7766395043639285 and parameters: {'kernel': 'linear', 'epsilon': 0.2878359851299066}. Best is trial 149 with value: 0.7767469696771062.
Trial 960 finished with value: 0.4247309963391155 and parameters: {'kernel': 'sigmoid', 'epsilon': 0.7539913174717502}. Best is trial 149 with value: 0.7767469696771062.
Trial 962 finished with value: 0.7754004154465868 and parameters: {'kernel': 'linear', 'epsilon': 0.9276221561078879}. Best is trial 149 with value: 0.7767469696771062.
Trial 957 finished with value: 0.7765844860901521 and parameters: {'kernel': 'linear', 'epsilon': 0.07602127070612297}. Best is trial 149 with value: 0.7767469696771062.
Trial 955 finished with value: 0.35323788024656344 and parameters: {'kernel': 'rbf', 'epsilon': 0.8570939407368268}. Best is trial 149 with value: 0.7767469696771062.
Trial 968 finished with value: 0.3506793965712691 and parameters: {'kernel': 'rbf', 'epsilon': 0.18410057840619287}. Best is trial 149 with value: 0.7767469696771062.
Trial 964 finished with value: 0.329399460026559 and parameters: {'kernel': 'poly', 'epsilon': 0.6740746426624826}. Best is trial 149 with value: 0.7767469696771062.
Trial 970 finished with value: 0.7760339620102235 and parameters: {'kernel': 'linear', 'epsilon': 0.6929648155047383}. Best is trial 149 with value: 0.7767469696771062.
Trial 967 finished with value: 0.424658217724222 and parameters: {'kernel': 'sigmoid', 'epsilon': 0.827690944856527}. Best is trial 149 with value: 0.7767469696771062.
Trial 979 finished with value: 0.42424597791206137 and parameters: {'kernel': 'sigmoid', 'epsilon': 0.9639455581309738}. Best is trial 149 with value: 0.7767469696771062.
Trial 973 finished with value: 0.3300423036211539 and parameters: {'kernel': 'poly', 'epsilon': 0.08406358642676681}. Best is trial 149 with value: 0.7767469696771062.
Trial 974 finished with value: 0.7760094484249713 and parameters: {'kernel': 'linear', 'epsilon': 0.5775738578856578}. Best is trial 149 with value: 0.7767469696771062.
Trial 975 finished with value: 0.32982928307837445 and parameters: {'kernel': 'poly', 'epsilon': 0.39302881314933846}. Best is trial 149 with value: 0.7767469696771062.
Trial 972 finished with value: 0.7760596422122831 and parameters: {'kernel': 'linear', 'epsilon': 0.6637348127088204}. Best is trial 149 with value: 0.7767469696771062.
Trial 971 finished with value: 0.42408303853582485 and parameters: {'kernel': 'sigmoid', 'epsilon': 0.9812479316302621}. Best is trial 149 with value: 0.7767469696771062.
Trial 966 finished with value: 0.7765611127865485 and parameters: {'kernel': 'linear', 'epsilon': 0.23572518981987334}. Best is trial 149 with value: 0.7767469696771062.
Trial 986 finished with value: 0.7762384108006918 and parameters: {'kernel': 'linear', 'epsilon': 0.36977126433001895}. Best is trial 149 with value: 0.7767469696771062.
Trial 969 finished with value: 0.775585039831132 and parameters: {'kernel': 'linear', 'epsilon': 0.8407026806513654}. Best is trial 149 with value: 0.7767469696771062.
Trial 984 finished with value: 0.35168858685124144 and parameters: {'kernel': 'rbf', 'epsilon': 0.4748586563604693}. Best is trial 149 with value: 0.7767469696771062.
Trial 976 finished with value: 0.7755660504395177 and parameters: {'kernel': 'linear', 'epsilon': 0.8570836850134755}. Best is trial 149 with value: 0.7767469696771062.
Trial 980 finished with value: 0.3519280606931067 and parameters: {'kernel': 'rbf', 'epsilon': 0.533208158458774}. Best is trial 149 with value: 0.7767469696771062.
Trial 987 finished with value: 0.3300902894466195 and parameters: {'kernel': 'poly', 'epsilon': 0.03310391136960389}. Best is trial 149 with value: 0.7767469696771062.
Trial 989 finished with value: 0.7760150407206664 and parameters: {'kernel': 'linear', 'epsilon': 0.5797811289483513}. Best is trial 149 with value: 0.7767469696771062.
Trial 985 finished with value: 0.4248366775685225 and parameters: {'kernel': 'sigmoid', 'epsilon': 0.28762240016167695}. Best is trial 149 with value: 0.7767469696771062.
Trial 983 finished with value: 0.35036103060317064 and parameters: {'kernel': 'rbf', 'epsilon': 0.026875255938481613}. Best is trial 149 with value: 0.7767469696771062.
Trial 981 finished with value: 0.42483120055426304 and parameters: {'kernel': 'sigmoid', 'epsilon': 0.2896174848535181}. Best is trial 149 with value: 0.7767469696771062.
Trial 990 finished with value: 0.353426300498421 and parameters: {'kernel': 'rbf', 'epsilon': 0.9196440000223352}. Best is trial 149 with value: 0.7767469696771062.
Trial 977 finished with value: 0.7766197571965525 and parameters: {'kernel': 'linear', 'epsilon': 0.30231706366276845}. Best is trial 149 with value: 0.7767469696771062.
Trial 991 finished with value: 0.7755666055987404 and parameters: {'kernel': 'linear', 'epsilon': 0.853925581866764}. Best is trial 149 with value: 0.7767469696771062.
Trial 978 finished with value: 0.3526098177256291 and parameters: {'kernel': 'rbf', 'epsilon': 0.6828486708924503}. Best is trial 149 with value: 0.7767469696771062.
Trial 982 finished with value: 0.7758962519290359 and parameters: {'kernel': 'linear', 'epsilon': 0.5469771081986198}. Best is trial 149 with value: 0.7767469696771062.
Trial 996 finished with value: 0.7765998674001687 and parameters: {'kernel': 'linear', 'epsilon': 0.21327055798959982}. Best is trial 149 with value: 0.7767469696771062.
Trial 992 finished with value: 0.35133788049475456 and parameters: {'kernel': 'rbf', 'epsilon': 0.4010935702462134}. Best is trial 149 with value: 0.7767469696771062.
Trial 988 finished with value: 0.3533513504903763 and parameters: {'kernel': 'rbf', 'epsilon': 0.8970842603833986}. Best is trial 149 with value: 0.7767469696771062.
Trial 997 finished with value: 0.7761459873025971 and parameters: {'kernel': 'linear', 'epsilon': 0.4032699823782333}. Best is trial 149 with value: 0.7767469696771062.
Trial 1001 finished with value: 0.42438836657110246 and parameters: {'kernel': 'sigmoid', 'epsilon': 0.5631725548282909}. Best is trial 149 with value: 0.7767469696771062.
Trial 995 finished with value: 0.4243741706517822 and parameters: {'kernel': 'sigmoid', 'epsilon': 0.4961760888537581}. Best is trial 149 with value: 0.7767469696771062.
Trial 998 finished with value: 0.775951135949897 and parameters: {'kernel': 'linear', 'epsilon': 0.5617310819859249}. Best is trial 149 with value: 0.7767469696771062.
Trial 994 finished with value: 0.7760373459175576 and parameters: {'kernel': 'linear', 'epsilon': 0.6123769360573406}. Best is trial 149 with value: 0.7767469696771062.
Trial 1002 finished with value: 0.4242793705467355 and parameters: {'kernel': 'sigmoid', 'epsilon': 0.9592525608187369}. Best is trial 149 with value: 0.7767469696771062.
Trial 1003 finished with value: 0.3299379275640554 and parameters: {'kernel': 'poly', 'epsilon': 0.25125659437745673}. Best is trial 149 with value: 0.7767469696771062.
Trial 1005 finished with value: 0.4245339496906727 and parameters: {'kernel': 'sigmoid', 'epsilon': 0.40017729467548857}. Best is trial 149 with value: 0.7767469696771062.
Trial 1007 finished with value: 0.7765934036543645 and parameters: {'kernel': 'linear', 'epsilon': 0.15610705638696254}. Best is trial 149 with value: 0.7767469696771062.
Trial 993 finished with value: 0.3292999115001468 and parameters: {'kernel': 'poly', 'epsilon': 0.798126284485578}. Best is trial 149 with value: 0.7767469696771062.
Trial 1004 finished with value: 0.3297859317785866 and parameters: {'kernel': 'poly', 'epsilon': 0.4281513507314354}. Best is trial 149 with value: 0.7767469696771062.
Trial 999 finished with value: 0.3522568165132226 and parameters: {'kernel': 'rbf', 'epsilon': 0.608223541118737}. Best is trial 149 with value: 0.7767469696771062.
Trial 1008 finished with value: 0.7756912256391966 and parameters: {'kernel': 'linear', 'epsilon': 0.5058615824018378}. Best is trial 149 with value: 0.7767469696771062.
Trial 1000 finished with value: 0.4243744648725711 and parameters: {'kernel': 'sigmoid', 'epsilon': 0.49841170937004475}. Best is trial 149 with value: 0.7767469696771062.
Trial 1010 finished with value: 0.3295915198115066 and parameters: {'kernel': 'poly', 'epsilon': 0.5465361871456073}. Best is trial 149 with value: 0.7767469696771062.
Trial 1012 finished with value: 0.32987346761813346 and parameters: {'kernel': 'poly', 'epsilon': 0.34919617302193384}. Best is trial 149 with value: 0.7767469696771062.
Trial 1013 finished with value: 0.42454563293695574 and parameters: {'kernel': 'sigmoid', 'epsilon': 0.8793031733826544}. Best is trial 149 with value: 0.7767469696771062.
Trial 1006 finished with value: 0.3299470212488126 and parameters: {'kernel': 'poly', 'epsilon': 0.23757226660176678}. Best is trial 149 with value: 0.7767469696771062.
Trial 1016 finished with value: 0.35343981858181717 and parameters: {'kernel': 'rbf', 'epsilon': 0.924182181436679}. Best is trial 149 with value: 0.7767469696771062.
Trial 1015 finished with value: 0.7760271592583535 and parameters: {'kernel': 'linear', 'epsilon': 0.5868471340642761}. Best is trial 149 with value: 0.7767469696771062.
Trial 1017 finished with value: 0.3517577497866105 and parameters: {'kernel': 'rbf', 'epsilon': 0.49088281944730694}. Best is trial 149 with value: 0.7767469696771062.
Trial 1009 finished with value: 0.35271100495569085 and parameters: {'kernel': 'rbf', 'epsilon': 0.7076256191785677}. Best is trial 149 with value: 0.7767469696771062.
Trial 1018 finished with value: 0.4249847793124243 and parameters: {'kernel': 'sigmoid', 'epsilon': 0.0787853407080612}. Best is trial 149 with value: 0.7767469696771062.
Trial 1011 finished with value: 0.7766285767882064 and parameters: {'kernel': 'linear', 'epsilon': 0.20492190595780002}. Best is trial 149 with value: 0.7767469696771062.
Trial 1014 finished with value: 0.3528559275804815 and parameters: {'kernel': 'rbf', 'epsilon': 0.7449723552082795}. Best is trial 149 with value: 0.7767469696771062.
Trial 1019 finished with value: 0.3503988121792714 and parameters: {'kernel': 'rbf', 'epsilon': 0.05402966724669167}. Best is trial 149 with value: 0.7767469696771062.
Trial 1024 finished with value: 0.3296574642329507 and parameters: {'kernel': 'poly', 'epsilon': 0.5187033653211522}. Best is trial 149 with value: 0.7767469696771062.
Trial 1023 finished with value: 0.4251005049584039 and parameters: {'kernel': 'sigmoid', 'epsilon': 0.1895366129181526}. Best is trial 149 with value: 0.7767469696771062.
Trial 1026 finished with value: 0.7752122862926507 and parameters: {'kernel': 'linear', 'epsilon': 0.99357768010632}. Best is trial 149 with value: 0.7767469696771062.
Trial 1025 finished with value: 0.35097865982608195 and parameters: {'kernel': 'rbf', 'epsilon': 0.2955045265370503}. Best is trial 149 with value: 0.7767469696771062.
Trial 1029 finished with value: 0.4243957856345505 and parameters: {'kernel': 'sigmoid', 'epsilon': 0.5139216550130223}. Best is trial 149 with value: 0.7767469696771062.
Trial 1021 finished with value: 0.32998583458377784 and parameters: {'kernel': 'poly', 'epsilon': 0.18409428796270444}. Best is trial 149 with value: 0.7767469696771062.
Trial 1028 finished with value: 0.7765947650199746 and parameters: {'kernel': 'linear', 'epsilon': 0.06263530843988885}. Best is trial 149 with value: 0.7767469696771062.
Trial 1032 finished with value: 0.4243797926059215 and parameters: {'kernel': 'sigmoid', 'epsilon': 0.5026296101591504}. Best is trial 149 with value: 0.7767469696771062.
Trial 1030 finished with value: 0.3527194771508936 and parameters: {'kernel': 'rbf', 'epsilon': 0.7096007274077489}. Best is trial 149 with value: 0.7767469696771062.
Trial 1033 finished with value: 0.35099075070026287 and parameters: {'kernel': 'rbf', 'epsilon': 0.30196630645545963}. Best is trial 149 with value: 0.7767469696771062.
Trial 1035 finished with value: 0.7761959362735211 and parameters: {'kernel': 'linear', 'epsilon': 0.38662366711666885}. Best is trial 149 with value: 0.7767469696771062.
Trial 1022 finished with value: 0.7754049718639336 and parameters: {'kernel': 'linear', 'epsilon': 0.9264319203458492}. Best is trial 149 with value: 0.7767469696771062.
Trial 1031 finished with value: 0.7765772001262146 and parameters: {'kernel': 'linear', 'epsilon': 0.264655468961118}. Best is trial 149 with value: 0.7767469696771062.
Trial 1027 finished with value: 0.3294091176793269 and parameters: {'kernel': 'poly', 'epsilon': 0.6624881603974122}. Best is trial 149 with value: 0.7767469696771062.
Trial 1041 finished with value: 0.7757969102978669 and parameters: {'kernel': 'linear', 'epsilon': 0.4588931844150882}. Best is trial 149 with value: 0.7767469696771062.
Trial 1037 finished with value: 0.776056405073185 and parameters: {'kernel': 'linear', 'epsilon': 0.649622603300356}. Best is trial 149 with value: 0.7767469696771062.
Trial 1020 finished with value: 0.7754209665172255 and parameters: {'kernel': 'linear', 'epsilon': 0.917866130664204}. Best is trial 149 with value: 0.7767469696771062.
Trial 1038 finished with value: 0.3532085051971848 and parameters: {'kernel': 'rbf', 'epsilon': 0.8435990727801195}. Best is trial 149 with value: 0.7767469696771062.
Trial 1034 finished with value: 0.32904162684674293 and parameters: {'kernel': 'poly', 'epsilon': 0.973801344447965}. Best is trial 149 with value: 0.7767469696771062.
Trial 1045 finished with value: 0.3298729642739028 and parameters: {'kernel': 'poly', 'epsilon': 0.34974801980570147}. Best is trial 149 with value: 0.7767469696771062.
Trial 1039 finished with value: 0.42466584138018104 and parameters: {'kernel': 'sigmoid', 'epsilon': 0.7985697164400949}. Best is trial 149 with value: 0.7767469696771062.
