Trial 779 finished with value: 0.7766173436703216 and parameters: {'kernel': 'linear', 'epsilon': 0.1952708662093745}. Best is trial 149 with value: 0.7767469696771062.
Trial 784 finished with value: 0.42479558346970947 and parameters: {'kernel': 'sigmoid', 'epsilon': 0.7143479001578497}. Best is trial 149 with value: 0.7767469696771062.
Trial 787 finished with value: 0.7754082210758835 and parameters: {'kernel': 'linear', 'epsilon': 0.9244668651760145}. Best is trial 149 with value: 0.7767469696771062.
Trial 789 finished with value: 0.7760255312216391 and parameters: {'kernel': 'linear', 'epsilon': 0.5973586852566132}. Best is trial 149 with value: 0.7767469696771062.
Trial 791 finished with value: 0.35078556639652075 and parameters: {'kernel': 'rbf', 'epsilon': 0.22084713201093165}. Best is trial 149 with value: 0.7767469696771062.
Trial 781 finished with value: 0.3506199239251931 and parameters: {'kernel': 'rbf', 'epsilon': 0.16166896775521966}. Best is trial 149 with value: 0.7767469696771062.
Trial 782 finished with value: 0.7754379872446256 and parameters: {'kernel': 'linear', 'epsilon': 0.9023521797166468}. Best is trial 149 with value: 0.7767469696771062.
Trial 785 finished with value: 0.7760408433113645 and parameters: {'kernel': 'linear', 'epsilon': 0.683915562264614}. Best is trial 149 with value: 0.7767469696771062.
Trial 786 finished with value: 0.42475043796068646 and parameters: {'kernel': 'sigmoid', 'epsilon': 0.6831475508107662}. Best is trial 149 with value: 0.7767469696771062.
Trial 795 finished with value: 0.42504838404355694 and parameters: {'kernel': 'sigmoid', 'epsilon': 0.16602992764699376}. Best is trial 149 with value: 0.7767469696771062.
Trial 796 finished with value: 0.3524460888330979 and parameters: {'kernel': 'rbf', 'epsilon': 0.6456264021973747}. Best is trial 149 with value: 0.7767469696771062.
Trial 790 finished with value: 0.3298427665506831 and parameters: {'kernel': 'poly', 'epsilon': 0.3800262220412668}. Best is trial 149 with value: 0.7767469696771062.
Trial 793 finished with value: 0.3291489086661121 and parameters: {'kernel': 'poly', 'epsilon': 0.8956095695879857}. Best is trial 149 with value: 0.7767469696771062.
Trial 788 finished with value: 0.4245402446533385 and parameters: {'kernel': 'sigmoid', 'epsilon': 0.3926499868645942}. Best is trial 149 with value: 0.7767469696771062.
Trial 794 finished with value: 0.7760729123157801 and parameters: {'kernel': 'linear', 'epsilon': 0.4206495053635322}. Best is trial 149 with value: 0.7767469696771062.
Trial 801 finished with value: 0.7766159231474232 and parameters: {'kernel': 'linear', 'epsilon': 0.21031358507230014}. Best is trial 149 with value: 0.7767469696771062.
Trial 798 finished with value: 0.4245021773048152 and parameters: {'kernel': 'sigmoid', 'epsilon': 0.4389473059929748}. Best is trial 149 with value: 0.7767469696771062.
Trial 800 finished with value: 0.32982706236237236 and parameters: {'kernel': 'poly', 'epsilon': 0.3961165242426954}. Best is trial 149 with value: 0.7767469696771062.
Trial 792 finished with value: 0.3504347010031261 and parameters: {'kernel': 'rbf', 'epsilon': 0.07098488368301725}. Best is trial 149 with value: 0.7767469696771062.
Trial 799 finished with value: 0.42477596484519503 and parameters: {'kernel': 'sigmoid', 'epsilon': 0.730600362259096}. Best is trial 149 with value: 0.7767469696771062.
Trial 805 finished with value: 0.33000582101002923 and parameters: {'kernel': 'poly', 'epsilon': 0.15338199185057266}. Best is trial 149 with value: 0.7767469696771062.
Trial 804 finished with value: 0.7765943462102703 and parameters: {'kernel': 'linear', 'epsilon': 0.05191696018245695}. Best is trial 149 with value: 0.7767469696771062.
Trial 797 finished with value: 0.3521807293423692 and parameters: {'kernel': 'rbf', 'epsilon': 0.5914771818688942}. Best is trial 149 with value: 0.7767469696771062.
Trial 803 finished with value: 0.7760479986467211 and parameters: {'kernel': 'linear', 'epsilon': 0.6350544997233505}. Best is trial 149 with value: 0.7767469696771062.
Trial 806 finished with value: 0.35266018086125245 and parameters: {'kernel': 'rbf', 'epsilon': 0.6953256950066176}. Best is trial 149 with value: 0.7767469696771062.
Trial 811 finished with value: 0.3530523858362648 and parameters: {'kernel': 'rbf', 'epsilon': 0.7976089637260507}. Best is trial 149 with value: 0.7767469696771062.
Trial 810 finished with value: 0.42481623603881663 and parameters: {'kernel': 'sigmoid', 'epsilon': 0.2945074586387264}. Best is trial 149 with value: 0.7767469696771062.
Trial 802 finished with value: 0.7760234502157044 and parameters: {'kernel': 'linear', 'epsilon': 0.6037358616228415}. Best is trial 149 with value: 0.7767469696771062.
Trial 817 finished with value: 0.7759340514629366 and parameters: {'kernel': 'linear', 'epsilon': 0.5584487995204919}. Best is trial 149 with value: 0.7767469696771062.
Trial 816 finished with value: 0.7753426238128064 and parameters: {'kernel': 'linear', 'epsilon': 0.9464008040636905}. Best is trial 149 with value: 0.7767469696771062.
Trial 818 finished with value: 0.42484073840960396 and parameters: {'kernel': 'sigmoid', 'epsilon': 0.2859842302637068}. Best is trial 149 with value: 0.7767469696771062.
Trial 814 finished with value: 0.32999509823383893 and parameters: {'kernel': 'poly', 'epsilon': 0.16899048190922838}. Best is trial 149 with value: 0.7767469696771062.
Trial 807 finished with value: 0.3299237155516559 and parameters: {'kernel': 'poly', 'epsilon': 0.2934002674513432}. Best is trial 149 with value: 0.7767469696771062.
Trial 812 finished with value: 0.4243598589389535 and parameters: {'kernel': 'sigmoid', 'epsilon': 0.5497160642688751}. Best is trial 149 with value: 0.7767469696771062.
Trial 809 finished with value: 0.35274978474352625 and parameters: {'kernel': 'rbf', 'epsilon': 0.7172576594256199}. Best is trial 149 with value: 0.7767469696771062.
Trial 815 finished with value: 0.32993162582191105 and parameters: {'kernel': 'poly', 'epsilon': 0.2701376844545701}. Best is trial 149 with value: 0.7767469696771062.
Trial 819 finished with value: 0.3299842712143821 and parameters: {'kernel': 'poly', 'epsilon': 0.18549467590158264}. Best is trial 149 with value: 0.7767469696771062.
Trial 813 finished with value: 0.33003140535426767 and parameters: {'kernel': 'poly', 'epsilon': 0.09544657209235796}. Best is trial 149 with value: 0.7767469696771062.
Trial 821 finished with value: 0.35233455812595266 and parameters: {'kernel': 'rbf', 'epsilon': 0.6235965486428787}. Best is trial 149 with value: 0.7767469696771062.
Trial 822 finished with value: 0.7760350092491634 and parameters: {'kernel': 'linear', 'epsilon': 0.6914417210412088}. Best is trial 149 with value: 0.7767469696771062.
Trial 823 finished with value: 0.42472328013757704 and parameters: {'kernel': 'sigmoid', 'epsilon': 0.6731040712439341}. Best is trial 149 with value: 0.7767469696771062.
Trial 820 finished with value: 0.7755708022629951 and parameters: {'kernel': 'linear', 'epsilon': 0.8431118737669951}. Best is trial 149 with value: 0.7767469696771062.
Trial 824 finished with value: 0.3290051771795561 and parameters: {'kernel': 'poly', 'epsilon': 0.9920373862440152}. Best is trial 149 with value: 0.7767469696771062.
Trial 826 finished with value: 0.35325462771769894 and parameters: {'kernel': 'rbf', 'epsilon': 0.8641852479254096}. Best is trial 149 with value: 0.7767469696771062.
Trial 825 finished with value: 0.425055691560556 and parameters: {'kernel': 'sigmoid', 'epsilon': 0.1682059009165109}. Best is trial 149 with value: 0.7767469696771062.
Trial 827 finished with value: 0.3301044837018675 and parameters: {'kernel': 'poly', 'epsilon': 0.01598413612862959}. Best is trial 149 with value: 0.7767469696771062.
Trial 828 finished with value: 0.42478926121149463 and parameters: {'kernel': 'sigmoid', 'epsilon': 0.31677576230015114}. Best is trial 149 with value: 0.7767469696771062.
Trial 808 finished with value: 0.4244520552880397 and parameters: {'kernel': 'sigmoid', 'epsilon': 0.9103752519051218}. Best is trial 149 with value: 0.7767469696771062.
Trial 833 finished with value: 0.3294438870770019 and parameters: {'kernel': 'poly', 'epsilon': 0.6373437810487615}. Best is trial 149 with value: 0.7767469696771062.
Trial 837 finished with value: 0.4245343269860145 and parameters: {'kernel': 'sigmoid', 'epsilon': 0.39935957534961486}. Best is trial 149 with value: 0.7767469696771062.
Trial 836 finished with value: 0.3528533722962618 and parameters: {'kernel': 'rbf', 'epsilon': 0.7440545021126409}. Best is trial 149 with value: 0.7767469696771062.
Trial 831 finished with value: 0.352949761261883 and parameters: {'kernel': 'rbf', 'epsilon': 0.7727348136014959}. Best is trial 149 with value: 0.7767469696771062.
Trial 835 finished with value: 0.352431922509813 and parameters: {'kernel': 'rbf', 'epsilon': 0.6428408394635521}. Best is trial 149 with value: 0.7767469696771062.
Trial 839 finished with value: 0.7767014535272484 and parameters: {'kernel': 'linear', 'epsilon': 0.1285336541582187}. Best is trial 149 with value: 0.7767469696771062.
Trial 834 finished with value: 0.42485113927012963 and parameters: {'kernel': 'sigmoid', 'epsilon': 0.01008286061586694}. Best is trial 149 with value: 0.7767469696771062.
Trial 841 finished with value: 0.32918724185790804 and parameters: {'kernel': 'poly', 'epsilon': 0.864280042797164}. Best is trial 149 with value: 0.7767469696771062.
Trial 830 finished with value: 0.7760547047464101 and parameters: {'kernel': 'linear', 'epsilon': 0.6485725726641917}. Best is trial 149 with value: 0.7767469696771062.
Trial 829 finished with value: 0.32928121044310854 and parameters: {'kernel': 'poly', 'epsilon': 0.8088840799792002}. Best is trial 149 with value: 0.7767469696771062.
Trial 840 finished with value: 0.35132162029218417 and parameters: {'kernel': 'rbf', 'epsilon': 0.39617938990555135}. Best is trial 149 with value: 0.7767469696771062.
Trial 845 finished with value: 0.32916598863555724 and parameters: {'kernel': 'poly', 'epsilon': 0.8802998934522529}. Best is trial 149 with value: 0.7767469696771062.
Trial 847 finished with value: 0.4243892316673173 and parameters: {'kernel': 'sigmoid', 'epsilon': 0.9430275198403404}. Best is trial 149 with value: 0.7767469696771062.
Trial 848 finished with value: 0.3507860222505529 and parameters: {'kernel': 'rbf', 'epsilon': 0.2209499983080303}. Best is trial 149 with value: 0.7767469696771062.
Trial 838 finished with value: 0.32993760983395826 and parameters: {'kernel': 'poly', 'epsilon': 0.2516944523603123}. Best is trial 149 with value: 0.7767469696771062.
Trial 843 finished with value: 0.4243924895058374 and parameters: {'kernel': 'sigmoid', 'epsilon': 0.48178658360298987}. Best is trial 149 with value: 0.7767469696771062.
Trial 832 finished with value: 0.3528368722680019 and parameters: {'kernel': 'rbf', 'epsilon': 0.7392826244031115}. Best is trial 149 with value: 0.7767469696771062.
Trial 844 finished with value: 0.32947049164413034 and parameters: {'kernel': 'poly', 'epsilon': 0.6104634360176627}. Best is trial 149 with value: 0.7767469696771062.
Trial 842 finished with value: 0.42430537014318565 and parameters: {'kernel': 'sigmoid', 'epsilon': 0.9554713801956379}. Best is trial 149 with value: 0.7767469696771062.
Trial 846 finished with value: 0.3517003523925024 and parameters: {'kernel': 'rbf', 'epsilon': 0.4776894472862028}. Best is trial 149 with value: 0.7767469696771062.
Trial 849 finished with value: 0.4244502465643702 and parameters: {'kernel': 'sigmoid', 'epsilon': 0.46024649543668195}. Best is trial 149 with value: 0.7767469696771062.
Trial 851 finished with value: 0.32947005157577547 and parameters: {'kernel': 'poly', 'epsilon': 0.6108058238813288}. Best is trial 149 with value: 0.7767469696771062.
Trial 853 finished with value: 0.42479449866451063 and parameters: {'kernel': 'sigmoid', 'epsilon': 0.6999160366809067}. Best is trial 149 with value: 0.7767469696771062.
Trial 852 finished with value: 0.3297564589738283 and parameters: {'kernel': 'poly', 'epsilon': 0.4643571723030958}. Best is trial 149 with value: 0.7767469696771062.
Trial 850 finished with value: 0.35141326832997916 and parameters: {'kernel': 'rbf', 'epsilon': 0.42338467582416084}. Best is trial 149 with value: 0.7767469696771062.
Trial 860 finished with value: 0.42500374204039293 and parameters: {'kernel': 'sigmoid', 'epsilon': 0.14220668928611802}. Best is trial 149 with value: 0.7767469696771062.
Trial 862 finished with value: 0.35225896145667557 and parameters: {'kernel': 'rbf', 'epsilon': 0.6086763983414265}. Best is trial 149 with value: 0.7767469696771062.
Trial 861 finished with value: 0.7766427587749559 and parameters: {'kernel': 'linear', 'epsilon': 0.2939834470386905}. Best is trial 149 with value: 0.7767469696771062.
Trial 863 finished with value: 0.4245587011405478 and parameters: {'kernel': 'sigmoid', 'epsilon': 0.3841355455448481}. Best is trial 149 with value: 0.7767469696771062.
Trial 856 finished with value: 0.42451269791632484 and parameters: {'kernel': 'sigmoid', 'epsilon': 0.8876425424089682}. Best is trial 149 with value: 0.7767469696771062.
Trial 865 finished with value: 0.4247022585192351 and parameters: {'kernel': 'sigmoid', 'epsilon': 0.6657432787031041}. Best is trial 149 with value: 0.7767469696771062.
Trial 866 finished with value: 0.4249855419021752 and parameters: {'kernel': 'sigmoid', 'epsilon': 0.0640959634735796}. Best is trial 149 with value: 0.7767469696771062.
Trial 859 finished with value: 0.3300284203729151 and parameters: {'kernel': 'poly', 'epsilon': 0.12606188386728012}. Best is trial 149 with value: 0.7767469696771062.
Trial 864 finished with value: 0.7757400639980843 and parameters: {'kernel': 'linear', 'epsilon': 0.8122602704355177}. Best is trial 149 with value: 0.7767469696771062.
Trial 855 finished with value: 0.42462863566895787 and parameters: {'kernel': 'sigmoid', 'epsilon': 0.8405666171918232}. Best is trial 149 with value: 0.7767469696771062.
Trial 868 finished with value: 0.3300168042120625 and parameters: {'kernel': 'poly', 'epsilon': 0.14330143267891615}. Best is trial 149 with value: 0.7767469696771062.
Trial 854 finished with value: 0.7765957386531326 and parameters: {'kernel': 'linear', 'epsilon': 0.169227558171121}. Best is trial 149 with value: 0.7767469696771062.
Trial 858 finished with value: 0.4244054027545168 and parameters: {'kernel': 'sigmoid', 'epsilon': 0.5211892396510003}. Best is trial 149 with value: 0.7767469696771062.
Trial 869 finished with value: 0.3299727924797645 and parameters: {'kernel': 'poly', 'epsilon': 0.21101657633657855}. Best is trial 149 with value: 0.7767469696771062.
Trial 857 finished with value: 0.3505418958363634 and parameters: {'kernel': 'rbf', 'epsilon': 0.12233640875549401}. Best is trial 149 with value: 0.7767469696771062.
Trial 870 finished with value: 0.3518902273086867 and parameters: {'kernel': 'rbf', 'epsilon': 0.5227802077705915}. Best is trial 149 with value: 0.7767469696771062.
Trial 875 finished with value: 0.7759539582082114 and parameters: {'kernel': 'linear', 'epsilon': 0.43567208053699413}. Best is trial 149 with value: 0.7767469696771062.
Trial 874 finished with value: 0.33010132790275426 and parameters: {'kernel': 'poly', 'epsilon': 0.02005893829375871}. Best is trial 149 with value: 0.7767469696771062.
Trial 873 finished with value: 0.330078334161217 and parameters: {'kernel': 'poly', 'epsilon': 0.04595910925849622}. Best is trial 149 with value: 0.7767469696771062.
Trial 877 finished with value: 0.32916814124150856 and parameters: {'kernel': 'poly', 'epsilon': 0.8782629763188937}. Best is trial 149 with value: 0.7767469696771062.
Trial 867 finished with value: 0.32974151696198933 and parameters: {'kernel': 'poly', 'epsilon': 0.4762856084028916}. Best is trial 149 with value: 0.7767469696771062.
Trial 872 finished with value: 0.32977716120031514 and parameters: {'kernel': 'poly', 'epsilon': 0.4410812198852251}. Best is trial 149 with value: 0.7767469696771062.
Trial 879 finished with value: 0.7766759073311978 and parameters: {'kernel': 'linear', 'epsilon': 0.13219078647940186}. Best is trial 149 with value: 0.7767469696771062.
Trial 876 finished with value: 0.7766277468284534 and parameters: {'kernel': 'linear', 'epsilon': 0.2990203538377627}. Best is trial 149 with value: 0.7767469696771062.
Trial 871 finished with value: 0.7755724589664356 and parameters: {'kernel': 'linear', 'epsilon': 0.8435144775268122}. Best is trial 149 with value: 0.7767469696771062.
Trial 880 finished with value: 0.33002961507484624 and parameters: {'kernel': 'poly', 'epsilon': 0.132221206065112}. Best is trial 149 with value: 0.7767469696771062.
Trial 882 finished with value: 0.7765952706250184 and parameters: {'kernel': 'linear', 'epsilon': 0.0557190269629354}. Best is trial 149 with value: 0.7767469696771062.
Trial 881 finished with value: 0.4247890333363852 and parameters: {'kernel': 'sigmoid', 'epsilon': 0.7234953834134892}. Best is trial 149 with value: 0.7767469696771062.
Trial 883 finished with value: 0.32982893586513323 and parameters: {'kernel': 'poly', 'epsilon': 0.3936923195153347}. Best is trial 149 with value: 0.7767469696771062.
Trial 885 finished with value: 0.351803970996904 and parameters: {'kernel': 'rbf', 'epsilon': 0.5013353251735676}. Best is trial 149 with value: 0.7767469696771062.
Trial 878 finished with value: 0.3503539536713612 and parameters: {'kernel': 'rbf', 'epsilon': 0.022274222587996606}. Best is trial 149 with value: 0.7767469696771062.
Trial 887 finished with value: 0.42399738661679204 and parameters: {'kernel': 'sigmoid', 'epsilon': 0.9892393622426106}. Best is trial 149 with value: 0.7767469696771062.
Trial 889 finished with value: 0.32971208680438924 and parameters: {'kernel': 'poly', 'epsilon': 0.4928029956052432}. Best is trial 149 with value: 0.7767469696771062.
Trial 891 finished with value: 0.7753296265382174 and parameters: {'kernel': 'linear', 'epsilon': 0.9591487074356941}. Best is trial 149 with value: 0.7767469696771062.
Trial 890 finished with value: 0.4243788123142799 and parameters: {'kernel': 'sigmoid', 'epsilon': 0.5021286374735403}. Best is trial 149 with value: 0.7767469696771062.
Trial 888 finished with value: 0.32997232204944676 and parameters: {'kernel': 'poly', 'epsilon': 0.21232701131952036}. Best is trial 149 with value: 0.7767469696771062.
Trial 895 finished with value: 0.3535290592614763 and parameters: {'kernel': 'rbf', 'epsilon': 0.9544101275732668}. Best is trial 149 with value: 0.7767469696771062.
Trial 884 finished with value: 0.4250389637547946 and parameters: {'kernel': 'sigmoid', 'epsilon': 0.21053335087523495}. Best is trial 149 with value: 0.7767469696771062.
Trial 886 finished with value: 0.7753439253833555 and parameters: {'kernel': 'linear', 'epsilon': 0.9442298433919193}. Best is trial 149 with value: 0.7767469696771062.
Trial 902 finished with value: 0.4244063113239627 and parameters: {'kernel': 'sigmoid', 'epsilon': 0.47685362949484866}. Best is trial 149 with value: 0.7767469696771062.
Trial 892 finished with value: 0.3301078615084282 and parameters: {'kernel': 'poly', 'epsilon': 0.011815780728198222}. Best is trial 149 with value: 0.7767469696771062.
Trial 900 finished with value: 0.4245227931674148 and parameters: {'kernel': 'sigmoid', 'epsilon': 0.4183578260976456}. Best is trial 149 with value: 0.7767469696771062.
Trial 901 finished with value: 0.3514596767304209 and parameters: {'kernel': 'rbf', 'epsilon': 0.432467140751818}. Best is trial 149 with value: 0.7767469696771062.
Trial 897 finished with value: 0.32950879130840555 and parameters: {'kernel': 'poly', 'epsilon': 0.5853154665616467}. Best is trial 149 with value: 0.7767469696771062.
Trial 893 finished with value: 0.350355908356807 and parameters: {'kernel': 'rbf', 'epsilon': 0.023483450919101312}. Best is trial 149 with value: 0.7767469696771062.
Trial 894 finished with value: 0.3299211918593047 and parameters: {'kernel': 'poly', 'epsilon': 0.29703180968710974}. Best is trial 149 with value: 0.7767469696771062.
Trial 899 finished with value: 0.42454730237137034 and parameters: {'kernel': 'sigmoid', 'epsilon': 0.385830106846195}. Best is trial 149 with value: 0.7767469696771062.
Trial 903 finished with value: 0.32982936264063156 and parameters: {'kernel': 'poly', 'epsilon': 0.39279435060223533}. Best is trial 149 with value: 0.7767469696771062.
Trial 898 finished with value: 0.35284933848618566 and parameters: {'kernel': 'rbf', 'epsilon': 0.7429561937752931}. Best is trial 149 with value: 0.7767469696771062.
Trial 908 finished with value: 0.35209238064779524 and parameters: {'kernel': 'rbf', 'epsilon': 0.5708289993933442}. Best is trial 149 with value: 0.7767469696771062.
Trial 904 finished with value: 0.4249750907273239 and parameters: {'kernel': 'sigmoid', 'epsilon': 0.057576791966534646}. Best is trial 149 with value: 0.7767469696771062.
Trial 907 finished with value: 0.7766035349660021 and parameters: {'kernel': 'linear', 'epsilon': 0.1805942656658579}. Best is trial 149 with value: 0.7767469696771062.
Trial 915 finished with value: 0.42442593835912773 and parameters: {'kernel': 'sigmoid', 'epsilon': 0.9376450198528583}. Best is trial 149 with value: 0.7767469696771062.
Trial 909 finished with value: 0.32908389425000534 and parameters: {'kernel': 'poly', 'epsilon': 0.95215320178627}. Best is trial 149 with value: 0.7767469696771062.
Trial 905 finished with value: 0.7763860487492338 and parameters: {'kernel': 'linear', 'epsilon': 0.34743014727688293}. Best is trial 149 with value: 0.7767469696771062.
Trial 912 finished with value: 0.7760497192959465 and parameters: {'kernel': 'linear', 'epsilon': 0.675994316907383}. Best is trial 149 with value: 0.7767469696771062.
Trial 906 finished with value: 0.33006666337868873 and parameters: {'kernel': 'poly', 'epsilon': 0.05815707942666848}. Best is trial 149 with value: 0.7767469696771062.
