Trial 642 finished with value: 0.7759538481502163 and parameters: {'kernel': 'linear', 'epsilon': 0.5623158439137351}. Best is trial 149 with value: 0.7767469696771062.
Trial 654 finished with value: 0.424533747204349 and parameters: {'kernel': 'sigmoid', 'epsilon': 0.400274443957618}. Best is trial 149 with value: 0.7767469696771062.
Trial 646 finished with value: 0.7757681116976237 and parameters: {'kernel': 'linear', 'epsilon': 0.5219960044343805}. Best is trial 149 with value: 0.7767469696771062.
Trial 658 finished with value: 0.35055141981063065 and parameters: {'kernel': 'rbf', 'epsilon': 0.12724968760949829}. Best is trial 149 with value: 0.7767469696771062.
Trial 655 finished with value: 0.4243618342468668 and parameters: {'kernel': 'sigmoid', 'epsilon': 0.5330831803691476}. Best is trial 149 with value: 0.7767469696771062.
Trial 651 finished with value: 0.7765844420897361 and parameters: {'kernel': 'linear', 'epsilon': 0.2677882684708336}. Best is trial 149 with value: 0.7767469696771062.
Trial 656 finished with value: 0.35044907510228335 and parameters: {'kernel': 'rbf', 'epsilon': 0.07774173175979449}. Best is trial 149 with value: 0.7767469696771062.
Trial 657 finished with value: 0.42439730117342817 and parameters: {'kernel': 'sigmoid', 'epsilon': 0.51485804734843}. Best is trial 149 with value: 0.7767469696771062.
Trial 662 finished with value: 0.32997067514766104 and parameters: {'kernel': 'poly', 'epsilon': 0.21594317979035127}. Best is trial 149 with value: 0.7767469696771062.
Trial 659 finished with value: 0.35047033023358626 and parameters: {'kernel': 'rbf', 'epsilon': 0.08875235567597883}. Best is trial 149 with value: 0.7767469696771062.
Trial 663 finished with value: 0.3509927131021655 and parameters: {'kernel': 'rbf', 'epsilon': 0.3037942950837518}. Best is trial 149 with value: 0.7767469696771062.
Trial 660 finished with value: 0.329340112506001 and parameters: {'kernel': 'poly', 'epsilon': 0.7696371837262534}. Best is trial 149 with value: 0.7767469696771062.
Trial 667 finished with value: 0.35346372990658853 and parameters: {'kernel': 'rbf', 'epsilon': 0.9324776794786955}. Best is trial 149 with value: 0.7767469696771062.
Trial 661 finished with value: 0.3529348750163048 and parameters: {'kernel': 'rbf', 'epsilon': 0.7686078347423678}. Best is trial 149 with value: 0.7767469696771062.
Trial 665 finished with value: 0.32997001044958396 and parameters: {'kernel': 'poly', 'epsilon': 0.21656212190350643}. Best is trial 149 with value: 0.7767469696771062.
Trial 672 finished with value: 0.3506156095347163 and parameters: {'kernel': 'rbf', 'epsilon': 0.15964650756596388}. Best is trial 149 with value: 0.7767469696771062.
Trial 664 finished with value: 0.3506280986482115 and parameters: {'kernel': 'rbf', 'epsilon': 0.16530968079477748}. Best is trial 149 with value: 0.7767469696771062.
Trial 666 finished with value: 0.3294306087982872 and parameters: {'kernel': 'poly', 'epsilon': 0.6465336621731709}. Best is trial 149 with value: 0.7767469696771062.
Trial 670 finished with value: 0.32916670867086606 and parameters: {'kernel': 'poly', 'epsilon': 0.8795486551211885}. Best is trial 149 with value: 0.7767469696771062.
Trial 674 finished with value: 0.4245021044462328 and parameters: {'kernel': 'sigmoid', 'epsilon': 0.43971941556423655}. Best is trial 149 with value: 0.7767469696771062.
Trial 668 finished with value: 0.32951978103075563 and parameters: {'kernel': 'poly', 'epsilon': 0.5785801549695124}. Best is trial 149 with value: 0.7767469696771062.
Trial 671 finished with value: 0.3513864745039356 and parameters: {'kernel': 'rbf', 'epsilon': 0.4153978867313115}. Best is trial 149 with value: 0.7767469696771062.
Trial 676 finished with value: 0.32941411243873403 and parameters: {'kernel': 'poly', 'epsilon': 0.6592744114531153}. Best is trial 149 with value: 0.7767469696771062.
Trial 675 finished with value: 0.3520665324477663 and parameters: {'kernel': 'rbf', 'epsilon': 0.5651542772152426}. Best is trial 149 with value: 0.7767469696771062.
Trial 677 finished with value: 0.3293842836205137 and parameters: {'kernel': 'poly', 'epsilon': 0.7136842893114884}. Best is trial 149 with value: 0.7767469696771062.
Trial 680 finished with value: 0.4249685751433983 and parameters: {'kernel': 'sigmoid', 'epsilon': 0.09900220409629312}. Best is trial 149 with value: 0.7767469696771062.
Trial 673 finished with value: 0.3505452639784169 and parameters: {'kernel': 'rbf', 'epsilon': 0.12415735533833505}. Best is trial 149 with value: 0.7767469696771062.
Trial 681 finished with value: 0.3298600709125275 and parameters: {'kernel': 'poly', 'epsilon': 0.3629879062699197}. Best is trial 149 with value: 0.7767469696771062.
Trial 692 finished with value: 0.7765693304974437 and parameters: {'kernel': 'linear', 'epsilon': 0.3163074577431002}. Best is trial 149 with value: 0.7767469696771062.
Trial 689 finished with value: 0.32909855629257095 and parameters: {'kernel': 'poly', 'epsilon': 0.942735370362659}. Best is trial 149 with value: 0.7767469696771062.
Trial 678 finished with value: 0.3529032971650825 and parameters: {'kernel': 'rbf', 'epsilon': 0.7590926257108934}. Best is trial 149 with value: 0.7767469696771062.
Trial 686 finished with value: 0.42463938493263215 and parameters: {'kernel': 'sigmoid', 'epsilon': 0.8366456019939055}. Best is trial 149 with value: 0.7767469696771062.
Trial 669 finished with value: 0.32938956967275546 and parameters: {'kernel': 'poly', 'epsilon': 0.7043966684533329}. Best is trial 149 with value: 0.7767469696771062.
Trial 687 finished with value: 0.7760250212093143 and parameters: {'kernel': 'linear', 'epsilon': 0.5857836821895794}. Best is trial 149 with value: 0.7767469696771062.
Trial 679 finished with value: 0.3512214812815826 and parameters: {'kernel': 'rbf', 'epsilon': 0.3720745189704481}. Best is trial 149 with value: 0.7767469696771062.
Trial 684 finished with value: 0.35186198297071297 and parameters: {'kernel': 'rbf', 'epsilon': 0.5147836685298791}. Best is trial 149 with value: 0.7767469696771062.
Trial 683 finished with value: 0.32977195496784395 and parameters: {'kernel': 'poly', 'epsilon': 0.4469718971451926}. Best is trial 149 with value: 0.7767469696771062.
Trial 690 finished with value: 0.4249758654847099 and parameters: {'kernel': 'sigmoid', 'epsilon': 0.08419068876441516}. Best is trial 149 with value: 0.7767469696771062.
Trial 697 finished with value: 0.32973664561981664 and parameters: {'kernel': 'poly', 'epsilon': 0.479020784936259}. Best is trial 149 with value: 0.7767469696771062.
Trial 691 finished with value: 0.4243971596620688 and parameters: {'kernel': 'sigmoid', 'epsilon': 0.5149475663525073}. Best is trial 149 with value: 0.7767469696771062.
Trial 685 finished with value: 0.4247080175376702 and parameters: {'kernel': 'sigmoid', 'epsilon': 0.7794971654852626}. Best is trial 149 with value: 0.7767469696771062.
Trial 688 finished with value: 0.32908595596077544 and parameters: {'kernel': 'poly', 'epsilon': 0.9508255037256835}. Best is trial 149 with value: 0.7767469696771062.
Trial 694 finished with value: 0.35232208825604294 and parameters: {'kernel': 'rbf', 'epsilon': 0.621126777415009}. Best is trial 149 with value: 0.7767469696771062.
Trial 693 finished with value: 0.3293576997285196 and parameters: {'kernel': 'poly', 'epsilon': 0.7467400479418711}. Best is trial 149 with value: 0.7767469696771062.
Trial 682 finished with value: 0.32908325008620526 and parameters: {'kernel': 'poly', 'epsilon': 0.9523967600925864}. Best is trial 149 with value: 0.7767469696771062.
Trial 695 finished with value: 0.3299834479510091 and parameters: {'kernel': 'poly', 'epsilon': 0.18902584708129322}. Best is trial 149 with value: 0.7767469696771062.
Trial 700 finished with value: 0.3291840643464189 and parameters: {'kernel': 'poly', 'epsilon': 0.8657971427549225}. Best is trial 149 with value: 0.7767469696771062.
Trial 699 finished with value: 0.32947513822056806 and parameters: {'kernel': 'poly', 'epsilon': 0.6073314212376636}. Best is trial 149 with value: 0.7767469696771062.
Trial 696 finished with value: 0.353407013791033 and parameters: {'kernel': 'rbf', 'epsilon': 0.9136702859602785}. Best is trial 149 with value: 0.7767469696771062.
Trial 698 finished with value: 0.35359903430721024 and parameters: {'kernel': 'rbf', 'epsilon': 0.9857667061535657}. Best is trial 149 with value: 0.7767469696771062.
Trial 706 finished with value: 0.3293004423896343 and parameters: {'kernel': 'poly', 'epsilon': 0.7979482317092804}. Best is trial 149 with value: 0.7767469696771062.
Trial 708 finished with value: 0.35248616138087313 and parameters: {'kernel': 'rbf', 'epsilon': 0.6535889556408664}. Best is trial 149 with value: 0.7767469696771062.
Trial 711 finished with value: 0.42497601058952794 and parameters: {'kernel': 'sigmoid', 'epsilon': 0.1058240049941267}. Best is trial 149 with value: 0.7767469696771062.
Trial 701 finished with value: 0.7752894305984336 and parameters: {'kernel': 'linear', 'epsilon': 0.9759579417519624}. Best is trial 149 with value: 0.7767469696771062.
Trial 707 finished with value: 0.3521246731134725 and parameters: {'kernel': 'rbf', 'epsilon': 0.578335895764803}. Best is trial 149 with value: 0.7767469696771062.
Trial 705 finished with value: 0.7753234793271219 and parameters: {'kernel': 'linear', 'epsilon': 0.9649003493023762}. Best is trial 149 with value: 0.7767469696771062.
Trial 710 finished with value: 0.3535323839689396 and parameters: {'kernel': 'rbf', 'epsilon': 0.9554788083725966}. Best is trial 149 with value: 0.7767469696771062.
Trial 702 finished with value: 0.3508273283139377 and parameters: {'kernel': 'rbf', 'epsilon': 0.23683768453217402}. Best is trial 149 with value: 0.7767469696771062.
Trial 703 finished with value: 0.3301040183137263 and parameters: {'kernel': 'poly', 'epsilon': 0.017577872756650015}. Best is trial 149 with value: 0.7767469696771062.
Trial 713 finished with value: 0.32962852682002064 and parameters: {'kernel': 'poly', 'epsilon': 0.5315251819541398}. Best is trial 149 with value: 0.7767469696771062.
Trial 704 finished with value: 0.7757165303649655 and parameters: {'kernel': 'linear', 'epsilon': 0.8165360570453203}. Best is trial 149 with value: 0.7767469696771062.
Trial 714 finished with value: 0.33006910618116797 and parameters: {'kernel': 'poly', 'epsilon': 0.05529190923600236}. Best is trial 149 with value: 0.7767469696771062.
Trial 719 finished with value: 0.7757426377004125 and parameters: {'kernel': 'linear', 'epsilon': 0.8119578710173888}. Best is trial 149 with value: 0.7767469696771062.
Trial 718 finished with value: 0.32989288813181317 and parameters: {'kernel': 'poly', 'epsilon': 0.3305850266993966}. Best is trial 149 with value: 0.7767469696771062.
Trial 721 finished with value: 0.35288648841863585 and parameters: {'kernel': 'rbf', 'epsilon': 0.7541208243934234}. Best is trial 149 with value: 0.7767469696771062.
Trial 723 finished with value: 0.3298050982478737 and parameters: {'kernel': 'poly', 'epsilon': 0.4131892510212095}. Best is trial 149 with value: 0.7767469696771062.
Trial 715 finished with value: 0.3504639344393759 and parameters: {'kernel': 'rbf', 'epsilon': 0.08513284245893915}. Best is trial 149 with value: 0.7767469696771062.
Trial 712 finished with value: 0.42450485937601784 and parameters: {'kernel': 'sigmoid', 'epsilon': 0.43676031861543996}. Best is trial 149 with value: 0.7767469696771062.
Trial 727 finished with value: 0.42457724842516764 and parameters: {'kernel': 'sigmoid', 'epsilon': 0.8685212258580509}. Best is trial 149 with value: 0.7767469696771062.
Trial 724 finished with value: 0.32993433006702905 and parameters: {'kernel': 'poly', 'epsilon': 0.25509845223065564}. Best is trial 149 with value: 0.7767469696771062.
Trial 720 finished with value: 0.3530524064728137 and parameters: {'kernel': 'rbf', 'epsilon': 0.7975374945085643}. Best is trial 149 with value: 0.7767469696771062.
Trial 728 finished with value: 0.424612622661921 and parameters: {'kernel': 'sigmoid', 'epsilon': 0.8517847105769505}. Best is trial 149 with value: 0.7767469696771062.
Trial 709 finished with value: 0.42444968124913107 and parameters: {'kernel': 'sigmoid', 'epsilon': 0.9142892243880906}. Best is trial 149 with value: 0.7767469696771062.
Trial 722 finished with value: 0.4243778009863449 and parameters: {'kernel': 'sigmoid', 'epsilon': 0.48929990718754257}. Best is trial 149 with value: 0.7767469696771062.
Trial 725 finished with value: 0.7766254768835801 and parameters: {'kernel': 'linear', 'epsilon': 0.2805267753289191}. Best is trial 149 with value: 0.7767469696771062.
Trial 717 finished with value: 0.3300027321506628 and parameters: {'kernel': 'poly', 'epsilon': 0.1567274359846984}. Best is trial 149 with value: 0.7767469696771062.
Trial 731 finished with value: 0.32995747322846414 and parameters: {'kernel': 'poly', 'epsilon': 0.22735749534311855}. Best is trial 149 with value: 0.7767469696771062.
Trial 736 finished with value: 0.7759586478285916 and parameters: {'kernel': 'linear', 'epsilon': 0.7557616129665314}. Best is trial 149 with value: 0.7767469696771062.
Trial 726 finished with value: 0.3293555130277421 and parameters: {'kernel': 'poly', 'epsilon': 0.7498413585021219}. Best is trial 149 with value: 0.7767469696771062.
Trial 729 finished with value: 0.35246870888718224 and parameters: {'kernel': 'rbf', 'epsilon': 0.6499580600008257}. Best is trial 149 with value: 0.7767469696771062.
Trial 716 finished with value: 0.32903191343378696 and parameters: {'kernel': 'poly', 'epsilon': 0.9784966802921141}. Best is trial 149 with value: 0.7767469696771062.
Trial 735 finished with value: 0.7766057220814433 and parameters: {'kernel': 'linear', 'epsilon': 0.27474150732766434}. Best is trial 149 with value: 0.7767469696771062.
Trial 732 finished with value: 0.42444713157720776 and parameters: {'kernel': 'sigmoid', 'epsilon': 0.9147303033288579}. Best is trial 149 with value: 0.7767469696771062.
Trial 740 finished with value: 0.3507493679599004 and parameters: {'kernel': 'rbf', 'epsilon': 0.20695680910055148}. Best is trial 149 with value: 0.7767469696771062.
Trial 733 finished with value: 0.7758624857263005 and parameters: {'kernel': 'linear', 'epsilon': 0.7927996497454801}. Best is trial 149 with value: 0.7767469696771062.
Trial 737 finished with value: 0.3299974687693169 and parameters: {'kernel': 'poly', 'epsilon': 0.16054056165562647}. Best is trial 149 with value: 0.7767469696771062.
Trial 745 finished with value: 0.775642807085301 and parameters: {'kernel': 'linear', 'epsilon': 0.8300135148718276}. Best is trial 149 with value: 0.7767469696771062.
Trial 739 finished with value: 0.3298544624518641 and parameters: {'kernel': 'poly', 'epsilon': 0.3687741221138854}. Best is trial 149 with value: 0.7767469696771062.
Trial 743 finished with value: 0.7760566573947664 and parameters: {'kernel': 'linear', 'epsilon': 0.6504682652856434}. Best is trial 149 with value: 0.7767469696771062.
Trial 734 finished with value: 0.35255666653822537 and parameters: {'kernel': 'rbf', 'epsilon': 0.6696872611032317}. Best is trial 149 with value: 0.7767469696771062.
Trial 742 finished with value: 0.4249597063244993 and parameters: {'kernel': 'sigmoid', 'epsilon': 0.05087748610121279}. Best is trial 149 with value: 0.7767469696771062.
Trial 738 finished with value: 0.42456964737706215 and parameters: {'kernel': 'sigmoid', 'epsilon': 0.8706286565889895}. Best is trial 149 with value: 0.7767469696771062.
Trial 730 finished with value: 0.35065538792783596 and parameters: {'kernel': 'rbf', 'epsilon': 0.1764302818732001}. Best is trial 149 with value: 0.7767469696771062.
Trial 744 finished with value: 0.4249679663941097 and parameters: {'kernel': 'sigmoid', 'epsilon': 0.09864863886225494}. Best is trial 149 with value: 0.7767469696771062.
Trial 750 finished with value: 0.4243948090808646 and parameters: {'kernel': 'sigmoid', 'epsilon': 0.5131615527881505}. Best is trial 149 with value: 0.7767469696771062.
Trial 746 finished with value: 0.3508407762787714 and parameters: {'kernel': 'rbf', 'epsilon': 0.24215155363891927}. Best is trial 149 with value: 0.7767469696771062.
Trial 755 finished with value: 0.3300134404323011 and parameters: {'kernel': 'poly', 'epsilon': 0.14696189284122496}. Best is trial 149 with value: 0.7767469696771062.
Trial 754 finished with value: 0.3292188552610792 and parameters: {'kernel': 'poly', 'epsilon': 0.8497815128279155}. Best is trial 149 with value: 0.7767469696771062.
Trial 752 finished with value: 0.3289953266995451 and parameters: {'kernel': 'poly', 'epsilon': 0.9972093678782223}. Best is trial 149 with value: 0.7767469696771062.
Trial 748 finished with value: 0.3298525913687266 and parameters: {'kernel': 'poly', 'epsilon': 0.37044081570010634}. Best is trial 149 with value: 0.7767469696771062.
Trial 747 finished with value: 0.35095254674821313 and parameters: {'kernel': 'rbf', 'epsilon': 0.28132682651381624}. Best is trial 149 with value: 0.7767469696771062.
Trial 741 finished with value: 0.3503273152965448 and parameters: {'kernel': 'rbf', 'epsilon': 0.005744275662089904}. Best is trial 149 with value: 0.7767469696771062.
Trial 757 finished with value: 0.7762520726458538 and parameters: {'kernel': 'linear', 'epsilon': 0.3668333211681568}. Best is trial 149 with value: 0.7767469696771062.
Trial 749 finished with value: 0.35131206692615125 and parameters: {'kernel': 'rbf', 'epsilon': 0.39408990981875913}. Best is trial 149 with value: 0.7767469696771062.
Trial 753 finished with value: 0.4242712735901022 and parameters: {'kernel': 'sigmoid', 'epsilon': 0.9604771542005547}. Best is trial 149 with value: 0.7767469696771062.
Trial 761 finished with value: 0.32932350961512963 and parameters: {'kernel': 'poly', 'epsilon': 0.7859728584358201}. Best is trial 149 with value: 0.7767469696771062.
Trial 759 finished with value: 0.3506185197095391 and parameters: {'kernel': 'rbf', 'epsilon': 0.16102233337151983}. Best is trial 149 with value: 0.7767469696771062.
Trial 762 finished with value: 0.7760361212261417 and parameters: {'kernel': 'linear', 'epsilon': 0.7035812967284754}. Best is trial 149 with value: 0.7767469696771062.
Trial 764 finished with value: 0.3291506477462145 and parameters: {'kernel': 'poly', 'epsilon': 0.8945653672180689}. Best is trial 149 with value: 0.7767469696771062.
Trial 751 finished with value: 0.35301252777176384 and parameters: {'kernel': 'rbf', 'epsilon': 0.7880341662684808}. Best is trial 149 with value: 0.7767469696771062.
Trial 760 finished with value: 0.7767310045383249 and parameters: {'kernel': 'linear', 'epsilon': 0.11406767454151534}. Best is trial 149 with value: 0.7767469696771062.
Trial 767 finished with value: 0.3509439484247308 and parameters: {'kernel': 'rbf', 'epsilon': 0.2775559319637345}. Best is trial 149 with value: 0.7767469696771062.
Trial 763 finished with value: 0.42438931852664863 and parameters: {'kernel': 'sigmoid', 'epsilon': 0.5093942755836224}. Best is trial 149 with value: 0.7767469696771062.
Trial 765 finished with value: 0.3510502568947419 and parameters: {'kernel': 'rbf', 'epsilon': 0.3309423578012668}. Best is trial 149 with value: 0.7767469696771062.
Trial 768 finished with value: 0.7753361095860802 and parameters: {'kernel': 'linear', 'epsilon': 0.9527475066085027}. Best is trial 149 with value: 0.7767469696771062.
Trial 758 finished with value: 0.3293442613048459 and parameters: {'kernel': 'poly', 'epsilon': 0.7642652185315412}. Best is trial 149 with value: 0.7767469696771062.
Trial 756 finished with value: 0.4245294142915627 and parameters: {'kernel': 'sigmoid', 'epsilon': 0.40890173903572424}. Best is trial 149 with value: 0.7767469696771062.
Trial 766 finished with value: 0.42479627498242517 and parameters: {'kernel': 'sigmoid', 'epsilon': 0.7129974395554157}. Best is trial 149 with value: 0.7767469696771062.
Trial 769 finished with value: 0.32928629401220355 and parameters: {'kernel': 'poly', 'epsilon': 0.8053954717713289}. Best is trial 149 with value: 0.7767469696771062.
Trial 771 finished with value: 0.7762044912212914 and parameters: {'kernel': 'linear', 'epsilon': 0.38019234237057997}. Best is trial 149 with value: 0.7767469696771062.
Trial 775 finished with value: 0.3294076457371105 and parameters: {'kernel': 'poly', 'epsilon': 0.6641940743931659}. Best is trial 149 with value: 0.7767469696771062.
Trial 772 finished with value: 0.4250964925242265 and parameters: {'kernel': 'sigmoid', 'epsilon': 0.18423737733797607}. Best is trial 149 with value: 0.7767469696771062.
Trial 780 finished with value: 0.35079573320867724 and parameters: {'kernel': 'rbf', 'epsilon': 0.2244997847685607}. Best is trial 149 with value: 0.7767469696771062.
Trial 773 finished with value: 0.7766048487454594 and parameters: {'kernel': 'linear', 'epsilon': 0.036320312671363264}. Best is trial 149 with value: 0.7767469696771062.
Trial 776 finished with value: 0.3508551073535305 and parameters: {'kernel': 'rbf', 'epsilon': 0.2474791625075211}. Best is trial 149 with value: 0.7767469696771062.
Trial 778 finished with value: 0.4244020805313541 and parameters: {'kernel': 'sigmoid', 'epsilon': 0.5185949484058247}. Best is trial 149 with value: 0.7767469696771062.
Trial 777 finished with value: 0.35158856273620503 and parameters: {'kernel': 'rbf', 'epsilon': 0.45663787880235507}. Best is trial 149 with value: 0.7767469696771062.
Trial 770 finished with value: 0.7760289119330944 and parameters: {'kernel': 'linear', 'epsilon': 0.5889866568040664}. Best is trial 149 with value: 0.7767469696771062.
Trial 774 finished with value: 0.42469878927034077 and parameters: {'kernel': 'sigmoid', 'epsilon': 0.7858308068428397}. Best is trial 149 with value: 0.7767469696771062.
Trial 783 finished with value: 0.32949540092265256 and parameters: {'kernel': 'poly', 'epsilon': 0.5938919313522846}. Best is trial 149 with value: 0.7767469696771062.
