Trial 264 finished with value: 0.7760396046512092 and parameters: {'kernel': 'linear', 'epsilon': 0.6136999883170567}. Best is trial 149 with value: 0.7767469696771062.
Trial 269 finished with value: 0.7759025901331489 and parameters: {'kernel': 'linear', 'epsilon': 0.7899876011309429}. Best is trial 149 with value: 0.7767469696771062.
Trial 254 finished with value: 0.3300012320548846 and parameters: {'kernel': 'poly', 'epsilon': 0.15746703519412064}. Best is trial 149 with value: 0.7767469696771062.
Trial 261 finished with value: 0.32987777422690534 and parameters: {'kernel': 'poly', 'epsilon': 0.345052342229457}. Best is trial 149 with value: 0.7767469696771062.
Trial 266 finished with value: 0.35151926678955253 and parameters: {'kernel': 'rbf', 'epsilon': 0.4433024493793497}. Best is trial 149 with value: 0.7767469696771062.
Trial 265 finished with value: 0.4244232410741765 and parameters: {'kernel': 'sigmoid', 'epsilon': 0.9380072961963656}. Best is trial 149 with value: 0.7767469696771062.
Trial 267 finished with value: 0.7765914498095693 and parameters: {'kernel': 'linear', 'epsilon': 0.16235943779629503}. Best is trial 149 with value: 0.7767469696771062.
Trial 270 finished with value: 0.7763505792077795 and parameters: {'kernel': 'linear', 'epsilon': 0.3543912755884504}. Best is trial 149 with value: 0.7767469696771062.
Trial 268 finished with value: 0.3526142825904905 and parameters: {'kernel': 'rbf', 'epsilon': 0.6840079728409068}. Best is trial 149 with value: 0.7767469696771062.
Trial 282 finished with value: 0.4246883366415576 and parameters: {'kernel': 'sigmoid', 'epsilon': 0.79018839044813}. Best is trial 149 with value: 0.7767469696771062.
Trial 276 finished with value: 0.7756926664479649 and parameters: {'kernel': 'linear', 'epsilon': 0.5088030247671386}. Best is trial 149 with value: 0.7767469696771062.
Trial 284 finished with value: 0.3297966577777838 and parameters: {'kernel': 'poly', 'epsilon': 0.41940854882623135}. Best is trial 149 with value: 0.7767469696771062.
Trial 272 finished with value: 0.7752307491697756 and parameters: {'kernel': 'linear', 'epsilon': 0.9899186385810945}. Best is trial 149 with value: 0.7767469696771062.
Trial 263 finished with value: 0.35277496230344074 and parameters: {'kernel': 'rbf', 'epsilon': 0.7236330628902587}. Best is trial 149 with value: 0.7767469696771062.
Trial 278 finished with value: 0.42497565535372156 and parameters: {'kernel': 'sigmoid', 'epsilon': 0.05803092192837622}. Best is trial 149 with value: 0.7767469696771062.
Trial 280 finished with value: 0.4244610151903451 and parameters: {'kernel': 'sigmoid', 'epsilon': 0.9003513136022145}. Best is trial 149 with value: 0.7767469696771062.
Trial 271 finished with value: 0.4250161482842971 and parameters: {'kernel': 'sigmoid', 'epsilon': 0.15184872170752828}. Best is trial 149 with value: 0.7767469696771062.
Trial 273 finished with value: 0.7767168305604032 and parameters: {'kernel': 'linear', 'epsilon': 0.1265050632266329}. Best is trial 149 with value: 0.7767469696771062.
Trial 281 finished with value: 0.4247467142040258 and parameters: {'kernel': 'sigmoid', 'epsilon': 0.7480879505011838}. Best is trial 149 with value: 0.7767469696771062.
Trial 274 finished with value: 0.7751914514316254 and parameters: {'kernel': 'linear', 'epsilon': 0.9993144411077107}. Best is trial 149 with value: 0.7767469696771062.
Trial 286 finished with value: 0.7766356209288522 and parameters: {'kernel': 'linear', 'epsilon': 0.28584091790926414}. Best is trial 149 with value: 0.7767469696771062.
Trial 287 finished with value: 0.7757328441269742 and parameters: {'kernel': 'linear', 'epsilon': 0.813871146747982}. Best is trial 149 with value: 0.7767469696771062.
Trial 285 finished with value: 0.32997105743223115 and parameters: {'kernel': 'poly', 'epsilon': 0.21391042630372514}. Best is trial 149 with value: 0.7767469696771062.
Trial 277 finished with value: 0.7753379285214113 and parameters: {'kernel': 'linear', 'epsilon': 0.9519784639581914}. Best is trial 149 with value: 0.7767469696771062.
Trial 289 finished with value: 0.3297651820510119 and parameters: {'kernel': 'poly', 'epsilon': 0.4563224719757799}. Best is trial 149 with value: 0.7767469696771062.
Trial 275 finished with value: 0.42462476912128455 and parameters: {'kernel': 'sigmoid', 'epsilon': 0.3657309649211312}. Best is trial 149 with value: 0.7767469696771062.
Trial 290 finished with value: 0.35082810772394024 and parameters: {'kernel': 'rbf', 'epsilon': 0.23676211595247354}. Best is trial 149 with value: 0.7767469696771062.
Trial 283 finished with value: 0.7762373974963165 and parameters: {'kernel': 'linear', 'epsilon': 0.3703680469596745}. Best is trial 149 with value: 0.7767469696771062.
Trial 288 finished with value: 0.7757031713102656 and parameters: {'kernel': 'linear', 'epsilon': 0.5105921439721907}. Best is trial 149 with value: 0.7767469696771062.
Trial 279 finished with value: 0.3300429848631696 and parameters: {'kernel': 'poly', 'epsilon': 0.08173133080628936}. Best is trial 149 with value: 0.7767469696771062.
Trial 291 finished with value: 0.3518495112546967 and parameters: {'kernel': 'rbf', 'epsilon': 0.5117428413366257}. Best is trial 149 with value: 0.7767469696771062.
Trial 299 finished with value: 0.3299824388325475 and parameters: {'kernel': 'poly', 'epsilon': 0.18987117927166308}. Best is trial 149 with value: 0.7767469696771062.
Trial 297 finished with value: 0.7765964647889664 and parameters: {'kernel': 'linear', 'epsilon': 0.17103013346597662}. Best is trial 149 with value: 0.7767469696771062.
Trial 293 finished with value: 0.35077979839962037 and parameters: {'kernel': 'rbf', 'epsilon': 0.21858357627802905}. Best is trial 149 with value: 0.7767469696771062.
Trial 294 finished with value: 0.7759002033638172 and parameters: {'kernel': 'linear', 'epsilon': 0.5484772072609366}. Best is trial 149 with value: 0.7767469696771062.
Trial 292 finished with value: 0.3291550282695721 and parameters: {'kernel': 'poly', 'epsilon': 0.8897805017224528}. Best is trial 149 with value: 0.7767469696771062.
Trial 300 finished with value: 0.4250113755049144 and parameters: {'kernel': 'sigmoid', 'epsilon': 0.21442180560128377}. Best is trial 149 with value: 0.7767469696771062.
Trial 304 finished with value: 0.7760234625709875 and parameters: {'kernel': 'linear', 'epsilon': 0.5996186613812048}. Best is trial 149 with value: 0.7767469696771062.
Trial 305 finished with value: 0.3293910457091562 and parameters: {'kernel': 'poly', 'epsilon': 0.703499276250828}. Best is trial 149 with value: 0.7767469696771062.
Trial 296 finished with value: 0.424692442767475 and parameters: {'kernel': 'sigmoid', 'epsilon': 0.7889235359752645}. Best is trial 149 with value: 0.7767469696771062.
Trial 301 finished with value: 0.42471202856367835 and parameters: {'kernel': 'sigmoid', 'epsilon': 0.7650137455588738}. Best is trial 149 with value: 0.7767469696771062.
Trial 295 finished with value: 0.3527673736640452 and parameters: {'kernel': 'rbf', 'epsilon': 0.7217644921314416}. Best is trial 149 with value: 0.7767469696771062.
Trial 298 finished with value: 0.32987329612276534 and parameters: {'kernel': 'poly', 'epsilon': 0.3498576759537182}. Best is trial 149 with value: 0.7767469696771062.
Trial 302 finished with value: 0.4249882447263305 and parameters: {'kernel': 'sigmoid', 'epsilon': 0.06675717769865519}. Best is trial 149 with value: 0.7767469696771062.
Trial 303 finished with value: 0.32919181910698064 and parameters: {'kernel': 'poly', 'epsilon': 0.8623781065029208}. Best is trial 149 with value: 0.7767469696771062.
Trial 309 finished with value: 0.32958892255024114 and parameters: {'kernel': 'poly', 'epsilon': 0.5475927251706052}. Best is trial 149 with value: 0.7767469696771062.
Trial 313 finished with value: 0.3507657274289059 and parameters: {'kernel': 'rbf', 'epsilon': 0.21324165351747193}. Best is trial 149 with value: 0.7767469696771062.
Trial 306 finished with value: 0.7765588233621238 and parameters: {'kernel': 'linear', 'epsilon': 0.23116883144359712}. Best is trial 149 with value: 0.7767469696771062.
Trial 315 finished with value: 0.4245358795931139 and parameters: {'kernel': 'sigmoid', 'epsilon': 0.8819994422798686}. Best is trial 149 with value: 0.7767469696771062.
Trial 312 finished with value: 0.3535687416857104 and parameters: {'kernel': 'rbf', 'epsilon': 0.9712658675123695}. Best is trial 149 with value: 0.7767469696771062.
Trial 311 finished with value: 0.3291736209875259 and parameters: {'kernel': 'poly', 'epsilon': 0.873351539358149}. Best is trial 149 with value: 0.7767469696771062.
Trial 314 finished with value: 0.35103002080300105 and parameters: {'kernel': 'rbf', 'epsilon': 0.3223046413620094}. Best is trial 149 with value: 0.7767469696771062.
Trial 308 finished with value: 0.42437718803271574 and parameters: {'kernel': 'sigmoid', 'epsilon': 0.5008386945589872}. Best is trial 149 with value: 0.7767469696771062.
Trial 316 finished with value: 0.3533340082629623 and parameters: {'kernel': 'rbf', 'epsilon': 0.8915097327664885}. Best is trial 149 with value: 0.7767469696771062.
Trial 310 finished with value: 0.35323269697741033 and parameters: {'kernel': 'rbf', 'epsilon': 0.8546408227800536}. Best is trial 149 with value: 0.7767469696771062.
Trial 307 finished with value: 0.32978498928629485 and parameters: {'kernel': 'poly', 'epsilon': 0.4302580066862046}. Best is trial 149 with value: 0.7767469696771062.
Trial 318 finished with value: 0.7762556763294964 and parameters: {'kernel': 'linear', 'epsilon': 0.3662970432028113}. Best is trial 149 with value: 0.7767469696771062.
Trial 317 finished with value: 0.32994454565620435 and parameters: {'kernel': 'poly', 'epsilon': 0.23981996850008713}. Best is trial 149 with value: 0.7767469696771062.
Trial 320 finished with value: 0.775797827810661 and parameters: {'kernel': 'linear', 'epsilon': 0.5271578851939271}. Best is trial 149 with value: 0.7767469696771062.
Trial 324 finished with value: 0.4246297877990421 and parameters: {'kernel': 'sigmoid', 'epsilon': 0.3636281769494978}. Best is trial 149 with value: 0.7767469696771062.
Trial 319 finished with value: 0.4245252424104563 and parameters: {'kernel': 'sigmoid', 'epsilon': 0.4135882351309037}. Best is trial 149 with value: 0.7767469696771062.
Trial 331 finished with value: 0.7765957739528202 and parameters: {'kernel': 'linear', 'epsilon': 0.059875100470435205}. Best is trial 149 with value: 0.7767469696771062.
Trial 325 finished with value: 0.42490691737402886 and parameters: {'kernel': 'sigmoid', 'epsilon': 0.029151853477148548}. Best is trial 149 with value: 0.7767469696771062.
Trial 322 finished with value: 0.3512687436283426 and parameters: {'kernel': 'rbf', 'epsilon': 0.3837049185347967}. Best is trial 149 with value: 0.7767469696771062.
Trial 323 finished with value: 0.3516267302651569 and parameters: {'kernel': 'rbf', 'epsilon': 0.46339780770999195}. Best is trial 149 with value: 0.7767469696771062.
Trial 334 finished with value: 0.7765961915173241 and parameters: {'kernel': 'linear', 'epsilon': 0.05838530440097234}. Best is trial 149 with value: 0.7767469696771062.
Trial 326 finished with value: 0.7753206261379015 and parameters: {'kernel': 'linear', 'epsilon': 0.9686069782747916}. Best is trial 149 with value: 0.7767469696771062.
Trial 321 finished with value: 0.4250611546332491 and parameters: {'kernel': 'sigmoid', 'epsilon': 0.20676967659898093}. Best is trial 149 with value: 0.7767469696771062.
Trial 333 finished with value: 0.42480060875632397 and parameters: {'kernel': 'sigmoid', 'epsilon': 0.3030449250637466}. Best is trial 149 with value: 0.7767469696771062.
Trial 328 finished with value: 0.33001532140232837 and parameters: {'kernel': 'poly', 'epsilon': 0.14483052559704612}. Best is trial 149 with value: 0.7767469696771062.
Trial 336 finished with value: 0.7760428763851022 and parameters: {'kernel': 'linear', 'epsilon': 0.42570223515853267}. Best is trial 149 with value: 0.7767469696771062.
Trial 341 finished with value: 0.4248513821832157 and parameters: {'kernel': 'sigmoid', 'epsilon': 0.010339229618355539}. Best is trial 149 with value: 0.7767469696771062.
Trial 332 finished with value: 0.7755417435307547 and parameters: {'kernel': 'linear', 'epsilon': 0.874257730716387}. Best is trial 149 with value: 0.7767469696771062.
Trial 329 finished with value: 0.42466250382554804 and parameters: {'kernel': 'sigmoid', 'epsilon': 0.8190536267408}. Best is trial 149 with value: 0.7767469696771062.
Trial 327 finished with value: 0.3299722036208746 and parameters: {'kernel': 'poly', 'epsilon': 0.2125391433281778}. Best is trial 149 with value: 0.7767469696771062.
Trial 337 finished with value: 0.352135470976771 and parameters: {'kernel': 'rbf', 'epsilon': 0.5809556704399994}. Best is trial 149 with value: 0.7767469696771062.
Trial 330 finished with value: 0.4250666658542787 and parameters: {'kernel': 'sigmoid', 'epsilon': 0.20523854696882848}. Best is trial 149 with value: 0.7767469696771062.
Trial 338 finished with value: 0.3503900436055448 and parameters: {'kernel': 'rbf', 'epsilon': 0.048650242537706556}. Best is trial 149 with value: 0.7767469696771062.
Trial 350 finished with value: 0.7766115134470947 and parameters: {'kernel': 'linear', 'epsilon': 0.026629423425143184}. Best is trial 149 with value: 0.7767469696771062.
Trial 351 finished with value: 0.42441220997556905 and parameters: {'kernel': 'sigmoid', 'epsilon': 0.4742037597765204}. Best is trial 149 with value: 0.7767469696771062.
Trial 339 finished with value: 0.7766298438711983 and parameters: {'kernel': 'linear', 'epsilon': 0.2814925501441189}. Best is trial 149 with value: 0.7767469696771062.
Trial 346 finished with value: 0.4248639386739429 and parameters: {'kernel': 'sigmoid', 'epsilon': 0.27602879151860604}. Best is trial 149 with value: 0.7767469696771062.
Trial 344 finished with value: 0.35320928838512805 and parameters: {'kernel': 'rbf', 'epsilon': 0.8436204883923434}. Best is trial 149 with value: 0.7767469696771062.
Trial 340 finished with value: 0.3525729729892192 and parameters: {'kernel': 'rbf', 'epsilon': 0.6739086613865165}. Best is trial 149 with value: 0.7767469696771062.
Trial 342 finished with value: 0.42441998742102294 and parameters: {'kernel': 'sigmoid', 'epsilon': 0.9385383092815641}. Best is trial 149 with value: 0.7767469696771062.
Trial 345 finished with value: 0.35327134348007944 and parameters: {'kernel': 'rbf', 'epsilon': 0.8699793742892903}. Best is trial 149 with value: 0.7767469696771062.
Trial 343 finished with value: 0.7757367350095739 and parameters: {'kernel': 'linear', 'epsilon': 0.4809748698446371}. Best is trial 149 with value: 0.7767469696771062.
Trial 347 finished with value: 0.32936940315872776 and parameters: {'kernel': 'poly', 'epsilon': 0.7332949779209827}. Best is trial 149 with value: 0.7767469696771062.
Trial 353 finished with value: 0.3294853709076578 and parameters: {'kernel': 'poly', 'epsilon': 0.6010738324163815}. Best is trial 149 with value: 0.7767469696771062.
Trial 335 finished with value: 0.35358811494983405 and parameters: {'kernel': 'rbf', 'epsilon': 0.9805526554560392}. Best is trial 149 with value: 0.7767469696771062.
Trial 349 finished with value: 0.42456634314108477 and parameters: {'kernel': 'sigmoid', 'epsilon': 0.8716138790567179}. Best is trial 149 with value: 0.7767469696771062.
Trial 355 finished with value: 0.7759648179634946 and parameters: {'kernel': 'linear', 'epsilon': 0.7461967538862584}. Best is trial 149 with value: 0.7767469696771062.
Trial 352 finished with value: 0.4249946715943909 and parameters: {'kernel': 'sigmoid', 'epsilon': 0.07104757494689129}. Best is trial 149 with value: 0.7767469696771062.
Trial 358 finished with value: 0.7760448397903563 and parameters: {'kernel': 'linear', 'epsilon': 0.6825809910508206}. Best is trial 149 with value: 0.7767469696771062.
Trial 360 finished with value: 0.7762224580048025 and parameters: {'kernel': 'linear', 'epsilon': 0.3746278995430844}. Best is trial 149 with value: 0.7767469696771062.
Trial 348 finished with value: 0.35097846248138664 and parameters: {'kernel': 'rbf', 'epsilon': 0.2954767394888216}. Best is trial 149 with value: 0.7767469696771062.
Trial 356 finished with value: 0.32992620981262466 and parameters: {'kernel': 'poly', 'epsilon': 0.2894955002071964}. Best is trial 149 with value: 0.7767469696771062.
Trial 354 finished with value: 0.4249844313726217 and parameters: {'kernel': 'sigmoid', 'epsilon': 0.11099901136465151}. Best is trial 149 with value: 0.7767469696771062.
Trial 357 finished with value: 0.4246406554920356 and parameters: {'kernel': 'sigmoid', 'epsilon': 0.35826409260195824}. Best is trial 149 with value: 0.7767469696771062.
Trial 370 finished with value: 0.7767013515154529 and parameters: {'kernel': 'linear', 'epsilon': 0.1285364041592959}. Best is trial 149 with value: 0.7767469696771062.
Trial 359 finished with value: 0.4245758719766736 and parameters: {'kernel': 'sigmoid', 'epsilon': 0.6346013729934727}. Best is trial 149 with value: 0.7767469696771062.
Trial 361 finished with value: 0.4250017723887482 and parameters: {'kernel': 'sigmoid', 'epsilon': 0.1387416254207191}. Best is trial 149 with value: 0.7767469696771062.
Trial 362 finished with value: 0.4243788097155418 and parameters: {'kernel': 'sigmoid', 'epsilon': 0.48808528305306065}. Best is trial 149 with value: 0.7767469696771062.
Trial 366 finished with value: 0.35352727002967826 and parameters: {'kernel': 'rbf', 'epsilon': 0.9538074076198338}. Best is trial 149 with value: 0.7767469696771062.
Trial 372 finished with value: 0.4246116718843149 and parameters: {'kernel': 'sigmoid', 'epsilon': 0.3721925328708119}. Best is trial 149 with value: 0.7767469696771062.
Trial 363 finished with value: 0.3512152762507364 and parameters: {'kernel': 'rbf', 'epsilon': 0.37029255447689835}. Best is trial 149 with value: 0.7767469696771062.
Trial 376 finished with value: 0.3299329660504805 and parameters: {'kernel': 'poly', 'epsilon': 0.2574012746270581}. Best is trial 149 with value: 0.7767469696771062.
Trial 367 finished with value: 0.424584562368985 and parameters: {'kernel': 'sigmoid', 'epsilon': 0.8661857905665307}. Best is trial 149 with value: 0.7767469696771062.
Trial 374 finished with value: 0.3289952777879503 and parameters: {'kernel': 'poly', 'epsilon': 0.9973662490504693}. Best is trial 149 with value: 0.7767469696771062.
Trial 365 finished with value: 0.4247105771149961 and parameters: {'kernel': 'sigmoid', 'epsilon': 0.7711609221110177}. Best is trial 149 with value: 0.7767469696771062.
Trial 369 finished with value: 0.7757973207672023 and parameters: {'kernel': 'linear', 'epsilon': 0.45892703529724055}. Best is trial 149 with value: 0.7767469696771062.
Trial 368 finished with value: 0.7766622291708324 and parameters: {'kernel': 'linear', 'epsilon': 0.0992375942799858}. Best is trial 149 with value: 0.7767469696771062.
Trial 364 finished with value: 0.7765944943905595 and parameters: {'kernel': 'linear', 'epsilon': 0.16432679897989289}. Best is trial 149 with value: 0.7767469696771062.
Trial 373 finished with value: 0.35224138525345666 and parameters: {'kernel': 'rbf', 'epsilon': 0.6050506433630071}. Best is trial 149 with value: 0.7767469696771062.
Trial 371 finished with value: 0.42496316071653534 and parameters: {'kernel': 'sigmoid', 'epsilon': 0.09344806662388305}. Best is trial 149 with value: 0.7767469696771062.
Trial 377 finished with value: 0.7765973477772692 and parameters: {'kernel': 'linear', 'epsilon': 0.1432765178326051}. Best is trial 149 with value: 0.7767469696771062.
Trial 375 finished with value: 0.7758413616083245 and parameters: {'kernel': 'linear', 'epsilon': 0.44974276245532807}. Best is trial 149 with value: 0.7767469696771062.
Trial 381 finished with value: 0.7765940075154021 and parameters: {'kernel': 'linear', 'epsilon': 0.04838163046912625}. Best is trial 149 with value: 0.7767469696771062.
Trial 378 finished with value: 0.7766220869865793 and parameters: {'kernel': 'linear', 'epsilon': 0.3008702556726811}. Best is trial 149 with value: 0.7767469696771062.
Trial 379 finished with value: 0.3508379952652768 and parameters: {'kernel': 'rbf', 'epsilon': 0.2403587348379187}. Best is trial 149 with value: 0.7767469696771062.
Trial 383 finished with value: 0.3522173458166258 and parameters: {'kernel': 'rbf', 'epsilon': 0.5997065357412628}. Best is trial 149 with value: 0.7767469696771062.
Trial 382 finished with value: 0.7760087037883865 and parameters: {'kernel': 'linear', 'epsilon': 0.7305595235768131}. Best is trial 149 with value: 0.7767469696771062.
Trial 386 finished with value: 0.32939043630277065 and parameters: {'kernel': 'poly', 'epsilon': 0.7038188791359549}. Best is trial 149 with value: 0.7767469696771062.
Trial 384 finished with value: 0.32904569991323146 and parameters: {'kernel': 'poly', 'epsilon': 0.9721566933153369}. Best is trial 149 with value: 0.7767469696771062.
Trial 388 finished with value: 0.32960870438364 and parameters: {'kernel': 'poly', 'epsilon': 0.5394516399529403}. Best is trial 149 with value: 0.7767469696771062.
Trial 391 finished with value: 0.4246470988074636 and parameters: {'kernel': 'sigmoid', 'epsilon': 0.6515663595392143}. Best is trial 149 with value: 0.7767469696771062.
Trial 385 finished with value: 0.35081354994054575 and parameters: {'kernel': 'rbf', 'epsilon': 0.23120278879477907}. Best is trial 149 with value: 0.7767469696771062.
Trial 392 finished with value: 0.352068703220632 and parameters: {'kernel': 'rbf', 'epsilon': 0.5656042105237886}. Best is trial 149 with value: 0.7767469696771062.
Trial 396 finished with value: 0.424805680560965 and parameters: {'kernel': 'sigmoid', 'epsilon': 0.3003713414373481}. Best is trial 149 with value: 0.7767469696771062.
Trial 398 finished with value: 0.3297943735060481 and parameters: {'kernel': 'poly', 'epsilon': 0.4212589822855386}. Best is trial 149 with value: 0.7767469696771062.
