Trial 399 finished with value: 0.7753875862386547 and parameters: {'kernel': 'linear', 'epsilon': 0.9303325927234339}. Best is trial 149 with value: 0.7767469696771062.
Trial 402 finished with value: 0.7755616882197478 and parameters: {'kernel': 'linear', 'epsilon': 0.8657277510023154}. Best is trial 149 with value: 0.7767469696771062.
Trial 393 finished with value: 0.3291407661888752 and parameters: {'kernel': 'poly', 'epsilon': 0.9092744080519093}. Best is trial 149 with value: 0.7767469696771062.
Trial 400 finished with value: 0.7754563370760555 and parameters: {'kernel': 'linear', 'epsilon': 0.8947225793006196}. Best is trial 149 with value: 0.7767469696771062.
Trial 394 finished with value: 0.7753635203886164 and parameters: {'kernel': 'linear', 'epsilon': 0.9360531590615393}. Best is trial 149 with value: 0.7767469696771062.
Trial 389 finished with value: 0.35282635568137233 and parameters: {'kernel': 'rbf', 'epsilon': 0.7362888844387775}. Best is trial 149 with value: 0.7767469696771062.
Trial 390 finished with value: 0.3291144284585171 and parameters: {'kernel': 'poly', 'epsilon': 0.9316689537582435}. Best is trial 149 with value: 0.7767469696771062.
Trial 395 finished with value: 0.7765957871863189 and parameters: {'kernel': 'linear', 'epsilon': 0.16937909175843024}. Best is trial 149 with value: 0.7767469696771062.
Trial 387 finished with value: 0.4243924518896597 and parameters: {'kernel': 'sigmoid', 'epsilon': 0.5113844005172495}. Best is trial 149 with value: 0.7767469696771062.
Trial 397 finished with value: 0.4250077154450729 and parameters: {'kernel': 'sigmoid', 'epsilon': 0.215167631227553}. Best is trial 149 with value: 0.7767469696771062.
Trial 401 finished with value: 0.32962267508810683 and parameters: {'kernel': 'poly', 'epsilon': 0.5337942141689183}. Best is trial 149 with value: 0.7767469696771062.
Trial 404 finished with value: 0.4244513123956522 and parameters: {'kernel': 'sigmoid', 'epsilon': 0.9106905085990443}. Best is trial 149 with value: 0.7767469696771062.
Trial 403 finished with value: 0.32939635863739847 and parameters: {'kernel': 'poly', 'epsilon': 0.6945147412169799}. Best is trial 149 with value: 0.7767469696771062.
Trial 406 finished with value: 0.35190542417554815 and parameters: {'kernel': 'rbf', 'epsilon': 0.5271020934325653}. Best is trial 149 with value: 0.7767469696771062.
Trial 407 finished with value: 0.35239807971900905 and parameters: {'kernel': 'rbf', 'epsilon': 0.636120945806032}. Best is trial 149 with value: 0.7767469696771062.
Trial 411 finished with value: 0.32986693071922313 and parameters: {'kernel': 'poly', 'epsilon': 0.3557837579210933}. Best is trial 149 with value: 0.7767469696771062.
Trial 409 finished with value: 0.35129338674835847 and parameters: {'kernel': 'rbf', 'epsilon': 0.3896678378659362}. Best is trial 149 with value: 0.7767469696771062.
Trial 410 finished with value: 0.7753397022527242 and parameters: {'kernel': 'linear', 'epsilon': 0.9499457327416776}. Best is trial 149 with value: 0.7767469696771062.
Trial 405 finished with value: 0.7760285034007823 and parameters: {'kernel': 'linear', 'epsilon': 0.5943439771199178}. Best is trial 149 with value: 0.7767469696771062.
Trial 413 finished with value: 0.35323830575239956 and parameters: {'kernel': 'rbf', 'epsilon': 0.8573225361451761}. Best is trial 149 with value: 0.7767469696771062.
Trial 380 finished with value: 0.776046412077785 and parameters: {'kernel': 'linear', 'epsilon': 0.6255799102948226}. Best is trial 149 with value: 0.7767469696771062.
Trial 408 finished with value: 0.33007120994739103 and parameters: {'kernel': 'poly', 'epsilon': 0.05325134556261635}. Best is trial 149 with value: 0.7767469696771062.
Trial 412 finished with value: 0.42438835707939015 and parameters: {'kernel': 'sigmoid', 'epsilon': 0.5088218556339654}. Best is trial 149 with value: 0.7767469696771062.
Trial 424 finished with value: 0.7763405950208022 and parameters: {'kernel': 'linear', 'epsilon': 0.3558908980804222}. Best is trial 149 with value: 0.7767469696771062.
Trial 417 finished with value: 0.7760410828874728 and parameters: {'kernel': 'linear', 'epsilon': 0.6145870504763002}. Best is trial 149 with value: 0.7767469696771062.
Trial 419 finished with value: 0.4250050482115751 and parameters: {'kernel': 'sigmoid', 'epsilon': 0.14356773325142347}. Best is trial 149 with value: 0.7767469696771062.
Trial 416 finished with value: 0.7765850164994006 and parameters: {'kernel': 'linear', 'epsilon': 0.0753237958683437}. Best is trial 149 with value: 0.7767469696771062.
Trial 414 finished with value: 0.33002079918171534 and parameters: {'kernel': 'poly', 'epsilon': 0.13994297212767004}. Best is trial 149 with value: 0.7767469696771062.
Trial 421 finished with value: 0.4242985778188788 and parameters: {'kernel': 'sigmoid', 'epsilon': 0.9564464016849583}. Best is trial 149 with value: 0.7767469696771062.
Trial 423 finished with value: 0.32908411427309164 and parameters: {'kernel': 'poly', 'epsilon': 0.9519723759006835}. Best is trial 149 with value: 0.7767469696771062.
Trial 418 finished with value: 0.3513462325884829 and parameters: {'kernel': 'rbf', 'epsilon': 0.4040719294082131}. Best is trial 149 with value: 0.7767469696771062.
Trial 426 finished with value: 0.3300037676563224 and parameters: {'kernel': 'poly', 'epsilon': 0.15546100130833074}. Best is trial 149 with value: 0.7767469696771062.
Trial 420 finished with value: 0.32899441980232613 and parameters: {'kernel': 'poly', 'epsilon': 0.9979796739659136}. Best is trial 149 with value: 0.7767469696771062.
Trial 425 finished with value: 0.42508816285459805 and parameters: {'kernel': 'sigmoid', 'epsilon': 0.1797390550684701}. Best is trial 149 with value: 0.7767469696771062.
Trial 415 finished with value: 0.350697336643194 and parameters: {'kernel': 'rbf', 'epsilon': 0.19021418085094277}. Best is trial 149 with value: 0.7767469696771062.
Trial 429 finished with value: 0.4248271167709343 and parameters: {'kernel': 'sigmoid', 'epsilon': 0.2913782739084535}. Best is trial 149 with value: 0.7767469696771062.
Trial 428 finished with value: 0.35153191778380966 and parameters: {'kernel': 'rbf', 'epsilon': 0.4456211258102172}. Best is trial 149 with value: 0.7767469696771062.
Trial 427 finished with value: 0.7759595900046901 and parameters: {'kernel': 'linear', 'epsilon': 0.5638426840742085}. Best is trial 149 with value: 0.7767469696771062.
Trial 434 finished with value: 0.32975762976143974 and parameters: {'kernel': 'poly', 'epsilon': 0.4630634791799152}. Best is trial 149 with value: 0.7767469696771062.
Trial 422 finished with value: 0.3505333993331603 and parameters: {'kernel': 'rbf', 'epsilon': 0.11726588874338817}. Best is trial 149 with value: 0.7767469696771062.
Trial 432 finished with value: 0.3298197356625345 and parameters: {'kernel': 'poly', 'epsilon': 0.4021843192975686}. Best is trial 149 with value: 0.7767469696771062.
Trial 435 finished with value: 0.42391896693825365 and parameters: {'kernel': 'sigmoid', 'epsilon': 0.9969037494343607}. Best is trial 149 with value: 0.7767469696771062.
Trial 430 finished with value: 0.4248306326221374 and parameters: {'kernel': 'sigmoid', 'epsilon': 0.28969885548556407}. Best is trial 149 with value: 0.7767469696771062.
Trial 437 finished with value: 0.3295107907187718 and parameters: {'kernel': 'poly', 'epsilon': 0.5837171517422819}. Best is trial 149 with value: 0.7767469696771062.
Trial 436 finished with value: 0.3526755167665544 and parameters: {'kernel': 'rbf', 'epsilon': 0.6988759114048518}. Best is trial 149 with value: 0.7767469696771062.
Trial 431 finished with value: 0.35174291876541913 and parameters: {'kernel': 'rbf', 'epsilon': 0.4873971148325632}. Best is trial 149 with value: 0.7767469696771062.
Trial 438 finished with value: 0.329661366647272 and parameters: {'kernel': 'poly', 'epsilon': 0.5171019074594564}. Best is trial 149 with value: 0.7767469696771062.
Trial 433 finished with value: 0.4247445503334875 and parameters: {'kernel': 'sigmoid', 'epsilon': 0.3360430693843779}. Best is trial 149 with value: 0.7767469696771062.
Trial 444 finished with value: 0.7765938092108525 and parameters: {'kernel': 'linear', 'epsilon': 0.1514734851256876}. Best is trial 149 with value: 0.7767469696771062.
Trial 442 finished with value: 0.3300449061685306 and parameters: {'kernel': 'poly', 'epsilon': 0.07997849298452342}. Best is trial 149 with value: 0.7767469696771062.
Trial 439 finished with value: 0.3503644843786639 and parameters: {'kernel': 'rbf', 'epsilon': 0.029915437848149873}. Best is trial 149 with value: 0.7767469696771062.
Trial 443 finished with value: 0.42466872026922553 and parameters: {'kernel': 'sigmoid', 'epsilon': 0.804845085930612}. Best is trial 149 with value: 0.7767469696771062.
Trial 441 finished with value: 0.3292773688111259 and parameters: {'kernel': 'poly', 'epsilon': 0.8114690708055216}. Best is trial 149 with value: 0.7767469696771062.
Trial 445 finished with value: 0.35336156869444457 and parameters: {'kernel': 'rbf', 'epsilon': 0.900104396318973}. Best is trial 149 with value: 0.7767469696771062.
Trial 440 finished with value: 0.7760236056394746 and parameters: {'kernel': 'linear', 'epsilon': 0.5832145134481019}. Best is trial 149 with value: 0.7767469696771062.
Trial 446 finished with value: 0.32946418401822836 and parameters: {'kernel': 'poly', 'epsilon': 0.6151155730600782}. Best is trial 149 with value: 0.7767469696771062.
Trial 452 finished with value: 0.35116962700824417 and parameters: {'kernel': 'rbf', 'epsilon': 0.3604847896974702}. Best is trial 149 with value: 0.7767469696771062.
Trial 448 finished with value: 0.33011604406231854 and parameters: {'kernel': 'poly', 'epsilon': 0.004020043924522598}. Best is trial 149 with value: 0.7767469696771062.
Trial 453 finished with value: 0.35062794874582 and parameters: {'kernel': 'rbf', 'epsilon': 0.1652624607867088}. Best is trial 149 with value: 0.7767469696771062.
Trial 451 finished with value: 0.4246401284615887 and parameters: {'kernel': 'sigmoid', 'epsilon': 0.358191401579817}. Best is trial 149 with value: 0.7767469696771062.
Trial 449 finished with value: 0.4245294145085946 and parameters: {'kernel': 'sigmoid', 'epsilon': 0.40890126878373645}. Best is trial 149 with value: 0.7767469696771062.
Trial 447 finished with value: 0.35144361930587376 and parameters: {'kernel': 'rbf', 'epsilon': 0.4295303693544519}. Best is trial 149 with value: 0.7767469696771062.
Trial 455 finished with value: 0.4247497601603559 and parameters: {'kernel': 'sigmoid', 'epsilon': 0.7470142825931158}. Best is trial 149 with value: 0.7767469696771062.
Trial 456 finished with value: 0.4244509608304396 and parameters: {'kernel': 'sigmoid', 'epsilon': 0.9114872198565417}. Best is trial 149 with value: 0.7767469696771062.
Trial 457 finished with value: 0.3299316870700117 and parameters: {'kernel': 'poly', 'epsilon': 0.2723760041011506}. Best is trial 149 with value: 0.7767469696771062.
Trial 450 finished with value: 0.35126826129487926 and parameters: {'kernel': 'rbf', 'epsilon': 0.3835345011257366}. Best is trial 149 with value: 0.7767469696771062.
Trial 460 finished with value: 0.3294549288713718 and parameters: {'kernel': 'poly', 'epsilon': 0.6253154691962071}. Best is trial 149 with value: 0.7767469696771062.
Trial 468 finished with value: 0.3300266741683733 and parameters: {'kernel': 'poly', 'epsilon': 0.11696065547342027}. Best is trial 149 with value: 0.7767469696771062.
Trial 463 finished with value: 0.7760057017857362 and parameters: {'kernel': 'linear', 'epsilon': 0.7314035169491354}. Best is trial 149 with value: 0.7767469696771062.
Trial 464 finished with value: 0.42498972558651393 and parameters: {'kernel': 'sigmoid', 'epsilon': 0.11979572704644004}. Best is trial 149 with value: 0.7767469696771062.
Trial 454 finished with value: 0.32939762077104096 and parameters: {'kernel': 'poly', 'epsilon': 0.679476502573354}. Best is trial 149 with value: 0.7767469696771062.
Trial 470 finished with value: 0.32920867358955797 and parameters: {'kernel': 'poly', 'epsilon': 0.8544986057477543}. Best is trial 149 with value: 0.7767469696771062.
Trial 465 finished with value: 0.329937857113151 and parameters: {'kernel': 'poly', 'epsilon': 0.2514887663426203}. Best is trial 149 with value: 0.7767469696771062.
Trial 462 finished with value: 0.3531551282278609 and parameters: {'kernel': 'rbf', 'epsilon': 0.8235169444217384}. Best is trial 149 with value: 0.7767469696771062.
Trial 476 finished with value: 0.32913948562497974 and parameters: {'kernel': 'poly', 'epsilon': 0.9104862694152589}. Best is trial 149 with value: 0.7767469696771062.
Trial 458 finished with value: 0.42497146401347746 and parameters: {'kernel': 'sigmoid', 'epsilon': 0.10138399323470149}. Best is trial 149 with value: 0.7767469696771062.
Trial 472 finished with value: 0.7760534942309407 and parameters: {'kernel': 'linear', 'epsilon': 0.6435918398846828}. Best is trial 149 with value: 0.7767469696771062.
Trial 474 finished with value: 0.32994974034223234 and parameters: {'kernel': 'poly', 'epsilon': 0.2341120006643288}. Best is trial 149 with value: 0.7767469696771062.
Trial 459 finished with value: 0.42440428183373147 and parameters: {'kernel': 'sigmoid', 'epsilon': 0.5723372418186626}. Best is trial 149 with value: 0.7767469696771062.
Trial 471 finished with value: 0.35107833280589484 and parameters: {'kernel': 'rbf', 'epsilon': 0.3394327479553322}. Best is trial 149 with value: 0.7767469696771062.
Trial 461 finished with value: 0.3300231376423079 and parameters: {'kernel': 'poly', 'epsilon': 0.1375765701936087}. Best is trial 149 with value: 0.7767469696771062.
Trial 467 finished with value: 0.32936944434476384 and parameters: {'kernel': 'poly', 'epsilon': 0.7335533114901731}. Best is trial 149 with value: 0.7767469696771062.
Trial 466 finished with value: 0.3297529564430425 and parameters: {'kernel': 'poly', 'epsilon': 0.46799867721287447}. Best is trial 149 with value: 0.7767469696771062.
Trial 475 finished with value: 0.42446362377156943 and parameters: {'kernel': 'sigmoid', 'epsilon': 0.45610602713908466}. Best is trial 149 with value: 0.7767469696771062.
Trial 473 finished with value: 0.3503515848705761 and parameters: {'kernel': 'rbf', 'epsilon': 0.020761443379060718}. Best is trial 149 with value: 0.7767469696771062.
Trial 478 finished with value: 0.7760344016913316 and parameters: {'kernel': 'linear', 'epsilon': 0.6923210502662255}. Best is trial 149 with value: 0.7767469696771062.
Trial 469 finished with value: 0.3294599738306131 and parameters: {'kernel': 'poly', 'epsilon': 0.6177002981458105}. Best is trial 149 with value: 0.7767469696771062.
Trial 477 finished with value: 0.4247414703989253 and parameters: {'kernel': 'sigmoid', 'epsilon': 0.6796595666173602}. Best is trial 149 with value: 0.7767469696771062.
Trial 479 finished with value: 0.7765915547452331 and parameters: {'kernel': 'linear', 'epsilon': 0.08052569862765868}. Best is trial 149 with value: 0.7767469696771062.
Trial 483 finished with value: 0.32996544271104095 and parameters: {'kernel': 'poly', 'epsilon': 0.21977498294231113}. Best is trial 149 with value: 0.7767469696771062.
Trial 480 finished with value: 0.3519561150665644 and parameters: {'kernel': 'rbf', 'epsilon': 0.5405530166482355}. Best is trial 149 with value: 0.7767469696771062.
Trial 484 finished with value: 0.3505111899788386 and parameters: {'kernel': 'rbf', 'epsilon': 0.10659247823154938}. Best is trial 149 with value: 0.7767469696771062.
Trial 482 finished with value: 0.3299323136918463 and parameters: {'kernel': 'poly', 'epsilon': 0.27361491838558205}. Best is trial 149 with value: 0.7767469696771062.
Trial 487 finished with value: 0.4247109269467293 and parameters: {'kernel': 'sigmoid', 'epsilon': 0.7695138779752341}. Best is trial 149 with value: 0.7767469696771062.
Trial 486 finished with value: 0.42455938812429156 and parameters: {'kernel': 'sigmoid', 'epsilon': 0.8741412324222237}. Best is trial 149 with value: 0.7767469696771062.
Trial 489 finished with value: 0.32902132315877114 and parameters: {'kernel': 'poly', 'epsilon': 0.9832344827747034}. Best is trial 149 with value: 0.7767469696771062.
Trial 481 finished with value: 0.32981958771641523 and parameters: {'kernel': 'poly', 'epsilon': 0.40230316160972224}. Best is trial 149 with value: 0.7767469696771062.
Trial 494 finished with value: 0.775979814731582 and parameters: {'kernel': 'linear', 'epsilon': 0.7377826961330416}. Best is trial 149 with value: 0.7767469696771062.
Trial 495 finished with value: 0.35336340712313286 and parameters: {'kernel': 'rbf', 'epsilon': 0.900737559501778}. Best is trial 149 with value: 0.7767469696771062.
Trial 485 finished with value: 0.7760435839292497 and parameters: {'kernel': 'linear', 'epsilon': 0.6822232618382151}. Best is trial 149 with value: 0.7767469696771062.
Trial 490 finished with value: 0.35141707290774155 and parameters: {'kernel': 'rbf', 'epsilon': 0.4243891305167503}. Best is trial 149 with value: 0.7767469696771062.
Trial 496 finished with value: 0.7765963316838482 and parameters: {'kernel': 'linear', 'epsilon': 0.1711487385714403}. Best is trial 149 with value: 0.7767469696771062.
Trial 493 finished with value: 0.3505209327664075 and parameters: {'kernel': 'rbf', 'epsilon': 0.11067645541234794}. Best is trial 149 with value: 0.7767469696771062.
Trial 499 finished with value: 0.3296979398389669 and parameters: {'kernel': 'poly', 'epsilon': 0.5005091976116118}. Best is trial 149 with value: 0.7767469696771062.
Trial 491 finished with value: 0.7756908086202488 and parameters: {'kernel': 'linear', 'epsilon': 0.49824772110225624}. Best is trial 149 with value: 0.7767469696771062.
Trial 498 finished with value: 0.35346364770555705 and parameters: {'kernel': 'rbf', 'epsilon': 0.9324848854461957}. Best is trial 149 with value: 0.7767469696771062.
Trial 488 finished with value: 0.35333856619832416 and parameters: {'kernel': 'rbf', 'epsilon': 0.8931716693802875}. Best is trial 149 with value: 0.7767469696771062.
Trial 502 finished with value: 0.42441520917891856 and parameters: {'kernel': 'sigmoid', 'epsilon': 0.5792168304238193}. Best is trial 149 with value: 0.7767469696771062.
Trial 497 finished with value: 0.3523125137185648 and parameters: {'kernel': 'rbf', 'epsilon': 0.6192099023764511}. Best is trial 149 with value: 0.7767469696771062.
Trial 492 finished with value: 0.32964292826797925 and parameters: {'kernel': 'poly', 'epsilon': 0.5250951534758724}. Best is trial 149 with value: 0.7767469696771062.
Trial 501 finished with value: 0.7766052564619519 and parameters: {'kernel': 'linear', 'epsilon': 0.14281877399613208}. Best is trial 149 with value: 0.7767469696771062.
Trial 505 finished with value: 0.35046305312705217 and parameters: {'kernel': 'rbf', 'epsilon': 0.08479575260608352}. Best is trial 149 with value: 0.7767469696771062.
Trial 500 finished with value: 0.35128272232590935 and parameters: {'kernel': 'rbf', 'epsilon': 0.3870505863303131}. Best is trial 149 with value: 0.7767469696771062.
Trial 516 finished with value: 0.7766028988465741 and parameters: {'kernel': 'linear', 'epsilon': 0.17907338778503123}. Best is trial 149 with value: 0.7767469696771062.
Trial 507 finished with value: 0.3503711993980064 and parameters: {'kernel': 'rbf', 'epsilon': 0.034696158511100084}. Best is trial 149 with value: 0.7767469696771062.
Trial 503 finished with value: 0.3532673948698927 and parameters: {'kernel': 'rbf', 'epsilon': 0.8685629081348377}. Best is trial 149 with value: 0.7767469696771062.
Trial 509 finished with value: 0.35337193655045074 and parameters: {'kernel': 'rbf', 'epsilon': 0.9034380821123436}. Best is trial 149 with value: 0.7767469696771062.
Trial 510 finished with value: 0.42435986933484654 and parameters: {'kernel': 'sigmoid', 'epsilon': 0.5497558966764206}. Best is trial 149 with value: 0.7767469696771062.
Trial 504 finished with value: 0.7765553446168483 and parameters: {'kernel': 'linear', 'epsilon': 0.25540488005716644}. Best is trial 149 with value: 0.7767469696771062.
Trial 506 finished with value: 0.35066735667552174 and parameters: {'kernel': 'rbf', 'epsilon': 0.18000414692559474}. Best is trial 149 with value: 0.7767469696771062.
Trial 508 finished with value: 0.3294597482139926 and parameters: {'kernel': 'poly', 'epsilon': 0.6179057070184295}. Best is trial 149 with value: 0.7767469696771062.
Trial 514 finished with value: 0.7756570374757876 and parameters: {'kernel': 'linear', 'epsilon': 0.8274131555134495}. Best is trial 149 with value: 0.7767469696771062.
Trial 513 finished with value: 0.32929126626233796 and parameters: {'kernel': 'poly', 'epsilon': 0.8024756377983888}. Best is trial 149 with value: 0.7767469696771062.
Trial 519 finished with value: 0.4246622594433938 and parameters: {'kernel': 'sigmoid', 'epsilon': 0.8204406005187951}. Best is trial 149 with value: 0.7767469696771062.
Trial 512 finished with value: 0.7765493370769139 and parameters: {'kernel': 'linear', 'epsilon': 0.01264313005985529}. Best is trial 149 with value: 0.7767469696771062.
Trial 521 finished with value: 0.3298108376150842 and parameters: {'kernel': 'poly', 'epsilon': 0.4092061362587188}. Best is trial 149 with value: 0.7767469696771062.
Trial 520 finished with value: 0.35204134166894047 and parameters: {'kernel': 'rbf', 'epsilon': 0.5597234967099327}. Best is trial 149 with value: 0.7767469696771062.
Trial 527 finished with value: 0.329060570023321 and parameters: {'kernel': 'poly', 'epsilon': 0.9644235213449056}. Best is trial 149 with value: 0.7767469696771062.
Trial 518 finished with value: 0.4243741771200174 and parameters: {'kernel': 'sigmoid', 'epsilon': 0.49738627352774223}. Best is trial 149 with value: 0.7767469696771062.
Trial 511 finished with value: 0.42509325228249945 and parameters: {'kernel': 'sigmoid', 'epsilon': 0.18210108545006043}. Best is trial 149 with value: 0.7767469696771062.
