A new study created in RDB with name: SVR_5389
Trial 11 finished with value: 0.32918484934257436 and parameters: {'kernel': 'poly', 'epsilon': 0.8655206201197745}. Best is trial 11 with value: 0.32918484934257436.
Trial 5 finished with value: 0.7760233930274172 and parameters: {'kernel': 'linear', 'epsilon': 0.7269316409102494}. Best is trial 5 with value: 0.7760233930274172.
Trial 13 finished with value: 0.32947024213849607 and parameters: {'kernel': 'poly', 'epsilon': 0.6106332337219902}. Best is trial 14 with value: 0.7766611261459099.
Trial 15 finished with value: 0.7765918111159195 and parameters: {'kernel': 'linear', 'epsilon': 0.06797076026327886}. Best is trial 14 with value: 0.7766611261459099.
Trial 7 finished with value: 0.42445495472641853 and parameters: {'kernel': 'sigmoid', 'epsilon': 0.6027510827746673}. Best is trial 15 with value: 0.7765918111159195.
Trial 14 finished with value: 0.7766611261459099 and parameters: {'kernel': 'linear', 'epsilon': 0.13444069450128238}. Best is trial 14 with value: 0.7766611261459099.
Trial 0 finished with value: 0.7760283480855783 and parameters: {'kernel': 'linear', 'epsilon': 0.5946126361921404}. Best is trial 14 with value: 0.7766611261459099.
Trial 4 finished with value: 0.32999468321046843 and parameters: {'kernel': 'poly', 'epsilon': 0.16690525434707493}. Best is trial 14 with value: 0.7766611261459099.
Trial 3 finished with value: 0.42467605092354627 and parameters: {'kernel': 'sigmoid', 'epsilon': 0.7946079346569273}. Best is trial 14 with value: 0.7766611261459099.
Trial 18 finished with value: 0.35350261944818195 and parameters: {'kernel': 'rbf', 'epsilon': 0.9456277997808197}. Best is trial 14 with value: 0.7766611261459099.
Trial 8 finished with value: 0.3299516050530613 and parameters: {'kernel': 'poly', 'epsilon': 0.23269275812060886}. Best is trial 14 with value: 0.7766611261459099.
Trial 20 finished with value: 0.3294193240885591 and parameters: {'kernel': 'poly', 'epsilon': 0.6547217497245822}. Best is trial 14 with value: 0.7766611261459099.
Trial 9 finished with value: 0.3291074888317282 and parameters: {'kernel': 'poly', 'epsilon': 0.9361632984616588}. Best is trial 14 with value: 0.7766611261459099.
Trial 16 finished with value: 0.7759910731879768 and parameters: {'kernel': 'linear', 'epsilon': 0.5718775691285884}. Best is trial 14 with value: 0.7766611261459099.
Trial 17 finished with value: 0.3299302600624171 and parameters: {'kernel': 'poly', 'epsilon': 0.2639878750918575}. Best is trial 14 with value: 0.7766611261459099.
Trial 12 finished with value: 0.3521524940941112 and parameters: {'kernel': 'rbf', 'epsilon': 0.5849508370181086}. Best is trial 14 with value: 0.7766611261459099.
Trial 6 finished with value: 0.7756910481799355 and parameters: {'kernel': 'linear', 'epsilon': 0.5013657500892855}. Best is trial 14 with value: 0.7766611261459099.
Trial 19 finished with value: 0.35084820115245985 and parameters: {'kernel': 'rbf', 'epsilon': 0.24459194572830256}. Best is trial 14 with value: 0.7766611261459099.
Trial 21 finished with value: 0.42498255719783645 and parameters: {'kernel': 'sigmoid', 'epsilon': 0.10999316805407888}. Best is trial 14 with value: 0.7766611261459099.
Trial 23 finished with value: 0.32991028822217283 and parameters: {'kernel': 'poly', 'epsilon': 0.3115367670919438}. Best is trial 14 with value: 0.7766611261459099.
Trial 22 finished with value: 0.42498928086208787 and parameters: {'kernel': 'sigmoid', 'epsilon': 0.11940499756630607}. Best is trial 14 with value: 0.7766611261459099.
Trial 1 finished with value: 0.3292563331972769 and parameters: {'kernel': 'poly', 'epsilon': 0.8251687034370097}. Best is trial 14 with value: 0.7766611261459099.
Trial 2 finished with value: 0.35067030169852453 and parameters: {'kernel': 'rbf', 'epsilon': 0.1813469666158506}. Best is trial 14 with value: 0.7766611261459099.
Trial 10 finished with value: 0.32935082290097484 and parameters: {'kernel': 'poly', 'epsilon': 0.7573902606457599}. Best is trial 14 with value: 0.7766611261459099.
Trial 24 finished with value: 0.7760165027921329 and parameters: {'kernel': 'linear', 'epsilon': 0.5802098828485419}. Best is trial 14 with value: 0.7766611261459099.
Trial 25 finished with value: 0.35354482092494394 and parameters: {'kernel': 'rbf', 'epsilon': 0.9595637778902842}. Best is trial 14 with value: 0.7766611261459099.
Trial 26 finished with value: 0.7759622417961434 and parameters: {'kernel': 'linear', 'epsilon': 0.7497020722878128}. Best is trial 14 with value: 0.7766611261459099.
Trial 27 finished with value: 0.35108608759512494 and parameters: {'kernel': 'rbf', 'epsilon': 0.3414330086518933}. Best is trial 14 with value: 0.7766611261459099.
Trial 32 finished with value: 0.4246252743594102 and parameters: {'kernel': 'sigmoid', 'epsilon': 0.3654893454094329}. Best is trial 14 with value: 0.7766611261459099.
Trial 41 finished with value: 0.7765955012653719 and parameters: {'kernel': 'linear', 'epsilon': 0.022780646414762296}. Best is trial 14 with value: 0.7766611261459099.
Trial 30 finished with value: 0.32982457030768114 and parameters: {'kernel': 'poly', 'epsilon': 0.3984671488314411}. Best is trial 14 with value: 0.7766611261459099.
Trial 40 finished with value: 0.4245408314552065 and parameters: {'kernel': 'sigmoid', 'epsilon': 0.3915621668776973}. Best is trial 14 with value: 0.7766611261459099.
Trial 33 finished with value: 0.3300348014795068 and parameters: {'kernel': 'poly', 'epsilon': 0.09234794148685499}. Best is trial 14 with value: 0.7766611261459099.
Trial 37 finished with value: 0.33008941624907606 and parameters: {'kernel': 'poly', 'epsilon': 0.0345694172849641}. Best is trial 14 with value: 0.7766611261459099.
Trial 38 finished with value: 0.7766258137407955 and parameters: {'kernel': 'linear', 'epsilon': 0.29973487800199505}. Best is trial 14 with value: 0.7766611261459099.
Trial 34 finished with value: 0.353250811091704 and parameters: {'kernel': 'rbf', 'epsilon': 0.8625967573805078}. Best is trial 14 with value: 0.7766611261459099.
Trial 39 finished with value: 0.32927873421599774 and parameters: {'kernel': 'poly', 'epsilon': 0.8105062537027816}. Best is trial 14 with value: 0.7766611261459099.
Trial 35 finished with value: 0.4248413920449228 and parameters: {'kernel': 'sigmoid', 'epsilon': 0.28575954488727306}. Best is trial 14 with value: 0.7766611261459099.
Trial 31 finished with value: 0.32996849490418645 and parameters: {'kernel': 'poly', 'epsilon': 0.21797952735192705}. Best is trial 14 with value: 0.7766611261459099.
Trial 46 finished with value: 0.42495189426651514 and parameters: {'kernel': 'sigmoid', 'epsilon': 0.23338952799887402}. Best is trial 14 with value: 0.7766611261459099.
Trial 44 finished with value: 0.32935565007582046 and parameters: {'kernel': 'poly', 'epsilon': 0.7494026321116123}. Best is trial 14 with value: 0.7766611261459099.
Trial 43 finished with value: 0.7755672443527478 and parameters: {'kernel': 'linear', 'epsilon': 0.8583609349044115}. Best is trial 14 with value: 0.7766611261459099.
Trial 29 finished with value: 0.42479420257610767 and parameters: {'kernel': 'sigmoid', 'epsilon': 0.6995227982392476}. Best is trial 14 with value: 0.7766611261459099.
Trial 36 finished with value: 0.3513409888022504 and parameters: {'kernel': 'rbf', 'epsilon': 0.40250900788595456}. Best is trial 14 with value: 0.7766611261459099.
Trial 28 finished with value: 0.35253243758044395 and parameters: {'kernel': 'rbf', 'epsilon': 0.6638339095680417}. Best is trial 14 with value: 0.7766611261459099.
Trial 47 finished with value: 0.3298578772136264 and parameters: {'kernel': 'poly', 'epsilon': 0.36474703527463115}. Best is trial 14 with value: 0.7766611261459099.
Trial 45 finished with value: 0.7759040268205747 and parameters: {'kernel': 'linear', 'epsilon': 0.5495825202424289}. Best is trial 14 with value: 0.7766611261459099.
Trial 50 finished with value: 0.7765933606411721 and parameters: {'kernel': 'linear', 'epsilon': 0.04902385332611692}. Best is trial 14 with value: 0.7766611261459099.
Trial 49 finished with value: 0.33002499891104814 and parameters: {'kernel': 'poly', 'epsilon': 0.10351441256412808}. Best is trial 14 with value: 0.7766611261459099.
Trial 48 finished with value: 0.32903323672420304 and parameters: {'kernel': 'poly', 'epsilon': 0.9778877643489194}. Best is trial 14 with value: 0.7766611261459099.
Trial 54 finished with value: 0.3505786630299196 and parameters: {'kernel': 'rbf', 'epsilon': 0.14172737436541338}. Best is trial 14 with value: 0.7766611261459099.
Trial 42 finished with value: 0.7761405738931269 and parameters: {'kernel': 'linear', 'epsilon': 0.4044734023368636}. Best is trial 14 with value: 0.7766611261459099.
Trial 53 finished with value: 0.4243913764426931 and parameters: {'kernel': 'sigmoid', 'epsilon': 0.5652176214523511}. Best is trial 14 with value: 0.7766611261459099.
Trial 51 finished with value: 0.4245652401764298 and parameters: {'kernel': 'sigmoid', 'epsilon': 0.8722495385823446}. Best is trial 14 with value: 0.7766611261459099.
Trial 57 finished with value: 0.4247534244468629 and parameters: {'kernel': 'sigmoid', 'epsilon': 0.7394449123681831}. Best is trial 14 with value: 0.7766611261459099.
Trial 58 finished with value: 0.4243602148193145 and parameters: {'kernel': 'sigmoid', 'epsilon': 0.5415883833198779}. Best is trial 14 with value: 0.7766611261459099.
Trial 52 finished with value: 0.3292782733977544 and parameters: {'kernel': 'poly', 'epsilon': 0.8109198279959048}. Best is trial 14 with value: 0.7766611261459099.
Trial 59 finished with value: 0.4250144366950087 and parameters: {'kernel': 'sigmoid', 'epsilon': 0.2142570483479227}. Best is trial 14 with value: 0.7766611261459099.
Trial 62 finished with value: 0.3535127370621887 and parameters: {'kernel': 'rbf', 'epsilon': 0.9490652057871228}. Best is trial 14 with value: 0.7766611261459099.
Trial 55 finished with value: 0.3299134728873879 and parameters: {'kernel': 'poly', 'epsilon': 0.3067745716376573}. Best is trial 14 with value: 0.7766611261459099.
Trial 65 finished with value: 0.7758410014683281 and parameters: {'kernel': 'linear', 'epsilon': 0.44985719016465475}. Best is trial 14 with value: 0.7766611261459099.
Trial 67 finished with value: 0.35073893759841296 and parameters: {'kernel': 'rbf', 'epsilon': 0.20322748472169383}. Best is trial 14 with value: 0.7766611261459099.
Trial 56 finished with value: 0.35148344766320605 and parameters: {'kernel': 'rbf', 'epsilon': 0.436714164713659}. Best is trial 14 with value: 0.7766611261459099.
Trial 71 finished with value: 0.33004769429311087 and parameters: {'kernel': 'poly', 'epsilon': 0.07710066616521183}. Best is trial 14 with value: 0.7766611261459099.
Trial 61 finished with value: 0.3505970342694001 and parameters: {'kernel': 'rbf', 'epsilon': 0.15062905708928165}. Best is trial 14 with value: 0.7766611261459099.
Trial 60 finished with value: 0.32998411927653226 and parameters: {'kernel': 'poly', 'epsilon': 0.1886138990939844}. Best is trial 14 with value: 0.7766611261459099.
Trial 68 finished with value: 0.32985474698124684 and parameters: {'kernel': 'poly', 'epsilon': 0.36788365027899705}. Best is trial 14 with value: 0.7766611261459099.
Trial 63 finished with value: 0.3535500043994919 and parameters: {'kernel': 'rbf', 'epsilon': 0.961248963854478}. Best is trial 14 with value: 0.7766611261459099.
Trial 64 finished with value: 0.3294544547421573 and parameters: {'kernel': 'poly', 'epsilon': 0.6256953154322324}. Best is trial 14 with value: 0.7766611261459099.
Trial 70 finished with value: 0.32993156401009505 and parameters: {'kernel': 'poly', 'epsilon': 0.2599806877262625}. Best is trial 14 with value: 0.7766611261459099.
Trial 69 finished with value: 0.3291521731989804 and parameters: {'kernel': 'poly', 'epsilon': 0.8932456864616177}. Best is trial 14 with value: 0.7766611261459099.
Trial 66 finished with value: 0.35187429163826545 and parameters: {'kernel': 'rbf', 'epsilon': 0.5182779981184362}. Best is trial 14 with value: 0.7766611261459099.
Trial 74 finished with value: 0.32988466090306423 and parameters: {'kernel': 'poly', 'epsilon': 0.33786840660822404}. Best is trial 14 with value: 0.7766611261459099.
Trial 72 finished with value: 0.3299506176793226 and parameters: {'kernel': 'poly', 'epsilon': 0.23331575485636258}. Best is trial 14 with value: 0.7766611261459099.
Trial 76 finished with value: 0.7759620231177836 and parameters: {'kernel': 'linear', 'epsilon': 0.7495974277450894}. Best is trial 14 with value: 0.7766611261459099.
Trial 77 finished with value: 0.4244854928664349 and parameters: {'kernel': 'sigmoid', 'epsilon': 0.44805692706813194}. Best is trial 14 with value: 0.7766611261459099.
Trial 75 finished with value: 0.42508592618434904 and parameters: {'kernel': 'sigmoid', 'epsilon': 0.19947727978028607}. Best is trial 14 with value: 0.7766611261459099.
Trial 73 finished with value: 0.3295508301952431 and parameters: {'kernel': 'poly', 'epsilon': 0.5640103268451819}. Best is trial 14 with value: 0.7766611261459099.
Trial 79 finished with value: 0.4243855306672888 and parameters: {'kernel': 'sigmoid', 'epsilon': 0.561644976711934}. Best is trial 14 with value: 0.7766611261459099.
Trial 78 finished with value: 0.3300252917787504 and parameters: {'kernel': 'poly', 'epsilon': 0.11177836597962443}. Best is trial 14 with value: 0.7766611261459099.
Trial 83 finished with value: 0.3526356133930332 and parameters: {'kernel': 'rbf', 'epsilon': 0.6896017605528334}. Best is trial 14 with value: 0.7766611261459099.
Trial 80 finished with value: 0.351569272631472 and parameters: {'kernel': 'rbf', 'epsilon': 0.4530046594701508}. Best is trial 14 with value: 0.7766611261459099.
Trial 89 finished with value: 0.776607573027795 and parameters: {'kernel': 'linear', 'epsilon': 0.18318817625120065}. Best is trial 14 with value: 0.7766611261459099.
Trial 84 finished with value: 0.3297089958728755 and parameters: {'kernel': 'poly', 'epsilon': 0.494604701980206}. Best is trial 14 with value: 0.7766611261459099.
Trial 86 finished with value: 0.42479724366333427 and parameters: {'kernel': 'sigmoid', 'epsilon': 0.7101581308443171}. Best is trial 14 with value: 0.7766611261459099.
Trial 82 finished with value: 0.3528970632817613 and parameters: {'kernel': 'rbf', 'epsilon': 0.7572863515075293}. Best is trial 14 with value: 0.7766611261459099.
Trial 87 finished with value: 0.42446889063978793 and parameters: {'kernel': 'sigmoid', 'epsilon': 0.6117017239678857}. Best is trial 14 with value: 0.7766611261459099.
Trial 91 finished with value: 0.35293447624452884 and parameters: {'kernel': 'rbf', 'epsilon': 0.7686099783315928}. Best is trial 14 with value: 0.7766611261459099.
Trial 92 finished with value: 0.35078101140363227 and parameters: {'kernel': 'rbf', 'epsilon': 0.21908667930935566}. Best is trial 14 with value: 0.7766611261459099.
Trial 90 finished with value: 0.7757140109317552 and parameters: {'kernel': 'linear', 'epsilon': 0.4885788347163639}. Best is trial 14 with value: 0.7766611261459099.
Trial 88 finished with value: 0.3292349685704952 and parameters: {'kernel': 'poly', 'epsilon': 0.8406463755006147}. Best is trial 14 with value: 0.7766611261459099.
Trial 95 finished with value: 0.3508107624132165 and parameters: {'kernel': 'rbf', 'epsilon': 0.2300621964051428}. Best is trial 14 with value: 0.7766611261459099.
Trial 81 finished with value: 0.3299574041375699 and parameters: {'kernel': 'poly', 'epsilon': 0.22754897744172908}. Best is trial 14 with value: 0.7766611261459099.
Trial 85 finished with value: 0.33011067713817605 and parameters: {'kernel': 'poly', 'epsilon': 0.00803089790048539}. Best is trial 14 with value: 0.7766611261459099.
Trial 103 finished with value: 0.35090569508083286 and parameters: {'kernel': 'rbf', 'epsilon': 0.2640943674572809}. Best is trial 14 with value: 0.7766611261459099.
Trial 93 finished with value: 0.4244343152789856 and parameters: {'kernel': 'sigmoid', 'epsilon': 0.46531265938580535}. Best is trial 14 with value: 0.7766611261459099.
Trial 98 finished with value: 0.42495411672097416 and parameters: {'kernel': 'sigmoid', 'epsilon': 0.04827927740611182}. Best is trial 14 with value: 0.7766611261459099.
Trial 97 finished with value: 0.3505373019326219 and parameters: {'kernel': 'rbf', 'epsilon': 0.11950965429331073}. Best is trial 14 with value: 0.7766611261459099.
Trial 99 finished with value: 0.7757377771220689 and parameters: {'kernel': 'linear', 'epsilon': 0.5166533375106082}. Best is trial 14 with value: 0.7766611261459099.
Trial 94 finished with value: 0.7757061458600677 and parameters: {'kernel': 'linear', 'epsilon': 0.5110307021259668}. Best is trial 14 with value: 0.7766611261459099.
Trial 100 finished with value: 0.32925794997600255 and parameters: {'kernel': 'poly', 'epsilon': 0.8241713643275617}. Best is trial 14 with value: 0.7766611261459099.
Trial 96 finished with value: 0.3534727709019349 and parameters: {'kernel': 'rbf', 'epsilon': 0.9354385964899453}. Best is trial 14 with value: 0.7766611261459099.
Trial 102 finished with value: 0.35287830054300284 and parameters: {'kernel': 'rbf', 'epsilon': 0.7515357599439105}. Best is trial 14 with value: 0.7766611261459099.
Trial 107 finished with value: 0.35035752818750654 and parameters: {'kernel': 'rbf', 'epsilon': 0.02433685323827095}. Best is trial 14 with value: 0.7766611261459099.
Trial 110 finished with value: 0.3298196844862856 and parameters: {'kernel': 'poly', 'epsilon': 0.40267135928109865}. Best is trial 14 with value: 0.7766611261459099.
Trial 104 finished with value: 0.35344673646023655 and parameters: {'kernel': 'rbf', 'epsilon': 0.9263660174794327}. Best is trial 14 with value: 0.7766611261459099.
Trial 105 finished with value: 0.35212154326382367 and parameters: {'kernel': 'rbf', 'epsilon': 0.5778547414996489}. Best is trial 14 with value: 0.7766611261459099.
Trial 108 finished with value: 0.329779619858593 and parameters: {'kernel': 'poly', 'epsilon': 0.43766668009928045}. Best is trial 14 with value: 0.7766611261459099.
Trial 109 finished with value: 0.3503700689376867 and parameters: {'kernel': 'rbf', 'epsilon': 0.03419407543399944}. Best is trial 14 with value: 0.7766611261459099.
Trial 114 finished with value: 0.3531526725158577 and parameters: {'kernel': 'rbf', 'epsilon': 0.8228513990153747}. Best is trial 14 with value: 0.7766611261459099.
Trial 111 finished with value: 0.4244374203682078 and parameters: {'kernel': 'sigmoid', 'epsilon': 0.46447507729723025}. Best is trial 14 with value: 0.7766611261459099.
Trial 101 finished with value: 0.3293473462366533 and parameters: {'kernel': 'poly', 'epsilon': 0.7607356511077987}. Best is trial 14 with value: 0.7766611261459099.
Trial 106 finished with value: 0.7760470635025007 and parameters: {'kernel': 'linear', 'epsilon': 0.6292600194342725}. Best is trial 14 with value: 0.7766611261459099.
Trial 112 finished with value: 0.42466638106893007 and parameters: {'kernel': 'sigmoid', 'epsilon': 0.8135422357579356}. Best is trial 14 with value: 0.7766611261459099.
Trial 113 finished with value: 0.4247123803796793 and parameters: {'kernel': 'sigmoid', 'epsilon': 0.7636974240952947}. Best is trial 14 with value: 0.7766611261459099.
Trial 116 finished with value: 0.7763259776407999 and parameters: {'kernel': 'linear', 'epsilon': 0.3580596063517797}. Best is trial 14 with value: 0.7766611261459099.
Trial 115 finished with value: 0.776535566376398 and parameters: {'kernel': 'linear', 'epsilon': 0.009859389453349632}. Best is trial 14 with value: 0.7766611261459099.
Trial 117 finished with value: 0.3505294727661689 and parameters: {'kernel': 'rbf', 'epsilon': 0.11475867246451199}. Best is trial 14 with value: 0.7766611261459099.
Trial 124 finished with value: 0.4243935659599254 and parameters: {'kernel': 'sigmoid', 'epsilon': 0.48134347353248264}. Best is trial 14 with value: 0.7766611261459099.
Trial 118 finished with value: 0.3524297065540076 and parameters: {'kernel': 'rbf', 'epsilon': 0.64243230948316}. Best is trial 14 with value: 0.7766611261459099.
Trial 125 finished with value: 0.4244871888005351 and parameters: {'kernel': 'sigmoid', 'epsilon': 0.447186478240608}. Best is trial 14 with value: 0.7766611261459099.
Trial 122 finished with value: 0.7753232871947965 and parameters: {'kernel': 'linear', 'epsilon': 0.9661853038243537}. Best is trial 14 with value: 0.7766611261459099.
Trial 119 finished with value: 0.42450821745549605 and parameters: {'kernel': 'sigmoid', 'epsilon': 0.4349859495692674}. Best is trial 14 with value: 0.7766611261459099.
Trial 129 finished with value: 0.7755650044011222 and parameters: {'kernel': 'linear', 'epsilon': 0.849734822481523}. Best is trial 14 with value: 0.7766611261459099.
Trial 120 finished with value: 0.3524719614122347 and parameters: {'kernel': 'rbf', 'epsilon': 0.6507401342219528}. Best is trial 14 with value: 0.7766611261459099.
Trial 121 finished with value: 0.35276312514593505 and parameters: {'kernel': 'rbf', 'epsilon': 0.7206853702676778}. Best is trial 14 with value: 0.7766611261459099.
Trial 126 finished with value: 0.32998977731828416 and parameters: {'kernel': 'poly', 'epsilon': 0.1765004402614886}. Best is trial 14 with value: 0.7766611261459099.
Trial 131 finished with value: 0.4249683616426968 and parameters: {'kernel': 'sigmoid', 'epsilon': 0.0982230902127581}. Best is trial 14 with value: 0.7766611261459099.
Trial 127 finished with value: 0.7761833308919053 and parameters: {'kernel': 'linear', 'epsilon': 0.3931132113907666}. Best is trial 14 with value: 0.7766611261459099.
Trial 123 finished with value: 0.3532247778194314 and parameters: {'kernel': 'rbf', 'epsilon': 0.8506726843157613}. Best is trial 14 with value: 0.7766611261459099.
Trial 130 finished with value: 0.775745130420593 and parameters: {'kernel': 'linear', 'epsilon': 0.8109454732645295}. Best is trial 14 with value: 0.7766611261459099.
