Trial 1040 finished with value: 0.3533996501642934 and parameters: {'kernel': 'rbf', 'epsilon': 0.9117214099733257}. Best is trial 149 with value: 0.7767469696771062.
Trial 1036 finished with value: 0.35196747227296316 and parameters: {'kernel': 'rbf', 'epsilon': 0.543532140902742}. Best is trial 149 with value: 0.7767469696771062.
Trial 1043 finished with value: 0.4243916360377983 and parameters: {'kernel': 'sigmoid', 'epsilon': 0.48238523786070986}. Best is trial 149 with value: 0.7767469696771062.
Trial 1046 finished with value: 0.7760473856511915 and parameters: {'kernel': 'linear', 'epsilon': 0.6775851903760979}. Best is trial 149 with value: 0.7767469696771062.
Trial 1044 finished with value: 0.3299752657954193 and parameters: {'kernel': 'poly', 'epsilon': 0.2015783908306834}. Best is trial 149 with value: 0.7767469696771062.
Trial 1047 finished with value: 0.32944657408593325 and parameters: {'kernel': 'poly', 'epsilon': 0.6345823835904962}. Best is trial 149 with value: 0.7767469696771062.
Trial 1049 finished with value: 0.329111278524864 and parameters: {'kernel': 'poly', 'epsilon': 0.9341442992648308}. Best is trial 149 with value: 0.7767469696771062.
Trial 1042 finished with value: 0.3294028759077904 and parameters: {'kernel': 'poly', 'epsilon': 0.6676032510486314}. Best is trial 149 with value: 0.7767469696771062.
Trial 1048 finished with value: 0.3503625283379764 and parameters: {'kernel': 'rbf', 'epsilon': 0.027356957771701995}. Best is trial 149 with value: 0.7767469696771062.
Trial 1053 finished with value: 0.3292710865089702 and parameters: {'kernel': 'poly', 'epsilon': 0.8150572169555016}. Best is trial 149 with value: 0.7767469696771062.
Trial 1054 finished with value: 0.3294405571063388 and parameters: {'kernel': 'poly', 'epsilon': 0.6405042410632261}. Best is trial 149 with value: 0.7767469696771062.
Trial 1056 finished with value: 0.3534656939162209 and parameters: {'kernel': 'rbf', 'epsilon': 0.9331470212461097}. Best is trial 149 with value: 0.7767469696771062.
Trial 1051 finished with value: 0.775725049316563 and parameters: {'kernel': 'linear', 'epsilon': 0.8151715764732174}. Best is trial 149 with value: 0.7767469696771062.
Trial 1055 finished with value: 0.7762325242384248 and parameters: {'kernel': 'linear', 'epsilon': 0.37158594685330104}. Best is trial 149 with value: 0.7767469696771062.
Trial 1057 finished with value: 0.35101259490833925 and parameters: {'kernel': 'rbf', 'epsilon': 0.31345123527893426}. Best is trial 149 with value: 0.7767469696771062.
Trial 1059 finished with value: 0.35225328184925153 and parameters: {'kernel': 'rbf', 'epsilon': 0.6075121948554586}. Best is trial 149 with value: 0.7767469696771062.
Trial 1058 finished with value: 0.7763601829219049 and parameters: {'kernel': 'linear', 'epsilon': 0.35253258881464355}. Best is trial 149 with value: 0.7767469696771062.
Trial 1062 finished with value: 0.3513692455174281 and parameters: {'kernel': 'rbf', 'epsilon': 0.4106698761027696}. Best is trial 149 with value: 0.7767469696771062.
Trial 1060 finished with value: 0.7766161173550783 and parameters: {'kernel': 'linear', 'epsilon': 0.2779875442690616}. Best is trial 149 with value: 0.7767469696771062.
Trial 1050 finished with value: 0.3293968614670118 and parameters: {'kernel': 'poly', 'epsilon': 0.6919716007829034}. Best is trial 149 with value: 0.7767469696771062.
Trial 1066 finished with value: 0.35127183953034163 and parameters: {'kernel': 'rbf', 'epsilon': 0.38436776090078606}. Best is trial 149 with value: 0.7767469696771062.
Trial 1063 finished with value: 0.7765938910789842 and parameters: {'kernel': 'linear', 'epsilon': 0.15615665143083257}. Best is trial 149 with value: 0.7767469696771062.
Trial 1065 finished with value: 0.329244657685 and parameters: {'kernel': 'poly', 'epsilon': 0.8333062293957803}. Best is trial 149 with value: 0.7767469696771062.
Trial 1061 finished with value: 0.3504529163583313 and parameters: {'kernel': 'rbf', 'epsilon': 0.07954970691601848}. Best is trial 149 with value: 0.7767469696771062.
Trial 1052 finished with value: 0.3295075234747084 and parameters: {'kernel': 'poly', 'epsilon': 0.5863251553063225}. Best is trial 149 with value: 0.7767469696771062.
Trial 1064 finished with value: 0.7757858779079427 and parameters: {'kernel': 'linear', 'epsilon': 0.8019531446073026}. Best is trial 149 with value: 0.7767469696771062.
Trial 1067 finished with value: 0.3505829155330803 and parameters: {'kernel': 'rbf', 'epsilon': 0.1436271948636748}. Best is trial 149 with value: 0.7767469696771062.
Trial 1073 finished with value: 0.42441112347959215 and parameters: {'kernel': 'sigmoid', 'epsilon': 0.4745092204058581}. Best is trial 149 with value: 0.7767469696771062.
Trial 1070 finished with value: 0.4248348704202768 and parameters: {'kernel': 'sigmoid', 'epsilon': 0.004326046027540609}. Best is trial 149 with value: 0.7767469696771062.
Trial 1075 finished with value: 0.42487388738669196 and parameters: {'kernel': 'sigmoid', 'epsilon': 0.27188808818356325}. Best is trial 149 with value: 0.7767469696771062.
Trial 1072 finished with value: 0.775823564200357 and parameters: {'kernel': 'linear', 'epsilon': 0.4525692278055824}. Best is trial 149 with value: 0.7767469696771062.
Trial 1079 finished with value: 0.35307443994971227 and parameters: {'kernel': 'rbf', 'epsilon': 0.8029990739041041}. Best is trial 149 with value: 0.7767469696771062.
Trial 1068 finished with value: 0.32992792890359646 and parameters: {'kernel': 'poly', 'epsilon': 0.2875663203767752}. Best is trial 149 with value: 0.7767469696771062.
Trial 1071 finished with value: 0.7759026069387479 and parameters: {'kernel': 'linear', 'epsilon': 0.7860835096643953}. Best is trial 149 with value: 0.7767469696771062.
Trial 1074 finished with value: 0.42453333685690486 and parameters: {'kernel': 'sigmoid', 'epsilon': 0.40199447206069805}. Best is trial 149 with value: 0.7767469696771062.
Trial 1083 finished with value: 0.35246239037546356 and parameters: {'kernel': 'rbf', 'epsilon': 0.6488762725200629}. Best is trial 149 with value: 0.7767469696771062.
Trial 1069 finished with value: 0.425077616321743 and parameters: {'kernel': 'sigmoid', 'epsilon': 0.1762893154288786}. Best is trial 149 with value: 0.7767469696771062.
Trial 1081 finished with value: 0.4249275707714723 and parameters: {'kernel': 'sigmoid', 'epsilon': 0.24294909444732793}. Best is trial 149 with value: 0.7767469696771062.
Trial 1077 finished with value: 0.7760495011238071 and parameters: {'kernel': 'linear', 'epsilon': 0.4250622547328273}. Best is trial 149 with value: 0.7767469696771062.
Trial 1082 finished with value: 0.7760352183399719 and parameters: {'kernel': 'linear', 'epsilon': 0.6899248297763191}. Best is trial 149 with value: 0.7767469696771062.
Trial 1078 finished with value: 0.4247472769622064 and parameters: {'kernel': 'sigmoid', 'epsilon': 0.6818047765640396}. Best is trial 149 with value: 0.7767469696771062.
Trial 1076 finished with value: 0.3526118078505556 and parameters: {'kernel': 'rbf', 'epsilon': 0.683295034303528}. Best is trial 149 with value: 0.7767469696771062.
Trial 1086 finished with value: 0.35175084701849696 and parameters: {'kernel': 'rbf', 'epsilon': 0.48938863660033216}. Best is trial 149 with value: 0.7767469696771062.
Trial 1085 finished with value: 0.35044293329529774 and parameters: {'kernel': 'rbf', 'epsilon': 0.07479301149510587}. Best is trial 149 with value: 0.7767469696771062.
Trial 1089 finished with value: 0.42502092962158083 and parameters: {'kernel': 'sigmoid', 'epsilon': 0.15545076410905367}. Best is trial 149 with value: 0.7767469696771062.
Trial 1088 finished with value: 0.32952646672092356 and parameters: {'kernel': 'poly', 'epsilon': 0.5748794909403219}. Best is trial 149 with value: 0.7767469696771062.
Trial 1080 finished with value: 0.42475535216611976 and parameters: {'kernel': 'sigmoid', 'epsilon': 0.3322610484447096}. Best is trial 149 with value: 0.7767469696771062.
Trial 1084 finished with value: 0.32955064816251545 and parameters: {'kernel': 'poly', 'epsilon': 0.5640036678025419}. Best is trial 149 with value: 0.7767469696771062.
Trial 1090 finished with value: 0.3517985038449931 and parameters: {'kernel': 'rbf', 'epsilon': 0.5000537525677681}. Best is trial 149 with value: 0.7767469696771062.
Trial 1087 finished with value: 0.776600491178975 and parameters: {'kernel': 'linear', 'epsilon': 0.21316103962177213}. Best is trial 149 with value: 0.7767469696771062.
Trial 1091 finished with value: 0.7753296171326618 and parameters: {'kernel': 'linear', 'epsilon': 0.959130553238031}. Best is trial 149 with value: 0.7767469696771062.
Trial 1093 finished with value: 0.7756637860400426 and parameters: {'kernel': 'linear', 'epsilon': 0.8261243365985288}. Best is trial 149 with value: 0.7767469696771062.
Trial 1094 finished with value: 0.4250953772723406 and parameters: {'kernel': 'sigmoid', 'epsilon': 0.1946018680210767}. Best is trial 149 with value: 0.7767469696771062.
Trial 1095 finished with value: 0.3292874660420886 and parameters: {'kernel': 'poly', 'epsilon': 0.8047770849583235}. Best is trial 149 with value: 0.7767469696771062.
Trial 1105 finished with value: 0.7756956420657236 and parameters: {'kernel': 'linear', 'epsilon': 0.8195327365201971}. Best is trial 149 with value: 0.7767469696771062.
Trial 1108 finished with value: 0.3291000159445148 and parameters: {'kernel': 'poly', 'epsilon': 0.94135413076636}. Best is trial 149 with value: 0.7767469696771062.
Trial 1092 finished with value: 0.776563752869706 and parameters: {'kernel': 'linear', 'epsilon': 0.225382635380585}. Best is trial 149 with value: 0.7767469696771062.
Trial 1098 finished with value: 0.32984164562469437 and parameters: {'kernel': 'poly', 'epsilon': 0.38072132000572323}. Best is trial 149 with value: 0.7767469696771062.
Trial 1107 finished with value: 0.7757370149714155 and parameters: {'kernel': 'linear', 'epsilon': 0.4741694187860752}. Best is trial 149 with value: 0.7767469696771062.
Trial 1099 finished with value: 0.7765684616652744 and parameters: {'kernel': 'linear', 'epsilon': 0.2365969197192488}. Best is trial 149 with value: 0.7767469696771062.
Trial 1104 finished with value: 0.3508426007464773 and parameters: {'kernel': 'rbf', 'epsilon': 0.2426774454097903}. Best is trial 149 with value: 0.7767469696771062.
Trial 1106 finished with value: 0.33007693866914584 and parameters: {'kernel': 'poly', 'epsilon': 0.04711344585884081}. Best is trial 149 with value: 0.7767469696771062.
Trial 1100 finished with value: 0.3291201361784273 and parameters: {'kernel': 'poly', 'epsilon': 0.9276699821505545}. Best is trial 149 with value: 0.7767469696771062.
Trial 1096 finished with value: 0.4247116245126345 and parameters: {'kernel': 'sigmoid', 'epsilon': 0.7674296449592435}. Best is trial 149 with value: 0.7767469696771062.
Trial 1101 finished with value: 0.7753202395999482 and parameters: {'kernel': 'linear', 'epsilon': 0.9686228120160438}. Best is trial 149 with value: 0.7767469696771062.
Trial 1103 finished with value: 0.4249837458577915 and parameters: {'kernel': 'sigmoid', 'epsilon': 0.21943063835390786}. Best is trial 149 with value: 0.7767469696771062.
Trial 1109 finished with value: 0.4249086921545563 and parameters: {'kernel': 'sigmoid', 'epsilon': 0.2532689955747689}. Best is trial 149 with value: 0.7767469696771062.
Trial 1097 finished with value: 0.3291441917522682 and parameters: {'kernel': 'poly', 'epsilon': 0.9005459937047101}. Best is trial 149 with value: 0.7767469696771062.
Trial 1110 finished with value: 0.42498805491240005 and parameters: {'kernel': 'sigmoid', 'epsilon': 0.21803483411876345}. Best is trial 149 with value: 0.7767469696771062.
Trial 1111 finished with value: 0.3513389848973286 and parameters: {'kernel': 'rbf', 'epsilon': 0.40139260444872826}. Best is trial 149 with value: 0.7767469696771062.
Trial 1113 finished with value: 0.7758167407846547 and parameters: {'kernel': 'linear', 'epsilon': 0.5303892784938582}. Best is trial 149 with value: 0.7767469696771062.
Trial 1102 finished with value: 0.3293979560624044 and parameters: {'kernel': 'poly', 'epsilon': 0.6782070332722647}. Best is trial 149 with value: 0.7767469696771062.
Trial 1112 finished with value: 0.42436387725091007 and parameters: {'kernel': 'sigmoid', 'epsilon': 0.5280025262160374}. Best is trial 149 with value: 0.7767469696771062.
Trial 1114 finished with value: 0.35067701606100815 and parameters: {'kernel': 'rbf', 'epsilon': 0.18322055338791388}. Best is trial 149 with value: 0.7767469696771062.
Trial 1119 finished with value: 0.4249784473717999 and parameters: {'kernel': 'sigmoid', 'epsilon': 0.22210964324969962}. Best is trial 149 with value: 0.7767469696771062.
Trial 1123 finished with value: 0.35211959582720953 and parameters: {'kernel': 'rbf', 'epsilon': 0.5771309557178586}. Best is trial 149 with value: 0.7767469696771062.
Trial 1116 finished with value: 0.7755792064192242 and parameters: {'kernel': 'linear', 'epsilon': 0.8417468679621686}. Best is trial 149 with value: 0.7767469696771062.
Trial 1115 finished with value: 0.35321534814538685 and parameters: {'kernel': 'rbf', 'epsilon': 0.8466545268657086}. Best is trial 149 with value: 0.7767469696771062.
Trial 1118 finished with value: 0.3292780167876703 and parameters: {'kernel': 'poly', 'epsilon': 0.81103286527714}. Best is trial 149 with value: 0.7767469696771062.
Trial 1120 finished with value: 0.32928869799719246 and parameters: {'kernel': 'poly', 'epsilon': 0.8043218312846822}. Best is trial 149 with value: 0.7767469696771062.
Trial 1126 finished with value: 0.3503949329885826 and parameters: {'kernel': 'rbf', 'epsilon': 0.051609942886822746}. Best is trial 149 with value: 0.7767469696771062.
Trial 1124 finished with value: 0.3530419763902805 and parameters: {'kernel': 'rbf', 'epsilon': 0.7951506844628431}. Best is trial 149 with value: 0.7767469696771062.
Trial 1122 finished with value: 0.3292293384176893 and parameters: {'kernel': 'poly', 'epsilon': 0.8438038981425903}. Best is trial 149 with value: 0.7767469696771062.
Trial 1125 finished with value: 0.4246101008757151 and parameters: {'kernel': 'sigmoid', 'epsilon': 0.37377485053244874}. Best is trial 149 with value: 0.7767469696771062.
Trial 1117 finished with value: 0.32932345005292685 and parameters: {'kernel': 'poly', 'epsilon': 0.7859362994429367}. Best is trial 149 with value: 0.7767469696771062.
Trial 1129 finished with value: 0.3291288323937363 and parameters: {'kernel': 'poly', 'epsilon': 0.9215415149617224}. Best is trial 149 with value: 0.7767469696771062.
Trial 1121 finished with value: 0.35361424876782765 and parameters: {'kernel': 'rbf', 'epsilon': 0.993894984421021}. Best is trial 149 with value: 0.7767469696771062.
Trial 1127 finished with value: 0.32946854736371867 and parameters: {'kernel': 'poly', 'epsilon': 0.6119505843335995}. Best is trial 149 with value: 0.7767469696771062.
Trial 1128 finished with value: 0.7757335797316932 and parameters: {'kernel': 'linear', 'epsilon': 0.48193328224192156}. Best is trial 149 with value: 0.7767469696771062.
Trial 1132 finished with value: 0.352539690844078 and parameters: {'kernel': 'rbf', 'epsilon': 0.6656066106141196}. Best is trial 149 with value: 0.7767469696771062.
Trial 1133 finished with value: 0.42499892727364263 and parameters: {'kernel': 'sigmoid', 'epsilon': 0.13479661370014306}. Best is trial 149 with value: 0.7767469696771062.
Trial 1135 finished with value: 0.3529802289292981 and parameters: {'kernel': 'rbf', 'epsilon': 0.7802880611165715}. Best is trial 149 with value: 0.7767469696771062.
Trial 1134 finished with value: 0.775866003258592 and parameters: {'kernel': 'linear', 'epsilon': 0.44707350835012416}. Best is trial 149 with value: 0.7767469696771062.
Trial 1130 finished with value: 0.35064158034386467 and parameters: {'kernel': 'rbf', 'epsilon': 0.17116268207559204}. Best is trial 149 with value: 0.7767469696771062.
Trial 1131 finished with value: 0.4245422888995514 and parameters: {'kernel': 'sigmoid', 'epsilon': 0.3873578178812801}. Best is trial 149 with value: 0.7767469696771062.
Trial 1136 finished with value: 0.32983368866486623 and parameters: {'kernel': 'poly', 'epsilon': 0.3895506069355732}. Best is trial 149 with value: 0.7767469696771062.
Trial 1137 finished with value: 0.3517265951830589 and parameters: {'kernel': 'rbf', 'epsilon': 0.48381366594066577}. Best is trial 149 with value: 0.7767469696771062.
Trial 1139 finished with value: 0.3295802051144606 and parameters: {'kernel': 'poly', 'epsilon': 0.5511276590268199}. Best is trial 149 with value: 0.7767469696771062.
Trial 1140 finished with value: 0.7764229083766581 and parameters: {'kernel': 'linear', 'epsilon': 0.34090775445537835}. Best is trial 149 with value: 0.7767469696771062.
Trial 1144 finished with value: 0.7758021252993081 and parameters: {'kernel': 'linear', 'epsilon': 0.457842288468034}. Best is trial 149 with value: 0.7767469696771062.
Trial 1138 finished with value: 0.7759675524764054 and parameters: {'kernel': 'linear', 'epsilon': 0.7429699725621289}. Best is trial 149 with value: 0.7767469696771062.
Trial 1141 finished with value: 0.7752199622670433 and parameters: {'kernel': 'linear', 'epsilon': 0.9922551582584358}. Best is trial 149 with value: 0.7767469696771062.
Trial 1148 finished with value: 0.3534394254830235 and parameters: {'kernel': 'rbf', 'epsilon': 0.9239727014488552}. Best is trial 149 with value: 0.7767469696771062.
Trial 1142 finished with value: 0.42437742381379345 and parameters: {'kernel': 'sigmoid', 'epsilon': 0.49051766348649206}. Best is trial 149 with value: 0.7767469696771062.
Trial 1143 finished with value: 0.7756240328763424 and parameters: {'kernel': 'linear', 'epsilon': 0.8335749437535916}. Best is trial 149 with value: 0.7767469696771062.
Trial 1147 finished with value: 0.329396923067939 and parameters: {'kernel': 'poly', 'epsilon': 0.6917032486703051}. Best is trial 149 with value: 0.7767469696771062.
Trial 1145 finished with value: 0.4247066856448507 and parameters: {'kernel': 'sigmoid', 'epsilon': 0.3507280653019921}. Best is trial 149 with value: 0.7767469696771062.
Trial 1149 finished with value: 0.33005650671550063 and parameters: {'kernel': 'poly', 'epsilon': 0.06795949571867732}. Best is trial 149 with value: 0.7767469696771062.
Trial 1151 finished with value: 0.35298374804559135 and parameters: {'kernel': 'rbf', 'epsilon': 0.7809874738719212}. Best is trial 149 with value: 0.7767469696771062.
Trial 1153 finished with value: 0.4247014646037163 and parameters: {'kernel': 'sigmoid', 'epsilon': 0.35230729409546024}. Best is trial 149 with value: 0.7767469696771062.
Trial 1146 finished with value: 0.3531903562549098 and parameters: {'kernel': 'rbf', 'epsilon': 0.835328821816712}. Best is trial 149 with value: 0.7767469696771062.
Trial 1150 finished with value: 0.3293981981249632 and parameters: {'kernel': 'poly', 'epsilon': 0.6789218625161961}. Best is trial 149 with value: 0.7767469696771062.
Trial 1152 finished with value: 0.3503660561573635 and parameters: {'kernel': 'rbf', 'epsilon': 0.030565291804933503}. Best is trial 149 with value: 0.7767469696771062.
Trial 1154 finished with value: 0.7759468055837454 and parameters: {'kernel': 'linear', 'epsilon': 0.43676382345849096}. Best is trial 149 with value: 0.7767469696771062.
Trial 1160 finished with value: 0.32981680492044063 and parameters: {'kernel': 'poly', 'epsilon': 0.4047190527069727}. Best is trial 149 with value: 0.7767469696771062.
Trial 1156 finished with value: 0.4244311834617229 and parameters: {'kernel': 'sigmoid', 'epsilon': 0.5886091835272727}. Best is trial 149 with value: 0.7767469696771062.
Trial 1158 finished with value: 0.3295732241406617 and parameters: {'kernel': 'poly', 'epsilon': 0.554219017892649}. Best is trial 149 with value: 0.7767469696771062.
Trial 1157 finished with value: 0.3524666989575895 and parameters: {'kernel': 'rbf', 'epsilon': 0.6496130234341895}. Best is trial 149 with value: 0.7767469696771062.
Trial 1159 finished with value: 0.775190960682008 and parameters: {'kernel': 'linear', 'epsilon': 0.9992998817365686}. Best is trial 149 with value: 0.7767469696771062.
Trial 1155 finished with value: 0.3509998585541461 and parameters: {'kernel': 'rbf', 'epsilon': 0.3071154877346284}. Best is trial 149 with value: 0.7767469696771062.
Trial 1162 finished with value: 0.35321225567746845 and parameters: {'kernel': 'rbf', 'epsilon': 0.8448440032895062}. Best is trial 149 with value: 0.7767469696771062.
Trial 1164 finished with value: 0.32934604179459714 and parameters: {'kernel': 'poly', 'epsilon': 0.7625711251684728}. Best is trial 149 with value: 0.7767469696771062.
Trial 1161 finished with value: 0.42497960989103 and parameters: {'kernel': 'sigmoid', 'epsilon': 0.08137384506043266}. Best is trial 149 with value: 0.7767469696771062.
Trial 1167 finished with value: 0.42486099030091024 and parameters: {'kernel': 'sigmoid', 'epsilon': 0.013436768689879086}. Best is trial 149 with value: 0.7767469696771062.
Trial 1171 finished with value: 0.4246311850300268 and parameters: {'kernel': 'sigmoid', 'epsilon': 0.36318152533671577}. Best is trial 149 with value: 0.7767469696771062.
Trial 1165 finished with value: 0.4250009615870211 and parameters: {'kernel': 'sigmoid', 'epsilon': 0.13840981288103982}. Best is trial 149 with value: 0.7767469696771062.
Trial 1168 finished with value: 0.7766057379650227 and parameters: {'kernel': 'linear', 'epsilon': 0.035299295804014474}. Best is trial 149 with value: 0.7767469696771062.
Trial 1170 finished with value: 0.3535594106298384 and parameters: {'kernel': 'rbf', 'epsilon': 0.9662423944427642}. Best is trial 149 with value: 0.7767469696771062.
Trial 1172 finished with value: 0.4248703551376477 and parameters: {'kernel': 'sigmoid', 'epsilon': 0.017550786213152203}. Best is trial 149 with value: 0.7767469696771062.
