Trial 1166 finished with value: 0.4246227604992049 and parameters: {'kernel': 'sigmoid', 'epsilon': 0.367145462611305}. Best is trial 149 with value: 0.7767469696771062.
Trial 1173 finished with value: 0.42466413949893844 and parameters: {'kernel': 'sigmoid', 'epsilon': 0.8154175266229207}. Best is trial 149 with value: 0.7767469696771062.
Trial 1163 finished with value: 0.4245231589441791 and parameters: {'kernel': 'sigmoid', 'epsilon': 0.4169464997589615}. Best is trial 149 with value: 0.7767469696771062.
Trial 1175 finished with value: 0.3514444978903197 and parameters: {'kernel': 'rbf', 'epsilon': 0.42973889150995315}. Best is trial 149 with value: 0.7767469696771062.
Trial 1176 finished with value: 0.42481021577840555 and parameters: {'kernel': 'sigmoid', 'epsilon': 0.2972827531508865}. Best is trial 149 with value: 0.7767469696771062.
Trial 1174 finished with value: 0.42440180729490357 and parameters: {'kernel': 'sigmoid', 'epsilon': 0.5179955884971931}. Best is trial 149 with value: 0.7767469696771062.
Trial 1179 finished with value: 0.7765919420209967 and parameters: {'kernel': 'linear', 'epsilon': 0.27113709091349325}. Best is trial 149 with value: 0.7767469696771062.
Trial 1183 finished with value: 0.3298609058034039 and parameters: {'kernel': 'poly', 'epsilon': 0.36220671125066317}. Best is trial 149 with value: 0.7767469696771062.
Trial 1177 finished with value: 0.33002541663897744 and parameters: {'kernel': 'poly', 'epsilon': 0.10574539022901708}. Best is trial 149 with value: 0.7767469696771062.
Trial 1178 finished with value: 0.7753686022549336 and parameters: {'kernel': 'linear', 'epsilon': 0.9345727789580399}. Best is trial 149 with value: 0.7767469696771062.
Trial 1180 finished with value: 0.7765576530073912 and parameters: {'kernel': 'linear', 'epsilon': 0.22761348946131887}. Best is trial 149 with value: 0.7767469696771062.
Trial 1188 finished with value: 0.42479233152477436 and parameters: {'kernel': 'sigmoid', 'epsilon': 0.3140062040588718}. Best is trial 149 with value: 0.7767469696771062.
Trial 1169 finished with value: 0.32996512710286235 and parameters: {'kernel': 'poly', 'epsilon': 0.22070511130355563}. Best is trial 149 with value: 0.7767469696771062.
Trial 1182 finished with value: 0.3299529480771709 and parameters: {'kernel': 'poly', 'epsilon': 0.23133652292996032}. Best is trial 149 with value: 0.7767469696771062.
Trial 1191 finished with value: 0.3506218668695715 and parameters: {'kernel': 'rbf', 'epsilon': 0.1626000024551878}. Best is trial 149 with value: 0.7767469696771062.
Trial 1181 finished with value: 0.3508202808508422 and parameters: {'kernel': 'rbf', 'epsilon': 0.23375964440124575}. Best is trial 149 with value: 0.7767469696771062.
Trial 1197 finished with value: 0.42459734106673414 and parameters: {'kernel': 'sigmoid', 'epsilon': 0.3753580674116117}. Best is trial 149 with value: 0.7767469696771062.
Trial 1192 finished with value: 0.32942662777751064 and parameters: {'kernel': 'poly', 'epsilon': 0.6484675489476815}. Best is trial 149 with value: 0.7767469696771062.
Trial 1186 finished with value: 0.35265639209035526 and parameters: {'kernel': 'rbf', 'epsilon': 0.6944397569396475}. Best is trial 149 with value: 0.7767469696771062.
Trial 1194 finished with value: 0.42483249213595686 and parameters: {'kernel': 'sigmoid', 'epsilon': 0.2893257954064795}. Best is trial 149 with value: 0.7767469696771062.
Trial 1184 finished with value: 0.7757191936161678 and parameters: {'kernel': 'linear', 'epsilon': 0.5133133338969813}. Best is trial 149 with value: 0.7767469696771062.
Trial 1189 finished with value: 0.4244495599958393 and parameters: {'kernel': 'sigmoid', 'epsilon': 0.913824306887065}. Best is trial 149 with value: 0.7767469696771062.
Trial 1187 finished with value: 0.3515332602528568 and parameters: {'kernel': 'rbf', 'epsilon': 0.44585767364137274}. Best is trial 149 with value: 0.7767469696771062.
Trial 1185 finished with value: 0.42495318369476565 and parameters: {'kernel': 'sigmoid', 'epsilon': 0.04789379060825183}. Best is trial 149 with value: 0.7767469696771062.
Trial 1196 finished with value: 0.35057197008849605 and parameters: {'kernel': 'rbf', 'epsilon': 0.1384403441027261}. Best is trial 149 with value: 0.7767469696771062.
Trial 1190 finished with value: 0.7760456536659929 and parameters: {'kernel': 'linear', 'epsilon': 0.6289154317351546}. Best is trial 149 with value: 0.7767469696771062.
Trial 1200 finished with value: 0.3292435059120827 and parameters: {'kernel': 'poly', 'epsilon': 0.8338409523682712}. Best is trial 149 with value: 0.7767469696771062.
Trial 1198 finished with value: 0.4247280845293918 and parameters: {'kernel': 'sigmoid', 'epsilon': 0.7554582097181279}. Best is trial 149 with value: 0.7767469696771062.
Trial 1193 finished with value: 0.35296390591387816 and parameters: {'kernel': 'rbf', 'epsilon': 0.7763256409185969}. Best is trial 149 with value: 0.7767469696771062.
Trial 1199 finished with value: 0.7759807692724126 and parameters: {'kernel': 'linear', 'epsilon': 0.5683898252719889}. Best is trial 149 with value: 0.7767469696771062.
Trial 1202 finished with value: 0.4250865856893077 and parameters: {'kernel': 'sigmoid', 'epsilon': 0.19861991834952708}. Best is trial 149 with value: 0.7767469696771062.
Trial 1204 finished with value: 0.3298982821239109 and parameters: {'kernel': 'poly', 'epsilon': 0.32359360841129814}. Best is trial 149 with value: 0.7767469696771062.
Trial 1195 finished with value: 0.32944104317773176 and parameters: {'kernel': 'poly', 'epsilon': 0.639796886085719}. Best is trial 149 with value: 0.7767469696771062.
Trial 1203 finished with value: 0.3298124274756612 and parameters: {'kernel': 'poly', 'epsilon': 0.4080716393186745}. Best is trial 149 with value: 0.7767469696771062.
Trial 1210 finished with value: 0.35060246798117006 and parameters: {'kernel': 'rbf', 'epsilon': 0.1532213192620654}. Best is trial 149 with value: 0.7767469696771062.
Trial 1208 finished with value: 0.32958612754104344 and parameters: {'kernel': 'poly', 'epsilon': 0.5485705840069844}. Best is trial 149 with value: 0.7767469696771062.
Trial 1209 finished with value: 0.32994973577095266 and parameters: {'kernel': 'poly', 'epsilon': 0.2343339020654822}. Best is trial 149 with value: 0.7767469696771062.
Trial 1206 finished with value: 0.3298477811747104 and parameters: {'kernel': 'poly', 'epsilon': 0.37481782545756137}. Best is trial 149 with value: 0.7767469696771062.
Trial 1211 finished with value: 0.3507532773933913 and parameters: {'kernel': 'rbf', 'epsilon': 0.20840243109525547}. Best is trial 149 with value: 0.7767469696771062.
Trial 1201 finished with value: 0.7760120241666819 and parameters: {'kernel': 'linear', 'epsilon': 0.4299186706294188}. Best is trial 149 with value: 0.7767469696771062.
Trial 1221 finished with value: 0.7765275247551662 and parameters: {'kernel': 'linear', 'epsilon': 0.24889374328837865}. Best is trial 149 with value: 0.7767469696771062.
Trial 1216 finished with value: 0.4250673836515875 and parameters: {'kernel': 'sigmoid', 'epsilon': 0.2050704437660703}. Best is trial 149 with value: 0.7767469696771062.
Trial 1213 finished with value: 0.42466305272556293 and parameters: {'kernel': 'sigmoid', 'epsilon': 0.8159613433378815}. Best is trial 149 with value: 0.7767469696771062.
Trial 1215 finished with value: 0.775965409577805 and parameters: {'kernel': 'linear', 'epsilon': 0.5648767774530729}. Best is trial 149 with value: 0.7767469696771062.
Trial 1218 finished with value: 0.7760366420168041 and parameters: {'kernel': 'linear', 'epsilon': 0.6876694510345749}. Best is trial 149 with value: 0.7767469696771062.
Trial 1207 finished with value: 0.3291531551445551 and parameters: {'kernel': 'poly', 'epsilon': 0.8921244471942928}. Best is trial 149 with value: 0.7767469696771062.
Trial 1214 finished with value: 0.7756908543250559 and parameters: {'kernel': 'linear', 'epsilon': 0.5049861990594043}. Best is trial 149 with value: 0.7767469696771062.
Trial 1220 finished with value: 0.776051477312287 and parameters: {'kernel': 'linear', 'epsilon': 0.6444326773358399}. Best is trial 149 with value: 0.7767469696771062.
Trial 1205 finished with value: 0.7767151238127887 and parameters: {'kernel': 'linear', 'epsilon': 0.11048538379216022}. Best is trial 149 with value: 0.7767469696771062.
Trial 1212 finished with value: 0.4250843940563588 and parameters: {'kernel': 'sigmoid', 'epsilon': 0.20092249440455223}. Best is trial 149 with value: 0.7767469696771062.
Trial 1217 finished with value: 0.4247583568621602 and parameters: {'kernel': 'sigmoid', 'epsilon': 0.33124036009052626}. Best is trial 149 with value: 0.7767469696771062.
Trial 1225 finished with value: 0.3517357098988099 and parameters: {'kernel': 'rbf', 'epsilon': 0.4858997036550403}. Best is trial 149 with value: 0.7767469696771062.
Trial 1219 finished with value: 0.3516695753708093 and parameters: {'kernel': 'rbf', 'epsilon': 0.47057137889543366}. Best is trial 149 with value: 0.7767469696771062.
Trial 1227 finished with value: 0.3294860565805189 and parameters: {'kernel': 'poly', 'epsilon': 0.6001836151319743}. Best is trial 149 with value: 0.7767469696771062.
Trial 1234 finished with value: 0.35052815396229636 and parameters: {'kernel': 'rbf', 'epsilon': 0.11398449786046327}. Best is trial 149 with value: 0.7767469696771062.
Trial 1223 finished with value: 0.7765609877124895 and parameters: {'kernel': 'linear', 'epsilon': 0.23368987857825585}. Best is trial 149 with value: 0.7767469696771062.
Trial 1228 finished with value: 0.35201249208157703 and parameters: {'kernel': 'rbf', 'epsilon': 0.5529917451175821}. Best is trial 149 with value: 0.7767469696771062.
Trial 1233 finished with value: 0.7758996802610854 and parameters: {'kernel': 'linear', 'epsilon': 0.7819573419853395}. Best is trial 149 with value: 0.7767469696771062.
Trial 1224 finished with value: 0.7759958917857804 and parameters: {'kernel': 'linear', 'epsilon': 0.7333058438714581}. Best is trial 149 with value: 0.7767469696771062.
Trial 1230 finished with value: 0.776586858210949 and parameters: {'kernel': 'linear', 'epsilon': 0.07110930672037796}. Best is trial 149 with value: 0.7767469696771062.
Trial 1226 finished with value: 0.3514838405475941 and parameters: {'kernel': 'rbf', 'epsilon': 0.43674045334488953}. Best is trial 149 with value: 0.7767469696771062.
Trial 1222 finished with value: 0.7759949720802197 and parameters: {'kernel': 'linear', 'epsilon': 0.7338629970793146}. Best is trial 149 with value: 0.7767469696771062.
Trial 1232 finished with value: 0.3300247973897386 and parameters: {'kernel': 'poly', 'epsilon': 0.10412110046390288}. Best is trial 149 with value: 0.7767469696771062.
Trial 1231 finished with value: 0.3510200761496271 and parameters: {'kernel': 'rbf', 'epsilon': 0.31719277765620413}. Best is trial 149 with value: 0.7767469696771062.
Trial 1237 finished with value: 0.32957723295882546 and parameters: {'kernel': 'poly', 'epsilon': 0.5524845212010637}. Best is trial 149 with value: 0.7767469696771062.
Trial 1229 finished with value: 0.3294555386390009 and parameters: {'kernel': 'poly', 'epsilon': 0.6242630780850111}. Best is trial 149 with value: 0.7767469696771062.
Trial 1238 finished with value: 0.3298580378171393 and parameters: {'kernel': 'poly', 'epsilon': 0.3652469761701074}. Best is trial 149 with value: 0.7767469696771062.
Trial 1239 finished with value: 0.3296191070121105 and parameters: {'kernel': 'poly', 'epsilon': 0.5352714608545942}. Best is trial 149 with value: 0.7767469696771062.
Trial 1236 finished with value: 0.42443268276016843 and parameters: {'kernel': 'sigmoid', 'epsilon': 0.46589409820507477}. Best is trial 149 with value: 0.7767469696771062.
Trial 1242 finished with value: 0.7760360185519188 and parameters: {'kernel': 'linear', 'epsilon': 0.6925049918691861}. Best is trial 149 with value: 0.7767469696771062.
Trial 1241 finished with value: 0.4243923466736753 and parameters: {'kernel': 'sigmoid', 'epsilon': 0.9424349025656861}. Best is trial 149 with value: 0.7767469696771062.
Trial 1240 finished with value: 0.7760222656719791 and parameters: {'kernel': 'linear', 'epsilon': 0.5825539977959018}. Best is trial 149 with value: 0.7767469696771062.
Trial 1245 finished with value: 0.7753226790372381 and parameters: {'kernel': 'linear', 'epsilon': 0.9663418374803076}. Best is trial 149 with value: 0.7767469696771062.
Trial 1244 finished with value: 0.35125265032025366 and parameters: {'kernel': 'rbf', 'epsilon': 0.3797745159183781}. Best is trial 149 with value: 0.7767469696771062.
Trial 1243 finished with value: 0.3300601300866498 and parameters: {'kernel': 'poly', 'epsilon': 0.06499317081351463}. Best is trial 149 with value: 0.7767469696771062.
Trial 1246 finished with value: 0.3299914721560239 and parameters: {'kernel': 'poly', 'epsilon': 0.17414185526727222}. Best is trial 149 with value: 0.7767469696771062.
Trial 1248 finished with value: 0.7762236836029145 and parameters: {'kernel': 'linear', 'epsilon': 0.3742492721121995}. Best is trial 149 with value: 0.7767469696771062.
Trial 1249 finished with value: 0.42463125180052347 and parameters: {'kernel': 'sigmoid', 'epsilon': 0.6471018319017972}. Best is trial 149 with value: 0.7767469696771062.
Trial 1247 finished with value: 0.776033376445602 and parameters: {'kernel': 'linear', 'epsilon': 0.6937598920892902}. Best is trial 149 with value: 0.7767469696771062.
Trial 1256 finished with value: 0.4247881948291288 and parameters: {'kernel': 'sigmoid', 'epsilon': 0.7250340630050003}. Best is trial 149 with value: 0.7767469696771062.
Trial 1235 finished with value: 0.7754322385513446 and parameters: {'kernel': 'linear', 'epsilon': 0.9090296637807305}. Best is trial 149 with value: 0.7767469696771062.
Trial 1250 finished with value: 0.35039294940815835 and parameters: {'kernel': 'rbf', 'epsilon': 0.050309444970328965}. Best is trial 149 with value: 0.7767469696771062.
Trial 1257 finished with value: 0.42486728927088036 and parameters: {'kernel': 'sigmoid', 'epsilon': 0.01656512403975252}. Best is trial 149 with value: 0.7767469696771062.
Trial 1258 finished with value: 0.42500494458493154 and parameters: {'kernel': 'sigmoid', 'epsilon': 0.14347938715931596}. Best is trial 149 with value: 0.7767469696771062.
Trial 1252 finished with value: 0.42470716187950225 and parameters: {'kernel': 'sigmoid', 'epsilon': 0.35042994625191703}. Best is trial 149 with value: 0.7767469696771062.
Trial 1259 finished with value: 0.35141324274518093 and parameters: {'kernel': 'rbf', 'epsilon': 0.4232598111899968}. Best is trial 149 with value: 0.7767469696771062.
Trial 1260 finished with value: 0.4243107791376873 and parameters: {'kernel': 'sigmoid', 'epsilon': 0.9546454961662154}. Best is trial 149 with value: 0.7767469696771062.
Trial 1261 finished with value: 0.350602248513289 and parameters: {'kernel': 'rbf', 'epsilon': 0.15331284052853655}. Best is trial 149 with value: 0.7767469696771062.
Trial 1253 finished with value: 0.4246613582644727 and parameters: {'kernel': 'sigmoid', 'epsilon': 0.6548989773921429}. Best is trial 149 with value: 0.7767469696771062.
Trial 1263 finished with value: 0.42470695380182233 and parameters: {'kernel': 'sigmoid', 'epsilon': 0.7827020361837596}. Best is trial 149 with value: 0.7767469696771062.
Trial 1262 finished with value: 0.3297738465155332 and parameters: {'kernel': 'poly', 'epsilon': 0.4443073387370816}. Best is trial 149 with value: 0.7767469696771062.
Trial 1255 finished with value: 0.3531679992926286 and parameters: {'kernel': 'rbf', 'epsilon': 0.827088143596838}. Best is trial 149 with value: 0.7767469696771062.
Trial 1254 finished with value: 0.7760590994135719 and parameters: {'kernel': 'linear', 'epsilon': 0.6664319247020256}. Best is trial 149 with value: 0.7767469696771062.
Trial 1271 finished with value: 0.3520498580632729 and parameters: {'kernel': 'rbf', 'epsilon': 0.561425516849411}. Best is trial 149 with value: 0.7767469696771062.
Trial 1268 finished with value: 0.4244118844744377 and parameters: {'kernel': 'sigmoid', 'epsilon': 0.5773387763307408}. Best is trial 149 with value: 0.7767469696771062.
Trial 1264 finished with value: 0.7762366332925358 and parameters: {'kernel': 'linear', 'epsilon': 0.37054203029225996}. Best is trial 149 with value: 0.7767469696771062.
Trial 1266 finished with value: 0.32988055319406884 and parameters: {'kernel': 'poly', 'epsilon': 0.3427234547938248}. Best is trial 149 with value: 0.7767469696771062.
Trial 1265 finished with value: 0.3527248173539528 and parameters: {'kernel': 'rbf', 'epsilon': 0.7110062808157329}. Best is trial 149 with value: 0.7767469696771062.
Trial 1267 finished with value: 0.35080768172343746 and parameters: {'kernel': 'rbf', 'epsilon': 0.22917653498109447}. Best is trial 149 with value: 0.7767469696771062.
Trial 1251 finished with value: 0.3294270192171324 and parameters: {'kernel': 'poly', 'epsilon': 0.6483237445616206}. Best is trial 149 with value: 0.7767469696771062.
Trial 1276 finished with value: 0.32939053089771164 and parameters: {'kernel': 'poly', 'epsilon': 0.7036644964741585}. Best is trial 149 with value: 0.7767469696771062.
Trial 1274 finished with value: 0.3503795466291299 and parameters: {'kernel': 'rbf', 'epsilon': 0.04054201969583848}. Best is trial 149 with value: 0.7767469696771062.
Trial 1275 finished with value: 0.32997476488173805 and parameters: {'kernel': 'poly', 'epsilon': 0.20362703293247297}. Best is trial 149 with value: 0.7767469696771062.
Trial 1273 finished with value: 0.3299434009921754 and parameters: {'kernel': 'poly', 'epsilon': 0.2419025574967968}. Best is trial 149 with value: 0.7767469696771062.
Trial 1269 finished with value: 0.42390364340775566 and parameters: {'kernel': 'sigmoid', 'epsilon': 0.9985738385039407}. Best is trial 149 with value: 0.7767469696771062.
Trial 1281 finished with value: 0.7760456372719857 and parameters: {'kernel': 'linear', 'epsilon': 0.6799984307556131}. Best is trial 149 with value: 0.7767469696771062.
Trial 1278 finished with value: 0.4245716103477104 and parameters: {'kernel': 'sigmoid', 'epsilon': 0.6337378216129236}. Best is trial 149 with value: 0.7767469696771062.
Trial 1272 finished with value: 0.4250941322604559 and parameters: {'kernel': 'sigmoid', 'epsilon': 0.19517676195883737}. Best is trial 149 with value: 0.7767469696771062.
Trial 1270 finished with value: 0.3296325120255127 and parameters: {'kernel': 'poly', 'epsilon': 0.5297501709536214}. Best is trial 149 with value: 0.7767469696771062.
Trial 1279 finished with value: 0.4246379231257215 and parameters: {'kernel': 'sigmoid', 'epsilon': 0.3598434156182244}. Best is trial 149 with value: 0.7767469696771062.
Trial 1285 finished with value: 0.3300273844340752 and parameters: {'kernel': 'poly', 'epsilon': 0.1338215259124267}. Best is trial 149 with value: 0.7767469696771062.
Trial 1283 finished with value: 0.4245549138769988 and parameters: {'kernel': 'sigmoid', 'epsilon': 0.8758611986776302}. Best is trial 149 with value: 0.7767469696771062.
Trial 1284 finished with value: 0.32926900457605746 and parameters: {'kernel': 'poly', 'epsilon': 0.8165749892466243}. Best is trial 149 with value: 0.7767469696771062.
Trial 1286 finished with value: 0.3291482293287137 and parameters: {'kernel': 'poly', 'epsilon': 0.8962704187522043}. Best is trial 149 with value: 0.7767469696771062.
Trial 1293 finished with value: 0.32942030621959545 and parameters: {'kernel': 'poly', 'epsilon': 0.6538356374223215}. Best is trial 149 with value: 0.7767469696771062.
Trial 1289 finished with value: 0.4243816935171685 and parameters: {'kernel': 'sigmoid', 'epsilon': 0.5254261709631302}. Best is trial 149 with value: 0.7767469696771062.
Trial 1287 finished with value: 0.7765937294622342 and parameters: {'kernel': 'linear', 'epsilon': 0.06631802505814866}. Best is trial 149 with value: 0.7767469696771062.
Trial 1288 finished with value: 0.3298242965304457 and parameters: {'kernel': 'poly', 'epsilon': 0.3992708299086857}. Best is trial 149 with value: 0.7767469696771062.
Trial 1282 finished with value: 0.7753564476622687 and parameters: {'kernel': 'linear', 'epsilon': 0.9375931198554652}. Best is trial 149 with value: 0.7767469696771062.
Trial 1292 finished with value: 0.424976028725093 and parameters: {'kernel': 'sigmoid', 'epsilon': 0.1060099474152324}. Best is trial 149 with value: 0.7767469696771062.
Trial 1290 finished with value: 0.329123067027262 and parameters: {'kernel': 'poly', 'epsilon': 0.9256808914052224}. Best is trial 149 with value: 0.7767469696771062.
Trial 1294 finished with value: 0.3510534480049782 and parameters: {'kernel': 'rbf', 'epsilon': 0.33253072896518554}. Best is trial 149 with value: 0.7767469696771062.
Trial 1277 finished with value: 0.3298401966174408 and parameters: {'kernel': 'poly', 'epsilon': 0.38226311247273237}. Best is trial 149 with value: 0.7767469696771062.
Trial 1291 finished with value: 0.3535787425157823 and parameters: {'kernel': 'rbf', 'epsilon': 0.9768300603718602}. Best is trial 149 with value: 0.7767469696771062.
Trial 1295 finished with value: 0.35322640015298024 and parameters: {'kernel': 'rbf', 'epsilon': 0.8513920628428541}. Best is trial 149 with value: 0.7767469696771062.
Trial 1298 finished with value: 0.3299389985807251 and parameters: {'kernel': 'poly', 'epsilon': 0.24992617624020963}. Best is trial 149 with value: 0.7767469696771062.
Trial 1297 finished with value: 0.3508766293178298 and parameters: {'kernel': 'rbf', 'epsilon': 0.2548334880444306}. Best is trial 149 with value: 0.7767469696771062.
Trial 1303 finished with value: 0.3503353238903431 and parameters: {'kernel': 'rbf', 'epsilon': 0.010568369269035593}. Best is trial 149 with value: 0.7767469696771062.
Trial 1301 finished with value: 0.42487990221687416 and parameters: {'kernel': 'sigmoid', 'epsilon': 0.26840268927923105}. Best is trial 149 with value: 0.7767469696771062.
