Trial 1299 finished with value: 0.4244262602581486 and parameters: {'kernel': 'sigmoid', 'epsilon': 0.9376120817062531}. Best is trial 149 with value: 0.7767469696771062.
Trial 1300 finished with value: 0.775332255399787 and parameters: {'kernel': 'linear', 'epsilon': 0.9573215209091426}. Best is trial 149 with value: 0.7767469696771062.
Trial 1296 finished with value: 0.4249888455240571 and parameters: {'kernel': 'sigmoid', 'epsilon': 0.11759704658754833}. Best is trial 149 with value: 0.7767469696771062.
Trial 1302 finished with value: 0.35102380570857805 and parameters: {'kernel': 'rbf', 'epsilon': 0.31906732796954473}. Best is trial 149 with value: 0.7767469696771062.
