Trial 517 finished with value: 0.32935361037937455 and parameters: {'kernel': 'poly', 'epsilon': 0.752673196773576}. Best is trial 149 with value: 0.7767469696771062.
Trial 525 finished with value: 0.329380144704476 and parameters: {'kernel': 'poly', 'epsilon': 0.7195781136408876}. Best is trial 149 with value: 0.7767469696771062.
Trial 528 finished with value: 0.3294272994580042 and parameters: {'kernel': 'poly', 'epsilon': 0.6482158536595186}. Best is trial 149 with value: 0.7767469696771062.
Trial 523 finished with value: 0.42445488198689085 and parameters: {'kernel': 'sigmoid', 'epsilon': 0.9047154408505756}. Best is trial 149 with value: 0.7767469696771062.
Trial 522 finished with value: 0.42444224121760643 and parameters: {'kernel': 'sigmoid', 'epsilon': 0.46290625184993517}. Best is trial 149 with value: 0.7767469696771062.
Trial 515 finished with value: 0.4248703500448364 and parameters: {'kernel': 'sigmoid', 'epsilon': 0.27361083783615525}. Best is trial 149 with value: 0.7767469696771062.
Trial 524 finished with value: 0.42453208278374543 and parameters: {'kernel': 'sigmoid', 'epsilon': 0.40386344417263564}. Best is trial 149 with value: 0.7767469696771062.
Trial 526 finished with value: 0.7765978541321837 and parameters: {'kernel': 'linear', 'epsilon': 0.17372499963722177}. Best is trial 149 with value: 0.7767469696771062.
Trial 529 finished with value: 0.776056831037925 and parameters: {'kernel': 'linear', 'epsilon': 0.668526763013742}. Best is trial 149 with value: 0.7767469696771062.
Trial 531 finished with value: 0.4250026338500543 and parameters: {'kernel': 'sigmoid', 'epsilon': 0.14029351172680604}. Best is trial 149 with value: 0.7767469696771062.
Trial 530 finished with value: 0.775441478897353 and parameters: {'kernel': 'linear', 'epsilon': 0.9003694893326883}. Best is trial 149 with value: 0.7767469696771062.
Trial 535 finished with value: 0.42497693929607383 and parameters: {'kernel': 'sigmoid', 'epsilon': 0.05874368756854054}. Best is trial 149 with value: 0.7767469696771062.
Trial 532 finished with value: 0.42461538064514404 and parameters: {'kernel': 'sigmoid', 'epsilon': 0.8498332507019257}. Best is trial 149 with value: 0.7767469696771062.
Trial 533 finished with value: 0.3534490292687717 and parameters: {'kernel': 'rbf', 'epsilon': 0.9271783141278812}. Best is trial 149 with value: 0.7767469696771062.
Trial 537 finished with value: 0.7765281123645806 and parameters: {'kernel': 'linear', 'epsilon': 0.24930794215809582}. Best is trial 149 with value: 0.7767469696771062.
Trial 541 finished with value: 0.42476243499772715 and parameters: {'kernel': 'sigmoid', 'epsilon': 0.32958852693253227}. Best is trial 149 with value: 0.7767469696771062.
Trial 536 finished with value: 0.35101433287411576 and parameters: {'kernel': 'rbf', 'epsilon': 0.313981077224744}. Best is trial 149 with value: 0.7767469696771062.
Trial 540 finished with value: 0.42444687353466354 and parameters: {'kernel': 'sigmoid', 'epsilon': 0.5971949456966092}. Best is trial 149 with value: 0.7767469696771062.
Trial 534 finished with value: 0.424712013574176 and parameters: {'kernel': 'sigmoid', 'epsilon': 0.7654961299649975}. Best is trial 149 with value: 0.7767469696771062.
Trial 539 finished with value: 0.42445587704044224 and parameters: {'kernel': 'sigmoid', 'epsilon': 0.9031737468915477}. Best is trial 149 with value: 0.7767469696771062.
Trial 538 finished with value: 0.35218257234119765 and parameters: {'kernel': 'rbf', 'epsilon': 0.5919307019636411}. Best is trial 149 with value: 0.7767469696771062.
Trial 543 finished with value: 0.7760428790589613 and parameters: {'kernel': 'linear', 'epsilon': 0.6154286110054865}. Best is trial 149 with value: 0.7767469696771062.
Trial 546 finished with value: 0.7765873694111911 and parameters: {'kernel': 'linear', 'epsilon': 0.15892186514909767}. Best is trial 149 with value: 0.7767469696771062.
Trial 545 finished with value: 0.42498223309873717 and parameters: {'kernel': 'sigmoid', 'epsilon': 0.22023194340356955}. Best is trial 149 with value: 0.7767469696771062.
Trial 547 finished with value: 0.3298765145006233 and parameters: {'kernel': 'poly', 'epsilon': 0.34672248552397344}. Best is trial 149 with value: 0.7767469696771062.
Trial 544 finished with value: 0.776745815537933 and parameters: {'kernel': 'linear', 'epsilon': 0.11818365492689942}. Best is trial 149 with value: 0.7767469696771062.
Trial 548 finished with value: 0.35076410356163434 and parameters: {'kernel': 'rbf', 'epsilon': 0.21268167491753687}. Best is trial 149 with value: 0.7767469696771062.
Trial 552 finished with value: 0.330016573165007 and parameters: {'kernel': 'poly', 'epsilon': 0.1439813082702237}. Best is trial 149 with value: 0.7767469696771062.
Trial 549 finished with value: 0.329166605964961 and parameters: {'kernel': 'poly', 'epsilon': 0.8792048610438534}. Best is trial 149 with value: 0.7767469696771062.
Trial 553 finished with value: 0.4249520434898483 and parameters: {'kernel': 'sigmoid', 'epsilon': 0.046893442500141935}. Best is trial 149 with value: 0.7767469696771062.
Trial 550 finished with value: 0.4245581521170507 and parameters: {'kernel': 'sigmoid', 'epsilon': 0.8745987006122794}. Best is trial 149 with value: 0.7767469696771062.
Trial 551 finished with value: 0.35119828128381025 and parameters: {'kernel': 'rbf', 'epsilon': 0.3665053327366393}. Best is trial 149 with value: 0.7767469696771062.
Trial 562 finished with value: 0.7759641941969446 and parameters: {'kernel': 'linear', 'epsilon': 0.43432917253479864}. Best is trial 149 with value: 0.7767469696771062.
Trial 555 finished with value: 0.35047438875883935 and parameters: {'kernel': 'rbf', 'epsilon': 0.09055143744485172}. Best is trial 149 with value: 0.7767469696771062.
Trial 542 finished with value: 0.4247962244227712 and parameters: {'kernel': 'sigmoid', 'epsilon': 0.7005883995414582}. Best is trial 149 with value: 0.7767469696771062.
Trial 557 finished with value: 0.32964566210324653 and parameters: {'kernel': 'poly', 'epsilon': 0.5237236699910413}. Best is trial 149 with value: 0.7767469696771062.
Trial 560 finished with value: 0.42447275985392796 and parameters: {'kernel': 'sigmoid', 'epsilon': 0.9294048246451422}. Best is trial 149 with value: 0.7767469696771062.
Trial 554 finished with value: 0.35089149428305716 and parameters: {'kernel': 'rbf', 'epsilon': 0.25979288805544176}. Best is trial 149 with value: 0.7767469696771062.
Trial 559 finished with value: 0.4246149721363389 and parameters: {'kernel': 'sigmoid', 'epsilon': 0.8506005454888828}. Best is trial 149 with value: 0.7767469696771062.
Trial 561 finished with value: 0.4247383609148906 and parameters: {'kernel': 'sigmoid', 'epsilon': 0.3378218080735017}. Best is trial 149 with value: 0.7767469696771062.
Trial 556 finished with value: 0.35043221084877735 and parameters: {'kernel': 'rbf', 'epsilon': 0.06991064642762379}. Best is trial 149 with value: 0.7767469696771062.
Trial 569 finished with value: 0.35319385405398873 and parameters: {'kernel': 'rbf', 'epsilon': 0.8371656136642671}. Best is trial 149 with value: 0.7767469696771062.
Trial 566 finished with value: 0.3515816109348548 and parameters: {'kernel': 'rbf', 'epsilon': 0.45527964964817047}. Best is trial 149 with value: 0.7767469696771062.
Trial 558 finished with value: 0.3535429151416579 and parameters: {'kernel': 'rbf', 'epsilon': 0.9590573039534678}. Best is trial 149 with value: 0.7767469696771062.
Trial 563 finished with value: 0.7759560073370194 and parameters: {'kernel': 'linear', 'epsilon': 0.7588982670696565}. Best is trial 149 with value: 0.7767469696771062.
Trial 567 finished with value: 0.3532062608233469 and parameters: {'kernel': 'rbf', 'epsilon': 0.842221197264115}. Best is trial 149 with value: 0.7767469696771062.
Trial 564 finished with value: 0.35168488478862003 and parameters: {'kernel': 'rbf', 'epsilon': 0.4742188752010862}. Best is trial 149 with value: 0.7767469696771062.
Trial 570 finished with value: 0.35221904632647283 and parameters: {'kernel': 'rbf', 'epsilon': 0.6001595348530675}. Best is trial 149 with value: 0.7767469696771062.
Trial 565 finished with value: 0.3511009418587602 and parameters: {'kernel': 'rbf', 'epsilon': 0.34526605890146356}. Best is trial 149 with value: 0.7767469696771062.
Trial 568 finished with value: 0.4247684522384986 and parameters: {'kernel': 'sigmoid', 'epsilon': 0.32755691164728384}. Best is trial 149 with value: 0.7767469696771062.
Trial 572 finished with value: 0.3504447640635846 and parameters: {'kernel': 'rbf', 'epsilon': 0.0757481832987541}. Best is trial 149 with value: 0.7767469696771062.
Trial 583 finished with value: 0.4249797026127826 and parameters: {'kernel': 'sigmoid', 'epsilon': 0.06149180386408115}. Best is trial 149 with value: 0.7767469696771062.
Trial 577 finished with value: 0.32939590355731724 and parameters: {'kernel': 'poly', 'epsilon': 0.6826579851847366}. Best is trial 149 with value: 0.7767469696771062.
Trial 579 finished with value: 0.4249958288889769 and parameters: {'kernel': 'sigmoid', 'epsilon': 0.12964391440258793}. Best is trial 149 with value: 0.7767469696771062.
Trial 580 finished with value: 0.3299762199394557 and parameters: {'kernel': 'poly', 'epsilon': 0.20012115186136226}. Best is trial 149 with value: 0.7767469696771062.
Trial 576 finished with value: 0.4248977171446877 and parameters: {'kernel': 'sigmoid', 'epsilon': 0.026083375208196258}. Best is trial 149 with value: 0.7767469696771062.
Trial 575 finished with value: 0.3300274858642534 and parameters: {'kernel': 'poly', 'epsilon': 0.11906392905083907}. Best is trial 149 with value: 0.7767469696771062.
Trial 573 finished with value: 0.32938748963067527 and parameters: {'kernel': 'poly', 'epsilon': 0.7080568112894086}. Best is trial 149 with value: 0.7767469696771062.
Trial 574 finished with value: 0.4248332322778932 and parameters: {'kernel': 'sigmoid', 'epsilon': 0.2889588833808585}. Best is trial 149 with value: 0.7767469696771062.
Trial 582 finished with value: 0.3300080192274618 and parameters: {'kernel': 'poly', 'epsilon': 0.151683955511288}. Best is trial 149 with value: 0.7767469696771062.
Trial 571 finished with value: 0.4250813311833446 and parameters: {'kernel': 'sigmoid', 'epsilon': 0.17741391969550657}. Best is trial 149 with value: 0.7767469696771062.
Trial 581 finished with value: 0.7757846298006076 and parameters: {'kernel': 'linear', 'epsilon': 0.5248735839997954}. Best is trial 149 with value: 0.7767469696771062.
Trial 585 finished with value: 0.3299844617845052 and parameters: {'kernel': 'poly', 'epsilon': 0.18517194824569339}. Best is trial 149 with value: 0.7767469696771062.
Trial 584 finished with value: 0.32996971801867037 and parameters: {'kernel': 'poly', 'epsilon': 0.2168715922219422}. Best is trial 149 with value: 0.7767469696771062.
Trial 578 finished with value: 0.4247933043459673 and parameters: {'kernel': 'sigmoid', 'epsilon': 0.3136343487363239}. Best is trial 149 with value: 0.7767469696771062.
Trial 586 finished with value: 0.7755609115350817 and parameters: {'kernel': 'linear', 'epsilon': 0.8466599468465176}. Best is trial 149 with value: 0.7767469696771062.
Trial 587 finished with value: 0.3503947529905678 and parameters: {'kernel': 'rbf', 'epsilon': 0.05135941732352789}. Best is trial 149 with value: 0.7767469696771062.
Trial 590 finished with value: 0.32910010098895764 and parameters: {'kernel': 'poly', 'epsilon': 0.9411016403430701}. Best is trial 149 with value: 0.7767469696771062.
Trial 591 finished with value: 0.32950668078139256 and parameters: {'kernel': 'poly', 'epsilon': 0.5869541039576718}. Best is trial 149 with value: 0.7767469696771062.
Trial 592 finished with value: 0.35032804957415503 and parameters: {'kernel': 'rbf', 'epsilon': 0.006580253551903947}. Best is trial 149 with value: 0.7767469696771062.
Trial 593 finished with value: 0.3294690815031911 and parameters: {'kernel': 'poly', 'epsilon': 0.6114070363705582}. Best is trial 149 with value: 0.7767469696771062.
Trial 597 finished with value: 0.42470862322715686 and parameters: {'kernel': 'sigmoid', 'epsilon': 0.7818837984660868}. Best is trial 149 with value: 0.7767469696771062.
Trial 588 finished with value: 0.7753358869130873 and parameters: {'kernel': 'linear', 'epsilon': 0.9534627648147596}. Best is trial 149 with value: 0.7767469696771062.
Trial 596 finished with value: 0.35273476006870724 and parameters: {'kernel': 'rbf', 'epsilon': 0.7135325324259937}. Best is trial 149 with value: 0.7767469696771062.
Trial 589 finished with value: 0.4245373107433741 and parameters: {'kernel': 'sigmoid', 'epsilon': 0.3943343885540832}. Best is trial 149 with value: 0.7767469696771062.
Trial 599 finished with value: 0.7758521207293739 and parameters: {'kernel': 'linear', 'epsilon': 0.5358485692550221}. Best is trial 149 with value: 0.7767469696771062.
Trial 594 finished with value: 0.4245751506435574 and parameters: {'kernel': 'sigmoid', 'epsilon': 0.869054607062898}. Best is trial 149 with value: 0.7767469696771062.
Trial 600 finished with value: 0.776052459851768 and parameters: {'kernel': 'linear', 'epsilon': 0.67282855231471}. Best is trial 149 with value: 0.7767469696771062.
Trial 595 finished with value: 0.32935080922801585 and parameters: {'kernel': 'poly', 'epsilon': 0.757563123120868}. Best is trial 149 with value: 0.7767469696771062.
Trial 598 finished with value: 0.3299318757140854 and parameters: {'kernel': 'poly', 'epsilon': 0.2718107671383244}. Best is trial 149 with value: 0.7767469696771062.
Trial 603 finished with value: 0.35179545042621185 and parameters: {'kernel': 'rbf', 'epsilon': 0.4993409557149088}. Best is trial 149 with value: 0.7767469696771062.
Trial 602 finished with value: 0.424365171290009 and parameters: {'kernel': 'sigmoid', 'epsilon': 0.5520480318007479}. Best is trial 149 with value: 0.7767469696771062.
Trial 604 finished with value: 0.4250636966752973 and parameters: {'kernel': 'sigmoid', 'epsilon': 0.17070013573634468}. Best is trial 149 with value: 0.7767469696771062.
Trial 609 finished with value: 0.329150032358579 and parameters: {'kernel': 'poly', 'epsilon': 0.8950113650282158}. Best is trial 149 with value: 0.7767469696771062.
Trial 601 finished with value: 0.3300056385496374 and parameters: {'kernel': 'poly', 'epsilon': 0.15392345278803987}. Best is trial 149 with value: 0.7767469696771062.
Trial 607 finished with value: 0.32942227501038823 and parameters: {'kernel': 'poly', 'epsilon': 0.6515661459627178}. Best is trial 149 with value: 0.7767469696771062.
Trial 605 finished with value: 0.32935276738820674 and parameters: {'kernel': 'poly', 'epsilon': 0.7535006693756273}. Best is trial 149 with value: 0.7767469696771062.
Trial 611 finished with value: 0.4243753243705771 and parameters: {'kernel': 'sigmoid', 'epsilon': 0.4995414162255175}. Best is trial 149 with value: 0.7767469696771062.
Trial 612 finished with value: 0.32943332994493046 and parameters: {'kernel': 'poly', 'epsilon': 0.6455795088000413}. Best is trial 149 with value: 0.7767469696771062.
Trial 608 finished with value: 0.7762764246161631 and parameters: {'kernel': 'linear', 'epsilon': 0.36309498561947406}. Best is trial 149 with value: 0.7767469696771062.
Trial 616 finished with value: 0.32924291114358467 and parameters: {'kernel': 'poly', 'epsilon': 0.8342982377650089}. Best is trial 149 with value: 0.7767469696771062.
Trial 606 finished with value: 0.7758165660927947 and parameters: {'kernel': 'linear', 'epsilon': 0.4545193447749908}. Best is trial 149 with value: 0.7767469696771062.
Trial 615 finished with value: 0.7760450509265329 and parameters: {'kernel': 'linear', 'epsilon': 0.6806093091846079}. Best is trial 149 with value: 0.7767469696771062.
Trial 617 finished with value: 0.3299303026993954 and parameters: {'kernel': 'poly', 'epsilon': 0.26513827794404665}. Best is trial 149 with value: 0.7767469696771062.
Trial 610 finished with value: 0.3526271791841219 and parameters: {'kernel': 'rbf', 'epsilon': 0.6873459890414546}. Best is trial 149 with value: 0.7767469696771062.
Trial 613 finished with value: 0.776118923248611 and parameters: {'kernel': 'linear', 'epsilon': 0.4109528714751046}. Best is trial 149 with value: 0.7767469696771062.
Trial 618 finished with value: 0.7757230266672402 and parameters: {'kernel': 'linear', 'epsilon': 0.5138803454785981}. Best is trial 149 with value: 0.7767469696771062.
Trial 619 finished with value: 0.4243609017468198 and parameters: {'kernel': 'sigmoid', 'epsilon': 0.5390816045871573}. Best is trial 149 with value: 0.7767469696771062.
Trial 620 finished with value: 0.329292690992346 and parameters: {'kernel': 'poly', 'epsilon': 0.8019560500224051}. Best is trial 149 with value: 0.7767469696771062.
Trial 621 finished with value: 0.3299947641965097 and parameters: {'kernel': 'poly', 'epsilon': 0.16710921764595799}. Best is trial 149 with value: 0.7767469696771062.
Trial 614 finished with value: 0.776544121346373 and parameters: {'kernel': 'linear', 'epsilon': 0.2524668082305468}. Best is trial 149 with value: 0.7767469696771062.
Trial 624 finished with value: 0.42464147383022405 and parameters: {'kernel': 'sigmoid', 'epsilon': 0.8357806489762782}. Best is trial 149 with value: 0.7767469696771062.
Trial 622 finished with value: 0.3512370675244789 and parameters: {'kernel': 'rbf', 'epsilon': 0.3759436506336815}. Best is trial 149 with value: 0.7767469696771062.
Trial 623 finished with value: 0.32916875314069594 and parameters: {'kernel': 'poly', 'epsilon': 0.8777451472313186}. Best is trial 149 with value: 0.7767469696771062.
Trial 626 finished with value: 0.776075021117871 and parameters: {'kernel': 'linear', 'epsilon': 0.42021823178978657}. Best is trial 149 with value: 0.7767469696771062.
Trial 633 finished with value: 0.3503277661938925 and parameters: {'kernel': 'rbf', 'epsilon': 0.006602308884866126}. Best is trial 149 with value: 0.7767469696771062.
Trial 634 finished with value: 0.42465702732329336 and parameters: {'kernel': 'sigmoid', 'epsilon': 0.3536385272537035}. Best is trial 149 with value: 0.7767469696771062.
Trial 632 finished with value: 0.7754278838031848 and parameters: {'kernel': 'linear', 'epsilon': 0.912753964268555}. Best is trial 149 with value: 0.7767469696771062.
Trial 629 finished with value: 0.3534858669403497 and parameters: {'kernel': 'rbf', 'epsilon': 0.93997533531125}. Best is trial 149 with value: 0.7767469696771062.
Trial 630 finished with value: 0.3298986261837644 and parameters: {'kernel': 'poly', 'epsilon': 0.32338701011138427}. Best is trial 149 with value: 0.7767469696771062.
Trial 631 finished with value: 0.3505738324633445 and parameters: {'kernel': 'rbf', 'epsilon': 0.13922111545882287}. Best is trial 149 with value: 0.7767469696771062.
Trial 635 finished with value: 0.3526464652730374 and parameters: {'kernel': 'rbf', 'epsilon': 0.6920438308164146}. Best is trial 149 with value: 0.7767469696771062.
Trial 625 finished with value: 0.3507093856736232 and parameters: {'kernel': 'rbf', 'epsilon': 0.1940756069489309}. Best is trial 149 with value: 0.7767469696771062.
Trial 627 finished with value: 0.42429745052587864 and parameters: {'kernel': 'sigmoid', 'epsilon': 0.9566205705185366}. Best is trial 149 with value: 0.7767469696771062.
Trial 640 finished with value: 0.4250645115288603 and parameters: {'kernel': 'sigmoid', 'epsilon': 0.2059105523140876}. Best is trial 149 with value: 0.7767469696771062.
Trial 639 finished with value: 0.7766202388841444 and parameters: {'kernel': 'linear', 'epsilon': 0.198675246725733}. Best is trial 149 with value: 0.7767469696771062.
Trial 628 finished with value: 0.7754611191436204 and parameters: {'kernel': 'linear', 'epsilon': 0.8930386369189285}. Best is trial 149 with value: 0.7767469696771062.
Trial 644 finished with value: 0.42453654055863754 and parameters: {'kernel': 'sigmoid', 'epsilon': 0.6252045721060498}. Best is trial 149 with value: 0.7767469696771062.
Trial 645 finished with value: 0.4247709726576766 and parameters: {'kernel': 'sigmoid', 'epsilon': 0.7317052656547386}. Best is trial 149 with value: 0.7767469696771062.
Trial 636 finished with value: 0.35074069520188056 and parameters: {'kernel': 'rbf', 'epsilon': 0.203893021146055}. Best is trial 149 with value: 0.7767469696771062.
Trial 638 finished with value: 0.3511949177605377 and parameters: {'kernel': 'rbf', 'epsilon': 0.3657626254517995}. Best is trial 149 with value: 0.7767469696771062.
Trial 637 finished with value: 0.4249904224479719 and parameters: {'kernel': 'sigmoid', 'epsilon': 0.07476795547256498}. Best is trial 149 with value: 0.7767469696771062.
Trial 641 finished with value: 0.32979675027482364 and parameters: {'kernel': 'poly', 'epsilon': 0.4196035166060468}. Best is trial 149 with value: 0.7767469696771062.
Trial 649 finished with value: 0.42489782985566266 and parameters: {'kernel': 'sigmoid', 'epsilon': 0.026686599493818686}. Best is trial 149 with value: 0.7767469696771062.
Trial 653 finished with value: 0.7757050117395387 and parameters: {'kernel': 'linear', 'epsilon': 0.4910728192405508}. Best is trial 149 with value: 0.7767469696771062.
Trial 643 finished with value: 0.7759817027289065 and parameters: {'kernel': 'linear', 'epsilon': 0.7376106487311825}. Best is trial 149 with value: 0.7767469696771062.
Trial 650 finished with value: 0.7765942572249502 and parameters: {'kernel': 'linear', 'epsilon': 0.05064310168870656}. Best is trial 149 with value: 0.7767469696771062.
Trial 647 finished with value: 0.4244397091016741 and parameters: {'kernel': 'sigmoid', 'epsilon': 0.5933047323242786}. Best is trial 149 with value: 0.7767469696771062.
Trial 648 finished with value: 0.7765677325150832 and parameters: {'kernel': 'linear', 'epsilon': 0.2228684682939277}. Best is trial 149 with value: 0.7767469696771062.
Trial 652 finished with value: 0.35128103445346487 and parameters: {'kernel': 'rbf', 'epsilon': 0.38664843224673995}. Best is trial 149 with value: 0.7767469696771062.
