Trial 138 finished with value: 0.42471150790656614 and parameters: {'kernel': 'sigmoid', 'epsilon': 0.7677926371556201}. Best is trial 14 with value: 0.7766611261459099.
Trial 132 finished with value: 0.42443751122537166 and parameters: {'kernel': 'sigmoid', 'epsilon': 0.591614467649392}. Best is trial 14 with value: 0.7766611261459099.
Trial 128 finished with value: 0.3300330514620356 and parameters: {'kernel': 'poly', 'epsilon': 0.09360739127370776}. Best is trial 14 with value: 0.7766611261459099.
Trial 137 finished with value: 0.4251001727747793 and parameters: {'kernel': 'sigmoid', 'epsilon': 0.18964209435324642}. Best is trial 14 with value: 0.7766611261459099.
Trial 133 finished with value: 0.4247601253833457 and parameters: {'kernel': 'sigmoid', 'epsilon': 0.734740929789284}. Best is trial 14 with value: 0.7766611261459099.
Trial 134 finished with value: 0.4244887796760716 and parameters: {'kernel': 'sigmoid', 'epsilon': 0.44659617979195754}. Best is trial 14 with value: 0.7766611261459099.
Trial 135 finished with value: 0.3290447847105783 and parameters: {'kernel': 'poly', 'epsilon': 0.9724770608495686}. Best is trial 14 with value: 0.7766611261459099.
Trial 136 finished with value: 0.42452852426385446 and parameters: {'kernel': 'sigmoid', 'epsilon': 0.4105729535203122}. Best is trial 14 with value: 0.7766611261459099.
Trial 139 finished with value: 0.4244132341224104 and parameters: {'kernel': 'sigmoid', 'epsilon': 0.473822277572044}. Best is trial 14 with value: 0.7766611261459099.
Trial 146 finished with value: 0.7755542652918058 and parameters: {'kernel': 'linear', 'epsilon': 0.8703265118348052}. Best is trial 14 with value: 0.7766611261459099.
Trial 150 finished with value: 0.42465524670373417 and parameters: {'kernel': 'sigmoid', 'epsilon': 0.8295901637429678}. Best is trial 14 with value: 0.7766611261459099.
Trial 142 finished with value: 0.35340093236481207 and parameters: {'kernel': 'rbf', 'epsilon': 0.9120543935560635}. Best is trial 14 with value: 0.7766611261459099.
Trial 143 finished with value: 0.42509532318891663 and parameters: {'kernel': 'sigmoid', 'epsilon': 0.18375855547875697}. Best is trial 14 with value: 0.7766611261459099.
Trial 145 finished with value: 0.351675736761907 and parameters: {'kernel': 'rbf', 'epsilon': 0.4721027481130703}. Best is trial 14 with value: 0.7766611261459099.
Trial 147 finished with value: 0.35119363612270627 and parameters: {'kernel': 'rbf', 'epsilon': 0.3654942255731064}. Best is trial 14 with value: 0.7766611261459099.
Trial 140 finished with value: 0.3535448186288769 and parameters: {'kernel': 'rbf', 'epsilon': 0.9595604905408646}. Best is trial 14 with value: 0.7766611261459099.
Trial 148 finished with value: 0.3504896272162451 and parameters: {'kernel': 'rbf', 'epsilon': 0.0971168680025788}. Best is trial 149 with value: 0.7767469696771062.
Trial 149 finished with value: 0.7767469696771062 and parameters: {'kernel': 'linear', 'epsilon': 0.118467053190348}. Best is trial 149 with value: 0.7767469696771062.
Trial 144 finished with value: 0.42497924212826754 and parameters: {'kernel': 'sigmoid', 'epsilon': 0.081606835220155}. Best is trial 149 with value: 0.7767469696771062.
Trial 154 finished with value: 0.33009167814170814 and parameters: {'kernel': 'poly', 'epsilon': 0.031465381966410355}. Best is trial 149 with value: 0.7767469696771062.
Trial 141 finished with value: 0.3299540760322331 and parameters: {'kernel': 'poly', 'epsilon': 0.23041334191909646}. Best is trial 149 with value: 0.7767469696771062.
Trial 151 finished with value: 0.32978217247637276 and parameters: {'kernel': 'poly', 'epsilon': 0.4337026564414631}. Best is trial 149 with value: 0.7767469696771062.
Trial 152 finished with value: 0.3503581681707625 and parameters: {'kernel': 'rbf', 'epsilon': 0.024820408925601556}. Best is trial 149 with value: 0.7767469696771062.
Trial 156 finished with value: 0.7759686809864481 and parameters: {'kernel': 'linear', 'epsilon': 0.43403830823277934}. Best is trial 149 with value: 0.7767469696771062.
Trial 153 finished with value: 0.42466092576820313 and parameters: {'kernel': 'sigmoid', 'epsilon': 0.8226505210002815}. Best is trial 149 with value: 0.7767469696771062.
Trial 155 finished with value: 0.350443291260628 and parameters: {'kernel': 'rbf', 'epsilon': 0.07513564536447259}. Best is trial 149 with value: 0.7767469696771062.
Trial 160 finished with value: 0.7757442496194724 and parameters: {'kernel': 'linear', 'epsilon': 0.4790801603301639}. Best is trial 149 with value: 0.7767469696771062.
Trial 157 finished with value: 0.35319508180470993 and parameters: {'kernel': 'rbf', 'epsilon': 0.8373458046574063}. Best is trial 149 with value: 0.7767469696771062.
Trial 161 finished with value: 0.7757754499835119 and parameters: {'kernel': 'linear', 'epsilon': 0.8038377940431742}. Best is trial 149 with value: 0.7767469696771062.
Trial 163 finished with value: 0.3300327331696825 and parameters: {'kernel': 'poly', 'epsilon': 0.0937069321627807}. Best is trial 149 with value: 0.7767469696771062.
Trial 159 finished with value: 0.7757264648166494 and parameters: {'kernel': 'linear', 'epsilon': 0.4834329956312189}. Best is trial 149 with value: 0.7767469696771062.
Trial 168 finished with value: 0.7758050340783145 and parameters: {'kernel': 'linear', 'epsilon': 0.79943578536564}. Best is trial 149 with value: 0.7767469696771062.
Trial 169 finished with value: 0.35327643484549337 and parameters: {'kernel': 'rbf', 'epsilon': 0.8720312924849041}. Best is trial 149 with value: 0.7767469696771062.
Trial 162 finished with value: 0.4247850457416892 and parameters: {'kernel': 'sigmoid', 'epsilon': 0.3199973065455174}. Best is trial 149 with value: 0.7767469696771062.
Trial 167 finished with value: 0.7760255204430436 and parameters: {'kernel': 'linear', 'epsilon': 0.7263261352835471}. Best is trial 149 with value: 0.7767469696771062.
Trial 170 finished with value: 0.42488433927620806 and parameters: {'kernel': 'sigmoid', 'epsilon': 0.2665944327576757}. Best is trial 149 with value: 0.7767469696771062.
Trial 158 finished with value: 0.32972021475236335 and parameters: {'kernel': 'poly', 'epsilon': 0.48816433213767807}. Best is trial 149 with value: 0.7767469696771062.
Trial 173 finished with value: 0.4245103033952079 and parameters: {'kernel': 'sigmoid', 'epsilon': 0.9213855976318972}. Best is trial 149 with value: 0.7767469696771062.
Trial 171 finished with value: 0.33002962637096867 and parameters: {'kernel': 'poly', 'epsilon': 0.12839623251476395}. Best is trial 149 with value: 0.7767469696771062.
Trial 164 finished with value: 0.35295340830340133 and parameters: {'kernel': 'rbf', 'epsilon': 0.7737208839615659}. Best is trial 149 with value: 0.7767469696771062.
Trial 165 finished with value: 0.7765827356702081 and parameters: {'kernel': 'linear', 'epsilon': 0.3130977734593543}. Best is trial 149 with value: 0.7767469696771062.
Trial 166 finished with value: 0.32911129575744574 and parameters: {'kernel': 'poly', 'epsilon': 0.9341093501814417}. Best is trial 149 with value: 0.7767469696771062.
Trial 175 finished with value: 0.32974377022372947 and parameters: {'kernel': 'poly', 'epsilon': 0.4751984340201959}. Best is trial 149 with value: 0.7767469696771062.
Trial 181 finished with value: 0.33008930821168886 and parameters: {'kernel': 'poly', 'epsilon': 0.03517099653194544}. Best is trial 149 with value: 0.7767469696771062.
Trial 179 finished with value: 0.7756171256658884 and parameters: {'kernel': 'linear', 'epsilon': 0.8351946479280423}. Best is trial 149 with value: 0.7767469696771062.
Trial 174 finished with value: 0.42462762417969585 and parameters: {'kernel': 'sigmoid', 'epsilon': 0.8410548487155671}. Best is trial 149 with value: 0.7767469696771062.
Trial 183 finished with value: 0.3523006119181705 and parameters: {'kernel': 'rbf', 'epsilon': 0.6167441130525277}. Best is trial 149 with value: 0.7767469696771062.
Trial 177 finished with value: 0.7757449133642778 and parameters: {'kernel': 'linear', 'epsilon': 0.47821036122189453}. Best is trial 149 with value: 0.7767469696771062.
Trial 178 finished with value: 0.3301074111653898 and parameters: {'kernel': 'poly', 'epsilon': 0.012445922286512201}. Best is trial 149 with value: 0.7767469696771062.
Trial 180 finished with value: 0.32913045166488253 and parameters: {'kernel': 'poly', 'epsilon': 0.920742632221829}. Best is trial 149 with value: 0.7767469696771062.
Trial 172 finished with value: 0.7766022483145609 and parameters: {'kernel': 'linear', 'epsilon': 0.1790167434916876}. Best is trial 149 with value: 0.7767469696771062.
Trial 187 finished with value: 0.4247874735110909 and parameters: {'kernel': 'sigmoid', 'epsilon': 0.6961615249685498}. Best is trial 149 with value: 0.7767469696771062.
Trial 189 finished with value: 0.7765983646374334 and parameters: {'kernel': 'linear', 'epsilon': 0.17501438129437485}. Best is trial 149 with value: 0.7767469696771062.
Trial 176 finished with value: 0.4244987650521689 and parameters: {'kernel': 'sigmoid', 'epsilon': 0.9245235082635181}. Best is trial 149 with value: 0.7767469696771062.
Trial 186 finished with value: 0.7759163525043817 and parameters: {'kernel': 'linear', 'epsilon': 0.5537503795988443}. Best is trial 149 with value: 0.7767469696771062.
Trial 184 finished with value: 0.3532984148854027 and parameters: {'kernel': 'rbf', 'epsilon': 0.8800449339868379}. Best is trial 149 with value: 0.7767469696771062.
Trial 185 finished with value: 0.3526057987963924 and parameters: {'kernel': 'rbf', 'epsilon': 0.6817537483572073}. Best is trial 149 with value: 0.7767469696771062.
Trial 188 finished with value: 0.3512025633225197 and parameters: {'kernel': 'rbf', 'epsilon': 0.3673015383548195}. Best is trial 149 with value: 0.7767469696771062.
Trial 182 finished with value: 0.4246814823440519 and parameters: {'kernel': 'sigmoid', 'epsilon': 0.7929273605673051}. Best is trial 149 with value: 0.7767469696771062.
Trial 190 finished with value: 0.35239321370208226 and parameters: {'kernel': 'rbf', 'epsilon': 0.6351520524968778}. Best is trial 149 with value: 0.7767469696771062.
Trial 197 finished with value: 0.3531183094243803 and parameters: {'kernel': 'rbf', 'epsilon': 0.8138939566332056}. Best is trial 149 with value: 0.7767469696771062.
Trial 198 finished with value: 0.3297756389896713 and parameters: {'kernel': 'poly', 'epsilon': 0.44299964917291235}. Best is trial 149 with value: 0.7767469696771062.
Trial 192 finished with value: 0.7753414956800821 and parameters: {'kernel': 'linear', 'epsilon': 0.9477187965145384}. Best is trial 149 with value: 0.7767469696771062.
Trial 195 finished with value: 0.7766090376228029 and parameters: {'kernel': 'linear', 'epsilon': 0.2754456032549899}. Best is trial 149 with value: 0.7767469696771062.
Trial 206 finished with value: 0.35064973732714205 and parameters: {'kernel': 'rbf', 'epsilon': 0.17436850491328193}. Best is trial 149 with value: 0.7767469696771062.
Trial 193 finished with value: 0.424708565820248 and parameters: {'kernel': 'sigmoid', 'epsilon': 0.7742232934171928}. Best is trial 149 with value: 0.7767469696771062.
Trial 191 finished with value: 0.7761393267829718 and parameters: {'kernel': 'linear', 'epsilon': 0.40536949790698484}. Best is trial 149 with value: 0.7767469696771062.
Trial 205 finished with value: 0.7767154005857252 and parameters: {'kernel': 'linear', 'epsilon': 0.11064345642909712}. Best is trial 149 with value: 0.7767469696771062.
Trial 201 finished with value: 0.3530455174432668 and parameters: {'kernel': 'rbf', 'epsilon': 0.7960763115678922}. Best is trial 149 with value: 0.7767469696771062.
Trial 199 finished with value: 0.3291605896839993 and parameters: {'kernel': 'poly', 'epsilon': 0.8846448918419737}. Best is trial 149 with value: 0.7767469696771062.
Trial 204 finished with value: 0.351736250844228 and parameters: {'kernel': 'rbf', 'epsilon': 0.48600172546264686}. Best is trial 149 with value: 0.7767469696771062.
Trial 203 finished with value: 0.7755651958138791 and parameters: {'kernel': 'linear', 'epsilon': 0.8513955037917773}. Best is trial 149 with value: 0.7767469696771062.
Trial 208 finished with value: 0.7758542703549113 and parameters: {'kernel': 'linear', 'epsilon': 0.44824461513868563}. Best is trial 149 with value: 0.7767469696771062.
Trial 196 finished with value: 0.4247929063387666 and parameters: {'kernel': 'sigmoid', 'epsilon': 0.6982153660188514}. Best is trial 149 with value: 0.7767469696771062.
Trial 194 finished with value: 0.7766025937354645 and parameters: {'kernel': 'linear', 'epsilon': 0.18036319019374059}. Best is trial 149 with value: 0.7767469696771062.
Trial 210 finished with value: 0.33010217798581454 and parameters: {'kernel': 'poly', 'epsilon': 0.018897749850312118}. Best is trial 149 with value: 0.7767469696771062.
Trial 200 finished with value: 0.4244051761046218 and parameters: {'kernel': 'sigmoid', 'epsilon': 0.521005903494733}. Best is trial 149 with value: 0.7767469696771062.
Trial 209 finished with value: 0.32993058833604244 and parameters: {'kernel': 'poly', 'epsilon': 0.2620947878980766}. Best is trial 149 with value: 0.7767469696771062.
Trial 207 finished with value: 0.35199052869747355 and parameters: {'kernel': 'rbf', 'epsilon': 0.548556298811335}. Best is trial 149 with value: 0.7767469696771062.
Trial 202 finished with value: 0.4250353099844634 and parameters: {'kernel': 'sigmoid', 'epsilon': 0.16083044990567374}. Best is trial 149 with value: 0.7767469696771062.
Trial 211 finished with value: 0.7766214147824422 and parameters: {'kernel': 'linear', 'epsilon': 0.20838673821905296}. Best is trial 149 with value: 0.7767469696771062.
Trial 215 finished with value: 0.42497129790380084 and parameters: {'kernel': 'sigmoid', 'epsilon': 0.22498040182349988}. Best is trial 149 with value: 0.7767469696771062.
Trial 213 finished with value: 0.3527329626758106 and parameters: {'kernel': 'rbf', 'epsilon': 0.7130991811694997}. Best is trial 149 with value: 0.7767469696771062.
Trial 216 finished with value: 0.32990979829644823 and parameters: {'kernel': 'poly', 'epsilon': 0.3122130880960018}. Best is trial 149 with value: 0.7767469696771062.
Trial 217 finished with value: 0.4244043216347011 and parameters: {'kernel': 'sigmoid', 'epsilon': 0.5202895057251424}. Best is trial 149 with value: 0.7767469696771062.
Trial 224 finished with value: 0.7763619899811263 and parameters: {'kernel': 'linear', 'epsilon': 0.35229168332448346}. Best is trial 149 with value: 0.7767469696771062.
Trial 222 finished with value: 0.42476137790216856 and parameters: {'kernel': 'sigmoid', 'epsilon': 0.73423270066892}. Best is trial 149 with value: 0.7767469696771062.
Trial 219 finished with value: 0.3291812706835969 and parameters: {'kernel': 'poly', 'epsilon': 0.8671124638331941}. Best is trial 149 with value: 0.7767469696771062.
Trial 220 finished with value: 0.7759601134243489 and parameters: {'kernel': 'linear', 'epsilon': 0.7547506111228969}. Best is trial 149 with value: 0.7767469696771062.
Trial 225 finished with value: 0.4249902159764919 and parameters: {'kernel': 'sigmoid', 'epsilon': 0.12090486481630802}. Best is trial 149 with value: 0.7767469696771062.
Trial 223 finished with value: 0.35167838125729345 and parameters: {'kernel': 'rbf', 'epsilon': 0.47265654414215696}. Best is trial 149 with value: 0.7767469696771062.
Trial 218 finished with value: 0.42493250032616176 and parameters: {'kernel': 'sigmoid', 'epsilon': 0.23963122486631738}. Best is trial 149 with value: 0.7767469696771062.
Trial 221 finished with value: 0.32936608729151595 and parameters: {'kernel': 'poly', 'epsilon': 0.7375612100005533}. Best is trial 149 with value: 0.7767469696771062.
Trial 226 finished with value: 0.7756170195109486 and parameters: {'kernel': 'linear', 'epsilon': 0.8351838347112338}. Best is trial 149 with value: 0.7767469696771062.
Trial 228 finished with value: 0.3293412500091044 and parameters: {'kernel': 'poly', 'epsilon': 0.768150216067651}. Best is trial 149 with value: 0.7767469696771062.
Trial 214 finished with value: 0.7760284346438646 and parameters: {'kernel': 'linear', 'epsilon': 0.5876490859096404}. Best is trial 149 with value: 0.7767469696771062.
Trial 227 finished with value: 0.3529913711651467 and parameters: {'kernel': 'rbf', 'epsilon': 0.7830070626660716}. Best is trial 149 with value: 0.7767469696771062.
Trial 212 finished with value: 0.3534579906118604 and parameters: {'kernel': 'rbf', 'epsilon': 0.930355356878024}. Best is trial 149 with value: 0.7767469696771062.
Trial 229 finished with value: 0.7760002136994081 and parameters: {'kernel': 'linear', 'epsilon': 0.43070965743517464}. Best is trial 149 with value: 0.7767469696771062.
Trial 230 finished with value: 0.32976849089288873 and parameters: {'kernel': 'poly', 'epsilon': 0.4525581004576549}. Best is trial 149 with value: 0.7767469696771062.
Trial 231 finished with value: 0.35069540915786096 and parameters: {'kernel': 'rbf', 'epsilon': 0.18952498810443996}. Best is trial 149 with value: 0.7767469696771062.
Trial 236 finished with value: 0.35155338941668524 and parameters: {'kernel': 'rbf', 'epsilon': 0.44982296584362214}. Best is trial 149 with value: 0.7767469696771062.
Trial 233 finished with value: 0.7761166165937535 and parameters: {'kernel': 'linear', 'epsilon': 0.41142059482793525}. Best is trial 149 with value: 0.7767469696771062.
Trial 237 finished with value: 0.7753814020522949 and parameters: {'kernel': 'linear', 'epsilon': 0.93167598979391}. Best is trial 149 with value: 0.7767469696771062.
Trial 234 finished with value: 0.4247197865937421 and parameters: {'kernel': 'sigmoid', 'epsilon': 0.3455492163547941}. Best is trial 149 with value: 0.7767469696771062.
Trial 239 finished with value: 0.7765880326841003 and parameters: {'kernel': 'linear', 'epsilon': 0.07089361408523576}. Best is trial 149 with value: 0.7767469696771062.
Trial 238 finished with value: 0.7759634427938139 and parameters: {'kernel': 'linear', 'epsilon': 0.5644647922734092}. Best is trial 149 with value: 0.7767469696771062.
Trial 232 finished with value: 0.3301004591768798 and parameters: {'kernel': 'poly', 'epsilon': 0.021528042818713566}. Best is trial 149 with value: 0.7767469696771062.
Trial 245 finished with value: 0.4243609777991522 and parameters: {'kernel': 'sigmoid', 'epsilon': 0.5353712155457551}. Best is trial 149 with value: 0.7767469696771062.
Trial 246 finished with value: 0.3510215186851437 and parameters: {'kernel': 'rbf', 'epsilon': 0.31816898711457375}. Best is trial 149 with value: 0.7767469696771062.
Trial 241 finished with value: 0.3521451065316244 and parameters: {'kernel': 'rbf', 'epsilon': 0.5831449148252462}. Best is trial 149 with value: 0.7767469696771062.
Trial 250 finished with value: 0.7765875816936685 and parameters: {'kernel': 'linear', 'epsilon': 0.07108604653009787}. Best is trial 149 with value: 0.7767469696771062.
Trial 242 finished with value: 0.3297167577389983 and parameters: {'kernel': 'poly', 'epsilon': 0.4899277078498335}. Best is trial 149 with value: 0.7767469696771062.
Trial 249 finished with value: 0.4248610736093032 and parameters: {'kernel': 'sigmoid', 'epsilon': 0.013163306484184623}. Best is trial 149 with value: 0.7767469696771062.
Trial 235 finished with value: 0.32917382499251097 and parameters: {'kernel': 'poly', 'epsilon': 0.8732809944479284}. Best is trial 149 with value: 0.7767469696771062.
Trial 240 finished with value: 0.4244556298263801 and parameters: {'kernel': 'sigmoid', 'epsilon': 0.6035837838254585}. Best is trial 149 with value: 0.7767469696771062.
Trial 251 finished with value: 0.32934347899308125 and parameters: {'kernel': 'poly', 'epsilon': 0.7652020465697341}. Best is trial 149 with value: 0.7767469696771062.
Trial 252 finished with value: 0.42456005854854173 and parameters: {'kernel': 'sigmoid', 'epsilon': 0.8737762020913327}. Best is trial 149 with value: 0.7767469696771062.
Trial 260 finished with value: 0.7765843189615752 and parameters: {'kernel': 'linear', 'epsilon': 0.31285519944623474}. Best is trial 149 with value: 0.7767469696771062.
Trial 247 finished with value: 0.32941914356306307 and parameters: {'kernel': 'poly', 'epsilon': 0.6547613118956627}. Best is trial 149 with value: 0.7767469696771062.
Trial 258 finished with value: 0.3507841170918732 and parameters: {'kernel': 'rbf', 'epsilon': 0.220275429719758}. Best is trial 149 with value: 0.7767469696771062.
Trial 248 finished with value: 0.351867045425343 and parameters: {'kernel': 'rbf', 'epsilon': 0.5162293461794296}. Best is trial 149 with value: 0.7767469696771062.
Trial 256 finished with value: 0.3535762065504807 and parameters: {'kernel': 'rbf', 'epsilon': 0.9752754707144292}. Best is trial 149 with value: 0.7767469696771062.
Trial 257 finished with value: 0.35290291063860046 and parameters: {'kernel': 'rbf', 'epsilon': 0.7590381520954871}. Best is trial 149 with value: 0.7767469696771062.
Trial 243 finished with value: 0.7766014375788386 and parameters: {'kernel': 'linear', 'epsilon': 0.17879768054518508}. Best is trial 149 with value: 0.7767469696771062.
Trial 253 finished with value: 0.3291098925757202 and parameters: {'kernel': 'poly', 'epsilon': 0.9350988041288271}. Best is trial 149 with value: 0.7767469696771062.
Trial 244 finished with value: 0.3291545779184847 and parameters: {'kernel': 'poly', 'epsilon': 0.8904551714324714}. Best is trial 149 with value: 0.7767469696771062.
Trial 255 finished with value: 0.32993195057602714 and parameters: {'kernel': 'poly', 'epsilon': 0.27467790380182655}. Best is trial 149 with value: 0.7767469696771062.
Trial 262 finished with value: 0.3297866504231638 and parameters: {'kernel': 'poly', 'epsilon': 0.42865381949024706}. Best is trial 149 with value: 0.7767469696771062.
Trial 259 finished with value: 0.7758382618054563 and parameters: {'kernel': 'linear', 'epsilon': 0.533637619493156}. Best is trial 149 with value: 0.7767469696771062.
