Trial 107 finished with value: 0.11285719745835174 and parameters: {'kernel': 'rbf', 'epsilon': 0.8784700136265354, 'degree': 2, 'C': 0.34824715656451394}. Best is trial 32 with value: 0.7769122762069597.
Trial 103 finished with value: 0.43630579342889514 and parameters: {'kernel': 'rbf', 'epsilon': 0.38587223069820353, 'degree': 5, 'C': 1.3203693361235112}. Best is trial 32 with value: 0.7769122762069597.
Trial 117 finished with value: -0.059710079224735 and parameters: {'kernel': 'rbf', 'epsilon': 0.2692614020358175, 'degree': 4, 'C': 0.004661753979575268}. Best is trial 32 with value: 0.7769122762069597.
Trial 111 finished with value: -0.0300041465690963 and parameters: {'kernel': 'sigmoid', 'epsilon': 0.721934014061466, 'degree': 3, 'C': 0.04224422619499687}. Best is trial 32 with value: 0.7769122762069597.
Trial 109 finished with value: -0.03440442754271961 and parameters: {'kernel': 'sigmoid', 'epsilon': 0.07395992664082707, 'degree': 5, 'C': 0.033790069593349834}. Best is trial 32 with value: 0.7769122762069597.
Trial 104 finished with value: 0.768123196869356 and parameters: {'kernel': 'rbf', 'epsilon': 0.17148176186672182, 'degree': 4, 'C': 9.56185661390649}. Best is trial 32 with value: 0.7769122762069597.
Trial 105 finished with value: -0.05679275768881762 and parameters: {'kernel': 'sigmoid', 'epsilon': 0.12533399213167717, 'degree': 5, 'C': 0.006530572414787228}. Best is trial 32 with value: 0.7769122762069597.
Trial 108 finished with value: 0.7742887951400569 and parameters: {'kernel': 'linear', 'epsilon': 0.44975199145679645, 'degree': 4, 'C': 0.772824413074642}. Best is trial 32 with value: 0.7769122762069597.
Trial 113 finished with value: 0.3252323211850439 and parameters: {'kernel': 'linear', 'epsilon': 0.9980740129840541, 'degree': 3, 'C': 0.025072091914542946}. Best is trial 32 with value: 0.7769122762069597.
Trial 106 finished with value: 0.03025427426885644 and parameters: {'kernel': 'poly', 'epsilon': 0.20637248191075164, 'degree': 4, 'C': 0.16329773766474862}. Best is trial 32 with value: 0.7769122762069597.
Trial 114 finished with value: -0.062363038867740486 and parameters: {'kernel': 'rbf', 'epsilon': 0.3909392533962932, 'degree': 2, 'C': 0.000916866216714357}. Best is trial 32 with value: 0.7769122762069597.
Trial 119 finished with value: 0.7467074162839034 and parameters: {'kernel': 'rbf', 'epsilon': 0.6987039847969768, 'degree': 6, 'C': 6.330453349177093}. Best is trial 32 with value: 0.7769122762069597.
Trial 126 finished with value: -0.012168725519255519 and parameters: {'kernel': 'sigmoid', 'epsilon': 0.3496816729064748, 'degree': 5, 'C': 0.0637407227999292}. Best is trial 32 with value: 0.7769122762069597.
Trial 118 finished with value: -0.05641367058341971 and parameters: {'kernel': 'sigmoid', 'epsilon': 0.04485755176280881, 'degree': 2, 'C': 0.006840446675361348}. Best is trial 32 with value: 0.7769122762069597.
Trial 116 finished with value: 0.39243340594828935 and parameters: {'kernel': 'poly', 'epsilon': 0.9664231994315102, 'degree': 6, 'C': 1.3586281692033735}. Best is trial 32 with value: 0.7769122762069597.
Trial 120 finished with value: 0.7738235433614894 and parameters: {'kernel': 'linear', 'epsilon': 0.9468157405076952, 'degree': 2, 'C': 6.825790409086408}. Best is trial 32 with value: 0.7769122762069597.
Trial 125 finished with value: 0.7172271925831604 and parameters: {'kernel': 'poly', 'epsilon': 0.8902906789465824, 'degree': 5, 'C': 6.891836020249921}. Best is trial 32 with value: 0.7769122762069597.
Trial 121 finished with value: -0.03772661305809062 and parameters: {'kernel': 'linear', 'epsilon': 0.6350049486713126, 'degree': 3, 'C': 0.0011968609438954701}. Best is trial 32 with value: 0.7769122762069597.
Trial 127 finished with value: 0.30176933021863317 and parameters: {'kernel': 'linear', 'epsilon': 0.7930890577707281, 'degree': 3, 'C': 0.022733744646438517}. Best is trial 32 with value: 0.7769122762069597.
Trial 122 finished with value: -0.0626968760030823 and parameters: {'kernel': 'sigmoid', 'epsilon': 0.9113391993167601, 'degree': 5, 'C': 0.002721675154992002}. Best is trial 32 with value: 0.7769122762069597.
Trial 129 finished with value: -0.00909783134275537 and parameters: {'kernel': 'linear', 'epsilon': 0.284573831265831, 'degree': 2, 'C': 0.002477846593554325}. Best is trial 32 with value: 0.7769122762069597.
Trial 137 finished with value: 0.12482222336297455 and parameters: {'kernel': 'rbf', 'epsilon': 0.9688162864118975, 'degree': 2, 'C': 0.3759364986729471}. Best is trial 32 with value: 0.7769122762069597.
Trial 123 finished with value: 0.7765840053195385 and parameters: {'kernel': 'poly', 'epsilon': 0.7768193698844937, 'degree': 2, 'C': 7.04600108018693}. Best is trial 32 with value: 0.7769122762069597.
Trial 124 finished with value: -0.06152359146980054 and parameters: {'kernel': 'poly', 'epsilon': 0.0767664011516479, 'degree': 5, 'C': 0.0008638176955829951}. Best is trial 32 with value: 0.7769122762069597.
Trial 128 finished with value: 0.30635645146347035 and parameters: {'kernel': 'linear', 'epsilon': 0.4167834672715991, 'degree': 6, 'C': 0.023184565836057283}. Best is trial 32 with value: 0.7769122762069597.
Trial 131 finished with value: 0.35332288868186235 and parameters: {'kernel': 'sigmoid', 'epsilon': 0.7966343992982776, 'degree': 3, 'C': 0.7544614045168423}. Best is trial 32 with value: 0.7769122762069597.
Trial 139 finished with value: -0.06321204069582442 and parameters: {'kernel': 'poly', 'epsilon': 0.4870411409330372, 'degree': 4, 'C': 0.0001493595278961528}. Best is trial 134 with value: 0.778311986716131.
Trial 134 finished with value: 0.778311986716131 and parameters: {'kernel': 'linear', 'epsilon': 0.08454845998305371, 'degree': 6, 'C': 1.212283549211197}. Best is trial 134 with value: 0.778311986716131.
Trial 132 finished with value: 0.5352781725948139 and parameters: {'kernel': 'poly', 'epsilon': 0.7287966029476264, 'degree': 6, 'C': 2.247459189082057}. Best is trial 134 with value: 0.778311986716131.
Trial 138 finished with value: 0.5883067960871562 and parameters: {'kernel': 'linear', 'epsilon': 0.34284175301440145, 'degree': 5, 'C': 0.07184620100534041}. Best is trial 134 with value: 0.778311986716131.
Trial 135 finished with value: -0.06379635423451932 and parameters: {'kernel': 'rbf', 'epsilon': 0.9086513978945574, 'degree': 2, 'C': 0.0019341622663947577}. Best is trial 134 with value: 0.778311986716131.
Trial 130 finished with value: -0.06107237900660706 and parameters: {'kernel': 'rbf', 'epsilon': 0.2844223548867918, 'degree': 4, 'C': 0.002498336159875025}. Best is trial 134 with value: 0.778311986716131.
Trial 142 finished with value: 0.015887750468777072 and parameters: {'kernel': 'sigmoid', 'epsilon': 0.3742926404123098, 'degree': 3, 'C': 0.10015279623846904}. Best is trial 134 with value: 0.778311986716131.
Trial 133 finished with value: 0.09508790393025347 and parameters: {'kernel': 'rbf', 'epsilon': 0.8261946543406334, 'degree': 5, 'C': 0.3076417115226327}. Best is trial 134 with value: 0.778311986716131.
Trial 145 finished with value: -0.06261110402176258 and parameters: {'kernel': 'rbf', 'epsilon': 0.36334004514570817, 'degree': 4, 'C': 0.00037836054321078945}. Best is trial 134 with value: 0.778311986716131.
Trial 136 finished with value: 0.5617249640221693 and parameters: {'kernel': 'poly', 'epsilon': 0.9771068485204618, 'degree': 6, 'C': 2.538946898274883}. Best is trial 134 with value: 0.778311986716131.
Trial 146 finished with value: 0.6778605952155118 and parameters: {'kernel': 'sigmoid', 'epsilon': 0.07836265953950583, 'degree': 3, 'C': 3.741522126542361}. Best is trial 134 with value: 0.778311986716131.
Trial 140 finished with value: 0.019738497992955607 and parameters: {'kernel': 'poly', 'epsilon': 0.46100820035495127, 'degree': 2, 'C': 0.16125329068897215}. Best is trial 134 with value: 0.778311986716131.
Trial 147 finished with value: 0.39243494812695734 and parameters: {'kernel': 'linear', 'epsilon': 0.5610305641368977, 'degree': 6, 'C': 0.03261387639672273}. Best is trial 134 with value: 0.778311986716131.
Trial 143 finished with value: -0.06243740782607221 and parameters: {'kernel': 'poly', 'epsilon': 0.28031908123853055, 'degree': 5, 'C': 0.00017899258527387634}. Best is trial 134 with value: 0.778311986716131.
Trial 144 finished with value: 0.2566674149789763 and parameters: {'kernel': 'linear', 'epsilon': 0.5962724966350209, 'degree': 3, 'C': 0.01907970988542177}. Best is trial 134 with value: 0.778311986716131.
Trial 153 finished with value: -0.06196332711512477 and parameters: {'kernel': 'poly', 'epsilon': 0.2815149206847479, 'degree': 4, 'C': 0.0009337720511816768}. Best is trial 134 with value: 0.778311986716131.
Trial 151 finished with value: -0.06379565872961322 and parameters: {'kernel': 'rbf', 'epsilon': 0.6600730487540063, 'degree': 4, 'C': 0.0002852126655592759}. Best is trial 134 with value: 0.778311986716131.
Trial 150 finished with value: 0.23258774921893122 and parameters: {'kernel': 'linear', 'epsilon': 0.9605266103443824, 'degree': 6, 'C': 0.017052446273199625}. Best is trial 134 with value: 0.778311986716131.
Trial 155 finished with value: 0.13430686945868792 and parameters: {'kernel': 'poly', 'epsilon': 0.7945271725658725, 'degree': 2, 'C': 0.42026174100351704}. Best is trial 134 with value: 0.778311986716131.
Trial 156 finished with value: 0.04982152324664084 and parameters: {'kernel': 'linear', 'epsilon': 0.037404947295206825, 'degree': 4, 'C': 0.005422592736947335}. Best is trial 134 with value: 0.778311986716131.
Trial 160 finished with value: -0.03617657990539993 and parameters: {'kernel': 'poly', 'epsilon': 0.3445447750808093, 'degree': 5, 'C': 0.03875379823693544}. Best is trial 134 with value: 0.778311986716131.
Trial 152 finished with value: 0.7767954877556409 and parameters: {'kernel': 'linear', 'epsilon': 0.6259153282932495, 'degree': 4, 'C': 1.9334720655963653}. Best is trial 134 with value: 0.778311986716131.
Trial 148 finished with value: 0.3275101465709107 and parameters: {'kernel': 'linear', 'epsilon': 0.45330896439719315, 'degree': 2, 'C': 0.025133735853925063}. Best is trial 134 with value: 0.778311986716131.
Trial 141 finished with value: -0.024863432121143492 and parameters: {'kernel': 'sigmoid', 'epsilon': 0.6169318378799349, 'degree': 6, 'C': 0.04849038320292853}. Best is trial 134 with value: 0.778311986716131.
Trial 161 finished with value: -0.061338705280955676 and parameters: {'kernel': 'rbf', 'epsilon': 0.28977431471339987, 'degree': 4, 'C': 0.0020943342474554097}. Best is trial 134 with value: 0.778311986716131.
Trial 157 finished with value: -0.05994785325045623 and parameters: {'kernel': 'poly', 'epsilon': 0.5118031762438312, 'degree': 6, 'C': 0.00422700052869901}. Best is trial 134 with value: 0.778311986716131.
Trial 159 finished with value: 0.5744816336876253 and parameters: {'kernel': 'rbf', 'epsilon': 0.8700013784317293, 'degree': 6, 'C': 2.129214330198053}. Best is trial 134 with value: 0.778311986716131.
Trial 149 finished with value: -0.062468221029268245 and parameters: {'kernel': 'rbf', 'epsilon': 0.567418473380664, 'degree': 6, 'C': 0.0019954755704159567}. Best is trial 134 with value: 0.778311986716131.
Trial 162 finished with value: 0.4377903910857815 and parameters: {'kernel': 'sigmoid', 'epsilon': 0.3419237085727972, 'degree': 6, 'C': 1.0560507983892466}. Best is trial 134 with value: 0.778311986716131.
Trial 163 finished with value: -0.059990439011105054 and parameters: {'kernel': 'rbf', 'epsilon': 0.6590983924556547, 'degree': 3, 'C': 0.006906332310438207}. Best is trial 134 with value: 0.778311986716131.
Trial 158 finished with value: -0.03566539936967926 and parameters: {'kernel': 'linear', 'epsilon': 0.27031131963804766, 'degree': 6, 'C': 0.001217142676929398}. Best is trial 134 with value: 0.778311986716131.
Trial 154 finished with value: -0.04070533678342588 and parameters: {'kernel': 'linear', 'epsilon': 0.31014003580783234, 'degree': 2, 'C': 0.000994582790396373}. Best is trial 134 with value: 0.778311986716131.
Trial 167 finished with value: -0.0640168188253855 and parameters: {'kernel': 'sigmoid', 'epsilon': 0.8009469960113785, 'degree': 6, 'C': 0.0005677026900556814}. Best is trial 134 with value: 0.778311986716131.
Trial 164 finished with value: 0.6548844116060067 and parameters: {'kernel': 'poly', 'epsilon': 0.3115972309041466, 'degree': 6, 'C': 4.183053962355211}. Best is trial 134 with value: 0.778311986716131.
Trial 165 finished with value: -0.04976797964946987 and parameters: {'kernel': 'poly', 'epsilon': 0.08330073641711533, 'degree': 5, 'C': 0.017313368948219745}. Best is trial 134 with value: 0.778311986716131.
Trial 173 finished with value: -0.060622862260844 and parameters: {'kernel': 'rbf', 'epsilon': 0.1172345463775537, 'degree': 6, 'C': 0.0025979398195976958}. Best is trial 134 with value: 0.778311986716131.
Trial 171 finished with value: -0.06369455417897896 and parameters: {'kernel': 'rbf', 'epsilon': 0.6198934239558134, 'degree': 3, 'C': 0.0002148625155494759}. Best is trial 134 with value: 0.778311986716131.
Trial 168 finished with value: -0.008897576657532779 and parameters: {'kernel': 'rbf', 'epsilon': 0.25195855565397274, 'degree': 6, 'C': 0.09298396655171165}. Best is trial 134 with value: 0.778311986716131.
Trial 179 finished with value: -0.0628035829734099 and parameters: {'kernel': 'poly', 'epsilon': 0.7845704498723286, 'degree': 3, 'C': 0.0026039779220941033}. Best is trial 134 with value: 0.778311986716131.
Trial 177 finished with value: -0.056018374759828994 and parameters: {'kernel': 'sigmoid', 'epsilon': 0.905689461661867, 'degree': 5, 'C': 0.010715917930168593}. Best is trial 134 with value: 0.778311986716131.
Trial 180 finished with value: 0.3435836364835597 and parameters: {'kernel': 'sigmoid', 'epsilon': 0.23876905201734366, 'degree': 6, 'C': 0.7215776919600487}. Best is trial 134 with value: 0.778311986716131.
Trial 172 finished with value: 0.7100476900510909 and parameters: {'kernel': 'rbf', 'epsilon': 0.6945764507874072, 'degree': 3, 'C': 4.326023240915644}. Best is trial 134 with value: 0.778311986716131.
Trial 175 finished with value: -0.06328101090193665 and parameters: {'kernel': 'rbf', 'epsilon': 0.5507844323640909, 'degree': 4, 'C': 0.0005012286304012138}. Best is trial 134 with value: 0.778311986716131.
Trial 174 finished with value: 0.7035802546478604 and parameters: {'kernel': 'rbf', 'epsilon': 0.8230269361049118, 'degree': 2, 'C': 4.129234866845297}. Best is trial 134 with value: 0.778311986716131.
Trial 169 finished with value: 0.2507580620078954 and parameters: {'kernel': 'rbf', 'epsilon': 0.17608641918759127, 'degree': 4, 'C': 0.6720422329397947}. Best is trial 134 with value: 0.778311986716131.
Trial 182 finished with value: -0.02284578934106679 and parameters: {'kernel': 'sigmoid', 'epsilon': 0.24874357702576033, 'degree': 5, 'C': 0.04892897956466274}. Best is trial 134 with value: 0.778311986716131.
Trial 166 finished with value: 0.13256074062449835 and parameters: {'kernel': 'sigmoid', 'epsilon': 0.5598057687834189, 'degree': 5, 'C': 0.2704232237160599}. Best is trial 134 with value: 0.778311986716131.
Trial 178 finished with value: 0.05870870293474788 and parameters: {'kernel': 'poly', 'epsilon': 0.5883195463359512, 'degree': 3, 'C': 0.22032112974067702}. Best is trial 134 with value: 0.778311986716131.
Trial 181 finished with value: 0.7601953524144132 and parameters: {'kernel': 'linear', 'epsilon': 0.42250196572375054, 'degree': 2, 'C': 0.4271300904486318}. Best is trial 134 with value: 0.778311986716131.
Trial 176 finished with value: -0.0626545600003077 and parameters: {'kernel': 'rbf', 'epsilon': 0.3605355266063477, 'degree': 6, 'C': 0.0002963438134837392}. Best is trial 134 with value: 0.778311986716131.
Trial 170 finished with value: 0.6873534456225289 and parameters: {'kernel': 'poly', 'epsilon': 0.8606975952406558, 'degree': 3, 'C': 4.181131260635689}. Best is trial 134 with value: 0.778311986716131.
Trial 184 finished with value: 0.12459045846344323 and parameters: {'kernel': 'rbf', 'epsilon': 0.824537151925405, 'degree': 3, 'C': 0.37363843961660137}. Best is trial 134 with value: 0.778311986716131.
Trial 186 finished with value: -0.058648769343510695 and parameters: {'kernel': 'linear', 'epsilon': 0.8507716919073092, 'degree': 2, 'C': 0.00027432411038771546}. Best is trial 134 with value: 0.778311986716131.
Trial 185 finished with value: -0.062391432681529455 and parameters: {'kernel': 'sigmoid', 'epsilon': 0.5285207309782299, 'degree': 3, 'C': 0.0013513677612594858}. Best is trial 134 with value: 0.778311986716131.
Trial 192 finished with value: 0.49954816646849604 and parameters: {'kernel': 'linear', 'epsilon': 0.1113552359813399, 'degree': 5, 'C': 0.05014731572443648}. Best is trial 134 with value: 0.778311986716131.
Trial 196 finished with value: 0.03311723873880621 and parameters: {'kernel': 'linear', 'epsilon': 0.8673444157498531, 'degree': 4, 'C': 0.004612789564937046}. Best is trial 134 with value: 0.778311986716131.
Trial 183 finished with value: -0.0640641725716961 and parameters: {'kernel': 'sigmoid', 'epsilon': 0.8494606171974409, 'degree': 5, 'C': 0.0007616822312177597}. Best is trial 134 with value: 0.778311986716131.
Trial 194 finished with value: 0.1884836241741171 and parameters: {'kernel': 'poly', 'epsilon': 0.29289778221049534, 'degree': 3, 'C': 0.5305292546804905}. Best is trial 134 with value: 0.778311986716131.
Trial 197 finished with value: 0.6959272947696793 and parameters: {'kernel': 'sigmoid', 'epsilon': 0.3517280038853742, 'degree': 4, 'C': 4.673108763356249}. Best is trial 134 with value: 0.778311986716131.
Trial 189 finished with value: -0.06352662891969038 and parameters: {'kernel': 'rbf', 'epsilon': 0.6066299762555399, 'degree': 2, 'C': 0.00042526241362879445}. Best is trial 134 with value: 0.778311986716131.
Trial 204 finished with value: -0.06344674505848331 and parameters: {'kernel': 'poly', 'epsilon': 0.5541907130087418, 'degree': 2, 'C': 0.00025779997573732033}. Best is trial 134 with value: 0.778311986716131.
Trial 191 finished with value: -0.06331606364386955 and parameters: {'kernel': 'poly', 'epsilon': 0.6221413557181177, 'degree': 5, 'C': 0.0007351182620752685}. Best is trial 134 with value: 0.778311986716131.
Trial 200 finished with value: -0.04461736794963335 and parameters: {'kernel': 'poly', 'epsilon': 0.5271203419101462, 'degree': 2, 'C': 0.03547833044578673}. Best is trial 134 with value: 0.778311986716131.
Trial 188 finished with value: -0.06479573786523736 and parameters: {'kernel': 'poly', 'epsilon': 0.9271104894237987, 'degree': 5, 'C': 0.00028668484836417383}. Best is trial 134 with value: 0.778311986716131.
Trial 193 finished with value: -0.06204911605316603 and parameters: {'kernel': 'rbf', 'epsilon': 0.06608091182584164, 'degree': 5, 'C': 0.00015101209865645294}. Best is trial 134 with value: 0.778311986716131.
Trial 199 finished with value: -0.05351246197326963 and parameters: {'kernel': 'rbf', 'epsilon': 0.2984959083181111, 'degree': 3, 'C': 0.015465371160912443}. Best is trial 134 with value: 0.778311986716131.
Trial 187 finished with value: -0.06336909771591892 and parameters: {'kernel': 'rbf', 'epsilon': 0.5179567546206808, 'degree': 4, 'C': 0.00012026731064984457}. Best is trial 134 with value: 0.778311986716131.
Trial 195 finished with value: 0.6660125863731878 and parameters: {'kernel': 'linear', 'epsilon': 0.21000475605470037, 'degree': 3, 'C': 0.10857203541517362}. Best is trial 134 with value: 0.778311986716131.
Trial 190 finished with value: -0.04712083100311769 and parameters: {'kernel': 'poly', 'epsilon': 0.10003364466575992, 'degree': 4, 'C': 0.023822639148785945}. Best is trial 134 with value: 0.778311986716131.
Trial 207 finished with value: -0.06336041227456937 and parameters: {'kernel': 'rbf', 'epsilon': 0.5530891061190439, 'degree': 2, 'C': 0.00037961485729502665}. Best is trial 134 with value: 0.778311986716131.
Trial 201 finished with value: 0.16525134668445376 and parameters: {'kernel': 'linear', 'epsilon': 0.6546936011962636, 'degree': 4, 'C': 0.01206448915232707}. Best is trial 134 with value: 0.778311986716131.
Trial 203 finished with value: -0.061758383200316715 and parameters: {'kernel': 'sigmoid', 'epsilon': 0.19707877875758628, 'degree': 2, 'C': 0.0007224395203421229}. Best is trial 134 with value: 0.778311986716131.
Trial 202 finished with value: 0.27048422994810106 and parameters: {'kernel': 'linear', 'epsilon': 0.38931566234367243, 'degree': 5, 'C': 0.020205380099446602}. Best is trial 134 with value: 0.778311986716131.
Trial 205 finished with value: -0.009717197708561187 and parameters: {'kernel': 'linear', 'epsilon': 0.9214687421929039, 'degree': 5, 'C': 0.0025330064187869404}. Best is trial 134 with value: 0.778311986716131.
Trial 206 finished with value: 0.4178584809775717 and parameters: {'kernel': 'rbf', 'epsilon': 0.7950257009186131, 'degree': 4, 'C': 1.2493191847585803}. Best is trial 134 with value: 0.778311986716131.
Trial 198 finished with value: -0.0485899059189173 and parameters: {'kernel': 'sigmoid', 'epsilon': 0.6681615547220603, 'degree': 5, 'C': 0.01914241397546893}. Best is trial 134 with value: 0.778311986716131.
Trial 213 finished with value: -0.05542194272150195 and parameters: {'kernel': 'linear', 'epsilon': 0.535347418363347, 'degree': 6, 'C': 0.00037039714555386005}. Best is trial 134 with value: 0.778311986716131.
Trial 218 finished with value: 0.18521398269300868 and parameters: {'kernel': 'linear', 'epsilon': 0.9589109599125725, 'degree': 4, 'C': 0.013484471877570771}. Best is trial 134 with value: 0.778311986716131.
Trial 214 finished with value: -0.01935413447355643 and parameters: {'kernel': 'poly', 'epsilon': 0.45668105422738003, 'degree': 3, 'C': 0.0728894777043004}. Best is trial 134 with value: 0.778311986716131.
