Trial 212 finished with value: -0.06299166976403965 and parameters: {'kernel': 'sigmoid', 'epsilon': 0.5312765543176335, 'degree': 2, 'C': 0.0006275685057498601}. Best is trial 134 with value: 0.778311986716131.
Trial 217 finished with value: -0.04008844969669033 and parameters: {'kernel': 'poly', 'epsilon': 0.9906277555795495, 'degree': 2, 'C': 0.04546514419899773}. Best is trial 134 with value: 0.778311986716131.
Trial 208 finished with value: -0.06440979671420105 and parameters: {'kernel': 'poly', 'epsilon': 0.8114836816106314, 'degree': 2, 'C': 0.00021205174122369404}. Best is trial 134 with value: 0.778311986716131.
Trial 220 finished with value: -0.06195893145367639 and parameters: {'kernel': 'sigmoid', 'epsilon': 0.02752486847258695, 'degree': 4, 'C': 0.0001814117777265573}. Best is trial 134 with value: 0.778311986716131.
Trial 219 finished with value: 0.6818597622194342 and parameters: {'kernel': 'poly', 'epsilon': 0.4616733263991224, 'degree': 2, 'C': 3.3753338658323933}. Best is trial 134 with value: 0.778311986716131.
Trial 211 finished with value: -0.0583496506969878 and parameters: {'kernel': 'poly', 'epsilon': 0.2808255463456064, 'degree': 6, 'C': 0.005029381761518229}. Best is trial 134 with value: 0.778311986716131.
Trial 216 finished with value: -0.06170782408254388 and parameters: {'kernel': 'rbf', 'epsilon': 0.5423592095612276, 'degree': 2, 'C': 0.003142483325807177}. Best is trial 134 with value: 0.778311986716131.
Trial 209 finished with value: 0.6805953141218029 and parameters: {'kernel': 'linear', 'epsilon': 0.47186807171086, 'degree': 4, 'C': 0.12820561689832669}. Best is trial 134 with value: 0.778311986716131.
Trial 224 finished with value: 0.7071837866903066 and parameters: {'kernel': 'sigmoid', 'epsilon': 0.9256870278642676, 'degree': 6, 'C': 5.427470691651331}. Best is trial 134 with value: 0.778311986716131.
Trial 215 finished with value: 0.7117122573136317 and parameters: {'kernel': 'linear', 'epsilon': 0.4118192596361969, 'degree': 5, 'C': 0.1721733889392663}. Best is trial 134 with value: 0.778311986716131.
Trial 223 finished with value: -0.06490381364540015 and parameters: {'kernel': 'rbf', 'epsilon': 0.936757990517367, 'degree': 6, 'C': 0.00017146637263407778}. Best is trial 134 with value: 0.778311986716131.
Trial 225 finished with value: -0.04095928231976074 and parameters: {'kernel': 'poly', 'epsilon': 0.39460148775236514, 'degree': 5, 'C': 0.03205035422618383}. Best is trial 134 with value: 0.778311986716131.
Trial 226 finished with value: 0.001422355922436891 and parameters: {'kernel': 'linear', 'epsilon': 0.34251697184025787, 'degree': 3, 'C': 0.0029916265934601827}. Best is trial 134 with value: 0.778311986716131.
Trial 222 finished with value: -0.04303729650815706 and parameters: {'kernel': 'poly', 'epsilon': 0.950363652626318, 'degree': 6, 'C': 0.027277533679127365}. Best is trial 134 with value: 0.778311986716131.
Trial 221 finished with value: 0.7709748440783739 and parameters: {'kernel': 'linear', 'epsilon': 0.030918115909488675, 'degree': 5, 'C': 0.5654434101325501}. Best is trial 134 with value: 0.778311986716131.
Trial 228 finished with value: -0.0637832094764494 and parameters: {'kernel': 'poly', 'epsilon': 0.6802818576040627, 'degree': 4, 'C': 0.0004123008576387485}. Best is trial 134 with value: 0.778311986716131.
Trial 231 finished with value: -0.06449598913734829 and parameters: {'kernel': 'sigmoid', 'epsilon': 0.9590582671029362, 'degree': 3, 'C': 0.0006397506307631012}. Best is trial 134 with value: 0.778311986716131.
Trial 229 finished with value: 0.689751010573444 and parameters: {'kernel': 'sigmoid', 'epsilon': 0.7943870476733704, 'degree': 3, 'C': 4.265216929363248}. Best is trial 134 with value: 0.778311986716131.
Trial 210 finished with value: 0.7597038474184967 and parameters: {'kernel': 'linear', 'epsilon': 0.9446033903089743, 'degree': 5, 'C': 0.36577278288221565}. Best is trial 134 with value: 0.778311986716131.
Trial 227 finished with value: -0.06282496662182305 and parameters: {'kernel': 'rbf', 'epsilon': 0.39660020188167433, 'degree': 6, 'C': 0.00017866647040769306}. Best is trial 134 with value: 0.778311986716131.
Trial 232 finished with value: -0.06322822699904122 and parameters: {'kernel': 'sigmoid', 'epsilon': 0.5384583962467353, 'degree': 2, 'C': 0.00036926207577330986}. Best is trial 134 with value: 0.778311986716131.
Trial 235 finished with value: -0.03522969567863047 and parameters: {'kernel': 'linear', 'epsilon': 0.609111519771031, 'degree': 6, 'C': 0.0013097675839942667}. Best is trial 134 with value: 0.778311986716131.
Trial 237 finished with value: 0.7773839160833834 and parameters: {'kernel': 'linear', 'epsilon': 0.4345650764861836, 'degree': 3, 'C': 1.959915084308053}. Best is trial 134 with value: 0.778311986716131.
Trial 236 finished with value: -0.06041892344749624 and parameters: {'kernel': 'rbf', 'epsilon': 0.8273497400908685, 'degree': 2, 'C': 0.007169265139416811}. Best is trial 134 with value: 0.778311986716131.
Trial 234 finished with value: 0.775786290071906 and parameters: {'kernel': 'linear', 'epsilon': 0.5871496167424243, 'degree': 2, 'C': 1.1077038096861378}. Best is trial 134 with value: 0.778311986716131.
Trial 240 finished with value: 0.7738447911464359 and parameters: {'kernel': 'linear', 'epsilon': 0.21081857009593552, 'degree': 4, 'C': 2.4416054341508184}. Best is trial 134 with value: 0.778311986716131.
Trial 239 finished with value: -0.05756814933760188 and parameters: {'kernel': 'poly', 'epsilon': 0.10248546283234128, 'degree': 2, 'C': 0.008151375866980986}. Best is trial 134 with value: 0.778311986716131.
Trial 233 finished with value: -0.06094580429464774 and parameters: {'kernel': 'rbf', 'epsilon': 0.07146631009399063, 'degree': 4, 'C': 0.001981015132433654}. Best is trial 134 with value: 0.778311986716131.
Trial 241 finished with value: -0.06479382021480466 and parameters: {'kernel': 'poly', 'epsilon': 0.9276161689717408, 'degree': 4, 'C': 0.0003298990257263322}. Best is trial 134 with value: 0.778311986716131.
Trial 238 finished with value: -0.06387656510688788 and parameters: {'kernel': 'rbf', 'epsilon': 0.6547129560810281, 'degree': 4, 'C': 0.00011220226874548251}. Best is trial 134 with value: 0.778311986716131.
Trial 230 finished with value: -0.05492002445101072 and parameters: {'kernel': 'rbf', 'epsilon': 0.8524474914818104, 'degree': 6, 'C': 0.016505255531814665}. Best is trial 134 with value: 0.778311986716131.
Trial 245 finished with value: -0.059697041296545385 and parameters: {'kernel': 'sigmoid', 'epsilon': 0.26447511112853195, 'degree': 3, 'C': 0.0033738734341144856}. Best is trial 134 with value: 0.778311986716131.
Trial 244 finished with value: -0.06374602964894278 and parameters: {'kernel': 'rbf', 'epsilon': 0.6446834727824382, 'degree': 3, 'C': 0.0002767963508365846}. Best is trial 134 with value: 0.778311986716131.
Trial 252 finished with value: 0.6152300483839004 and parameters: {'kernel': 'rbf', 'epsilon': 0.08536857390431596, 'degree': 4, 'C': 2.5473611344772213}. Best is trial 134 with value: 0.778311986716131.
Trial 246 finished with value: -0.06470738423692168 and parameters: {'kernel': 'rbf', 'epsilon': 0.8973101577685023, 'degree': 2, 'C': 0.000319957104169205}. Best is trial 134 with value: 0.778311986716131.
Trial 250 finished with value: 0.2554232892840219 and parameters: {'kernel': 'rbf', 'epsilon': 0.03546770149038703, 'degree': 4, 'C': 0.6846567791215717}. Best is trial 134 with value: 0.778311986716131.
Trial 254 finished with value: -0.059365689734541836 and parameters: {'kernel': 'linear', 'epsilon': 0.05502150196652156, 'degree': 4, 'C': 0.00012136121867833136}. Best is trial 134 with value: 0.778311986716131.
Trial 255 finished with value: 0.04110150005649926 and parameters: {'kernel': 'rbf', 'epsilon': 0.6901406487514479, 'degree': 2, 'C': 0.1923805682481504}. Best is trial 134 with value: 0.778311986716131.
Trial 243 finished with value: -0.06370790272222702 and parameters: {'kernel': 'sigmoid', 'epsilon': 0.7553609469581388, 'degree': 2, 'C': 0.0007585091788227654}. Best is trial 134 with value: 0.778311986716131.
Trial 251 finished with value: -0.05092395249033673 and parameters: {'kernel': 'poly', 'epsilon': 0.27418425071703256, 'degree': 3, 'C': 0.018431611915962584}. Best is trial 134 with value: 0.778311986716131.
Trial 258 finished with value: -0.06233660103953307 and parameters: {'kernel': 'poly', 'epsilon': 0.23312056932798786, 'degree': 5, 'C': 0.0001404220302800333}. Best is trial 134 with value: 0.778311986716131.
Trial 261 finished with value: -0.061428917233124124 and parameters: {'kernel': 'sigmoid', 'epsilon': 0.5024780472473415, 'degree': 3, 'C': 0.0023818201196779167}. Best is trial 134 with value: 0.778311986716131.
Trial 247 finished with value: 0.0416567651325046 and parameters: {'kernel': 'sigmoid', 'epsilon': 0.8780812869803171, 'degree': 5, 'C': 0.13713663654466576}. Best is trial 134 with value: 0.778311986716131.
Trial 249 finished with value: 0.06743188511552953 and parameters: {'kernel': 'poly', 'epsilon': 0.18438905589665955, 'degree': 4, 'C': 0.23630243990293046}. Best is trial 134 with value: 0.778311986716131.
Trial 253 finished with value: 0.12771544804761387 and parameters: {'kernel': 'rbf', 'epsilon': 0.9236480876274594, 'degree': 2, 'C': 0.3818919124063547}. Best is trial 134 with value: 0.778311986716131.
Trial 260 finished with value: 0.23054470541836172 and parameters: {'kernel': 'rbf', 'epsilon': 0.5430646170875871, 'degree': 6, 'C': 0.6228816269411592}. Best is trial 134 with value: 0.778311986716131.
Trial 265 finished with value: -0.05475390090945281 and parameters: {'kernel': 'linear', 'epsilon': 0.2796436016563384, 'degree': 3, 'C': 0.00034890509044945944}. Best is trial 134 with value: 0.778311986716131.
Trial 242 finished with value: -0.06303018893370398 and parameters: {'kernel': 'sigmoid', 'epsilon': 0.955185528635491, 'degree': 2, 'C': 0.002387078831657764}. Best is trial 134 with value: 0.778311986716131.
Trial 263 finished with value: -0.05887169568932312 and parameters: {'kernel': 'linear', 'epsilon': 0.4373162199332612, 'degree': 2, 'C': 0.00019175612535828404}. Best is trial 134 with value: 0.778311986716131.
Trial 257 finished with value: -0.062109073939864645 and parameters: {'kernel': 'sigmoid', 'epsilon': 0.09773120366208188, 'degree': 2, 'C': 0.00010693328167111293}. Best is trial 134 with value: 0.778311986716131.
Trial 248 finished with value: -0.03975461760972297 and parameters: {'kernel': 'poly', 'epsilon': 0.3985595491663262, 'degree': 4, 'C': 0.03868569741251667}. Best is trial 134 with value: 0.778311986716131.
Trial 264 finished with value: 0.08621372624577746 and parameters: {'kernel': 'poly', 'epsilon': 0.32735123244956366, 'degree': 6, 'C': 0.22720014266693886}. Best is trial 134 with value: 0.778311986716131.
Trial 266 finished with value: 0.30265567867799137 and parameters: {'kernel': 'sigmoid', 'epsilon': 0.8855669001440339, 'degree': 5, 'C': 0.6120262641265872}. Best is trial 134 with value: 0.778311986716131.
Trial 256 finished with value: -0.016400350290348687 and parameters: {'kernel': 'linear', 'epsilon': 0.6895930161927464, 'degree': 6, 'C': 0.002190836743681732}. Best is trial 134 with value: 0.778311986716131.
Trial 262 finished with value: -0.06072337837755424 and parameters: {'kernel': 'poly', 'epsilon': 0.124255430447755, 'degree': 5, 'C': 0.0019977529878612912}. Best is trial 134 with value: 0.778311986716131.
Trial 259 finished with value: -0.03282897741898375 and parameters: {'kernel': 'rbf', 'epsilon': 0.37457368292868976, 'degree': 2, 'C': 0.05222010168946215}. Best is trial 134 with value: 0.778311986716131.
Trial 268 finished with value: 0.07986255942591806 and parameters: {'kernel': 'poly', 'epsilon': 0.010924461871687607, 'degree': 3, 'C': 0.26310534816493963}. Best is trial 134 with value: 0.778311986716131.
Trial 267 finished with value: 0.6588578711244955 and parameters: {'kernel': 'poly', 'epsilon': 0.31356834301903425, 'degree': 2, 'C': 2.9645420824195075}. Best is trial 134 with value: 0.778311986716131.
Trial 275 finished with value: -0.019879967305858726 and parameters: {'kernel': 'linear', 'epsilon': 0.8886550753380469, 'degree': 6, 'C': 0.0020483716883290502}. Best is trial 134 with value: 0.778311986716131.
Trial 270 finished with value: 0.5118535660781037 and parameters: {'kernel': 'linear', 'epsilon': 0.608465569325658, 'degree': 2, 'C': 0.05256935644006417}. Best is trial 134 with value: 0.778311986716131.
Trial 276 finished with value: 0.5300107146110322 and parameters: {'kernel': 'rbf', 'epsilon': 0.7344639403944345, 'degree': 3, 'C': 1.8034854227449864}. Best is trial 134 with value: 0.778311986716131.
Trial 271 finished with value: 0.004728217551337921 and parameters: {'kernel': 'poly', 'epsilon': 0.19121345487053, 'degree': 2, 'C': 0.1295019895904228}. Best is trial 134 with value: 0.778311986716131.
Trial 273 finished with value: 0.4750199914967035 and parameters: {'kernel': 'poly', 'epsilon': 0.9321932041826988, 'degree': 5, 'C': 1.8971004981136903}. Best is trial 134 with value: 0.778311986716131.
Trial 274 finished with value: 0.20140186236589264 and parameters: {'kernel': 'linear', 'epsilon': 0.2024162001341958, 'degree': 4, 'C': 0.014674112054265007}. Best is trial 134 with value: 0.778311986716131.
Trial 269 finished with value: 0.1005315434239727 and parameters: {'kernel': 'poly', 'epsilon': 0.3469321247019025, 'degree': 3, 'C': 0.3058656271846255}. Best is trial 134 with value: 0.778311986716131.
Trial 282 finished with value: -0.03552693969888114 and parameters: {'kernel': 'poly', 'epsilon': 0.11368826940126553, 'degree': 5, 'C': 0.038033818708336324}. Best is trial 134 with value: 0.778311986716131.
Trial 278 finished with value: -0.06204238129925801 and parameters: {'kernel': 'sigmoid', 'epsilon': 0.0685734989342146, 'degree': 5, 'C': 0.00012260333463019125}. Best is trial 134 with value: 0.778311986716131.
Trial 285 finished with value: 0.6987679866848137 and parameters: {'kernel': 'poly', 'epsilon': 0.6601312770063783, 'degree': 6, 'C': 5.93339811894767}. Best is trial 134 with value: 0.778311986716131.
Trial 279 finished with value: -0.05647554529784412 and parameters: {'kernel': 'sigmoid', 'epsilon': 0.9444554250346007, 'degree': 2, 'C': 0.010287173130428196}. Best is trial 134 with value: 0.778311986716131.
Trial 272 finished with value: 0.3922074080826107 and parameters: {'kernel': 'linear', 'epsilon': 0.4097273451731178, 'degree': 6, 'C': 0.032612578146339236}. Best is trial 134 with value: 0.778311986716131.
Trial 280 finished with value: -0.06156660511268638 and parameters: {'kernel': 'linear', 'epsilon': 0.7477913648485326, 'degree': 5, 'C': 0.00012426683455121524}. Best is trial 134 with value: 0.778311986716131.
Trial 288 finished with value: -0.06137110758440477 and parameters: {'kernel': 'sigmoid', 'epsilon': 0.9729515197061693, 'degree': 4, 'C': 0.004465655798480683}. Best is trial 134 with value: 0.778311986716131.
Trial 289 finished with value: -0.06313956492606701 and parameters: {'kernel': 'sigmoid', 'epsilon': 0.7482884852535823, 'degree': 3, 'C': 0.0014298622370381353}. Best is trial 134 with value: 0.778311986716131.
Trial 290 finished with value: 0.7618802572996478 and parameters: {'kernel': 'poly', 'epsilon': 0.1553761328831642, 'degree': 3, 'C': 8.887080861207663}. Best is trial 134 with value: 0.778311986716131.
Trial 281 finished with value: -0.06394830605294818 and parameters: {'kernel': 'rbf', 'epsilon': 0.7648071876200142, 'degree': 2, 'C': 0.0006943410818402154}. Best is trial 134 with value: 0.778311986716131.
Trial 287 finished with value: -0.04603920252423434 and parameters: {'kernel': 'poly', 'epsilon': 0.2631717235366836, 'degree': 5, 'C': 0.023306167094912497}. Best is trial 134 with value: 0.778311986716131.
Trial 291 finished with value: 0.7735452996258025 and parameters: {'kernel': 'linear', 'epsilon': 0.9722760380732159, 'degree': 4, 'C': 2.9075335216131943}. Best is trial 134 with value: 0.778311986716131.
Trial 277 finished with value: -0.05763731957761024 and parameters: {'kernel': 'sigmoid', 'epsilon': 0.7070506044492725, 'degree': 2, 'C': 0.008080942747731572}. Best is trial 134 with value: 0.778311986716131.
Trial 283 finished with value: 0.08003260084545519 and parameters: {'kernel': 'rbf', 'epsilon': 0.22153121607923398, 'degree': 4, 'C': 0.27056225586200944}. Best is trial 134 with value: 0.778311986716131.
Trial 284 finished with value: 0.7025813767924468 and parameters: {'kernel': 'poly', 'epsilon': 0.5490926879692477, 'degree': 4, 'C': 4.609859245497866}. Best is trial 134 with value: 0.778311986716131.
Trial 294 finished with value: -0.061987058914870684 and parameters: {'kernel': 'poly', 'epsilon': 0.36564874879667686, 'degree': 4, 'C': 0.0013236558804190148}. Best is trial 134 with value: 0.778311986716131.
Trial 293 finished with value: 0.6866395869341184 and parameters: {'kernel': 'poly', 'epsilon': 0.5495986993642932, 'degree': 3, 'C': 4.120947384024602}. Best is trial 134 with value: 0.778311986716131.
Trial 286 finished with value: 0.2909979756131983 and parameters: {'kernel': 'rbf', 'epsilon': 0.26506907325027707, 'degree': 5, 'C': 0.7858819104868082}. Best is trial 134 with value: 0.778311986716131.
Trial 296 finished with value: -0.010348738391876621 and parameters: {'kernel': 'poly', 'epsilon': 0.20408006666855993, 'degree': 6, 'C': 0.06722052337061575}. Best is trial 134 with value: 0.778311986716131.
Trial 303 finished with value: 0.296107186223664 and parameters: {'kernel': 'poly', 'epsilon': 0.009413379549514378, 'degree': 5, 'C': 0.9541283520389547}. Best is trial 134 with value: 0.778311986716131.
Trial 297 finished with value: -0.05689624178080834 and parameters: {'kernel': 'sigmoid', 'epsilon': 0.6952271159025947, 'degree': 6, 'C': 0.008967344774128362}. Best is trial 134 with value: 0.778311986716131.
Trial 292 finished with value: -0.06405444128890692 and parameters: {'kernel': 'poly', 'epsilon': 0.7257931838200822, 'degree': 2, 'C': 0.00029341130818087084}. Best is trial 134 with value: 0.778311986716131.
Trial 299 finished with value: -0.05069096227705926 and parameters: {'kernel': 'linear', 'epsilon': 0.34142054498965557, 'degree': 3, 'C': 0.0005466012860169362}. Best is trial 134 with value: 0.778311986716131.
Trial 300 finished with value: -0.02450714246062593 and parameters: {'kernel': 'rbf', 'epsilon': 0.16309506610073488, 'degree': 3, 'C': 0.06480201659450267}. Best is trial 134 with value: 0.778311986716131.
Trial 301 finished with value: -0.06065604037724185 and parameters: {'kernel': 'sigmoid', 'epsilon': 0.38447566793793797, 'degree': 4, 'C': 0.002698493576235882}. Best is trial 134 with value: 0.778311986716131.
Trial 295 finished with value: -0.03042323306602739 and parameters: {'kernel': 'rbf', 'epsilon': 0.1027699182096996, 'degree': 5, 'C': 0.05410557203605805}. Best is trial 134 with value: 0.778311986716131.
Trial 305 finished with value: -0.062298257623085676 and parameters: {'kernel': 'poly', 'epsilon': 0.2337463293288301, 'degree': 3, 'C': 0.00021449432216501398}. Best is trial 134 with value: 0.778311986716131.
Trial 306 finished with value: 0.5498453658325557 and parameters: {'kernel': 'linear', 'epsilon': 0.24665346204363048, 'degree': 3, 'C': 0.061000397498563765}. Best is trial 134 with value: 0.778311986716131.
Trial 298 finished with value: -0.04842973592583618 and parameters: {'kernel': 'sigmoid', 'epsilon': 0.7902007375842071, 'degree': 5, 'C': 0.01970012882035776}. Best is trial 134 with value: 0.778311986716131.
Trial 302 finished with value: 0.43389625495868345 and parameters: {'kernel': 'rbf', 'epsilon': 0.8228975316266729, 'degree': 5, 'C': 1.309355846884981}. Best is trial 134 with value: 0.778311986716131.
Trial 313 finished with value: 0.04983022337016302 and parameters: {'kernel': 'poly', 'epsilon': 0.6689953734177345, 'degree': 4, 'C': 0.20447386213232027}. Best is trial 134 with value: 0.778311986716131.
Trial 311 finished with value: 0.042650120718635734 and parameters: {'kernel': 'linear', 'epsilon': 0.9374273144555886, 'degree': 3, 'C': 0.005131933437359006}. Best is trial 134 with value: 0.778311986716131.
Trial 307 finished with value: 0.7738062863378943 and parameters: {'kernel': 'linear', 'epsilon': 0.7283452105130768, 'degree': 5, 'C': 3.0285913765510415}. Best is trial 134 with value: 0.778311986716131.
Trial 310 finished with value: -0.06421268213969898 and parameters: {'kernel': 'poly', 'epsilon': 0.9362048933658011, 'degree': 5, 'C': 0.0011190785732904023}. Best is trial 134 with value: 0.778311986716131.
Trial 304 finished with value: -0.060195096124089964 and parameters: {'kernel': 'sigmoid', 'epsilon': 0.3097228786492078, 'degree': 6, 'C': 0.0030031409119413745}. Best is trial 134 with value: 0.778311986716131.
Trial 308 finished with value: 0.6919515829353401 and parameters: {'kernel': 'sigmoid', 'epsilon': 0.6054961066416876, 'degree': 3, 'C': 4.47346610515217}. Best is trial 134 with value: 0.778311986716131.
Trial 312 finished with value: 0.7499429148279082 and parameters: {'kernel': 'linear', 'epsilon': 0.8056622667071587, 'degree': 2, 'C': 0.281929000033117}. Best is trial 134 with value: 0.778311986716131.
Trial 309 finished with value: -0.058572994824198275 and parameters: {'kernel': 'sigmoid', 'epsilon': 0.13492880142791097, 'degree': 3, 'C': 0.0043756748114886935}. Best is trial 134 with value: 0.778311986716131.
Trial 318 finished with value: 0.7252163400658537 and parameters: {'kernel': 'poly', 'epsilon': 0.03387592223498603, 'degree': 2, 'C': 4.269958903883944}. Best is trial 134 with value: 0.778311986716131.
Trial 316 finished with value: -0.0589395573126544 and parameters: {'kernel': 'poly', 'epsilon': 0.13480996115249144, 'degree': 3, 'C': 0.00507750910815723}. Best is trial 134 with value: 0.778311986716131.
