Trial 208 finished with value: 0.036722383242897304 and parameters: {'kernel': 'linear', 'epsilon': 0.94946248490097, 'degree': 5, 'C': 0.004823908504246659}. Best is trial 210 with value: 0.7782517423338795.
Trial 212 finished with value: -0.019134471332314894 and parameters: {'kernel': 'sigmoid', 'epsilon': 0.9902887718274336, 'degree': 5, 'C': 0.05696832943447332}. Best is trial 210 with value: 0.7782517423338795.
Trial 214 finished with value: -0.06335277859539469 and parameters: {'kernel': 'rbf', 'epsilon': 0.5861872466286895, 'degree': 4, 'C': 0.0006030783545807598}. Best is trial 210 with value: 0.7782517423338795.
Trial 213 finished with value: -0.013697736593259258 and parameters: {'kernel': 'poly', 'epsilon': 0.7893873658253416, 'degree': 5, 'C': 0.0756460487477432}. Best is trial 210 with value: 0.7782517423338795.
Trial 221 finished with value: -0.05908981568952457 and parameters: {'kernel': 'rbf', 'epsilon': 0.683224171412796, 'degree': 2, 'C': 0.00862970533023571}. Best is trial 210 with value: 0.7782517423338795.
Trial 215 finished with value: -0.061632246500527677 and parameters: {'kernel': 'rbf', 'epsilon': 0.05587566559388102, 'degree': 6, 'C': 0.0008098644969908019}. Best is trial 210 with value: 0.7782517423338795.
Trial 224 finished with value: 0.1111216762694374 and parameters: {'kernel': 'sigmoid', 'epsilon': 0.03527147617841486, 'degree': 3, 'C': 0.23501004623608468}. Best is trial 210 with value: 0.7782517423338795.
Trial 216 finished with value: -0.04521673268340276 and parameters: {'kernel': 'poly', 'epsilon': 0.530299727234661, 'degree': 3, 'C': 0.030143869036173252}. Best is trial 210 with value: 0.7782517423338795.
Trial 225 finished with value: -0.06455907152565935 and parameters: {'kernel': 'sigmoid', 'epsilon': 0.9179216093488811, 'degree': 6, 'C': 0.0005038258819850228}. Best is trial 210 with value: 0.7782517423338795.
Trial 220 finished with value: -0.048512310019429614 and parameters: {'kernel': 'poly', 'epsilon': 0.5702751537230081, 'degree': 5, 'C': 0.02190258627629585}. Best is trial 210 with value: 0.7782517423338795.
Trial 217 finished with value: -0.03278854273421876 and parameters: {'kernel': 'rbf', 'epsilon': 0.31896487424024766, 'degree': 3, 'C': 0.05174192645237668}. Best is trial 210 with value: 0.7782517423338795.
Trial 234 finished with value: 0.01482653935083741 and parameters: {'kernel': 'poly', 'epsilon': 0.5472577740422374, 'degree': 2, 'C': 0.15100249014731312}. Best is trial 210 with value: 0.7782517423338795.
Trial 222 finished with value: -0.05822624014574358 and parameters: {'kernel': 'poly', 'epsilon': 0.024480202422529018, 'degree': 5, 'C': 0.0053480811671941745}. Best is trial 210 with value: 0.7782517423338795.
Trial 226 finished with value: -0.027540601042702395 and parameters: {'kernel': 'linear', 'epsilon': 0.5332498138993413, 'degree': 2, 'C': 0.0016579733516405154}. Best is trial 210 with value: 0.7782517423338795.
Trial 218 finished with value: 0.776219022424799 and parameters: {'kernel': 'linear', 'epsilon': 0.9174562975653321, 'degree': 6, 'C': 4.305199305609596}. Best is trial 210 with value: 0.7782517423338795.
Trial 229 finished with value: -0.064351181918945 and parameters: {'kernel': 'sigmoid', 'epsilon': 0.8048920819882915, 'degree': 3, 'C': 0.00017832307804957552}. Best is trial 210 with value: 0.7782517423338795.
Trial 231 finished with value: -0.06408088298928556 and parameters: {'kernel': 'rbf', 'epsilon': 0.7203222802434893, 'degree': 5, 'C': 0.00018442756864766054}. Best is trial 210 with value: 0.7782517423338795.
Trial 227 finished with value: -0.0640247183458991 and parameters: {'kernel': 'rbf', 'epsilon': 0.7667024443668299, 'degree': 6, 'C': 0.0005730918240752136}. Best is trial 210 with value: 0.7782517423338795.
Trial 219 finished with value: -0.0486562922591806 and parameters: {'kernel': 'linear', 'epsilon': 0.6250633707007851, 'degree': 3, 'C': 0.0006974980487489627}. Best is trial 210 with value: 0.7782517423338795.
Trial 230 finished with value: -0.05035833765534838 and parameters: {'kernel': 'sigmoid', 'epsilon': 0.16739913620708147, 'degree': 6, 'C': 0.01434448000243109}. Best is trial 210 with value: 0.7782517423338795.
Trial 223 finished with value: -0.06478109663127082 and parameters: {'kernel': 'rbf', 'epsilon': 0.8893555207246401, 'degree': 2, 'C': 0.00013487456552328813}. Best is trial 210 with value: 0.7782517423338795.
Trial 228 finished with value: 0.09487331058202236 and parameters: {'kernel': 'poly', 'epsilon': 0.2731438688490371, 'degree': 5, 'C': 0.2776724654944109}. Best is trial 210 with value: 0.7782517423338795.
Trial 232 finished with value: -0.06487269796443898 and parameters: {'kernel': 'poly', 'epsilon': 0.9068350349501876, 'degree': 4, 'C': 0.00010466873529828014}. Best is trial 210 with value: 0.7782517423338795.
Trial 236 finished with value: 0.2532604253701588 and parameters: {'kernel': 'poly', 'epsilon': 0.5041606809656626, 'degree': 3, 'C': 0.728204747619432}. Best is trial 210 with value: 0.7782517423338795.
Trial 239 finished with value: 0.1451260991416518 and parameters: {'kernel': 'poly', 'epsilon': 0.4493341536879467, 'degree': 4, 'C': 0.413483557819487}. Best is trial 210 with value: 0.7782517423338795.
Trial 238 finished with value: -0.015661212192567754 and parameters: {'kernel': 'poly', 'epsilon': 0.5696424827469322, 'degree': 6, 'C': 0.06148686527867615}. Best is trial 210 with value: 0.7782517423338795.
Trial 237 finished with value: 0.254014817135869 and parameters: {'kernel': 'poly', 'epsilon': 0.7228749163670668, 'degree': 4, 'C': 0.7374264924389133}. Best is trial 210 with value: 0.7782517423338795.
Trial 240 finished with value: -0.06101619364371399 and parameters: {'kernel': 'sigmoid', 'epsilon': 0.24699734853705835, 'degree': 2, 'C': 0.0017310350060201576}. Best is trial 210 with value: 0.7782517423338795.
Trial 235 finished with value: -0.04694617858174853 and parameters: {'kernel': 'rbf', 'epsilon': 0.0775195937582066, 'degree': 5, 'C': 0.02532772621095973}. Best is trial 210 with value: 0.7782517423338795.
Trial 243 finished with value: -0.051536740262898985 and parameters: {'kernel': 'linear', 'epsilon': 0.686373097068119, 'degree': 3, 'C': 0.0005736804415774106}. Best is trial 210 with value: 0.7782517423338795.
Trial 233 finished with value: 0.6234410772062956 and parameters: {'kernel': 'sigmoid', 'epsilon': 0.4227670584486253, 'degree': 6, 'C': 2.4047702461559357}. Best is trial 210 with value: 0.7782517423338795.
Trial 247 finished with value: -0.06468513543329778 and parameters: {'kernel': 'rbf', 'epsilon': 0.9716505887676901, 'degree': 4, 'C': 0.0006221107409859279}. Best is trial 210 with value: 0.7782517423338795.
Trial 248 finished with value: -0.0625718368139028 and parameters: {'kernel': 'poly', 'epsilon': 0.323019094390245, 'degree': 6, 'C': 0.00020109375083970205}. Best is trial 210 with value: 0.7782517423338795.
Trial 250 finished with value: -0.06422753516784876 and parameters: {'kernel': 'sigmoid', 'epsilon': 0.8303355633903774, 'degree': 3, 'C': 0.00046236979084685043}. Best is trial 210 with value: 0.7782517423338795.
Trial 242 finished with value: -0.06373068234499699 and parameters: {'kernel': 'sigmoid', 'epsilon': 0.7134070061803219, 'degree': 4, 'C': 0.0005303171292641075}. Best is trial 210 with value: 0.7782517423338795.
Trial 249 finished with value: 0.2832094711559584 and parameters: {'kernel': 'poly', 'epsilon': 0.8416574018341317, 'degree': 4, 'C': 0.8328901708348257}. Best is trial 210 with value: 0.7782517423338795.
Trial 254 finished with value: 0.7762392917045569 and parameters: {'kernel': 'linear', 'epsilon': 0.3645106955877384, 'degree': 3, 'C': 1.0600812128769368}. Best is trial 210 with value: 0.7782517423338795.
Trial 245 finished with value: -0.06425307003695123 and parameters: {'kernel': 'poly', 'epsilon': 0.883120921697555, 'degree': 4, 'C': 0.0009514133978043731}. Best is trial 210 with value: 0.7782517423338795.
Trial 244 finished with value: 0.03673202777586811 and parameters: {'kernel': 'linear', 'epsilon': 0.7534843005015228, 'degree': 4, 'C': 0.0047795327107352775}. Best is trial 210 with value: 0.7782517423338795.
Trial 241 finished with value: 0.40720768445858246 and parameters: {'kernel': 'linear', 'epsilon': 0.6926878896810379, 'degree': 5, 'C': 0.0347297343480525}. Best is trial 210 with value: 0.7782517423338795.
Trial 246 finished with value: -0.06402567767778186 and parameters: {'kernel': 'sigmoid', 'epsilon': 0.7581837576794637, 'degree': 4, 'C': 0.0003792957766671328}. Best is trial 210 with value: 0.7782517423338795.
Trial 255 finished with value: -0.055129916533616666 and parameters: {'kernel': 'linear', 'epsilon': 0.34855720884327845, 'degree': 6, 'C': 0.0003464386511061811}. Best is trial 210 with value: 0.7782517423338795.
Trial 252 finished with value: 0.5002572195154088 and parameters: {'kernel': 'rbf', 'epsilon': 0.0019001363597820342, 'degree': 6, 'C': 1.6005542501121326}. Best is trial 210 with value: 0.7782517423338795.
Trial 253 finished with value: -0.05754398640724073 and parameters: {'kernel': 'linear', 'epsilon': 0.24807613279297036, 'degree': 6, 'C': 0.00021686468487856702}. Best is trial 210 with value: 0.7782517423338795.
Trial 251 finished with value: 0.011383865956454941 and parameters: {'kernel': 'sigmoid', 'epsilon': 0.6421406501497535, 'degree': 6, 'C': 0.09502540977440649}. Best is trial 210 with value: 0.7782517423338795.
Trial 256 finished with value: -0.06190553648320478 and parameters: {'kernel': 'sigmoid', 'epsilon': 0.10748896909620875, 'degree': 5, 'C': 0.00035432163731308235}. Best is trial 210 with value: 0.7782517423338795.
Trial 258 finished with value: -0.06499950866893585 and parameters: {'kernel': 'rbf', 'epsilon': 0.9772270401206042, 'degree': 5, 'C': 0.00013130337857027565}. Best is trial 210 with value: 0.7782517423338795.
Trial 272 finished with value: -0.02338369921966469 and parameters: {'kernel': 'sigmoid', 'epsilon': 0.21146706498172096, 'degree': 4, 'C': 0.047974075450436554}. Best is trial 210 with value: 0.7782517423338795.
Trial 260 finished with value: 0.6224597378886995 and parameters: {'kernel': 'rbf', 'epsilon': 0.2952358996719442, 'degree': 6, 'C': 2.641555017164841}. Best is trial 210 with value: 0.7782517423338795.
Trial 270 finished with value: -0.05467527105880081 and parameters: {'kernel': 'linear', 'epsilon': 0.20572275540866336, 'degree': 2, 'C': 0.000338875791938733}. Best is trial 210 with value: 0.7782517423338795.
Trial 259 finished with value: 0.6561175962042709 and parameters: {'kernel': 'linear', 'epsilon': 0.5962856883466393, 'degree': 6, 'C': 0.1003546519321974}. Best is trial 210 with value: 0.7782517423338795.
Trial 261 finished with value: -0.04463127828582406 and parameters: {'kernel': 'sigmoid', 'epsilon': 0.9922337732469637, 'degree': 6, 'C': 0.025277591607196875}. Best is trial 210 with value: 0.7782517423338795.
Trial 257 finished with value: 0.11971718271680157 and parameters: {'kernel': 'rbf', 'epsilon': 0.4613785631486982, 'degree': 6, 'C': 0.3606762155386365}. Best is trial 210 with value: 0.7782517423338795.
Trial 267 finished with value: -0.0631122077611421 and parameters: {'kernel': 'sigmoid', 'epsilon': 0.7061856380553714, 'degree': 6, 'C': 0.001260012545191661}. Best is trial 210 with value: 0.7782517423338795.
Trial 262 finished with value: -0.06148431470983782 and parameters: {'kernel': 'rbf', 'epsilon': 0.21804883157046018, 'degree': 4, 'C': 0.0015155709911355221}. Best is trial 210 with value: 0.7782517423338795.
Trial 265 finished with value: -0.05415825959981346 and parameters: {'kernel': 'rbf', 'epsilon': 0.6369784255072055, 'degree': 6, 'C': 0.01695365352345279}. Best is trial 210 with value: 0.7782517423338795.
Trial 273 finished with value: 0.774846578224927 and parameters: {'kernel': 'linear', 'epsilon': 0.8367529516866443, 'degree': 2, 'C': 4.917589323266082}. Best is trial 210 with value: 0.7782517423338795.
Trial 263 finished with value: -0.06396247002912754 and parameters: {'kernel': 'rbf', 'epsilon': 0.6788216653841599, 'degree': 4, 'C': 0.00011188593668134753}. Best is trial 210 with value: 0.7782517423338795.
Trial 266 finished with value: 0.16908913648426666 and parameters: {'kernel': 'poly', 'epsilon': 0.06743579254476506, 'degree': 6, 'C': 0.44255739651117615}. Best is trial 210 with value: 0.7782517423338795.
Trial 268 finished with value: 0.10504188227051656 and parameters: {'kernel': 'linear', 'epsilon': 0.6077356987834556, 'degree': 3, 'C': 0.008468225761390953}. Best is trial 210 with value: 0.7782517423338795.
Trial 269 finished with value: -0.05743161243172388 and parameters: {'kernel': 'linear', 'epsilon': 0.5739461255181726, 'degree': 4, 'C': 0.00028617515236334}. Best is trial 210 with value: 0.7782517423338795.
Trial 264 finished with value: -0.0632022703181708 and parameters: {'kernel': 'sigmoid', 'epsilon': 0.5884934469442142, 'degree': 2, 'C': 0.0006285748245052154}. Best is trial 210 with value: 0.7782517423338795.
Trial 275 finished with value: 0.776065375202923 and parameters: {'kernel': 'linear', 'epsilon': 0.6984795170010827, 'degree': 5, 'C': 2.0773823258303477}. Best is trial 210 with value: 0.7782517423338795.
Trial 271 finished with value: 0.3246264967130231 and parameters: {'kernel': 'rbf', 'epsilon': 0.990044137898148, 'degree': 4, 'C': 0.9024043023972689}. Best is trial 210 with value: 0.7782517423338795.
Trial 276 finished with value: 0.03457065039052757 and parameters: {'kernel': 'sigmoid', 'epsilon': 0.26094845475875084, 'degree': 2, 'C': 0.12562132856264102}. Best is trial 210 with value: 0.7782517423338795.
Trial 280 finished with value: -0.05647902842083737 and parameters: {'kernel': 'rbf', 'epsilon': 0.7070108828389868, 'degree': 6, 'C': 0.013279399240765488}. Best is trial 210 with value: 0.7782517423338795.
Trial 274 finished with value: -0.05817027413213509 and parameters: {'kernel': 'poly', 'epsilon': 0.407651522661019, 'degree': 4, 'C': 0.007783955350029829}. Best is trial 210 with value: 0.7782517423338795.
Trial 281 finished with value: -0.0637613638510698 and parameters: {'kernel': 'sigmoid', 'epsilon': 0.6511519319096986, 'degree': 6, 'C': 0.00020758395674859849}. Best is trial 210 with value: 0.7782517423338795.
Trial 283 finished with value: -0.04458511157257979 and parameters: {'kernel': 'poly', 'epsilon': 0.7792862736810426, 'degree': 5, 'C': 0.028422780986690203}. Best is trial 210 with value: 0.7782517423338795.
Trial 286 finished with value: 0.08942001305697465 and parameters: {'kernel': 'poly', 'epsilon': 0.20672058890485945, 'degree': 5, 'C': 0.2641237859772847}. Best is trial 210 with value: 0.7782517423338795.
Trial 278 finished with value: -0.02560551090722426 and parameters: {'kernel': 'rbf', 'epsilon': 0.8319766890970216, 'degree': 4, 'C': 0.06625843326287506}. Best is trial 210 with value: 0.7782517423338795.
Trial 279 finished with value: -0.06266134938680526 and parameters: {'kernel': 'poly', 'epsilon': 0.8437241347002038, 'degree': 2, 'C': 0.0037148149292596834}. Best is trial 210 with value: 0.7782517423338795.
Trial 277 finished with value: 0.7742921875244303 and parameters: {'kernel': 'linear', 'epsilon': 0.07323404586660454, 'degree': 6, 'C': 2.9833487300382595}. Best is trial 210 with value: 0.7782517423338795.
Trial 288 finished with value: -0.06480068683676271 and parameters: {'kernel': 'sigmoid', 'epsilon': 0.9018579713385332, 'degree': 5, 'C': 0.0001390088898918318}. Best is trial 210 with value: 0.7782517423338795.
Trial 284 finished with value: -0.06190182680987584 and parameters: {'kernel': 'sigmoid', 'epsilon': 0.4001863898223603, 'degree': 2, 'C': 0.0012689643524694987}. Best is trial 210 with value: 0.7782517423338795.
Trial 290 finished with value: 0.049011447041002486 and parameters: {'kernel': 'rbf', 'epsilon': 0.10390664161898999, 'degree': 3, 'C': 0.203920172582885}. Best is trial 210 with value: 0.7782517423338795.
Trial 289 finished with value: -0.06306530004760082 and parameters: {'kernel': 'sigmoid', 'epsilon': 0.5118029693402358, 'degree': 3, 'C': 0.00042266178921544333}. Best is trial 210 with value: 0.7782517423338795.
Trial 282 finished with value: -0.06163594565038079 and parameters: {'kernel': 'rbf', 'epsilon': 0.025484275861728967, 'degree': 3, 'C': 0.0007854795136089081}. Best is trial 210 with value: 0.7782517423338795.
Trial 291 finished with value: 0.14931778014837865 and parameters: {'kernel': 'poly', 'epsilon': 0.5643649942793056, 'degree': 3, 'C': 0.4232888583094535}. Best is trial 210 with value: 0.7782517423338795.
Trial 285 finished with value: -0.06383346172020699 and parameters: {'kernel': 'sigmoid', 'epsilon': 0.9627934194555343, 'degree': 4, 'C': 0.0014386706865958886}. Best is trial 210 with value: 0.7782517423338795.
Trial 294 finished with value: 0.06797900761869635 and parameters: {'kernel': 'sigmoid', 'epsilon': 0.5402824946265522, 'degree': 3, 'C': 0.17347541933515825}. Best is trial 210 with value: 0.7782517423338795.
Trial 292 finished with value: 0.6437692721341531 and parameters: {'kernel': 'rbf', 'epsilon': 0.4953730660184452, 'degree': 3, 'C': 2.9392791920633274}. Best is trial 210 with value: 0.7782517423338795.
Trial 287 finished with value: -0.056271287431200315 and parameters: {'kernel': 'linear', 'epsilon': 0.9448740255325406, 'degree': 2, 'C': 0.00038868791553123305}. Best is trial 210 with value: 0.7782517423338795.
Trial 297 finished with value: 0.7525441059740678 and parameters: {'kernel': 'poly', 'epsilon': 0.9654232975588863, 'degree': 4, 'C': 7.545386416958448}. Best is trial 210 with value: 0.7782517423338795.
Trial 301 finished with value: -0.0553746490803792 and parameters: {'kernel': 'poly', 'epsilon': 0.5514467315844935, 'degree': 2, 'C': 0.01532542990376648}. Best is trial 210 with value: 0.7782517423338795.
Trial 296 finished with value: 0.07264222413088797 and parameters: {'kernel': 'sigmoid', 'epsilon': 0.1105481770958393, 'degree': 4, 'C': 0.17770603022344222}. Best is trial 210 with value: 0.7782517423338795.
Trial 303 finished with value: 0.2299473604435859 and parameters: {'kernel': 'poly', 'epsilon': 0.08264059533827484, 'degree': 4, 'C': 0.6610754272525861}. Best is trial 210 with value: 0.7782517423338795.
Trial 304 finished with value: 0.514778873350221 and parameters: {'kernel': 'poly', 'epsilon': 0.0760160758997186, 'degree': 2, 'C': 1.695022605507787}. Best is trial 210 with value: 0.7782517423338795.
Trial 295 finished with value: -0.06380079853177054 and parameters: {'kernel': 'sigmoid', 'epsilon': 0.6635274540844858, 'degree': 6, 'C': 0.000213096350491047}. Best is trial 210 with value: 0.7782517423338795.
Trial 298 finished with value: 0.12168130919081524 and parameters: {'kernel': 'linear', 'epsilon': 0.9128171181156359, 'degree': 6, 'C': 0.00947007005309385}. Best is trial 210 with value: 0.7782517423338795.
Trial 299 finished with value: 0.74097799874126 and parameters: {'kernel': 'linear', 'epsilon': 0.6349404286112939, 'degree': 3, 'C': 0.24384275387660018}. Best is trial 210 with value: 0.7782517423338795.
Trial 293 finished with value: 0.13829289429884253 and parameters: {'kernel': 'sigmoid', 'epsilon': 0.6913251405645359, 'degree': 3, 'C': 0.28086915132092866}. Best is trial 210 with value: 0.7782517423338795.
Trial 305 finished with value: -0.05772856408853155 and parameters: {'kernel': 'linear', 'epsilon': 0.8572838334492454, 'degree': 2, 'C': 0.00031674353151530223}. Best is trial 210 with value: 0.7782517423338795.
Trial 300 finished with value: -0.04739971840091726 and parameters: {'kernel': 'sigmoid', 'epsilon': 0.03437559251625999, 'degree': 6, 'C': 0.017761534379420754}. Best is trial 210 with value: 0.7782517423338795.
Trial 309 finished with value: -0.03582212119502903 and parameters: {'kernel': 'poly', 'epsilon': 0.22585078813155868, 'degree': 3, 'C': 0.04293911367557867}. Best is trial 210 with value: 0.7782517423338795.
Trial 302 finished with value: -0.058412977875471325 and parameters: {'kernel': 'sigmoid', 'epsilon': 0.7733329117648052, 'degree': 3, 'C': 0.007358834790601903}. Best is trial 210 with value: 0.7782517423338795.
Trial 306 finished with value: 0.4324126799469881 and parameters: {'kernel': 'sigmoid', 'epsilon': 0.5175110977292803, 'degree': 6, 'C': 1.0301195170573683}. Best is trial 210 with value: 0.7782517423338795.
Trial 310 finished with value: 0.7747346277248152 and parameters: {'kernel': 'linear', 'epsilon': 0.6605946103134257, 'degree': 5, 'C': 5.741932004021478}. Best is trial 210 with value: 0.7782517423338795.
Trial 307 finished with value: -0.0445842640619863 and parameters: {'kernel': 'linear', 'epsilon': 0.8942448986144528, 'degree': 5, 'C': 0.000917014229267604}. Best is trial 210 with value: 0.7782517423338795.
Trial 308 finished with value: 0.08112504540362543 and parameters: {'kernel': 'linear', 'epsilon': 0.17710949975017187, 'degree': 3, 'C': 0.007084505311808431}. Best is trial 210 with value: 0.7782517423338795.
Trial 313 finished with value: -0.0610180613450909 and parameters: {'kernel': 'rbf', 'epsilon': 0.19186960708884093, 'degree': 4, 'C': 0.002182787769391935}. Best is trial 210 with value: 0.7782517423338795.
Trial 311 finished with value: -0.06347969764476728 and parameters: {'kernel': 'rbf', 'epsilon': 0.5779871800519183, 'degree': 4, 'C': 0.0003299610726396758}. Best is trial 210 with value: 0.7782517423338795.
Trial 324 finished with value: 0.7409292549949547 and parameters: {'kernel': 'poly', 'epsilon': 0.9613379897929821, 'degree': 4, 'C': 6.502933450780854}. Best is trial 210 with value: 0.7782517423338795.
Trial 319 finished with value: -0.06079822540099907 and parameters: {'kernel': 'rbf', 'epsilon': 0.375507289567407, 'degree': 2, 'C': 0.003453640899288255}. Best is trial 210 with value: 0.7782517423338795.
Trial 321 finished with value: 0.20039812937879087 and parameters: {'kernel': 'sigmoid', 'epsilon': 0.29804703745200534, 'degree': 3, 'C': 0.3916247156731195}. Best is trial 210 with value: 0.7782517423338795.
