Trial 176 finished with value: 0.6317563967411574 and parameters: {'n_components': 5, 'max_depth': 9}. Best is trial 2 with value: 0.7649568505386313.
Trial 175 finished with value: 0.6652637813175384 and parameters: {'n_components': 10, 'max_depth': 8}. Best is trial 2 with value: 0.7649568505386313.
Trial 187 finished with value: 0.7648173933979423 and parameters: {'n_components': 2, 'max_depth': 4}. Best is trial 2 with value: 0.7649568505386313.
Trial 182 finished with value: 0.6468038693118385 and parameters: {'n_components': 7, 'max_depth': 18}. Best is trial 2 with value: 0.7649568505386313.
Trial 184 finished with value: 0.6913066187288833 and parameters: {'n_components': 10, 'max_depth': 8}. Best is trial 2 with value: 0.7649568505386313.
Trial 179 finished with value: 0.6990806737143305 and parameters: {'n_components': 6, 'max_depth': 6}. Best is trial 2 with value: 0.7649568505386313.
Trial 186 finished with value: 0.6512550267944103 and parameters: {'n_components': 7, 'max_depth': 8}. Best is trial 2 with value: 0.7649568505386313.
Trial 181 finished with value: 0.6585386133842819 and parameters: {'n_components': 2, 'max_depth': 10}. Best is trial 2 with value: 0.7649568505386313.
Trial 185 finished with value: 0.6213861766059996 and parameters: {'n_components': 9, 'max_depth': 20}. Best is trial 2 with value: 0.7649568505386313.
Trial 189 finished with value: 0.7640022858025428 and parameters: {'n_components': 11, 'max_depth': 4}. Best is trial 2 with value: 0.7649568505386313.
Trial 190 finished with value: 0.6848901825870944 and parameters: {'n_components': 11, 'max_depth': 14}. Best is trial 2 with value: 0.7649568505386313.
Trial 177 finished with value: 0.6712894670610653 and parameters: {'n_components': 6, 'max_depth': 10}. Best is trial 2 with value: 0.7649568505386313.
Trial 194 finished with value: 0.6206562312115802 and parameters: {'n_components': 2, 'max_depth': 2}. Best is trial 2 with value: 0.7649568505386313.
Trial 195 finished with value: 0.6363533473363693 and parameters: {'n_components': 5, 'max_depth': 16}. Best is trial 2 with value: 0.7649568505386313.
Trial 198 finished with value: 0.6317188579963773 and parameters: {'n_components': 8, 'max_depth': 15}. Best is trial 2 with value: 0.7649568505386313.
Trial 193 finished with value: 0.6412157531428339 and parameters: {'n_components': 2, 'max_depth': 10}. Best is trial 2 with value: 0.7649568505386313.
Trial 188 finished with value: 0.7109067256617191 and parameters: {'n_components': 8, 'max_depth': 6}. Best is trial 2 with value: 0.7649568505386313.
Trial 199 finished with value: 0.6660830718735335 and parameters: {'n_components': 4, 'max_depth': 7}. Best is trial 2 with value: 0.7649568505386313.
Trial 191 finished with value: 0.6223071966188012 and parameters: {'n_components': 4, 'max_depth': 2}. Best is trial 2 with value: 0.7649568505386313.
Trial 192 finished with value: 0.5532462123730317 and parameters: {'n_components': 1, 'max_depth': 13}. Best is trial 2 with value: 0.7649568505386313.
Trial 183 finished with value: 0.67313550804432 and parameters: {'n_components': 10, 'max_depth': 20}. Best is trial 2 with value: 0.7649568505386313.
Trial 197 finished with value: 0.6784939431254273 and parameters: {'n_components': 11, 'max_depth': 10}. Best is trial 2 with value: 0.7649568505386313.
Trial 196 finished with value: 0.6226342250524939 and parameters: {'n_components': 7, 'max_depth': 14}. Best is trial 2 with value: 0.7649568505386313.
A new study created in RDB with name: RandomForestRegressor_84936
Trial 11 finished with value: 0.8223173507608367 and parameters: {'n_estimators': 76}. Best is trial 11 with value: 0.8223173507608367.
Trial 1 finished with value: 0.8221669962357436 and parameters: {'n_estimators': 84}. Best is trial 11 with value: 0.8223173507608367.
Trial 15 finished with value: 0.8225592957230841 and parameters: {'n_estimators': 122}. Best is trial 15 with value: 0.8225592957230841.
A new study created in RDB with name: RandomForestRegressor_85120
