Trial 527 finished with value: 0.03347086270867665 and parameters: {'kernel': 'rbf', 'epsilon': 0.4874074775632583, 'degree': 6, 'C': 0.17436246139103617}. Best is trial 422 with value: 0.7787752748757922.
Trial 525 finished with value: 0.00819271778997872 and parameters: {'kernel': 'rbf', 'epsilon': 0.9817588996738028, 'degree': 2, 'C': 0.12884441693071005}. Best is trial 422 with value: 0.7787752748757922.
Trial 522 finished with value: 0.7189688209337305 and parameters: {'kernel': 'sigmoid', 'epsilon': 0.7037001809174325, 'degree': 4, 'C': 6.149082535258703}. Best is trial 422 with value: 0.7787752748757922.
Trial 533 finished with value: -0.02412283943085867 and parameters: {'kernel': 'sigmoid', 'epsilon': 0.3550015461777347, 'degree': 5, 'C': 0.04821570338686108}. Best is trial 422 with value: 0.7787752748757922.
Trial 535 finished with value: -0.06360368406676445 and parameters: {'kernel': 'poly', 'epsilon': 0.6427582216631075, 'degree': 6, 'C': 0.0003629929096233174}. Best is trial 422 with value: 0.7787752748757922.
Trial 529 finished with value: 0.7651981525897774 and parameters: {'kernel': 'linear', 'epsilon': 0.4496075293349371, 'degree': 6, 'C': 0.5067925257124556}. Best is trial 422 with value: 0.7787752748757922.
Trial 531 finished with value: 0.45207966454961285 and parameters: {'kernel': 'sigmoid', 'epsilon': 0.40011666497947407, 'degree': 5, 'C': 1.1179548315655081}. Best is trial 422 with value: 0.7787752748757922.
Trial 526 finished with value: 0.346817289536936 and parameters: {'kernel': 'sigmoid', 'epsilon': 0.004653328743965179, 'degree': 5, 'C': 0.7284703264338857}. Best is trial 422 with value: 0.7787752748757922.
Trial 536 finished with value: -0.064938295991967 and parameters: {'kernel': 'rbf', 'epsilon': 0.9601714900672933, 'degree': 6, 'C': 0.00015501681325530696}. Best is trial 422 with value: 0.7787752748757922.
Trial 538 finished with value: 0.6972838083277623 and parameters: {'kernel': 'sigmoid', 'epsilon': 0.8675104564861374, 'degree': 2, 'C': 4.663807167870913}. Best is trial 422 with value: 0.7787752748757922.
Trial 539 finished with value: 0.3966764644597701 and parameters: {'kernel': 'rbf', 'epsilon': 0.557087607705972, 'degree': 6, 'C': 1.1704458546097605}. Best is trial 422 with value: 0.7787752748757922.
Trial 544 finished with value: 0.6591061109684071 and parameters: {'kernel': 'linear', 'epsilon': 0.7754294529128238, 'degree': 4, 'C': 0.1027813378771808}. Best is trial 422 with value: 0.7787752748757922.
Trial 530 finished with value: 0.4622378427249837 and parameters: {'kernel': 'rbf', 'epsilon': 0.5208486529255628, 'degree': 2, 'C': 1.42701216441206}. Best is trial 422 with value: 0.7787752748757922.
Trial 541 finished with value: 0.5541076973786273 and parameters: {'kernel': 'sigmoid', 'epsilon': 0.18140758369060606, 'degree': 5, 'C': 1.6921621444582915}. Best is trial 422 with value: 0.7787752748757922.
Trial 540 finished with value: -2.529489434336396e-05 and parameters: {'kernel': 'poly', 'epsilon': 0.563659700514499, 'degree': 3, 'C': 0.10771992779293502}. Best is trial 422 with value: 0.7787752748757922.
Trial 546 finished with value: -0.051477311212745215 and parameters: {'kernel': 'linear', 'epsilon': 0.3591623518100526, 'degree': 4, 'C': 0.0005150298059379392}. Best is trial 422 with value: 0.7787752748757922.
Trial 532 finished with value: 0.7183288953811406 and parameters: {'kernel': 'rbf', 'epsilon': 0.07361362550088735, 'degree': 4, 'C': 4.6438764261317615}. Best is trial 422 with value: 0.7787752748757922.
Trial 537 finished with value: -0.06046192621453609 and parameters: {'kernel': 'poly', 'epsilon': 0.15806485595228936, 'degree': 6, 'C': 0.002079824639608855}. Best is trial 422 with value: 0.7787752748757922.
Trial 545 finished with value: -0.06251038012512591 and parameters: {'kernel': 'poly', 'epsilon': 0.28651969640062414, 'degree': 2, 'C': 0.00013930737325617754}. Best is trial 422 with value: 0.7787752748757922.
Trial 543 finished with value: -0.06188471170660933 and parameters: {'kernel': 'sigmoid', 'epsilon': 0.34493646686107615, 'degree': 2, 'C': 0.001109258040448936}. Best is trial 422 with value: 0.7787752748757922.
Trial 549 finished with value: 0.06482232383121546 and parameters: {'kernel': 'sigmoid', 'epsilon': 0.8445360723133151, 'degree': 2, 'C': 0.1698677885178809}. Best is trial 422 with value: 0.7787752748757922.
Trial 548 finished with value: 0.004090045798212716 and parameters: {'kernel': 'sigmoid', 'epsilon': 0.47384276182981655, 'degree': 4, 'C': 0.08483922841344535}. Best is trial 422 with value: 0.7787752748757922.
Trial 542 finished with value: 0.16833078873161594 and parameters: {'kernel': 'sigmoid', 'epsilon': 0.5793485941885245, 'degree': 5, 'C': 0.33151357267923437}. Best is trial 422 with value: 0.7787752748757922.
Trial 553 finished with value: -0.015585195085398806 and parameters: {'kernel': 'linear', 'epsilon': 0.4146075720508072, 'degree': 6, 'C': 0.0022008129982005378}. Best is trial 422 with value: 0.7787752748757922.
Trial 551 finished with value: 0.4657417559178376 and parameters: {'kernel': 'sigmoid', 'epsilon': 0.3127827376739656, 'degree': 6, 'C': 1.1816541541790238}. Best is trial 422 with value: 0.7787752748757922.
Trial 552 finished with value: 0.773996936214097 and parameters: {'kernel': 'linear', 'epsilon': 0.104493980442671, 'degree': 4, 'C': 0.6944642145678273}. Best is trial 422 with value: 0.7787752748757922.
Trial 559 finished with value: -0.061987841967038174 and parameters: {'kernel': 'sigmoid', 'epsilon': 0.16908374675437554, 'degree': 3, 'C': 0.0003232603590890479}. Best is trial 422 with value: 0.7787752748757922.
Trial 550 finished with value: 0.727477045279381 and parameters: {'kernel': 'poly', 'epsilon': 0.7242053712331549, 'degree': 2, 'C': 4.284379787643324}. Best is trial 422 with value: 0.7787752748757922.
Trial 561 finished with value: -0.03663779153704093 and parameters: {'kernel': 'rbf', 'epsilon': 0.3792963294283246, 'degree': 5, 'C': 0.045574195041104076}. Best is trial 422 with value: 0.7787752748757922.
Trial 557 finished with value: -0.06391474057106009 and parameters: {'kernel': 'poly', 'epsilon': 0.7521943711947996, 'degree': 5, 'C': 0.0005741863570619247}. Best is trial 422 with value: 0.7787752748757922.
Trial 555 finished with value: -0.06251796346690289 and parameters: {'kernel': 'rbf', 'epsilon': 0.8795848977846765, 'degree': 2, 'C': 0.003939883067737994}. Best is trial 422 with value: 0.7787752748757922.
Trial 556 finished with value: -0.04819187751928892 and parameters: {'kernel': 'linear', 'epsilon': 0.6348660852183033, 'degree': 5, 'C': 0.0007195470655173147}. Best is trial 422 with value: 0.7787752748757922.
Trial 563 finished with value: 0.6229734322693258 and parameters: {'kernel': 'rbf', 'epsilon': 0.3211368446183771, 'degree': 5, 'C': 2.6480487873646106}. Best is trial 422 with value: 0.7787752748757922.
Trial 547 finished with value: -0.05942908777439142 and parameters: {'kernel': 'sigmoid', 'epsilon': 0.7577414733382238, 'degree': 6, 'C': 0.006045633421899019}. Best is trial 422 with value: 0.7787752748757922.
Trial 566 finished with value: 0.768155062258842 and parameters: {'kernel': 'rbf', 'epsilon': 0.21280466239727058, 'degree': 3, 'C': 9.563621748556843}. Best is trial 422 with value: 0.7787752748757922.
Trial 562 finished with value: -0.05440491953902042 and parameters: {'kernel': 'sigmoid', 'epsilon': 0.5828917740514378, 'degree': 4, 'C': 0.01159590695233561}. Best is trial 422 with value: 0.7787752748757922.
Trial 564 finished with value: -0.04963922551180326 and parameters: {'kernel': 'sigmoid', 'epsilon': 0.04846550943312267, 'degree': 2, 'C': 0.015112033502301147}. Best is trial 422 with value: 0.7787752748757922.
Trial 567 finished with value: 0.054753519808763994 and parameters: {'kernel': 'rbf', 'epsilon': 0.4982656780608886, 'degree': 2, 'C': 0.21806957385444378}. Best is trial 422 with value: 0.7787752748757922.
Trial 560 finished with value: -0.056291812263061305 and parameters: {'kernel': 'linear', 'epsilon': 0.09119276188409509, 'degree': 3, 'C': 0.0002602166808818248}. Best is trial 422 with value: 0.7787752748757922.
Trial 558 finished with value: -0.0621693659977308 and parameters: {'kernel': 'rbf', 'epsilon': 0.19918787868167587, 'degree': 2, 'C': 0.00033684832144906864}. Best is trial 422 with value: 0.7787752748757922.
Trial 554 finished with value: 0.05023857069972065 and parameters: {'kernel': 'sigmoid', 'epsilon': 0.683306375575618, 'degree': 6, 'C': 0.14805901868992583}. Best is trial 422 with value: 0.7787752748757922.
Trial 568 finished with value: 0.08268408170562468 and parameters: {'kernel': 'linear', 'epsilon': 0.6352121879192181, 'degree': 5, 'C': 0.007225372448143204}. Best is trial 422 with value: 0.7787752748757922.
Trial 565 finished with value: 0.44442354328685807 and parameters: {'kernel': 'poly', 'epsilon': 0.2696689311531797, 'degree': 6, 'C': 1.6342236491147752}. Best is trial 422 with value: 0.7787752748757922.
Trial 571 finished with value: 0.4606304375692064 and parameters: {'kernel': 'linear', 'epsilon': 0.5940010359453163, 'degree': 4, 'C': 0.04250883680419939}. Best is trial 422 with value: 0.7787752748757922.
Trial 574 finished with value: 0.23214372102076716 and parameters: {'kernel': 'poly', 'epsilon': 0.11587644893358351, 'degree': 4, 'C': 0.6686036474919289}. Best is trial 422 with value: 0.7787752748757922.
Trial 569 finished with value: -0.06081859169412971 and parameters: {'kernel': 'linear', 'epsilon': 0.6416633767460164, 'degree': 2, 'C': 0.00014146755705646128}. Best is trial 422 with value: 0.7787752748757922.
Trial 578 finished with value: 0.7088829753802672 and parameters: {'kernel': 'sigmoid', 'epsilon': 0.6481312232636541, 'degree': 2, 'C': 5.437198424587627}. Best is trial 422 with value: 0.7787752748757922.
Trial 572 finished with value: -0.0647431412116629 and parameters: {'kernel': 'poly', 'epsilon': 0.9020216741266518, 'degree': 6, 'C': 0.0002107314542738614}. Best is trial 422 with value: 0.7787752748757922.
Trial 576 finished with value: -0.018187697263392356 and parameters: {'kernel': 'poly', 'epsilon': 0.042984061119735184, 'degree': 2, 'C': 0.08326231522308845}. Best is trial 422 with value: 0.7787752748757922.
Trial 579 finished with value: -0.05552199082093353 and parameters: {'kernel': 'rbf', 'epsilon': 0.685296502761457, 'degree': 3, 'C': 0.014834160299912252}. Best is trial 422 with value: 0.7787752748757922.
Trial 577 finished with value: -0.06171491966926986 and parameters: {'kernel': 'rbf', 'epsilon': 0.4473000365501242, 'degree': 3, 'C': 0.002430267926202678}. Best is trial 422 with value: 0.7787752748757922.
Trial 570 finished with value: 0.7321640103650123 and parameters: {'kernel': 'linear', 'epsilon': 0.2966310466360468, 'degree': 2, 'C': 0.2175323359141642}. Best is trial 422 with value: 0.7787752748757922.
Trial 584 finished with value: 0.037463684768010444 and parameters: {'kernel': 'sigmoid', 'epsilon': 0.2768647875340179, 'degree': 5, 'C': 0.12946702286402248}. Best is trial 422 with value: 0.7787752748757922.
Trial 582 finished with value: 0.34864183966882717 and parameters: {'kernel': 'poly', 'epsilon': 0.8807678362370603, 'degree': 6, 'C': 1.1416896166096404}. Best is trial 422 with value: 0.7787752748757922.
Trial 573 finished with value: -0.04172714054208708 and parameters: {'kernel': 'rbf', 'epsilon': 0.22935689433852602, 'degree': 5, 'C': 0.03504898987283447}. Best is trial 422 with value: 0.7787752748757922.
Trial 583 finished with value: -0.0569815079128355 and parameters: {'kernel': 'rbf', 'epsilon': 0.5495960803761901, 'degree': 6, 'C': 0.0114144472280541}. Best is trial 422 with value: 0.7787752748757922.
Trial 580 finished with value: -0.06416297104652087 and parameters: {'kernel': 'rbf', 'epsilon': 0.9410652216785971, 'degree': 2, 'C': 0.001389295594816374}. Best is trial 422 with value: 0.7787752748757922.
Trial 581 finished with value: -0.05626738141860706 and parameters: {'kernel': 'rbf', 'epsilon': 0.07117898398836586, 'degree': 5, 'C': 0.009789319748509712}. Best is trial 422 with value: 0.7787752748757922.
Trial 575 finished with value: -0.06508737604344908 and parameters: {'kernel': 'poly', 'epsilon': 0.9992938064004392, 'degree': 5, 'C': 0.00013155159707379155}. Best is trial 422 with value: 0.7787752748757922.
Trial 588 finished with value: -0.04311700317048497 and parameters: {'kernel': 'poly', 'epsilon': 0.9257117490504109, 'degree': 4, 'C': 0.03581089404467627}. Best is trial 422 with value: 0.7787752748757922.
Trial 585 finished with value: 0.43637307974264 and parameters: {'kernel': 'rbf', 'epsilon': 0.5980633226586773, 'degree': 3, 'C': 1.3199913165746364}. Best is trial 422 with value: 0.7787752748757922.
Trial 586 finished with value: -0.058052072155481624 and parameters: {'kernel': 'rbf', 'epsilon': 0.48188037046190324, 'degree': 3, 'C': 0.008995392621450354}. Best is trial 422 with value: 0.7787752748757922.
Trial 587 finished with value: 0.07530459963736749 and parameters: {'kernel': 'sigmoid', 'epsilon': 0.38906628412710853, 'degree': 5, 'C': 0.18365910086732673}. Best is trial 422 with value: 0.7787752748757922.
Trial 590 finished with value: -0.06060800906406657 and parameters: {'kernel': 'poly', 'epsilon': 0.8057183640864585, 'degree': 2, 'C': 0.007235295862636137}. Best is trial 422 with value: 0.7787752748757922.
Trial 593 finished with value: -0.058031990974551174 and parameters: {'kernel': 'poly', 'epsilon': 0.46214126552040247, 'degree': 3, 'C': 0.00830831234239897}. Best is trial 422 with value: 0.7787752748757922.
Trial 604 finished with value: -0.06339937462683329 and parameters: {'kernel': 'poly', 'epsilon': 0.5584512281778808, 'degree': 5, 'C': 0.0002872613577479857}. Best is trial 422 with value: 0.7787752748757922.
Trial 592 finished with value: -0.06080086580608949 and parameters: {'kernel': 'linear', 'epsilon': 0.47403916166547433, 'degree': 5, 'C': 0.00011093655327971464}. Best is trial 422 with value: 0.7787752748757922.
Trial 591 finished with value: -0.05252822067474415 and parameters: {'kernel': 'poly', 'epsilon': 0.9811978270196215, 'degree': 5, 'C': 0.018072578095071967}. Best is trial 422 with value: 0.7787752748757922.
Trial 596 finished with value: -0.0626428305238467 and parameters: {'kernel': 'rbf', 'epsilon': 0.5821375641093376, 'degree': 2, 'C': 0.0018065508407611058}. Best is trial 422 with value: 0.7787752748757922.
Trial 589 finished with value: -0.05765876722836848 and parameters: {'kernel': 'rbf', 'epsilon': 0.8718273912015139, 'degree': 5, 'C': 0.011966732007797408}. Best is trial 422 with value: 0.7787752748757922.
Trial 595 finished with value: -0.0640733857774567 and parameters: {'kernel': 'rbf', 'epsilon': 0.8430626098560455, 'degree': 2, 'C': 0.0010008414588200715}. Best is trial 422 with value: 0.7787752748757922.
Trial 603 finished with value: -0.06106928136866098 and parameters: {'kernel': 'rbf', 'epsilon': 0.39389765398880816, 'degree': 3, 'C': 0.0031273503692758747}. Best is trial 422 with value: 0.7787752748757922.
Trial 600 finished with value: 0.7570945101554046 and parameters: {'kernel': 'linear', 'epsilon': 0.019677297735230748, 'degree': 5, 'C': 0.34046488613354486}. Best is trial 422 with value: 0.7787752748757922.
Trial 597 finished with value: 0.4276815953313843 and parameters: {'kernel': 'poly', 'epsilon': 0.8883680604176701, 'degree': 4, 'C': 1.4419702111805446}. Best is trial 422 with value: 0.7787752748757922.
Trial 608 finished with value: -0.0642527992362364 and parameters: {'kernel': 'sigmoid', 'epsilon': 0.7726685950594326, 'degree': 4, 'C': 0.0001525034046093316}. Best is trial 422 with value: 0.7787752748757922.
Trial 599 finished with value: 0.711320944611129 and parameters: {'kernel': 'sigmoid', 'epsilon': 0.09264562353132144, 'degree': 2, 'C': 5.7476663926409195}. Best is trial 422 with value: 0.7787752748757922.
Trial 605 finished with value: -0.05744193811788241 and parameters: {'kernel': 'rbf', 'epsilon': 0.8753891701244934, 'degree': 4, 'C': 0.012360446168718725}. Best is trial 422 with value: 0.7787752748757922.
Trial 601 finished with value: -0.06356650389850006 and parameters: {'kernel': 'sigmoid', 'epsilon': 0.6089173080977298, 'degree': 2, 'C': 0.00026504474891479116}. Best is trial 422 with value: 0.7787752748757922.
Trial 594 finished with value: -0.05713024403407457 and parameters: {'kernel': 'sigmoid', 'epsilon': 0.03536869085274885, 'degree': 6, 'C': 0.005963788269601603}. Best is trial 422 with value: 0.7787752748757922.
Trial 602 finished with value: -0.06308579708260595 and parameters: {'kernel': 'sigmoid', 'epsilon': 0.5157367455698738, 'degree': 4, 'C': 0.0004214320467076045}. Best is trial 422 with value: 0.7787752748757922.
Trial 607 finished with value: 0.056485910218541525 and parameters: {'kernel': 'linear', 'epsilon': 0.8128341549432174, 'degree': 6, 'C': 0.00583815178304824}. Best is trial 422 with value: 0.7787752748757922.
Trial 610 finished with value: 0.03567635798669054 and parameters: {'kernel': 'rbf', 'epsilon': 0.26816319186226123, 'degree': 4, 'C': 0.17731844531579197}. Best is trial 422 with value: 0.7787752748757922.
Trial 606 finished with value: -0.03989438252616775 and parameters: {'kernel': 'poly', 'epsilon': 0.14753506729844112, 'degree': 6, 'C': 0.02704835530194775}. Best is trial 422 with value: 0.7787752748757922.
Trial 609 finished with value: -0.06468943729874733 and parameters: {'kernel': 'poly', 'epsilon': 0.9112630254081265, 'degree': 2, 'C': 0.0004850627279923957}. Best is trial 422 with value: 0.7787752748757922.
Trial 598 finished with value: -0.06219460566554237 and parameters: {'kernel': 'sigmoid', 'epsilon': 0.42477272536909505, 'degree': 6, 'C': 0.001043469040405736}. Best is trial 422 with value: 0.7787752748757922.
Trial 611 finished with value: 0.7753240326674032 and parameters: {'kernel': 'linear', 'epsilon': 0.2216214813660693, 'degree': 4, 'C': 6.860759018376331}. Best is trial 422 with value: 0.7787752748757922.
Trial 615 finished with value: -0.04574208453930885 and parameters: {'kernel': 'poly', 'epsilon': 0.29701640259459594, 'degree': 4, 'C': 0.027336388853357475}. Best is trial 422 with value: 0.7787752748757922.
Trial 612 finished with value: -0.05016386034767576 and parameters: {'kernel': 'poly', 'epsilon': 0.7031174031849373, 'degree': 6, 'C': 0.01713004424115764}. Best is trial 422 with value: 0.7787752748757922.
Trial 617 finished with value: -0.06340214012679625 and parameters: {'kernel': 'poly', 'epsilon': 0.6905260641194355, 'degree': 6, 'C': 0.0008196147198529825}. Best is trial 422 with value: 0.7787752748757922.
Trial 619 finished with value: -0.05838835768942259 and parameters: {'kernel': 'linear', 'epsilon': 0.299616967230786, 'degree': 6, 'C': 0.0001890717032504695}. Best is trial 422 with value: 0.7787752748757922.
Trial 622 finished with value: 0.7578505917386817 and parameters: {'kernel': 'rbf', 'epsilon': 0.7218706646786537, 'degree': 4, 'C': 7.642533500705194}. Best is trial 422 with value: 0.7787752748757922.
Trial 621 finished with value: -0.06128895406394559 and parameters: {'kernel': 'rbf', 'epsilon': 0.29077517534243735, 'degree': 4, 'C': 0.0021843811902207046}. Best is trial 422 with value: 0.7787752748757922.
Trial 618 finished with value: -0.027060570345389667 and parameters: {'kernel': 'rbf', 'epsilon': 0.2685133106858053, 'degree': 6, 'C': 0.06115558963053554}. Best is trial 422 with value: 0.7787752748757922.
Trial 613 finished with value: 0.6318353608029412 and parameters: {'kernel': 'poly', 'epsilon': 0.1954271270081338, 'degree': 6, 'C': 3.5960068582945137}. Best is trial 422 with value: 0.7787752748757922.
Trial 616 finished with value: -0.020829267902334414 and parameters: {'kernel': 'poly', 'epsilon': 0.06953776339627904, 'degree': 6, 'C': 0.05217031805757074}. Best is trial 422 with value: 0.7787752748757922.
Trial 614 finished with value: 0.0866216447276712 and parameters: {'kernel': 'linear', 'epsilon': 0.20276701778443584, 'degree': 2, 'C': 0.007390466761141373}. Best is trial 422 with value: 0.7787752748757922.
Trial 627 finished with value: 0.180264814943016 and parameters: {'kernel': 'sigmoid', 'epsilon': 0.9150351004591291, 'degree': 2, 'C': 0.3545615695001717}. Best is trial 422 with value: 0.7787752748757922.
Trial 633 finished with value: 0.14544789520138907 and parameters: {'kernel': 'rbf', 'epsilon': 0.0009656358498999484, 'degree': 3, 'C': 0.41468119903106826}. Best is trial 422 with value: 0.7787752748757922.
Trial 629 finished with value: -0.05827373417774508 and parameters: {'kernel': 'sigmoid', 'epsilon': 0.22276084794279027, 'degree': 6, 'C': 0.0049247863336859465}. Best is trial 422 with value: 0.7787752748757922.
Trial 620 finished with value: -0.057735193681641726 and parameters: {'kernel': 'sigmoid', 'epsilon': 0.12014970925123458, 'degree': 2, 'C': 0.005376416913491396}. Best is trial 422 with value: 0.7787752748757922.
Trial 623 finished with value: -0.05589333338111019 and parameters: {'kernel': 'linear', 'epsilon': 0.12303116802682035, 'degree': 4, 'C': 0.00028022449085758806}. Best is trial 422 with value: 0.7787752748757922.
Trial 625 finished with value: 0.06601714554760327 and parameters: {'kernel': 'rbf', 'epsilon': 0.4041878464027089, 'degree': 2, 'C': 0.24217275952992257}. Best is trial 422 with value: 0.7787752748757922.
Trial 634 finished with value: -0.06355310777135452 and parameters: {'kernel': 'sigmoid', 'epsilon': 0.8200812856066692, 'degree': 5, 'C': 0.0012358537766739063}. Best is trial 422 with value: 0.7787752748757922.
Trial 630 finished with value: 0.7757282180765718 and parameters: {'kernel': 'linear', 'epsilon': 0.6486850074805893, 'degree': 2, 'C': 2.097735515142262}. Best is trial 422 with value: 0.7787752748757922.
Trial 631 finished with value: 0.7439523902209645 and parameters: {'kernel': 'linear', 'epsilon': 0.33424596802765605, 'degree': 2, 'C': 0.2551599061823263}. Best is trial 422 with value: 0.7787752748757922.
