A new study created in RDB with name: SVR_65137
Trial 6 finished with value: -0.043898416741434555 and parameters: {'kernel': 'rbf', 'epsilon': 0.7241620203011013, 'degree': 4, 'C': 0.034827035394214875}. Best is trial 6 with value: -0.043898416741434555.
Trial 12 finished with value: -0.06243834670038349 and parameters: {'kernel': 'rbf', 'epsilon': 0.3787646310683157, 'degree': 2, 'C': 0.0007013550960729284}. Best is trial 3 with value: 0.7752417975614934.
Trial 0 finished with value: 0.056751207486804345 and parameters: {'kernel': 'poly', 'epsilon': 0.011697192894360886, 'degree': 2, 'C': 0.23297733446406974}. Best is trial 3 with value: 0.7752417975614934.
Trial 3 finished with value: 0.7752417975614934 and parameters: {'kernel': 'linear', 'epsilon': 0.06380577928177944, 'degree': 5, 'C': 0.8866749871462848}. Best is trial 3 with value: 0.7752417975614934.
Trial 8 finished with value: 0.1878619701646401 and parameters: {'kernel': 'rbf', 'epsilon': 0.5330884924966359, 'degree': 6, 'C': 0.5182059408596873}. Best is trial 3 with value: 0.7752417975614934.
Trial 1 finished with value: -0.06150975655746007 and parameters: {'kernel': 'poly', 'epsilon': 0.5030313060738297, 'degree': 6, 'C': 0.0022604815270971055}. Best is trial 3 with value: 0.7752417975614934.
Trial 17 finished with value: -0.059722624720121 and parameters: {'kernel': 'sigmoid', 'epsilon': 0.5127237734801793, 'degree': 3, 'C': 0.0045600950041844515}. Best is trial 3 with value: 0.7752417975614934.
Trial 14 finished with value: -0.06452898710942377 and parameters: {'kernel': 'poly', 'epsilon': 0.8323920952283408, 'degree': 6, 'C': 0.00010302188878238925}. Best is trial 3 with value: 0.7752417975614934.
Trial 13 finished with value: -0.0009038570215002984 and parameters: {'kernel': 'poly', 'epsilon': 0.7807558066831983, 'degree': 5, 'C': 0.09534629132351187}. Best is trial 3 with value: 0.7752417975614934.
Trial 18 finished with value: 0.0710552911016284 and parameters: {'kernel': 'sigmoid', 'epsilon': 0.6828197938546846, 'degree': 4, 'C': 0.17856670252061901}. Best is trial 3 with value: 0.7752417975614934.
Trial 9 finished with value: 0.664012713424156 and parameters: {'kernel': 'linear', 'epsilon': 0.7405655591202628, 'degree': 3, 'C': 0.10712933859244615}. Best is trial 3 with value: 0.7752417975614934.
Trial 11 finished with value: 0.6613197735523745 and parameters: {'kernel': 'linear', 'epsilon': 0.3549445696108, 'degree': 5, 'C': 0.1042011151013889}. Best is trial 3 with value: 0.7752417975614934.
Trial 4 finished with value: 0.2994628204791234 and parameters: {'kernel': 'linear', 'epsilon': 0.21039305949781562, 'degree': 6, 'C': 0.022595477083158164}. Best is trial 3 with value: 0.7752417975614934.
Trial 20 finished with value: 0.774703581715783 and parameters: {'kernel': 'linear', 'epsilon': 0.8788705362526087, 'degree': 3, 'C': 1.8097543774215126}. Best is trial 3 with value: 0.7752417975614934.
Trial 21 finished with value: -0.06265913958527354 and parameters: {'kernel': 'poly', 'epsilon': 0.604018127607375, 'degree': 5, 'C': 0.0015906620843937978}. Best is trial 3 with value: 0.7752417975614934.
Trial 22 finished with value: -0.05915948552051027 and parameters: {'kernel': 'rbf', 'epsilon': 0.25021916183591264, 'degree': 2, 'C': 0.005480255934865338}. Best is trial 3 with value: 0.7752417975614934.
Trial 23 finished with value: 0.7571570707092665 and parameters: {'kernel': 'linear', 'epsilon': 0.3395735716159891, 'degree': 6, 'C': 0.32733274719469574}. Best is trial 3 with value: 0.7752417975614934.
Trial 7 finished with value: -0.057364942813430034 and parameters: {'kernel': 'linear', 'epsilon': 0.5459740440626627, 'degree': 4, 'C': 0.00028291171214607855}. Best is trial 3 with value: 0.7752417975614934.
Trial 5 finished with value: -0.03793878380482514 and parameters: {'kernel': 'poly', 'epsilon': 0.08520643690375418, 'degree': 5, 'C': 0.0344482643226808}. Best is trial 3 with value: 0.7752417975614934.
Trial 2 finished with value: 0.7032482619572764 and parameters: {'kernel': 'rbf', 'epsilon': 0.8600011314528713, 'degree': 2, 'C': 4.119785743850245}. Best is trial 3 with value: 0.7752417975614934.
Trial 19 finished with value: 0.7730981264911042 and parameters: {'kernel': 'linear', 'epsilon': 0.6437736256025385, 'degree': 4, 'C': 0.6209955823147026}. Best is trial 3 with value: 0.7752417975614934.
Trial 10 finished with value: -0.06225276288080295 and parameters: {'kernel': 'sigmoid', 'epsilon': 0.4624606286594798, 'degree': 6, 'C': 0.0011636621322898414}. Best is trial 3 with value: 0.7752417975614934.
Trial 16 finished with value: 0.12640473760215043 and parameters: {'kernel': 'poly', 'epsilon': 0.7032547532178315, 'degree': 5, 'C': 0.35707541539726495}. Best is trial 3 with value: 0.7752417975614934.
Trial 15 finished with value: -0.055477817441106844 and parameters: {'kernel': 'poly', 'epsilon': 0.994675314822035, 'degree': 4, 'C': 0.016008573013566032}. Best is trial 3 with value: 0.7752417975614934.
Trial 27 finished with value: -0.032082366446274733 and parameters: {'kernel': 'rbf', 'epsilon': 0.3971725603486923, 'degree': 4, 'C': 0.05364592928636766}. Best is trial 3 with value: 0.7752417975614934.
Trial 28 finished with value: -0.05961037064021827 and parameters: {'kernel': 'rbf', 'epsilon': 0.5160272044143078, 'degree': 5, 'C': 0.006589602803520489}. Best is trial 3 with value: 0.7752417975614934.
Trial 35 finished with value: -0.05673817365681093 and parameters: {'kernel': 'linear', 'epsilon': 0.3084651458187855, 'degree': 5, 'C': 0.00026503482707834227}. Best is trial 3 with value: 0.7752417975614934.
Trial 29 finished with value: 0.0484264733103338 and parameters: {'kernel': 'linear', 'epsilon': 0.500638539450852, 'degree': 5, 'C': 0.005372474329447196}. Best is trial 3 with value: 0.7752417975614934.
Trial 36 finished with value: -0.0436329593812703 and parameters: {'kernel': 'poly', 'epsilon': 0.3444052768143139, 'degree': 5, 'C': 0.027640634225821116}. Best is trial 3 with value: 0.7752417975614934.
Trial 26 finished with value: -0.04733711825030409 and parameters: {'kernel': 'sigmoid', 'epsilon': 0.3769965904030588, 'degree': 3, 'C': 0.01911620172073585}. Best is trial 3 with value: 0.7752417975614934.
Trial 30 finished with value: 0.21845859544552973 and parameters: {'kernel': 'poly', 'epsilon': 0.4827960647249431, 'degree': 3, 'C': 0.6154962308391331}. Best is trial 3 with value: 0.7752417975614934.
Trial 32 finished with value: 0.7252066008635583 and parameters: {'kernel': 'linear', 'epsilon': 0.8184744778389378, 'degree': 4, 'C': 0.1972837346471484}. Best is trial 3 with value: 0.7752417975614934.
Trial 25 finished with value: -0.03551016815685491 and parameters: {'kernel': 'linear', 'epsilon': 0.8655096170400752, 'degree': 3, 'C': 0.0013255784855059074}. Best is trial 3 with value: 0.7752417975614934.
Trial 24 finished with value: -0.06236573749238842 and parameters: {'kernel': 'poly', 'epsilon': 0.40293133740821097, 'degree': 3, 'C': 0.0009405088126168374}. Best is trial 3 with value: 0.7752417975614934.
Trial 38 finished with value: -0.05847543741974176 and parameters: {'kernel': 'poly', 'epsilon': 0.2178449679854333, 'degree': 6, 'C': 0.004670345474553634}. Best is trial 3 with value: 0.7752417975614934.
Trial 31 finished with value: 0.7733793463378039 and parameters: {'kernel': 'linear', 'epsilon': 0.5567979037468597, 'degree': 2, 'C': 3.2149373004874415}. Best is trial 3 with value: 0.7752417975614934.
Trial 40 finished with value: -0.0353654864547712 and parameters: {'kernel': 'linear', 'epsilon': 0.2945307335265116, 'degree': 3, 'C': 0.0012380562691595507}. Best is trial 3 with value: 0.7752417975614934.
Trial 41 finished with value: 0.7747466480534249 and parameters: {'kernel': 'linear', 'epsilon': 0.5100045961465057, 'degree': 3, 'C': 6.498466651071293}. Best is trial 3 with value: 0.7752417975614934.
Trial 43 finished with value: 0.7294441162843446 and parameters: {'kernel': 'poly', 'epsilon': 0.6842815853720206, 'degree': 6, 'C': 8.672612835258741}. Best is trial 3 with value: 0.7752417975614934.
Trial 37 finished with value: 0.014322418069590514 and parameters: {'kernel': 'poly', 'epsilon': 0.09916584360695613, 'degree': 5, 'C': 0.11822017342742763}. Best is trial 3 with value: 0.7752417975614934.
Trial 39 finished with value: -0.062322965808259426 and parameters: {'kernel': 'poly', 'epsilon': 0.22709958546645115, 'degree': 2, 'C': 0.00018924756690864015}. Best is trial 3 with value: 0.7752417975614934.
Trial 44 finished with value: -0.046470457320693694 and parameters: {'kernel': 'poly', 'epsilon': 0.3045482642266235, 'degree': 5, 'C': 0.023067169048510455}. Best is trial 3 with value: 0.7752417975614934.
Trial 42 finished with value: 0.00801594592234336 and parameters: {'kernel': 'linear', 'epsilon': 0.479600368449575, 'degree': 5, 'C': 0.0033287693376091603}. Best is trial 3 with value: 0.7752417975614934.
Trial 46 finished with value: 0.7694922256308334 and parameters: {'kernel': 'linear', 'epsilon': 0.5204345560935908, 'degree': 6, 'C': 0.5686339901063945}. Best is trial 3 with value: 0.7752417975614934.
Trial 45 finished with value: -0.05833002912323203 and parameters: {'kernel': 'linear', 'epsilon': 0.10244212207729086, 'degree': 4, 'C': 0.00016948982441349373}. Best is trial 3 with value: 0.7752417975614934.
Trial 34 finished with value: -0.05991464113010035 and parameters: {'kernel': 'sigmoid', 'epsilon': 0.06903793901485211, 'degree': 2, 'C': 0.0026650545226940365}. Best is trial 3 with value: 0.7752417975614934.
Trial 33 finished with value: -0.0622342177608035 and parameters: {'kernel': 'poly', 'epsilon': 0.349933401098353, 'degree': 2, 'C': 0.0010113170788105172}. Best is trial 3 with value: 0.7752417975614934.
Trial 47 finished with value: -0.05651538162845025 and parameters: {'kernel': 'linear', 'epsilon': 0.7915644442328629, 'degree': 4, 'C': 0.0003602024013148565}. Best is trial 3 with value: 0.7752417975614934.
Trial 51 finished with value: -0.0615814310718957 and parameters: {'kernel': 'sigmoid', 'epsilon': 0.4972131241510326, 'degree': 2, 'C': 0.0021660528796192766}. Best is trial 3 with value: 0.7752417975614934.
Trial 48 finished with value: -0.06431572675204192 and parameters: {'kernel': 'sigmoid', 'epsilon': 0.7810316699861298, 'degree': 6, 'C': 0.00010547734924969632}. Best is trial 3 with value: 0.7752417975614934.
Trial 56 finished with value: 0.08678566200035698 and parameters: {'kernel': 'sigmoid', 'epsilon': 0.6450291381243449, 'degree': 4, 'C': 0.20150867394884844}. Best is trial 3 with value: 0.7752417975614934.
Trial 49 finished with value: 0.27365207830700206 and parameters: {'kernel': 'linear', 'epsilon': 0.8586655755424079, 'degree': 5, 'C': 0.020348662336378425}. Best is trial 3 with value: 0.7752417975614934.
Trial 53 finished with value: -0.029227998796441668 and parameters: {'kernel': 'linear', 'epsilon': 0.24866034456541364, 'degree': 4, 'C': 0.0015096351506780376}. Best is trial 3 with value: 0.7752417975614934.
Trial 60 finished with value: -0.061871419417045014 and parameters: {'kernel': 'poly', 'epsilon': 0.5579386537080253, 'degree': 2, 'C': 0.0032061696784085156}. Best is trial 3 with value: 0.7752417975614934.
Trial 52 finished with value: -0.05923535003569606 and parameters: {'kernel': 'linear', 'epsilon': 0.6107819542397503, 'degree': 4, 'C': 0.00020950208817329652}. Best is trial 3 with value: 0.7752417975614934.
Trial 50 finished with value: 0.3477903238257383 and parameters: {'kernel': 'linear', 'epsilon': 0.7675920068534243, 'degree': 5, 'C': 0.02728081027838345}. Best is trial 3 with value: 0.7752417975614934.
Trial 58 finished with value: 0.7199930180880802 and parameters: {'kernel': 'sigmoid', 'epsilon': 0.25673735581456336, 'degree': 3, 'C': 6.2512936792614555}. Best is trial 3 with value: 0.7752417975614934.
Trial 62 finished with value: -0.06230342826292099 and parameters: {'kernel': 'poly', 'epsilon': 0.4675794429531066, 'degree': 2, 'C': 0.0016859218982855442}. Best is trial 3 with value: 0.7752417975614934.
Trial 54 finished with value: -0.06104126720198423 and parameters: {'kernel': 'poly', 'epsilon': 0.3019700387279436, 'degree': 4, 'C': 0.0025053946986904204}. Best is trial 3 with value: 0.7752417975614934.
Trial 55 finished with value: 0.29896554494520544 and parameters: {'kernel': 'rbf', 'epsilon': 0.8612669019672049, 'degree': 6, 'C': 0.8145251653965851}. Best is trial 3 with value: 0.7752417975614934.
Trial 59 finished with value: 0.6991159098839081 and parameters: {'kernel': 'sigmoid', 'epsilon': 0.6894024488192316, 'degree': 6, 'C': 4.787362681346119}. Best is trial 3 with value: 0.7752417975614934.
Trial 65 finished with value: -0.06085160660919028 and parameters: {'kernel': 'linear', 'epsilon': 0.6313572834633047, 'degree': 3, 'C': 0.00013826834352558565}. Best is trial 3 with value: 0.7752417975614934.
Trial 61 finished with value: -0.0648330654655574 and parameters: {'kernel': 'rbf', 'epsilon': 0.995314429442078, 'degree': 4, 'C': 0.0005567322010985881}. Best is trial 3 with value: 0.7752417975614934.
Trial 57 finished with value: -0.04760168568943161 and parameters: {'kernel': 'linear', 'epsilon': 0.4226920266184284, 'degree': 5, 'C': 0.0007014707391438868}. Best is trial 3 with value: 0.7752417975614934.
Trial 70 finished with value: 0.3500477662182798 and parameters: {'kernel': 'linear', 'epsilon': 0.33203439311719873, 'degree': 6, 'C': 0.027405825891049396}. Best is trial 3 with value: 0.7752417975614934.
Trial 63 finished with value: 0.408880933587902 and parameters: {'kernel': 'sigmoid', 'epsilon': 0.9112914972782679, 'degree': 6, 'C': 0.9445286686944914}. Best is trial 3 with value: 0.7752417975614934.
Trial 64 finished with value: -0.06209159309449637 and parameters: {'kernel': 'poly', 'epsilon': 0.07893127095129704, 'degree': 4, 'C': 0.00010941324809906212}. Best is trial 3 with value: 0.7752417975614934.
Trial 71 finished with value: -0.06500022672624657 and parameters: {'kernel': 'sigmoid', 'epsilon': 0.9998366687540656, 'degree': 4, 'C': 0.00021861068552047664}. Best is trial 3 with value: 0.7752417975614934.
Trial 66 finished with value: -0.05092978353441123 and parameters: {'kernel': 'poly', 'epsilon': 0.1741478893541336, 'degree': 3, 'C': 0.01764924405654027}. Best is trial 3 with value: 0.7752417975614934.
Trial 67 finished with value: -0.055995180181540316 and parameters: {'kernel': 'linear', 'epsilon': 0.3931759660442832, 'degree': 4, 'C': 0.0003131638429436942}. Best is trial 3 with value: 0.7752417975614934.
Trial 68 finished with value: 0.6048745408873077 and parameters: {'kernel': 'sigmoid', 'epsilon': 0.6549487898096968, 'degree': 3, 'C': 2.1790433828642226}. Best is trial 3 with value: 0.7752417975614934.
Trial 73 finished with value: -0.05899494541866875 and parameters: {'kernel': 'sigmoid', 'epsilon': 0.9051424852756031, 'degree': 2, 'C': 0.007130811119387525}. Best is trial 3 with value: 0.7752417975614934.
Trial 69 finished with value: -0.05780700452746559 and parameters: {'kernel': 'sigmoid', 'epsilon': 0.43021409628522556, 'degree': 5, 'C': 0.006460072175301311}. Best is trial 3 with value: 0.7752417975614934.
Trial 72 finished with value: 0.0007948658148190457 and parameters: {'kernel': 'linear', 'epsilon': 0.014581156046929444, 'degree': 4, 'C': 0.0029692585401415133}. Best is trial 3 with value: 0.7752417975614934.
Trial 74 finished with value: 0.027438922962497437 and parameters: {'kernel': 'linear', 'epsilon': 0.9281975472471763, 'degree': 4, 'C': 0.004331402914817171}. Best is trial 3 with value: 0.7752417975614934.
Trial 76 finished with value: -0.049949148420044345 and parameters: {'kernel': 'sigmoid', 'epsilon': 0.6851951024690446, 'degree': 6, 'C': 0.01753321292538766}. Best is trial 3 with value: 0.7752417975614934.
Trial 75 finished with value: -0.05473419556496012 and parameters: {'kernel': 'poly', 'epsilon': 0.6693709499877789, 'degree': 5, 'C': 0.013289104088498892}. Best is trial 3 with value: 0.7752417975614934.
Trial 78 finished with value: -0.06153390376102286 and parameters: {'kernel': 'rbf', 'epsilon': 0.12371141299694088, 'degree': 2, 'C': 0.0011079344693683461}. Best is trial 3 with value: 0.7752417975614934.
Trial 77 finished with value: -0.06319896757084752 and parameters: {'kernel': 'poly', 'epsilon': 0.5567018748174389, 'degree': 3, 'C': 0.0006368763513150038}. Best is trial 3 with value: 0.7752417975614934.
Trial 84 finished with value: -0.042807519531623275 and parameters: {'kernel': 'sigmoid', 'epsilon': 0.9392166090909181, 'degree': 5, 'C': 0.02728277422742346}. Best is trial 3 with value: 0.7752417975614934.
Trial 83 finished with value: -0.06200365683504381 and parameters: {'kernel': 'rbf', 'epsilon': 0.06845480298852002, 'degree': 5, 'C': 0.00023231687025137442}. Best is trial 3 with value: 0.7752417975614934.
Trial 82 finished with value: -0.06196293654722801 and parameters: {'kernel': 'poly', 'epsilon': 0.94095890128569, 'degree': 6, 'C': 0.003648091941283637}. Best is trial 3 with value: 0.7752417975614934.
Trial 80 finished with value: -0.05937051667532513 and parameters: {'kernel': 'rbf', 'epsilon': 0.07688174566774009, 'degree': 4, 'C': 0.00459300157351209}. Best is trial 3 with value: 0.7752417975614934.
Trial 85 finished with value: -0.06222001020873227 and parameters: {'kernel': 'sigmoid', 'epsilon': 0.312373556867247, 'degree': 2, 'C': 0.000575394780683348}. Best is trial 3 with value: 0.7752417975614934.
Trial 81 finished with value: -0.06156480237112657 and parameters: {'kernel': 'poly', 'epsilon': 0.5332794380863357, 'degree': 2, 'C': 0.0036143896293270262}. Best is trial 3 with value: 0.7752417975614934.
Trial 87 finished with value: -0.0634834724863524 and parameters: {'kernel': 'poly', 'epsilon': 0.656629564514114, 'degree': 3, 'C': 0.0007613408501932044}. Best is trial 3 with value: 0.7752417975614934.
Trial 79 finished with value: -0.05698751582003858 and parameters: {'kernel': 'rbf', 'epsilon': 0.4954582099964622, 'degree': 3, 'C': 0.010955863984614803}. Best is trial 3 with value: 0.7752417975614934.
Trial 91 finished with value: -0.05330521442585323 and parameters: {'kernel': 'rbf', 'epsilon': 0.4128247750679488, 'degree': 2, 'C': 0.016522342837707468}. Best is trial 88 with value: 0.7768506091400382.
Trial 98 finished with value: -0.059786312291899325 and parameters: {'kernel': 'rbf', 'epsilon': 0.5881477040561238, 'degree': 2, 'C': 0.006826694027127755}. Best is trial 88 with value: 0.7768506091400382.
Trial 92 finished with value: -0.06196597463985961 and parameters: {'kernel': 'poly', 'epsilon': 0.22452012590874115, 'degree': 3, 'C': 0.0006872855641982995}. Best is trial 88 with value: 0.7768506091400382.
Trial 88 finished with value: 0.7768506091400382 and parameters: {'kernel': 'linear', 'epsilon': 0.028642911185148057, 'degree': 4, 'C': 1.816998877595234}. Best is trial 88 with value: 0.7768506091400382.
Trial 86 finished with value: 0.6779564967651419 and parameters: {'kernel': 'linear', 'epsilon': 0.42418182531355875, 'degree': 6, 'C': 0.1231623761563581}. Best is trial 88 with value: 0.7768506091400382.
Trial 101 finished with value: 0.7741271547161807 and parameters: {'kernel': 'linear', 'epsilon': 0.9039408761996515, 'degree': 3, 'C': 6.615109375641397}. Best is trial 88 with value: 0.7768506091400382.
Trial 100 finished with value: -0.06095900817544233 and parameters: {'kernel': 'sigmoid', 'epsilon': 0.30268532888461197, 'degree': 4, 'C': 0.002044142012698494}. Best is trial 88 with value: 0.7768506091400382.
Trial 90 finished with value: 0.0795846353366117 and parameters: {'kernel': 'linear', 'epsilon': 0.8359255316461776, 'degree': 4, 'C': 0.007061837410986655}. Best is trial 88 with value: 0.7768506091400382.
Trial 95 finished with value: -0.06361374087180552 and parameters: {'kernel': 'rbf', 'epsilon': 0.8018677869147874, 'degree': 5, 'C': 0.0014882153902067647}. Best is trial 88 with value: 0.7768506091400382.
Trial 89 finished with value: -0.05179693504758539 and parameters: {'kernel': 'poly', 'epsilon': 0.18018139884263906, 'degree': 3, 'C': 0.016316975881128667}. Best is trial 88 with value: 0.7768506091400382.
Trial 103 finished with value: -0.0415495162577315 and parameters: {'kernel': 'poly', 'epsilon': 0.4818286896358944, 'degree': 6, 'C': 0.027122446665143518}. Best is trial 88 with value: 0.7768506091400382.
Trial 97 finished with value: 0.5648059896075829 and parameters: {'kernel': 'sigmoid', 'epsilon': 0.5988347669197108, 'degree': 6, 'C': 1.7816829869255215}. Best is trial 88 with value: 0.7768506091400382.
Trial 94 finished with value: -0.045100762493993196 and parameters: {'kernel': 'rbf', 'epsilon': 0.4190289151663452, 'degree': 2, 'C': 0.030824498138420475}. Best is trial 88 with value: 0.7768506091400382.
Trial 102 finished with value: 0.7738441837957801 and parameters: {'kernel': 'linear', 'epsilon': 0.9235888563884994, 'degree': 4, 'C': 9.120053456020988}. Best is trial 88 with value: 0.7768506091400382.
Trial 99 finished with value: -0.06328085652034257 and parameters: {'kernel': 'rbf', 'epsilon': 0.6888445832865127, 'degree': 6, 'C': 0.0013546047541192145}. Best is trial 88 with value: 0.7768506091400382.
Trial 93 finished with value: 0.07278944107763965 and parameters: {'kernel': 'sigmoid', 'epsilon': 0.1707292559032667, 'degree': 4, 'C': 0.1779192207357706}. Best is trial 88 with value: 0.7768506091400382.
Trial 105 finished with value: 0.054834794103927595 and parameters: {'kernel': 'linear', 'epsilon': 0.7283642736025924, 'degree': 3, 'C': 0.005733789619498076}. Best is trial 88 with value: 0.7768506091400382.
Trial 104 finished with value: -0.02915803974908774 and parameters: {'kernel': 'poly', 'epsilon': 0.45701285716340423, 'degree': 5, 'C': 0.04990874592814403}. Best is trial 88 with value: 0.7768506091400382.
Trial 108 finished with value: -0.06218676659638511 and parameters: {'kernel': 'sigmoid', 'epsilon': 0.871649114189331, 'degree': 3, 'C': 0.0031807777178045928}. Best is trial 88 with value: 0.7768506091400382.
