Trial 39 finished with value: 0.6202052242213941 and parameters: {'n_components': 3, 'max_depth': 9}. Best is trial 2 with value: 0.7649568505386313.
Trial 33 finished with value: 0.5507324189250955 and parameters: {'n_components': 1, 'max_depth': 14}. Best is trial 2 with value: 0.7649568505386313.
Trial 36 finished with value: 0.7631001355893837 and parameters: {'n_components': 4, 'max_depth': 4}. Best is trial 2 with value: 0.7649568505386313.
Trial 27 finished with value: 0.642506873709325 and parameters: {'n_components': 2, 'max_depth': 12}. Best is trial 2 with value: 0.7649568505386313.
Trial 28 finished with value: 0.7382557357181924 and parameters: {'n_components': 10, 'max_depth': 7}. Best is trial 2 with value: 0.7649568505386313.
Trial 42 finished with value: 0.6343615228505036 and parameters: {'n_components': 8, 'max_depth': 20}. Best is trial 2 with value: 0.7649568505386313.
Trial 46 finished with value: 0.6331084721343542 and parameters: {'n_components': 6, 'max_depth': 15}. Best is trial 2 with value: 0.7649568505386313.
Trial 38 finished with value: 0.6319282268835184 and parameters: {'n_components': 5, 'max_depth': 14}. Best is trial 2 with value: 0.7649568505386313.
Trial 44 finished with value: 0.6057158950823336 and parameters: {'n_components': 1, 'max_depth': 8}. Best is trial 2 with value: 0.7649568505386313.
Trial 43 finished with value: 0.7475264209122823 and parameters: {'n_components': 6, 'max_depth': 4}. Best is trial 2 with value: 0.7649568505386313.
Trial 32 finished with value: 0.6491171329386335 and parameters: {'n_components': 2, 'max_depth': 16}. Best is trial 2 with value: 0.7649568505386313.
Trial 37 finished with value: 0.6281399887902598 and parameters: {'n_components': 3, 'max_depth': 9}. Best is trial 2 with value: 0.7649568505386313.
Trial 40 finished with value: 0.6217980956013198 and parameters: {'n_components': 4, 'max_depth': 13}. Best is trial 2 with value: 0.7649568505386313.
Trial 41 finished with value: 0.6522630174901274 and parameters: {'n_components': 7, 'max_depth': 14}. Best is trial 2 with value: 0.7649568505386313.
Trial 45 finished with value: 0.6394242820847793 and parameters: {'n_components': 7, 'max_depth': 13}. Best is trial 2 with value: 0.7649568505386313.
Trial 51 finished with value: 0.6214258778709671 and parameters: {'n_components': 3, 'max_depth': 13}. Best is trial 2 with value: 0.7649568505386313.
Trial 47 finished with value: 0.6428647978118859 and parameters: {'n_components': 6, 'max_depth': 20}. Best is trial 2 with value: 0.7649568505386313.
Trial 49 finished with value: 0.6332016724493758 and parameters: {'n_components': 5, 'max_depth': 18}. Best is trial 2 with value: 0.7649568505386313.
Trial 52 finished with value: 0.6789072471317299 and parameters: {'n_components': 10, 'max_depth': 19}. Best is trial 2 with value: 0.7649568505386313.
Trial 48 finished with value: 0.5708579903232153 and parameters: {'n_components': 7, 'max_depth': 2}. Best is trial 2 with value: 0.7649568505386313.
Trial 58 finished with value: 0.6380426267056659 and parameters: {'n_components': 8, 'max_depth': 14}. Best is trial 2 with value: 0.7649568505386313.
Trial 50 finished with value: 0.7276630196073534 and parameters: {'n_components': 7, 'max_depth': 5}. Best is trial 2 with value: 0.7649568505386313.
Trial 53 finished with value: 0.638333875682093 and parameters: {'n_components': 9, 'max_depth': 14}. Best is trial 2 with value: 0.7649568505386313.
Trial 56 finished with value: 0.6136289188886275 and parameters: {'n_components': 4, 'max_depth': 19}. Best is trial 2 with value: 0.7649568505386313.
Trial 55 finished with value: 0.6229544645000945 and parameters: {'n_components': 3, 'max_depth': 19}. Best is trial 2 with value: 0.7649568505386313.
Trial 54 finished with value: 0.5532462123730317 and parameters: {'n_components': 1, 'max_depth': 13}. Best is trial 2 with value: 0.7649568505386313.
Trial 66 finished with value: 0.6988491740998716 and parameters: {'n_components': 4, 'max_depth': 6}. Best is trial 2 with value: 0.7649568505386313.
Trial 57 finished with value: 0.6682169366764334 and parameters: {'n_components': 11, 'max_depth': 2}. Best is trial 2 with value: 0.7649568505386313.
Trial 62 finished with value: 0.6083182561215462 and parameters: {'n_components': 4, 'max_depth': 16}. Best is trial 2 with value: 0.7649568505386313.
Trial 67 finished with value: 0.6334434019331688 and parameters: {'n_components': 5, 'max_depth': 20}. Best is trial 2 with value: 0.7649568505386313.
Trial 60 finished with value: 0.6131518920184835 and parameters: {'n_components': 8, 'max_depth': 13}. Best is trial 2 with value: 0.7649568505386313.
Trial 63 finished with value: 0.7425412707056528 and parameters: {'n_components': 3, 'max_depth': 4}. Best is trial 2 with value: 0.7649568505386313.
Trial 64 finished with value: 0.6200868799014007 and parameters: {'n_components': 4, 'max_depth': 15}. Best is trial 2 with value: 0.7649568505386313.
Trial 69 finished with value: 0.6761659253281418 and parameters: {'n_components': 3, 'max_depth': 7}. Best is trial 2 with value: 0.7649568505386313.
Trial 59 finished with value: 0.7531322325908962 and parameters: {'n_components': 4, 'max_depth': 3}. Best is trial 2 with value: 0.7649568505386313.
Trial 68 finished with value: 0.642093929192378 and parameters: {'n_components': 7, 'max_depth': 17}. Best is trial 2 with value: 0.7649568505386313.
Trial 61 finished with value: 0.6261366864363793 and parameters: {'n_components': 8, 'max_depth': 11}. Best is trial 2 with value: 0.7649568505386313.
Trial 72 finished with value: 0.7023089920337712 and parameters: {'n_components': 9, 'max_depth': 7}. Best is trial 2 with value: 0.7649568505386313.
Trial 65 finished with value: 0.6324766225359084 and parameters: {'n_components': 5, 'max_depth': 18}. Best is trial 2 with value: 0.7649568505386313.
Trial 71 finished with value: 0.6463625327775052 and parameters: {'n_components': 5, 'max_depth': 14}. Best is trial 2 with value: 0.7649568505386313.
Trial 83 finished with value: 0.6415489239641324 and parameters: {'n_components': 10, 'max_depth': 12}. Best is trial 2 with value: 0.7649568505386313.
Trial 70 finished with value: 0.7470907384186295 and parameters: {'n_components': 7, 'max_depth': 3}. Best is trial 2 with value: 0.7649568505386313.
Trial 75 finished with value: 0.6711167557786796 and parameters: {'n_components': 11, 'max_depth': 20}. Best is trial 2 with value: 0.7649568505386313.
Trial 82 finished with value: 0.6352211270549777 and parameters: {'n_components': 2, 'max_depth': 15}. Best is trial 2 with value: 0.7649568505386313.
Trial 77 finished with value: 0.6405949879131002 and parameters: {'n_components': 5, 'max_depth': 11}. Best is trial 2 with value: 0.7649568505386313.
Trial 79 finished with value: 0.6695444428794823 and parameters: {'n_components': 11, 'max_depth': 12}. Best is trial 2 with value: 0.7649568505386313.
Trial 73 finished with value: 0.661991003271652 and parameters: {'n_components': 9, 'max_depth': 10}. Best is trial 2 with value: 0.7649568505386313.
Trial 76 finished with value: 0.5380390387858688 and parameters: {'n_components': 1, 'max_depth': 19}. Best is trial 2 with value: 0.7649568505386313.
Trial 81 finished with value: 0.639740729828367 and parameters: {'n_components': 9, 'max_depth': 11}. Best is trial 2 with value: 0.7649568505386313.
Trial 86 finished with value: 0.7177691410038352 and parameters: {'n_components': 9, 'max_depth': 5}. Best is trial 2 with value: 0.7649568505386313.
Trial 74 finished with value: 0.6292482667396991 and parameters: {'n_components': 7, 'max_depth': 10}. Best is trial 2 with value: 0.7649568505386313.
Trial 80 finished with value: 0.6543182961036444 and parameters: {'n_components': 10, 'max_depth': 13}. Best is trial 2 with value: 0.7649568505386313.
Trial 78 finished with value: 0.7561599490848886 and parameters: {'n_components': 6, 'max_depth': 3}. Best is trial 2 with value: 0.7649568505386313.
Trial 85 finished with value: 0.6426775228223597 and parameters: {'n_components': 6, 'max_depth': 13}. Best is trial 2 with value: 0.7649568505386313.
Trial 89 finished with value: 0.6338371600129894 and parameters: {'n_components': 1, 'max_depth': 7}. Best is trial 2 with value: 0.7649568505386313.
Trial 87 finished with value: 0.6187724405856481 and parameters: {'n_components': 6, 'max_depth': 17}. Best is trial 2 with value: 0.7649568505386313.
Trial 90 finished with value: 0.6372030564940696 and parameters: {'n_components': 10, 'max_depth': 13}. Best is trial 2 with value: 0.7649568505386313.
Trial 93 finished with value: 0.7606339540759262 and parameters: {'n_components': 9, 'max_depth': 4}. Best is trial 2 with value: 0.7649568505386313.
Trial 91 finished with value: 0.6057158950823336 and parameters: {'n_components': 1, 'max_depth': 8}. Best is trial 2 with value: 0.7649568505386313.
Trial 94 finished with value: 0.735113353886472 and parameters: {'n_components': 2, 'max_depth': 5}. Best is trial 2 with value: 0.7649568505386313.
Trial 92 finished with value: 0.6339930910829013 and parameters: {'n_components': 5, 'max_depth': 20}. Best is trial 2 with value: 0.7649568505386313.
Trial 101 finished with value: 0.6491644095390166 and parameters: {'n_components': 8, 'max_depth': 17}. Best is trial 2 with value: 0.7649568505386313.
Trial 98 finished with value: 0.643598117784191 and parameters: {'n_components': 4, 'max_depth': 14}. Best is trial 2 with value: 0.7649568505386313.
Trial 95 finished with value: 0.5640094089710839 and parameters: {'n_components': 1, 'max_depth': 11}. Best is trial 2 with value: 0.7649568505386313.
Trial 84 finished with value: 0.7248704667118888 and parameters: {'n_components': 9, 'max_depth': 7}. Best is trial 2 with value: 0.7649568505386313.
Trial 88 finished with value: 0.7634120691396412 and parameters: {'n_components': 8, 'max_depth': 4}. Best is trial 2 with value: 0.7649568505386313.
Trial 97 finished with value: 0.625291075075172 and parameters: {'n_components': 3, 'max_depth': 2}. Best is trial 2 with value: 0.7649568505386313.
Trial 99 finished with value: 0.6882961496459391 and parameters: {'n_components': 1, 'max_depth': 5}. Best is trial 2 with value: 0.7649568505386313.
Trial 100 finished with value: 0.37331304051525366 and parameters: {'n_components': 1, 'max_depth': 3}. Best is trial 2 with value: 0.7649568505386313.
Trial 96 finished with value: 0.6155464717201317 and parameters: {'n_components': 5, 'max_depth': 17}. Best is trial 2 with value: 0.7649568505386313.
Trial 106 finished with value: 0.6394973923402292 and parameters: {'n_components': 7, 'max_depth': 19}. Best is trial 2 with value: 0.7649568505386313.
Trial 102 finished with value: 0.6444300544547388 and parameters: {'n_components': 2, 'max_depth': 18}. Best is trial 2 with value: 0.7649568505386313.
Trial 104 finished with value: 0.7296958364590588 and parameters: {'n_components': 6, 'max_depth': 5}. Best is trial 2 with value: 0.7649568505386313.
Trial 108 finished with value: 0.6973760139670088 and parameters: {'n_components': 6, 'max_depth': 6}. Best is trial 2 with value: 0.7649568505386313.
Trial 105 finished with value: 0.6521856029940895 and parameters: {'n_components': 7, 'max_depth': 12}. Best is trial 2 with value: 0.7649568505386313.
Trial 107 finished with value: 0.6197733820317668 and parameters: {'n_components': 4, 'max_depth': 14}. Best is trial 2 with value: 0.7649568505386313.
Trial 103 finished with value: 0.6343979018344486 and parameters: {'n_components': 4, 'max_depth': 18}. Best is trial 2 with value: 0.7649568505386313.
Trial 117 finished with value: 0.6366291126154071 and parameters: {'n_components': 6, 'max_depth': 20}. Best is trial 2 with value: 0.7649568505386313.
Trial 116 finished with value: 0.6384696299813305 and parameters: {'n_components': 2, 'max_depth': 18}. Best is trial 2 with value: 0.7649568505386313.
Trial 110 finished with value: 0.6481954858616568 and parameters: {'n_components': 2, 'max_depth': 12}. Best is trial 2 with value: 0.7649568505386313.
Trial 115 finished with value: 0.7144518001184555 and parameters: {'n_components': 8, 'max_depth': 7}. Best is trial 2 with value: 0.7649568505386313.
Trial 112 finished with value: 0.6081106482191859 and parameters: {'n_components': 3, 'max_depth': 16}. Best is trial 2 with value: 0.7649568505386313.
Trial 113 finished with value: 0.5651394312175378 and parameters: {'n_components': 1, 'max_depth': 12}. Best is trial 2 with value: 0.7649568505386313.
Trial 123 finished with value: 0.7564410353025105 and parameters: {'n_components': 5, 'max_depth': 3}. Best is trial 2 with value: 0.7649568505386313.
Trial 122 finished with value: 0.7351154963278587 and parameters: {'n_components': 11, 'max_depth': 5}. Best is trial 2 with value: 0.7649568505386313.
Trial 120 finished with value: 0.7556555905189726 and parameters: {'n_components': 8, 'max_depth': 3}. Best is trial 2 with value: 0.7649568505386313.
Trial 124 finished with value: 0.6139670958937222 and parameters: {'n_components': 3, 'max_depth': 13}. Best is trial 2 with value: 0.7649568505386313.
Trial 114 finished with value: 0.6594880050789913 and parameters: {'n_components': 10, 'max_depth': 13}. Best is trial 2 with value: 0.7649568505386313.
Trial 125 finished with value: 0.6407502364082978 and parameters: {'n_components': 7, 'max_depth': 9}. Best is trial 2 with value: 0.7649568505386313.
Trial 126 finished with value: 0.6141791806056947 and parameters: {'n_components': 3, 'max_depth': 9}. Best is trial 2 with value: 0.7649568505386313.
Trial 118 finished with value: 0.6599819566769808 and parameters: {'n_components': 11, 'max_depth': 14}. Best is trial 2 with value: 0.7649568505386313.
Trial 109 finished with value: 0.6342170997844565 and parameters: {'n_components': 5, 'max_depth': 18}. Best is trial 2 with value: 0.7649568505386313.
Trial 119 finished with value: 0.6245567092189092 and parameters: {'n_components': 6, 'max_depth': 15}. Best is trial 2 with value: 0.7649568505386313.
Trial 121 finished with value: 0.6501657072275522 and parameters: {'n_components': 6, 'max_depth': 9}. Best is trial 2 with value: 0.7649568505386313.
Trial 127 finished with value: 0.631613053683739 and parameters: {'n_components': 2, 'max_depth': 10}. Best is trial 2 with value: 0.7649568505386313.
Trial 128 finished with value: 0.7561599490848885 and parameters: {'n_components': 6, 'max_depth': 3}. Best is trial 2 with value: 0.7649568505386313.
Trial 131 finished with value: 0.6093070719661525 and parameters: {'n_components': 7, 'max_depth': 17}. Best is trial 2 with value: 0.7649568505386313.
Trial 111 finished with value: 0.6838079107590145 and parameters: {'n_components': 3, 'max_depth': 7}. Best is trial 2 with value: 0.7649568505386313.
Trial 129 finished with value: 0.6639416823273336 and parameters: {'n_components': 11, 'max_depth': 19}. Best is trial 2 with value: 0.7649568505386313.
Trial 130 finished with value: 0.6243447733525858 and parameters: {'n_components': 3, 'max_depth': 11}. Best is trial 2 with value: 0.7649568505386313.
Trial 132 finished with value: 0.7556555905189726 and parameters: {'n_components': 8, 'max_depth': 3}. Best is trial 2 with value: 0.7649568505386313.
Trial 135 finished with value: 0.6291395553890847 and parameters: {'n_components': 5, 'max_depth': 20}. Best is trial 2 with value: 0.7649568505386313.
Trial 139 finished with value: 0.6190873222570936 and parameters: {'n_components': 4, 'max_depth': 19}. Best is trial 2 with value: 0.7649568505386313.
Trial 136 finished with value: 0.6658162639271024 and parameters: {'n_components': 6, 'max_depth': 9}. Best is trial 2 with value: 0.7649568505386313.
Trial 142 finished with value: 0.718118159052415 and parameters: {'n_components': 10, 'max_depth': 7}. Best is trial 2 with value: 0.7649568505386313.
Trial 145 finished with value: 0.689472293516534 and parameters: {'n_components': 11, 'max_depth': 8}. Best is trial 2 with value: 0.7649568505386313.
Trial 141 finished with value: 0.6197420283025312 and parameters: {'n_components': 3, 'max_depth': 16}. Best is trial 2 with value: 0.7649568505386313.
Trial 140 finished with value: 0.6281413915106208 and parameters: {'n_components': 4, 'max_depth': 16}. Best is trial 2 with value: 0.7649568505386313.
Trial 134 finished with value: 0.5640094089710839 and parameters: {'n_components': 1, 'max_depth': 11}. Best is trial 2 with value: 0.7649568505386313.
Trial 133 finished with value: 0.6598183573310916 and parameters: {'n_components': 7, 'max_depth': 10}. Best is trial 2 with value: 0.7649568505386313.
Trial 138 finished with value: 0.6589081178970256 and parameters: {'n_components': 6, 'max_depth': 7}. Best is trial 2 with value: 0.7649568505386313.
Trial 146 finished with value: 0.572951779105887 and parameters: {'n_components': 1, 'max_depth': 4}. Best is trial 2 with value: 0.7649568505386313.
Trial 147 finished with value: 0.6299949945723273 and parameters: {'n_components': 8, 'max_depth': 2}. Best is trial 2 with value: 0.7649568505386313.
Trial 143 finished with value: 0.6734491278058161 and parameters: {'n_components': 10, 'max_depth': 10}. Best is trial 2 with value: 0.7649568505386313.
Trial 144 finished with value: 0.626272831686935 and parameters: {'n_components': 5, 'max_depth': 19}. Best is trial 2 with value: 0.7649568505386313.
Trial 150 finished with value: 0.6497916866753052 and parameters: {'n_components': 9, 'max_depth': 16}. Best is trial 2 with value: 0.7649568505386313.
Trial 137 finished with value: 0.6462124781425526 and parameters: {'n_components': 9, 'max_depth': 18}. Best is trial 2 with value: 0.7649568505386313.
Trial 149 finished with value: 0.6321693957776072 and parameters: {'n_components': 4, 'max_depth': 8}. Best is trial 2 with value: 0.7649568505386313.
Trial 154 finished with value: 0.7198241049468488 and parameters: {'n_components': 8, 'max_depth': 6}. Best is trial 2 with value: 0.7649568505386313.
Trial 155 finished with value: 0.2814194348080986 and parameters: {'n_components': 1, 'max_depth': 2}. Best is trial 2 with value: 0.7649568505386313.
Trial 156 finished with value: 0.6769559142937706 and parameters: {'n_components': 8, 'max_depth': 8}. Best is trial 2 with value: 0.7649568505386313.
Trial 153 finished with value: 0.7416184586068247 and parameters: {'n_components': 3, 'max_depth': 3}. Best is trial 2 with value: 0.7649568505386313.
Trial 151 finished with value: 0.6410897655839346 and parameters: {'n_components': 9, 'max_depth': 13}. Best is trial 2 with value: 0.7649568505386313.
Trial 148 finished with value: 0.5422484575502416 and parameters: {'n_components': 1, 'max_depth': 16}. Best is trial 2 with value: 0.7649568505386313.
Trial 158 finished with value: 0.6424633492505444 and parameters: {'n_components': 6, 'max_depth': 8}. Best is trial 2 with value: 0.7649568505386313.
Trial 162 finished with value: 0.5356330686639534 and parameters: {'n_components': 1, 'max_depth': 20}. Best is trial 2 with value: 0.7649568505386313.
Trial 159 finished with value: 0.625291075075172 and parameters: {'n_components': 3, 'max_depth': 2}. Best is trial 2 with value: 0.7649568505386313.
Trial 163 finished with value: 0.6442651246198509 and parameters: {'n_components': 8, 'max_depth': 10}. Best is trial 2 with value: 0.7649568505386313.
Trial 161 finished with value: 0.6079171976129114 and parameters: {'n_components': 4, 'max_depth': 19}. Best is trial 2 with value: 0.7649568505386313.
Trial 152 finished with value: 0.6709568831991705 and parameters: {'n_components': 5, 'max_depth': 8}. Best is trial 2 with value: 0.7649568505386313.
Trial 160 finished with value: 0.6301025033285812 and parameters: {'n_components': 7, 'max_depth': 13}. Best is trial 2 with value: 0.7649568505386313.
Trial 172 finished with value: 0.6301164296665076 and parameters: {'n_components': 6, 'max_depth': 10}. Best is trial 2 with value: 0.7649568505386313.
Trial 157 finished with value: 0.6324808867094426 and parameters: {'n_components': 5, 'max_depth': 11}. Best is trial 2 with value: 0.7649568505386313.
Trial 173 finished with value: 0.6223071966188012 and parameters: {'n_components': 5, 'max_depth': 2}. Best is trial 2 with value: 0.7649568505386313.
Trial 170 finished with value: 0.640710736259401 and parameters: {'n_components': 9, 'max_depth': 18}. Best is trial 2 with value: 0.7649568505386313.
Trial 164 finished with value: 0.6596939282503433 and parameters: {'n_components': 4, 'max_depth': 7}. Best is trial 2 with value: 0.7649568505386313.
Trial 171 finished with value: 0.657606398868316 and parameters: {'n_components': 11, 'max_depth': 11}. Best is trial 2 with value: 0.7649568505386313.
Trial 169 finished with value: 0.6297586769180112 and parameters: {'n_components': 6, 'max_depth': 14}. Best is trial 2 with value: 0.7649568505386313.
Trial 165 finished with value: 0.6308148241020983 and parameters: {'n_components': 4, 'max_depth': 10}. Best is trial 2 with value: 0.7649568505386313.
Trial 168 finished with value: 0.7196267953091018 and parameters: {'n_components': 8, 'max_depth': 6}. Best is trial 2 with value: 0.7649568505386313.
Trial 166 finished with value: 0.6409900507269063 and parameters: {'n_components': 6, 'max_depth': 8}. Best is trial 2 with value: 0.7649568505386313.
Trial 167 finished with value: 0.6109239616197192 and parameters: {'n_components': 3, 'max_depth': 13}. Best is trial 2 with value: 0.7649568505386313.
Trial 180 finished with value: 0.6546263094036058 and parameters: {'n_components': 5, 'max_depth': 9}. Best is trial 2 with value: 0.7649568505386313.
Trial 178 finished with value: 0.6870266780484894 and parameters: {'n_components': 11, 'max_depth': 8}. Best is trial 2 with value: 0.7649568505386313.
Trial 174 finished with value: 0.6643299709750509 and parameters: {'n_components': 5, 'max_depth': 7}. Best is trial 2 with value: 0.7649568505386313.
