Trial 106 finished with value: 0.7650773207563607 and parameters: {'kernel': 'poly', 'epsilon': 0.27438563166954233, 'degree': 3, 'C': 9.602924212774363}. Best is trial 88 with value: 0.7768506091400382.
Trial 107 finished with value: 0.7761144826665645 and parameters: {'kernel': 'linear', 'epsilon': 0.45628040314952845, 'degree': 3, 'C': 1.0610785837463428}. Best is trial 88 with value: 0.7768506091400382.
Trial 109 finished with value: 0.39073423229841575 and parameters: {'kernel': 'sigmoid', 'epsilon': 0.49728488247360425, 'degree': 5, 'C': 0.8779817836332222}. Best is trial 88 with value: 0.7768506091400382.
Trial 115 finished with value: 0.2653032552519068 and parameters: {'kernel': 'linear', 'epsilon': 0.535431203103263, 'degree': 6, 'C': 0.01974905925481481}. Best is trial 88 with value: 0.7768506091400382.
Trial 96 finished with value: -0.06186794707962404 and parameters: {'kernel': 'poly', 'epsilon': 0.22818233781700314, 'degree': 6, 'C': 0.0006532022239134872}. Best is trial 88 with value: 0.7768506091400382.
Trial 113 finished with value: 0.7761722325715936 and parameters: {'kernel': 'linear', 'epsilon': 0.4195788684135904, 'degree': 6, 'C': 1.0657394359396986}. Best is trial 112 with value: 0.7772807227025529.
Trial 110 finished with value: 0.09751076931071187 and parameters: {'kernel': 'linear', 'epsilon': 0.41162890610656644, 'degree': 6, 'C': 0.00799910011433674}. Best is trial 112 with value: 0.7772807227025529.
Trial 112 finished with value: 0.7772807227025529 and parameters: {'kernel': 'linear', 'epsilon': 0.08424137053455372, 'degree': 3, 'C': 2.0134627813544115}. Best is trial 112 with value: 0.7772807227025529.
Trial 111 finished with value: 0.13273984112262766 and parameters: {'kernel': 'poly', 'epsilon': 0.494589965982166, 'degree': 5, 'C': 0.3748520505624833}. Best is trial 112 with value: 0.7772807227025529.
Trial 121 finished with value: -0.06218727525617089 and parameters: {'kernel': 'rbf', 'epsilon': 0.8058124436046415, 'degree': 6, 'C': 0.003969321978794365}. Best is trial 112 with value: 0.7772807227025529.
Trial 119 finished with value: -0.05765572394815819 and parameters: {'kernel': 'linear', 'epsilon': 0.0922262218257679, 'degree': 6, 'C': 0.00019889155293617894}. Best is trial 112 with value: 0.7772807227025529.
Trial 122 finished with value: -0.05682248313870166 and parameters: {'kernel': 'rbf', 'epsilon': 0.5975095332132406, 'degree': 4, 'C': 0.012062130298544617}. Best is trial 112 with value: 0.7772807227025529.
Trial 117 finished with value: 0.1454220062400407 and parameters: {'kernel': 'sigmoid', 'epsilon': 0.2715829090090668, 'degree': 3, 'C': 0.2910067780806572}. Best is trial 112 with value: 0.7772807227025529.
Trial 120 finished with value: -0.038251009269376246 and parameters: {'kernel': 'poly', 'epsilon': 0.049294483442113735, 'degree': 3, 'C': 0.03820735720921558}. Best is trial 112 with value: 0.7772807227025529.
Trial 118 finished with value: -0.06253905680331022 and parameters: {'kernel': 'rbf', 'epsilon': 0.30149210024511086, 'degree': 2, 'C': 0.00018415412095943709}. Best is trial 112 with value: 0.7772807227025529.
Trial 123 finished with value: 0.7496441665654789 and parameters: {'kernel': 'rbf', 'epsilon': 0.1543474618438292, 'degree': 4, 'C': 6.776328186853272}. Best is trial 112 with value: 0.7772807227025529.
Trial 126 finished with value: 0.4276946577138731 and parameters: {'kernel': 'linear', 'epsilon': 0.9018528677291116, 'degree': 6, 'C': 0.037483496430184386}. Best is trial 112 with value: 0.7772807227025529.
Trial 114 finished with value: 0.7741425724007763 and parameters: {'kernel': 'linear', 'epsilon': 0.8852176991885689, 'degree': 6, 'C': 6.553660669099019}. Best is trial 112 with value: 0.7772807227025529.
Trial 124 finished with value: -0.0478786065032763 and parameters: {'kernel': 'sigmoid', 'epsilon': 0.6909913817267487, 'degree': 3, 'C': 0.020082143036865233}. Best is trial 112 with value: 0.7772807227025529.
Trial 128 finished with value: 0.024468481312692424 and parameters: {'kernel': 'sigmoid', 'epsilon': 0.734184318883812, 'degree': 2, 'C': 0.11230906654543515}. Best is trial 112 with value: 0.7772807227025529.
Trial 133 finished with value: -0.06436023622419504 and parameters: {'kernel': 'rbf', 'epsilon': 0.8548775119344061, 'degree': 3, 'C': 0.0005981612880369932}. Best is trial 112 with value: 0.7772807227025529.
Trial 125 finished with value: -0.062054461893607284 and parameters: {'kernel': 'sigmoid', 'epsilon': 0.13313132997073418, 'degree': 3, 'C': 0.00019016412357296446}. Best is trial 112 with value: 0.7772807227025529.
Trial 116 finished with value: 0.7242747247813054 and parameters: {'kernel': 'poly', 'epsilon': 0.9496723846045558, 'degree': 4, 'C': 5.507006193881809}. Best is trial 112 with value: 0.7772807227025529.
Trial 131 finished with value: 0.6975963287117046 and parameters: {'kernel': 'poly', 'epsilon': 0.04159301527949488, 'degree': 3, 'C': 4.4429416965351}. Best is trial 112 with value: 0.7772807227025529.
Trial 127 finished with value: 0.2772901232951793 and parameters: {'kernel': 'poly', 'epsilon': 0.5896613362546331, 'degree': 5, 'C': 0.8771970018863909}. Best is trial 112 with value: 0.7772807227025529.
Trial 130 finished with value: 0.5524783999764392 and parameters: {'kernel': 'linear', 'epsilon': 0.7736591184768814, 'degree': 5, 'C': 0.061536049904303225}. Best is trial 112 with value: 0.7772807227025529.
Trial 132 finished with value: 0.6415709087537611 and parameters: {'kernel': 'poly', 'epsilon': 0.007842683936958306, 'degree': 6, 'C': 3.8235458076632076}. Best is trial 112 with value: 0.7772807227025529.
Trial 129 finished with value: -0.05391181680637528 and parameters: {'kernel': 'poly', 'epsilon': 0.16800909011420884, 'degree': 6, 'C': 0.009973124482234346}. Best is trial 112 with value: 0.7772807227025529.
Trial 136 finished with value: -0.046936182076393794 and parameters: {'kernel': 'poly', 'epsilon': 0.699041224819949, 'degree': 4, 'C': 0.02824837747021794}. Best is trial 112 with value: 0.7772807227025529.
Trial 139 finished with value: -0.06471148757890452 and parameters: {'kernel': 'poly', 'epsilon': 0.9143438006421857, 'degree': 4, 'C': 0.00041107947504759784}. Best is trial 112 with value: 0.7772807227025529.
Trial 134 finished with value: 0.7741955786269573 and parameters: {'kernel': 'linear', 'epsilon': 0.9895622210667281, 'degree': 2, 'C': 1.5611988794779263}. Best is trial 112 with value: 0.7772807227025529.
Trial 135 finished with value: -0.05715510227564752 and parameters: {'kernel': 'rbf', 'epsilon': 0.3683156222604004, 'degree': 2, 'C': 0.0096907539051367}. Best is trial 112 with value: 0.7772807227025529.
Trial 141 finished with value: -0.06363203687369391 and parameters: {'kernel': 'poly', 'epsilon': 0.6023249793912324, 'degree': 5, 'C': 0.0001802137250663104}. Best is trial 112 with value: 0.7772807227025529.
Trial 144 finished with value: -0.0631352225099526 and parameters: {'kernel': 'poly', 'epsilon': 0.4910146928342679, 'degree': 6, 'C': 0.00022494938882167958}. Best is trial 112 with value: 0.7772807227025529.
Trial 137 finished with value: 0.019431288738736806 and parameters: {'kernel': 'sigmoid', 'epsilon': 0.5788729304328214, 'degree': 3, 'C': 0.1054039924799455}. Best is trial 112 with value: 0.7772807227025529.
Trial 138 finished with value: -0.06166963767437291 and parameters: {'kernel': 'poly', 'epsilon': 0.4320175021853764, 'degree': 4, 'C': 0.002279761533382148}. Best is trial 112 with value: 0.7772807227025529.
Trial 149 finished with value: -0.05747084394820497 and parameters: {'kernel': 'poly', 'epsilon': 0.457823365263475, 'degree': 6, 'C': 0.006951522724652709}. Best is trial 112 with value: 0.7772807227025529.
Trial 142 finished with value: 0.12286882279594027 and parameters: {'kernel': 'rbf', 'epsilon': 0.23908070152720395, 'degree': 5, 'C': 0.36681136020975286}. Best is trial 112 with value: 0.7772807227025529.
Trial 148 finished with value: 0.6616502283061796 and parameters: {'kernel': 'linear', 'epsilon': 0.659926715874568, 'degree': 2, 'C': 0.10446784865040053}. Best is trial 112 with value: 0.7772807227025529.
Trial 151 finished with value: 0.055214264406664104 and parameters: {'kernel': 'sigmoid', 'epsilon': 0.9871249667175177, 'degree': 3, 'C': 0.1570151556716509}. Best is trial 112 with value: 0.7772807227025529.
Trial 140 finished with value: -0.06407292965652114 and parameters: {'kernel': 'poly', 'epsilon': 0.8440958723356434, 'degree': 4, 'C': 0.0009636159128350897}. Best is trial 112 with value: 0.7772807227025529.
Trial 145 finished with value: 0.35390139832524553 and parameters: {'kernel': 'linear', 'epsilon': 0.6483971754076886, 'degree': 2, 'C': 0.027920627951326306}. Best is trial 112 with value: 0.7772807227025529.
Trial 147 finished with value: -0.032019064039565295 and parameters: {'kernel': 'rbf', 'epsilon': 0.26845696857262513, 'degree': 3, 'C': 0.0524788250579166}. Best is trial 112 with value: 0.7772807227025529.
Trial 152 finished with value: 0.777745466887514 and parameters: {'kernel': 'linear', 'epsilon': 0.22531134968869027, 'degree': 2, 'C': 1.3917349901705702}. Best is trial 152 with value: 0.777745466887514.
Trial 157 finished with value: -0.023890899160453127 and parameters: {'kernel': 'rbf', 'epsilon': 0.718664519298263, 'degree': 5, 'C': 0.06899246646815406}. Best is trial 152 with value: 0.777745466887514.
Trial 153 finished with value: -0.06357955910757895 and parameters: {'kernel': 'sigmoid', 'epsilon': 0.6358274527319869, 'degree': 2, 'C': 0.00036595581945575846}. Best is trial 152 with value: 0.777745466887514.
Trial 143 finished with value: 0.34431801578270216 and parameters: {'kernel': 'linear', 'epsilon': 0.01790943777835996, 'degree': 6, 'C': 0.02670805438784406}. Best is trial 152 with value: 0.777745466887514.
Trial 146 finished with value: -0.06383224391640971 and parameters: {'kernel': 'sigmoid', 'epsilon': 0.7083731421713092, 'degree': 6, 'C': 0.0003785600544324403}. Best is trial 152 with value: 0.777745466887514.
Trial 150 finished with value: 0.5596828752049233 and parameters: {'kernel': 'poly', 'epsilon': 0.9953508596914129, 'degree': 5, 'C': 2.5819045475740037}. Best is trial 152 with value: 0.777745466887514.
Trial 155 finished with value: 0.4793824152084529 and parameters: {'kernel': 'rbf', 'epsilon': 0.46093491996102653, 'degree': 3, 'C': 1.5038944570376314}. Best is trial 152 with value: 0.777745466887514.
Trial 158 finished with value: 0.05827800056749388 and parameters: {'kernel': 'poly', 'epsilon': 0.6354039060029939, 'degree': 6, 'C': 0.1733098084341316}. Best is trial 152 with value: 0.777745466887514.
Trial 156 finished with value: -0.0620230818415346 and parameters: {'kernel': 'sigmoid', 'epsilon': 0.03931470041872809, 'degree': 2, 'C': 0.00011009820809063256}. Best is trial 152 with value: 0.777745466887514.
Trial 154 finished with value: -0.05175682792167961 and parameters: {'kernel': 'linear', 'epsilon': 0.5059334946509978, 'degree': 4, 'C': 0.0005328621175542429}. Best is trial 152 with value: 0.777745466887514.
Trial 159 finished with value: 0.21897444321800216 and parameters: {'kernel': 'linear', 'epsilon': 0.9347264084163996, 'degree': 3, 'C': 0.01595618867249408}. Best is trial 152 with value: 0.777745466887514.
Trial 168 finished with value: 0.49053944134774435 and parameters: {'kernel': 'rbf', 'epsilon': 0.8862955565930664, 'degree': 6, 'C': 1.5713063990666731}. Best is trial 152 with value: 0.777745466887514.
Trial 162 finished with value: -0.05597402611076696 and parameters: {'kernel': 'rbf', 'epsilon': 0.27841117540322013, 'degree': 2, 'C': 0.011052758771277333}. Best is trial 152 with value: 0.777745466887514.
Trial 165 finished with value: -0.015554423396999573 and parameters: {'kernel': 'linear', 'epsilon': 0.5638502682364073, 'degree': 2, 'C': 0.002219373495974169}. Best is trial 152 with value: 0.777745466887514.
Trial 160 finished with value: 0.2994798895429664 and parameters: {'kernel': 'sigmoid', 'epsilon': 0.619663741161528, 'degree': 2, 'C': 0.6054230344171684}. Best is trial 152 with value: 0.777745466887514.
Trial 164 finished with value: -0.06128832427693036 and parameters: {'kernel': 'rbf', 'epsilon': 0.14463192087200405, 'degree': 2, 'C': 0.0015464301402635652}. Best is trial 152 with value: 0.777745466887514.
Trial 161 finished with value: -0.006656279828867806 and parameters: {'kernel': 'linear', 'epsilon': 0.5624239417385478, 'degree': 2, 'C': 0.002634932416932848}. Best is trial 152 with value: 0.777745466887514.
Trial 170 finished with value: -0.053743977519092975 and parameters: {'kernel': 'rbf', 'epsilon': 0.7368478633472482, 'degree': 6, 'C': 0.01800597259496143}. Best is trial 152 with value: 0.777745466887514.
Trial 171 finished with value: -0.044315120562672373 and parameters: {'kernel': 'linear', 'epsilon': 0.07585652947051935, 'degree': 4, 'C': 0.0007894544808214023}. Best is trial 152 with value: 0.777745466887514.
Trial 163 finished with value: 0.11293494708864027 and parameters: {'kernel': 'rbf', 'epsilon': 0.6511929096966833, 'degree': 3, 'C': 0.34596093745426004}. Best is trial 152 with value: 0.777745466887514.
Trial 172 finished with value: -0.06158776349449 and parameters: {'kernel': 'sigmoid', 'epsilon': 0.22484964124424944, 'degree': 4, 'C': 0.0009930835396991747}. Best is trial 152 with value: 0.777745466887514.
Trial 179 finished with value: -0.05646295343550867 and parameters: {'kernel': 'sigmoid', 'epsilon': 0.5892244690360848, 'degree': 6, 'C': 0.009049340143621753}. Best is trial 152 with value: 0.777745466887514.
Trial 167 finished with value: -0.05285332811519933 and parameters: {'kernel': 'poly', 'epsilon': 0.6356995020525372, 'degree': 4, 'C': 0.018192359023650254}. Best is trial 152 with value: 0.777745466887514.
Trial 166 finished with value: -0.056431666880119594 and parameters: {'kernel': 'rbf', 'epsilon': 0.2389837520232695, 'degree': 4, 'C': 0.009990282370017148}. Best is trial 152 with value: 0.777745466887514.
Trial 176 finished with value: 0.6217823075050729 and parameters: {'kernel': 'poly', 'epsilon': 0.31438445140380367, 'degree': 3, 'C': 2.9686201939970176}. Best is trial 152 with value: 0.777745466887514.
Trial 178 finished with value: -0.062112323626963194 and parameters: {'kernel': 'rbf', 'epsilon': 0.3664335245553073, 'degree': 2, 'C': 0.0012104502410699213}. Best is trial 152 with value: 0.777745466887514.
Trial 169 finished with value: 0.7687329688528652 and parameters: {'kernel': 'linear', 'epsilon': 0.2914687117018544, 'degree': 4, 'C': 0.5519602035545236}. Best is trial 152 with value: 0.777745466887514.
Trial 180 finished with value: 0.7746174753341377 and parameters: {'kernel': 'linear', 'epsilon': 0.6564325658730294, 'degree': 3, 'C': 9.030804789583147}. Best is trial 152 with value: 0.777745466887514.
Trial 174 finished with value: -0.060948285828919965 and parameters: {'kernel': 'sigmoid', 'epsilon': 0.1778690135648322, 'degree': 6, 'C': 0.0016006530126463042}. Best is trial 152 with value: 0.777745466887514.
Trial 173 finished with value: -0.047717827690435755 and parameters: {'kernel': 'sigmoid', 'epsilon': 0.3293941012049799, 'degree': 2, 'C': 0.018397248878208896}. Best is trial 152 with value: 0.777745466887514.
Trial 185 finished with value: -0.06359023164371387 and parameters: {'kernel': 'rbf', 'epsilon': 0.6364697714906551, 'degree': 4, 'C': 0.0004964035478905552}. Best is trial 152 with value: 0.777745466887514.
Trial 177 finished with value: 0.10781795216218182 and parameters: {'kernel': 'rbf', 'epsilon': 0.1389292995238749, 'degree': 3, 'C': 0.33192763314302554}. Best is trial 152 with value: 0.777745466887514.
Trial 181 finished with value: 0.5748601186798228 and parameters: {'kernel': 'sigmoid', 'epsilon': 0.15574244200715825, 'degree': 2, 'C': 1.8804623965966731}. Best is trial 152 with value: 0.777745466887514.
Trial 175 finished with value: -0.061830515711037294 and parameters: {'kernel': 'poly', 'epsilon': 0.1759391894287271, 'degree': 2, 'C': 0.0007865889664256957}. Best is trial 152 with value: 0.777745466887514.
Trial 188 finished with value: -0.06122172750579934 and parameters: {'kernel': 'sigmoid', 'epsilon': 0.10174405172753775, 'degree': 5, 'C': 0.0011666988512313182}. Best is trial 152 with value: 0.777745466887514.
Trial 182 finished with value: -0.03744589697128351 and parameters: {'kernel': 'sigmoid', 'epsilon': 0.09773470659081374, 'degree': 5, 'C': 0.0299529487456755}. Best is trial 152 with value: 0.777745466887514.
Trial 183 finished with value: -0.0642436155170736 and parameters: {'kernel': 'poly', 'epsilon': 0.8666952489806369, 'degree': 4, 'C': 0.0008451680044669365}. Best is trial 152 with value: 0.777745466887514.
Trial 186 finished with value: 0.7757642103762684 and parameters: {'kernel': 'linear', 'epsilon': 0.12211161307644258, 'degree': 2, 'C': 0.8361297127304801}. Best is trial 152 with value: 0.777745466887514.
Trial 189 finished with value: 0.7761660212123054 and parameters: {'kernel': 'linear', 'epsilon': 0.22113104444883536, 'degree': 4, 'C': 3.7731860706968794}. Best is trial 152 with value: 0.777745466887514.
Trial 191 finished with value: -0.058926571683392735 and parameters: {'kernel': 'poly', 'epsilon': 0.8039654236305156, 'degree': 5, 'C': 0.007924137123143007}. Best is trial 152 with value: 0.777745466887514.
Trial 184 finished with value: 0.7759796438723323 and parameters: {'kernel': 'linear', 'epsilon': 0.6981129427547421, 'degree': 4, 'C': 1.4656578473819943}. Best is trial 152 with value: 0.777745466887514.
Trial 190 finished with value: -0.06493335233487005 and parameters: {'kernel': 'sigmoid', 'epsilon': 0.9648972226258115, 'degree': 6, 'C': 0.00012565152888573068}. Best is trial 152 with value: 0.777745466887514.
Trial 187 finished with value: 0.06989524705974827 and parameters: {'kernel': 'linear', 'epsilon': 0.8875569830846258, 'degree': 3, 'C': 0.006541954876032878}. Best is trial 152 with value: 0.777745466887514.
Trial 199 finished with value: 0.21322068882096143 and parameters: {'kernel': 'sigmoid', 'epsilon': 0.7698510508032559, 'degree': 6, 'C': 0.41611364963513436}. Best is trial 152 with value: 0.777745466887514.
Trial 194 finished with value: 0.7325686427807186 and parameters: {'kernel': 'sigmoid', 'epsilon': 0.287153145095555, 'degree': 3, 'C': 8.907369102759684}. Best is trial 152 with value: 0.777745466887514.
Trial 201 finished with value: -0.04846882749334843 and parameters: {'kernel': 'rbf', 'epsilon': 0.40176475706446735, 'degree': 6, 'C': 0.0247755507793137}. Best is trial 152 with value: 0.777745466887514.
Trial 198 finished with value: 0.011096987069930175 and parameters: {'kernel': 'poly', 'epsilon': 0.27647854987264486, 'degree': 2, 'C': 0.14289034266089173}. Best is trial 152 with value: 0.777745466887514.
Trial 195 finished with value: 0.428526756757431 and parameters: {'kernel': 'rbf', 'epsilon': 0.7438460112990162, 'degree': 6, 'C': 1.2890188011739734}. Best is trial 152 with value: 0.777745466887514.
Trial 196 finished with value: -0.01913679327895489 and parameters: {'kernel': 'poly', 'epsilon': 0.03848711873501165, 'degree': 2, 'C': 0.08145215043340005}. Best is trial 152 with value: 0.777745466887514.
Trial 203 finished with value: -0.03121830564090732 and parameters: {'kernel': 'rbf', 'epsilon': 0.8268768763002177, 'degree': 6, 'C': 0.05651773815918477}. Best is trial 152 with value: 0.777745466887514.
Trial 200 finished with value: -0.0615234146809394 and parameters: {'kernel': 'rbf', 'epsilon': 0.23526275986761214, 'degree': 5, 'C': 0.0014975757821853192}. Best is trial 152 with value: 0.777745466887514.
Trial 193 finished with value: 0.013909042817163575 and parameters: {'kernel': 'sigmoid', 'epsilon': 0.5470045459155446, 'degree': 6, 'C': 0.09808890208748659}. Best is trial 152 with value: 0.777745466887514.
Trial 204 finished with value: 0.7242130004160682 and parameters: {'kernel': 'sigmoid', 'epsilon': 0.18277638303663524, 'degree': 4, 'C': 9.155230416867488}. Best is trial 152 with value: 0.777745466887514.
Trial 192 finished with value: 0.31943164957281905 and parameters: {'kernel': 'linear', 'epsilon': 0.5664209359851763, 'degree': 4, 'C': 0.024360712816355202}. Best is trial 152 with value: 0.777745466887514.
Trial 205 finished with value: 0.15052246702231625 and parameters: {'kernel': 'linear', 'epsilon': 0.0746551076162052, 'degree': 4, 'C': 0.011114205649244547}. Best is trial 152 with value: 0.777745466887514.
Trial 197 finished with value: 0.7119807595047225 and parameters: {'kernel': 'rbf', 'epsilon': 0.9375814601128994, 'degree': 5, 'C': 4.388635761027974}. Best is trial 152 with value: 0.777745466887514.
Trial 202 finished with value: 0.7169728922522262 and parameters: {'kernel': 'poly', 'epsilon': 0.7462837894866571, 'degree': 5, 'C': 6.896780822431309}. Best is trial 152 with value: 0.777745466887514.
Trial 206 finished with value: 0.1482465592848289 and parameters: {'kernel': 'sigmoid', 'epsilon': 0.5020361576855262, 'degree': 5, 'C': 0.29598818112471237}. Best is trial 152 with value: 0.777745466887514.
Trial 207 finished with value: -0.062304844530630454 and parameters: {'kernel': 'poly', 'epsilon': 0.9823825825790746, 'degree': 4, 'C': 0.004542510239001051}. Best is trial 210 with value: 0.7782517423338795.
Trial 210 finished with value: 0.7782517423338795 and parameters: {'kernel': 'linear', 'epsilon': 0.02936160555263123, 'degree': 6, 'C': 1.3476788898887115}. Best is trial 210 with value: 0.7782517423338795.
Trial 209 finished with value: -0.06274561906512549 and parameters: {'kernel': 'rbf', 'epsilon': 0.44032088563277916, 'degree': 3, 'C': 0.0006217596335579937}. Best is trial 210 with value: 0.7782517423338795.
Trial 211 finished with value: -0.05460026121739155 and parameters: {'kernel': 'rbf', 'epsilon': 0.8923083634188046, 'degree': 5, 'C': 0.01731375907699612}. Best is trial 210 with value: 0.7782517423338795.
