Trial 3 finished with value: 0.6739141479638319 and parameters: {'max_depth': 18}. Best is trial 0 with value: 0.7704003690285397.
Trial 13 finished with value: 0.6709317437335524 and parameters: {'max_depth': 17}. Best is trial 0 with value: 0.7704003690285397.
Trial 11 finished with value: 0.80285889052441 and parameters: {'max_depth': 3}. Best is trial 5 with value: 0.8028588905244101.
Trial 1 finished with value: 0.6684358267445754 and parameters: {'max_depth': 11}. Best is trial 5 with value: 0.8028588905244101.
Trial 9 finished with value: 0.6681574281629633 and parameters: {'max_depth': 18}. Best is trial 11 with value: 0.80285889052441.
Trial 2 finished with value: 0.6714610782425785 and parameters: {'max_depth': 16}. Best is trial 11 with value: 0.80285889052441.
Trial 6 finished with value: 0.6704145287434177 and parameters: {'max_depth': 17}. Best is trial 11 with value: 0.80285889052441.
Trial 5 finished with value: 0.8028588905244101 and parameters: {'max_depth': 3}. Best is trial 5 with value: 0.8028588905244101.
Trial 23 finished with value: 0.6745300693936855 and parameters: {'max_depth': 17}. Best is trial 5 with value: 0.8028588905244101.
Trial 10 finished with value: 0.739902029707628 and parameters: {'max_depth': 7}. Best is trial 5 with value: 0.8028588905244101.
Trial 7 finished with value: 0.7387179265909589 and parameters: {'max_depth': 7}. Best is trial 22 with value: 0.8208739178371156.
Trial 4 finished with value: 0.6694161331225628 and parameters: {'max_depth': 11}. Best is trial 22 with value: 0.8208739178371156.
Trial 15 finished with value: 0.6755328021979314 and parameters: {'max_depth': 20}. Best is trial 22 with value: 0.8208739178371156.
Trial 8 finished with value: 0.6706688903805469 and parameters: {'max_depth': 17}. Best is trial 22 with value: 0.8208739178371156.
Trial 16 finished with value: 0.7677914112127707 and parameters: {'max_depth': 6}. Best is trial 22 with value: 0.8208739178371156.
Trial 21 finished with value: 0.7509308117469141 and parameters: {'max_depth': 2}. Best is trial 22 with value: 0.8208739178371156.
Trial 18 finished with value: 0.6759385562381833 and parameters: {'max_depth': 16}. Best is trial 22 with value: 0.8208739178371156.
Trial 19 finished with value: 0.7044035566254953 and parameters: {'max_depth': 8}. Best is trial 22 with value: 0.8208739178371156.
Trial 12 finished with value: 0.8208739178371156 and parameters: {'max_depth': 4}. Best is trial 22 with value: 0.8208739178371156.
Trial 14 finished with value: 0.8101057100180489 and parameters: {'max_depth': 5}. Best is trial 22 with value: 0.8208739178371156.
Trial 17 finished with value: 0.7397935570386502 and parameters: {'max_depth': 7}. Best is trial 22 with value: 0.8208739178371156.
Trial 20 finished with value: 0.6683098545276884 and parameters: {'max_depth': 17}. Best is trial 22 with value: 0.8208739178371156.
Trial 22 finished with value: 0.8208739178371156 and parameters: {'max_depth': 4}. Best is trial 22 with value: 0.8208739178371156.
Trial 25 finished with value: 0.667776896471058 and parameters: {'max_depth': 13}. Best is trial 22 with value: 0.8208739178371156.
Trial 24 finished with value: 0.7509308117469141 and parameters: {'max_depth': 2}. Best is trial 22 with value: 0.8208739178371156.
Trial 32 finished with value: 0.8208739178371154 and parameters: {'max_depth': 4}. Best is trial 22 with value: 0.8208739178371156.
Trial 31 finished with value: 0.6755291498175224 and parameters: {'max_depth': 12}. Best is trial 22 with value: 0.8208739178371156.
Trial 27 finished with value: 0.6707544023070136 and parameters: {'max_depth': 14}. Best is trial 22 with value: 0.8208739178371156.
Trial 26 finished with value: 0.8102063288950058 and parameters: {'max_depth': 5}. Best is trial 22 with value: 0.8208739178371156.
Trial 38 finished with value: 0.6709672133689741 and parameters: {'max_depth': 20}. Best is trial 22 with value: 0.8208739178371156.
Trial 36 finished with value: 0.7695659109934704 and parameters: {'max_depth': 6}. Best is trial 22 with value: 0.8208739178371156.
Trial 28 finished with value: 0.7106201379576547 and parameters: {'max_depth': 8}. Best is trial 22 with value: 0.8208739178371156.
Trial 30 finished with value: 0.6710982360708163 and parameters: {'max_depth': 18}. Best is trial 22 with value: 0.8208739178371156.
Trial 29 finished with value: 0.7509308117469141 and parameters: {'max_depth': 2}. Best is trial 22 with value: 0.8208739178371156.
Trial 42 finished with value: 0.7509308117469141 and parameters: {'max_depth': 2}. Best is trial 22 with value: 0.8208739178371156.
Trial 33 finished with value: 0.7106090753859039 and parameters: {'max_depth': 8}. Best is trial 22 with value: 0.8208739178371156.
Trial 34 finished with value: 0.6737878205969821 and parameters: {'max_depth': 18}. Best is trial 22 with value: 0.8208739178371156.
Trial 39 finished with value: 0.7509308117469141 and parameters: {'max_depth': 2}. Best is trial 22 with value: 0.8208739178371156.
Trial 37 finished with value: 0.6685983528331203 and parameters: {'max_depth': 15}. Best is trial 22 with value: 0.8208739178371156.
Trial 35 finished with value: 0.6714446456995652 and parameters: {'max_depth': 19}. Best is trial 22 with value: 0.8208739178371156.
Trial 41 finished with value: 0.6716961480589038 and parameters: {'max_depth': 16}. Best is trial 22 with value: 0.8208739178371156.
Trial 43 finished with value: 0.6706527998259919 and parameters: {'max_depth': 12}. Best is trial 22 with value: 0.8208739178371156.
Trial 45 finished with value: 0.8208739178371156 and parameters: {'max_depth': 4}. Best is trial 22 with value: 0.8208739178371156.
Trial 44 finished with value: 0.6670016026862017 and parameters: {'max_depth': 10}. Best is trial 22 with value: 0.8208739178371156.
Trial 53 finished with value: 0.6701567582792338 and parameters: {'max_depth': 15}. Best is trial 22 with value: 0.8208739178371156.
Trial 54 finished with value: 0.7023230294319864 and parameters: {'max_depth': 8}. Best is trial 22 with value: 0.8208739178371156.
Trial 50 finished with value: 0.6704569343260327 and parameters: {'max_depth': 13}. Best is trial 22 with value: 0.8208739178371156.
Trial 47 finished with value: 0.6733769508048708 and parameters: {'max_depth': 18}. Best is trial 22 with value: 0.8208739178371156.
Trial 48 finished with value: 0.6686715737853174 and parameters: {'max_depth': 18}. Best is trial 22 with value: 0.8208739178371156.
Trial 55 finished with value: 0.6697966631684755 and parameters: {'max_depth': 15}. Best is trial 22 with value: 0.8208739178371156.
Trial 51 finished with value: 0.7509308117469141 and parameters: {'max_depth': 2}. Best is trial 22 with value: 0.8208739178371156.
Trial 40 finished with value: 0.7683593749649069 and parameters: {'max_depth': 6}. Best is trial 22 with value: 0.8208739178371156.
Trial 56 finished with value: 0.80285889052441 and parameters: {'max_depth': 3}. Best is trial 22 with value: 0.8208739178371156.
Trial 52 finished with value: 0.768747478738328 and parameters: {'max_depth': 6}. Best is trial 22 with value: 0.8208739178371156.
Trial 46 finished with value: 0.673824531587111 and parameters: {'max_depth': 10}. Best is trial 22 with value: 0.8208739178371156.
Trial 60 finished with value: 0.6715750341017978 and parameters: {'max_depth': 13}. Best is trial 22 with value: 0.8208739178371156.
Trial 49 finished with value: 0.6690605473488469 and parameters: {'max_depth': 19}. Best is trial 22 with value: 0.8208739178371156.
Trial 62 finished with value: 0.6684313393993401 and parameters: {'max_depth': 11}. Best is trial 22 with value: 0.8208739178371156.
Trial 57 finished with value: 0.6757411574269033 and parameters: {'max_depth': 18}. Best is trial 22 with value: 0.8208739178371156.
Trial 59 finished with value: 0.6760073191903873 and parameters: {'max_depth': 17}. Best is trial 22 with value: 0.8208739178371156.
Trial 58 finished with value: 0.6729488853170176 and parameters: {'max_depth': 9}. Best is trial 22 with value: 0.8208739178371156.
Trial 61 finished with value: 0.750930811746914 and parameters: {'max_depth': 2}. Best is trial 22 with value: 0.8208739178371156.
Trial 72 finished with value: 0.6696010052073875 and parameters: {'max_depth': 10}. Best is trial 22 with value: 0.8208739178371156.
Trial 70 finished with value: 0.671653897732243 and parameters: {'max_depth': 10}. Best is trial 22 with value: 0.8208739178371156.
Trial 65 finished with value: 0.8098123376218787 and parameters: {'max_depth': 5}. Best is trial 22 with value: 0.8208739178371156.
Trial 67 finished with value: 0.6682114055013522 and parameters: {'max_depth': 20}. Best is trial 22 with value: 0.8208739178371156.
Trial 63 finished with value: 0.8102063288950058 and parameters: {'max_depth': 5}. Best is trial 22 with value: 0.8208739178371156.
Trial 68 finished with value: 0.8101057100180489 and parameters: {'max_depth': 5}. Best is trial 22 with value: 0.8208739178371156.
Trial 78 finished with value: 0.6694020120429603 and parameters: {'max_depth': 10}. Best is trial 22 with value: 0.8208739178371156.
Trial 69 finished with value: 0.6694239849690338 and parameters: {'max_depth': 13}. Best is trial 22 with value: 0.8208739178371156.
Trial 64 finished with value: 0.6741525222843188 and parameters: {'max_depth': 9}. Best is trial 22 with value: 0.8208739178371156.
Trial 77 finished with value: 0.6704852769273069 and parameters: {'max_depth': 15}. Best is trial 22 with value: 0.8208739178371156.
Trial 76 finished with value: 0.6701748614141563 and parameters: {'max_depth': 20}. Best is trial 22 with value: 0.8208739178371156.
Trial 66 finished with value: 0.6700689862527774 and parameters: {'max_depth': 17}. Best is trial 22 with value: 0.8208739178371156.
Trial 71 finished with value: 0.810206328895006 and parameters: {'max_depth': 5}. Best is trial 22 with value: 0.8208739178371156.
Trial 83 finished with value: 0.6691167669101082 and parameters: {'max_depth': 12}. Best is trial 22 with value: 0.8208739178371156.
Trial 82 finished with value: 0.6743764392348275 and parameters: {'max_depth': 18}. Best is trial 22 with value: 0.8208739178371156.
Trial 73 finished with value: 0.7051673962637188 and parameters: {'max_depth': 8}. Best is trial 22 with value: 0.8208739178371156.
Trial 80 finished with value: 0.80285889052441 and parameters: {'max_depth': 3}. Best is trial 22 with value: 0.8208739178371156.
Trial 75 finished with value: 0.6742948446254092 and parameters: {'max_depth': 20}. Best is trial 22 with value: 0.8208739178371156.
Trial 85 finished with value: 0.6694947102906756 and parameters: {'max_depth': 15}. Best is trial 22 with value: 0.8208739178371156.
Trial 79 finished with value: 0.6722179818796097 and parameters: {'max_depth': 10}. Best is trial 22 with value: 0.8208739178371156.
Trial 92 finished with value: 0.8098123376218785 and parameters: {'max_depth': 5}. Best is trial 22 with value: 0.8208739178371156.
Trial 86 finished with value: 0.766901049312684 and parameters: {'max_depth': 6}. Best is trial 22 with value: 0.8208739178371156.
Trial 74 finished with value: 0.6686803882942829 and parameters: {'max_depth': 16}. Best is trial 22 with value: 0.8208739178371156.
Trial 84 finished with value: 0.6765014263805875 and parameters: {'max_depth': 12}. Best is trial 22 with value: 0.8208739178371156.
Trial 90 finished with value: 0.6690925422977633 and parameters: {'max_depth': 15}. Best is trial 22 with value: 0.8208739178371156.
Trial 81 finished with value: 0.6741220740256303 and parameters: {'max_depth': 9}. Best is trial 22 with value: 0.8208739178371156.
Trial 97 finished with value: 0.6700597802659687 and parameters: {'max_depth': 19}. Best is trial 22 with value: 0.8208739178371156.
Trial 96 finished with value: 0.6752881196872409 and parameters: {'max_depth': 11}. Best is trial 22 with value: 0.8208739178371156.
Trial 91 finished with value: 0.6688018335499162 and parameters: {'max_depth': 17}. Best is trial 22 with value: 0.8208739178371156.
Trial 95 finished with value: 0.7047922641886925 and parameters: {'max_depth': 8}. Best is trial 22 with value: 0.8208739178371156.
Trial 89 finished with value: 0.7695259233034928 and parameters: {'max_depth': 6}. Best is trial 22 with value: 0.8208739178371156.
Trial 88 finished with value: 0.66974403833608 and parameters: {'max_depth': 20}. Best is trial 22 with value: 0.8208739178371156.
Trial 98 finished with value: 0.6787023850701763 and parameters: {'max_depth': 9}. Best is trial 22 with value: 0.8208739178371156.
Trial 93 finished with value: 0.6700909017927058 and parameters: {'max_depth': 18}. Best is trial 22 with value: 0.8208739178371156.
Trial 87 finished with value: 0.8028588905244101 and parameters: {'max_depth': 3}. Best is trial 22 with value: 0.8208739178371156.
Trial 94 finished with value: 0.80285889052441 and parameters: {'max_depth': 3}. Best is trial 22 with value: 0.8208739178371156.
Trial 99 finished with value: 0.6761708247032691 and parameters: {'max_depth': 15}. Best is trial 22 with value: 0.8208739178371156.
A new study created in RDB with name: PCADecisionTreeRegressor_8143
Trial 2 finished with value: 0.7167958570116963 and parameters: {'n_components': 11, 'max_depth': 8}. Best is trial 2 with value: 0.7167958570116963.
Trial 1 finished with value: 0.6196458169550967 and parameters: {'n_components': 6, 'max_depth': 9}. Best is trial 2 with value: 0.7167958570116963.
Trial 9 finished with value: 0.30454195604046774 and parameters: {'n_components': 2, 'max_depth': 2}. Best is trial 2 with value: 0.7167958570116963.
Trial 6 finished with value: 0.623159464204347 and parameters: {'n_components': 2, 'max_depth': 19}. Best is trial 2 with value: 0.7167958570116963.
Trial 13 finished with value: 0.651327824012058 and parameters: {'n_components': 11, 'max_depth': 13}. Best is trial 2 with value: 0.7167958570116963.
Trial 12 finished with value: 0.6123412354183475 and parameters: {'n_components': 5, 'max_depth': 9}. Best is trial 2 with value: 0.7167958570116963.
Trial 18 finished with value: 0.6340455397999932 and parameters: {'n_components': 6, 'max_depth': 13}. Best is trial 2 with value: 0.7167958570116963.
Trial 8 finished with value: 0.7005646149325374 and parameters: {'n_components': 8, 'max_depth': 10}. Best is trial 2 with value: 0.7167958570116963.
Trial 14 finished with value: 0.6435147754204169 and parameters: {'n_components': 2, 'max_depth': 5}. Best is trial 11 with value: 0.7670193737382579.
Trial 7 finished with value: 0.714770682983975 and parameters: {'n_components': 9, 'max_depth': 15}. Best is trial 11 with value: 0.7670193737382579.
Trial 16 finished with value: 0.30454195604046796 and parameters: {'n_components': 2, 'max_depth': 2}. Best is trial 11 with value: 0.7670193737382579.
Trial 22 finished with value: 0.6169210199099346 and parameters: {'n_components': 4, 'max_depth': 15}. Best is trial 11 with value: 0.7670193737382579.
Trial 11 finished with value: 0.7670193737382579 and parameters: {'n_components': 11, 'max_depth': 6}. Best is trial 11 with value: 0.7670193737382579.
Trial 4 finished with value: 0.13986192076866083 and parameters: {'n_components': 1, 'max_depth': 5}. Best is trial 11 with value: 0.7670193737382579.
Trial 15 finished with value: 0.6672286352915566 and parameters: {'n_components': 8, 'max_depth': 16}. Best is trial 11 with value: 0.7670193737382579.
Trial 20 finished with value: 0.7169937877642273 and parameters: {'n_components': 11, 'max_depth': 8}. Best is trial 11 with value: 0.7670193737382579.
Trial 21 finished with value: 0.6755237373163704 and parameters: {'n_components': 6, 'max_depth': 5}. Best is trial 11 with value: 0.7670193737382579.
Trial 0 finished with value: 0.6317996533475251 and parameters: {'n_components': 3, 'max_depth': 11}. Best is trial 11 with value: 0.7670193737382579.
Trial 23 finished with value: 0.3868947156063623 and parameters: {'n_components': 1, 'max_depth': 20}. Best is trial 11 with value: 0.7670193737382579.
Trial 10 finished with value: 0.6796306206334968 and parameters: {'n_components': 5, 'max_depth': 6}. Best is trial 11 with value: 0.7670193737382579.
Trial 3 finished with value: 0.6796888310461777 and parameters: {'n_components': 8, 'max_depth': 19}. Best is trial 11 with value: 0.7670193737382579.
Trial 17 finished with value: 0.7005037810190045 and parameters: {'n_components': 9, 'max_depth': 10}. Best is trial 11 with value: 0.7670193737382579.
Trial 19 finished with value: 0.621167957877848 and parameters: {'n_components': 3, 'max_depth': 14}. Best is trial 11 with value: 0.7670193737382579.
Trial 5 finished with value: 0.6205159294579002 and parameters: {'n_components': 2, 'max_depth': 18}. Best is trial 11 with value: 0.7670193737382579.
Trial 24 finished with value: 0.6101328015287204 and parameters: {'n_components': 5, 'max_depth': 19}. Best is trial 11 with value: 0.7670193737382579.
Trial 25 finished with value: 0.6781928954841743 and parameters: {'n_components': 8, 'max_depth': 17}. Best is trial 11 with value: 0.7670193737382579.
A new study created in RDB with name: PCADecisionTreeRegressor_81528
Trial 2 finished with value: 0.7649568505386313 and parameters: {'n_components': 11, 'max_depth': 4}. Best is trial 2 with value: 0.7649568505386313.
Trial 1 finished with value: 0.6192982157370077 and parameters: {'n_components': 4, 'max_depth': 15}. Best is trial 2 with value: 0.7649568505386313.
Trial 5 finished with value: 0.663285575337734 and parameters: {'n_components': 9, 'max_depth': 2}. Best is trial 2 with value: 0.7649568505386313.
Trial 16 finished with value: 0.6454500239605898 and parameters: {'n_components': 5, 'max_depth': 8}. Best is trial 2 with value: 0.7649568505386313.
Trial 10 finished with value: 0.6305845540334538 and parameters: {'n_components': 6, 'max_depth': 19}. Best is trial 2 with value: 0.7649568505386313.
Trial 0 finished with value: 0.6398906715835652 and parameters: {'n_components': 5, 'max_depth': 20}. Best is trial 2 with value: 0.7649568505386313.
Trial 12 finished with value: 0.6075433946269981 and parameters: {'n_components': 5, 'max_depth': 20}. Best is trial 2 with value: 0.7649568505386313.
Trial 19 finished with value: 0.653285409947469 and parameters: {'n_components': 2, 'max_depth': 10}. Best is trial 2 with value: 0.7649568505386313.
Trial 6 finished with value: 0.6353602546194874 and parameters: {'n_components': 4, 'max_depth': 20}. Best is trial 2 with value: 0.7649568505386313.
Trial 18 finished with value: 0.5380390387858688 and parameters: {'n_components': 1, 'max_depth': 19}. Best is trial 2 with value: 0.7649568505386313.
Trial 15 finished with value: 0.6474819460700585 and parameters: {'n_components': 5, 'max_depth': 12}. Best is trial 2 with value: 0.7649568505386313.
Trial 11 finished with value: 0.6969696745181928 and parameters: {'n_components': 11, 'max_depth': 15}. Best is trial 2 with value: 0.7649568505386313.
Trial 17 finished with value: 0.6206525768753519 and parameters: {'n_components': 6, 'max_depth': 20}. Best is trial 2 with value: 0.7649568505386313.
Trial 8 finished with value: 0.6584094566923926 and parameters: {'n_components': 5, 'max_depth': 9}. Best is trial 2 with value: 0.7649568505386313.
Trial 9 finished with value: 0.6622285145098334 and parameters: {'n_components': 10, 'max_depth': 9}. Best is trial 2 with value: 0.7649568505386313.
Trial 20 finished with value: 0.6542827113867031 and parameters: {'n_components': 8, 'max_depth': 9}. Best is trial 2 with value: 0.7649568505386313.
Trial 21 finished with value: 0.6616380853746663 and parameters: {'n_components': 11, 'max_depth': 20}. Best is trial 2 with value: 0.7649568505386313.
Trial 7 finished with value: 0.6612985718667914 and parameters: {'n_components': 10, 'max_depth': 13}. Best is trial 2 with value: 0.7649568505386313.
Trial 14 finished with value: 0.7375401963130801 and parameters: {'n_components': 2, 'max_depth': 5}. Best is trial 2 with value: 0.7649568505386313.
Trial 3 finished with value: 0.7531322325908963 and parameters: {'n_components': 4, 'max_depth': 3}. Best is trial 2 with value: 0.7649568505386313.
Trial 23 finished with value: 0.5507324189250955 and parameters: {'n_components': 1, 'max_depth': 14}. Best is trial 2 with value: 0.7649568505386313.
Trial 4 finished with value: 0.6282902465691036 and parameters: {'n_components': 8, 'max_depth': 20}. Best is trial 2 with value: 0.7649568505386313.
Trial 13 finished with value: 0.6357686106912749 and parameters: {'n_components': 9, 'max_depth': 13}. Best is trial 2 with value: 0.7649568505386313.
Trial 22 finished with value: 0.6307870840009586 and parameters: {'n_components': 9, 'max_depth': 17}. Best is trial 2 with value: 0.7649568505386313.
Trial 26 finished with value: 0.7206737500904723 and parameters: {'n_components': 9, 'max_depth': 6}. Best is trial 2 with value: 0.7649568505386313.
Trial 25 finished with value: 0.5434713911293243 and parameters: {'n_components': 1, 'max_depth': 18}. Best is trial 2 with value: 0.7649568505386313.
Trial 24 finished with value: 0.7375334303271679 and parameters: {'n_components': 11, 'max_depth': 6}. Best is trial 2 with value: 0.7649568505386313.
Trial 31 finished with value: 0.6285417608156663 and parameters: {'n_components': 2, 'max_depth': 17}. Best is trial 2 with value: 0.7649568505386313.
Trial 34 finished with value: 0.7053717052790649 and parameters: {'n_components': 2, 'max_depth': 6}. Best is trial 2 with value: 0.7649568505386313.
Trial 30 finished with value: 0.616070369684297 and parameters: {'n_components': 8, 'max_depth': 15}. Best is trial 2 with value: 0.7649568505386313.
Trial 29 finished with value: 0.6358880511707014 and parameters: {'n_components': 4, 'max_depth': 13}. Best is trial 2 with value: 0.7649568505386313.
Trial 35 finished with value: 0.6649686644575837 and parameters: {'n_components': 2, 'max_depth': 7}. Best is trial 2 with value: 0.7649568505386313.
