Trial 945 finished with value: 0.10490266568913686 and parameters: {'kernel': 'rbf', 'epsilon': 0.9014294892725426, 'degree': 6, 'C': 0.32966334037469053}. Best is trial 422 with value: 0.7787752748757922.
Trial 947 finished with value: 0.3818263692780892 and parameters: {'kernel': 'linear', 'epsilon': 0.8275113010881574, 'degree': 6, 'C': 0.031308997721819866}. Best is trial 422 with value: 0.7787752748757922.
Trial 946 finished with value: -0.052396058778047774 and parameters: {'kernel': 'poly', 'epsilon': 0.6666264224722606, 'degree': 4, 'C': 0.019095078723536184}. Best is trial 422 with value: 0.7787752748757922.
Trial 953 finished with value: -0.04993706039378879 and parameters: {'kernel': 'poly', 'epsilon': 0.2996185362029685, 'degree': 2, 'C': 0.023276776732053042}. Best is trial 422 with value: 0.7787752748757922.
Trial 950 finished with value: -0.05766178974950511 and parameters: {'kernel': 'linear', 'epsilon': 0.23437856591033346, 'degree': 2, 'C': 0.00020971809111089703}. Best is trial 422 with value: 0.7787752748757922.
Trial 956 finished with value: -0.06271131236019507 and parameters: {'kernel': 'poly', 'epsilon': 0.5509806894638177, 'degree': 6, 'C': 0.0010514891876148601}. Best is trial 422 with value: 0.7787752748757922.
Trial 957 finished with value: -0.06300947023013712 and parameters: {'kernel': 'sigmoid', 'epsilon': 0.567212113748759, 'degree': 5, 'C': 0.0007646828579677185}. Best is trial 422 with value: 0.7787752748757922.
Trial 954 finished with value: 0.6797716936944871 and parameters: {'kernel': 'sigmoid', 'epsilon': 0.7178409065987937, 'degree': 6, 'C': 3.749326507566046}. Best is trial 422 with value: 0.7787752748757922.
Trial 949 finished with value: 0.4463980100683914 and parameters: {'kernel': 'rbf', 'epsilon': 0.6042577033166623, 'degree': 6, 'C': 1.3620093696896576}. Best is trial 422 with value: 0.7787752748757922.
Trial 955 finished with value: 0.07698727871564313 and parameters: {'kernel': 'linear', 'epsilon': 0.4674397353420049, 'degree': 6, 'C': 0.006913368718598465}. Best is trial 422 with value: 0.7787752748757922.
Trial 958 finished with value: -0.0625902897380074 and parameters: {'kernel': 'poly', 'epsilon': 0.31214341454441563, 'degree': 6, 'C': 0.00012424836912470908}. Best is trial 422 with value: 0.7787752748757922.
Trial 952 finished with value: 0.026668873513532677 and parameters: {'kernel': 'linear', 'epsilon': 0.001962578760660305, 'degree': 4, 'C': 0.004270371125851298}. Best is trial 422 with value: 0.7787752748757922.
Trial 959 finished with value: 0.4118324163978663 and parameters: {'kernel': 'rbf', 'epsilon': 0.44861580367372145, 'degree': 3, 'C': 1.226514047094144}. Best is trial 422 with value: 0.7787752748757922.
Trial 951 finished with value: -0.031738420113276156 and parameters: {'kernel': 'linear', 'epsilon': 0.49849257214564036, 'degree': 6, 'C': 0.0014638585730361359}. Best is trial 422 with value: 0.7787752748757922.
Trial 963 finished with value: -0.017933123394575923 and parameters: {'kernel': 'linear', 'epsilon': 0.06334019012436087, 'degree': 4, 'C': 0.002028111602886307}. Best is trial 422 with value: 0.7787752748757922.
Trial 964 finished with value: -0.06222339797181028 and parameters: {'kernel': 'poly', 'epsilon': 0.34614670181882445, 'degree': 4, 'C': 0.0008924520738713975}. Best is trial 422 with value: 0.7787752748757922.
Trial 960 finished with value: -0.031020907935502818 and parameters: {'kernel': 'poly', 'epsilon': 0.2257044148415338, 'degree': 2, 'C': 0.05806888267499402}. Best is trial 422 with value: 0.7787752748757922.
Trial 970 finished with value: -0.05284454454580119 and parameters: {'kernel': 'sigmoid', 'epsilon': 0.2559939694321174, 'degree': 3, 'C': 0.01169876717026022}. Best is trial 422 with value: 0.7787752748757922.
Trial 962 finished with value: -0.05404299405475451 and parameters: {'kernel': 'rbf', 'epsilon': 0.48934510778909135, 'degree': 5, 'C': 0.016006750732402653}. Best is trial 422 with value: 0.7787752748757922.
Trial 961 finished with value: -0.06204902964741332 and parameters: {'kernel': 'poly', 'epsilon': 0.07663577423839474, 'degree': 3, 'C': 0.0001676119881515128}. Best is trial 422 with value: 0.7787752748757922.
Trial 966 finished with value: 0.4222413621405451 and parameters: {'kernel': 'sigmoid', 'epsilon': 0.20201206728579313, 'degree': 3, 'C': 0.9894250145293249}. Best is trial 422 with value: 0.7787752748757922.
Trial 968 finished with value: 0.661320957567155 and parameters: {'kernel': 'sigmoid', 'epsilon': 0.428200197248666, 'degree': 5, 'C': 3.084170787785098}. Best is trial 969 with value: 0.7798586353958561.
Trial 969 finished with value: 0.7798586353958561 and parameters: {'kernel': 'poly', 'epsilon': 0.30460711323351286, 'degree': 2, 'C': 7.541636891908624}. Best is trial 969 with value: 0.7798586353958561.
Trial 967 finished with value: -0.06114612726202606 and parameters: {'kernel': 'rbf', 'epsilon': 0.6646991771009564, 'degree': 3, 'C': 0.00492461085575351}. Best is trial 969 with value: 0.7798586353958561.
Trial 965 finished with value: -0.006710982434589963 and parameters: {'kernel': 'poly', 'epsilon': 0.9166025678496343, 'degree': 4, 'C': 0.09719943227863974}. Best is trial 969 with value: 0.7798586353958561.
Trial 971 finished with value: -0.06203471292596485 and parameters: {'kernel': 'sigmoid', 'epsilon': 0.04895343675188768, 'degree': 6, 'C': 0.00010732141038557617}. Best is trial 969 with value: 0.7798586353958561.
Trial 973 finished with value: 0.37108726082605836 and parameters: {'kernel': 'rbf', 'epsilon': 0.2478073987170989, 'degree': 2, 'C': 1.0765790726659834}. Best is trial 969 with value: 0.7798586353958561.
Trial 975 finished with value: 0.7738186765288637 and parameters: {'kernel': 'linear', 'epsilon': 0.5103875427663521, 'degree': 3, 'C': 2.8529266324436224}. Best is trial 969 with value: 0.7798586353958561.
Trial 979 finished with value: 0.4569124828636607 and parameters: {'kernel': 'poly', 'epsilon': 0.8839767782607918, 'degree': 6, 'C': 1.7051424948680476}. Best is trial 969 with value: 0.7798586353958561.
Trial 977 finished with value: 0.7759585599665328 and parameters: {'kernel': 'linear', 'epsilon': 0.39810610981172345, 'degree': 2, 'C': 1.0880206273722943}. Best is trial 969 with value: 0.7798586353958561.
Trial 976 finished with value: -0.04130980053804406 and parameters: {'kernel': 'linear', 'epsilon': 0.6607487701765379, 'degree': 6, 'C': 0.0010349314029911758}. Best is trial 969 with value: 0.7798586353958561.
Trial 972 finished with value: 0.3448498521994159 and parameters: {'kernel': 'linear', 'epsilon': 0.1606711162117832, 'degree': 4, 'C': 0.026799996696980452}. Best is trial 969 with value: 0.7798586353958561.
Trial 980 finished with value: 0.5874950462326417 and parameters: {'kernel': 'rbf', 'epsilon': 0.739988844254793, 'degree': 4, 'C': 2.222782449177449}. Best is trial 969 with value: 0.7798586353958561.
Trial 982 finished with value: -0.016576877790069368 and parameters: {'kernel': 'linear', 'epsilon': 0.4777179348553293, 'degree': 3, 'C': 0.002159271045327909}. Best is trial 969 with value: 0.7798586353958561.
Trial 978 finished with value: 0.7256347856440574 and parameters: {'kernel': 'sigmoid', 'epsilon': 0.7771487051379504, 'degree': 3, 'C': 7.387749143010059}. Best is trial 969 with value: 0.7798586353958561.
Trial 974 finished with value: -0.061173987348500235 and parameters: {'kernel': 'rbf', 'epsilon': 0.3148874339244744, 'degree': 4, 'C': 0.002551749207423985}. Best is trial 969 with value: 0.7798586353958561.
Trial 987 finished with value: -0.060445219496589084 and parameters: {'kernel': 'rbf', 'epsilon': 0.7643655843845678, 'degree': 2, 'C': 0.0067170530258535525}. Best is trial 969 with value: 0.7798586353958561.
Trial 983 finished with value: 0.19919520991499784 and parameters: {'kernel': 'linear', 'epsilon': 0.12054552759900516, 'degree': 4, 'C': 0.014528270002277481}. Best is trial 969 with value: 0.7798586353958561.
Trial 984 finished with value: -0.060941655451286394 and parameters: {'kernel': 'rbf', 'epsilon': 0.9885293703024803, 'degree': 4, 'C': 0.0070889944917852405}. Best is trial 969 with value: 0.7798586353958561.
Trial 986 finished with value: 0.41632176383361436 and parameters: {'kernel': 'linear', 'epsilon': 0.30092083007294756, 'degree': 3, 'C': 0.03582229095443474}. Best is trial 969 with value: 0.7798586353958561.
Trial 988 finished with value: 0.2343774382863811 and parameters: {'kernel': 'poly', 'epsilon': 0.5922935057717605, 'degree': 6, 'C': 0.6620486604184169}. Best is trial 969 with value: 0.7798586353958561.
Trial 981 finished with value: 0.7662455343095876 and parameters: {'kernel': 'rbf', 'epsilon': 0.09287989918715234, 'degree': 6, 'C': 9.224683938995469}. Best is trial 969 with value: 0.7798586353958561.
Trial 991 finished with value: 0.6739908815316549 and parameters: {'kernel': 'linear', 'epsilon': 0.6161225800163044, 'degree': 2, 'C': 0.11668062503547039}. Best is trial 969 with value: 0.7798586353958561.
Trial 995 finished with value: 0.6688139561223261 and parameters: {'kernel': 'poly', 'epsilon': 0.23652363982756597, 'degree': 3, 'C': 3.685136985108228}. Best is trial 969 with value: 0.7798586353958561.
Trial 989 finished with value: -0.049374438053735814 and parameters: {'kernel': 'sigmoid', 'epsilon': 0.1191005447981005, 'degree': 5, 'C': 0.015486667740726255}. Best is trial 969 with value: 0.7798586353958561.
Trial 992 finished with value: -0.020983917328854528 and parameters: {'kernel': 'linear', 'epsilon': 0.24143144765025182, 'degree': 2, 'C': 0.001894240968634275}. Best is trial 969 with value: 0.7798586353958561.
Trial 985 finished with value: -0.06171321105358659 and parameters: {'kernel': 'poly', 'epsilon': 0.001774764742362045, 'degree': 4, 'C': 0.000623319824806102}. Best is trial 969 with value: 0.7798586353958561.
Trial 996 finished with value: -0.04697302688057718 and parameters: {'kernel': 'poly', 'epsilon': 0.8459244344907045, 'degree': 2, 'C': 0.03233741733589319}. Best is trial 969 with value: 0.7798586353958561.
Trial 999 finished with value: 0.04108723879708799 and parameters: {'kernel': 'sigmoid', 'epsilon': 0.08509850547449638, 'degree': 6, 'C': 0.13474548858618146}. Best is trial 969 with value: 0.7798586353958561.
Trial 1006 finished with value: -0.03672989950300909 and parameters: {'kernel': 'linear', 'epsilon': 0.18474349771581655, 'degree': 4, 'C': 0.001144473119637734}. Best is trial 969 with value: 0.7798586353958561.
Trial 994 finished with value: 0.6759218303520684 and parameters: {'kernel': 'rbf', 'epsilon': 0.10350718271643244, 'degree': 3, 'C': 3.462818173595618}. Best is trial 969 with value: 0.7798586353958561.
Trial 998 finished with value: -0.06377962955709564 and parameters: {'kernel': 'rbf', 'epsilon': 0.6319724724917203, 'degree': 3, 'C': 0.00014101902978485957}. Best is trial 969 with value: 0.7798586353958561.
Trial 990 finished with value: -0.059345791606601195 and parameters: {'kernel': 'rbf', 'epsilon': 0.3153243309073952, 'degree': 4, 'C': 0.005619275104028273}. Best is trial 969 with value: 0.7798586353958561.
Trial 1005 finished with value: -0.0637210188973035 and parameters: {'kernel': 'sigmoid', 'epsilon': 0.876925413941789, 'degree': 3, 'C': 0.0013277895791885953}. Best is trial 969 with value: 0.7798586353958561.
Trial 1000 finished with value: -0.06498552792060988 and parameters: {'kernel': 'poly', 'epsilon': 0.9787645360554368, 'degree': 2, 'C': 0.0001805877168427968}. Best is trial 969 with value: 0.7798586353958561.
Trial 1004 finished with value: -0.061692176238884885 and parameters: {'kernel': 'sigmoid', 'epsilon': 0.3480398051516116, 'degree': 3, 'C': 0.0013528420934977423}. Best is trial 969 with value: 0.7798586353958561.
Trial 993 finished with value: 0.17731689256323283 and parameters: {'kernel': 'linear', 'epsilon': 0.9138083007038603, 'degree': 5, 'C': 0.012958946545586743}. Best is trial 969 with value: 0.7798586353958561.
Trial 1008 finished with value: -0.058642738509793804 and parameters: {'kernel': 'poly', 'epsilon': 0.8486973741028093, 'degree': 4, 'C': 0.009881333576244943}. Best is trial 969 with value: 0.7798586353958561.
Trial 1002 finished with value: 0.11724401059783729 and parameters: {'kernel': 'linear', 'epsilon': 0.9150401386475134, 'degree': 5, 'C': 0.009212024649853387}. Best is trial 969 with value: 0.7798586353958561.
Trial 1003 finished with value: -0.05780594313981398 and parameters: {'kernel': 'poly', 'epsilon': 0.7291790288296371, 'degree': 5, 'C': 0.009189442340090202}. Best is trial 969 with value: 0.7798586353958561.
Trial 1007 finished with value: -0.06047639947140556 and parameters: {'kernel': 'poly', 'epsilon': 0.38849400475959395, 'degree': 3, 'C': 0.003860128118571517}. Best is trial 969 with value: 0.7798586353958561.
Trial 997 finished with value: 0.4693777875951858 and parameters: {'kernel': 'rbf', 'epsilon': 0.39962671082578005, 'degree': 6, 'C': 1.4577952668593264}. Best is trial 969 with value: 0.7798586353958561.
Trial 1009 finished with value: 0.006351847188693816 and parameters: {'kernel': 'poly', 'epsilon': 0.7312663924288282, 'degree': 5, 'C': 0.10700152240238611}. Best is trial 969 with value: 0.7798586353958561.
Trial 1010 finished with value: -0.06201276411923162 and parameters: {'kernel': 'sigmoid', 'epsilon': 0.10272165585832826, 'degree': 2, 'C': 0.00022417420326286357}. Best is trial 969 with value: 0.7798586353958561.
Trial 1001 finished with value: -0.04106158780804696 and parameters: {'kernel': 'poly', 'epsilon': 0.11798099393255157, 'degree': 6, 'C': 0.02554870347214885}. Best is trial 969 with value: 0.7798586353958561.
Trial 1014 finished with value: -0.05056232205787399 and parameters: {'kernel': 'sigmoid', 'epsilon': 0.3565906807321345, 'degree': 4, 'C': 0.015075473333486054}. Best is trial 969 with value: 0.7798586353958561.
Trial 1013 finished with value: 0.76597856776065 and parameters: {'kernel': 'poly', 'epsilon': 0.224829837571749, 'degree': 4, 'C': 8.936432767517294}. Best is trial 969 with value: 0.7798586353958561.
Trial 1015 finished with value: 0.5498567166503824 and parameters: {'kernel': 'linear', 'epsilon': 0.5127285551332553, 'degree': 6, 'C': 0.06102721540284794}. Best is trial 969 with value: 0.7798586353958561.
Trial 1016 finished with value: 0.06198432652098026 and parameters: {'kernel': 'rbf', 'epsilon': 0.1626971760077508, 'degree': 5, 'C': 0.23197378681428643}. Best is trial 969 with value: 0.7798586353958561.
Trial 1022 finished with value: 0.7743039638134951 and parameters: {'kernel': 'linear', 'epsilon': 0.8132462349243524, 'degree': 4, 'C': 5.969643486569105}. Best is trial 969 with value: 0.7798586353958561.
Trial 1017 finished with value: 0.37329188511174155 and parameters: {'kernel': 'linear', 'epsilon': 0.28103689589103, 'degree': 6, 'C': 0.0301978554671857}. Best is trial 969 with value: 0.7798586353958561.
Trial 1018 finished with value: 0.6855051189166639 and parameters: {'kernel': 'linear', 'epsilon': 0.16990490442475115, 'degree': 6, 'C': 0.13441060113584768}. Best is trial 969 with value: 0.7798586353958561.
Trial 1012 finished with value: 0.5694982715614134 and parameters: {'kernel': 'rbf', 'epsilon': 0.48800356704067704, 'degree': 5, 'C': 2.0879926331571315}. Best is trial 969 with value: 0.7798586353958561.
Trial 1024 finished with value: 0.47393431855383367 and parameters: {'kernel': 'poly', 'epsilon': 0.6488136651356124, 'degree': 3, 'C': 1.685823207144919}. Best is trial 969 with value: 0.7798586353958561.
Trial 1019 finished with value: -0.05821296996221326 and parameters: {'kernel': 'rbf', 'epsilon': 0.21105141762514457, 'degree': 6, 'C': 0.006887784176518832}. Best is trial 969 with value: 0.7798586353958561.
Trial 1011 finished with value: -0.05905800978922715 and parameters: {'kernel': 'rbf', 'epsilon': 0.08037671673207292, 'degree': 2, 'C': 0.005117969167073486}. Best is trial 969 with value: 0.7798586353958561.
Trial 1025 finished with value: -0.06472591060107477 and parameters: {'kernel': 'rbf', 'epsilon': 0.9227608125648289, 'degree': 3, 'C': 0.0004388493967492572}. Best is trial 969 with value: 0.7798586353958561.
Trial 1020 finished with value: 0.08145553521921906 and parameters: {'kernel': 'poly', 'epsilon': 0.32041335809351634, 'degree': 5, 'C': 0.2466526056581831}. Best is trial 969 with value: 0.7798586353958561.
Trial 1023 finished with value: -0.05920296037546211 and parameters: {'kernel': 'linear', 'epsilon': 0.38166555485186193, 'degree': 2, 'C': 0.00016494138663277632}. Best is trial 969 with value: 0.7798586353958561.
Trial 1021 finished with value: -0.05382201058874324 and parameters: {'kernel': 'linear', 'epsilon': 0.2893574108790463, 'degree': 3, 'C': 0.0003938378352670239}. Best is trial 969 with value: 0.7798586353958561.
Trial 1027 finished with value: 0.07443020675436048 and parameters: {'kernel': 'rbf', 'epsilon': 0.8651969364836732, 'degree': 6, 'C': 0.26336803814743803}. Best is trial 969 with value: 0.7798586353958561.
Trial 1026 finished with value: 0.4084390507182333 and parameters: {'kernel': 'poly', 'epsilon': 0.43039582829548595, 'degree': 2, 'C': 1.2397583360087014}. Best is trial 969 with value: 0.7798586353958561.
Trial 1028 finished with value: -0.064247644389164 and parameters: {'kernel': 'poly', 'epsilon': 0.7633981116802504, 'degree': 6, 'C': 0.0001253958688408289}. Best is trial 969 with value: 0.7798586353958561.
Trial 1029 finished with value: -0.042018666139544636 and parameters: {'kernel': 'linear', 'epsilon': 0.18580973120692135, 'degree': 2, 'C': 0.0009014565369098609}. Best is trial 969 with value: 0.7798586353958561.
Trial 1030 finished with value: -0.05508856089337026 and parameters: {'kernel': 'sigmoid', 'epsilon': 0.14761582715214117, 'degree': 6, 'C': 0.00861515431582075}. Best is trial 969 with value: 0.7798586353958561.
Trial 1036 finished with value: 0.5693397604492173 and parameters: {'kernel': 'rbf', 'epsilon': 0.31858378855172476, 'degree': 3, 'C': 2.0838956422850385}. Best is trial 969 with value: 0.7798586353958561.
Trial 1035 finished with value: -0.05722003606970614 and parameters: {'kernel': 'sigmoid', 'epsilon': 0.7176743422007538, 'degree': 3, 'C': 0.008635126735418814}. Best is trial 969 with value: 0.7798586353958561.
Trial 1040 finished with value: 0.33543088819381384 and parameters: {'kernel': 'linear', 'epsilon': 0.026937488395631815, 'degree': 5, 'C': 0.02571230994756263}. Best is trial 969 with value: 0.7798586353958561.
Trial 1046 finished with value: -0.06275291544585171 and parameters: {'kernel': 'sigmoid', 'epsilon': 0.3675272442931078, 'degree': 4, 'C': 0.00010948317459557142}. Best is trial 969 with value: 0.7798586353958561.
Trial 1045 finished with value: 0.6036792764403283 and parameters: {'kernel': 'poly', 'epsilon': 0.27074285219835137, 'degree': 2, 'C': 2.285942073783408}. Best is trial 969 with value: 0.7798586353958561.
Trial 1050 finished with value: 0.7227250855917953 and parameters: {'kernel': 'sigmoid', 'epsilon': 0.459839317048654, 'degree': 2, 'C': 6.53016348662188}. Best is trial 969 with value: 0.7798586353958561.
Trial 1044 finished with value: 0.07905561694911153 and parameters: {'kernel': 'linear', 'epsilon': 0.5510717726306018, 'degree': 3, 'C': 0.007028963169260274}. Best is trial 969 with value: 0.7798586353958561.
Trial 1048 finished with value: 0.167676649758916 and parameters: {'kernel': 'poly', 'epsilon': 0.8350970244257209, 'degree': 6, 'C': 0.4391732414548691}. Best is trial 969 with value: 0.7798586353958561.
Trial 1049 finished with value: 0.5693173512073457 and parameters: {'kernel': 'sigmoid', 'epsilon': 0.28007233310693214, 'degree': 3, 'C': 1.8238501133155642}. Best is trial 969 with value: 0.7798586353958561.
Trial 1038 finished with value: -0.04312090383037831 and parameters: {'kernel': 'rbf', 'epsilon': 0.25934629185801306, 'degree': 4, 'C': 0.03300374398212026}. Best is trial 969 with value: 0.7798586353958561.
Trial 1052 finished with value: 0.6810741436685982 and parameters: {'kernel': 'sigmoid', 'epsilon': 0.7145465667753255, 'degree': 2, 'C': 3.8320981480762546}. Best is trial 969 with value: 0.7798586353958561.
Trial 1034 finished with value: 0.1946985717910668 and parameters: {'kernel': 'sigmoid', 'epsilon': 0.5561681457296852, 'degree': 3, 'C': 0.3804260412576489}. Best is trial 969 with value: 0.7798586353958561.
Trial 1043 finished with value: 0.6769893441378672 and parameters: {'kernel': 'sigmoid', 'epsilon': 0.14582148158616892, 'degree': 2, 'C': 3.6949444217253364}. Best is trial 969 with value: 0.7798586353958561.
Trial 1039 finished with value: -0.051225123298093735 and parameters: {'kernel': 'linear', 'epsilon': 0.5410408717636697, 'degree': 4, 'C': 0.0005651464511108798}. Best is trial 969 with value: 0.7798586353958561.
Trial 1042 finished with value: 0.7290749846570798 and parameters: {'kernel': 'sigmoid', 'epsilon': 0.1791310531274768, 'degree': 3, 'C': 8.049160438539081}. Best is trial 969 with value: 0.7798586353958561.
Trial 1047 finished with value: 0.7131670746631535 and parameters: {'kernel': 'rbf', 'epsilon': 0.831227826784008, 'degree': 4, 'C': 4.429351739705707}. Best is trial 969 with value: 0.7798586353958561.
Trial 1041 finished with value: 0.33278345422908934 and parameters: {'kernel': 'poly', 'epsilon': 0.6664439135331642, 'degree': 6, 'C': 1.0673934851797868}. Best is trial 969 with value: 0.7798586353958561.
Trial 1051 finished with value: 0.6640601041085078 and parameters: {'kernel': 'rbf', 'epsilon': 0.3731831395096863, 'degree': 4, 'C': 3.2599233323719954}. Best is trial 969 with value: 0.7798586353958561.
Trial 1053 finished with value: 0.6945783372035284 and parameters: {'kernel': 'sigmoid', 'epsilon': 0.5537036457399444, 'degree': 2, 'C': 4.612097401050235}. Best is trial 969 with value: 0.7798586353958561.
A new study created in RDB with name: DecisionTreeRegressor_859
Trial 0 finished with value: 0.7704003690285397 and parameters: {'max_depth': 6}. Best is trial 0 with value: 0.7704003690285397.
