Trial 422 finished with value: 0.7787752748757922 and parameters: {'kernel': 'poly', 'epsilon': 0.1539959582202335, 'degree': 2, 'C': 7.306292464146345}. Best is trial 422 with value: 0.7787752748757922.
Trial 411 finished with value: 0.30268214715356667 and parameters: {'kernel': 'rbf', 'epsilon': 0.8617735345787462, 'degree': 4, 'C': 0.8264868621667438}. Best is trial 422 with value: 0.7787752748757922.
Trial 425 finished with value: 0.07097975404246333 and parameters: {'kernel': 'rbf', 'epsilon': 0.7238080993989797, 'degree': 6, 'C': 0.2540606796825408}. Best is trial 422 with value: 0.7787752748757922.
Trial 420 finished with value: 0.7674013764363066 and parameters: {'kernel': 'rbf', 'epsilon': 0.6199513981650611, 'degree': 6, 'C': 9.510595004708923}. Best is trial 422 with value: 0.7787752748757922.
Trial 429 finished with value: -0.057767594681554416 and parameters: {'kernel': 'poly', 'epsilon': 0.672635482755647, 'degree': 2, 'C': 0.011723843373892704}. Best is trial 422 with value: 0.7787752748757922.
Trial 427 finished with value: -0.06260882770373223 and parameters: {'kernel': 'poly', 'epsilon': 0.7064671057473614, 'degree': 2, 'C': 0.002874958443519018}. Best is trial 422 with value: 0.7787752748757922.
Trial 428 finished with value: -0.009456490161347109 and parameters: {'kernel': 'rbf', 'epsilon': 0.6675219498206169, 'degree': 4, 'C': 0.09390456353751137}. Best is trial 422 with value: 0.7787752748757922.
Trial 419 finished with value: 0.776332607534934 and parameters: {'kernel': 'linear', 'epsilon': 0.592081821514195, 'degree': 5, 'C': 1.1526414842603017}. Best is trial 422 with value: 0.7787752748757922.
Trial 426 finished with value: 0.7747756516771165 and parameters: {'kernel': 'linear', 'epsilon': 0.4506429588879871, 'degree': 3, 'C': 5.112935646524061}. Best is trial 422 with value: 0.7787752748757922.
Trial 433 finished with value: 0.6736949277634677 and parameters: {'kernel': 'linear', 'epsilon': 0.1942639281521057, 'degree': 6, 'C': 0.11839902741059288}. Best is trial 422 with value: 0.7787752748757922.
Trial 435 finished with value: 0.22171010299372312 and parameters: {'kernel': 'poly', 'epsilon': 0.33598602486587403, 'degree': 5, 'C': 0.6579254907880424}. Best is trial 422 with value: 0.7787752748757922.
Trial 441 finished with value: -0.06156337009336373 and parameters: {'kernel': 'rbf', 'epsilon': 0.5098415625833703, 'degree': 2, 'C': 0.0031528643809058433}. Best is trial 422 with value: 0.7787752748757922.
Trial 431 finished with value: 0.15213084747135738 and parameters: {'kernel': 'sigmoid', 'epsilon': 0.3855626131201957, 'degree': 4, 'C': 0.30231954172892483}. Best is trial 422 with value: 0.7787752748757922.
Trial 430 finished with value: -0.0003719256483579292 and parameters: {'kernel': 'poly', 'epsilon': 0.37642771958939536, 'degree': 2, 'C': 0.1198655965750677}. Best is trial 422 with value: 0.7787752748757922.
Trial 437 finished with value: 0.30487014090726 and parameters: {'kernel': 'poly', 'epsilon': 0.7907270827318257, 'degree': 4, 'C': 0.9092974942729126}. Best is trial 422 with value: 0.7787752748757922.
Trial 443 finished with value: 0.5436694415891408 and parameters: {'kernel': 'sigmoid', 'epsilon': 0.6314962392141585, 'degree': 6, 'C': 1.6311566450601962}. Best is trial 422 with value: 0.7787752748757922.
Trial 434 finished with value: -0.06101783704939055 and parameters: {'kernel': 'rbf', 'epsilon': 0.09563865095272372, 'degree': 4, 'C': 0.001935162280042229}. Best is trial 422 with value: 0.7787752748757922.
Trial 442 finished with value: -0.02966046559311606 and parameters: {'kernel': 'linear', 'epsilon': 0.713229466254087, 'degree': 2, 'C': 0.001577255612051638}. Best is trial 422 with value: 0.7787752748757922.
Trial 445 finished with value: -0.06165469218848404 and parameters: {'kernel': 'sigmoid', 'epsilon': 0.009022120643814913, 'degree': 5, 'C': 0.0005445018466341192}. Best is trial 422 with value: 0.7787752748757922.
Trial 439 finished with value: 0.6162012682537638 and parameters: {'kernel': 'rbf', 'epsilon': 0.14545208034468737, 'degree': 6, 'C': 2.5605850214086683}. Best is trial 422 with value: 0.7787752748757922.
Trial 438 finished with value: -0.05860809384520821 and parameters: {'kernel': 'poly', 'epsilon': 0.629670684063983, 'degree': 4, 'C': 0.008717832877911499}. Best is trial 422 with value: 0.7787752748757922.
Trial 444 finished with value: -0.054605036126394405 and parameters: {'kernel': 'sigmoid', 'epsilon': 0.6036310963630168, 'degree': 4, 'C': 0.01144344015487286}. Best is trial 422 with value: 0.7787752748757922.
Trial 440 finished with value: 0.7745399544464299 and parameters: {'kernel': 'linear', 'epsilon': 0.7732401832975624, 'degree': 3, 'C': 2.1888968194912573}. Best is trial 422 with value: 0.7787752748757922.
Trial 432 finished with value: -0.0596642686660067 and parameters: {'kernel': 'poly', 'epsilon': 0.6620688585422722, 'degree': 5, 'C': 0.006246192950171522}. Best is trial 422 with value: 0.7787752748757922.
Trial 446 finished with value: -0.0604878638798385 and parameters: {'kernel': 'rbf', 'epsilon': 0.7491978284208267, 'degree': 4, 'C': 0.0065709360147014634}. Best is trial 422 with value: 0.7787752748757922.
Trial 436 finished with value: 0.4537521498727955 and parameters: {'kernel': 'linear', 'epsilon': 0.9037230600100399, 'degree': 4, 'C': 0.04152929527341213}. Best is trial 422 with value: 0.7787752748757922.
Trial 449 finished with value: -0.061227589407575424 and parameters: {'kernel': 'rbf', 'epsilon': 0.07161908841146025, 'degree': 2, 'C': 0.001517709271245006}. Best is trial 422 with value: 0.7787752748757922.
Trial 451 finished with value: 0.22577886793519072 and parameters: {'kernel': 'poly', 'epsilon': 0.08697872213864333, 'degree': 3, 'C': 0.6387701013062329}. Best is trial 422 with value: 0.7787752748757922.
Trial 450 finished with value: -0.05662326242282033 and parameters: {'kernel': 'rbf', 'epsilon': 0.2714225215889968, 'degree': 4, 'C': 0.009901043718960013}. Best is trial 422 with value: 0.7787752748757922.
Trial 454 finished with value: 0.3272816911239866 and parameters: {'kernel': 'poly', 'epsilon': 0.45820117851380693, 'degree': 3, 'C': 0.9906417668438087}. Best is trial 422 with value: 0.7787752748757922.
Trial 448 finished with value: 0.6944697572963596 and parameters: {'kernel': 'sigmoid', 'epsilon': 0.6991131523995056, 'degree': 3, 'C': 4.586321554189534}. Best is trial 422 with value: 0.7787752748757922.
Trial 452 finished with value: 0.26802217850457727 and parameters: {'kernel': 'rbf', 'epsilon': 0.688907309466548, 'degree': 3, 'C': 0.7203035334050366}. Best is trial 422 with value: 0.7787752748757922.
Trial 447 finished with value: 0.07784215949805794 and parameters: {'kernel': 'linear', 'epsilon': 0.6044037141328371, 'degree': 2, 'C': 0.006968543502678617}. Best is trial 422 with value: 0.7787752748757922.
Trial 456 finished with value: -0.060724854873170434 and parameters: {'kernel': 'sigmoid', 'epsilon': 0.36039826830758515, 'degree': 6, 'C': 0.0025530154605384265}. Best is trial 422 with value: 0.7787752748757922.
Trial 457 finished with value: -0.002612434513552764 and parameters: {'kernel': 'sigmoid', 'epsilon': 0.1942256578793865, 'degree': 2, 'C': 0.07523417083624416}. Best is trial 422 with value: 0.7787752748757922.
Trial 462 finished with value: -0.062008512491753855 and parameters: {'kernel': 'poly', 'epsilon': 0.11596405719976444, 'degree': 3, 'C': 0.00029890676075217066}. Best is trial 422 with value: 0.7787752748757922.
Trial 467 finished with value: 0.03663454351738691 and parameters: {'kernel': 'sigmoid', 'epsilon': 0.17450585428740162, 'degree': 5, 'C': 0.12843877123864197}. Best is trial 422 with value: 0.7787752748757922.
Trial 464 finished with value: -0.06013345387535131 and parameters: {'kernel': 'linear', 'epsilon': 0.9555809018486163, 'degree': 3, 'C': 0.00021648387580305902}. Best is trial 422 with value: 0.7787752748757922.
Trial 466 finished with value: -0.058330659298802136 and parameters: {'kernel': 'poly', 'epsilon': 0.3913861404851715, 'degree': 3, 'C': 0.00730189111527031}. Best is trial 422 with value: 0.7787752748757922.
Trial 465 finished with value: -0.06341862389673861 and parameters: {'kernel': 'sigmoid', 'epsilon': 0.6613318985026428, 'degree': 6, 'C': 0.0006774812499272218}. Best is trial 422 with value: 0.7787752748757922.
Trial 458 finished with value: -0.05928245892739261 and parameters: {'kernel': 'sigmoid', 'epsilon': 0.15796264413525873, 'degree': 2, 'C': 0.003549223688227241}. Best is trial 422 with value: 0.7787752748757922.
Trial 460 finished with value: -0.06363258691486902 and parameters: {'kernel': 'poly', 'epsilon': 0.6556244518586527, 'degree': 3, 'C': 0.0005111439217440503}. Best is trial 422 with value: 0.7787752748757922.
Trial 459 finished with value: 0.7332243139559289 and parameters: {'kernel': 'rbf', 'epsilon': 0.6007093300471233, 'degree': 2, 'C': 5.2894940810964375}. Best is trial 422 with value: 0.7787752748757922.
Trial 461 finished with value: -0.05662231271037314 and parameters: {'kernel': 'poly', 'epsilon': 0.8094076817126034, 'degree': 2, 'C': 0.01453413732249476}. Best is trial 422 with value: 0.7787752748757922.
Trial 453 finished with value: 0.04057378473428247 and parameters: {'kernel': 'sigmoid', 'epsilon': 0.6351244473533418, 'degree': 2, 'C': 0.13415084045830844}. Best is trial 422 with value: 0.7787752748757922.
Trial 455 finished with value: 0.039048336011699956 and parameters: {'kernel': 'sigmoid', 'epsilon': 0.5387922149112944, 'degree': 5, 'C': 0.13172021761769606}. Best is trial 422 with value: 0.7787752748757922.
Trial 468 finished with value: -0.06315509124665583 and parameters: {'kernel': 'sigmoid', 'epsilon': 0.7468430077182422, 'degree': 6, 'C': 0.0014057452556205901}. Best is trial 422 with value: 0.7787752748757922.
Trial 472 finished with value: -0.06045977396718919 and parameters: {'kernel': 'rbf', 'epsilon': 0.31035592098913745, 'degree': 5, 'C': 0.003706981232528824}. Best is trial 422 with value: 0.7787752748757922.
Trial 463 finished with value: -0.06261918507250452 and parameters: {'kernel': 'sigmoid', 'epsilon': 0.33384576041506187, 'degree': 6, 'C': 0.00018266743571356296}. Best is trial 422 with value: 0.7787752748757922.
Trial 471 finished with value: -0.05293725117185396 and parameters: {'kernel': 'linear', 'epsilon': 0.23683515112804554, 'degree': 2, 'C': 0.00042270448572452943}. Best is trial 422 with value: 0.7787752748757922.
Trial 470 finished with value: 0.41089044849331835 and parameters: {'kernel': 'poly', 'epsilon': 0.6400622837260337, 'degree': 3, 'C': 1.3693566187203805}. Best is trial 422 with value: 0.7787752748757922.
Trial 475 finished with value: -0.06295154570443436 and parameters: {'kernel': 'rbf', 'epsilon': 0.4400789058808078, 'degree': 4, 'C': 0.00026875058801151757}. Best is trial 422 with value: 0.7787752748757922.
Trial 469 finished with value: -0.0435647807765294 and parameters: {'kernel': 'poly', 'epsilon': 0.040658266084512173, 'degree': 3, 'C': 0.029369920637914597}. Best is trial 422 with value: 0.7787752748757922.
Trial 478 finished with value: -0.047832339633495626 and parameters: {'kernel': 'rbf', 'epsilon': 0.6623068326436066, 'degree': 2, 'C': 0.02782716305245171}. Best is trial 422 with value: 0.7787752748757922.
Trial 481 finished with value: -0.03784299152003057 and parameters: {'kernel': 'sigmoid', 'epsilon': 0.8962997189937186, 'degree': 6, 'C': 0.03315627919990811}. Best is trial 422 with value: 0.7787752748757922.
Trial 473 finished with value: -0.024286128389091378 and parameters: {'kernel': 'rbf', 'epsilon': 0.2287586650164345, 'degree': 3, 'C': 0.06551020839682341}. Best is trial 422 with value: 0.7787752748757922.
Trial 486 finished with value: -0.05247686511720843 and parameters: {'kernel': 'rbf', 'epsilon': 0.8640773054768431, 'degree': 6, 'C': 0.020793745928018293}. Best is trial 422 with value: 0.7787752748757922.
Trial 480 finished with value: 0.6416652708509514 and parameters: {'kernel': 'poly', 'epsilon': 0.9044204048980038, 'degree': 6, 'C': 3.8290898831419073}. Best is trial 422 with value: 0.7787752748757922.
Trial 476 finished with value: -0.06303376663835333 and parameters: {'kernel': 'poly', 'epsilon': 0.5537899645587397, 'degree': 2, 'C': 0.0010182796503533256}. Best is trial 422 with value: 0.7787752748757922.
Trial 477 finished with value: 0.2178793932007828 and parameters: {'kernel': 'linear', 'epsilon': 0.750364891833774, 'degree': 4, 'C': 0.0158773630633701}. Best is trial 422 with value: 0.7787752748757922.
Trial 488 finished with value: -0.03492867757962842 and parameters: {'kernel': 'linear', 'epsilon': 0.8585488907430388, 'degree': 5, 'C': 0.0013516118700745987}. Best is trial 422 with value: 0.7787752748757922.
Trial 483 finished with value: -0.06273012358128409 and parameters: {'kernel': 'rbf', 'epsilon': 0.3535920244774352, 'degree': 4, 'C': 0.00014176535164126902}. Best is trial 422 with value: 0.7787752748757922.
Trial 484 finished with value: -0.06388122524927721 and parameters: {'kernel': 'sigmoid', 'epsilon': 0.7744893724582957, 'degree': 6, 'C': 0.0006141751955026665}. Best is trial 422 with value: 0.7787752748757922.
Trial 490 finished with value: -0.0629000303493275 and parameters: {'kernel': 'sigmoid', 'epsilon': 0.43037678138012614, 'degree': 2, 'C': 0.000207043684519169}. Best is trial 422 with value: 0.7787752748757922.
Trial 482 finished with value: -0.052392907627308506 and parameters: {'kernel': 'poly', 'epsilon': 0.3142981111563603, 'degree': 4, 'C': 0.016490323019045534}. Best is trial 422 with value: 0.7787752748757922.
Trial 485 finished with value: -0.03916962417661167 and parameters: {'kernel': 'sigmoid', 'epsilon': 0.054684741309060314, 'degree': 6, 'C': 0.027775974539944105}. Best is trial 422 with value: 0.7787752748757922.
Trial 479 finished with value: 0.7671155892405798 and parameters: {'kernel': 'poly', 'epsilon': 0.2493965495611803, 'degree': 2, 'C': 5.951892416168578}. Best is trial 422 with value: 0.7787752748757922.
Trial 474 finished with value: 0.6609181315896878 and parameters: {'kernel': 'rbf', 'epsilon': 0.5574472134656477, 'degree': 6, 'C': 3.2104883505197743}. Best is trial 422 with value: 0.7787752748757922.
Trial 491 finished with value: 0.24049610379868386 and parameters: {'kernel': 'rbf', 'epsilon': 0.9093024826102537, 'degree': 4, 'C': 0.6506501647359393}. Best is trial 422 with value: 0.7787752748757922.
Trial 493 finished with value: -0.06205561828983032 and parameters: {'kernel': 'poly', 'epsilon': 0.5632022556681401, 'degree': 5, 'C': 0.0022271512681096848}. Best is trial 422 with value: 0.7787752748757922.
Trial 494 finished with value: -0.05276167239012669 and parameters: {'kernel': 'sigmoid', 'epsilon': 0.7637694048320439, 'degree': 3, 'C': 0.014309592220482208}. Best is trial 422 with value: 0.7787752748757922.
Trial 495 finished with value: 0.034538894153141084 and parameters: {'kernel': 'linear', 'epsilon': 0.8688946071515953, 'degree': 6, 'C': 0.004689085402453028}. Best is trial 422 with value: 0.7787752748757922.
Trial 487 finished with value: 0.20267905213968165 and parameters: {'kernel': 'linear', 'epsilon': 0.5224781636275939, 'degree': 6, 'C': 0.014741862934929453}. Best is trial 422 with value: 0.7787752748757922.
Trial 496 finished with value: 0.6826345310780877 and parameters: {'kernel': 'linear', 'epsilon': 0.8679931467568097, 'degree': 6, 'C': 0.12913204836752393}. Best is trial 422 with value: 0.7787752748757922.
Trial 489 finished with value: -0.056053447845880996 and parameters: {'kernel': 'sigmoid', 'epsilon': 0.699636518917265, 'degree': 3, 'C': 0.010025009538342214}. Best is trial 422 with value: 0.7787752748757922.
Trial 492 finished with value: 0.7597839719197189 and parameters: {'kernel': 'rbf', 'epsilon': 0.11912363910383639, 'degree': 3, 'C': 7.945372409428459}. Best is trial 422 with value: 0.7787752748757922.
Trial 500 finished with value: -0.031194399821004602 and parameters: {'kernel': 'sigmoid', 'epsilon': 0.09528791757242805, 'degree': 5, 'C': 0.03792626168374043}. Best is trial 422 with value: 0.7787752748757922.
Trial 498 finished with value: 0.773207549158978 and parameters: {'kernel': 'linear', 'epsilon': 0.3499636767812433, 'degree': 4, 'C': 0.7049308923476477}. Best is trial 422 with value: 0.7787752748757922.
Trial 497 finished with value: 0.2102736299955247 and parameters: {'kernel': 'sigmoid', 'epsilon': 0.47521359021091314, 'degree': 2, 'C': 0.41215741818517937}. Best is trial 422 with value: 0.7787752748757922.
Trial 499 finished with value: -0.040203772549651275 and parameters: {'kernel': 'sigmoid', 'epsilon': 0.8317091711724484, 'degree': 2, 'C': 0.02995388372307163}. Best is trial 422 with value: 0.7787752748757922.
Trial 506 finished with value: -0.01133813891247929 and parameters: {'kernel': 'sigmoid', 'epsilon': 0.6288633543996466, 'degree': 4, 'C': 0.06583213592035214}. Best is trial 422 with value: 0.7787752748757922.
Trial 501 finished with value: -0.0481709434314632 and parameters: {'kernel': 'poly', 'epsilon': 0.04905215438585253, 'degree': 4, 'C': 0.022274807826141586}. Best is trial 422 with value: 0.7787752748757922.
Trial 507 finished with value: -0.05535792801098395 and parameters: {'kernel': 'linear', 'epsilon': 0.39878672226022693, 'degree': 4, 'C': 0.00034301628411184887}. Best is trial 422 with value: 0.7787752748757922.
Trial 511 finished with value: 0.759433666641538 and parameters: {'kernel': 'linear', 'epsilon': 0.44848450025914144, 'degree': 3, 'C': 0.38261573805076776}. Best is trial 422 with value: 0.7787752748757922.
Trial 508 finished with value: 0.24871363316631742 and parameters: {'kernel': 'linear', 'epsilon': 0.6441223787094077, 'degree': 5, 'C': 0.018430040104779416}. Best is trial 422 with value: 0.7787752748757922.
Trial 504 finished with value: 0.43794979423093566 and parameters: {'kernel': 'poly', 'epsilon': 0.9409844009642361, 'degree': 5, 'C': 1.6845367109757332}. Best is trial 422 with value: 0.7787752748757922.
Trial 503 finished with value: -0.01208824213016092 and parameters: {'kernel': 'linear', 'epsilon': 0.5883540990227565, 'degree': 4, 'C': 0.002382879234811058}. Best is trial 422 with value: 0.7787752748757922.
Trial 502 finished with value: 0.7753256342997696 and parameters: {'kernel': 'linear', 'epsilon': 0.439501864962329, 'degree': 6, 'C': 4.082561150412607}. Best is trial 422 with value: 0.7787752748757922.
Trial 505 finished with value: 0.165313255781177 and parameters: {'kernel': 'linear', 'epsilon': 0.6701167772395078, 'degree': 6, 'C': 0.012068727024900864}. Best is trial 422 with value: 0.7787752748757922.
Trial 512 finished with value: -0.06467950274684586 and parameters: {'kernel': 'poly', 'epsilon': 0.9268074594970117, 'degree': 2, 'C': 0.0005652462268653448}. Best is trial 422 with value: 0.7787752748757922.
Trial 509 finished with value: 0.6539804687856087 and parameters: {'kernel': 'poly', 'epsilon': 0.34763415186458413, 'degree': 5, 'C': 4.1791213939004015}. Best is trial 422 with value: 0.7787752748757922.
Trial 514 finished with value: 0.6666096835035057 and parameters: {'kernel': 'sigmoid', 'epsilon': 0.15935348364860058, 'degree': 2, 'C': 3.253989786705419}. Best is trial 422 with value: 0.7787752748757922.
Trial 510 finished with value: -0.032916613508358075 and parameters: {'kernel': 'sigmoid', 'epsilon': 0.47998029233365436, 'degree': 6, 'C': 0.038080920572225875}. Best is trial 422 with value: 0.7787752748757922.
Trial 517 finished with value: -0.05160449298234494 and parameters: {'kernel': 'poly', 'epsilon': 0.9759669247221465, 'degree': 5, 'C': 0.01935831295114701}. Best is trial 422 with value: 0.7787752748757922.
Trial 519 finished with value: -0.06180664629012337 and parameters: {'kernel': 'sigmoid', 'epsilon': 0.4589716347727675, 'degree': 6, 'C': 0.001693503825205814}. Best is trial 422 with value: 0.7787752748757922.
Trial 513 finished with value: 0.4076132026151549 and parameters: {'kernel': 'sigmoid', 'epsilon': 0.7924107801051009, 'degree': 2, 'C': 0.9391633677529322}. Best is trial 422 with value: 0.7787752748757922.
Trial 516 finished with value: -0.0595864569658728 and parameters: {'kernel': 'linear', 'epsilon': 0.831395365476186, 'degree': 6, 'C': 0.0002278172306886444}. Best is trial 422 with value: 0.7787752748757922.
Trial 520 finished with value: 0.6517047613030288 and parameters: {'kernel': 'sigmoid', 'epsilon': 0.24678582383064096, 'degree': 3, 'C': 2.839844102304405}. Best is trial 422 with value: 0.7787752748757922.
Trial 515 finished with value: -0.061120664219200274 and parameters: {'kernel': 'rbf', 'epsilon': 0.47625461310848627, 'degree': 4, 'C': 0.0036596839045833145}. Best is trial 422 with value: 0.7787752748757922.
Trial 523 finished with value: 0.775329573215612 and parameters: {'kernel': 'linear', 'epsilon': 0.15954977917986235, 'degree': 3, 'C': 8.312790159087642}. Best is trial 422 with value: 0.7787752748757922.
Trial 518 finished with value: -0.06215199001369456 and parameters: {'kernel': 'rbf', 'epsilon': 0.23617053720237402, 'degree': 6, 'C': 0.0004787201618822812}. Best is trial 422 with value: 0.7787752748757922.
Trial 524 finished with value: 0.14235442955099462 and parameters: {'kernel': 'rbf', 'epsilon': 0.796937367688785, 'degree': 6, 'C': 0.41590020778621734}. Best is trial 422 with value: 0.7787752748757922.
Trial 521 finished with value: -0.016688587610538007 and parameters: {'kernel': 'linear', 'epsilon': 0.23220304795603464, 'degree': 5, 'C': 0.0020993319273764368}. Best is trial 422 with value: 0.7787752748757922.
Trial 534 finished with value: 0.1783613095083203 and parameters: {'kernel': 'sigmoid', 'epsilon': 0.7656596299544534, 'degree': 2, 'C': 0.3502304337405167}. Best is trial 422 with value: 0.7787752748757922.
Trial 528 finished with value: 0.010502087115190484 and parameters: {'kernel': 'sigmoid', 'epsilon': 0.8960319592530077, 'degree': 6, 'C': 0.09458235349070071}. Best is trial 422 with value: 0.7787752748757922.
