Trial 632 finished with value: -0.05844438212850942 and parameters: {'kernel': 'rbf', 'epsilon': 0.09394523039113378, 'degree': 4, 'C': 0.006161675922850034}. Best is trial 422 with value: 0.7787752748757922.
Trial 628 finished with value: -0.05000829558915868 and parameters: {'kernel': 'poly', 'epsilon': 0.3430002929496716, 'degree': 3, 'C': 0.02062587978857477}. Best is trial 422 with value: 0.7787752748757922.
Trial 624 finished with value: -0.0641142201439488 and parameters: {'kernel': 'poly', 'epsilon': 0.7385812241725913, 'degree': 2, 'C': 0.0002811211879593201}. Best is trial 422 with value: 0.7787752748757922.
Trial 637 finished with value: -0.06112360710299465 and parameters: {'kernel': 'linear', 'epsilon': 0.6479236455158343, 'degree': 2, 'C': 0.00012841425885113002}. Best is trial 422 with value: 0.7787752748757922.
Trial 626 finished with value: -0.06199019242971354 and parameters: {'kernel': 'sigmoid', 'epsilon': 0.9262523149146297, 'degree': 4, 'C': 0.0035885780484378863}. Best is trial 422 with value: 0.7787752748757922.
Trial 642 finished with value: -0.06021919995495094 and parameters: {'kernel': 'sigmoid', 'epsilon': 0.15560211013129055, 'degree': 5, 'C': 0.002420300259011608}. Best is trial 422 with value: 0.7787752748757922.
Trial 635 finished with value: -0.062407230684111206 and parameters: {'kernel': 'sigmoid', 'epsilon': 0.3435076517109614, 'degree': 3, 'C': 0.0004681680422056841}. Best is trial 422 with value: 0.7787752748757922.
Trial 643 finished with value: 0.129628035240648 and parameters: {'kernel': 'sigmoid', 'epsilon': 0.37999860448761325, 'degree': 4, 'C': 0.2659680581775563}. Best is trial 422 with value: 0.7787752748757922.
Trial 636 finished with value: -0.06185776178411155 and parameters: {'kernel': 'rbf', 'epsilon': 0.429033385706716, 'degree': 5, 'C': 0.0020573250130460313}. Best is trial 422 with value: 0.7787752748757922.
Trial 640 finished with value: -0.06390582929254539 and parameters: {'kernel': 'rbf', 'epsilon': 0.8518581546620608, 'degree': 2, 'C': 0.0013525072069016807}. Best is trial 422 with value: 0.7787752748757922.
Trial 652 finished with value: -0.060776457149342336 and parameters: {'kernel': 'sigmoid', 'epsilon': 0.43086025875520917, 'degree': 6, 'C': 0.002814535394391879}. Best is trial 422 with value: 0.7787752748757922.
Trial 638 finished with value: 0.07771519831896494 and parameters: {'kernel': 'poly', 'epsilon': 0.7353270126307239, 'degree': 2, 'C': 0.2840557651065033}. Best is trial 422 with value: 0.7787752748757922.
Trial 648 finished with value: -0.06348115543656083 and parameters: {'kernel': 'poly', 'epsilon': 0.5744814923935448, 'degree': 6, 'C': 0.0002174241485536953}. Best is trial 422 with value: 0.7787752748757922.
Trial 647 finished with value: 0.47273515866966254 and parameters: {'kernel': 'poly', 'epsilon': 0.3228309198349617, 'degree': 3, 'C': 1.687899098974589}. Best is trial 422 with value: 0.7787752748757922.
Trial 651 finished with value: 0.5078384338602135 and parameters: {'kernel': 'sigmoid', 'epsilon': 0.977361993853207, 'degree': 2, 'C': 1.422262601441553}. Best is trial 422 with value: 0.7787752748757922.
Trial 645 finished with value: -0.05962418526989385 and parameters: {'kernel': 'linear', 'epsilon': 0.5436905606584997, 'degree': 6, 'C': 0.0001781325655246905}. Best is trial 422 with value: 0.7787752748757922.
Trial 655 finished with value: 0.4833031732232471 and parameters: {'kernel': 'sigmoid', 'epsilon': 0.6535577851331807, 'degree': 2, 'C': 1.2813069377099542}. Best is trial 422 with value: 0.7787752748757922.
Trial 646 finished with value: 0.47008106825541096 and parameters: {'kernel': 'linear', 'epsilon': 0.6316932604173642, 'degree': 5, 'C': 0.0443516137012687}. Best is trial 422 with value: 0.7787752748757922.
Trial 639 finished with value: 0.717462477534775 and parameters: {'kernel': 'sigmoid', 'epsilon': 0.5403656738851148, 'degree': 2, 'C': 5.97301661367262}. Best is trial 422 with value: 0.7787752748757922.
Trial 650 finished with value: 0.17906928465869903 and parameters: {'kernel': 'poly', 'epsilon': 0.5494701390659604, 'degree': 6, 'C': 0.4758843238369987}. Best is trial 422 with value: 0.7787752748757922.
Trial 641 finished with value: -0.03282625867570702 and parameters: {'kernel': 'rbf', 'epsilon': 0.4463739141730052, 'degree': 2, 'C': 0.052748996074750226}. Best is trial 422 with value: 0.7787752748757922.
Trial 649 finished with value: -0.06062749504861823 and parameters: {'kernel': 'rbf', 'epsilon': 0.6126154483853116, 'degree': 5, 'C': 0.005508049788408645}. Best is trial 422 with value: 0.7787752748757922.
Trial 654 finished with value: -0.05138291432308632 and parameters: {'kernel': 'sigmoid', 'epsilon': 0.23416196738361983, 'degree': 6, 'C': 0.013377945928902773}. Best is trial 422 with value: 0.7787752748757922.
Trial 656 finished with value: 0.7760946149769596 and parameters: {'kernel': 'linear', 'epsilon': 0.9742166014144651, 'degree': 5, 'C': 3.99480882000836}. Best is trial 422 with value: 0.7787752748757922.
Trial 657 finished with value: -0.06239346327869906 and parameters: {'kernel': 'poly', 'epsilon': 0.26697396927130235, 'degree': 2, 'C': 0.00023423066461121295}. Best is trial 422 with value: 0.7787752748757922.
Trial 653 finished with value: -0.038920652250174194 and parameters: {'kernel': 'rbf', 'epsilon': 0.9596567691969338, 'degree': 2, 'C': 0.04392805098974189}. Best is trial 422 with value: 0.7787752748757922.
Trial 644 finished with value: 0.7737898144624931 and parameters: {'kernel': 'linear', 'epsilon': 0.6928464164087162, 'degree': 5, 'C': 2.7661349184971886}. Best is trial 422 with value: 0.7787752748757922.
Trial 658 finished with value: -0.04491548887775644 and parameters: {'kernel': 'sigmoid', 'epsilon': 0.20986756091915126, 'degree': 2, 'C': 0.021105925964938505}. Best is trial 422 with value: 0.7787752748757922.
Trial 662 finished with value: -0.06411806434042497 and parameters: {'kernel': 'sigmoid', 'epsilon': 0.754995796022808, 'degree': 3, 'C': 0.00025492723389671277}. Best is trial 422 with value: 0.7787752748757922.
Trial 669 finished with value: -0.0636989452955677 and parameters: {'kernel': 'rbf', 'epsilon': 0.6407774380328195, 'degree': 2, 'C': 0.00033444956443678465}. Best is trial 422 with value: 0.7787752748757922.
Trial 665 finished with value: 0.76048888892785 and parameters: {'kernel': 'linear', 'epsilon': 0.4823429553820092, 'degree': 2, 'C': 0.4444143216928759}. Best is trial 422 with value: 0.7787752748757922.
Trial 666 finished with value: -0.017405490279498094 and parameters: {'kernel': 'poly', 'epsilon': 0.884005030735408, 'degree': 5, 'C': 0.06969974324242792}. Best is trial 422 with value: 0.7787752748757922.
Trial 667 finished with value: 0.37346820629782523 and parameters: {'kernel': 'rbf', 'epsilon': 0.20312870505139757, 'degree': 3, 'C': 1.0857202132189003}. Best is trial 422 with value: 0.7787752748757922.
Trial 664 finished with value: -0.023728553061023817 and parameters: {'kernel': 'rbf', 'epsilon': 0.0504092477436795, 'degree': 3, 'C': 0.06609988705320162}. Best is trial 422 with value: 0.7787752748757922.
Trial 660 finished with value: 0.5575240163098343 and parameters: {'kernel': 'linear', 'epsilon': 0.41346280225471, 'degree': 5, 'C': 0.06273794078496668}. Best is trial 422 with value: 0.7787752748757922.
Trial 673 finished with value: -0.05938908855095569 and parameters: {'kernel': 'linear', 'epsilon': 0.16733790914932178, 'degree': 2, 'C': 0.0001258453765677238}. Best is trial 422 with value: 0.7787752748757922.
Trial 668 finished with value: 0.10534620371888133 and parameters: {'kernel': 'linear', 'epsilon': 0.021149709253757254, 'degree': 2, 'C': 0.008384452736306731}. Best is trial 422 with value: 0.7787752748757922.
Trial 663 finished with value: 0.6903988035638973 and parameters: {'kernel': 'linear', 'epsilon': 0.48582301046554643, 'degree': 2, 'C': 0.14007791780132337}. Best is trial 422 with value: 0.7787752748757922.
Trial 675 finished with value: 0.006366872015667014 and parameters: {'kernel': 'poly', 'epsilon': 0.1807843214297027, 'degree': 6, 'C': 0.09072002507704467}. Best is trial 422 with value: 0.7787752748757922.
Trial 670 finished with value: -0.049511928585372345 and parameters: {'kernel': 'sigmoid', 'epsilon': 0.7477569100975993, 'degree': 6, 'C': 0.01821709561466786}. Best is trial 422 with value: 0.7787752748757922.
Trial 674 finished with value: 0.4194946536140349 and parameters: {'kernel': 'linear', 'epsilon': 0.9577747153844174, 'degree': 3, 'C': 0.03640884065672372}. Best is trial 422 with value: 0.7787752748757922.
Trial 659 finished with value: -0.05186099549432852 and parameters: {'kernel': 'linear', 'epsilon': 0.2025293701191645, 'degree': 4, 'C': 0.00046480234534328516}. Best is trial 422 with value: 0.7787752748757922.
Trial 661 finished with value: -0.06269124943204174 and parameters: {'kernel': 'rbf', 'epsilon': 0.326376051377147, 'degree': 5, 'C': 0.00010148505374510638}. Best is trial 422 with value: 0.7787752748757922.
Trial 671 finished with value: 0.026441988609824885 and parameters: {'kernel': 'linear', 'epsilon': 0.9341123835267868, 'degree': 2, 'C': 0.004281852854099434}. Best is trial 422 with value: 0.7787752748757922.
Trial 677 finished with value: -0.05083873213707415 and parameters: {'kernel': 'linear', 'epsilon': 0.6389990524320927, 'degree': 2, 'C': 0.000600504223397524}. Best is trial 422 with value: 0.7787752748757922.
Trial 682 finished with value: 0.3129349589028842 and parameters: {'kernel': 'linear', 'epsilon': 0.07099225188113178, 'degree': 6, 'C': 0.023690236338789694}. Best is trial 422 with value: 0.7787752748757922.
Trial 672 finished with value: 0.7741185545730763 and parameters: {'kernel': 'linear', 'epsilon': 0.4546917322872859, 'degree': 3, 'C': 2.374389869498715}. Best is trial 422 with value: 0.7787752748757922.
Trial 679 finished with value: 0.6814637502127724 and parameters: {'kernel': 'sigmoid', 'epsilon': 0.3295439160943566, 'degree': 2, 'C': 3.9689255303938844}. Best is trial 422 with value: 0.7787752748757922.
Trial 681 finished with value: 0.6039490186216759 and parameters: {'kernel': 'linear', 'epsilon': 0.04295834617267824, 'degree': 2, 'C': 0.07757447010428699}. Best is trial 422 with value: 0.7787752748757922.
Trial 680 finished with value: -0.06443636353594182 and parameters: {'kernel': 'rbf', 'epsilon': 0.8802564876403314, 'degree': 6, 'C': 0.0006555074959054134}. Best is trial 422 with value: 0.7787752748757922.
Trial 678 finished with value: 0.7277078062925352 and parameters: {'kernel': 'poly', 'epsilon': 0.06954044780057711, 'degree': 6, 'C': 8.646291725161646}. Best is trial 422 with value: 0.7787752748757922.
Trial 683 finished with value: 0.14750504646879933 and parameters: {'kernel': 'poly', 'epsilon': 0.16513664622913626, 'degree': 5, 'C': 0.4160334648497154}. Best is trial 422 with value: 0.7787752748757922.
Trial 676 finished with value: 0.4751678542381857 and parameters: {'kernel': 'rbf', 'epsilon': 0.07311351669878341, 'degree': 2, 'C': 1.4829162072926745}. Best is trial 422 with value: 0.7787752748757922.
Trial 684 finished with value: -0.058771913077498995 and parameters: {'kernel': 'rbf', 'epsilon': 0.4079891091300255, 'degree': 5, 'C': 0.007153308779638839}. Best is trial 422 with value: 0.7787752748757922.
Trial 689 finished with value: -0.06319128464537174 and parameters: {'kernel': 'rbf', 'epsilon': 0.6231813020799067, 'degree': 6, 'C': 0.0011063991603386906}. Best is trial 422 with value: 0.7787752748757922.
Trial 688 finished with value: 0.032850708892852486 and parameters: {'kernel': 'rbf', 'epsilon': 0.8846193523935706, 'degree': 5, 'C': 0.17579532670615886}. Best is trial 422 with value: 0.7787752748757922.
Trial 685 finished with value: 0.7246828502092402 and parameters: {'kernel': 'sigmoid', 'epsilon': 0.02748485735474493, 'degree': 4, 'C': 6.753883586208987}. Best is trial 422 with value: 0.7787752748757922.
Trial 686 finished with value: 0.7740919846999335 and parameters: {'kernel': 'linear', 'epsilon': 0.7227884513176027, 'degree': 5, 'C': 3.529410961110257}. Best is trial 422 with value: 0.7787752748757922.
Trial 691 finished with value: -0.05444154372164266 and parameters: {'kernel': 'linear', 'epsilon': 0.10857978419610947, 'degree': 2, 'C': 0.0003444469844880097}. Best is trial 422 with value: 0.7787752748757922.
Trial 687 finished with value: -0.005471019771848218 and parameters: {'kernel': 'rbf', 'epsilon': 0.6793734074955403, 'degree': 6, 'C': 0.10107401538578221}. Best is trial 422 with value: 0.7787752748757922.
Trial 692 finished with value: 0.23099001733099428 and parameters: {'kernel': 'sigmoid', 'epsilon': 0.6271568351843583, 'degree': 6, 'C': 0.4542129329417838}. Best is trial 422 with value: 0.7787752748757922.
Trial 690 finished with value: 0.6232776933344268 and parameters: {'kernel': 'linear', 'epsilon': 0.3115819987833881, 'degree': 2, 'C': 0.08463695370280439}. Best is trial 422 with value: 0.7787752748757922.
Trial 694 finished with value: 0.721778870061504 and parameters: {'kernel': 'sigmoid', 'epsilon': 0.0021289002287480097, 'degree': 2, 'C': 9.621621254814315}. Best is trial 422 with value: 0.7787752748757922.
Trial 702 finished with value: -0.03787884238250862 and parameters: {'kernel': 'rbf', 'epsilon': 0.2647473781021292, 'degree': 5, 'C': 0.04224865419419353}. Best is trial 422 with value: 0.7787752748757922.
Trial 697 finished with value: -0.011003594579939924 and parameters: {'kernel': 'poly', 'epsilon': 0.08776400854444966, 'degree': 3, 'C': 0.08584392213465626}. Best is trial 422 with value: 0.7787752748757922.
Trial 698 finished with value: 0.4509710918049925 and parameters: {'kernel': 'sigmoid', 'epsilon': 0.1028820100283766, 'degree': 2, 'C': 1.1114670129086213}. Best is trial 422 with value: 0.7787752748757922.
Trial 693 finished with value: 0.7742628388351346 and parameters: {'kernel': 'linear', 'epsilon': 0.0670705467516608, 'degree': 2, 'C': 2.9792047691414085}. Best is trial 422 with value: 0.7787752748757922.
Trial 706 finished with value: -0.05354293028568715 and parameters: {'kernel': 'poly', 'epsilon': 0.7206012540349623, 'degree': 6, 'C': 0.013067493892462848}. Best is trial 422 with value: 0.7787752748757922.
Trial 695 finished with value: -0.05007783921160541 and parameters: {'kernel': 'sigmoid', 'epsilon': 0.8604740489254405, 'degree': 5, 'C': 0.01783902172048214}. Best is trial 422 with value: 0.7787752748757922.
Trial 700 finished with value: 0.5788562018868564 and parameters: {'kernel': 'sigmoid', 'epsilon': 0.7299277796203217, 'degree': 2, 'C': 1.9036489764200402}. Best is trial 422 with value: 0.7787752748757922.
Trial 703 finished with value: 0.7601430954084499 and parameters: {'kernel': 'linear', 'epsilon': 0.4442808775963042, 'degree': 3, 'C': 0.43525020174974705}. Best is trial 422 with value: 0.7787752748757922.
Trial 696 finished with value: -0.03493966261826605 and parameters: {'kernel': 'sigmoid', 'epsilon': 0.2848694339524628, 'degree': 6, 'C': 0.03406121650189101}. Best is trial 422 with value: 0.7787752748757922.
Trial 701 finished with value: 0.774886656965237 and parameters: {'kernel': 'linear', 'epsilon': 0.8113055957630051, 'degree': 5, 'C': 0.9349701882858157}. Best is trial 422 with value: 0.7787752748757922.
Trial 705 finished with value: -0.03314881589025094 and parameters: {'kernel': 'sigmoid', 'epsilon': 0.8992619635516477, 'degree': 5, 'C': 0.03901718021477163}. Best is trial 422 with value: 0.7787752748757922.
Trial 709 finished with value: 0.042829127726620786 and parameters: {'kernel': 'sigmoid', 'epsilon': 0.13356955302531393, 'degree': 3, 'C': 0.1369965766007121}. Best is trial 422 with value: 0.7787752748757922.
Trial 704 finished with value: 0.18748379525894637 and parameters: {'kernel': 'poly', 'epsilon': 0.9011961722103821, 'degree': 2, 'C': 0.5561509734111773}. Best is trial 422 with value: 0.7787752748757922.
Trial 711 finished with value: -0.060167269683036886 and parameters: {'kernel': 'sigmoid', 'epsilon': 0.7975491145435861, 'degree': 4, 'C': 0.005293911941232539}. Best is trial 422 with value: 0.7787752748757922.
Trial 716 finished with value: -0.06278028810280578 and parameters: {'kernel': 'poly', 'epsilon': 0.9939026866539231, 'degree': 5, 'C': 0.0033703799111823676}. Best is trial 422 with value: 0.7787752748757922.
Trial 714 finished with value: -0.059556913917345834 and parameters: {'kernel': 'sigmoid', 'epsilon': 0.17861787084749858, 'degree': 2, 'C': 0.0032595441476753867}. Best is trial 422 with value: 0.7787752748757922.
Trial 699 finished with value: -0.05228621094196675 and parameters: {'kernel': 'linear', 'epsilon': 0.7170631581427824, 'degree': 5, 'C': 0.0005432911301924084}. Best is trial 422 with value: 0.7787752748757922.
Trial 707 finished with value: -0.06132122365491395 and parameters: {'kernel': 'linear', 'epsilon': 0.6501590057860712, 'degree': 6, 'C': 0.00011962805864973615}. Best is trial 422 with value: 0.7787752748757922.
Trial 715 finished with value: -0.04675530428433492 and parameters: {'kernel': 'poly', 'epsilon': 0.32875884955850454, 'degree': 3, 'C': 0.025842413685676385}. Best is trial 422 with value: 0.7787752748757922.
Trial 712 finished with value: 0.24188964202661783 and parameters: {'kernel': 'sigmoid', 'epsilon': 0.14815549033271136, 'degree': 6, 'C': 0.4796167007088888}. Best is trial 422 with value: 0.7787752748757922.
Trial 708 finished with value: 0.6924147429697204 and parameters: {'kernel': 'poly', 'epsilon': 0.04605231046571434, 'degree': 6, 'C': 5.562592607300404}. Best is trial 422 with value: 0.7787752748757922.
Trial 710 finished with value: -0.06478877673118312 and parameters: {'kernel': 'poly', 'epsilon': 0.9035774383642755, 'degree': 3, 'C': 0.00021577235571935217}. Best is trial 422 with value: 0.7787752748757922.
Trial 718 finished with value: -0.0628994438646113 and parameters: {'kernel': 'sigmoid', 'epsilon': 0.9486309696425438, 'degree': 3, 'C': 0.00253394129869324}. Best is trial 422 with value: 0.7787752748757922.
Trial 720 finished with value: -0.05636457002730314 and parameters: {'kernel': 'sigmoid', 'epsilon': 0.9431308536281348, 'degree': 3, 'C': 0.01041733087251207}. Best is trial 422 with value: 0.7787752748757922.
Trial 713 finished with value: -0.013971436594186593 and parameters: {'kernel': 'rbf', 'epsilon': 0.3237822191530596, 'degree': 3, 'C': 0.08452891683908706}. Best is trial 422 with value: 0.7787752748757922.
Trial 717 finished with value: -0.06458861281155917 and parameters: {'kernel': 'sigmoid', 'epsilon': 0.8801343825658531, 'degree': 3, 'C': 0.00028192531772361563}. Best is trial 422 with value: 0.7787752748757922.
Trial 724 finished with value: 0.6908895316014287 and parameters: {'kernel': 'linear', 'epsilon': 0.3653633778894835, 'degree': 2, 'C': 0.14296532933842865}. Best is trial 422 with value: 0.7787752748757922.
Trial 719 finished with value: -0.06205096327805228 and parameters: {'kernel': 'rbf', 'epsilon': 0.05839704280090008, 'degree': 4, 'C': 0.000128573533482437}. Best is trial 422 with value: 0.7787752748757922.
Trial 721 finished with value: 0.32685347186225 and parameters: {'kernel': 'poly', 'epsilon': 0.027042328142041994, 'degree': 6, 'C': 1.0372754476271546}. Best is trial 422 with value: 0.7787752748757922.
Trial 722 finished with value: -0.06444997132119341 and parameters: {'kernel': 'poly', 'epsilon': 0.9279373862932598, 'degree': 5, 'C': 0.0007756574617934082}. Best is trial 422 with value: 0.7787752748757922.
Trial 727 finished with value: -0.0607161812277482 and parameters: {'kernel': 'rbf', 'epsilon': 0.23198217266865473, 'degree': 6, 'C': 0.0028023315222966}. Best is trial 422 with value: 0.7787752748757922.
Trial 726 finished with value: 0.775264700268088 and parameters: {'kernel': 'linear', 'epsilon': 0.08027128720619037, 'degree': 2, 'C': 0.8975613155913145}. Best is trial 422 with value: 0.7787752748757922.
Trial 737 finished with value: 0.2511922545234477 and parameters: {'kernel': 'linear', 'epsilon': 0.9511485743815342, 'degree': 4, 'C': 0.018521200759961384}. Best is trial 422 with value: 0.7787752748757922.
Trial 734 finished with value: -0.06305463754136827 and parameters: {'kernel': 'poly', 'epsilon': 0.4441058416580863, 'degree': 3, 'C': 0.00011387226878648023}. Best is trial 422 with value: 0.7787752748757922.
Trial 730 finished with value: 0.17900935961623668 and parameters: {'kernel': 'rbf', 'epsilon': 0.1358769421341216, 'degree': 4, 'C': 0.4933791294539995}. Best is trial 422 with value: 0.7787752748757922.
Trial 729 finished with value: -0.037841515740112554 and parameters: {'kernel': 'sigmoid', 'epsilon': 0.6461389727004276, 'degree': 2, 'C': 0.03237774246669326}. Best is trial 422 with value: 0.7787752748757922.
Trial 736 finished with value: 0.727918043002599 and parameters: {'kernel': 'rbf', 'epsilon': 0.23542886381548522, 'degree': 3, 'C': 5.0623225346794225}. Best is trial 422 with value: 0.7787752748757922.
Trial 735 finished with value: 0.7139632479122467 and parameters: {'kernel': 'poly', 'epsilon': 0.9706890704279647, 'degree': 4, 'C': 5.02216358781773}. Best is trial 422 with value: 0.7787752748757922.
Trial 732 finished with value: -0.06333483567865106 and parameters: {'kernel': 'rbf', 'epsilon': 0.5666767141144338, 'degree': 2, 'C': 0.0005075260362992737}. Best is trial 422 with value: 0.7787752748757922.
Trial 728 finished with value: 0.05331486489099109 and parameters: {'kernel': 'sigmoid', 'epsilon': 0.37578459835477096, 'degree': 4, 'C': 0.151328424433062}. Best is trial 422 with value: 0.7787752748757922.
Trial 723 finished with value: 0.7530531272206828 and parameters: {'kernel': 'poly', 'epsilon': 0.3283974305603611, 'degree': 4, 'C': 7.568413766654511}. Best is trial 422 with value: 0.7787752748757922.
Trial 738 finished with value: -0.05556938509584175 and parameters: {'kernel': 'poly', 'epsilon': 0.1816929288576593, 'degree': 2, 'C': 0.01179225084777409}. Best is trial 422 with value: 0.7787752748757922.
