Trial 480 finished with value: 19.277271042666786 and parameters: {'input_dropout': 0.0, 'hidden_layers': 5, 'hidden_units': 224, 'kernel_initializer': 'he_uniform', 'hidden_activation': 'relu', 'hidden_dropout': 0.0, 'batch_norm': 'off', 'optimizer_type': 'adam', 'lr': 0.002143020097622274, 'batch_size': 64}. Best is trial 425 with value: 10.402115430356979.
Trial 481 finished with value: 392.44193063788174 and parameters: {'input_dropout': 0.0, 'hidden_layers': 5, 'hidden_units': 128, 'kernel_initializer': 'he_normal', 'hidden_activation': 'relu', 'hidden_dropout': 0.25, 'batch_norm': 'off', 'optimizer_type': 'adam', 'lr': 0.0018524633880264583, 'batch_size': 64}. Best is trial 425 with value: 10.402115430356979.
Trial 482 finished with value: 11.790972050511364 and parameters: {'input_dropout': 0.0, 'hidden_layers': 5, 'hidden_units': 224, 'kernel_initializer': 'he_uniform', 'hidden_activation': 'relu', 'hidden_dropout': 0.0, 'batch_norm': 'off', 'optimizer_type': 'adam', 'lr': 0.0006774500961850268, 'batch_size': 64}. Best is trial 425 with value: 10.402115430356979.
Trial 483 finished with value: 20.407370279238854 and parameters: {'input_dropout': 0.0, 'hidden_layers': 5, 'hidden_units': 224, 'kernel_initializer': 'he_uniform', 'hidden_activation': 'relu', 'hidden_dropout': 0.0, 'batch_norm': 'off', 'optimizer_type': 'adam', 'lr': 0.0005083796132501119, 'batch_size': 64}. Best is trial 425 with value: 10.402115430356979.
Trial 484 finished with value: 77.52572274407326 and parameters: {'input_dropout': 0.05, 'hidden_layers': 5, 'hidden_units': 224, 'kernel_initializer': 'he_uniform', 'hidden_activation': 'relu', 'hidden_dropout': 0.0, 'batch_norm': 'off', 'optimizer_type': 'adam', 'lr': 0.0005289639018539314, 'batch_size': 64}. Best is trial 425 with value: 10.402115430356979.
Trial 485 finished with value: 25.622534882185867 and parameters: {'input_dropout': 0.0, 'hidden_layers': 5, 'hidden_units': 224, 'kernel_initializer': 'he_uniform', 'hidden_activation': 'relu', 'hidden_dropout': 0.0, 'batch_norm': 'off', 'optimizer_type': 'adam', 'lr': 0.000438238222118595, 'batch_size': 64}. Best is trial 425 with value: 10.402115430356979.
Trial 486 finished with value: 291.3216141650664 and parameters: {'input_dropout': 0.0, 'hidden_layers': 5, 'hidden_units': 224, 'kernel_initializer': 'he_uniform', 'hidden_activation': 'relu', 'hidden_dropout': 0.2, 'batch_norm': 'off', 'optimizer_type': 'adam', 'lr': 0.0006965205588976307, 'batch_size': 64}. Best is trial 425 with value: 10.402115430356979.
Trial 487 finished with value: 20.532255958550103 and parameters: {'input_dropout': 0.0, 'hidden_layers': 5, 'hidden_units': 224, 'kernel_initializer': 'he_uniform', 'hidden_activation': 'relu', 'hidden_dropout': 0.0, 'batch_norm': 'off', 'optimizer_type': 'adam', 'lr': 0.0006589599758469124, 'batch_size': 64}. Best is trial 425 with value: 10.402115430356979.
Trial 488 finished with value: 15.921454283199171 and parameters: {'input_dropout': 0.0, 'hidden_layers': 5, 'hidden_units': 192, 'kernel_initializer': 'he_uniform', 'hidden_activation': 'relu', 'hidden_dropout': 0.0, 'batch_norm': 'off', 'optimizer_type': 'adam', 'lr': 0.0006413935176733478, 'batch_size': 64}. Best is trial 425 with value: 10.402115430356979.
Trial 489 finished with value: 26.46058818173305 and parameters: {'input_dropout': 0.0, 'hidden_layers': 5, 'hidden_units': 224, 'kernel_initializer': 'he_uniform', 'hidden_activation': 'relu', 'hidden_dropout': 0.0, 'batch_norm': 'off', 'optimizer_type': 'adam', 'lr': 0.0007784614678139398, 'batch_size': 96}. Best is trial 425 with value: 10.402115430356979.
Trial 490 finished with value: 17.326436895119187 and parameters: {'input_dropout': 0.0, 'hidden_layers': 5, 'hidden_units': 224, 'kernel_initializer': 'he_uniform', 'hidden_activation': 'leaky_relu', 'hidden_dropout': 0.0, 'batch_norm': 'off', 'optimizer_type': 'adam', 'lr': 0.0005739456986309428, 'batch_size': 64}. Best is trial 425 with value: 10.402115430356979.
Trial 491 finished with value: 117.5881940956319 and parameters: {'input_dropout': 0.0, 'hidden_layers': 4, 'hidden_units': 224, 'kernel_initializer': 'he_uniform', 'hidden_activation': 'relu', 'hidden_dropout': 0.15000000000000002, 'batch_norm': 'off', 'optimizer_type': 'adam', 'lr': 0.0009227188801646169, 'batch_size': 64}. Best is trial 425 with value: 10.402115430356979.
Trial 492 finished with value: 73.02522905263521 and parameters: {'input_dropout': 0.0, 'hidden_layers': 5, 'hidden_units': 224, 'kernel_initializer': 'he_normal', 'hidden_activation': 'relu', 'hidden_dropout': 0.0, 'batch_norm': 'off', 'optimizer_type': 'rmsprop', 'lr': 0.0007995082109942469, 'batch_size': 64}. Best is trial 425 with value: 10.402115430356979.
Trial 493 finished with value: 49.12378125565782 and parameters: {'input_dropout': 0.0, 'hidden_layers': 5, 'hidden_units': 256, 'kernel_initializer': 'random_normal', 'hidden_activation': 'relu', 'hidden_dropout': 0.0, 'batch_norm': 'off', 'optimizer_type': 'adam', 'lr': 0.001044718246121725, 'batch_size': 64}. Best is trial 425 with value: 10.402115430356979.
Trial 494 finished with value: 20.8366884956458 and parameters: {'input_dropout': 0.0, 'hidden_layers': 5, 'hidden_units': 224, 'kernel_initializer': 'he_uniform', 'hidden_activation': 'relu', 'hidden_dropout': 0.0, 'batch_norm': 'off', 'optimizer_type': 'adam', 'lr': 0.0008459860168530357, 'batch_size': 64}. Best is trial 425 with value: 10.402115430356979.
Trial 495 finished with value: 15.57958863497186 and parameters: {'input_dropout': 0.0, 'hidden_layers': 5, 'hidden_units': 224, 'kernel_initializer': 'he_normal', 'hidden_activation': 'relu', 'hidden_dropout': 0.0, 'batch_norm': 'off', 'optimizer_type': 'adam', 'lr': 0.0007270871233682915, 'batch_size': 64}. Best is trial 425 with value: 10.402115430356979.
Trial 496 finished with value: 26.450018660253487 and parameters: {'input_dropout': 0.0, 'hidden_layers': 5, 'hidden_units': 160, 'kernel_initializer': 'he_normal', 'hidden_activation': 'prelu', 'hidden_dropout': 0.0, 'batch_norm': 'on', 'optimizer_type': 'adam', 'lr': 0.0011631420403157703, 'batch_size': 64}. Best is trial 425 with value: 10.402115430356979.
Trial 497 finished with value: 26.6961728221684 and parameters: {'input_dropout': 0.0, 'hidden_layers': 5, 'hidden_units': 224, 'kernel_initializer': 'he_normal', 'hidden_activation': 'relu', 'hidden_dropout': 0.0, 'batch_norm': 'off', 'optimizer_type': 'adam', 'lr': 0.0005995628444888516, 'batch_size': 64}. Best is trial 425 with value: 10.402115430356979.
Trial 498 finished with value: 11.54735509542284 and parameters: {'input_dropout': 0.0, 'hidden_layers': 5, 'hidden_units': 224, 'kernel_initializer': 'he_normal', 'hidden_activation': 'relu', 'hidden_dropout': 0.0, 'batch_norm': 'off', 'optimizer_type': 'adam', 'lr': 0.0009754073464452877, 'batch_size': 64}. Best is trial 425 with value: 10.402115430356979.
Trial 499 finished with value: 21.435285845392833 and parameters: {'input_dropout': 0.0, 'hidden_layers': 5, 'hidden_units': 224, 'kernel_initializer': 'he_normal', 'hidden_activation': 'relu', 'hidden_dropout': 0.0, 'batch_norm': 'off', 'optimizer_type': 'adam', 'lr': 0.0008838926361010443, 'batch_size': 64}. Best is trial 425 with value: 10.402115430356979.
Trial 500 finished with value: 21.008559781136537 and parameters: {'input_dropout': 0.0, 'hidden_layers': 5, 'hidden_units': 224, 'kernel_initializer': 'he_normal', 'hidden_activation': 'relu', 'hidden_dropout': 0.0, 'batch_norm': 'off', 'optimizer_type': 'adam', 'lr': 0.0009958058876789436, 'batch_size': 64}. Best is trial 425 with value: 10.402115430356979.
Trial 501 finished with value: 18.931380880342772 and parameters: {'input_dropout': 0.0, 'hidden_layers': 5, 'hidden_units': 192, 'kernel_initializer': 'he_normal', 'hidden_activation': 'relu', 'hidden_dropout': 0.0, 'batch_norm': 'off', 'optimizer_type': 'adam', 'lr': 0.0007895157230395436, 'batch_size': 64}. Best is trial 425 with value: 10.402115430356979.
Trial 502 finished with value: 24.695425150581695 and parameters: {'input_dropout': 0.0, 'hidden_layers': 5, 'hidden_units': 224, 'kernel_initializer': 'he_normal', 'hidden_activation': 'relu', 'hidden_dropout': 0.0, 'batch_norm': 'off', 'optimizer_type': 'adam', 'lr': 0.001000166194370587, 'batch_size': 64}. Best is trial 425 with value: 10.402115430356979.
Trial 503 finished with value: 87.28637138538531 and parameters: {'input_dropout': 0.0, 'hidden_layers': 5, 'hidden_units': 224, 'kernel_initializer': 'he_uniform', 'hidden_activation': 'relu', 'hidden_dropout': 0.05, 'batch_norm': 'off', 'optimizer_type': 'adam', 'lr': 0.0006819813961883223, 'batch_size': 64}. Best is trial 425 with value: 10.402115430356979.
Trial 504 finished with value: 127.25479044109944 and parameters: {'input_dropout': 0.0, 'hidden_layers': 5, 'hidden_units': 224, 'kernel_initializer': 'he_normal', 'hidden_activation': 'relu', 'hidden_dropout': 0.0, 'batch_norm': 'off', 'optimizer_type': 'adam', 'lr': 9.720400351328885e-05, 'batch_size': 64}. Best is trial 425 with value: 10.402115430356979.
Trial 505 finished with value: 27.15153528130513 and parameters: {'input_dropout': 0.0, 'hidden_layers': 5, 'hidden_units': 224, 'kernel_initializer': 'he_normal', 'hidden_activation': 'relu', 'hidden_dropout': 0.0, 'batch_norm': 'off', 'optimizer_type': 'adam', 'lr': 0.0008691058465997141, 'batch_size': 64}. Best is trial 425 with value: 10.402115430356979.
Trial 506 finished with value: 24.910245672009637 and parameters: {'input_dropout': 0.0, 'hidden_layers': 5, 'hidden_units': 224, 'kernel_initializer': 'he_normal', 'hidden_activation': 'relu', 'hidden_dropout': 0.0, 'batch_norm': 'off', 'optimizer_type': 'adam', 'lr': 0.0010903931555055239, 'batch_size': 64}. Best is trial 425 with value: 10.402115430356979.
Trial 507 finished with value: 77.39227216489326 and parameters: {'input_dropout': 0.0, 'hidden_layers': 5, 'hidden_units': 32, 'kernel_initializer': 'he_normal', 'hidden_activation': 'relu', 'hidden_dropout': 0.0, 'batch_norm': 'off', 'optimizer_type': 'adam', 'lr': 0.0012494040222651732, 'batch_size': 64}. Best is trial 425 with value: 10.402115430356979.
Trial 508 finished with value: 14.40933136080943 and parameters: {'input_dropout': 0.0, 'hidden_layers': 5, 'hidden_units': 224, 'kernel_initializer': 'he_normal', 'hidden_activation': 'relu', 'hidden_dropout': 0.0, 'batch_norm': 'off', 'optimizer_type': 'adam', 'lr': 0.0009547949883509047, 'batch_size': 64}. Best is trial 425 with value: 10.402115430356979.
Trial 509 finished with value: 19.344985742172266 and parameters: {'input_dropout': 0.0, 'hidden_layers': 5, 'hidden_units': 224, 'kernel_initializer': 'he_normal', 'hidden_activation': 'relu', 'hidden_dropout': 0.0, 'batch_norm': 'off', 'optimizer_type': 'adam', 'lr': 0.0007605392713626325, 'batch_size': 64}. Best is trial 425 with value: 10.402115430356979.
Trial 510 finished with value: 18.000658658071522 and parameters: {'input_dropout': 0.0, 'hidden_layers': 5, 'hidden_units': 224, 'kernel_initializer': 'he_normal', 'hidden_activation': 'relu', 'hidden_dropout': 0.0, 'batch_norm': 'off', 'optimizer_type': 'adam', 'lr': 0.0011360050529095995, 'batch_size': 64}. Best is trial 425 with value: 10.402115430356979.
Trial 511 finished with value: 15.139632236564488 and parameters: {'input_dropout': 0.0, 'hidden_layers': 5, 'hidden_units': 256, 'kernel_initializer': 'he_normal', 'hidden_activation': 'relu', 'hidden_dropout': 0.0, 'batch_norm': 'off', 'optimizer_type': 'adam', 'lr': 0.0008424771013709647, 'batch_size': 64}. Best is trial 425 with value: 10.402115430356979.
Trial 512 finished with value: 97.0566256738416 and parameters: {'input_dropout': 0.0, 'hidden_layers': 5, 'hidden_units': 224, 'kernel_initializer': 'he_normal', 'hidden_activation': 'relu', 'hidden_dropout': 0.0, 'batch_norm': 'off', 'optimizer_type': 'rmsprop', 'lr': 0.0012625107483277963, 'batch_size': 64}. Best is trial 425 with value: 10.402115430356979.
Trial 513 finished with value: 53.745506339773 and parameters: {'input_dropout': 0.0, 'hidden_layers': 5, 'hidden_units': 224, 'kernel_initializer': 'random_normal', 'hidden_activation': 'relu', 'hidden_dropout': 0.0, 'batch_norm': 'off', 'optimizer_type': 'adam', 'lr': 0.0009696977496585676, 'batch_size': 64}. Best is trial 425 with value: 10.402115430356979.
Trial 514 finished with value: 34.13624628861527 and parameters: {'input_dropout': 0.0, 'hidden_layers': 5, 'hidden_units': 224, 'kernel_initializer': 'he_uniform', 'hidden_activation': 'leaky_relu', 'hidden_dropout': 0.0, 'batch_norm': 'off', 'optimizer_type': 'adam', 'lr': 0.0006745714340468579, 'batch_size': 128}. Best is trial 425 with value: 10.402115430356979.
Trial 515 finished with value: 14.111809853668122 and parameters: {'input_dropout': 0.0, 'hidden_layers': 5, 'hidden_units': 192, 'kernel_initializer': 'he_normal', 'hidden_activation': 'relu', 'hidden_dropout': 0.0, 'batch_norm': 'off', 'optimizer_type': 'adam', 'lr': 0.0014022477944229143, 'batch_size': 64}. Best is trial 425 with value: 10.402115430356979.
Trial 516 finished with value: 28.643276883575368 and parameters: {'input_dropout': 0.0, 'hidden_layers': 5, 'hidden_units': 224, 'kernel_initializer': 'he_normal', 'hidden_activation': 'relu', 'hidden_dropout': 0.0, 'batch_norm': 'on', 'optimizer_type': 'adam', 'lr': 0.0010774673190872565, 'batch_size': 64}. Best is trial 425 with value: 10.402115430356979.
Trial 517 finished with value: 31.649106087669132 and parameters: {'input_dropout': 0.0, 'hidden_layers': 5, 'hidden_units': 224, 'kernel_initializer': 'he_normal', 'hidden_activation': 'relu', 'hidden_dropout': 0.0, 'batch_norm': 'off', 'optimizer_type': 'adam', 'lr': 0.0013084691944439644, 'batch_size': 64}. Best is trial 425 with value: 10.402115430356979.
Trial 518 finished with value: 20.962561501061476 and parameters: {'input_dropout': 0.0, 'hidden_layers': 5, 'hidden_units': 224, 'kernel_initializer': 'he_normal', 'hidden_activation': 'relu', 'hidden_dropout': 0.0, 'batch_norm': 'off', 'optimizer_type': 'adam', 'lr': 0.0008576922630189382, 'batch_size': 64}. Best is trial 425 with value: 10.402115430356979.
Trial 519 finished with value: 316.30884454079165 and parameters: {'input_dropout': 0.0, 'hidden_layers': 5, 'hidden_units': 224, 'kernel_initializer': 'he_normal', 'hidden_activation': 'prelu', 'hidden_dropout': 0.0, 'batch_norm': 'off', 'optimizer_type': 'adam', 'lr': 1.2443699911652343e-05, 'batch_size': 64}. Best is trial 425 with value: 10.402115430356979.
Trial 520 finished with value: 21.816230514611437 and parameters: {'input_dropout': 0.0, 'hidden_layers': 5, 'hidden_units': 224, 'kernel_initializer': 'he_normal', 'hidden_activation': 'relu', 'hidden_dropout': 0.0, 'batch_norm': 'off', 'optimizer_type': 'adam', 'lr': 0.0005038362108030219, 'batch_size': 64}. Best is trial 425 with value: 10.402115430356979.
Trial 521 finished with value: 193.89196989173587 and parameters: {'input_dropout': 0.0, 'hidden_layers': 3, 'hidden_units': 224, 'kernel_initializer': 'he_normal', 'hidden_activation': 'relu', 'hidden_dropout': 0.0, 'batch_norm': 'off', 'optimizer_type': 'adam', 'lr': 0.00023660763614030632, 'batch_size': 64}. Best is trial 425 with value: 10.402115430356979.
Trial 522 finished with value: 139.63674918905858 and parameters: {'input_dropout': 0.0, 'hidden_layers': 5, 'hidden_units': 224, 'kernel_initializer': 'he_normal', 'hidden_activation': 'relu', 'hidden_dropout': 0.1, 'batch_norm': 'off', 'optimizer_type': 'adam', 'lr': 0.0010576172337688858, 'batch_size': 64}. Best is trial 425 with value: 10.402115430356979.
Trial 523 finished with value: 14.631194060692515 and parameters: {'input_dropout': 0.0, 'hidden_layers': 5, 'hidden_units': 224, 'kernel_initializer': 'he_uniform', 'hidden_activation': 'relu', 'hidden_dropout': 0.0, 'batch_norm': 'off', 'optimizer_type': 'adam', 'lr': 0.0012013649014453846, 'batch_size': 64}. Best is trial 425 with value: 10.402115430356979.
Trial 524 finished with value: 19.670892265616367 and parameters: {'input_dropout': 0.0, 'hidden_layers': 5, 'hidden_units': 192, 'kernel_initializer': 'he_normal', 'hidden_activation': 'relu', 'hidden_dropout': 0.0, 'batch_norm': 'off', 'optimizer_type': 'adam', 'lr': 0.0006091992009100378, 'batch_size': 64}. Best is trial 425 with value: 10.402115430356979.
Trial 525 finished with value: 18.39443144503304 and parameters: {'input_dropout': 0.0, 'hidden_layers': 5, 'hidden_units': 224, 'kernel_initializer': 'he_normal', 'hidden_activation': 'relu', 'hidden_dropout': 0.0, 'batch_norm': 'off', 'optimizer_type': 'adam', 'lr': 0.0014977083243069983, 'batch_size': 64}. Best is trial 425 with value: 10.402115430356979.
Trial 526 finished with value: 88.39136248590603 and parameters: {'input_dropout': 0.0, 'hidden_layers': 5, 'hidden_units': 224, 'kernel_initializer': 'he_normal', 'hidden_activation': 'relu', 'hidden_dropout': 0.05, 'batch_norm': 'off', 'optimizer_type': 'adam', 'lr': 0.0007223126889592426, 'batch_size': 64}. Best is trial 425 with value: 10.402115430356979.
Trial 527 finished with value: 11.991347703925287 and parameters: {'input_dropout': 0.0, 'hidden_layers': 5, 'hidden_units': 256, 'kernel_initializer': 'he_normal', 'hidden_activation': 'relu', 'hidden_dropout': 0.0, 'batch_norm': 'off', 'optimizer_type': 'adam', 'lr': 0.0010087986518239106, 'batch_size': 64}. Best is trial 425 with value: 10.402115430356979.
Trial 528 finished with value: 24.46367485083975 and parameters: {'input_dropout': 0.0, 'hidden_layers': 5, 'hidden_units': 256, 'kernel_initializer': 'he_normal', 'hidden_activation': 'relu', 'hidden_dropout': 0.0, 'batch_norm': 'off', 'optimizer_type': 'adam', 'lr': 0.0003639564690017575, 'batch_size': 64}. Best is trial 425 with value: 10.402115430356979.
Trial 529 finished with value: 15.750489343665539 and parameters: {'input_dropout': 0.0, 'hidden_layers': 5, 'hidden_units': 192, 'kernel_initializer': 'he_normal', 'hidden_activation': 'relu', 'hidden_dropout': 0.0, 'batch_norm': 'off', 'optimizer_type': 'adam', 'lr': 0.000909614035688565, 'batch_size': 64}. Best is trial 425 with value: 10.402115430356979.
Trial 530 finished with value: 20.173986018463793 and parameters: {'input_dropout': 0.0, 'hidden_layers': 5, 'hidden_units': 256, 'kernel_initializer': 'he_normal', 'hidden_activation': 'relu', 'hidden_dropout': 0.0, 'batch_norm': 'off', 'optimizer_type': 'adam', 'lr': 0.0009795122257213414, 'batch_size': 64}. Best is trial 425 with value: 10.402115430356979.
Trial 531 finished with value: 96.92628313840856 and parameters: {'input_dropout': 0.0, 'hidden_layers': 5, 'hidden_units': 256, 'kernel_initializer': 'he_normal', 'hidden_activation': 'relu', 'hidden_dropout': 0.0, 'batch_norm': 'off', 'optimizer_type': 'rmsprop', 'lr': 0.000810171477287675, 'batch_size': 64}. Best is trial 425 with value: 10.402115430356979.
Trial 532 finished with value: 23.818385603893596 and parameters: {'input_dropout': 0.0, 'hidden_layers': 5, 'hidden_units': 256, 'kernel_initializer': 'he_uniform', 'hidden_activation': 'relu', 'hidden_dropout': 0.0, 'batch_norm': 'off', 'optimizer_type': 'adam', 'lr': 0.0010255723441717703, 'batch_size': 64}. Best is trial 425 with value: 10.402115430356979.
Trial 533 finished with value: 19.828799696050936 and parameters: {'input_dropout': 0.0, 'hidden_layers': 5, 'hidden_units': 256, 'kernel_initializer': 'he_normal', 'hidden_activation': 'relu', 'hidden_dropout': 0.0, 'batch_norm': 'off', 'optimizer_type': 'adam', 'lr': 0.001140030900408324, 'batch_size': 64}. Best is trial 425 with value: 10.402115430356979.
Trial 534 finished with value: 18.04632929709577 and parameters: {'input_dropout': 0.0, 'hidden_layers': 5, 'hidden_units': 256, 'kernel_initializer': 'he_normal', 'hidden_activation': 'relu', 'hidden_dropout': 0.0, 'batch_norm': 'off', 'optimizer_type': 'adam', 'lr': 0.0008993806902603456, 'batch_size': 64}. Best is trial 425 with value: 10.402115430356979.
Trial 535 finished with value: 16.08642964294376 and parameters: {'input_dropout': 0.0, 'hidden_layers': 5, 'hidden_units': 256, 'kernel_initializer': 'he_normal', 'hidden_activation': 'relu', 'hidden_dropout': 0.0, 'batch_norm': 'off', 'optimizer_type': 'adam', 'lr': 0.0008297378356860325, 'batch_size': 64}. Best is trial 425 with value: 10.402115430356979.
Trial 536 finished with value: 19.57616621400944 and parameters: {'input_dropout': 0.0, 'hidden_layers': 5, 'hidden_units': 160, 'kernel_initializer': 'random_normal', 'hidden_activation': 'leaky_relu', 'hidden_dropout': 0.0, 'batch_norm': 'on', 'optimizer_type': 'adam', 'lr': 0.000730212771388908, 'batch_size': 64}. Best is trial 425 with value: 10.402115430356979.
Trial 537 finished with value: 678.2591320600073 and parameters: {'input_dropout': 0.15000000000000002, 'hidden_layers': 5, 'hidden_units': 256, 'kernel_initializer': 'he_normal', 'hidden_activation': 'relu', 'hidden_dropout': 0.3, 'batch_norm': 'off', 'optimizer_type': 'adam', 'lr': 0.0011929522286416095, 'batch_size': 64}. Best is trial 425 with value: 10.402115430356979.
Trial 538 finished with value: 19.836656379727028 and parameters: {'input_dropout': 0.0, 'hidden_layers': 5, 'hidden_units': 192, 'kernel_initializer': 'he_normal', 'hidden_activation': 'relu', 'hidden_dropout': 0.0, 'batch_norm': 'off', 'optimizer_type': 'adam', 'lr': 0.000992528305863106, 'batch_size': 64}. Best is trial 425 with value: 10.402115430356979.
Trial 539 finished with value: 34.224876571223646 and parameters: {'input_dropout': 0.0, 'hidden_layers': 5, 'hidden_units': 192, 'kernel_initializer': 'he_normal', 'hidden_activation': 'relu', 'hidden_dropout': 0.0, 'batch_norm': 'off', 'optimizer_type': 'adam', 'lr': 0.0006024723111801946, 'batch_size': 64}. Best is trial 425 with value: 10.402115430356979.
