Trial 120 finished with value: 37.18183017875179 and parameters: {'input_dropout': 0.0, 'hidden_layers': 5, 'hidden_units': 224, 'kernel_initializer': 'he_normal', 'hidden_activation': 'relu', 'hidden_dropout': 0.05, 'batch_norm': 'on', 'optimizer_type': 'adam', 'lr': 0.0014366722022879144, 'batch_size': 64}. Best is trial 115 with value: 11.315390660609015.
Trial 121 finished with value: 19.293683439579468 and parameters: {'input_dropout': 0.0, 'hidden_layers': 5, 'hidden_units': 224, 'kernel_initializer': 'he_normal', 'hidden_activation': 'relu', 'hidden_dropout': 0.0, 'batch_norm': 'off', 'optimizer_type': 'adam', 'lr': 0.0009816650360177984, 'batch_size': 64}. Best is trial 115 with value: 11.315390660609015.
Trial 122 finished with value: 21.30977459274554 and parameters: {'input_dropout': 0.0, 'hidden_layers': 5, 'hidden_units': 224, 'kernel_initializer': 'he_normal', 'hidden_activation': 'relu', 'hidden_dropout': 0.0, 'batch_norm': 'off', 'optimizer_type': 'adam', 'lr': 0.0023209764253273083, 'batch_size': 64}. Best is trial 115 with value: 11.315390660609015.
Trial 123 finished with value: 26.22057107387183 and parameters: {'input_dropout': 0.0, 'hidden_layers': 5, 'hidden_units': 224, 'kernel_initializer': 'he_normal', 'hidden_activation': 'relu', 'hidden_dropout': 0.0, 'batch_norm': 'off', 'optimizer_type': 'adam', 'lr': 0.0012570949598760038, 'batch_size': 64}. Best is trial 115 with value: 11.315390660609015.
Trial 124 finished with value: 18.153483689315713 and parameters: {'input_dropout': 0.0, 'hidden_layers': 5, 'hidden_units': 224, 'kernel_initializer': 'he_normal', 'hidden_activation': 'relu', 'hidden_dropout': 0.0, 'batch_norm': 'off', 'optimizer_type': 'adam', 'lr': 0.0016335017048169085, 'batch_size': 64}. Best is trial 115 with value: 11.315390660609015.
Trial 125 finished with value: 11.592922124813644 and parameters: {'input_dropout': 0.0, 'hidden_layers': 5, 'hidden_units': 224, 'kernel_initializer': 'he_normal', 'hidden_activation': 'relu', 'hidden_dropout': 0.0, 'batch_norm': 'off', 'optimizer_type': 'adam', 'lr': 0.001701033572557372, 'batch_size': 64}. Best is trial 115 with value: 11.315390660609015.
Trial 126 finished with value: 16.861924983513102 and parameters: {'input_dropout': 0.0, 'hidden_layers': 5, 'hidden_units': 224, 'kernel_initializer': 'he_normal', 'hidden_activation': 'relu', 'hidden_dropout': 0.0, 'batch_norm': 'off', 'optimizer_type': 'adam', 'lr': 0.0017199199460141933, 'batch_size': 64}. Best is trial 115 with value: 11.315390660609015.
Trial 127 finished with value: 256.52254973596547 and parameters: {'input_dropout': 0.0, 'hidden_layers': 5, 'hidden_units': 224, 'kernel_initializer': 'he_normal', 'hidden_activation': 'relu', 'hidden_dropout': 0.25, 'batch_norm': 'off', 'optimizer_type': 'adam', 'lr': 0.0025667263503204103, 'batch_size': 64}. Best is trial 115 with value: 11.315390660609015.
Trial 128 finished with value: 25.01967236549332 and parameters: {'input_dropout': 0.0, 'hidden_layers': 4, 'hidden_units': 224, 'kernel_initializer': 'he_normal', 'hidden_activation': 'relu', 'hidden_dropout': 0.0, 'batch_norm': 'off', 'optimizer_type': 'adam', 'lr': 0.00118996826165865, 'batch_size': 64}. Best is trial 115 with value: 11.315390660609015.
Trial 129 finished with value: 16.734609109308895 and parameters: {'input_dropout': 0.0, 'hidden_layers': 5, 'hidden_units': 224, 'kernel_initializer': 'he_normal', 'hidden_activation': 'relu', 'hidden_dropout': 0.0, 'batch_norm': 'off', 'optimizer_type': 'adam', 'lr': 0.0014350993301752858, 'batch_size': 64}. Best is trial 115 with value: 11.315390660609015.
Trial 130 finished with value: 16.54232949624275 and parameters: {'input_dropout': 0.0, 'hidden_layers': 5, 'hidden_units': 224, 'kernel_initializer': 'he_normal', 'hidden_activation': 'relu', 'hidden_dropout': 0.0, 'batch_norm': 'off', 'optimizer_type': 'adam', 'lr': 0.0032101149223902614, 'batch_size': 64}. Best is trial 115 with value: 11.315390660609015.
Trial 131 finished with value: 15.476608195365344 and parameters: {'input_dropout': 0.0, 'hidden_layers': 5, 'hidden_units': 224, 'kernel_initializer': 'he_normal', 'hidden_activation': 'relu', 'hidden_dropout': 0.0, 'batch_norm': 'off', 'optimizer_type': 'adam', 'lr': 0.0009423952294932948, 'batch_size': 64}. Best is trial 115 with value: 11.315390660609015.
Trial 132 finished with value: 17.866229506944464 and parameters: {'input_dropout': 0.0, 'hidden_layers': 5, 'hidden_units': 224, 'kernel_initializer': 'he_normal', 'hidden_activation': 'relu', 'hidden_dropout': 0.0, 'batch_norm': 'off', 'optimizer_type': 'adam', 'lr': 0.0008576383439919707, 'batch_size': 64}. Best is trial 115 with value: 11.315390660609015.
Trial 133 finished with value: 15.748179858925548 and parameters: {'input_dropout': 0.0, 'hidden_layers': 5, 'hidden_units': 224, 'kernel_initializer': 'he_normal', 'hidden_activation': 'relu', 'hidden_dropout': 0.0, 'batch_norm': 'off', 'optimizer_type': 'adam', 'lr': 0.0014469615447711488, 'batch_size': 64}. Best is trial 115 with value: 11.315390660609015.
Trial 134 finished with value: 23.809295479746677 and parameters: {'input_dropout': 0.0, 'hidden_layers': 5, 'hidden_units': 224, 'kernel_initializer': 'he_normal', 'hidden_activation': 'relu', 'hidden_dropout': 0.0, 'batch_norm': 'off', 'optimizer_type': 'adam', 'lr': 0.0032548391990122796, 'batch_size': 64}. Best is trial 115 with value: 11.315390660609015.
Trial 135 finished with value: 18.81981033561288 and parameters: {'input_dropout': 0.0, 'hidden_layers': 5, 'hidden_units': 224, 'kernel_initializer': 'he_normal', 'hidden_activation': 'relu', 'hidden_dropout': 0.0, 'batch_norm': 'off', 'optimizer_type': 'adam', 'lr': 0.0009770341404884218, 'batch_size': 64}. Best is trial 115 with value: 11.315390660609015.
Trial 136 finished with value: 18.48600729725755 and parameters: {'input_dropout': 0.0, 'hidden_layers': 5, 'hidden_units': 224, 'kernel_initializer': 'he_normal', 'hidden_activation': 'relu', 'hidden_dropout': 0.0, 'batch_norm': 'off', 'optimizer_type': 'adam', 'lr': 0.0021754870857202046, 'batch_size': 64}. Best is trial 115 with value: 11.315390660609015.
Trial 137 finished with value: 58.50521417109202 and parameters: {'input_dropout': 0.0, 'hidden_layers': 5, 'hidden_units': 224, 'kernel_initializer': 'random_normal', 'hidden_activation': 'leaky_relu', 'hidden_dropout': 0.0, 'batch_norm': 'off', 'optimizer_type': 'adam', 'lr': 0.0026409125355784054, 'batch_size': 64}. Best is trial 115 with value: 11.315390660609015.
Trial 138 finished with value: 19.607779621213208 and parameters: {'input_dropout': 0.0, 'hidden_layers': 5, 'hidden_units': 224, 'kernel_initializer': 'he_normal', 'hidden_activation': 'relu', 'hidden_dropout': 0.0, 'batch_norm': 'off', 'optimizer_type': 'adam', 'lr': 0.001381864695954515, 'batch_size': 64}. Best is trial 115 with value: 11.315390660609015.
Trial 139 finished with value: 22.453195943456727 and parameters: {'input_dropout': 0.0, 'hidden_layers': 5, 'hidden_units': 224, 'kernel_initializer': 'he_normal', 'hidden_activation': 'relu', 'hidden_dropout': 0.0, 'batch_norm': 'off', 'optimizer_type': 'adam', 'lr': 0.001422237190490477, 'batch_size': 64}. Best is trial 115 with value: 11.315390660609015.
Trial 140 finished with value: 16.196459048097253 and parameters: {'input_dropout': 0.0, 'hidden_layers': 5, 'hidden_units': 224, 'kernel_initializer': 'he_normal', 'hidden_activation': 'relu', 'hidden_dropout': 0.0, 'batch_norm': 'off', 'optimizer_type': 'adam', 'lr': 0.0011530981666497378, 'batch_size': 64}. Best is trial 115 with value: 11.315390660609015.
Trial 141 finished with value: 11.750640116187034 and parameters: {'input_dropout': 0.0, 'hidden_layers': 5, 'hidden_units': 224, 'kernel_initializer': 'he_normal', 'hidden_activation': 'relu', 'hidden_dropout': 0.0, 'batch_norm': 'off', 'optimizer_type': 'adam', 'lr': 0.0011389827678260826, 'batch_size': 64}. Best is trial 115 with value: 11.315390660609015.
Trial 142 finished with value: 134.1503341110332 and parameters: {'input_dropout': 0.0, 'hidden_layers': 5, 'hidden_units': 224, 'kernel_initializer': 'he_normal', 'hidden_activation': 'relu', 'hidden_dropout': 0.1, 'batch_norm': 'off', 'optimizer_type': 'adam', 'lr': 0.001145096885405458, 'batch_size': 64}. Best is trial 115 with value: 11.315390660609015.
Trial 143 finished with value: 17.555197852674368 and parameters: {'input_dropout': 0.0, 'hidden_layers': 5, 'hidden_units': 224, 'kernel_initializer': 'he_normal', 'hidden_activation': 'relu', 'hidden_dropout': 0.0, 'batch_norm': 'off', 'optimizer_type': 'adam', 'lr': 0.0009235030004598716, 'batch_size': 64}. Best is trial 115 with value: 11.315390660609015.
Trial 144 finished with value: 175.5454378811339 and parameters: {'input_dropout': 0.0, 'hidden_layers': 5, 'hidden_units': 32, 'kernel_initializer': 'he_normal', 'hidden_activation': 'relu', 'hidden_dropout': 0.0, 'batch_norm': 'off', 'optimizer_type': 'adam', 'lr': 0.0007219626690654305, 'batch_size': 64}. Best is trial 115 with value: 11.315390660609015.
Trial 145 finished with value: 24.494499488966984 and parameters: {'input_dropout': 0.0, 'hidden_layers': 5, 'hidden_units': 224, 'kernel_initializer': 'he_normal', 'hidden_activation': 'relu', 'hidden_dropout': 0.0, 'batch_norm': 'off', 'optimizer_type': 'adam', 'lr': 0.001649601608646202, 'batch_size': 64}. Best is trial 115 with value: 11.315390660609015.
Trial 146 finished with value: 31.30485976201996 and parameters: {'input_dropout': 0.0, 'hidden_layers': 5, 'hidden_units': 224, 'kernel_initializer': 'he_normal', 'hidden_activation': 'relu', 'hidden_dropout': 0.0, 'batch_norm': 'on', 'optimizer_type': 'adam', 'lr': 0.0010704564305327397, 'batch_size': 64}. Best is trial 115 with value: 11.315390660609015.
Trial 147 finished with value: 19.48448623271252 and parameters: {'input_dropout': 0.0, 'hidden_layers': 5, 'hidden_units': 224, 'kernel_initializer': 'he_normal', 'hidden_activation': 'relu', 'hidden_dropout': 0.0, 'batch_norm': 'off', 'optimizer_type': 'adam', 'lr': 0.0020927089828276517, 'batch_size': 64}. Best is trial 115 with value: 11.315390660609015.
Trial 148 finished with value: 19.56166709889184 and parameters: {'input_dropout': 0.0, 'hidden_layers': 5, 'hidden_units': 224, 'kernel_initializer': 'he_normal', 'hidden_activation': 'relu', 'hidden_dropout': 0.0, 'batch_norm': 'off', 'optimizer_type': 'adam', 'lr': 0.0017963135769288238, 'batch_size': 64}. Best is trial 115 with value: 11.315390660609015.
Trial 149 finished with value: 85.47055185944129 and parameters: {'input_dropout': 0.0, 'hidden_layers': 5, 'hidden_units': 224, 'kernel_initializer': 'he_normal', 'hidden_activation': 'relu', 'hidden_dropout': 0.05, 'batch_norm': 'off', 'optimizer_type': 'adam', 'lr': 0.0038173701776560527, 'batch_size': 64}. Best is trial 115 with value: 11.315390660609015.
Trial 150 finished with value: 16.447023126857356 and parameters: {'input_dropout': 0.0, 'hidden_layers': 5, 'hidden_units': 224, 'kernel_initializer': 'he_normal', 'hidden_activation': 'relu', 'hidden_dropout': 0.0, 'batch_norm': 'off', 'optimizer_type': 'adam', 'lr': 0.0012006471102732296, 'batch_size': 64}. Best is trial 115 with value: 11.315390660609015.
Trial 151 finished with value: 14.041196042032631 and parameters: {'input_dropout': 0.0, 'hidden_layers': 5, 'hidden_units': 224, 'kernel_initializer': 'he_normal', 'hidden_activation': 'relu', 'hidden_dropout': 0.0, 'batch_norm': 'off', 'optimizer_type': 'adam', 'lr': 0.0015546758565209865, 'batch_size': 64}. Best is trial 115 with value: 11.315390660609015.
Trial 152 finished with value: 21.434789146568605 and parameters: {'input_dropout': 0.0, 'hidden_layers': 5, 'hidden_units': 224, 'kernel_initializer': 'he_normal', 'hidden_activation': 'relu', 'hidden_dropout': 0.0, 'batch_norm': 'off', 'optimizer_type': 'adam', 'lr': 0.0012248609705368583, 'batch_size': 64}. Best is trial 115 with value: 11.315390660609015.
Trial 153 finished with value: 44.19700310413181 and parameters: {'input_dropout': 0.0, 'hidden_layers': 5, 'hidden_units': 64, 'kernel_initializer': 'he_normal', 'hidden_activation': 'relu', 'hidden_dropout': 0.0, 'batch_norm': 'off', 'optimizer_type': 'adam', 'lr': 0.0014350397450087042, 'batch_size': 64}. Best is trial 115 with value: 11.315390660609015.
Trial 154 finished with value: 288.3877122755833 and parameters: {'input_dropout': 0.0, 'hidden_layers': 5, 'hidden_units': 224, 'kernel_initializer': 'he_normal', 'hidden_activation': 'relu', 'hidden_dropout': 0.0, 'batch_norm': 'off', 'optimizer_type': 'adam', 'lr': 1.0445204944798797e-05, 'batch_size': 64}. Best is trial 115 with value: 11.315390660609015.
Trial 155 finished with value: 13.262874085164379 and parameters: {'input_dropout': 0.0, 'hidden_layers': 5, 'hidden_units': 224, 'kernel_initializer': 'he_normal', 'hidden_activation': 'relu', 'hidden_dropout': 0.0, 'batch_norm': 'off', 'optimizer_type': 'adam', 'lr': 0.0015438106713173342, 'batch_size': 64}. Best is trial 115 with value: 11.315390660609015.
Trial 156 finished with value: 12.979411120615618 and parameters: {'input_dropout': 0.0, 'hidden_layers': 5, 'hidden_units': 224, 'kernel_initializer': 'he_normal', 'hidden_activation': 'relu', 'hidden_dropout': 0.0, 'batch_norm': 'off', 'optimizer_type': 'adam', 'lr': 0.001197245036689107, 'batch_size': 64}. Best is trial 115 with value: 11.315390660609015.
Trial 157 finished with value: 21.54160611359755 and parameters: {'input_dropout': 0.0, 'hidden_layers': 5, 'hidden_units': 224, 'kernel_initializer': 'he_normal', 'hidden_activation': 'relu', 'hidden_dropout': 0.0, 'batch_norm': 'off', 'optimizer_type': 'adam', 'lr': 0.000830825968634708, 'batch_size': 64}. Best is trial 115 with value: 11.315390660609015.
Trial 158 finished with value: 12.159294093465398 and parameters: {'input_dropout': 0.0, 'hidden_layers': 5, 'hidden_units': 224, 'kernel_initializer': 'he_normal', 'hidden_activation': 'relu', 'hidden_dropout': 0.0, 'batch_norm': 'off', 'optimizer_type': 'adam', 'lr': 0.0010348096708383111, 'batch_size': 64}. Best is trial 115 with value: 11.315390660609015.
Trial 159 finished with value: 10.962566169289193 and parameters: {'input_dropout': 0.0, 'hidden_layers': 5, 'hidden_units': 224, 'kernel_initializer': 'he_normal', 'hidden_activation': 'relu', 'hidden_dropout': 0.0, 'batch_norm': 'off', 'optimizer_type': 'adam', 'lr': 0.0009623043097685801, 'batch_size': 64}. Best is trial 159 with value: 10.962566169289193.
Trial 160 finished with value: 43.99287725907351 and parameters: {'input_dropout': 0.0, 'hidden_layers': 5, 'hidden_units': 224, 'kernel_initializer': 'random_normal', 'hidden_activation': 'leaky_relu', 'hidden_dropout': 0.0, 'batch_norm': 'off', 'optimizer_type': 'adam', 'lr': 0.0010174693828701837, 'batch_size': 64}. Best is trial 159 with value: 10.962566169289193.
Trial 161 finished with value: 20.170430295875448 and parameters: {'input_dropout': 0.0, 'hidden_layers': 5, 'hidden_units': 224, 'kernel_initializer': 'he_normal', 'hidden_activation': 'relu', 'hidden_dropout': 0.0, 'batch_norm': 'off', 'optimizer_type': 'adam', 'lr': 0.001808573376790976, 'batch_size': 64}. Best is trial 159 with value: 10.962566169289193.
Trial 162 finished with value: 22.369225391903583 and parameters: {'input_dropout': 0.0, 'hidden_layers': 5, 'hidden_units': 224, 'kernel_initializer': 'he_normal', 'hidden_activation': 'relu', 'hidden_dropout': 0.0, 'batch_norm': 'off', 'optimizer_type': 'adam', 'lr': 0.0009221325610896059, 'batch_size': 64}. Best is trial 159 with value: 10.962566169289193.
Trial 163 finished with value: 13.148181272176458 and parameters: {'input_dropout': 0.0, 'hidden_layers': 5, 'hidden_units': 224, 'kernel_initializer': 'he_normal', 'hidden_activation': 'relu', 'hidden_dropout': 0.0, 'batch_norm': 'off', 'optimizer_type': 'adam', 'lr': 0.0006651170281730291, 'batch_size': 64}. Best is trial 159 with value: 10.962566169289193.
Trial 164 finished with value: 17.081941520116658 and parameters: {'input_dropout': 0.0, 'hidden_layers': 5, 'hidden_units': 224, 'kernel_initializer': 'he_normal', 'hidden_activation': 'relu', 'hidden_dropout': 0.0, 'batch_norm': 'off', 'optimizer_type': 'adam', 'lr': 0.0006459303495689663, 'batch_size': 64}. Best is trial 159 with value: 10.962566169289193.
Trial 165 finished with value: 22.446268941128608 and parameters: {'input_dropout': 0.0, 'hidden_layers': 5, 'hidden_units': 224, 'kernel_initializer': 'he_normal', 'hidden_activation': 'relu', 'hidden_dropout': 0.0, 'batch_norm': 'off', 'optimizer_type': 'adam', 'lr': 0.0008042110314936215, 'batch_size': 64}. Best is trial 159 with value: 10.962566169289193.
Trial 166 finished with value: 13.330986643843438 and parameters: {'input_dropout': 0.0, 'hidden_layers': 5, 'hidden_units': 224, 'kernel_initializer': 'he_normal', 'hidden_activation': 'relu', 'hidden_dropout': 0.0, 'batch_norm': 'off', 'optimizer_type': 'adam', 'lr': 0.0015655097763539164, 'batch_size': 64}. Best is trial 159 with value: 10.962566169289193.
Trial 167 finished with value: 24.072709089364 and parameters: {'input_dropout': 0.0, 'hidden_layers': 5, 'hidden_units': 224, 'kernel_initializer': 'he_uniform', 'hidden_activation': 'relu', 'hidden_dropout': 0.0, 'batch_norm': 'off', 'optimizer_type': 'adam', 'lr': 0.001565309547775582, 'batch_size': 64}. Best is trial 159 with value: 10.962566169289193.
Trial 168 finished with value: 22.882984013043316 and parameters: {'input_dropout': 0.0, 'hidden_layers': 5, 'hidden_units': 224, 'kernel_initializer': 'he_normal', 'hidden_activation': 'relu', 'hidden_dropout': 0.0, 'batch_norm': 'off', 'optimizer_type': 'adam', 'lr': 0.002290669972172151, 'batch_size': 64}. Best is trial 159 with value: 10.962566169289193.
Trial 169 finished with value: 23.955842518942482 and parameters: {'input_dropout': 0.0, 'hidden_layers': 5, 'hidden_units': 224, 'kernel_initializer': 'he_normal', 'hidden_activation': 'prelu', 'hidden_dropout': 0.0, 'batch_norm': 'on', 'optimizer_type': 'adam', 'lr': 0.0018709219537425652, 'batch_size': 64}. Best is trial 159 with value: 10.962566169289193.
Trial 170 finished with value: 10.560527383025718 and parameters: {'input_dropout': 0.0, 'hidden_layers': 5, 'hidden_units': 224, 'kernel_initializer': 'he_normal', 'hidden_activation': 'relu', 'hidden_dropout': 0.0, 'batch_norm': 'off', 'optimizer_type': 'adam', 'lr': 0.0010221854801773826, 'batch_size': 64}. Best is trial 170 with value: 10.560527383025718.
Trial 171 finished with value: 24.74555989215374 and parameters: {'input_dropout': 0.0, 'hidden_layers': 5, 'hidden_units': 224, 'kernel_initializer': 'he_normal', 'hidden_activation': 'relu', 'hidden_dropout': 0.0, 'batch_norm': 'off', 'optimizer_type': 'adam', 'lr': 0.00102855982258182, 'batch_size': 64}. Best is trial 170 with value: 10.560527383025718.
Trial 172 finished with value: 21.264460471160696 and parameters: {'input_dropout': 0.0, 'hidden_layers': 5, 'hidden_units': 224, 'kernel_initializer': 'he_normal', 'hidden_activation': 'relu', 'hidden_dropout': 0.0, 'batch_norm': 'off', 'optimizer_type': 'adam', 'lr': 0.0007555435970419398, 'batch_size': 64}. Best is trial 170 with value: 10.560527383025718.
Trial 173 finished with value: 19.771635225561415 and parameters: {'input_dropout': 0.0, 'hidden_layers': 5, 'hidden_units': 224, 'kernel_initializer': 'he_normal', 'hidden_activation': 'relu', 'hidden_dropout': 0.0, 'batch_norm': 'off', 'optimizer_type': 'adam', 'lr': 0.001254388169931652, 'batch_size': 64}. Best is trial 170 with value: 10.560527383025718.
Trial 174 finished with value: 19.535089243954786 and parameters: {'input_dropout': 0.0, 'hidden_layers': 5, 'hidden_units': 224, 'kernel_initializer': 'he_normal', 'hidden_activation': 'relu', 'hidden_dropout': 0.0, 'batch_norm': 'off', 'optimizer_type': 'adam', 'lr': 0.0015409540295584832, 'batch_size': 64}. Best is trial 170 with value: 10.560527383025718.
Trial 175 finished with value: 22.958630289702832 and parameters: {'input_dropout': 0.0, 'hidden_layers': 5, 'hidden_units': 224, 'kernel_initializer': 'he_normal', 'hidden_activation': 'relu', 'hidden_dropout': 0.0, 'batch_norm': 'off', 'optimizer_type': 'adam', 'lr': 0.0009301788989003099, 'batch_size': 64}. Best is trial 170 with value: 10.560527383025718.
Trial 176 finished with value: 18.654909459996045 and parameters: {'input_dropout': 0.0, 'hidden_layers': 5, 'hidden_units': 224, 'kernel_initializer': 'he_normal', 'hidden_activation': 'relu', 'hidden_dropout': 0.0, 'batch_norm': 'off', 'optimizer_type': 'adam', 'lr': 0.0010807023809413954, 'batch_size': 64}. Best is trial 170 with value: 10.560527383025718.
Trial 177 finished with value: 17.310652244877776 and parameters: {'input_dropout': 0.0, 'hidden_layers': 5, 'hidden_units': 224, 'kernel_initializer': 'he_normal', 'hidden_activation': 'relu', 'hidden_dropout': 0.0, 'batch_norm': 'off', 'optimizer_type': 'adam', 'lr': 0.001726227760529268, 'batch_size': 64}. Best is trial 170 with value: 10.560527383025718.
Trial 178 finished with value: 14.260005759472232 and parameters: {'input_dropout': 0.0, 'hidden_layers': 5, 'hidden_units': 224, 'kernel_initializer': 'he_normal', 'hidden_activation': 'relu', 'hidden_dropout': 0.0, 'batch_norm': 'off', 'optimizer_type': 'adam', 'lr': 0.0020573580574013615, 'batch_size': 64}. Best is trial 170 with value: 10.560527383025718.
Trial 179 finished with value: 16.070131375444767 and parameters: {'input_dropout': 0.0, 'hidden_layers': 5, 'hidden_units': 224, 'kernel_initializer': 'he_normal', 'hidden_activation': 'relu', 'hidden_dropout': 0.0, 'batch_norm': 'off', 'optimizer_type': 'adam', 'lr': 0.0013051288690057463, 'batch_size': 64}. Best is trial 170 with value: 10.560527383025718.
