Trial 360 finished with value: 25.627231608187216 and parameters: {'input_dropout': 0.0, 'hidden_layers': 5, 'hidden_units': 224, 'kernel_initializer': 'he_normal', 'hidden_activation': 'prelu', 'hidden_dropout': 0.0, 'batch_norm': 'on', 'optimizer_type': 'adam', 'lr': 0.0012298662138755568, 'batch_size': 64}. Best is trial 170 with value: 10.560527383025718.
Trial 361 finished with value: 52.577298348369915 and parameters: {'input_dropout': 0.05, 'hidden_layers': 5, 'hidden_units': 256, 'kernel_initializer': 'he_normal', 'hidden_activation': 'relu', 'hidden_dropout': 0.0, 'batch_norm': 'off', 'optimizer_type': 'adam', 'lr': 0.0017620151605992104, 'batch_size': 64}. Best is trial 170 with value: 10.560527383025718.
Trial 362 finished with value: 19.953281221067865 and parameters: {'input_dropout': 0.0, 'hidden_layers': 5, 'hidden_units': 224, 'kernel_initializer': 'he_normal', 'hidden_activation': 'relu', 'hidden_dropout': 0.0, 'batch_norm': 'off', 'optimizer_type': 'adam', 'lr': 0.0014787683008927325, 'batch_size': 64}. Best is trial 170 with value: 10.560527383025718.
Trial 363 finished with value: 17.578376092026538 and parameters: {'input_dropout': 0.0, 'hidden_layers': 5, 'hidden_units': 224, 'kernel_initializer': 'he_normal', 'hidden_activation': 'relu', 'hidden_dropout': 0.0, 'batch_norm': 'off', 'optimizer_type': 'adam', 'lr': 0.0008449849511788697, 'batch_size': 64}. Best is trial 170 with value: 10.560527383025718.
Trial 364 finished with value: 13.595188623430937 and parameters: {'input_dropout': 0.0, 'hidden_layers': 5, 'hidden_units': 224, 'kernel_initializer': 'he_normal', 'hidden_activation': 'relu', 'hidden_dropout': 0.0, 'batch_norm': 'off', 'optimizer_type': 'adam', 'lr': 0.0010162990862124968, 'batch_size': 64}. Best is trial 170 with value: 10.560527383025718.
Trial 365 finished with value: 11.767268984231265 and parameters: {'input_dropout': 0.0, 'hidden_layers': 5, 'hidden_units': 224, 'kernel_initializer': 'he_normal', 'hidden_activation': 'relu', 'hidden_dropout': 0.0, 'batch_norm': 'off', 'optimizer_type': 'adam', 'lr': 0.0007289527676341017, 'batch_size': 64}. Best is trial 170 with value: 10.560527383025718.
Trial 366 finished with value: 24.11704525216532 and parameters: {'input_dropout': 0.0, 'hidden_layers': 5, 'hidden_units': 224, 'kernel_initializer': 'he_normal', 'hidden_activation': 'relu', 'hidden_dropout': 0.0, 'batch_norm': 'off', 'optimizer_type': 'adam', 'lr': 0.00068899772166685, 'batch_size': 64}. Best is trial 170 with value: 10.560527383025718.
Trial 367 finished with value: 25.27212724471278 and parameters: {'input_dropout': 0.0, 'hidden_layers': 5, 'hidden_units': 192, 'kernel_initializer': 'he_normal', 'hidden_activation': 'relu', 'hidden_dropout': 0.0, 'batch_norm': 'off', 'optimizer_type': 'adam', 'lr': 0.0007229138009228038, 'batch_size': 64}. Best is trial 170 with value: 10.560527383025718.
Trial 368 finished with value: 25.480358639093232 and parameters: {'input_dropout': 0.0, 'hidden_layers': 5, 'hidden_units': 224, 'kernel_initializer': 'he_normal', 'hidden_activation': 'relu', 'hidden_dropout': 0.0, 'batch_norm': 'off', 'optimizer_type': 'adam', 'lr': 0.000776580254650663, 'batch_size': 64}. Best is trial 170 with value: 10.560527383025718.
Trial 369 finished with value: 21.739130500746775 and parameters: {'input_dropout': 0.0, 'hidden_layers': 5, 'hidden_units': 224, 'kernel_initializer': 'he_normal', 'hidden_activation': 'relu', 'hidden_dropout': 0.0, 'batch_norm': 'off', 'optimizer_type': 'adam', 'lr': 0.0006434615926615249, 'batch_size': 64}. Best is trial 170 with value: 10.560527383025718.
Trial 370 finished with value: 31.205023666490945 and parameters: {'input_dropout': 0.0, 'hidden_layers': 4, 'hidden_units': 224, 'kernel_initializer': 'he_normal', 'hidden_activation': 'relu', 'hidden_dropout': 0.0, 'batch_norm': 'off', 'optimizer_type': 'adam', 'lr': 0.0005668878695589888, 'batch_size': 64}. Best is trial 170 with value: 10.560527383025718.
Trial 371 finished with value: 37.16249044181837 and parameters: {'input_dropout': 0.0, 'hidden_layers': 5, 'hidden_units': 224, 'kernel_initializer': 'he_normal', 'hidden_activation': 'relu', 'hidden_dropout': 0.0, 'batch_norm': 'off', 'optimizer_type': 'adam', 'lr': 0.006060017093982984, 'batch_size': 64}. Best is trial 170 with value: 10.560527383025718.
Trial 372 finished with value: 22.950935725197038 and parameters: {'input_dropout': 0.0, 'hidden_layers': 5, 'hidden_units': 224, 'kernel_initializer': 'he_normal', 'hidden_activation': 'relu', 'hidden_dropout': 0.0, 'batch_norm': 'off', 'optimizer_type': 'adam', 'lr': 0.0008970753150312431, 'batch_size': 64}. Best is trial 170 with value: 10.560527383025718.
Trial 373 finished with value: 16.192994072266444 and parameters: {'input_dropout': 0.0, 'hidden_layers': 5, 'hidden_units': 224, 'kernel_initializer': 'he_normal', 'hidden_activation': 'relu', 'hidden_dropout': 0.0, 'batch_norm': 'off', 'optimizer_type': 'adam', 'lr': 0.0008730956349498249, 'batch_size': 64}. Best is trial 170 with value: 10.560527383025718.
Trial 374 finished with value: 87.23245833081673 and parameters: {'input_dropout': 0.0, 'hidden_layers': 5, 'hidden_units': 224, 'kernel_initializer': 'he_normal', 'hidden_activation': 'relu', 'hidden_dropout': 0.05, 'batch_norm': 'off', 'optimizer_type': 'adam', 'lr': 0.0010096155353612197, 'batch_size': 64}. Best is trial 170 with value: 10.560527383025718.
Trial 375 finished with value: 16.83957015358442 and parameters: {'input_dropout': 0.0, 'hidden_layers': 5, 'hidden_units': 224, 'kernel_initializer': 'he_normal', 'hidden_activation': 'relu', 'hidden_dropout': 0.0, 'batch_norm': 'off', 'optimizer_type': 'adam', 'lr': 0.001012155572913546, 'batch_size': 64}. Best is trial 170 with value: 10.560527383025718.
Trial 376 finished with value: 91.21512900376051 and parameters: {'input_dropout': 0.0, 'hidden_layers': 5, 'hidden_units': 224, 'kernel_initializer': 'he_normal', 'hidden_activation': 'relu', 'hidden_dropout': 0.0, 'batch_norm': 'off', 'optimizer_type': 'rmsprop', 'lr': 0.0010965962934436917, 'batch_size': 64}. Best is trial 170 with value: 10.560527383025718.
Trial 377 finished with value: 31.313659478531 and parameters: {'input_dropout': 0.0, 'hidden_layers': 5, 'hidden_units': 192, 'kernel_initializer': 'he_normal', 'hidden_activation': 'relu', 'hidden_dropout': 0.0, 'batch_norm': 'off', 'optimizer_type': 'adam', 'lr': 0.0007942511750280742, 'batch_size': 64}. Best is trial 170 with value: 10.560527383025718.
Trial 378 finished with value: 55.23956953394404 and parameters: {'input_dropout': 0.0, 'hidden_layers': 5, 'hidden_units': 256, 'kernel_initializer': 'random_normal', 'hidden_activation': 'relu', 'hidden_dropout': 0.0, 'batch_norm': 'off', 'optimizer_type': 'adam', 'lr': 0.0009353830526186707, 'batch_size': 64}. Best is trial 170 with value: 10.560527383025718.
Trial 379 finished with value: 18.688170992322373 and parameters: {'input_dropout': 0.0, 'hidden_layers': 5, 'hidden_units': 224, 'kernel_initializer': 'he_normal', 'hidden_activation': 'leaky_relu', 'hidden_dropout': 0.0, 'batch_norm': 'off', 'optimizer_type': 'adam', 'lr': 0.0011589380190441718, 'batch_size': 64}. Best is trial 170 with value: 10.560527383025718.
Trial 380 finished with value: 14.822007899200973 and parameters: {'input_dropout': 0.0, 'hidden_layers': 5, 'hidden_units': 224, 'kernel_initializer': 'he_uniform', 'hidden_activation': 'relu', 'hidden_dropout': 0.0, 'batch_norm': 'off', 'optimizer_type': 'adam', 'lr': 0.0026951277867362667, 'batch_size': 64}. Best is trial 170 with value: 10.560527383025718.
Trial 381 finished with value: 6181.588555580181 and parameters: {'input_dropout': 0.0, 'hidden_layers': 5, 'hidden_units': 32, 'kernel_initializer': 'he_normal', 'hidden_activation': 'relu', 'hidden_dropout': 0.0, 'batch_norm': 'on', 'optimizer_type': 'adam', 'lr': 0.0006357964885651469, 'batch_size': 64}. Best is trial 170 with value: 10.560527383025718.
Trial 382 finished with value: 115.97226693594865 and parameters: {'input_dropout': 0.1, 'hidden_layers': 5, 'hidden_units': 224, 'kernel_initializer': 'he_normal', 'hidden_activation': 'relu', 'hidden_dropout': 0.0, 'batch_norm': 'off', 'optimizer_type': 'adam', 'lr': 0.0013600630271567214, 'batch_size': 64}. Best is trial 170 with value: 10.560527383025718.
Trial 383 finished with value: 16.6155496061318 and parameters: {'input_dropout': 0.0, 'hidden_layers': 5, 'hidden_units': 224, 'kernel_initializer': 'he_normal', 'hidden_activation': 'prelu', 'hidden_dropout': 0.0, 'batch_norm': 'off', 'optimizer_type': 'adam', 'lr': 0.00042767031886165014, 'batch_size': 64}. Best is trial 170 with value: 10.560527383025718.
Trial 384 finished with value: 16.202911225414315 and parameters: {'input_dropout': 0.0, 'hidden_layers': 5, 'hidden_units': 224, 'kernel_initializer': 'he_normal', 'hidden_activation': 'relu', 'hidden_dropout': 0.0, 'batch_norm': 'off', 'optimizer_type': 'adam', 'lr': 0.0019572109882684367, 'batch_size': 64}. Best is trial 170 with value: 10.560527383025718.
Trial 385 finished with value: 18.38254060391093 and parameters: {'input_dropout': 0.0, 'hidden_layers': 5, 'hidden_units': 224, 'kernel_initializer': 'he_normal', 'hidden_activation': 'relu', 'hidden_dropout': 0.0, 'batch_norm': 'off', 'optimizer_type': 'adam', 'lr': 0.00115003584309048, 'batch_size': 64}. Best is trial 170 with value: 10.560527383025718.
Trial 386 finished with value: 16.758992203587063 and parameters: {'input_dropout': 0.0, 'hidden_layers': 5, 'hidden_units': 224, 'kernel_initializer': 'he_normal', 'hidden_activation': 'relu', 'hidden_dropout': 0.0, 'batch_norm': 'off', 'optimizer_type': 'adam', 'lr': 0.0009654702162105499, 'batch_size': 64}. Best is trial 170 with value: 10.560527383025718.
Trial 387 finished with value: 15.298363018713406 and parameters: {'input_dropout': 0.0, 'hidden_layers': 5, 'hidden_units': 224, 'kernel_initializer': 'he_normal', 'hidden_activation': 'relu', 'hidden_dropout': 0.0, 'batch_norm': 'off', 'optimizer_type': 'adam', 'lr': 0.0013281969765217472, 'batch_size': 64}. Best is trial 170 with value: 10.560527383025718.
Trial 388 finished with value: 16.3392270061871 and parameters: {'input_dropout': 0.0, 'hidden_layers': 5, 'hidden_units': 224, 'kernel_initializer': 'he_normal', 'hidden_activation': 'relu', 'hidden_dropout': 0.0, 'batch_norm': 'off', 'optimizer_type': 'adam', 'lr': 0.0007438664988355315, 'batch_size': 64}. Best is trial 170 with value: 10.560527383025718.
Trial 389 finished with value: 76.96302534441091 and parameters: {'input_dropout': 0.0, 'hidden_layers': 2, 'hidden_units': 224, 'kernel_initializer': 'he_normal', 'hidden_activation': 'relu', 'hidden_dropout': 0.0, 'batch_norm': 'off', 'optimizer_type': 'adam', 'lr': 0.0016700236418859527, 'batch_size': 64}. Best is trial 170 with value: 10.560527383025718.
Trial 390 finished with value: 21.874463213227557 and parameters: {'input_dropout': 0.0, 'hidden_layers': 5, 'hidden_units': 256, 'kernel_initializer': 'he_normal', 'hidden_activation': 'relu', 'hidden_dropout': 0.0, 'batch_norm': 'off', 'optimizer_type': 'adam', 'lr': 0.0008759675951263704, 'batch_size': 64}. Best is trial 170 with value: 10.560527383025718.
Trial 391 finished with value: 17.643186167889272 and parameters: {'input_dropout': 0.0, 'hidden_layers': 5, 'hidden_units': 224, 'kernel_initializer': 'he_normal', 'hidden_activation': 'relu', 'hidden_dropout': 0.0, 'batch_norm': 'off', 'optimizer_type': 'adam', 'lr': 0.00104919557391116, 'batch_size': 64}. Best is trial 170 with value: 10.560527383025718.
Trial 392 finished with value: 17.09371005135902 and parameters: {'input_dropout': 0.0, 'hidden_layers': 5, 'hidden_units': 224, 'kernel_initializer': 'he_normal', 'hidden_activation': 'relu', 'hidden_dropout': 0.0, 'batch_norm': 'off', 'optimizer_type': 'adam', 'lr': 0.001250190761139204, 'batch_size': 64}. Best is trial 170 with value: 10.560527383025718.
Trial 393 finished with value: 14.163541581431197 and parameters: {'input_dropout': 0.0, 'hidden_layers': 5, 'hidden_units': 224, 'kernel_initializer': 'he_normal', 'hidden_activation': 'relu', 'hidden_dropout': 0.0, 'batch_norm': 'off', 'optimizer_type': 'adam', 'lr': 0.0019486232136759775, 'batch_size': 64}. Best is trial 170 with value: 10.560527383025718.
Trial 394 finished with value: 79.42734955837153 and parameters: {'input_dropout': 0.05, 'hidden_layers': 5, 'hidden_units': 224, 'kernel_initializer': 'he_normal', 'hidden_activation': 'relu', 'hidden_dropout': 0.0, 'batch_norm': 'off', 'optimizer_type': 'adam', 'lr': 0.0015106584967943628, 'batch_size': 64}. Best is trial 170 with value: 10.560527383025718.
Trial 395 finished with value: 19.461056920339395 and parameters: {'input_dropout': 0.0, 'hidden_layers': 5, 'hidden_units': 224, 'kernel_initializer': 'he_normal', 'hidden_activation': 'relu', 'hidden_dropout': 0.0, 'batch_norm': 'off', 'optimizer_type': 'adam', 'lr': 0.001146432845087968, 'batch_size': 64}. Best is trial 170 with value: 10.560527383025718.
Trial 396 finished with value: 133.29978084627635 and parameters: {'input_dropout': 0.0, 'hidden_layers': 5, 'hidden_units': 224, 'kernel_initializer': 'he_normal', 'hidden_activation': 'relu', 'hidden_dropout': 0.0, 'batch_norm': 'off', 'optimizer_type': 'rmsprop', 'lr': 0.0013785700437208652, 'batch_size': 64}. Best is trial 170 with value: 10.560527383025718.
Trial 397 finished with value: 15.875087776688906 and parameters: {'input_dropout': 0.0, 'hidden_layers': 5, 'hidden_units': 224, 'kernel_initializer': 'he_normal', 'hidden_activation': 'relu', 'hidden_dropout': 0.0, 'batch_norm': 'off', 'optimizer_type': 'adam', 'lr': 0.0005604944090907325, 'batch_size': 64}. Best is trial 170 with value: 10.560527383025718.
Trial 398 finished with value: 15.184129945332598 and parameters: {'input_dropout': 0.0, 'hidden_layers': 5, 'hidden_units': 224, 'kernel_initializer': 'he_normal', 'hidden_activation': 'relu', 'hidden_dropout': 0.0, 'batch_norm': 'off', 'optimizer_type': 'adam', 'lr': 0.0008144461903737204, 'batch_size': 64}. Best is trial 170 with value: 10.560527383025718.
Trial 399 finished with value: 20.00995517302481 and parameters: {'input_dropout': 0.0, 'hidden_layers': 5, 'hidden_units': 128, 'kernel_initializer': 'he_normal', 'hidden_activation': 'relu', 'hidden_dropout': 0.0, 'batch_norm': 'on', 'optimizer_type': 'adam', 'lr': 0.0024034011533335077, 'batch_size': 64}. Best is trial 170 with value: 10.560527383025718.
Trial 400 finished with value: 74.43880691429747 and parameters: {'input_dropout': 0.0, 'hidden_layers': 3, 'hidden_units': 224, 'kernel_initializer': 'random_normal', 'hidden_activation': 'relu', 'hidden_dropout': 0.0, 'batch_norm': 'off', 'optimizer_type': 'adam', 'lr': 0.0017530948470387633, 'batch_size': 64}. Best is trial 170 with value: 10.560527383025718.
Trial 401 finished with value: 17.968634586792245 and parameters: {'input_dropout': 0.0, 'hidden_layers': 5, 'hidden_units': 192, 'kernel_initializer': 'he_normal', 'hidden_activation': 'leaky_relu', 'hidden_dropout': 0.0, 'batch_norm': 'off', 'optimizer_type': 'adam', 'lr': 0.0010169206120481035, 'batch_size': 64}. Best is trial 170 with value: 10.560527383025718.
Trial 402 finished with value: 20.049748726143438 and parameters: {'input_dropout': 0.0, 'hidden_layers': 5, 'hidden_units': 224, 'kernel_initializer': 'he_uniform', 'hidden_activation': 'relu', 'hidden_dropout': 0.0, 'batch_norm': 'off', 'optimizer_type': 'adam', 'lr': 0.0015386256134682428, 'batch_size': 96}. Best is trial 170 with value: 10.560527383025718.
Trial 403 finished with value: 86.32039520783425 and parameters: {'input_dropout': 0.0, 'hidden_layers': 5, 'hidden_units': 224, 'kernel_initializer': 'he_normal', 'hidden_activation': 'relu', 'hidden_dropout': 0.05, 'batch_norm': 'off', 'optimizer_type': 'adam', 'lr': 0.0007127927922078695, 'batch_size': 64}. Best is trial 170 with value: 10.560527383025718.
Trial 404 finished with value: 21.501655915645394 and parameters: {'input_dropout': 0.0, 'hidden_layers': 5, 'hidden_units': 224, 'kernel_initializer': 'he_normal', 'hidden_activation': 'relu', 'hidden_dropout': 0.0, 'batch_norm': 'off', 'optimizer_type': 'adam', 'lr': 0.00129015433887825, 'batch_size': 128}. Best is trial 170 with value: 10.560527383025718.
Trial 405 finished with value: 17.199206769825036 and parameters: {'input_dropout': 0.0, 'hidden_layers': 5, 'hidden_units': 224, 'kernel_initializer': 'he_normal', 'hidden_activation': 'relu', 'hidden_dropout': 0.0, 'batch_norm': 'off', 'optimizer_type': 'adam', 'lr': 0.001151438652889732, 'batch_size': 64}. Best is trial 170 with value: 10.560527383025718.
Trial 406 finished with value: 19.05192328650783 and parameters: {'input_dropout': 0.0, 'hidden_layers': 5, 'hidden_units': 224, 'kernel_initializer': 'he_normal', 'hidden_activation': 'prelu', 'hidden_dropout': 0.0, 'batch_norm': 'off', 'optimizer_type': 'adam', 'lr': 0.000966733803476496, 'batch_size': 64}. Best is trial 170 with value: 10.560527383025718.
Trial 407 finished with value: 18.759623768046335 and parameters: {'input_dropout': 0.0, 'hidden_layers': 5, 'hidden_units': 256, 'kernel_initializer': 'he_normal', 'hidden_activation': 'relu', 'hidden_dropout': 0.0, 'batch_norm': 'off', 'optimizer_type': 'adam', 'lr': 0.0016321658907128272, 'batch_size': 64}. Best is trial 170 with value: 10.560527383025718.
Trial 408 finished with value: 105.81154336276529 and parameters: {'input_dropout': 0.1, 'hidden_layers': 5, 'hidden_units': 224, 'kernel_initializer': 'he_normal', 'hidden_activation': 'relu', 'hidden_dropout': 0.0, 'batch_norm': 'off', 'optimizer_type': 'adam', 'lr': 0.0013839771943030905, 'batch_size': 64}. Best is trial 170 with value: 10.560527383025718.
Trial 409 finished with value: 44.80858458670957 and parameters: {'input_dropout': 0.0, 'hidden_layers': 5, 'hidden_units': 64, 'kernel_initializer': 'he_normal', 'hidden_activation': 'relu', 'hidden_dropout': 0.0, 'batch_norm': 'off', 'optimizer_type': 'adam', 'lr': 0.0018437784519221762, 'batch_size': 64}. Best is trial 170 with value: 10.560527383025718.
Trial 410 finished with value: 26.538434228414037 and parameters: {'input_dropout': 0.0, 'hidden_layers': 5, 'hidden_units': 160, 'kernel_initializer': 'he_normal', 'hidden_activation': 'relu', 'hidden_dropout': 0.0, 'batch_norm': 'off', 'optimizer_type': 'adam', 'lr': 0.0008740294476082993, 'batch_size': 64}. Best is trial 170 with value: 10.560527383025718.
Trial 411 finished with value: 18.647531471943168 and parameters: {'input_dropout': 0.0, 'hidden_layers': 5, 'hidden_units': 224, 'kernel_initializer': 'he_normal', 'hidden_activation': 'relu', 'hidden_dropout': 0.0, 'batch_norm': 'off', 'optimizer_type': 'adam', 'lr': 0.001203538440775453, 'batch_size': 64}. Best is trial 170 with value: 10.560527383025718.
Trial 412 finished with value: 214.0086131762162 and parameters: {'input_dropout': 0.0, 'hidden_layers': 5, 'hidden_units': 224, 'kernel_initializer': 'he_normal', 'hidden_activation': 'relu', 'hidden_dropout': 0.2, 'batch_norm': 'off', 'optimizer_type': 'adam', 'lr': 0.002164493530946162, 'batch_size': 64}. Best is trial 170 with value: 10.560527383025718.
Trial 413 finished with value: 154.45358102465434 and parameters: {'input_dropout': 0.0, 'hidden_layers': 5, 'hidden_units': 224, 'kernel_initializer': 'he_normal', 'hidden_activation': 'relu', 'hidden_dropout': 0.1, 'batch_norm': 'off', 'optimizer_type': 'adam', 'lr': 0.0006297862400235909, 'batch_size': 64}. Best is trial 170 with value: 10.560527383025718.
Trial 414 finished with value: 130.9936121103215 and parameters: {'input_dropout': 0.0, 'hidden_layers': 5, 'hidden_units': 224, 'kernel_initializer': 'he_normal', 'hidden_activation': 'relu', 'hidden_dropout': 0.15000000000000002, 'batch_norm': 'off', 'optimizer_type': 'rmsprop', 'lr': 0.0010570954301497488, 'batch_size': 64}. Best is trial 170 with value: 10.560527383025718.
Trial 415 finished with value: 16.98653893042486 and parameters: {'input_dropout': 0.0, 'hidden_layers': 5, 'hidden_units': 224, 'kernel_initializer': 'he_normal', 'hidden_activation': 'relu', 'hidden_dropout': 0.0, 'batch_norm': 'off', 'optimizer_type': 'adam', 'lr': 0.0013970092820418108, 'batch_size': 64}. Best is trial 170 with value: 10.560527383025718.
Trial 416 finished with value: 211.55100472040607 and parameters: {'input_dropout': 0.0, 'hidden_layers': 5, 'hidden_units': 224, 'kernel_initializer': 'he_normal', 'hidden_activation': 'relu', 'hidden_dropout': 0.0, 'batch_norm': 'off', 'optimizer_type': 'adam', 'lr': 6.067267694579432e-05, 'batch_size': 64}. Best is trial 170 with value: 10.560527383025718.
Trial 417 finished with value: 16.77028097954315 and parameters: {'input_dropout': 0.0, 'hidden_layers': 5, 'hidden_units': 224, 'kernel_initializer': 'he_normal', 'hidden_activation': 'relu', 'hidden_dropout': 0.0, 'batch_norm': 'off', 'optimizer_type': 'adam', 'lr': 0.001640745723047339, 'batch_size': 64}. Best is trial 170 with value: 10.560527383025718.
Trial 418 finished with value: 207.93809556359074 and parameters: {'input_dropout': 0.0, 'hidden_layers': 5, 'hidden_units': 224, 'kernel_initializer': 'he_normal', 'hidden_activation': 'relu', 'hidden_dropout': 0.0, 'batch_norm': 'off', 'optimizer_type': 'adam', 'lr': 2.661559062517575e-05, 'batch_size': 64}. Best is trial 170 with value: 10.560527383025718.
Trial 419 finished with value: 23.50092956602072 and parameters: {'input_dropout': 0.0, 'hidden_layers': 4, 'hidden_units': 224, 'kernel_initializer': 'he_normal', 'hidden_activation': 'relu', 'hidden_dropout': 0.0, 'batch_norm': 'off', 'optimizer_type': 'adam', 'lr': 0.0004948978945938464, 'batch_size': 64}. Best is trial 170 with value: 10.560527383025718.
