Trial 420 finished with value: 26.54207211831188 and parameters: {'input_dropout': 0.0, 'hidden_layers': 5, 'hidden_units': 192, 'kernel_initializer': 'he_normal', 'hidden_activation': 'relu', 'hidden_dropout': 0.0, 'batch_norm': 'on', 'optimizer_type': 'adam', 'lr': 0.0012394051448336866, 'batch_size': 64}. Best is trial 170 with value: 10.560527383025718.
Trial 421 finished with value: 16.47187769843088 and parameters: {'input_dropout': 0.0, 'hidden_layers': 5, 'hidden_units': 224, 'kernel_initializer': 'he_normal', 'hidden_activation': 'relu', 'hidden_dropout': 0.0, 'batch_norm': 'off', 'optimizer_type': 'adam', 'lr': 0.0007444996669204421, 'batch_size': 64}. Best is trial 170 with value: 10.560527383025718.
Trial 422 finished with value: 23.795821313935733 and parameters: {'input_dropout': 0.0, 'hidden_layers': 5, 'hidden_units': 224, 'kernel_initializer': 'he_normal', 'hidden_activation': 'relu', 'hidden_dropout': 0.0, 'batch_norm': 'off', 'optimizer_type': 'adam', 'lr': 0.0014804790520492506, 'batch_size': 64}. Best is trial 170 with value: 10.560527383025718.
Trial 423 finished with value: 42.65250403095789 and parameters: {'input_dropout': 0.0, 'hidden_layers': 5, 'hidden_units': 224, 'kernel_initializer': 'random_normal', 'hidden_activation': 'leaky_relu', 'hidden_dropout': 0.0, 'batch_norm': 'off', 'optimizer_type': 'adam', 'lr': 0.0009382670426732993, 'batch_size': 64}. Best is trial 170 with value: 10.560527383025718.
Trial 424 finished with value: 70.05944578081426 and parameters: {'input_dropout': 0.0, 'hidden_layers': 5, 'hidden_units': 224, 'kernel_initializer': 'he_normal', 'hidden_activation': 'relu', 'hidden_dropout': 0.05, 'batch_norm': 'off', 'optimizer_type': 'adam', 'lr': 0.001979963784909545, 'batch_size': 64}. Best is trial 170 with value: 10.560527383025718.
Trial 425 finished with value: 10.402115430356979 and parameters: {'input_dropout': 0.0, 'hidden_layers': 5, 'hidden_units': 192, 'kernel_initializer': 'he_normal', 'hidden_activation': 'relu', 'hidden_dropout': 0.0, 'batch_norm': 'off', 'optimizer_type': 'adam', 'lr': 0.0011272172664551796, 'batch_size': 64}. Best is trial 425 with value: 10.402115430356979.
Trial 426 finished with value: 22.623517847278112 and parameters: {'input_dropout': 0.0, 'hidden_layers': 5, 'hidden_units': 160, 'kernel_initializer': 'he_uniform', 'hidden_activation': 'relu', 'hidden_dropout': 0.0, 'batch_norm': 'off', 'optimizer_type': 'adam', 'lr': 0.0008309257554279881, 'batch_size': 64}. Best is trial 425 with value: 10.402115430356979.
Trial 427 finished with value: 29.237869550435686 and parameters: {'input_dropout': 0.0, 'hidden_layers': 5, 'hidden_units': 192, 'kernel_initializer': 'he_normal', 'hidden_activation': 'relu', 'hidden_dropout': 0.0, 'batch_norm': 'off', 'optimizer_type': 'adam', 'lr': 0.0010631462731748812, 'batch_size': 64}. Best is trial 425 with value: 10.402115430356979.
Trial 428 finished with value: 18.110272011572526 and parameters: {'input_dropout': 0.0, 'hidden_layers': 5, 'hidden_units': 192, 'kernel_initializer': 'he_normal', 'hidden_activation': 'relu', 'hidden_dropout': 0.0, 'batch_norm': 'off', 'optimizer_type': 'adam', 'lr': 0.0013438564001272428, 'batch_size': 64}. Best is trial 425 with value: 10.402115430356979.
Trial 429 finished with value: 118.27095212320363 and parameters: {'input_dropout': 0.1, 'hidden_layers': 5, 'hidden_units': 192, 'kernel_initializer': 'he_normal', 'hidden_activation': 'prelu', 'hidden_dropout': 0.0, 'batch_norm': 'off', 'optimizer_type': 'adam', 'lr': 0.0015839825331794817, 'batch_size': 64}. Best is trial 425 with value: 10.402115430356979.
Trial 430 finished with value: 17.117176615077938 and parameters: {'input_dropout': 0.0, 'hidden_layers': 5, 'hidden_units': 256, 'kernel_initializer': 'he_normal', 'hidden_activation': 'relu', 'hidden_dropout': 0.0, 'batch_norm': 'off', 'optimizer_type': 'adam', 'lr': 0.001217212605078321, 'batch_size': 64}. Best is trial 425 with value: 10.402115430356979.
Trial 431 finished with value: 15.795815403658485 and parameters: {'input_dropout': 0.0, 'hidden_layers': 5, 'hidden_units': 224, 'kernel_initializer': 'he_normal', 'hidden_activation': 'relu', 'hidden_dropout': 0.0, 'batch_norm': 'off', 'optimizer_type': 'adam', 'lr': 0.0018415373482780068, 'batch_size': 64}. Best is trial 425 with value: 10.402115430356979.
Trial 432 finished with value: 15.839209914291079 and parameters: {'input_dropout': 0.0, 'hidden_layers': 5, 'hidden_units': 224, 'kernel_initializer': 'he_normal', 'hidden_activation': 'relu', 'hidden_dropout': 0.0, 'batch_norm': 'off', 'optimizer_type': 'adam', 'lr': 0.0009266241560431072, 'batch_size': 64}. Best is trial 425 with value: 10.402115430356979.
Trial 433 finished with value: 23.08355066780488 and parameters: {'input_dropout': 0.0, 'hidden_layers': 5, 'hidden_units': 224, 'kernel_initializer': 'he_normal', 'hidden_activation': 'relu', 'hidden_dropout': 0.0, 'batch_norm': 'off', 'optimizer_type': 'adam', 'lr': 0.0014542380639025892, 'batch_size': 64}. Best is trial 425 with value: 10.402115430356979.
Trial 434 finished with value: 243.23854738548084 and parameters: {'input_dropout': 0.0, 'hidden_layers': 5, 'hidden_units': 224, 'kernel_initializer': 'he_normal', 'hidden_activation': 'relu', 'hidden_dropout': 0.3, 'batch_norm': 'off', 'optimizer_type': 'rmsprop', 'lr': 0.001036532777904983, 'batch_size': 64}. Best is trial 425 with value: 10.402115430356979.
Trial 435 finished with value: 15.769927870232022 and parameters: {'input_dropout': 0.0, 'hidden_layers': 5, 'hidden_units': 224, 'kernel_initializer': 'he_normal', 'hidden_activation': 'relu', 'hidden_dropout': 0.0, 'batch_norm': 'off', 'optimizer_type': 'adam', 'lr': 0.0006668240963196688, 'batch_size': 64}. Best is trial 425 with value: 10.402115430356979.
Trial 436 finished with value: 18.86194622359513 and parameters: {'input_dropout': 0.0, 'hidden_layers': 5, 'hidden_units': 192, 'kernel_initializer': 'he_normal', 'hidden_activation': 'relu', 'hidden_dropout': 0.0, 'batch_norm': 'off', 'optimizer_type': 'adam', 'lr': 0.0022011282439312304, 'batch_size': 64}. Best is trial 425 with value: 10.402115430356979.
Trial 437 finished with value: 16.161605900243767 and parameters: {'input_dropout': 0.0, 'hidden_layers': 5, 'hidden_units': 224, 'kernel_initializer': 'he_normal', 'hidden_activation': 'relu', 'hidden_dropout': 0.0, 'batch_norm': 'off', 'optimizer_type': 'adam', 'lr': 0.001690345659386172, 'batch_size': 64}. Best is trial 425 with value: 10.402115430356979.
Trial 438 finished with value: 21.833293359963843 and parameters: {'input_dropout': 0.0, 'hidden_layers': 5, 'hidden_units': 224, 'kernel_initializer': 'he_normal', 'hidden_activation': 'relu', 'hidden_dropout': 0.0, 'batch_norm': 'on', 'optimizer_type': 'adam', 'lr': 0.0012700415484370557, 'batch_size': 64}. Best is trial 425 with value: 10.402115430356979.
Trial 439 finished with value: 11.33685171406819 and parameters: {'input_dropout': 0.0, 'hidden_layers': 5, 'hidden_units': 224, 'kernel_initializer': 'he_normal', 'hidden_activation': 'relu', 'hidden_dropout': 0.0, 'batch_norm': 'off', 'optimizer_type': 'adam', 'lr': 0.0008437041318739467, 'batch_size': 64}. Best is trial 425 with value: 10.402115430356979.
Trial 440 finished with value: 16.32838930152012 and parameters: {'input_dropout': 0.0, 'hidden_layers': 5, 'hidden_units': 160, 'kernel_initializer': 'he_normal', 'hidden_activation': 'relu', 'hidden_dropout': 0.0, 'batch_norm': 'off', 'optimizer_type': 'adam', 'lr': 0.0008051090233930083, 'batch_size': 64}. Best is trial 425 with value: 10.402115430356979.
Trial 441 finished with value: 20.110407310670386 and parameters: {'input_dropout': 0.0, 'hidden_layers': 5, 'hidden_units': 256, 'kernel_initializer': 'he_normal', 'hidden_activation': 'relu', 'hidden_dropout': 0.0, 'batch_norm': 'off', 'optimizer_type': 'adam', 'lr': 0.0005719981869327517, 'batch_size': 64}. Best is trial 425 with value: 10.402115430356979.
Trial 442 finished with value: 27.267645739139596 and parameters: {'input_dropout': 0.0, 'hidden_layers': 5, 'hidden_units': 224, 'kernel_initializer': 'he_normal', 'hidden_activation': 'relu', 'hidden_dropout': 0.0, 'batch_norm': 'off', 'optimizer_type': 'adam', 'lr': 0.0006655418520093714, 'batch_size': 64}. Best is trial 425 with value: 10.402115430356979.
Trial 443 finished with value: 17.316955145623545 and parameters: {'input_dropout': 0.0, 'hidden_layers': 5, 'hidden_units': 224, 'kernel_initializer': 'he_normal', 'hidden_activation': 'relu', 'hidden_dropout': 0.0, 'batch_norm': 'off', 'optimizer_type': 'adam', 'lr': 0.000749109318760245, 'batch_size': 64}. Best is trial 425 with value: 10.402115430356979.
Trial 444 finished with value: 14.408007130526602 and parameters: {'input_dropout': 0.0, 'hidden_layers': 5, 'hidden_units': 224, 'kernel_initializer': 'he_normal', 'hidden_activation': 'relu', 'hidden_dropout': 0.0, 'batch_norm': 'off', 'optimizer_type': 'adam', 'lr': 0.0014315231858166495, 'batch_size': 64}. Best is trial 425 with value: 10.402115430356979.
Trial 445 finished with value: 51.525301108003205 and parameters: {'input_dropout': 0.0, 'hidden_layers': 5, 'hidden_units': 224, 'kernel_initializer': 'random_normal', 'hidden_activation': 'leaky_relu', 'hidden_dropout': 0.0, 'batch_norm': 'off', 'optimizer_type': 'adam', 'lr': 0.0018852537856894063, 'batch_size': 64}. Best is trial 425 with value: 10.402115430356979.
Trial 446 finished with value: 18.153936838219483 and parameters: {'input_dropout': 0.0, 'hidden_layers': 5, 'hidden_units': 224, 'kernel_initializer': 'he_normal', 'hidden_activation': 'relu', 'hidden_dropout': 0.0, 'batch_norm': 'off', 'optimizer_type': 'adam', 'lr': 0.0011615239781495844, 'batch_size': 64}. Best is trial 425 with value: 10.402115430356979.
Trial 447 finished with value: 18.256982200304492 and parameters: {'input_dropout': 0.0, 'hidden_layers': 5, 'hidden_units': 224, 'kernel_initializer': 'he_uniform', 'hidden_activation': 'relu', 'hidden_dropout': 0.0, 'batch_norm': 'off', 'optimizer_type': 'adam', 'lr': 0.0008501239166284252, 'batch_size': 64}. Best is trial 425 with value: 10.402115430356979.
Trial 448 finished with value: 16.48665325917044 and parameters: {'input_dropout': 0.0, 'hidden_layers': 5, 'hidden_units': 224, 'kernel_initializer': 'he_normal', 'hidden_activation': 'relu', 'hidden_dropout': 0.0, 'batch_norm': 'off', 'optimizer_type': 'adam', 'lr': 0.0016144288625681165, 'batch_size': 64}. Best is trial 425 with value: 10.402115430356979.
Trial 449 finished with value: 19.299905168432424 and parameters: {'input_dropout': 0.0, 'hidden_layers': 5, 'hidden_units': 192, 'kernel_initializer': 'he_normal', 'hidden_activation': 'relu', 'hidden_dropout': 0.0, 'batch_norm': 'off', 'optimizer_type': 'adam', 'lr': 0.0009157544101166354, 'batch_size': 64}. Best is trial 425 with value: 10.402115430356979.
Trial 450 finished with value: 19.70455626118974 and parameters: {'input_dropout': 0.0, 'hidden_layers': 5, 'hidden_units': 224, 'kernel_initializer': 'he_normal', 'hidden_activation': 'relu', 'hidden_dropout': 0.0, 'batch_norm': 'off', 'optimizer_type': 'adam', 'lr': 0.0013868198701775481, 'batch_size': 64}. Best is trial 425 with value: 10.402115430356979.
Trial 451 finished with value: 19.277745970479184 and parameters: {'input_dropout': 0.0, 'hidden_layers': 5, 'hidden_units': 224, 'kernel_initializer': 'he_normal', 'hidden_activation': 'prelu', 'hidden_dropout': 0.0, 'batch_norm': 'off', 'optimizer_type': 'adam', 'lr': 0.001094413812441913, 'batch_size': 64}. Best is trial 425 with value: 10.402115430356979.
Trial 452 finished with value: 16.21550840166446 and parameters: {'input_dropout': 0.0, 'hidden_layers': 5, 'hidden_units': 224, 'kernel_initializer': 'he_normal', 'hidden_activation': 'relu', 'hidden_dropout': 0.0, 'batch_norm': 'off', 'optimizer_type': 'adam', 'lr': 0.0016368552555423898, 'batch_size': 64}. Best is trial 425 with value: 10.402115430356979.
Trial 453 finished with value: 52.09741834633039 and parameters: {'input_dropout': 0.0, 'hidden_layers': 2, 'hidden_units': 224, 'kernel_initializer': 'he_normal', 'hidden_activation': 'relu', 'hidden_dropout': 0.0, 'batch_norm': 'off', 'optimizer_type': 'rmsprop', 'lr': 0.0023882363388607014, 'batch_size': 64}. Best is trial 425 with value: 10.402115430356979.
Trial 454 finished with value: 15.678995485180804 and parameters: {'input_dropout': 0.0, 'hidden_layers': 5, 'hidden_units': 224, 'kernel_initializer': 'he_normal', 'hidden_activation': 'relu', 'hidden_dropout': 0.0, 'batch_norm': 'off', 'optimizer_type': 'adam', 'lr': 0.0012594243038146094, 'batch_size': 64}. Best is trial 425 with value: 10.402115430356979.
Trial 455 finished with value: 196.19233825510318 and parameters: {'input_dropout': 0.2, 'hidden_layers': 5, 'hidden_units': 224, 'kernel_initializer': 'he_normal', 'hidden_activation': 'relu', 'hidden_dropout': 0.0, 'batch_norm': 'off', 'optimizer_type': 'adam', 'lr': 0.0014408703756600067, 'batch_size': 64}. Best is trial 425 with value: 10.402115430356979.
Trial 456 finished with value: 16.645634187868612 and parameters: {'input_dropout': 0.0, 'hidden_layers': 5, 'hidden_units': 224, 'kernel_initializer': 'he_normal', 'hidden_activation': 'relu', 'hidden_dropout': 0.0, 'batch_norm': 'off', 'optimizer_type': 'adam', 'lr': 0.001896063594084613, 'batch_size': 64}. Best is trial 425 with value: 10.402115430356979.
Trial 457 finished with value: 1972.8253060617167 and parameters: {'input_dropout': 0.0, 'hidden_layers': 5, 'hidden_units': 224, 'kernel_initializer': 'he_normal', 'hidden_activation': 'relu', 'hidden_dropout': 0.05, 'batch_norm': 'on', 'optimizer_type': 'adam', 'lr': 0.000719874635260524, 'batch_size': 64}. Best is trial 425 with value: 10.402115430356979.
Trial 458 finished with value: 13.639949733420298 and parameters: {'input_dropout': 0.0, 'hidden_layers': 5, 'hidden_units': 256, 'kernel_initializer': 'he_normal', 'hidden_activation': 'relu', 'hidden_dropout': 0.0, 'batch_norm': 'off', 'optimizer_type': 'adam', 'lr': 0.000993237906596359, 'batch_size': 64}. Best is trial 425 with value: 10.402115430356979.
Trial 459 finished with value: 21.793183404705854 and parameters: {'input_dropout': 0.0, 'hidden_layers': 4, 'hidden_units': 192, 'kernel_initializer': 'he_normal', 'hidden_activation': 'relu', 'hidden_dropout': 0.0, 'batch_norm': 'off', 'optimizer_type': 'adam', 'lr': 0.0011996542117819278, 'batch_size': 64}. Best is trial 425 with value: 10.402115430356979.
Trial 460 finished with value: 16.701849193120182 and parameters: {'input_dropout': 0.0, 'hidden_layers': 5, 'hidden_units': 160, 'kernel_initializer': 'he_normal', 'hidden_activation': 'relu', 'hidden_dropout': 0.0, 'batch_norm': 'off', 'optimizer_type': 'adam', 'lr': 0.0008274025771037048, 'batch_size': 64}. Best is trial 425 with value: 10.402115430356979.
Trial 461 finished with value: 78.55562323391939 and parameters: {'input_dropout': 0.05, 'hidden_layers': 5, 'hidden_units': 224, 'kernel_initializer': 'he_normal', 'hidden_activation': 'relu', 'hidden_dropout': 0.0, 'batch_norm': 'off', 'optimizer_type': 'adam', 'lr': 0.0016837681459440138, 'batch_size': 64}. Best is trial 425 with value: 10.402115430356979.
Trial 462 finished with value: 196.82725200071957 and parameters: {'input_dropout': 0.15000000000000002, 'hidden_layers': 5, 'hidden_units': 224, 'kernel_initializer': 'he_normal', 'hidden_activation': 'relu', 'hidden_dropout': 0.0, 'batch_norm': 'off', 'optimizer_type': 'adam', 'lr': 0.0010967484353780787, 'batch_size': 64}. Best is trial 425 with value: 10.402115430356979.
Trial 463 finished with value: 42.31259224624951 and parameters: {'input_dropout': 0.0, 'hidden_layers': 3, 'hidden_units': 224, 'kernel_initializer': 'he_normal', 'hidden_activation': 'relu', 'hidden_dropout': 0.0, 'batch_norm': 'off', 'optimizer_type': 'adam', 'lr': 0.0013547393109312506, 'batch_size': 64}. Best is trial 425 with value: 10.402115430356979.
Trial 464 finished with value: 21.881714695071242 and parameters: {'input_dropout': 0.0, 'hidden_layers': 5, 'hidden_units': 224, 'kernel_initializer': 'he_normal', 'hidden_activation': 'relu', 'hidden_dropout': 0.0, 'batch_norm': 'off', 'optimizer_type': 'adam', 'lr': 0.0005999080562069241, 'batch_size': 64}. Best is trial 425 with value: 10.402115430356979.
Trial 465 finished with value: 13.372438158600726 and parameters: {'input_dropout': 0.0, 'hidden_layers': 5, 'hidden_units': 224, 'kernel_initializer': 'he_normal', 'hidden_activation': 'relu', 'hidden_dropout': 0.0, 'batch_norm': 'off', 'optimizer_type': 'adam', 'lr': 0.0021049791267076954, 'batch_size': 64}. Best is trial 425 with value: 10.402115430356979.
Trial 466 finished with value: 25.469862391638273 and parameters: {'input_dropout': 0.0, 'hidden_layers': 5, 'hidden_units': 224, 'kernel_initializer': 'he_normal', 'hidden_activation': 'relu', 'hidden_dropout': 0.0, 'batch_norm': 'off', 'optimizer_type': 'adam', 'lr': 0.0015853977073360841, 'batch_size': 64}. Best is trial 425 with value: 10.402115430356979.
Trial 467 finished with value: 56.229758598283 and parameters: {'input_dropout': 0.0, 'hidden_layers': 5, 'hidden_units': 224, 'kernel_initializer': 'random_normal', 'hidden_activation': 'relu', 'hidden_dropout': 0.0, 'batch_norm': 'off', 'optimizer_type': 'adam', 'lr': 0.0009202396498099138, 'batch_size': 64}. Best is trial 425 with value: 10.402115430356979.
Trial 468 finished with value: 13.583693746498524 and parameters: {'input_dropout': 0.0, 'hidden_layers': 5, 'hidden_units': 224, 'kernel_initializer': 'he_normal', 'hidden_activation': 'relu', 'hidden_dropout': 0.0, 'batch_norm': 'off', 'optimizer_type': 'adam', 'lr': 0.0012743105954959048, 'batch_size': 64}. Best is trial 425 with value: 10.402115430356979.
Trial 469 finished with value: 11.854808239499356 and parameters: {'input_dropout': 0.0, 'hidden_layers': 5, 'hidden_units': 224, 'kernel_initializer': 'he_uniform', 'hidden_activation': 'relu', 'hidden_dropout': 0.0, 'batch_norm': 'off', 'optimizer_type': 'adam', 'lr': 0.0018096003119504602, 'batch_size': 64}. Best is trial 425 with value: 10.402115430356979.
Trial 470 finished with value: 23.44377906109339 and parameters: {'input_dropout': 0.0, 'hidden_layers': 5, 'hidden_units': 224, 'kernel_initializer': 'he_uniform', 'hidden_activation': 'relu', 'hidden_dropout': 0.0, 'batch_norm': 'off', 'optimizer_type': 'adam', 'lr': 0.002813480638948306, 'batch_size': 64}. Best is trial 425 with value: 10.402115430356979.
Trial 471 finished with value: 15.409702485970946 and parameters: {'input_dropout': 0.0, 'hidden_layers': 5, 'hidden_units': 192, 'kernel_initializer': 'he_normal', 'hidden_activation': 'leaky_relu', 'hidden_dropout': 0.0, 'batch_norm': 'off', 'optimizer_type': 'adam', 'lr': 0.001984134823234887, 'batch_size': 64}. Best is trial 425 with value: 10.402115430356979.
Trial 472 finished with value: 83.13725743173563 and parameters: {'input_dropout': 0.0, 'hidden_layers': 5, 'hidden_units': 224, 'kernel_initializer': 'he_normal', 'hidden_activation': 'prelu', 'hidden_dropout': 0.0, 'batch_norm': 'off', 'optimizer_type': 'rmsprop', 'lr': 0.00017357986585171412, 'batch_size': 96}. Best is trial 425 with value: 10.402115430356979.
Trial 473 finished with value: 80.12738125385128 and parameters: {'input_dropout': 0.0, 'hidden_layers': 5, 'hidden_units': 224, 'kernel_initializer': 'he_uniform', 'hidden_activation': 'relu', 'hidden_dropout': 0.05, 'batch_norm': 'off', 'optimizer_type': 'adam', 'lr': 0.0023024525585990732, 'batch_size': 64}. Best is trial 425 with value: 10.402115430356979.
Trial 474 finished with value: 18.543551876661855 and parameters: {'input_dropout': 0.0, 'hidden_layers': 5, 'hidden_units': 224, 'kernel_initializer': 'he_uniform', 'hidden_activation': 'relu', 'hidden_dropout': 0.0, 'batch_norm': 'off', 'optimizer_type': 'adam', 'lr': 0.001812654930211476, 'batch_size': 64}. Best is trial 425 with value: 10.402115430356979.
Trial 475 finished with value: 24.936266285177858 and parameters: {'input_dropout': 0.0, 'hidden_layers': 5, 'hidden_units': 256, 'kernel_initializer': 'he_uniform', 'hidden_activation': 'relu', 'hidden_dropout': 0.0, 'batch_norm': 'off', 'optimizer_type': 'adam', 'lr': 0.0017323807795214103, 'batch_size': 64}. Best is trial 425 with value: 10.402115430356979.
Trial 476 finished with value: 13.786271037715503 and parameters: {'input_dropout': 0.0, 'hidden_layers': 5, 'hidden_units': 224, 'kernel_initializer': 'he_uniform', 'hidden_activation': 'relu', 'hidden_dropout': 0.0, 'batch_norm': 'off', 'optimizer_type': 'adam', 'lr': 0.0007642430072830746, 'batch_size': 64}. Best is trial 425 with value: 10.402115430356979.
Trial 477 finished with value: 24.13592707529755 and parameters: {'input_dropout': 0.0, 'hidden_layers': 5, 'hidden_units': 224, 'kernel_initializer': 'he_uniform', 'hidden_activation': 'relu', 'hidden_dropout': 0.0, 'batch_norm': 'on', 'optimizer_type': 'adam', 'lr': 0.0015064004481557612, 'batch_size': 64}. Best is trial 425 with value: 10.402115430356979.
Trial 478 finished with value: 15.904096714727645 and parameters: {'input_dropout': 0.0, 'hidden_layers': 5, 'hidden_units': 224, 'kernel_initializer': 'he_uniform', 'hidden_activation': 'relu', 'hidden_dropout': 0.0, 'batch_norm': 'off', 'optimizer_type': 'adam', 'lr': 0.0011153123060132807, 'batch_size': 64}. Best is trial 425 with value: 10.402115430356979.
Trial 479 finished with value: 20.34816346970191 and parameters: {'input_dropout': 0.0, 'hidden_layers': 5, 'hidden_units': 96, 'kernel_initializer': 'he_uniform', 'hidden_activation': 'relu', 'hidden_dropout': 0.0, 'batch_norm': 'off', 'optimizer_type': 'adam', 'lr': 0.000935290357605218, 'batch_size': 64}. Best is trial 425 with value: 10.402115430356979.
