Trial 600 finished with value: 14.38577993553617 and parameters: {'input_dropout': 0.0, 'hidden_layers': 5, 'hidden_units': 256, 'kernel_initializer': 'he_uniform', 'hidden_activation': 'relu', 'hidden_dropout': 0.0, 'batch_norm': 'off', 'optimizer_type': 'adam', 'lr': 0.0008417000324765109, 'batch_size': 64}. Best is trial 425 with value: 10.402115430356979.
Trial 601 finished with value: 22.95516685793022 and parameters: {'input_dropout': 0.0, 'hidden_layers': 5, 'hidden_units': 224, 'kernel_initializer': 'he_uniform', 'hidden_activation': 'relu', 'hidden_dropout': 0.0, 'batch_norm': 'off', 'optimizer_type': 'adam', 'lr': 0.0005980387915498737, 'batch_size': 64}. Best is trial 425 with value: 10.402115430356979.
Trial 602 finished with value: 18.502226654961728 and parameters: {'input_dropout': 0.0, 'hidden_layers': 5, 'hidden_units': 224, 'kernel_initializer': 'he_uniform', 'hidden_activation': 'relu', 'hidden_dropout': 0.0, 'batch_norm': 'off', 'optimizer_type': 'adam', 'lr': 0.0006668856248485688, 'batch_size': 64}. Best is trial 425 with value: 10.402115430356979.
Trial 603 finished with value: 20.40065850644319 and parameters: {'input_dropout': 0.0, 'hidden_layers': 5, 'hidden_units': 192, 'kernel_initializer': 'he_uniform', 'hidden_activation': 'relu', 'hidden_dropout': 0.0, 'batch_norm': 'off', 'optimizer_type': 'adam', 'lr': 0.0073640893407574464, 'batch_size': 64}. Best is trial 425 with value: 10.402115430356979.
Trial 604 finished with value: 20.07205396998621 and parameters: {'input_dropout': 0.0, 'hidden_layers': 5, 'hidden_units': 224, 'kernel_initializer': 'he_uniform', 'hidden_activation': 'relu', 'hidden_dropout': 0.0, 'batch_norm': 'off', 'optimizer_type': 'adam', 'lr': 0.0007874053697027476, 'batch_size': 64}. Best is trial 425 with value: 10.402115430356979.
Trial 605 finished with value: 13.92569265643601 and parameters: {'input_dropout': 0.0, 'hidden_layers': 5, 'hidden_units': 224, 'kernel_initializer': 'he_uniform', 'hidden_activation': 'relu', 'hidden_dropout': 0.0, 'batch_norm': 'off', 'optimizer_type': 'adam', 'lr': 0.000956272627615236, 'batch_size': 64}. Best is trial 425 with value: 10.402115430356979.
Trial 606 finished with value: 86.72227746528193 and parameters: {'input_dropout': 0.0, 'hidden_layers': 5, 'hidden_units': 224, 'kernel_initializer': 'he_uniform', 'hidden_activation': 'leaky_relu', 'hidden_dropout': 0.05, 'batch_norm': 'off', 'optimizer_type': 'adam', 'lr': 0.0007441693443301453, 'batch_size': 64}. Best is trial 425 with value: 10.402115430356979.
Trial 607 finished with value: 124.9877390228389 and parameters: {'input_dropout': 0.0, 'hidden_layers': 5, 'hidden_units': 224, 'kernel_initializer': 'random_normal', 'hidden_activation': 'relu', 'hidden_dropout': 0.0, 'batch_norm': 'off', 'optimizer_type': 'adam', 'lr': 0.0004805678969402979, 'batch_size': 64}. Best is trial 425 with value: 10.402115430356979.
Trial 608 finished with value: 115.05245386717068 and parameters: {'input_dropout': 0.0, 'hidden_layers': 5, 'hidden_units': 224, 'kernel_initializer': 'he_uniform', 'hidden_activation': 'prelu', 'hidden_dropout': 0.0, 'batch_norm': 'off', 'optimizer_type': 'rmsprop', 'lr': 0.0009266446043564838, 'batch_size': 64}. Best is trial 425 with value: 10.402115430356979.
Trial 609 finished with value: 20.11751488252264 and parameters: {'input_dropout': 0.0, 'hidden_layers': 5, 'hidden_units': 224, 'kernel_initializer': 'he_normal', 'hidden_activation': 'relu', 'hidden_dropout': 0.0, 'batch_norm': 'off', 'optimizer_type': 'adam', 'lr': 0.001781229313805703, 'batch_size': 64}. Best is trial 425 with value: 10.402115430356979.
Trial 610 finished with value: 12.284241658636532 and parameters: {'input_dropout': 0.0, 'hidden_layers': 5, 'hidden_units': 224, 'kernel_initializer': 'he_normal', 'hidden_activation': 'relu', 'hidden_dropout': 0.0, 'batch_norm': 'off', 'optimizer_type': 'adam', 'lr': 0.0010593943914679377, 'batch_size': 64}. Best is trial 425 with value: 10.402115430356979.
Trial 611 finished with value: 19.972655199870545 and parameters: {'input_dropout': 0.0, 'hidden_layers': 5, 'hidden_units': 256, 'kernel_initializer': 'he_normal', 'hidden_activation': 'relu', 'hidden_dropout': 0.0, 'batch_norm': 'off', 'optimizer_type': 'adam', 'lr': 0.0010846778638650687, 'batch_size': 64}. Best is trial 425 with value: 10.402115430356979.
Trial 612 finished with value: 27.153537179304607 and parameters: {'input_dropout': 0.0, 'hidden_layers': 5, 'hidden_units': 192, 'kernel_initializer': 'he_normal', 'hidden_activation': 'relu', 'hidden_dropout': 0.0, 'batch_norm': 'on', 'optimizer_type': 'adam', 'lr': 0.0012261054120173808, 'batch_size': 64}. Best is trial 425 with value: 10.402115430356979.
Trial 613 finished with value: 46.78697680640732 and parameters: {'input_dropout': 0.0, 'hidden_layers': 5, 'hidden_units': 224, 'kernel_initializer': 'he_normal', 'hidden_activation': 'relu', 'hidden_dropout': 0.0, 'batch_norm': 'off', 'optimizer_type': 'adam', 'lr': 0.00020734421692861736, 'batch_size': 64}. Best is trial 425 with value: 10.402115430356979.
Trial 614 finished with value: 119.96832089863283 and parameters: {'input_dropout': 0.1, 'hidden_layers': 5, 'hidden_units': 224, 'kernel_initializer': 'he_normal', 'hidden_activation': 'relu', 'hidden_dropout': 0.0, 'batch_norm': 'off', 'optimizer_type': 'adam', 'lr': 0.00147984042716665, 'batch_size': 64}. Best is trial 425 with value: 10.402115430356979.
Trial 615 finished with value: 12.839322840626991 and parameters: {'input_dropout': 0.0, 'hidden_layers': 5, 'hidden_units': 224, 'kernel_initializer': 'he_normal', 'hidden_activation': 'relu', 'hidden_dropout': 0.0, 'batch_norm': 'off', 'optimizer_type': 'adam', 'lr': 0.001062813330982396, 'batch_size': 64}. Best is trial 425 with value: 10.402115430356979.
Trial 616 finished with value: 13.204829660506807 and parameters: {'input_dropout': 0.0, 'hidden_layers': 5, 'hidden_units': 224, 'kernel_initializer': 'he_normal', 'hidden_activation': 'relu', 'hidden_dropout': 0.0, 'batch_norm': 'off', 'optimizer_type': 'adam', 'lr': 0.0010278752416891803, 'batch_size': 64}. Best is trial 425 with value: 10.402115430356979.
Trial 617 finished with value: 18.410703378334592 and parameters: {'input_dropout': 0.0, 'hidden_layers': 5, 'hidden_units': 224, 'kernel_initializer': 'he_normal', 'hidden_activation': 'relu', 'hidden_dropout': 0.0, 'batch_norm': 'off', 'optimizer_type': 'adam', 'lr': 0.001169131641907091, 'batch_size': 64}. Best is trial 425 with value: 10.402115430356979.
Trial 618 finished with value: 25.715628958789615 and parameters: {'input_dropout': 0.0, 'hidden_layers': 4, 'hidden_units': 160, 'kernel_initializer': 'he_normal', 'hidden_activation': 'relu', 'hidden_dropout': 0.0, 'batch_norm': 'off', 'optimizer_type': 'adam', 'lr': 0.0010518553215929033, 'batch_size': 64}. Best is trial 425 with value: 10.402115430356979.
Trial 619 finished with value: 31.902615740613573 and parameters: {'input_dropout': 0.0, 'hidden_layers': 5, 'hidden_units': 224, 'kernel_initializer': 'he_normal', 'hidden_activation': 'relu', 'hidden_dropout': 0.0, 'batch_norm': 'off', 'optimizer_type': 'adam', 'lr': 0.0013279238334842618, 'batch_size': 96}. Best is trial 425 with value: 10.402115430356979.
Trial 620 finished with value: 17.355282851496593 and parameters: {'input_dropout': 0.0, 'hidden_layers': 5, 'hidden_units': 224, 'kernel_initializer': 'he_normal', 'hidden_activation': 'relu', 'hidden_dropout': 0.0, 'batch_norm': 'off', 'optimizer_type': 'adam', 'lr': 0.001163721734293074, 'batch_size': 64}. Best is trial 425 with value: 10.402115430356979.
Trial 621 finished with value: 267.5182045238516 and parameters: {'input_dropout': 0.15000000000000002, 'hidden_layers': 5, 'hidden_units': 224, 'kernel_initializer': 'he_normal', 'hidden_activation': 'relu', 'hidden_dropout': 0.1, 'batch_norm': 'off', 'optimizer_type': 'adam', 'lr': 0.0010039229773058408, 'batch_size': 64}. Best is trial 425 with value: 10.402115430356979.
Trial 622 finished with value: 104.5088953591841 and parameters: {'input_dropout': 0.0, 'hidden_layers': 5, 'hidden_units': 192, 'kernel_initializer': 'he_normal', 'hidden_activation': 'relu', 'hidden_dropout': 0.0, 'batch_norm': 'off', 'optimizer_type': 'adam', 'lr': 0.00013092158874739124, 'batch_size': 64}. Best is trial 425 with value: 10.402115430356979.
Trial 623 finished with value: 357.466366288316 and parameters: {'input_dropout': 0.05, 'hidden_layers': 5, 'hidden_units': 224, 'kernel_initializer': 'he_normal', 'hidden_activation': 'relu', 'hidden_dropout': 0.2, 'batch_norm': 'off', 'optimizer_type': 'adam', 'lr': 0.001507506797631632, 'batch_size': 128}. Best is trial 425 with value: 10.402115430356979.
Trial 624 finished with value: 13.268976567650634 and parameters: {'input_dropout': 0.0, 'hidden_layers': 5, 'hidden_units': 256, 'kernel_initializer': 'he_normal', 'hidden_activation': 'relu', 'hidden_dropout': 0.0, 'batch_norm': 'off', 'optimizer_type': 'adam', 'lr': 0.0013098312444382015, 'batch_size': 64}. Best is trial 425 with value: 10.402115430356979.
Trial 625 finished with value: 77.40307132259804 and parameters: {'input_dropout': 0.0, 'hidden_layers': 5, 'hidden_units': 224, 'kernel_initializer': 'he_normal', 'hidden_activation': 'relu', 'hidden_dropout': 0.05, 'batch_norm': 'off', 'optimizer_type': 'adam', 'lr': 0.0009961762261513235, 'batch_size': 64}. Best is trial 425 with value: 10.402115430356979.
Trial 626 finished with value: 12.936245957997079 and parameters: {'input_dropout': 0.0, 'hidden_layers': 5, 'hidden_units': 224, 'kernel_initializer': 'he_normal', 'hidden_activation': 'relu', 'hidden_dropout': 0.0, 'batch_norm': 'off', 'optimizer_type': 'adam', 'lr': 0.001640570703960032, 'batch_size': 64}. Best is trial 425 with value: 10.402115430356979.
Trial 627 finished with value: 16.75112135647564 and parameters: {'input_dropout': 0.0, 'hidden_layers': 5, 'hidden_units': 224, 'kernel_initializer': 'he_normal', 'hidden_activation': 'leaky_relu', 'hidden_dropout': 0.0, 'batch_norm': 'off', 'optimizer_type': 'adam', 'lr': 0.0022110111227739526, 'batch_size': 64}. Best is trial 425 with value: 10.402115430356979.
Trial 628 finished with value: 110.31205898772612 and parameters: {'input_dropout': 0.0, 'hidden_layers': 5, 'hidden_units': 224, 'kernel_initializer': 'he_normal', 'hidden_activation': 'relu', 'hidden_dropout': 0.0, 'batch_norm': 'off', 'optimizer_type': 'rmsprop', 'lr': 0.001169966310938963, 'batch_size': 64}. Best is trial 425 with value: 10.402115430356979.
Trial 629 finished with value: 16.23629680879913 and parameters: {'input_dropout': 0.0, 'hidden_layers': 5, 'hidden_units': 224, 'kernel_initializer': 'he_normal', 'hidden_activation': 'relu', 'hidden_dropout': 0.0, 'batch_norm': 'off', 'optimizer_type': 'adam', 'lr': 0.0008884505975369239, 'batch_size': 64}. Best is trial 425 with value: 10.402115430356979.
Trial 630 finished with value: 72.3660217235717 and parameters: {'input_dropout': 0.0, 'hidden_layers': 2, 'hidden_units': 224, 'kernel_initializer': 'he_normal', 'hidden_activation': 'relu', 'hidden_dropout': 0.0, 'batch_norm': 'off', 'optimizer_type': 'adam', 'lr': 0.0013989400224382336, 'batch_size': 64}. Best is trial 425 with value: 10.402115430356979.
Trial 631 finished with value: 15.189117372831426 and parameters: {'input_dropout': 0.0, 'hidden_layers': 5, 'hidden_units': 224, 'kernel_initializer': 'he_normal', 'hidden_activation': 'prelu', 'hidden_dropout': 0.0, 'batch_norm': 'off', 'optimizer_type': 'adam', 'lr': 0.0018540525346292876, 'batch_size': 64}. Best is trial 425 with value: 10.402115430356979.
Trial 632 finished with value: 26.212903322662775 and parameters: {'input_dropout': 0.0, 'hidden_layers': 3, 'hidden_units': 224, 'kernel_initializer': 'he_normal', 'hidden_activation': 'relu', 'hidden_dropout': 0.0, 'batch_norm': 'off', 'optimizer_type': 'adam', 'lr': 0.001558209056467702, 'batch_size': 64}. Best is trial 425 with value: 10.402115430356979.
Trial 633 finished with value: 32.84976870249789 and parameters: {'input_dropout': 0.0, 'hidden_layers': 5, 'hidden_units': 224, 'kernel_initializer': 'he_normal', 'hidden_activation': 'relu', 'hidden_dropout': 0.0, 'batch_norm': 'on', 'optimizer_type': 'adam', 'lr': 0.0011319433343584236, 'batch_size': 64}. Best is trial 425 with value: 10.402115430356979.
Trial 634 finished with value: 15.170559411126126 and parameters: {'input_dropout': 0.0, 'hidden_layers': 5, 'hidden_units': 256, 'kernel_initializer': 'he_normal', 'hidden_activation': 'relu', 'hidden_dropout': 0.0, 'batch_norm': 'off', 'optimizer_type': 'adam', 'lr': 0.0013053072872677588, 'batch_size': 64}. Best is trial 425 with value: 10.402115430356979.
Trial 635 finished with value: 17.48307857014113 and parameters: {'input_dropout': 0.0, 'hidden_layers': 5, 'hidden_units': 224, 'kernel_initializer': 'he_normal', 'hidden_activation': 'relu', 'hidden_dropout': 0.0, 'batch_norm': 'off', 'optimizer_type': 'adam', 'lr': 0.0009086566566778763, 'batch_size': 64}. Best is trial 425 with value: 10.402115430356979.
Trial 636 finished with value: 22.98139648737265 and parameters: {'input_dropout': 0.0, 'hidden_layers': 5, 'hidden_units': 224, 'kernel_initializer': 'he_normal', 'hidden_activation': 'relu', 'hidden_dropout': 0.0, 'batch_norm': 'off', 'optimizer_type': 'adam', 'lr': 0.001087019217381206, 'batch_size': 64}. Best is trial 425 with value: 10.402115430356979.
Trial 637 finished with value: 47.72046107953093 and parameters: {'input_dropout': 0.0, 'hidden_layers': 5, 'hidden_units': 192, 'kernel_initializer': 'random_normal', 'hidden_activation': 'relu', 'hidden_dropout': 0.0, 'batch_norm': 'off', 'optimizer_type': 'adam', 'lr': 0.0016432205133145837, 'batch_size': 64}. Best is trial 425 with value: 10.402115430356979.
Trial 638 finished with value: 24.628030176557953 and parameters: {'input_dropout': 0.0, 'hidden_layers': 5, 'hidden_units': 224, 'kernel_initializer': 'he_normal', 'hidden_activation': 'relu', 'hidden_dropout': 0.0, 'batch_norm': 'off', 'optimizer_type': 'adam', 'lr': 0.0013366207991797536, 'batch_size': 64}. Best is trial 425 with value: 10.402115430356979.
Trial 639 finished with value: 24.940702270237463 and parameters: {'input_dropout': 0.0, 'hidden_layers': 5, 'hidden_units': 224, 'kernel_initializer': 'he_normal', 'hidden_activation': 'relu', 'hidden_dropout': 0.0, 'batch_norm': 'off', 'optimizer_type': 'adam', 'lr': 0.0009773562958971889, 'batch_size': 64}. Best is trial 425 with value: 10.402115430356979.
Trial 640 finished with value: 21.197395444024767 and parameters: {'input_dropout': 0.0, 'hidden_layers': 5, 'hidden_units': 224, 'kernel_initializer': 'he_normal', 'hidden_activation': 'relu', 'hidden_dropout': 0.0, 'batch_norm': 'off', 'optimizer_type': 'adam', 'lr': 0.003280680807640053, 'batch_size': 64}. Best is trial 425 with value: 10.402115430356979.
Trial 641 finished with value: 13.970465146376053 and parameters: {'input_dropout': 0.0, 'hidden_layers': 5, 'hidden_units': 224, 'kernel_initializer': 'he_normal', 'hidden_activation': 'relu', 'hidden_dropout': 0.0, 'batch_norm': 'off', 'optimizer_type': 'adam', 'lr': 0.0019985736565584057, 'batch_size': 64}. Best is trial 425 with value: 10.402115430356979.
Trial 642 finished with value: 18.98220051579204 and parameters: {'input_dropout': 0.0, 'hidden_layers': 5, 'hidden_units': 224, 'kernel_initializer': 'he_normal', 'hidden_activation': 'relu', 'hidden_dropout': 0.0, 'batch_norm': 'off', 'optimizer_type': 'adam', 'lr': 0.0012076098434203914, 'batch_size': 32}. Best is trial 425 with value: 10.402115430356979.
Trial 643 finished with value: 190.11573284663538 and parameters: {'input_dropout': 0.2, 'hidden_layers': 5, 'hidden_units': 224, 'kernel_initializer': 'he_normal', 'hidden_activation': 'relu', 'hidden_dropout': 0.0, 'batch_norm': 'off', 'optimizer_type': 'adam', 'lr': 0.0025646434213570696, 'batch_size': 64}. Best is trial 425 with value: 10.402115430356979.
Trial 644 finished with value: 24.00687441585712 and parameters: {'input_dropout': 0.0, 'hidden_layers': 5, 'hidden_units': 192, 'kernel_initializer': 'he_normal', 'hidden_activation': 'relu', 'hidden_dropout': 0.0, 'batch_norm': 'off', 'optimizer_type': 'adam', 'lr': 0.0008325170471199853, 'batch_size': 64}. Best is trial 425 with value: 10.402115430356979.
Trial 645 finished with value: 19.637637171849267 and parameters: {'input_dropout': 0.0, 'hidden_layers': 5, 'hidden_units': 256, 'kernel_initializer': 'he_normal', 'hidden_activation': 'relu', 'hidden_dropout': 0.0, 'batch_norm': 'off', 'optimizer_type': 'adam', 'lr': 0.001499192752065761, 'batch_size': 64}. Best is trial 425 with value: 10.402115430356979.
Trial 646 finished with value: 20.3474202528186 and parameters: {'input_dropout': 0.0, 'hidden_layers': 5, 'hidden_units': 224, 'kernel_initializer': 'he_normal', 'hidden_activation': 'relu', 'hidden_dropout': 0.0, 'batch_norm': 'off', 'optimizer_type': 'adam', 'lr': 0.0010489626704853472, 'batch_size': 64}. Best is trial 425 with value: 10.402115430356979.
Trial 647 finished with value: 113.14910469813981 and parameters: {'input_dropout': 0.0, 'hidden_layers': 5, 'hidden_units': 224, 'kernel_initializer': 'he_normal', 'hidden_activation': 'relu', 'hidden_dropout': 0.05, 'batch_norm': 'off', 'optimizer_type': 'rmsprop', 'lr': 0.0016768633497050765, 'batch_size': 64}. Best is trial 425 with value: 10.402115430356979.
Trial 648 finished with value: 18.707270221341915 and parameters: {'input_dropout': 0.0, 'hidden_layers': 5, 'hidden_units': 224, 'kernel_initializer': 'he_normal', 'hidden_activation': 'leaky_relu', 'hidden_dropout': 0.0, 'batch_norm': 'off', 'optimizer_type': 'adam', 'lr': 0.0008924915541904733, 'batch_size': 64}. Best is trial 425 with value: 10.402115430356979.
Trial 649 finished with value: 16.294283564243308 and parameters: {'input_dropout': 0.0, 'hidden_layers': 5, 'hidden_units': 224, 'kernel_initializer': 'he_normal', 'hidden_activation': 'relu', 'hidden_dropout': 0.0, 'batch_norm': 'off', 'optimizer_type': 'adam', 'lr': 0.001379548180146943, 'batch_size': 64}. Best is trial 425 with value: 10.402115430356979.
Trial 650 finished with value: 54.45524128631695 and parameters: {'input_dropout': 0.05, 'hidden_layers': 5, 'hidden_units': 224, 'kernel_initializer': 'he_normal', 'hidden_activation': 'relu', 'hidden_dropout': 0.0, 'batch_norm': 'off', 'optimizer_type': 'adam', 'lr': 0.00123239517021169, 'batch_size': 64}. Best is trial 425 with value: 10.402115430356979.
Trial 651 finished with value: 33.46922610386112 and parameters: {'input_dropout': 0.0, 'hidden_layers': 5, 'hidden_units': 224, 'kernel_initializer': 'he_normal', 'hidden_activation': 'relu', 'hidden_dropout': 0.0, 'batch_norm': 'off', 'optimizer_type': 'adam', 'lr': 0.00028368537580607944, 'batch_size': 64}. Best is trial 425 with value: 10.402115430356979.
Trial 652 finished with value: 87.91072107346272 and parameters: {'input_dropout': 0.0, 'hidden_layers': 5, 'hidden_units': 256, 'kernel_initializer': 'he_normal', 'hidden_activation': 'relu', 'hidden_dropout': 0.15000000000000002, 'batch_norm': 'on', 'optimizer_type': 'adam', 'lr': 0.0010371666856120797, 'batch_size': 64}. Best is trial 425 with value: 10.402115430356979.
Trial 653 finished with value: 16.884431081748406 and parameters: {'input_dropout': 0.0, 'hidden_layers': 5, 'hidden_units': 224, 'kernel_initializer': 'he_normal', 'hidden_activation': 'prelu', 'hidden_dropout': 0.0, 'batch_norm': 'off', 'optimizer_type': 'adam', 'lr': 0.0018977390055632355, 'batch_size': 64}. Best is trial 425 with value: 10.402115430356979.
Trial 654 finished with value: 19.184901096418592 and parameters: {'input_dropout': 0.0, 'hidden_layers': 5, 'hidden_units': 160, 'kernel_initializer': 'he_normal', 'hidden_activation': 'relu', 'hidden_dropout': 0.0, 'batch_norm': 'off', 'optimizer_type': 'adam', 'lr': 0.0011742669297273862, 'batch_size': 64}. Best is trial 425 with value: 10.402115430356979.
Trial 655 finished with value: 17.16348514895024 and parameters: {'input_dropout': 0.0, 'hidden_layers': 5, 'hidden_units': 224, 'kernel_initializer': 'he_normal', 'hidden_activation': 'relu', 'hidden_dropout': 0.0, 'batch_norm': 'off', 'optimizer_type': 'adam', 'lr': 0.0014607191950849131, 'batch_size': 64}. Best is trial 425 with value: 10.402115430356979.
Trial 656 failed because of the following error: KeyboardInterrupt()
Traceback (most recent call last):
  File "/usr/local/lib/python3.8/dist-packages/optuna/study/_optimize.py", line 196, in _run_trial
    value_or_values = func(trial)
  File "/tmp/ipykernel_102620/3251956394.py", line 53, in __call__
    model.fit(tr_x=train_explanatory_variable, tr_y=train_objective_variable,
  File "/tmp/ipykernel_102620/1998736836.py", line 71, in fit
    history = self.model.fit(
  File "/usr/local/lib/python3.8/dist-packages/keras/utils/traceback_utils.py", line 64, in error_handler
    return fn(*args, **kwargs)
  File "/usr/local/lib/python3.8/dist-packages/keras/engine/training.py", line 1445, in fit
    val_logs = self.evaluate(
  File "/usr/local/lib/python3.8/dist-packages/keras/utils/traceback_utils.py", line 64, in error_handler
    return fn(*args, **kwargs)
  File "/usr/local/lib/python3.8/dist-packages/keras/engine/training.py", line 1749, in evaluate
    callbacks.on_test_begin()
  File "/usr/local/lib/python3.8/dist-packages/keras/callbacks.py", line 515, in on_test_begin
    callback.on_test_begin(logs)
KeyboardInterrupt
