A new study created in RDB with name: MLP_91153
Trial 0 finished with value: 113.14763640204342 and parameters: {'input_dropout': 0.05, 'hidden_layers': 2, 'hidden_units': 192, 'kernel_initializer': 'he_uniform', 'hidden_activation': 'prelu', 'hidden_dropout': 0.15000000000000002, 'batch_norm': 'off', 'optimizer_type': 'adam', 'lr': 0.005833076814463422, 'batch_size': 96}. Best is trial 0 with value: 113.14763640204342.
Trial 1 finished with value: 1354.748976075616 and parameters: {'input_dropout': 0.15000000000000002, 'hidden_layers': 4, 'hidden_units': 64, 'kernel_initializer': 'random_normal', 'hidden_activation': 'leaky_relu', 'hidden_dropout': 0.2, 'batch_norm': 'off', 'optimizer_type': 'rmsprop', 'lr': 6.961293262007917e-05, 'batch_size': 128}. Best is trial 0 with value: 113.14763640204342.
Trial 2 finished with value: 21812.86340952214 and parameters: {'input_dropout': 0.1, 'hidden_layers': 2, 'hidden_units': 32, 'kernel_initializer': 'random_normal', 'hidden_activation': 'leaky_relu', 'hidden_dropout': 0.3, 'batch_norm': 'on', 'optimizer_type': 'rmsprop', 'lr': 0.0001080651219721655, 'batch_size': 64}. Best is trial 0 with value: 113.14763640204342.
Trial 3 finished with value: 5589.258739731475 and parameters: {'input_dropout': 0.2, 'hidden_layers': 2, 'hidden_units': 32, 'kernel_initializer': 'he_uniform', 'hidden_activation': 'relu', 'hidden_dropout': 0.05, 'batch_norm': 'on', 'optimizer_type': 'rmsprop', 'lr': 0.0014491010620012069, 'batch_size': 128}. Best is trial 0 with value: 113.14763640204342.
Trial 4 finished with value: 58.86486213008148 and parameters: {'input_dropout': 0.0, 'hidden_layers': 5, 'hidden_units': 224, 'kernel_initializer': 'random_normal', 'hidden_activation': 'relu', 'hidden_dropout': 0.0, 'batch_norm': 'off', 'optimizer_type': 'adam', 'lr': 0.00028025390232301465, 'batch_size': 32}. Best is trial 4 with value: 58.86486213008148.
Trial 5 finished with value: 11744.706128259711 and parameters: {'input_dropout': 0.0, 'hidden_layers': 2, 'hidden_units': 128, 'kernel_initializer': 'he_normal', 'hidden_activation': 'relu', 'hidden_dropout': 0.05, 'batch_norm': 'on', 'optimizer_type': 'adam', 'lr': 0.00017310644241121985, 'batch_size': 64}. Best is trial 4 with value: 58.86486213008148.
Trial 6 finished with value: 20128.117198005868 and parameters: {'input_dropout': 0.15000000000000002, 'hidden_layers': 4, 'hidden_units': 64, 'kernel_initializer': 'random_normal', 'hidden_activation': 'leaky_relu', 'hidden_dropout': 0.25, 'batch_norm': 'on', 'optimizer_type': 'rmsprop', 'lr': 5.7091693224554094e-05, 'batch_size': 32}. Best is trial 4 with value: 58.86486213008148.
Trial 7 finished with value: 23533.357808986766 and parameters: {'input_dropout': 0.0, 'hidden_layers': 4, 'hidden_units': 96, 'kernel_initializer': 'random_normal', 'hidden_activation': 'prelu', 'hidden_dropout': 0.15000000000000002, 'batch_norm': 'on', 'optimizer_type': 'rmsprop', 'lr': 2.6776154382826383e-05, 'batch_size': 128}. Best is trial 4 with value: 58.86486213008148.
Trial 8 failed because of the following error: ValueError('Input contains NaN.')
Traceback (most recent call last):
  File "/usr/local/lib/python3.8/dist-packages/optuna/study/_optimize.py", line 196, in _run_trial
    value_or_values = func(trial)
  File "/tmp/ipykernel_102620/4177894695.py", line 58, in __call__
    scores.append(mean_squared_error(validate_objective_variable, validate_pred))
  File "/usr/local/lib/python3.8/dist-packages/sklearn/metrics/_regression.py", line 442, in mean_squared_error
    y_type, y_true, y_pred, multioutput = _check_reg_targets(
  File "/usr/local/lib/python3.8/dist-packages/sklearn/metrics/_regression.py", line 102, in _check_reg_targets
    y_pred = check_array(y_pred, ensure_2d=False, dtype=dtype)
  File "/usr/local/lib/python3.8/dist-packages/sklearn/utils/validation.py", line 899, in check_array
    _assert_all_finite(
  File "/usr/local/lib/python3.8/dist-packages/sklearn/utils/validation.py", line 146, in _assert_all_finite
    raise ValueError(msg_err)
ValueError: Input contains NaN.
