A new study created in RDB with name: MLP_93627
Trial 0 finished with value: 4921.703935446604 and parameters: {'input_dropout': 0.2, 'hidden_layers': 2, 'hidden_units': 64, 'kernel_initializer': 'he_uniform', 'hidden_activation': 'prelu', 'hidden_dropout': 0.1, 'batch_norm': 'off', 'optimizer_type': 'rmsprop', 'lr': 2.132672724772604e-05, 'batch_size': 64}. Best is trial 0 with value: 4921.703935446604.
Trial 1 finished with value: 189.76226386064795 and parameters: {'input_dropout': 0.1, 'hidden_layers': 3, 'hidden_units': 64, 'kernel_initializer': 'he_normal', 'hidden_activation': 'leaky_relu', 'hidden_dropout': 0.25, 'batch_norm': 'on', 'optimizer_type': 'sgd', 'lr': 0.0008996790880061689, 'batch_size': 96}. Best is trial 1 with value: 189.76226386064795.
Trial 2 finished with value: 1030.9172869983104 and parameters: {'input_dropout': 0.05, 'hidden_layers': 2, 'hidden_units': 96, 'kernel_initializer': 'random_normal', 'hidden_activation': 'relu', 'hidden_dropout': 0.15000000000000002, 'batch_norm': 'off', 'optimizer_type': 'rmsprop', 'lr': 2.4064314154508975e-05, 'batch_size': 96}. Best is trial 1 with value: 189.76226386064795.
Trial 3 finished with value: 5209.211736614441 and parameters: {'input_dropout': 0.2, 'hidden_layers': 4, 'hidden_units': 128, 'kernel_initializer': 'he_normal', 'hidden_activation': 'relu', 'hidden_dropout': 0.2, 'batch_norm': 'off', 'optimizer_type': 'rmsprop', 'lr': 5.498771333217036e-05, 'batch_size': 32}. Best is trial 1 with value: 189.76226386064795.
Trial 4 finished with value: 21285.493726435667 and parameters: {'input_dropout': 0.05, 'hidden_layers': 4, 'hidden_units': 192, 'kernel_initializer': 'he_uniform', 'hidden_activation': 'relu', 'hidden_dropout': 0.3, 'batch_norm': 'on', 'optimizer_type': 'adam', 'lr': 3.180215043534683e-05, 'batch_size': 32}. Best is trial 1 with value: 189.76226386064795.
Trial 5 finished with value: 188.7232914209352 and parameters: {'input_dropout': 0.2, 'hidden_layers': 2, 'hidden_units': 64, 'kernel_initializer': 'random_normal', 'hidden_activation': 'prelu', 'hidden_dropout': 0.0, 'batch_norm': 'on', 'optimizer_type': 'rmsprop', 'lr': 0.0004392503876099897, 'batch_size': 32}. Best is trial 5 with value: 188.7232914209352.
Trial 6 finished with value: 3069.0697276737224 and parameters: {'input_dropout': 0.0, 'hidden_layers': 2, 'hidden_units': 128, 'kernel_initializer': 'he_uniform', 'hidden_activation': 'leaky_relu', 'hidden_dropout': 0.05, 'batch_norm': 'on', 'optimizer_type': 'rmsprop', 'lr': 0.004084130751360017, 'batch_size': 96}. Best is trial 5 with value: 188.7232914209352.
Trial 7 finished with value: 330.9908121416344 and parameters: {'input_dropout': 0.2, 'hidden_layers': 5, 'hidden_units': 224, 'kernel_initializer': 'he_normal', 'hidden_activation': 'leaky_relu', 'hidden_dropout': 0.0, 'batch_norm': 'off', 'optimizer_type': 'adam', 'lr': 0.006639763121998747, 'batch_size': 64}. Best is trial 5 with value: 188.7232914209352.
Trial 8 finished with value: 22215.990075265934 and parameters: {'input_dropout': 0.0, 'hidden_layers': 3, 'hidden_units': 64, 'kernel_initializer': 'he_uniform', 'hidden_activation': 'relu', 'hidden_dropout': 0.1, 'batch_norm': 'on', 'optimizer_type': 'adam', 'lr': 5.684981666308784e-05, 'batch_size': 96}. Best is trial 5 with value: 188.7232914209352.
Trial 9 finished with value: 4699.5070062006 and parameters: {'input_dropout': 0.0, 'hidden_layers': 5, 'hidden_units': 160, 'kernel_initializer': 'he_normal', 'hidden_activation': 'leaky_relu', 'hidden_dropout': 0.2, 'batch_norm': 'on', 'optimizer_type': 'adam', 'lr': 0.000614959724548895, 'batch_size': 96}. Best is trial 5 with value: 188.7232914209352.
Trial 10 finished with value: 354.40056738816463 and parameters: {'input_dropout': 0.15000000000000002, 'hidden_layers': 3, 'hidden_units': 32, 'kernel_initializer': 'random_normal', 'hidden_activation': 'prelu', 'hidden_dropout': 0.0, 'batch_norm': 'on', 'optimizer_type': 'sgd', 'lr': 0.0001843061236752808, 'batch_size': 128}. Best is trial 5 with value: 188.7232914209352.
Trial 11 finished with value: 187.70757401353265 and parameters: {'input_dropout': 0.1, 'hidden_layers': 3, 'hidden_units': 32, 'kernel_initializer': 'random_normal', 'hidden_activation': 'prelu', 'hidden_dropout': 0.3, 'batch_norm': 'on', 'optimizer_type': 'sgd', 'lr': 0.0007875847105882973, 'batch_size': 128}. Best is trial 11 with value: 187.70757401353265.
Trial 12 finished with value: 197.32771973967772 and parameters: {'input_dropout': 0.1, 'hidden_layers': 2, 'hidden_units': 32, 'kernel_initializer': 'random_normal', 'hidden_activation': 'prelu', 'hidden_dropout': 0.3, 'batch_norm': 'on', 'optimizer_type': 'sgd', 'lr': 0.0017322529570501523, 'batch_size': 128}. Best is trial 11 with value: 187.70757401353265.
Trial 13 finished with value: 199.7894558317049 and parameters: {'input_dropout': 0.15000000000000002, 'hidden_layers': 3, 'hidden_units': 32, 'kernel_initializer': 'random_normal', 'hidden_activation': 'prelu', 'hidden_dropout': 0.2, 'batch_norm': 'on', 'optimizer_type': 'sgd', 'lr': 0.00029882898562337535, 'batch_size': 32}. Best is trial 11 with value: 187.70757401353265.
Trial 14 finished with value: 266.11718590652646 and parameters: {'input_dropout': 0.15000000000000002, 'hidden_layers': 4, 'hidden_units': 96, 'kernel_initializer': 'random_normal', 'hidden_activation': 'prelu', 'hidden_dropout': 0.1, 'batch_norm': 'on', 'optimizer_type': 'sgd', 'lr': 0.0001458982347818379, 'batch_size': 64}. Best is trial 11 with value: 187.70757401353265.
Trial 15 finished with value: 219.72711565351113 and parameters: {'input_dropout': 0.05, 'hidden_layers': 2, 'hidden_units': 256, 'kernel_initializer': 'random_normal', 'hidden_activation': 'prelu', 'hidden_dropout': 0.25, 'batch_norm': 'on', 'optimizer_type': 'rmsprop', 'lr': 0.001815862376092429, 'batch_size': 128}. Best is trial 11 with value: 187.70757401353265.
Trial 16 finished with value: 232.83295939191302 and parameters: {'input_dropout': 0.1, 'hidden_layers': 3, 'hidden_units': 96, 'kernel_initializer': 'random_normal', 'hidden_activation': 'prelu', 'hidden_dropout': 0.05, 'batch_norm': 'on', 'optimizer_type': 'sgd', 'lr': 0.000625661994398556, 'batch_size': 64}. Best is trial 11 with value: 187.70757401353265.
Trial 17 finished with value: 163.4645363001716 and parameters: {'input_dropout': 0.15000000000000002, 'hidden_layers': 2, 'hidden_units': 64, 'kernel_initializer': 'random_normal', 'hidden_activation': 'prelu', 'hidden_dropout': 0.15000000000000002, 'batch_norm': 'on', 'optimizer_type': 'rmsprop', 'lr': 0.002005487297433783, 'batch_size': 32}. Best is trial 17 with value: 163.4645363001716.
Trial 18 failed because of the following error: ValueError('Input contains NaN.')
Traceback (most recent call last):
  File "/usr/local/lib/python3.8/dist-packages/optuna/study/_optimize.py", line 196, in _run_trial
    value_or_values = func(trial)
  File "/tmp/ipykernel_102620/2376586184.py", line 60, in __call__
    scores.append(mean_squared_error(validate_objective_variable, validate_pred))
  File "/usr/local/lib/python3.8/dist-packages/sklearn/metrics/_regression.py", line 442, in mean_squared_error
    y_type, y_true, y_pred, multioutput = _check_reg_targets(
  File "/usr/local/lib/python3.8/dist-packages/sklearn/metrics/_regression.py", line 102, in _check_reg_targets
    y_pred = check_array(y_pred, ensure_2d=False, dtype=dtype)
  File "/usr/local/lib/python3.8/dist-packages/sklearn/utils/validation.py", line 899, in check_array
    _assert_all_finite(
  File "/usr/local/lib/python3.8/dist-packages/sklearn/utils/validation.py", line 146, in _assert_all_finite
    raise ValueError(msg_err)
ValueError: Input contains NaN.
