A new study created in RDB with name: SVR_14125
Trial 4 finished with value: -0.023359501702395313 and parameters: {'kernel': 'linear', 'epsilon': 0.6728621938972464, 'degree': 2, 'C': 1.5813969950821456}. Best is trial 4 with value: -0.023359501702395313.
Trial 10 finished with value: -1.9167838295515607 and parameters: {'kernel': 'sigmoid', 'epsilon': 0.2838958597140512, 'degree': 3, 'C': 0.7419120336616126}. Best is trial 4 with value: -0.023359501702395313.
Trial 12 finished with value: -4.6871429603421975 and parameters: {'kernel': 'poly', 'epsilon': 0.5718438277190468, 'degree': 6, 'C': 0.04280105463095277}. Best is trial 4 with value: -0.023359501702395313.
Trial 19 finished with value: -0.022755573077481262 and parameters: {'kernel': 'linear', 'epsilon': 0.32661633990746053, 'degree': 4, 'C': 1.8366423209041527}. Best is trial 11 with value: 0.05531934963934123.
Trial 11 finished with value: 0.05531934963934123 and parameters: {'kernel': 'rbf', 'epsilon': 0.5014416364910296, 'degree': 4, 'C': 8.325987397956395}. Best is trial 11 with value: 0.05531934963934123.
Trial 16 finished with value: -3.4919645108223443 and parameters: {'kernel': 'linear', 'epsilon': 0.7491879145359224, 'degree': 2, 'C': 0.009973315673118098}. Best is trial 11 with value: 0.05531934963934123.
Trial 0 finished with value: -0.36191513739901543 and parameters: {'kernel': 'linear', 'epsilon': 0.7654417465812666, 'degree': 3, 'C': 0.14756035563533249}. Best is trial 11 with value: 0.05531934963934123.
Trial 22 finished with value: -5.4219403134740505 and parameters: {'kernel': 'poly', 'epsilon': 0.8038971298102734, 'degree': 4, 'C': 0.0006277701361557448}. Best is trial 11 with value: 0.05531934963934123.
Trial 3 finished with value: -0.02010174999849811 and parameters: {'kernel': 'linear', 'epsilon': 0.7727661097386043, 'degree': 3, 'C': 9.11343215956475}. Best is trial 11 with value: 0.05531934963934123.
Trial 8 finished with value: -3.6611912581194086 and parameters: {'kernel': 'poly', 'epsilon': 0.8036122591756915, 'degree': 6, 'C': 0.11669424999736884}. Best is trial 11 with value: 0.05531934963934123.
Trial 21 finished with value: -5.370975183527817 and parameters: {'kernel': 'rbf', 'epsilon': 0.25629682489765204, 'degree': 4, 'C': 0.0002793205097942657}. Best is trial 11 with value: 0.05531934963934123.
Trial 1 finished with value: -1.5804604143218826 and parameters: {'kernel': 'sigmoid', 'epsilon': 0.9055304579904142, 'degree': 3, 'C': 1.0178077768616791}. Best is trial 11 with value: 0.05531934963934123.
Trial 17 finished with value: -5.2977297080710875 and parameters: {'kernel': 'sigmoid', 'epsilon': 0.32529333554190554, 'degree': 5, 'C': 0.012734368576335328}. Best is trial 11 with value: 0.05531934963934123.
Trial 5 finished with value: -5.373746049863371 and parameters: {'kernel': 'rbf', 'epsilon': 0.27249437294195533, 'degree': 3, 'C': 0.00014667955154171674}. Best is trial 11 with value: 0.05531934963934123.
Trial 2 finished with value: -5.33774539676768 and parameters: {'kernel': 'linear', 'epsilon': 0.23304320757287256, 'degree': 5, 'C': 0.00016364535167207606}. Best is trial 11 with value: 0.05531934963934123.
Trial 7 finished with value: -4.9230841808806565 and parameters: {'kernel': 'rbf', 'epsilon': 0.42732627183293814, 'degree': 2, 'C': 0.10183503150887706}. Best is trial 11 with value: 0.05531934963934123.
Trial 9 finished with value: -0.932780616101252 and parameters: {'kernel': 'rbf', 'epsilon': 0.6571642266578458, 'degree': 5, 'C': 2.086163748666693}. Best is trial 11 with value: 0.05531934963934123.
Trial 14 finished with value: -5.165369875427356 and parameters: {'kernel': 'sigmoid', 'epsilon': 0.8994868462414148, 'degree': 2, 'C': 0.02969307658802802}. Best is trial 11 with value: 0.05531934963934123.
Trial 18 finished with value: -5.384104019637486 and parameters: {'kernel': 'sigmoid', 'epsilon': 0.3480009684187876, 'degree': 5, 'C': 0.00011713396677264792}. Best is trial 11 with value: 0.05531934963934123.
Trial 15 finished with value: -5.42493649195761 and parameters: {'kernel': 'sigmoid', 'epsilon': 0.6632555857008872, 'degree': 5, 'C': 0.0004795274827841025}. Best is trial 11 with value: 0.05531934963934123.
Trial 20 finished with value: -1.0300227246527351 and parameters: {'kernel': 'sigmoid', 'epsilon': 0.3419557005567728, 'degree': 4, 'C': 2.0998340663253847}. Best is trial 11 with value: 0.05531934963934123.
Trial 23 finished with value: -5.351137089753855 and parameters: {'kernel': 'poly', 'epsilon': 0.1757642097929316, 'degree': 4, 'C': 0.0010027580739390733}. Best is trial 11 with value: 0.05531934963934123.
Trial 6 finished with value: -0.021573273633916423 and parameters: {'kernel': 'linear', 'epsilon': 0.7424265556966672, 'degree': 3, 'C': 2.099030385545239}. Best is trial 11 with value: 0.05531934963934123.
Trial 13 finished with value: -5.355925670387396 and parameters: {'kernel': 'sigmoid', 'epsilon': 0.8335208044603715, 'degree': 3, 'C': 0.007054382866086767}. Best is trial 11 with value: 0.05531934963934123.
Trial 24 finished with value: -5.340547141194365 and parameters: {'kernel': 'rbf', 'epsilon': 0.5298288389506778, 'degree': 5, 'C': 0.018332031139744367}. Best is trial 11 with value: 0.05531934963934123.
Trial 25 finished with value: -0.6340828628316266 and parameters: {'kernel': 'poly', 'epsilon': 0.6449537161845342, 'degree': 2, 'C': 3.685862484823371}. Best is trial 11 with value: 0.05531934963934123.
Trial 26 finished with value: -5.299315509643417 and parameters: {'kernel': 'poly', 'epsilon': 0.1183483498968525, 'degree': 4, 'C': 0.005563505011447164}. Best is trial 11 with value: 0.05531934963934123.
Trial 31 finished with value: -4.583927193257659 and parameters: {'kernel': 'sigmoid', 'epsilon': 0.6568068078591461, 'degree': 2, 'C': 0.10755151079286451}. Best is trial 11 with value: 0.05531934963934123.
Trial 29 finished with value: -4.024392392549755 and parameters: {'kernel': 'linear', 'epsilon': 0.08998020400030937, 'degree': 5, 'C': 0.006612480559077436}. Best is trial 11 with value: 0.05531934963934123.
Trial 30 finished with value: -4.915535229506602 and parameters: {'kernel': 'sigmoid', 'epsilon': 0.08710768366019284, 'degree': 4, 'C': 0.059253739287358026}. Best is trial 11 with value: 0.05531934963934123.
Trial 32 finished with value: -5.4173445383475185 and parameters: {'kernel': 'rbf', 'epsilon': 0.890972738239217, 'degree': 4, 'C': 0.0005489418201020908}. Best is trial 11 with value: 0.05531934963934123.
Trial 37 finished with value: -5.386304363385385 and parameters: {'kernel': 'sigmoid', 'epsilon': 0.8437165835217024, 'degree': 3, 'C': 0.003978732582421323}. Best is trial 11 with value: 0.05531934963934123.
Trial 39 finished with value: -5.2415175875928925 and parameters: {'kernel': 'sigmoid', 'epsilon': 0.767486967018814, 'degree': 2, 'C': 0.019314119056914207}. Best is trial 11 with value: 0.05531934963934123.
Trial 33 finished with value: -5.355340002548765 and parameters: {'kernel': 'sigmoid', 'epsilon': 0.14120985941613018, 'degree': 2, 'C': 0.00010567896517353091}. Best is trial 11 with value: 0.05531934963934123.
Trial 27 finished with value: -1.0386912129654091 and parameters: {'kernel': 'linear', 'epsilon': 0.1396209364833041, 'degree': 5, 'C': 0.05776551710876005}. Best is trial 11 with value: 0.05531934963934123.
Trial 40 finished with value: -4.765414285620527 and parameters: {'kernel': 'poly', 'epsilon': 0.30159296513828193, 'degree': 3, 'C': 0.07483770999523436}. Best is trial 11 with value: 0.05531934963934123.
Trial 34 finished with value: -5.409902532838918 and parameters: {'kernel': 'poly', 'epsilon': 0.5510915296670801, 'degree': 3, 'C': 0.00044413350991654647}. Best is trial 11 with value: 0.05531934963934123.
Trial 43 finished with value: -5.37893032489218 and parameters: {'kernel': 'rbf', 'epsilon': 0.362820129440945, 'degree': 2, 'C': 0.002097527600428828}. Best is trial 11 with value: 0.05531934963934123.
Trial 28 finished with value: -5.366483943419579 and parameters: {'kernel': 'rbf', 'epsilon': 0.22298246800314425, 'degree': 3, 'C': 0.00023931767446449786}. Best is trial 11 with value: 0.05531934963934123.
Trial 35 finished with value: -5.16559149340029 and parameters: {'kernel': 'linear', 'epsilon': 0.7547191368202233, 'degree': 2, 'C': 0.0010326941524861392}. Best is trial 11 with value: 0.05531934963934123.
Trial 38 finished with value: -0.15060007909361878 and parameters: {'kernel': 'linear', 'epsilon': 0.2785424852151043, 'degree': 5, 'C': 0.24656856828574877}. Best is trial 11 with value: 0.05531934963934123.
Trial 36 finished with value: -5.316867766168554 and parameters: {'kernel': 'poly', 'epsilon': 0.36142425843503134, 'degree': 3, 'C': 0.00843736746867177}. Best is trial 11 with value: 0.05531934963934123.
Trial 47 finished with value: -1.1992378001031885 and parameters: {'kernel': 'sigmoid', 'epsilon': 0.26421544648919015, 'degree': 4, 'C': 1.545809344132854}. Best is trial 11 with value: 0.05531934963934123.
Trial 45 finished with value: -0.3429897536428252 and parameters: {'kernel': 'rbf', 'epsilon': 0.9836412997476662, 'degree': 6, 'C': 3.5239676264427042}. Best is trial 11 with value: 0.05531934963934123.
Trial 41 finished with value: -4.9561592205004565 and parameters: {'kernel': 'sigmoid', 'epsilon': 0.9187179583683734, 'degree': 4, 'C': 0.058122194794663164}. Best is trial 11 with value: 0.05531934963934123.
Trial 44 finished with value: -5.386327626718993 and parameters: {'kernel': 'rbf', 'epsilon': 0.5073912854988325, 'degree': 3, 'C': 0.0055011110202525535}. Best is trial 11 with value: 0.05531934963934123.
Trial 48 finished with value: -4.321529941211897 and parameters: {'kernel': 'linear', 'epsilon': 0.29226717873331276, 'degree': 5, 'C': 0.005029262030395047}. Best is trial 11 with value: 0.05531934963934123.
Trial 42 finished with value: -0.38147226129725287 and parameters: {'kernel': 'linear', 'epsilon': 0.2985680494577213, 'degree': 2, 'C': 0.1426328846983632}. Best is trial 11 with value: 0.05531934963934123.
Trial 50 finished with value: -3.7720535216648132 and parameters: {'kernel': 'sigmoid', 'epsilon': 0.6952024544020093, 'degree': 6, 'C': 0.2340883373016296}. Best is trial 11 with value: 0.05531934963934123.
Trial 46 finished with value: -1.1874753245170975 and parameters: {'kernel': 'sigmoid', 'epsilon': 0.4912355375879073, 'degree': 4, 'C': 1.6084770224492915}. Best is trial 11 with value: 0.05531934963934123.
Trial 49 finished with value: -0.23231813120624878 and parameters: {'kernel': 'linear', 'epsilon': 0.6012557159074178, 'degree': 6, 'C': 0.1952559470880138}. Best is trial 11 with value: 0.05531934963934123.
Trial 53 finished with value: -1.7903115842710753 and parameters: {'kernel': 'poly', 'epsilon': 0.23538566109359094, 'degree': 3, 'C': 1.206380806655196}. Best is trial 11 with value: 0.05531934963934123.
Trial 57 finished with value: -5.426153730065753 and parameters: {'kernel': 'poly', 'epsilon': 0.7925578052057735, 'degree': 5, 'C': 0.00017043316629431894}. Best is trial 11 with value: 0.05531934963934123.
Trial 59 finished with value: -5.28715718120669 and parameters: {'kernel': 'sigmoid', 'epsilon': 0.7306039978388899, 'degree': 2, 'C': 0.015150825453762213}. Best is trial 11 with value: 0.05531934963934123.
Trial 52 finished with value: -1.1867416359651841 and parameters: {'kernel': 'sigmoid', 'epsilon': 0.6655657993602371, 'degree': 5, 'C': 1.54519031250391}. Best is trial 11 with value: 0.05531934963934123.
Trial 55 finished with value: -0.8541405024356019 and parameters: {'kernel': 'rbf', 'epsilon': 0.6679256038176002, 'degree': 6, 'C': 2.2297973330232512}. Best is trial 11 with value: 0.05531934963934123.
Trial 56 finished with value: -5.384282936284613 and parameters: {'kernel': 'rbf', 'epsilon': 0.36165536021413425, 'degree': 4, 'C': 0.0006585396389282645}. Best is trial 11 with value: 0.05531934963934123.
Trial 51 finished with value: -5.406622874990785 and parameters: {'kernel': 'rbf', 'epsilon': 0.5078527495275403, 'degree': 5, 'C': 0.00022279760431858243}. Best is trial 11 with value: 0.05531934963934123.
Trial 62 finished with value: -5.170704767756848 and parameters: {'kernel': 'sigmoid', 'epsilon': 0.912805896366069, 'degree': 2, 'C': 0.029180863827219645}. Best is trial 11 with value: 0.05531934963934123.
Trial 61 finished with value: -1.2308489202236543 and parameters: {'kernel': 'sigmoid', 'epsilon': 0.1124531978420169, 'degree': 6, 'C': 1.4892187406252233}. Best is trial 11 with value: 0.05531934963934123.
Trial 65 finished with value: -4.935549885845288 and parameters: {'kernel': 'poly', 'epsilon': 0.7897695095846341, 'degree': 2, 'C': 0.08686732092097833}. Best is trial 11 with value: 0.05531934963934123.
Trial 64 finished with value: -5.384935848967541 and parameters: {'kernel': 'poly', 'epsilon': 0.9912186469928764, 'degree': 3, 'C': 0.0030534403396456733}. Best is trial 11 with value: 0.05531934963934123.
Trial 54 finished with value: -5.064616429015097 and parameters: {'kernel': 'sigmoid', 'epsilon': 0.4905577999844234, 'degree': 6, 'C': 0.041819975711843295}. Best is trial 11 with value: 0.05531934963934123.
Trial 60 finished with value: -0.9514568659678045 and parameters: {'kernel': 'linear', 'epsilon': 0.5993650080921499, 'degree': 2, 'C': 0.06520385678797157}. Best is trial 11 with value: 0.05531934963934123.
Trial 68 finished with value: -0.020145651641261565 and parameters: {'kernel': 'linear', 'epsilon': 0.5897925711232799, 'degree': 3, 'C': 7.2640234294449}. Best is trial 11 with value: 0.05531934963934123.
Trial 69 finished with value: -5.260914906284794 and parameters: {'kernel': 'rbf', 'epsilon': 0.7969108294665933, 'degree': 3, 'C': 0.028224860677655825}. Best is trial 11 with value: 0.05531934963934123.
Trial 63 finished with value: -5.385580054284508 and parameters: {'kernel': 'rbf', 'epsilon': 0.4187785916042329, 'degree': 2, 'C': 0.0024198945503089166}. Best is trial 11 with value: 0.05531934963934123.
Trial 58 finished with value: -4.887539738117896 and parameters: {'kernel': 'sigmoid', 'epsilon': 0.4119170015584971, 'degree': 6, 'C': 0.06608561728501453}. Best is trial 11 with value: 0.05531934963934123.
Trial 70 finished with value: -5.412907712818417 and parameters: {'kernel': 'poly', 'epsilon': 0.5690676989889472, 'degree': 4, 'C': 0.0003377895290066733}. Best is trial 11 with value: 0.05531934963934123.
Trial 67 finished with value: -5.418379772102119 and parameters: {'kernel': 'sigmoid', 'epsilon': 0.8846009381560115, 'degree': 2, 'C': 0.0003292565437389068}. Best is trial 11 with value: 0.05531934963934123.
Trial 73 finished with value: -0.8657060708240923 and parameters: {'kernel': 'rbf', 'epsilon': 0.2715884695737981, 'degree': 6, 'C': 2.2172233753753026}. Best is trial 11 with value: 0.05531934963934123.
Trial 66 finished with value: -5.265422121086764 and parameters: {'kernel': 'poly', 'epsilon': 0.41044297830511434, 'degree': 2, 'C': 0.024275794113413605}. Best is trial 11 with value: 0.05531934963934123.
Trial 72 finished with value: -2.1638376623297098 and parameters: {'kernel': 'rbf', 'epsilon': 0.5177362016193037, 'degree': 3, 'C': 0.9983177528486251}. Best is trial 11 with value: 0.05531934963934123.
Trial 75 finished with value: -0.38062529685982915 and parameters: {'kernel': 'linear', 'epsilon': 0.645709364343712, 'degree': 6, 'C': 0.1420494733064786}. Best is trial 11 with value: 0.05531934963934123.
Trial 71 finished with value: -4.678568803701314 and parameters: {'kernel': 'rbf', 'epsilon': 0.4312204016338905, 'degree': 6, 'C': 0.16374707290277618}. Best is trial 11 with value: 0.05531934963934123.
Trial 77 finished with value: -4.141775993896461 and parameters: {'kernel': 'rbf', 'epsilon': 0.073336851537524, 'degree': 4, 'C': 0.3047459923118844}. Best is trial 11 with value: 0.05531934963934123.
Trial 76 finished with value: -4.908460353594246 and parameters: {'kernel': 'poly', 'epsilon': 0.88721179548693, 'degree': 5, 'C': 0.037633777166415014}. Best is trial 11 with value: 0.05531934963934123.
Trial 79 finished with value: -3.9866130410990754 and parameters: {'kernel': 'sigmoid', 'epsilon': 0.3410936319391147, 'degree': 3, 'C': 0.19261765620210075}. Best is trial 11 with value: 0.05531934963934123.
Trial 78 finished with value: -2.591211292341094 and parameters: {'kernel': 'linear', 'epsilon': 0.09722491724051152, 'degree': 4, 'C': 0.01701819705812474}. Best is trial 11 with value: 0.05531934963934123.
Trial 86 finished with value: -4.895745810992314 and parameters: {'kernel': 'poly', 'epsilon': 0.6018618729803172, 'degree': 3, 'C': 0.0582531016338584}. Best is trial 11 with value: 0.05531934963934123.
Trial 83 finished with value: -3.2569092869068292 and parameters: {'kernel': 'poly', 'epsilon': 0.5659649301608608, 'degree': 4, 'C': 0.2794655131690614}. Best is trial 11 with value: 0.05531934963934123.
Trial 74 finished with value: -0.06368960057461584 and parameters: {'kernel': 'linear', 'epsilon': 0.7343048945133241, 'degree': 4, 'C': 0.4376003138341601}. Best is trial 11 with value: 0.05531934963934123.
Trial 80 finished with value: -5.29833568187958 and parameters: {'kernel': 'sigmoid', 'epsilon': 0.6582213667583384, 'degree': 3, 'C': 0.015053972000055474}. Best is trial 11 with value: 0.05531934963934123.
Trial 90 finished with value: -5.348756260656306 and parameters: {'kernel': 'sigmoid', 'epsilon': 0.7256938568181699, 'degree': 2, 'C': 0.009229498933860726}. Best is trial 11 with value: 0.05531934963934123.
Trial 85 finished with value: -1.7679155523951176 and parameters: {'kernel': 'linear', 'epsilon': 0.8061533594744937, 'degree': 2, 'C': 0.028986868082174207}. Best is trial 11 with value: 0.05531934963934123.
Trial 82 finished with value: -1.1172688650363214 and parameters: {'kernel': 'rbf', 'epsilon': 0.7240204316124165, 'degree': 5, 'C': 1.7920137796540407}. Best is trial 11 with value: 0.05531934963934123.
Trial 87 finished with value: -5.419496699456011 and parameters: {'kernel': 'poly', 'epsilon': 0.622520217216103, 'degree': 3, 'C': 0.0005167297147412967}. Best is trial 11 with value: 0.05531934963934123.
Trial 89 finished with value: -5.067319453325199 and parameters: {'kernel': 'poly', 'epsilon': 0.46295903206774824, 'degree': 3, 'C': 0.04019909234835431}. Best is trial 11 with value: 0.05531934963934123.
Trial 81 finished with value: -4.431489483867301 and parameters: {'kernel': 'poly', 'epsilon': 0.2243258731697665, 'degree': 3, 'C': 0.11856770133880877}. Best is trial 11 with value: 0.05531934963934123.
Trial 94 finished with value: -5.420062827592655 and parameters: {'kernel': 'rbf', 'epsilon': 0.6072055342638986, 'degree': 4, 'C': 0.00041259336052306615}. Best is trial 11 with value: 0.05531934963934123.
Trial 88 finished with value: -5.319975696052015 and parameters: {'kernel': 'rbf', 'epsilon': 0.5205089097831025, 'degree': 4, 'C': 0.023084398410852875}. Best is trial 11 with value: 0.05531934963934123.
Trial 96 finished with value: -5.3220372276737296 and parameters: {'kernel': 'linear', 'epsilon': 0.10015384885413992, 'degree': 2, 'C': 0.00014937591296217186}. Best is trial 11 with value: 0.05531934963934123.
Trial 84 finished with value: -5.342421745246397 and parameters: {'kernel': 'sigmoid', 'epsilon': 0.010357229141658486, 'degree': 3, 'C': 0.00025016094218251937}. Best is trial 11 with value: 0.05531934963934123.
Trial 91 finished with value: -5.362586341112573 and parameters: {'kernel': 'poly', 'epsilon': 0.19313618242036534, 'degree': 2, 'C': 0.0001246258439939877}. Best is trial 11 with value: 0.05531934963934123.
Trial 92 finished with value: -2.808736491807717 and parameters: {'kernel': 'poly', 'epsilon': 0.37921224671936116, 'degree': 2, 'C': 0.6367529481732783}. Best is trial 11 with value: 0.05531934963934123.
Trial 99 finished with value: -0.7173720245306155 and parameters: {'kernel': 'sigmoid', 'epsilon': 0.3152585851170633, 'degree': 2, 'C': 5.635713993457624}. Best is trial 11 with value: 0.05531934963934123.
Trial 95 finished with value: -0.020101079349028585 and parameters: {'kernel': 'linear', 'epsilon': 0.323629522958521, 'degree': 3, 'C': 4.514607598485694}. Best is trial 11 with value: 0.05531934963934123.
Trial 93 finished with value: -5.30838445596813 and parameters: {'kernel': 'sigmoid', 'epsilon': 0.14915154289915156, 'degree': 5, 'C': 0.007381445485841726}. Best is trial 11 with value: 0.05531934963934123.
Trial 98 finished with value: -4.029448443436653 and parameters: {'kernel': 'linear', 'epsilon': 0.5002629685953959, 'degree': 4, 'C': 0.006685017483323647}. Best is trial 11 with value: 0.05531934963934123.
Trial 103 finished with value: -5.370822223371083 and parameters: {'kernel': 'linear', 'epsilon': 0.42968329056924215, 'degree': 4, 'C': 0.00013458790027523642}. Best is trial 11 with value: 0.05531934963934123.
Trial 101 finished with value: -0.019437533547021102 and parameters: {'kernel': 'linear', 'epsilon': 0.551644093049434, 'degree': 4, 'C': 5.898239346377907}. Best is trial 11 with value: 0.05531934963934123.
Trial 97 finished with value: -5.410993576871249 and parameters: {'kernel': 'sigmoid', 'epsilon': 0.6247170402299931, 'degree': 5, 'C': 0.0019630140816355775}. Best is trial 11 with value: 0.05531934963934123.
Trial 105 finished with value: -1.599928234607209 and parameters: {'kernel': 'sigmoid', 'epsilon': 0.15146307455994057, 'degree': 4, 'C': 1.0034561913936642}. Best is trial 11 with value: 0.05531934963934123.
Trial 102 finished with value: -2.3755612765973644 and parameters: {'kernel': 'rbf', 'epsilon': 0.9875480031480968, 'degree': 4, 'C': 0.8935799887375733}. Best is trial 11 with value: 0.05531934963934123.
Trial 106 finished with value: -4.880438371327231 and parameters: {'kernel': 'linear', 'epsilon': 0.5180996613595228, 'degree': 6, 'C': 0.002421322851234008}. Best is trial 11 with value: 0.05531934963934123.
