Trial 629 finished with value: 16637.58238116084 and parameters: {'input_dropout': 0.0, 'hidden_layers': 3, 'hidden_units': 160, 'kernel_initializer': 'he_normal', 'hidden_activation': 'relu', 'hidden_dropout': 0.1, 'batch_norm': 'on', 'optimizer_type': 'rmsprop', 'optimizer_lr': 0.00017097022934903417, 'batch_size': 96}. Best is trial 390 with value: 16.963969438912468.
Trial 630 finished with value: 173.52846527994808 and parameters: {'input_dropout': 0.2, 'hidden_layers': 8, 'hidden_units': 224, 'kernel_initializer': 'random_normal', 'hidden_activation': 'relu', 'hidden_dropout': 0.0, 'batch_norm': 'off', 'optimizer_type': 'rmsprop', 'optimizer_lr': 0.006385146187087306, 'batch_size': 96}. Best is trial 390 with value: 16.963969438912468.
Trial 631 finished with value: 233.1110436756805 and parameters: {'input_dropout': 0.15000000000000002, 'hidden_layers': 6, 'hidden_units': 160, 'kernel_initializer': 'he_uniform', 'hidden_activation': 'leaky_relu', 'hidden_dropout': 0.15000000000000002, 'batch_norm': 'off', 'optimizer_type': 'rmsprop', 'optimizer_lr': 0.001450718993862634, 'batch_size': 64}. Best is trial 390 with value: 16.963969438912468.
Trial 632 finished with value: 64.20358938256423 and parameters: {'input_dropout': 0.05, 'hidden_layers': 7, 'hidden_units': 64, 'kernel_initializer': 'he_uniform', 'hidden_activation': 'relu', 'hidden_dropout': 0.0, 'batch_norm': 'on', 'optimizer_type': 'rmsprop', 'optimizer_lr': 0.0018538690393517182, 'batch_size': 96}. Best is trial 390 with value: 16.963969438912468.
Trial 633 finished with value: 148.84837657363863 and parameters: {'input_dropout': 0.05, 'hidden_layers': 4, 'hidden_units': 128, 'kernel_initializer': 'he_normal', 'hidden_activation': 'prelu', 'hidden_dropout': 0.25, 'batch_norm': 'on', 'optimizer_type': 'adam', 'optimizer_lr': 0.0019041797632295449, 'batch_size': 96}. Best is trial 390 with value: 16.963969438912468.
Trial 634 finished with value: 4738.992336439331 and parameters: {'input_dropout': 0.0, 'hidden_layers': 3, 'hidden_units': 128, 'kernel_initializer': 'he_uniform', 'hidden_activation': 'relu', 'hidden_dropout': 0.1, 'batch_norm': 'on', 'optimizer_type': 'adam', 'optimizer_lr': 0.0013685443328493696, 'batch_size': 128}. Best is trial 390 with value: 16.963969438912468.
Trial 635 finished with value: 20696.10347158291 and parameters: {'input_dropout': 0.1, 'hidden_layers': 3, 'hidden_units': 32, 'kernel_initializer': 'random_normal', 'hidden_activation': 'relu', 'hidden_dropout': 0.2, 'batch_norm': 'on', 'optimizer_type': 'rmsprop', 'optimizer_lr': 0.00015896905313007414, 'batch_size': 64}. Best is trial 390 with value: 16.963969438912468.
Trial 636 finished with value: 152.77514541648682 and parameters: {'input_dropout': 0.15000000000000002, 'hidden_layers': 8, 'hidden_units': 32, 'kernel_initializer': 'he_uniform', 'hidden_activation': 'relu', 'hidden_dropout': 0.0, 'batch_norm': 'on', 'optimizer_type': 'rmsprop', 'optimizer_lr': 0.0016708047363670606, 'batch_size': 96}. Best is trial 390 with value: 16.963969438912468.
Trial 637 finished with value: 35.95395648902674 and parameters: {'input_dropout': 0.1, 'hidden_layers': 9, 'hidden_units': 256, 'kernel_initializer': 'he_normal', 'hidden_activation': 'relu', 'hidden_dropout': 0.0, 'batch_norm': 'on', 'optimizer_type': 'adam', 'optimizer_lr': 0.0017690290784546996, 'batch_size': 96}. Best is trial 390 with value: 16.963969438912468.
Trial 638 finished with value: 176.2383300378904 and parameters: {'input_dropout': 0.2, 'hidden_layers': 5, 'hidden_units': 128, 'kernel_initializer': 'random_normal', 'hidden_activation': 'leaky_relu', 'hidden_dropout': 0.15000000000000002, 'batch_norm': 'off', 'optimizer_type': 'adam', 'optimizer_lr': 0.0005356058386976226, 'batch_size': 32}. Best is trial 390 with value: 16.963969438912468.
Trial 639 finished with value: 9925.84539213317 and parameters: {'input_dropout': 0.0, 'hidden_layers': 7, 'hidden_units': 192, 'kernel_initializer': 'random_normal', 'hidden_activation': 'relu', 'hidden_dropout': 0.1, 'batch_norm': 'on', 'optimizer_type': 'adam', 'optimizer_lr': 0.00011058525463452325, 'batch_size': 32}. Best is trial 390 with value: 16.963969438912468.
Trial 640 finished with value: 9275.277489568101 and parameters: {'input_dropout': 0.15000000000000002, 'hidden_layers': 10, 'hidden_units': 64, 'kernel_initializer': 'he_uniform', 'hidden_activation': 'leaky_relu', 'hidden_dropout': 0.15000000000000002, 'batch_norm': 'on', 'optimizer_type': 'adam', 'optimizer_lr': 0.0006635681258713203, 'batch_size': 96}. Best is trial 390 with value: 16.963969438912468.
Trial 641 finished with value: 229.7925993960586 and parameters: {'input_dropout': 0.2, 'hidden_layers': 8, 'hidden_units': 160, 'kernel_initializer': 'he_normal', 'hidden_activation': 'leaky_relu', 'hidden_dropout': 0.1, 'batch_norm': 'off', 'optimizer_type': 'rmsprop', 'optimizer_lr': 0.002830313246733156, 'batch_size': 32}. Best is trial 390 with value: 16.963969438912468.
Trial 642 finished with value: 21.507407741835458 and parameters: {'input_dropout': 0.0, 'hidden_layers': 5, 'hidden_units': 256, 'kernel_initializer': 'he_normal', 'hidden_activation': 'leaky_relu', 'hidden_dropout': 0.0, 'batch_norm': 'on', 'optimizer_type': 'adam', 'optimizer_lr': 0.006157869368996548, 'batch_size': 32}. Best is trial 390 with value: 16.963969438912468.
Trial 643 finished with value: 126.67357422485208 and parameters: {'input_dropout': 0.05, 'hidden_layers': 4, 'hidden_units': 192, 'kernel_initializer': 'random_normal', 'hidden_activation': 'leaky_relu', 'hidden_dropout': 0.25, 'batch_norm': 'off', 'optimizer_type': 'rmsprop', 'optimizer_lr': 0.0013854658445608002, 'batch_size': 32}. Best is trial 390 with value: 16.963969438912468.
Trial 644 finished with value: 17.218586072024333 and parameters: {'input_dropout': 0.0, 'hidden_layers': 8, 'hidden_units': 256, 'kernel_initializer': 'he_uniform', 'hidden_activation': 'leaky_relu', 'hidden_dropout': 0.0, 'batch_norm': 'on', 'optimizer_type': 'adam', 'optimizer_lr': 0.0020710065132101604, 'batch_size': 64}. Best is trial 390 with value: 16.963969438912468.
Trial 645 finished with value: 9677.360161146304 and parameters: {'input_dropout': 0.1, 'hidden_layers': 9, 'hidden_units': 128, 'kernel_initializer': 'he_uniform', 'hidden_activation': 'leaky_relu', 'hidden_dropout': 0.15000000000000002, 'batch_norm': 'on', 'optimizer_type': 'adam', 'optimizer_lr': 0.00027428348157612506, 'batch_size': 64}. Best is trial 390 with value: 16.963969438912468.
Trial 646 finished with value: 170.23746276518168 and parameters: {'input_dropout': 0.15000000000000002, 'hidden_layers': 7, 'hidden_units': 224, 'kernel_initializer': 'he_uniform', 'hidden_activation': 'leaky_relu', 'hidden_dropout': 0.05, 'batch_norm': 'off', 'optimizer_type': 'rmsprop', 'optimizer_lr': 0.00212319590334937, 'batch_size': 64}. Best is trial 390 with value: 16.963969438912468.
Trial 647 finished with value: 228.15598968006998 and parameters: {'input_dropout': 0.1, 'hidden_layers': 6, 'hidden_units': 64, 'kernel_initializer': 'random_normal', 'hidden_activation': 'relu', 'hidden_dropout': 0.25, 'batch_norm': 'on', 'optimizer_type': 'rmsprop', 'optimizer_lr': 0.0009452657059472262, 'batch_size': 64}. Best is trial 390 with value: 16.963969438912468.
Trial 648 finished with value: 194.89309649799344 and parameters: {'input_dropout': 0.0, 'hidden_layers': 7, 'hidden_units': 192, 'kernel_initializer': 'random_normal', 'hidden_activation': 'prelu', 'hidden_dropout': 0.25, 'batch_norm': 'on', 'optimizer_type': 'adam', 'optimizer_lr': 0.00025190050624248803, 'batch_size': 32}. Best is trial 390 with value: 16.963969438912468.
Trial 649 finished with value: 66.83938491911057 and parameters: {'input_dropout': 0.1, 'hidden_layers': 4, 'hidden_units': 224, 'kernel_initializer': 'he_normal', 'hidden_activation': 'leaky_relu', 'hidden_dropout': 0.1, 'batch_norm': 'on', 'optimizer_type': 'adam', 'optimizer_lr': 0.0038532103004545125, 'batch_size': 96}. Best is trial 390 with value: 16.963969438912468.
Trial 650 finished with value: 152.56592184986098 and parameters: {'input_dropout': 0.1, 'hidden_layers': 10, 'hidden_units': 32, 'kernel_initializer': 'he_uniform', 'hidden_activation': 'prelu', 'hidden_dropout': 0.0, 'batch_norm': 'off', 'optimizer_type': 'adam', 'optimizer_lr': 0.001317489269933337, 'batch_size': 96}. Best is trial 390 with value: 16.963969438912468.
Trial 651 finished with value: 80.78895530013808 and parameters: {'input_dropout': 0.05, 'hidden_layers': 6, 'hidden_units': 128, 'kernel_initializer': 'he_uniform', 'hidden_activation': 'prelu', 'hidden_dropout': 0.05, 'batch_norm': 'on', 'optimizer_type': 'rmsprop', 'optimizer_lr': 0.0007808740425716531, 'batch_size': 64}. Best is trial 390 with value: 16.963969438912468.
Trial 652 finished with value: 97.15418028967082 and parameters: {'input_dropout': 0.2, 'hidden_layers': 4, 'hidden_units': 224, 'kernel_initializer': 'random_normal', 'hidden_activation': 'leaky_relu', 'hidden_dropout': 0.05, 'batch_norm': 'on', 'optimizer_type': 'adam', 'optimizer_lr': 0.0014510649749805557, 'batch_size': 64}. Best is trial 390 with value: 16.963969438912468.
Trial 653 finished with value: 175.4089861182264 and parameters: {'input_dropout': 0.15000000000000002, 'hidden_layers': 5, 'hidden_units': 32, 'kernel_initializer': 'random_normal', 'hidden_activation': 'prelu', 'hidden_dropout': 0.2, 'batch_norm': 'off', 'optimizer_type': 'rmsprop', 'optimizer_lr': 0.004692903558755436, 'batch_size': 96}. Best is trial 390 with value: 16.963969438912468.
Trial 654 finished with value: 3364.9640147064665 and parameters: {'input_dropout': 0.2, 'hidden_layers': 10, 'hidden_units': 192, 'kernel_initializer': 'he_uniform', 'hidden_activation': 'relu', 'hidden_dropout': 0.2, 'batch_norm': 'off', 'optimizer_type': 'adam', 'optimizer_lr': 0.0008969299154005868, 'batch_size': 64}. Best is trial 390 with value: 16.963969438912468.
Trial 655 finished with value: 14850.95496795787 and parameters: {'input_dropout': 0.2, 'hidden_layers': 7, 'hidden_units': 256, 'kernel_initializer': 'he_normal', 'hidden_activation': 'relu', 'hidden_dropout': 0.3, 'batch_norm': 'on', 'optimizer_type': 'adam', 'optimizer_lr': 0.00014920052382601245, 'batch_size': 128}. Best is trial 390 with value: 16.963969438912468.
Trial 656 finished with value: 177.74798137519133 and parameters: {'input_dropout': 0.0, 'hidden_layers': 10, 'hidden_units': 96, 'kernel_initializer': 'he_normal', 'hidden_activation': 'leaky_relu', 'hidden_dropout': 0.2, 'batch_norm': 'on', 'optimizer_type': 'adam', 'optimizer_lr': 0.0018748792069436947, 'batch_size': 64}. Best is trial 390 with value: 16.963969438912468.
Trial 657 finished with value: 10800.390302696307 and parameters: {'input_dropout': 0.15000000000000002, 'hidden_layers': 8, 'hidden_units': 64, 'kernel_initializer': 'random_normal', 'hidden_activation': 'relu', 'hidden_dropout': 0.25, 'batch_norm': 'on', 'optimizer_type': 'rmsprop', 'optimizer_lr': 0.0005451548851669516, 'batch_size': 96}. Best is trial 390 with value: 16.963969438912468.
Trial 658 finished with value: 497.2100552026027 and parameters: {'input_dropout': 0.1, 'hidden_layers': 4, 'hidden_units': 32, 'kernel_initializer': 'he_normal', 'hidden_activation': 'prelu', 'hidden_dropout': 0.3, 'batch_norm': 'off', 'optimizer_type': 'rmsprop', 'optimizer_lr': 0.00018226512331804247, 'batch_size': 32}. Best is trial 390 with value: 16.963969438912468.
Trial 659 finished with value: 1843.4983456408402 and parameters: {'input_dropout': 0.15000000000000002, 'hidden_layers': 10, 'hidden_units': 32, 'kernel_initializer': 'random_normal', 'hidden_activation': 'relu', 'hidden_dropout': 0.05, 'batch_norm': 'on', 'optimizer_type': 'rmsprop', 'optimizer_lr': 0.0007895621370783166, 'batch_size': 32}. Best is trial 390 with value: 16.963969438912468.
Trial 660 finished with value: 212.05039576164734 and parameters: {'input_dropout': 0.0, 'hidden_layers': 7, 'hidden_units': 96, 'kernel_initializer': 'he_uniform', 'hidden_activation': 'leaky_relu', 'hidden_dropout': 0.3, 'batch_norm': 'on', 'optimizer_type': 'adam', 'optimizer_lr': 0.0008672568861881419, 'batch_size': 32}. Best is trial 390 with value: 16.963969438912468.
Trial 661 finished with value: 11281.859332417407 and parameters: {'input_dropout': 0.15000000000000002, 'hidden_layers': 3, 'hidden_units': 64, 'kernel_initializer': 'random_normal', 'hidden_activation': 'prelu', 'hidden_dropout': 0.05, 'batch_norm': 'on', 'optimizer_type': 'adam', 'optimizer_lr': 0.0002808705683091814, 'batch_size': 96}. Best is trial 390 with value: 16.963969438912468.
Trial 662 finished with value: 9759.152710530028 and parameters: {'input_dropout': 0.15000000000000002, 'hidden_layers': 5, 'hidden_units': 128, 'kernel_initializer': 'he_normal', 'hidden_activation': 'leaky_relu', 'hidden_dropout': 0.3, 'batch_norm': 'on', 'optimizer_type': 'rmsprop', 'optimizer_lr': 0.0006189570301399131, 'batch_size': 128}. Best is trial 390 with value: 16.963969438912468.
Trial 663 finished with value: 18993.8383126685 and parameters: {'input_dropout': 0.1, 'hidden_layers': 8, 'hidden_units': 224, 'kernel_initializer': 'random_normal', 'hidden_activation': 'prelu', 'hidden_dropout': 0.25, 'batch_norm': 'on', 'optimizer_type': 'rmsprop', 'optimizer_lr': 0.00012427955503334324, 'batch_size': 96}. Best is trial 390 with value: 16.963969438912468.
Trial 664 finished with value: 6569.115457632912 and parameters: {'input_dropout': 0.05, 'hidden_layers': 3, 'hidden_units': 64, 'kernel_initializer': 'random_normal', 'hidden_activation': 'leaky_relu', 'hidden_dropout': 0.0, 'batch_norm': 'on', 'optimizer_type': 'adam', 'optimizer_lr': 0.00047238451430436793, 'batch_size': 96}. Best is trial 390 with value: 16.963969438912468.
Trial 665 finished with value: 1866.2774694112804 and parameters: {'input_dropout': 0.2, 'hidden_layers': 9, 'hidden_units': 128, 'kernel_initializer': 'he_uniform', 'hidden_activation': 'prelu', 'hidden_dropout': 0.2, 'batch_norm': 'off', 'optimizer_type': 'rmsprop', 'optimizer_lr': 0.00034795356864523536, 'batch_size': 96}. Best is trial 390 with value: 16.963969438912468.
Trial 666 finished with value: 223.33279685988322 and parameters: {'input_dropout': 0.2, 'hidden_layers': 8, 'hidden_units': 96, 'kernel_initializer': 'random_normal', 'hidden_activation': 'leaky_relu', 'hidden_dropout': 0.15000000000000002, 'batch_norm': 'on', 'optimizer_type': 'adam', 'optimizer_lr': 0.00034287934373315, 'batch_size': 32}. Best is trial 390 with value: 16.963969438912468.
Trial 667 finished with value: 147.24348866081462 and parameters: {'input_dropout': 0.1, 'hidden_layers': 8, 'hidden_units': 160, 'kernel_initializer': 'he_uniform', 'hidden_activation': 'leaky_relu', 'hidden_dropout': 0.15000000000000002, 'batch_norm': 'on', 'optimizer_type': 'rmsprop', 'optimizer_lr': 0.006583014979077846, 'batch_size': 128}. Best is trial 390 with value: 16.963969438912468.
Trial 668 finished with value: 10557.168717300958 and parameters: {'input_dropout': 0.0, 'hidden_layers': 3, 'hidden_units': 256, 'kernel_initializer': 'he_uniform', 'hidden_activation': 'relu', 'hidden_dropout': 0.25, 'batch_norm': 'on', 'optimizer_type': 'rmsprop', 'optimizer_lr': 0.00034620044943264086, 'batch_size': 128}. Best is trial 390 with value: 16.963969438912468.
Trial 669 finished with value: 263.33080996259764 and parameters: {'input_dropout': 0.0, 'hidden_layers': 8, 'hidden_units': 192, 'kernel_initializer': 'he_uniform', 'hidden_activation': 'prelu', 'hidden_dropout': 0.1, 'batch_norm': 'off', 'optimizer_type': 'rmsprop', 'optimizer_lr': 0.009973615409050052, 'batch_size': 64}. Best is trial 390 with value: 16.963969438912468.
Trial 670 finished with value: 299.80444103702905 and parameters: {'input_dropout': 0.15000000000000002, 'hidden_layers': 3, 'hidden_units': 256, 'kernel_initializer': 'he_uniform', 'hidden_activation': 'prelu', 'hidden_dropout': 0.05, 'batch_norm': 'off', 'optimizer_type': 'rmsprop', 'optimizer_lr': 0.008277853460017907, 'batch_size': 96}. Best is trial 390 with value: 16.963969438912468.
Trial 671 finished with value: 157.10940901693837 and parameters: {'input_dropout': 0.2, 'hidden_layers': 5, 'hidden_units': 160, 'kernel_initializer': 'random_normal', 'hidden_activation': 'relu', 'hidden_dropout': 0.0, 'batch_norm': 'off', 'optimizer_type': 'rmsprop', 'optimizer_lr': 0.00038531272792635424, 'batch_size': 32}. Best is trial 390 with value: 16.963969438912468.
Trial 672 finished with value: 11236.892779558428 and parameters: {'input_dropout': 0.2, 'hidden_layers': 4, 'hidden_units': 160, 'kernel_initializer': 'random_normal', 'hidden_activation': 'leaky_relu', 'hidden_dropout': 0.25, 'batch_norm': 'on', 'optimizer_type': 'adam', 'optimizer_lr': 0.00018381937844823702, 'batch_size': 64}. Best is trial 390 with value: 16.963969438912468.
Trial 673 finished with value: 282.84538950992135 and parameters: {'input_dropout': 0.05, 'hidden_layers': 4, 'hidden_units': 128, 'kernel_initializer': 'he_uniform', 'hidden_activation': 'relu', 'hidden_dropout': 0.25, 'batch_norm': 'off', 'optimizer_type': 'adam', 'optimizer_lr': 0.00022123937862194928, 'batch_size': 96}. Best is trial 390 with value: 16.963969438912468.
Trial 674 finished with value: 173.21239884102192 and parameters: {'input_dropout': 0.15000000000000002, 'hidden_layers': 4, 'hidden_units': 224, 'kernel_initializer': 'he_uniform', 'hidden_activation': 'leaky_relu', 'hidden_dropout': 0.1, 'batch_norm': 'off', 'optimizer_type': 'rmsprop', 'optimizer_lr': 0.000636690456100087, 'batch_size': 128}. Best is trial 390 with value: 16.963969438912468.
Trial 675 finished with value: 106.24952299355354 and parameters: {'input_dropout': 0.2, 'hidden_layers': 5, 'hidden_units': 160, 'kernel_initializer': 'he_normal', 'hidden_activation': 'prelu', 'hidden_dropout': 0.0, 'batch_norm': 'on', 'optimizer_type': 'rmsprop', 'optimizer_lr': 0.003011235998543313, 'batch_size': 64}. Best is trial 390 with value: 16.963969438912468.
Trial 676 finished with value: 105.8496041056269 and parameters: {'input_dropout': 0.0, 'hidden_layers': 8, 'hidden_units': 128, 'kernel_initializer': 'random_normal', 'hidden_activation': 'prelu', 'hidden_dropout': 0.1, 'batch_norm': 'off', 'optimizer_type': 'adam', 'optimizer_lr': 0.0006892277708060143, 'batch_size': 128}. Best is trial 390 with value: 16.963969438912468.
Trial 677 finished with value: 173.1321955818414 and parameters: {'input_dropout': 0.2, 'hidden_layers': 6, 'hidden_units': 96, 'kernel_initializer': 'random_normal', 'hidden_activation': 'relu', 'hidden_dropout': 0.0, 'batch_norm': 'off', 'optimizer_type': 'rmsprop', 'optimizer_lr': 0.00424314317229951, 'batch_size': 96}. Best is trial 390 with value: 16.963969438912468.
Trial 678 finished with value: 17319.96317588693 and parameters: {'input_dropout': 0.2, 'hidden_layers': 5, 'hidden_units': 64, 'kernel_initializer': 'he_normal', 'hidden_activation': 'prelu', 'hidden_dropout': 0.05, 'batch_norm': 'on', 'optimizer_type': 'adam', 'optimizer_lr': 0.00016583158457722318, 'batch_size': 64}. Best is trial 390 with value: 16.963969438912468.
Trial 679 finished with value: 8762.890248095335 and parameters: {'input_dropout': 0.15000000000000002, 'hidden_layers': 8, 'hidden_units': 160, 'kernel_initializer': 'random_normal', 'hidden_activation': 'leaky_relu', 'hidden_dropout': 0.3, 'batch_norm': 'on', 'optimizer_type': 'adam', 'optimizer_lr': 0.0002484083857805009, 'batch_size': 32}. Best is trial 390 with value: 16.963969438912468.
Trial 680 finished with value: 17939.701823993564 and parameters: {'input_dropout': 0.0, 'hidden_layers': 7, 'hidden_units': 128, 'kernel_initializer': 'random_normal', 'hidden_activation': 'relu', 'hidden_dropout': 0.25, 'batch_norm': 'on', 'optimizer_type': 'rmsprop', 'optimizer_lr': 0.00010391737199200655, 'batch_size': 64}. Best is trial 390 with value: 16.963969438912468.
Trial 681 finished with value: 125.3452950011559 and parameters: {'input_dropout': 0.1, 'hidden_layers': 4, 'hidden_units': 32, 'kernel_initializer': 'he_uniform', 'hidden_activation': 'prelu', 'hidden_dropout': 0.05, 'batch_norm': 'off', 'optimizer_type': 'rmsprop', 'optimizer_lr': 0.0037763027342807487, 'batch_size': 32}. Best is trial 390 with value: 16.963969438912468.
Trial 682 finished with value: 24.230325846461156 and parameters: {'input_dropout': 0.05, 'hidden_layers': 7, 'hidden_units': 160, 'kernel_initializer': 'he_normal', 'hidden_activation': 'prelu', 'hidden_dropout': 0.0, 'batch_norm': 'on', 'optimizer_type': 'adam', 'optimizer_lr': 0.001920360759023092, 'batch_size': 64}. Best is trial 390 with value: 16.963969438912468.
Trial 683 finished with value: 14082.790825765613 and parameters: {'input_dropout': 0.2, 'hidden_layers': 4, 'hidden_units': 256, 'kernel_initializer': 'he_normal', 'hidden_activation': 'leaky_relu', 'hidden_dropout': 0.25, 'batch_norm': 'on', 'optimizer_type': 'rmsprop', 'optimizer_lr': 0.0001017393179593994, 'batch_size': 64}. Best is trial 390 with value: 16.963969438912468.
Trial 684 finished with value: 215.4685903956195 and parameters: {'input_dropout': 0.15000000000000002, 'hidden_layers': 10, 'hidden_units': 224, 'kernel_initializer': 'random_normal', 'hidden_activation': 'relu', 'hidden_dropout': 0.3, 'batch_norm': 'off', 'optimizer_type': 'rmsprop', 'optimizer_lr': 0.0002977312264700466, 'batch_size': 128}. Best is trial 390 with value: 16.963969438912468.
Trial 685 finished with value: 14006.606261813204 and parameters: {'input_dropout': 0.0, 'hidden_layers': 10, 'hidden_units': 64, 'kernel_initializer': 'random_normal', 'hidden_activation': 'prelu', 'hidden_dropout': 0.0, 'batch_norm': 'on', 'optimizer_type': 'rmsprop', 'optimizer_lr': 0.0002072508143113022, 'batch_size': 64}. Best is trial 390 with value: 16.963969438912468.
