Trial 572 finished with value: 156.35371978612875 and parameters: {'input_dropout': 0.05, 'hidden_layers': 10, 'hidden_units': 32, 'kernel_initializer': 'he_uniform', 'hidden_activation': 'prelu', 'hidden_dropout': 0.0, 'batch_norm': 'off', 'optimizer_type': 'rmsprop', 'optimizer_lr': 0.007608768761680162, 'batch_size': 64}. Best is trial 390 with value: 16.963969438912468.
Trial 573 finished with value: 282.7217586566588 and parameters: {'input_dropout': 0.1, 'hidden_layers': 8, 'hidden_units': 256, 'kernel_initializer': 'he_uniform', 'hidden_activation': 'relu', 'hidden_dropout': 0.1, 'batch_norm': 'off', 'optimizer_type': 'adam', 'optimizer_lr': 0.0016924035419456033, 'batch_size': 96}. Best is trial 390 with value: 16.963969438912468.
Trial 574 finished with value: 95.25470527755581 and parameters: {'input_dropout': 0.05, 'hidden_layers': 3, 'hidden_units': 224, 'kernel_initializer': 'he_uniform', 'hidden_activation': 'prelu', 'hidden_dropout': 0.2, 'batch_norm': 'on', 'optimizer_type': 'adam', 'optimizer_lr': 0.002564336951341825, 'batch_size': 32}. Best is trial 390 with value: 16.963969438912468.
Trial 575 finished with value: 19336.635120327912 and parameters: {'input_dropout': 0.1, 'hidden_layers': 5, 'hidden_units': 128, 'kernel_initializer': 'he_uniform', 'hidden_activation': 'prelu', 'hidden_dropout': 0.1, 'batch_norm': 'on', 'optimizer_type': 'adam', 'optimizer_lr': 0.00014161284889490288, 'batch_size': 128}. Best is trial 390 with value: 16.963969438912468.
Trial 576 finished with value: 148.19549372816567 and parameters: {'input_dropout': 0.15000000000000002, 'hidden_layers': 8, 'hidden_units': 160, 'kernel_initializer': 'random_normal', 'hidden_activation': 'relu', 'hidden_dropout': 0.05, 'batch_norm': 'off', 'optimizer_type': 'rmsprop', 'optimizer_lr': 0.002120498018621039, 'batch_size': 32}. Best is trial 390 with value: 16.963969438912468.
Trial 577 finished with value: 122.55205552405107 and parameters: {'input_dropout': 0.1, 'hidden_layers': 3, 'hidden_units': 160, 'kernel_initializer': 'random_normal', 'hidden_activation': 'prelu', 'hidden_dropout': 0.25, 'batch_norm': 'off', 'optimizer_type': 'rmsprop', 'optimizer_lr': 0.004125926519082143, 'batch_size': 32}. Best is trial 390 with value: 16.963969438912468.
Trial 578 finished with value: 705.1659528940578 and parameters: {'input_dropout': 0.15000000000000002, 'hidden_layers': 3, 'hidden_units': 32, 'kernel_initializer': 'he_uniform', 'hidden_activation': 'leaky_relu', 'hidden_dropout': 0.25, 'batch_norm': 'off', 'optimizer_type': 'adam', 'optimizer_lr': 0.00016063713161288822, 'batch_size': 96}. Best is trial 390 with value: 16.963969438912468.
Trial 579 finished with value: 135.8678932365722 and parameters: {'input_dropout': 0.1, 'hidden_layers': 5, 'hidden_units': 192, 'kernel_initializer': 'he_normal', 'hidden_activation': 'relu', 'hidden_dropout': 0.05, 'batch_norm': 'off', 'optimizer_type': 'rmsprop', 'optimizer_lr': 0.007584058110751957, 'batch_size': 128}. Best is trial 390 with value: 16.963969438912468.
Trial 580 finished with value: 259.7463543875801 and parameters: {'input_dropout': 0.0, 'hidden_layers': 10, 'hidden_units': 96, 'kernel_initializer': 'random_normal', 'hidden_activation': 'prelu', 'hidden_dropout': 0.3, 'batch_norm': 'on', 'optimizer_type': 'rmsprop', 'optimizer_lr': 0.001420118578294164, 'batch_size': 32}. Best is trial 390 with value: 16.963969438912468.
Trial 581 finished with value: 89.64597205405613 and parameters: {'input_dropout': 0.0, 'hidden_layers': 8, 'hidden_units': 192, 'kernel_initializer': 'random_normal', 'hidden_activation': 'leaky_relu', 'hidden_dropout': 0.15000000000000002, 'batch_norm': 'off', 'optimizer_type': 'adam', 'optimizer_lr': 0.0005842695072566266, 'batch_size': 64}. Best is trial 390 with value: 16.963969438912468.
Trial 582 finished with value: 3554.241685871203 and parameters: {'input_dropout': 0.15000000000000002, 'hidden_layers': 7, 'hidden_units': 64, 'kernel_initializer': 'he_normal', 'hidden_activation': 'prelu', 'hidden_dropout': 0.3, 'batch_norm': 'off', 'optimizer_type': 'adam', 'optimizer_lr': 0.000241402324126779, 'batch_size': 96}. Best is trial 390 with value: 16.963969438912468.
Trial 583 finished with value: 134.0214512205565 and parameters: {'input_dropout': 0.05, 'hidden_layers': 5, 'hidden_units': 128, 'kernel_initializer': 'he_normal', 'hidden_activation': 'prelu', 'hidden_dropout': 0.05, 'batch_norm': 'off', 'optimizer_type': 'rmsprop', 'optimizer_lr': 0.00035527910428637826, 'batch_size': 32}. Best is trial 390 with value: 16.963969438912468.
Trial 584 finished with value: 323.81304007663596 and parameters: {'input_dropout': 0.1, 'hidden_layers': 8, 'hidden_units': 160, 'kernel_initializer': 'he_normal', 'hidden_activation': 'relu', 'hidden_dropout': 0.1, 'batch_norm': 'off', 'optimizer_type': 'adam', 'optimizer_lr': 0.003779202776377723, 'batch_size': 96}. Best is trial 390 with value: 16.963969438912468.
Trial 585 finished with value: 423.13455053468977 and parameters: {'input_dropout': 0.1, 'hidden_layers': 10, 'hidden_units': 32, 'kernel_initializer': 'he_uniform', 'hidden_activation': 'prelu', 'hidden_dropout': 0.15000000000000002, 'batch_norm': 'on', 'optimizer_type': 'adam', 'optimizer_lr': 0.0065146538408481355, 'batch_size': 96}. Best is trial 390 with value: 16.963969438912468.
Trial 586 finished with value: 1080.060448614079 and parameters: {'input_dropout': 0.2, 'hidden_layers': 7, 'hidden_units': 160, 'kernel_initializer': 'he_normal', 'hidden_activation': 'prelu', 'hidden_dropout': 0.2, 'batch_norm': 'off', 'optimizer_type': 'rmsprop', 'optimizer_lr': 0.000296518623852304, 'batch_size': 64}. Best is trial 390 with value: 16.963969438912468.
Trial 587 finished with value: 14793.134600348523 and parameters: {'input_dropout': 0.15000000000000002, 'hidden_layers': 6, 'hidden_units': 128, 'kernel_initializer': 'he_normal', 'hidden_activation': 'leaky_relu', 'hidden_dropout': 0.1, 'batch_norm': 'on', 'optimizer_type': 'adam', 'optimizer_lr': 0.00029616314266984035, 'batch_size': 128}. Best is trial 390 with value: 16.963969438912468.
Trial 588 finished with value: 261.54663604981243 and parameters: {'input_dropout': 0.2, 'hidden_layers': 8, 'hidden_units': 160, 'kernel_initializer': 'he_uniform', 'hidden_activation': 'prelu', 'hidden_dropout': 0.0, 'batch_norm': 'off', 'optimizer_type': 'adam', 'optimizer_lr': 0.0002909513832758801, 'batch_size': 96}. Best is trial 390 with value: 16.963969438912468.
Trial 589 finished with value: 1349.1612960288207 and parameters: {'input_dropout': 0.05, 'hidden_layers': 9, 'hidden_units': 224, 'kernel_initializer': 'he_uniform', 'hidden_activation': 'prelu', 'hidden_dropout': 0.2, 'batch_norm': 'off', 'optimizer_type': 'rmsprop', 'optimizer_lr': 0.00012638342130226438, 'batch_size': 32}. Best is trial 390 with value: 16.963969438912468.
Trial 590 finished with value: 3196.7210369449385 and parameters: {'input_dropout': 0.2, 'hidden_layers': 10, 'hidden_units': 32, 'kernel_initializer': 'he_uniform', 'hidden_activation': 'leaky_relu', 'hidden_dropout': 0.15000000000000002, 'batch_norm': 'off', 'optimizer_type': 'rmsprop', 'optimizer_lr': 0.0049640821426847614, 'batch_size': 64}. Best is trial 390 with value: 16.963969438912468.
Trial 591 finished with value: 148.12152569604913 and parameters: {'input_dropout': 0.0, 'hidden_layers': 8, 'hidden_units': 128, 'kernel_initializer': 'random_normal', 'hidden_activation': 'leaky_relu', 'hidden_dropout': 0.15000000000000002, 'batch_norm': 'on', 'optimizer_type': 'adam', 'optimizer_lr': 0.0016630224999898131, 'batch_size': 64}. Best is trial 390 with value: 16.963969438912468.
Trial 592 finished with value: 4404.405759687605 and parameters: {'input_dropout': 0.0, 'hidden_layers': 8, 'hidden_units': 64, 'kernel_initializer': 'he_uniform', 'hidden_activation': 'leaky_relu', 'hidden_dropout': 0.3, 'batch_norm': 'off', 'optimizer_type': 'adam', 'optimizer_lr': 0.00011055947276583791, 'batch_size': 64}. Best is trial 390 with value: 16.963969438912468.
Trial 593 finished with value: 198.83057036580843 and parameters: {'input_dropout': 0.1, 'hidden_layers': 9, 'hidden_units': 192, 'kernel_initializer': 'he_uniform', 'hidden_activation': 'prelu', 'hidden_dropout': 0.1, 'batch_norm': 'on', 'optimizer_type': 'adam', 'optimizer_lr': 0.0019144751048707528, 'batch_size': 32}. Best is trial 390 with value: 16.963969438912468.
Trial 594 finished with value: 187.90917222664328 and parameters: {'input_dropout': 0.15000000000000002, 'hidden_layers': 6, 'hidden_units': 160, 'kernel_initializer': 'he_normal', 'hidden_activation': 'leaky_relu', 'hidden_dropout': 0.0, 'batch_norm': 'off', 'optimizer_type': 'adam', 'optimizer_lr': 0.00031273760080708144, 'batch_size': 32}. Best is trial 390 with value: 16.963969438912468.
Trial 595 finished with value: 9586.130417200122 and parameters: {'input_dropout': 0.0, 'hidden_layers': 3, 'hidden_units': 192, 'kernel_initializer': 'he_normal', 'hidden_activation': 'relu', 'hidden_dropout': 0.1, 'batch_norm': 'on', 'optimizer_type': 'rmsprop', 'optimizer_lr': 0.00025907491471479326, 'batch_size': 64}. Best is trial 390 with value: 16.963969438912468.
Trial 596 finished with value: 84.54520167025156 and parameters: {'input_dropout': 0.15000000000000002, 'hidden_layers': 4, 'hidden_units': 224, 'kernel_initializer': 'random_normal', 'hidden_activation': 'relu', 'hidden_dropout': 0.0, 'batch_norm': 'on', 'optimizer_type': 'adam', 'optimizer_lr': 0.00518183401134401, 'batch_size': 64}. Best is trial 390 with value: 16.963969438912468.
Trial 597 finished with value: 18315.550085369934 and parameters: {'input_dropout': 0.1, 'hidden_layers': 4, 'hidden_units': 160, 'kernel_initializer': 'he_uniform', 'hidden_activation': 'prelu', 'hidden_dropout': 0.15000000000000002, 'batch_norm': 'on', 'optimizer_type': 'adam', 'optimizer_lr': 0.0001329686437989139, 'batch_size': 128}. Best is trial 390 with value: 16.963969438912468.
Trial 598 finished with value: 173.38375470822356 and parameters: {'input_dropout': 0.15000000000000002, 'hidden_layers': 8, 'hidden_units': 224, 'kernel_initializer': 'he_uniform', 'hidden_activation': 'leaky_relu', 'hidden_dropout': 0.2, 'batch_norm': 'on', 'optimizer_type': 'adam', 'optimizer_lr': 0.0005751679151770843, 'batch_size': 32}. Best is trial 390 with value: 16.963969438912468.
Trial 599 finished with value: 9048.764712955684 and parameters: {'input_dropout': 0.15000000000000002, 'hidden_layers': 3, 'hidden_units': 128, 'kernel_initializer': 'he_uniform', 'hidden_activation': 'leaky_relu', 'hidden_dropout': 0.3, 'batch_norm': 'on', 'optimizer_type': 'rmsprop', 'optimizer_lr': 0.0006765998351714921, 'batch_size': 96}. Best is trial 390 with value: 16.963969438912468.
Trial 600 finished with value: 1691.9269241419297 and parameters: {'input_dropout': 0.05, 'hidden_layers': 7, 'hidden_units': 32, 'kernel_initializer': 'he_uniform', 'hidden_activation': 'prelu', 'hidden_dropout': 0.2, 'batch_norm': 'off', 'optimizer_type': 'adam', 'optimizer_lr': 0.0031371264616802067, 'batch_size': 128}. Best is trial 390 with value: 16.963969438912468.
Trial 601 finished with value: 2049.813304867222 and parameters: {'input_dropout': 0.2, 'hidden_layers': 8, 'hidden_units': 128, 'kernel_initializer': 'he_normal', 'hidden_activation': 'relu', 'hidden_dropout': 0.2, 'batch_norm': 'off', 'optimizer_type': 'rmsprop', 'optimizer_lr': 0.0001022723722521429, 'batch_size': 96}. Best is trial 390 with value: 16.963969438912468.
Trial 602 finished with value: 11115.475190450894 and parameters: {'input_dropout': 0.15000000000000002, 'hidden_layers': 8, 'hidden_units': 256, 'kernel_initializer': 'he_uniform', 'hidden_activation': 'leaky_relu', 'hidden_dropout': 0.05, 'batch_norm': 'on', 'optimizer_type': 'rmsprop', 'optimizer_lr': 0.0003316964907626593, 'batch_size': 128}. Best is trial 390 with value: 16.963969438912468.
Trial 603 finished with value: 245.34436405552984 and parameters: {'input_dropout': 0.2, 'hidden_layers': 7, 'hidden_units': 192, 'kernel_initializer': 'he_normal', 'hidden_activation': 'relu', 'hidden_dropout': 0.1, 'batch_norm': 'on', 'optimizer_type': 'adam', 'optimizer_lr': 0.006585684529853288, 'batch_size': 128}. Best is trial 390 with value: 16.963969438912468.
Trial 604 finished with value: 4034.2793385281484 and parameters: {'input_dropout': 0.05, 'hidden_layers': 9, 'hidden_units': 32, 'kernel_initializer': 'he_uniform', 'hidden_activation': 'relu', 'hidden_dropout': 0.2, 'batch_norm': 'off', 'optimizer_type': 'rmsprop', 'optimizer_lr': 0.0005912065004607495, 'batch_size': 64}. Best is trial 390 with value: 16.963969438912468.
Trial 605 finished with value: 8402.98564178321 and parameters: {'input_dropout': 0.15000000000000002, 'hidden_layers': 9, 'hidden_units': 256, 'kernel_initializer': 'he_normal', 'hidden_activation': 'relu', 'hidden_dropout': 0.25, 'batch_norm': 'on', 'optimizer_type': 'rmsprop', 'optimizer_lr': 0.00021291395219898103, 'batch_size': 64}. Best is trial 390 with value: 16.963969438912468.
Trial 606 finished with value: 11442.934615322698 and parameters: {'input_dropout': 0.1, 'hidden_layers': 8, 'hidden_units': 160, 'kernel_initializer': 'random_normal', 'hidden_activation': 'relu', 'hidden_dropout': 0.1, 'batch_norm': 'on', 'optimizer_type': 'rmsprop', 'optimizer_lr': 0.00010384326502405044, 'batch_size': 32}. Best is trial 390 with value: 16.963969438912468.
Trial 607 finished with value: 142.17516865126095 and parameters: {'input_dropout': 0.05, 'hidden_layers': 6, 'hidden_units': 256, 'kernel_initializer': 'he_uniform', 'hidden_activation': 'relu', 'hidden_dropout': 0.15000000000000002, 'batch_norm': 'off', 'optimizer_type': 'adam', 'optimizer_lr': 0.0027815633653211647, 'batch_size': 32}. Best is trial 390 with value: 16.963969438912468.
Trial 608 finished with value: 6165.448675698161 and parameters: {'input_dropout': 0.05, 'hidden_layers': 4, 'hidden_units': 192, 'kernel_initializer': 'random_normal', 'hidden_activation': 'prelu', 'hidden_dropout': 0.1, 'batch_norm': 'on', 'optimizer_type': 'rmsprop', 'optimizer_lr': 0.00021139476455666164, 'batch_size': 64}. Best is trial 390 with value: 16.963969438912468.
Trial 609 finished with value: 192.12934137415684 and parameters: {'input_dropout': 0.05, 'hidden_layers': 8, 'hidden_units': 96, 'kernel_initializer': 'he_uniform', 'hidden_activation': 'relu', 'hidden_dropout': 0.2, 'batch_norm': 'on', 'optimizer_type': 'rmsprop', 'optimizer_lr': 0.00766148344052667, 'batch_size': 128}. Best is trial 390 with value: 16.963969438912468.
Trial 610 finished with value: 103.0987610429857 and parameters: {'input_dropout': 0.0, 'hidden_layers': 5, 'hidden_units': 160, 'kernel_initializer': 'he_uniform', 'hidden_activation': 'leaky_relu', 'hidden_dropout': 0.25, 'batch_norm': 'on', 'optimizer_type': 'rmsprop', 'optimizer_lr': 0.002123672776976184, 'batch_size': 96}. Best is trial 390 with value: 16.963969438912468.
Trial 611 finished with value: 248.50655685405044 and parameters: {'input_dropout': 0.2, 'hidden_layers': 10, 'hidden_units': 96, 'kernel_initializer': 'he_normal', 'hidden_activation': 'relu', 'hidden_dropout': 0.15000000000000002, 'batch_norm': 'on', 'optimizer_type': 'adam', 'optimizer_lr': 0.005745443064050924, 'batch_size': 128}. Best is trial 390 with value: 16.963969438912468.
Trial 612 finished with value: 396.8100061005681 and parameters: {'input_dropout': 0.2, 'hidden_layers': 9, 'hidden_units': 256, 'kernel_initializer': 'he_uniform', 'hidden_activation': 'relu', 'hidden_dropout': 0.1, 'batch_norm': 'off', 'optimizer_type': 'adam', 'optimizer_lr': 0.004055135556118179, 'batch_size': 96}. Best is trial 390 with value: 16.963969438912468.
Trial 613 finished with value: 385.6197360803207 and parameters: {'input_dropout': 0.0, 'hidden_layers': 5, 'hidden_units': 160, 'kernel_initializer': 'he_normal', 'hidden_activation': 'relu', 'hidden_dropout': 0.25, 'batch_norm': 'off', 'optimizer_type': 'adam', 'optimizer_lr': 0.0013770608886447529, 'batch_size': 32}. Best is trial 390 with value: 16.963969438912468.
Trial 614 finished with value: 18669.788012839286 and parameters: {'input_dropout': 0.05, 'hidden_layers': 8, 'hidden_units': 96, 'kernel_initializer': 'he_uniform', 'hidden_activation': 'leaky_relu', 'hidden_dropout': 0.15000000000000002, 'batch_norm': 'on', 'optimizer_type': 'rmsprop', 'optimizer_lr': 0.00011171162420544822, 'batch_size': 64}. Best is trial 390 with value: 16.963969438912468.
Trial 615 finished with value: 159.8252331640123 and parameters: {'input_dropout': 0.1, 'hidden_layers': 4, 'hidden_units': 256, 'kernel_initializer': 'he_uniform', 'hidden_activation': 'prelu', 'hidden_dropout': 0.2, 'batch_norm': 'off', 'optimizer_type': 'adam', 'optimizer_lr': 0.0017552661769901369, 'batch_size': 32}. Best is trial 390 with value: 16.963969438912468.
Trial 616 finished with value: 355.2615465437003 and parameters: {'input_dropout': 0.05, 'hidden_layers': 5, 'hidden_units': 128, 'kernel_initializer': 'random_normal', 'hidden_activation': 'prelu', 'hidden_dropout': 0.25, 'batch_norm': 'on', 'optimizer_type': 'adam', 'optimizer_lr': 0.00929305580067612, 'batch_size': 128}. Best is trial 390 with value: 16.963969438912468.
Trial 617 finished with value: 191.94401691750684 and parameters: {'input_dropout': 0.1, 'hidden_layers': 5, 'hidden_units': 96, 'kernel_initializer': 'random_normal', 'hidden_activation': 'relu', 'hidden_dropout': 0.3, 'batch_norm': 'on', 'optimizer_type': 'adam', 'optimizer_lr': 0.0007820539750069628, 'batch_size': 32}. Best is trial 390 with value: 16.963969438912468.
Trial 618 finished with value: 163.92000511981874 and parameters: {'input_dropout': 0.15000000000000002, 'hidden_layers': 5, 'hidden_units': 96, 'kernel_initializer': 'he_normal', 'hidden_activation': 'leaky_relu', 'hidden_dropout': 0.25, 'batch_norm': 'on', 'optimizer_type': 'rmsprop', 'optimizer_lr': 0.006871924519627315, 'batch_size': 64}. Best is trial 390 with value: 16.963969438912468.
Trial 619 finished with value: 1520.244807321521 and parameters: {'input_dropout': 0.15000000000000002, 'hidden_layers': 6, 'hidden_units': 256, 'kernel_initializer': 'he_normal', 'hidden_activation': 'relu', 'hidden_dropout': 0.3, 'batch_norm': 'off', 'optimizer_type': 'adam', 'optimizer_lr': 0.0018792278829578473, 'batch_size': 32}. Best is trial 390 with value: 16.963969438912468.
Trial 620 finished with value: 279.6402510150402 and parameters: {'input_dropout': 0.2, 'hidden_layers': 6, 'hidden_units': 64, 'kernel_initializer': 'random_normal', 'hidden_activation': 'prelu', 'hidden_dropout': 0.3, 'batch_norm': 'on', 'optimizer_type': 'adam', 'optimizer_lr': 0.009304167242199693, 'batch_size': 128}. Best is trial 390 with value: 16.963969438912468.
Trial 621 finished with value: 9110.741608213966 and parameters: {'input_dropout': 0.2, 'hidden_layers': 5, 'hidden_units': 192, 'kernel_initializer': 'he_normal', 'hidden_activation': 'leaky_relu', 'hidden_dropout': 0.2, 'batch_norm': 'on', 'optimizer_type': 'rmsprop', 'optimizer_lr': 0.0006441199914414919, 'batch_size': 128}. Best is trial 390 with value: 16.963969438912468.
Trial 622 finished with value: 16652.991996302153 and parameters: {'input_dropout': 0.2, 'hidden_layers': 6, 'hidden_units': 96, 'kernel_initializer': 'he_uniform', 'hidden_activation': 'relu', 'hidden_dropout': 0.2, 'batch_norm': 'on', 'optimizer_type': 'adam', 'optimizer_lr': 0.0001936163040409551, 'batch_size': 96}. Best is trial 390 with value: 16.963969438912468.
Trial 623 finished with value: 8954.06942174289 and parameters: {'input_dropout': 0.15000000000000002, 'hidden_layers': 9, 'hidden_units': 64, 'kernel_initializer': 'he_uniform', 'hidden_activation': 'leaky_relu', 'hidden_dropout': 0.0, 'batch_norm': 'on', 'optimizer_type': 'adam', 'optimizer_lr': 0.0005963343537943619, 'batch_size': 32}. Best is trial 390 with value: 16.963969438912468.
Trial 624 finished with value: 39.87618679970862 and parameters: {'input_dropout': 0.0, 'hidden_layers': 6, 'hidden_units': 160, 'kernel_initializer': 'random_normal', 'hidden_activation': 'prelu', 'hidden_dropout': 0.05, 'batch_norm': 'on', 'optimizer_type': 'rmsprop', 'optimizer_lr': 0.0007606080438243852, 'batch_size': 128}. Best is trial 390 with value: 16.963969438912468.
Trial 625 finished with value: 35.97398445045758 and parameters: {'input_dropout': 0.0, 'hidden_layers': 5, 'hidden_units': 160, 'kernel_initializer': 'he_uniform', 'hidden_activation': 'relu', 'hidden_dropout': 0.0, 'batch_norm': 'on', 'optimizer_type': 'rmsprop', 'optimizer_lr': 0.003988125226814654, 'batch_size': 32}. Best is trial 390 with value: 16.963969438912468.
Trial 626 finished with value: 304.47883001690485 and parameters: {'input_dropout': 0.0, 'hidden_layers': 10, 'hidden_units': 128, 'kernel_initializer': 'he_uniform', 'hidden_activation': 'leaky_relu', 'hidden_dropout': 0.05, 'batch_norm': 'off', 'optimizer_type': 'adam', 'optimizer_lr': 0.001014892692376542, 'batch_size': 128}. Best is trial 390 with value: 16.963969438912468.
Trial 627 finished with value: 101.61915194989436 and parameters: {'input_dropout': 0.0, 'hidden_layers': 4, 'hidden_units': 192, 'kernel_initializer': 'he_uniform', 'hidden_activation': 'relu', 'hidden_dropout': 0.2, 'batch_norm': 'off', 'optimizer_type': 'adam', 'optimizer_lr': 0.004031681892449913, 'batch_size': 96}. Best is trial 390 with value: 16.963969438912468.
Trial 628 finished with value: 300.28344845822073 and parameters: {'input_dropout': 0.1, 'hidden_layers': 6, 'hidden_units': 160, 'kernel_initializer': 'he_uniform', 'hidden_activation': 'leaky_relu', 'hidden_dropout': 0.15000000000000002, 'batch_norm': 'off', 'optimizer_type': 'rmsprop', 'optimizer_lr': 0.00023064744985462184, 'batch_size': 32}. Best is trial 390 with value: 16.963969438912468.
