Trial 401 finished with value: 194.21017525305678 and parameters: {'input_dropout': 0.2, 'hidden_layers': 4, 'hidden_units': 128, 'kernel_initializer': 'he_uniform', 'hidden_activation': 'prelu', 'hidden_dropout': 0.05, 'batch_norm': 'off', 'optimizer_type': 'adam', 'optimizer_lr': 0.0034910182058423807, 'batch_size': 32}. Best is trial 390 with value: 16.963969438912468.
Trial 402 finished with value: 169.10166257634194 and parameters: {'input_dropout': 0.15000000000000002, 'hidden_layers': 3, 'hidden_units': 128, 'kernel_initializer': 'random_normal', 'hidden_activation': 'relu', 'hidden_dropout': 0.0, 'batch_norm': 'off', 'optimizer_type': 'adam', 'optimizer_lr': 0.000411820281666404, 'batch_size': 128}. Best is trial 390 with value: 16.963969438912468.
Trial 403 finished with value: 207.46820048720795 and parameters: {'input_dropout': 0.15000000000000002, 'hidden_layers': 10, 'hidden_units': 256, 'kernel_initializer': 'random_normal', 'hidden_activation': 'relu', 'hidden_dropout': 0.05, 'batch_norm': 'off', 'optimizer_type': 'rmsprop', 'optimizer_lr': 0.007740838627478182, 'batch_size': 128}. Best is trial 390 with value: 16.963969438912468.
Trial 404 finished with value: 231.89977526854466 and parameters: {'input_dropout': 0.0, 'hidden_layers': 8, 'hidden_units': 256, 'kernel_initializer': 'he_uniform', 'hidden_activation': 'prelu', 'hidden_dropout': 0.15000000000000002, 'batch_norm': 'off', 'optimizer_type': 'rmsprop', 'optimizer_lr': 0.004557081951653906, 'batch_size': 32}. Best is trial 390 with value: 16.963969438912468.
Trial 405 finished with value: 1210.223170633773 and parameters: {'input_dropout': 0.0, 'hidden_layers': 6, 'hidden_units': 32, 'kernel_initializer': 'he_normal', 'hidden_activation': 'leaky_relu', 'hidden_dropout': 0.25, 'batch_norm': 'off', 'optimizer_type': 'adam', 'optimizer_lr': 0.00011579506480776992, 'batch_size': 32}. Best is trial 390 with value: 16.963969438912468.
Trial 406 finished with value: 10120.014747587451 and parameters: {'input_dropout': 0.05, 'hidden_layers': 3, 'hidden_units': 96, 'kernel_initializer': 'random_normal', 'hidden_activation': 'prelu', 'hidden_dropout': 0.1, 'batch_norm': 'on', 'optimizer_type': 'rmsprop', 'optimizer_lr': 0.0002231397473627346, 'batch_size': 64}. Best is trial 390 with value: 16.963969438912468.
Trial 407 finished with value: 773.7550610178657 and parameters: {'input_dropout': 0.1, 'hidden_layers': 9, 'hidden_units': 224, 'kernel_initializer': 'he_uniform', 'hidden_activation': 'prelu', 'hidden_dropout': 0.15000000000000002, 'batch_norm': 'off', 'optimizer_type': 'adam', 'optimizer_lr': 0.00010282127960913753, 'batch_size': 96}. Best is trial 390 with value: 16.963969438912468.
Trial 408 finished with value: 12035.784886406977 and parameters: {'input_dropout': 0.2, 'hidden_layers': 4, 'hidden_units': 32, 'kernel_initializer': 'he_uniform', 'hidden_activation': 'leaky_relu', 'hidden_dropout': 0.15000000000000002, 'batch_norm': 'on', 'optimizer_type': 'rmsprop', 'optimizer_lr': 0.0002729933717322495, 'batch_size': 32}. Best is trial 390 with value: 16.963969438912468.
Trial 409 finished with value: 183.19052439500348 and parameters: {'input_dropout': 0.05, 'hidden_layers': 6, 'hidden_units': 96, 'kernel_initializer': 'random_normal', 'hidden_activation': 'relu', 'hidden_dropout': 0.1, 'batch_norm': 'off', 'optimizer_type': 'rmsprop', 'optimizer_lr': 0.00015651169836430176, 'batch_size': 96}. Best is trial 390 with value: 16.963969438912468.
Trial 410 finished with value: 10100.213753883998 and parameters: {'input_dropout': 0.05, 'hidden_layers': 10, 'hidden_units': 32, 'kernel_initializer': 'he_normal', 'hidden_activation': 'relu', 'hidden_dropout': 0.05, 'batch_norm': 'on', 'optimizer_type': 'adam', 'optimizer_lr': 0.00040942380530175395, 'batch_size': 64}. Best is trial 390 with value: 16.963969438912468.
Trial 411 finished with value: 466.02328104276125 and parameters: {'input_dropout': 0.2, 'hidden_layers': 9, 'hidden_units': 128, 'kernel_initializer': 'he_normal', 'hidden_activation': 'relu', 'hidden_dropout': 0.1, 'batch_norm': 'off', 'optimizer_type': 'adam', 'optimizer_lr': 0.003003989541526184, 'batch_size': 96}. Best is trial 390 with value: 16.963969438912468.
Trial 412 finished with value: 351.80617304200973 and parameters: {'input_dropout': 0.05, 'hidden_layers': 9, 'hidden_units': 32, 'kernel_initializer': 'random_normal', 'hidden_activation': 'prelu', 'hidden_dropout': 0.15000000000000002, 'batch_norm': 'on', 'optimizer_type': 'rmsprop', 'optimizer_lr': 0.0014287948843965522, 'batch_size': 96}. Best is trial 390 with value: 16.963969438912468.
Trial 413 finished with value: 196.87728120078697 and parameters: {'input_dropout': 0.0, 'hidden_layers': 4, 'hidden_units': 32, 'kernel_initializer': 'he_uniform', 'hidden_activation': 'leaky_relu', 'hidden_dropout': 0.2, 'batch_norm': 'on', 'optimizer_type': 'adam', 'optimizer_lr': 0.003321956751705749, 'batch_size': 96}. Best is trial 390 with value: 16.963969438912468.
Trial 414 finished with value: 165.15623250673204 and parameters: {'input_dropout': 0.2, 'hidden_layers': 8, 'hidden_units': 160, 'kernel_initializer': 'he_uniform', 'hidden_activation': 'leaky_relu', 'hidden_dropout': 0.1, 'batch_norm': 'on', 'optimizer_type': 'adam', 'optimizer_lr': 0.005123678532756491, 'batch_size': 32}. Best is trial 390 with value: 16.963969438912468.
Trial 415 finished with value: 184.42033442927334 and parameters: {'input_dropout': 0.15000000000000002, 'hidden_layers': 7, 'hidden_units': 256, 'kernel_initializer': 'he_uniform', 'hidden_activation': 'prelu', 'hidden_dropout': 0.25, 'batch_norm': 'on', 'optimizer_type': 'rmsprop', 'optimizer_lr': 0.001151209639794214, 'batch_size': 128}. Best is trial 390 with value: 16.963969438912468.
Trial 416 finished with value: 3123.088391921764 and parameters: {'input_dropout': 0.15000000000000002, 'hidden_layers': 8, 'hidden_units': 160, 'kernel_initializer': 'random_normal', 'hidden_activation': 'relu', 'hidden_dropout': 0.1, 'batch_norm': 'on', 'optimizer_type': 'adam', 'optimizer_lr': 0.0005033511905639058, 'batch_size': 96}. Best is trial 390 with value: 16.963969438912468.
Trial 417 finished with value: 132.4176842099605 and parameters: {'input_dropout': 0.15000000000000002, 'hidden_layers': 5, 'hidden_units': 96, 'kernel_initializer': 'random_normal', 'hidden_activation': 'relu', 'hidden_dropout': 0.15000000000000002, 'batch_norm': 'on', 'optimizer_type': 'adam', 'optimizer_lr': 0.004730012554079807, 'batch_size': 32}. Best is trial 390 with value: 16.963969438912468.
Trial 418 finished with value: 141.85329522346626 and parameters: {'input_dropout': 0.0, 'hidden_layers': 5, 'hidden_units': 224, 'kernel_initializer': 'he_normal', 'hidden_activation': 'prelu', 'hidden_dropout': 0.25, 'batch_norm': 'on', 'optimizer_type': 'adam', 'optimizer_lr': 0.0026638348013202913, 'batch_size': 128}. Best is trial 390 with value: 16.963969438912468.
Trial 419 finished with value: 8762.197008079727 and parameters: {'input_dropout': 0.0, 'hidden_layers': 7, 'hidden_units': 224, 'kernel_initializer': 'random_normal', 'hidden_activation': 'leaky_relu', 'hidden_dropout': 0.25, 'batch_norm': 'on', 'optimizer_type': 'adam', 'optimizer_lr': 0.0001606250255647808, 'batch_size': 32}. Best is trial 390 with value: 16.963969438912468.
Trial 420 finished with value: 167.94945469819925 and parameters: {'input_dropout': 0.1, 'hidden_layers': 5, 'hidden_units': 256, 'kernel_initializer': 'he_uniform', 'hidden_activation': 'leaky_relu', 'hidden_dropout': 0.1, 'batch_norm': 'off', 'optimizer_type': 'adam', 'optimizer_lr': 0.0027461444291554805, 'batch_size': 96}. Best is trial 390 with value: 16.963969438912468.
Trial 421 finished with value: 571.5953779920104 and parameters: {'input_dropout': 0.1, 'hidden_layers': 10, 'hidden_units': 32, 'kernel_initializer': 'he_uniform', 'hidden_activation': 'leaky_relu', 'hidden_dropout': 0.1, 'batch_norm': 'off', 'optimizer_type': 'rmsprop', 'optimizer_lr': 0.009246205126843035, 'batch_size': 96}. Best is trial 390 with value: 16.963969438912468.
Trial 422 finished with value: 141.38979258867698 and parameters: {'input_dropout': 0.15000000000000002, 'hidden_layers': 4, 'hidden_units': 192, 'kernel_initializer': 'he_normal', 'hidden_activation': 'leaky_relu', 'hidden_dropout': 0.3, 'batch_norm': 'on', 'optimizer_type': 'rmsprop', 'optimizer_lr': 0.0018551031326195884, 'batch_size': 32}. Best is trial 390 with value: 16.963969438912468.
Trial 423 finished with value: 63.60065810054263 and parameters: {'input_dropout': 0.15000000000000002, 'hidden_layers': 6, 'hidden_units': 160, 'kernel_initializer': 'he_uniform', 'hidden_activation': 'leaky_relu', 'hidden_dropout': 0.0, 'batch_norm': 'on', 'optimizer_type': 'rmsprop', 'optimizer_lr': 0.003093458390213773, 'batch_size': 128}. Best is trial 390 with value: 16.963969438912468.
Trial 424 finished with value: 3999.48596704876 and parameters: {'input_dropout': 0.1, 'hidden_layers': 9, 'hidden_units': 128, 'kernel_initializer': 'he_normal', 'hidden_activation': 'leaky_relu', 'hidden_dropout': 0.25, 'batch_norm': 'off', 'optimizer_type': 'rmsprop', 'optimizer_lr': 0.0017866732286103734, 'batch_size': 32}. Best is trial 390 with value: 16.963969438912468.
Trial 425 finished with value: 12328.559585105202 and parameters: {'input_dropout': 0.0, 'hidden_layers': 6, 'hidden_units': 96, 'kernel_initializer': 'random_normal', 'hidden_activation': 'relu', 'hidden_dropout': 0.15000000000000002, 'batch_norm': 'on', 'optimizer_type': 'rmsprop', 'optimizer_lr': 0.00021425548248670833, 'batch_size': 64}. Best is trial 390 with value: 16.963969438912468.
Trial 426 finished with value: 7955.375519243674 and parameters: {'input_dropout': 0.05, 'hidden_layers': 10, 'hidden_units': 32, 'kernel_initializer': 'he_normal', 'hidden_activation': 'prelu', 'hidden_dropout': 0.3, 'batch_norm': 'off', 'optimizer_type': 'rmsprop', 'optimizer_lr': 0.0042036308108119895, 'batch_size': 32}. Best is trial 390 with value: 16.963969438912468.
Trial 427 finished with value: 181.65973351661094 and parameters: {'input_dropout': 0.15000000000000002, 'hidden_layers': 4, 'hidden_units': 96, 'kernel_initializer': 'random_normal', 'hidden_activation': 'leaky_relu', 'hidden_dropout': 0.05, 'batch_norm': 'off', 'optimizer_type': 'adam', 'optimizer_lr': 0.00040823288748103513, 'batch_size': 96}. Best is trial 390 with value: 16.963969438912468.
Trial 428 finished with value: 161.77925021948536 and parameters: {'input_dropout': 0.2, 'hidden_layers': 4, 'hidden_units': 64, 'kernel_initializer': 'he_normal', 'hidden_activation': 'leaky_relu', 'hidden_dropout': 0.1, 'batch_norm': 'on', 'optimizer_type': 'rmsprop', 'optimizer_lr': 0.003377134396288357, 'batch_size': 32}. Best is trial 390 with value: 16.963969438912468.
Trial 429 finished with value: 181.21087637055888 and parameters: {'input_dropout': 0.2, 'hidden_layers': 9, 'hidden_units': 192, 'kernel_initializer': 'random_normal', 'hidden_activation': 'prelu', 'hidden_dropout': 0.3, 'batch_norm': 'off', 'optimizer_type': 'rmsprop', 'optimizer_lr': 0.0021975275773051636, 'batch_size': 32}. Best is trial 390 with value: 16.963969438912468.
Trial 430 finished with value: 254.32841284859956 and parameters: {'input_dropout': 0.05, 'hidden_layers': 10, 'hidden_units': 64, 'kernel_initializer': 'random_normal', 'hidden_activation': 'prelu', 'hidden_dropout': 0.15000000000000002, 'batch_norm': 'on', 'optimizer_type': 'rmsprop', 'optimizer_lr': 0.004394018466346871, 'batch_size': 32}. Best is trial 390 with value: 16.963969438912468.
Trial 431 finished with value: 8812.994266283724 and parameters: {'input_dropout': 0.2, 'hidden_layers': 7, 'hidden_units': 32, 'kernel_initializer': 'he_uniform', 'hidden_activation': 'prelu', 'hidden_dropout': 0.2, 'batch_norm': 'on', 'optimizer_type': 'adam', 'optimizer_lr': 0.0005956621359377985, 'batch_size': 96}. Best is trial 390 with value: 16.963969438912468.
Trial 432 finished with value: 14706.870270121017 and parameters: {'input_dropout': 0.05, 'hidden_layers': 7, 'hidden_units': 192, 'kernel_initializer': 'random_normal', 'hidden_activation': 'leaky_relu', 'hidden_dropout': 0.05, 'batch_norm': 'on', 'optimizer_type': 'adam', 'optimizer_lr': 0.00021087214522587969, 'batch_size': 128}. Best is trial 390 with value: 16.963969438912468.
Trial 433 finished with value: 693.2373255451627 and parameters: {'input_dropout': 0.2, 'hidden_layers': 7, 'hidden_units': 128, 'kernel_initializer': 'he_uniform', 'hidden_activation': 'relu', 'hidden_dropout': 0.3, 'batch_norm': 'off', 'optimizer_type': 'adam', 'optimizer_lr': 0.007812649811417965, 'batch_size': 32}. Best is trial 390 with value: 16.963969438912468.
Trial 434 finished with value: 6541.817748864387 and parameters: {'input_dropout': 0.1, 'hidden_layers': 10, 'hidden_units': 32, 'kernel_initializer': 'random_normal', 'hidden_activation': 'relu', 'hidden_dropout': 0.15000000000000002, 'batch_norm': 'on', 'optimizer_type': 'rmsprop', 'optimizer_lr': 0.0010592584048718535, 'batch_size': 32}. Best is trial 390 with value: 16.963969438912468.
Trial 435 finished with value: 236.66520656141205 and parameters: {'input_dropout': 0.1, 'hidden_layers': 7, 'hidden_units': 96, 'kernel_initializer': 'he_uniform', 'hidden_activation': 'prelu', 'hidden_dropout': 0.15000000000000002, 'batch_norm': 'on', 'optimizer_type': 'adam', 'optimizer_lr': 0.0007612822157775887, 'batch_size': 64}. Best is trial 390 with value: 16.963969438912468.
Trial 436 finished with value: 131.65909739595946 and parameters: {'input_dropout': 0.05, 'hidden_layers': 7, 'hidden_units': 224, 'kernel_initializer': 'random_normal', 'hidden_activation': 'prelu', 'hidden_dropout': 0.15000000000000002, 'batch_norm': 'on', 'optimizer_type': 'adam', 'optimizer_lr': 0.0010387804682729111, 'batch_size': 96}. Best is trial 390 with value: 16.963969438912468.
Trial 437 finished with value: 122.26134661593532 and parameters: {'input_dropout': 0.05, 'hidden_layers': 3, 'hidden_units': 64, 'kernel_initializer': 'he_uniform', 'hidden_activation': 'leaky_relu', 'hidden_dropout': 0.15000000000000002, 'batch_norm': 'on', 'optimizer_type': 'adam', 'optimizer_lr': 0.00468839097439286, 'batch_size': 64}. Best is trial 390 with value: 16.963969438912468.
Trial 438 finished with value: 145.38103721161883 and parameters: {'input_dropout': 0.15000000000000002, 'hidden_layers': 8, 'hidden_units': 224, 'kernel_initializer': 'random_normal', 'hidden_activation': 'leaky_relu', 'hidden_dropout': 0.05, 'batch_norm': 'on', 'optimizer_type': 'adam', 'optimizer_lr': 0.003065202599987277, 'batch_size': 96}. Best is trial 390 with value: 16.963969438912468.
Trial 439 finished with value: 117.21346344310284 and parameters: {'input_dropout': 0.2, 'hidden_layers': 3, 'hidden_units': 160, 'kernel_initializer': 'random_normal', 'hidden_activation': 'prelu', 'hidden_dropout': 0.1, 'batch_norm': 'on', 'optimizer_type': 'rmsprop', 'optimizer_lr': 0.002908173940443439, 'batch_size': 32}. Best is trial 390 with value: 16.963969438912468.
Trial 440 finished with value: 124.3147106997231 and parameters: {'input_dropout': 0.1, 'hidden_layers': 6, 'hidden_units': 128, 'kernel_initializer': 'random_normal', 'hidden_activation': 'leaky_relu', 'hidden_dropout': 0.1, 'batch_norm': 'off', 'optimizer_type': 'adam', 'optimizer_lr': 0.003940670322430688, 'batch_size': 32}. Best is trial 390 with value: 16.963969438912468.
Trial 441 finished with value: 589.4594603039355 and parameters: {'input_dropout': 0.2, 'hidden_layers': 6, 'hidden_units': 96, 'kernel_initializer': 'he_uniform', 'hidden_activation': 'leaky_relu', 'hidden_dropout': 0.05, 'batch_norm': 'off', 'optimizer_type': 'adam', 'optimizer_lr': 0.0001751121801989582, 'batch_size': 96}. Best is trial 390 with value: 16.963969438912468.
Trial 442 finished with value: 230.7193679460939 and parameters: {'input_dropout': 0.05, 'hidden_layers': 9, 'hidden_units': 160, 'kernel_initializer': 'random_normal', 'hidden_activation': 'leaky_relu', 'hidden_dropout': 0.2, 'batch_norm': 'off', 'optimizer_type': 'rmsprop', 'optimizer_lr': 0.00022217714335914234, 'batch_size': 128}. Best is trial 390 with value: 16.963969438912468.
Trial 443 finished with value: 114.93345489286216 and parameters: {'input_dropout': 0.1, 'hidden_layers': 4, 'hidden_units': 192, 'kernel_initializer': 'he_normal', 'hidden_activation': 'relu', 'hidden_dropout': 0.05, 'batch_norm': 'off', 'optimizer_type': 'rmsprop', 'optimizer_lr': 0.0005219150983169031, 'batch_size': 32}. Best is trial 390 with value: 16.963969438912468.
Trial 444 finished with value: 8889.305390503996 and parameters: {'input_dropout': 0.05, 'hidden_layers': 5, 'hidden_units': 32, 'kernel_initializer': 'he_normal', 'hidden_activation': 'relu', 'hidden_dropout': 0.3, 'batch_norm': 'on', 'optimizer_type': 'adam', 'optimizer_lr': 0.0019953793430938192, 'batch_size': 128}. Best is trial 390 with value: 16.963969438912468.
Trial 445 finished with value: 16825.06016018503 and parameters: {'input_dropout': 0.05, 'hidden_layers': 10, 'hidden_units': 32, 'kernel_initializer': 'random_normal', 'hidden_activation': 'leaky_relu', 'hidden_dropout': 0.1, 'batch_norm': 'on', 'optimizer_type': 'rmsprop', 'optimizer_lr': 0.0006297860646097092, 'batch_size': 128}. Best is trial 390 with value: 16.963969438912468.
Trial 446 finished with value: 5513.653732041753 and parameters: {'input_dropout': 0.0, 'hidden_layers': 9, 'hidden_units': 96, 'kernel_initializer': 'he_normal', 'hidden_activation': 'prelu', 'hidden_dropout': 0.15000000000000002, 'batch_norm': 'on', 'optimizer_type': 'adam', 'optimizer_lr': 0.00014799141933871318, 'batch_size': 32}. Best is trial 390 with value: 16.963969438912468.
Trial 447 finished with value: 147.53959675395637 and parameters: {'input_dropout': 0.1, 'hidden_layers': 3, 'hidden_units': 160, 'kernel_initializer': 'he_normal', 'hidden_activation': 'leaky_relu', 'hidden_dropout': 0.1, 'batch_norm': 'off', 'optimizer_type': 'rmsprop', 'optimizer_lr': 0.0005710001375326889, 'batch_size': 64}. Best is trial 390 with value: 16.963969438912468.
Trial 448 finished with value: 244.79230102186625 and parameters: {'input_dropout': 0.2, 'hidden_layers': 4, 'hidden_units': 128, 'kernel_initializer': 'random_normal', 'hidden_activation': 'leaky_relu', 'hidden_dropout': 0.25, 'batch_norm': 'off', 'optimizer_type': 'adam', 'optimizer_lr': 0.0002487021445445191, 'batch_size': 64}. Best is trial 390 with value: 16.963969438912468.
Trial 449 finished with value: 223.0880482488344 and parameters: {'input_dropout': 0.0, 'hidden_layers': 4, 'hidden_units': 192, 'kernel_initializer': 'random_normal', 'hidden_activation': 'relu', 'hidden_dropout': 0.05, 'batch_norm': 'off', 'optimizer_type': 'rmsprop', 'optimizer_lr': 0.0047046561047474275, 'batch_size': 96}. Best is trial 390 with value: 16.963969438912468.
Trial 450 finished with value: 216.5549218075133 and parameters: {'input_dropout': 0.1, 'hidden_layers': 9, 'hidden_units': 64, 'kernel_initializer': 'random_normal', 'hidden_activation': 'relu', 'hidden_dropout': 0.25, 'batch_norm': 'off', 'optimizer_type': 'adam', 'optimizer_lr': 0.000267576496610055, 'batch_size': 32}. Best is trial 390 with value: 16.963969438912468.
Trial 451 finished with value: 274.32138797023845 and parameters: {'input_dropout': 0.05, 'hidden_layers': 8, 'hidden_units': 64, 'kernel_initializer': 'he_uniform', 'hidden_activation': 'leaky_relu', 'hidden_dropout': 0.3, 'batch_norm': 'on', 'optimizer_type': 'rmsprop', 'optimizer_lr': 0.007256324803220098, 'batch_size': 128}. Best is trial 390 with value: 16.963969438912468.
Trial 452 finished with value: 183.7048680861635 and parameters: {'input_dropout': 0.2, 'hidden_layers': 8, 'hidden_units': 224, 'kernel_initializer': 'random_normal', 'hidden_activation': 'relu', 'hidden_dropout': 0.15000000000000002, 'batch_norm': 'off', 'optimizer_type': 'rmsprop', 'optimizer_lr': 0.002781644425039491, 'batch_size': 64}. Best is trial 390 with value: 16.963969438912468.
Trial 453 finished with value: 166.04189380213487 and parameters: {'input_dropout': 0.15000000000000002, 'hidden_layers': 9, 'hidden_units': 96, 'kernel_initializer': 'random_normal', 'hidden_activation': 'leaky_relu', 'hidden_dropout': 0.05, 'batch_norm': 'on', 'optimizer_type': 'adam', 'optimizer_lr': 0.0025438193226545737, 'batch_size': 96}. Best is trial 390 with value: 16.963969438912468.
Trial 454 finished with value: 224.10412591213176 and parameters: {'input_dropout': 0.15000000000000002, 'hidden_layers': 8, 'hidden_units': 224, 'kernel_initializer': 'he_uniform', 'hidden_activation': 'relu', 'hidden_dropout': 0.05, 'batch_norm': 'off', 'optimizer_type': 'adam', 'optimizer_lr': 0.0009530448354431947, 'batch_size': 64}. Best is trial 390 with value: 16.963969438912468.
Trial 455 finished with value: 36.753440975597975 and parameters: {'input_dropout': 0.05, 'hidden_layers': 7, 'hidden_units': 128, 'kernel_initializer': 'he_normal', 'hidden_activation': 'relu', 'hidden_dropout': 0.0, 'batch_norm': 'on', 'optimizer_type': 'rmsprop', 'optimizer_lr': 0.005427821865714641, 'batch_size': 64}. Best is trial 390 with value: 16.963969438912468.
Trial 456 finished with value: 71.55740697714529 and parameters: {'input_dropout': 0.0, 'hidden_layers': 3, 'hidden_units': 224, 'kernel_initializer': 'he_uniform', 'hidden_activation': 'leaky_relu', 'hidden_dropout': 0.1, 'batch_norm': 'on', 'optimizer_type': 'adam', 'optimizer_lr': 0.001018826513263608, 'batch_size': 64}. Best is trial 390 with value: 16.963969438912468.
Trial 457 finished with value: 10730.927729535055 and parameters: {'input_dropout': 0.05, 'hidden_layers': 6, 'hidden_units': 96, 'kernel_initializer': 'he_uniform', 'hidden_activation': 'leaky_relu', 'hidden_dropout': 0.05, 'batch_norm': 'on', 'optimizer_type': 'rmsprop', 'optimizer_lr': 0.0006462160895669766, 'batch_size': 128}. Best is trial 390 with value: 16.963969438912468.
