Trial 686 finished with value: 9469.137874396558 and parameters: {'input_dropout': 0.05, 'hidden_layers': 5, 'hidden_units': 64, 'kernel_initializer': 'he_normal', 'hidden_activation': 'relu', 'hidden_dropout': 0.0, 'batch_norm': 'on', 'optimizer_type': 'rmsprop', 'optimizer_lr': 0.00037691339006993766, 'batch_size': 64}. Best is trial 390 with value: 16.963969438912468.
Trial 687 finished with value: 96.32855669145677 and parameters: {'input_dropout': 0.05, 'hidden_layers': 4, 'hidden_units': 256, 'kernel_initializer': 'he_normal', 'hidden_activation': 'leaky_relu', 'hidden_dropout': 0.25, 'batch_norm': 'on', 'optimizer_type': 'rmsprop', 'optimizer_lr': 0.0015845045179585368, 'batch_size': 96}. Best is trial 390 with value: 16.963969438912468.
Trial 688 finished with value: 21594.795712057596 and parameters: {'input_dropout': 0.1, 'hidden_layers': 8, 'hidden_units': 32, 'kernel_initializer': 'he_uniform', 'hidden_activation': 'leaky_relu', 'hidden_dropout': 0.2, 'batch_norm': 'on', 'optimizer_type': 'rmsprop', 'optimizer_lr': 0.00027158918154265285, 'batch_size': 128}. Best is trial 390 with value: 16.963969438912468.
Trial 689 finished with value: 5589.968603816016 and parameters: {'input_dropout': 0.0, 'hidden_layers': 5, 'hidden_units': 32, 'kernel_initializer': 'he_uniform', 'hidden_activation': 'prelu', 'hidden_dropout': 0.25, 'batch_norm': 'on', 'optimizer_type': 'rmsprop', 'optimizer_lr': 0.0005076274797039397, 'batch_size': 64}. Best is trial 390 with value: 16.963969438912468.
Trial 690 finished with value: 70.14714100482105 and parameters: {'input_dropout': 0.0, 'hidden_layers': 4, 'hidden_units': 64, 'kernel_initializer': 'random_normal', 'hidden_activation': 'relu', 'hidden_dropout': 0.05, 'batch_norm': 'on', 'optimizer_type': 'adam', 'optimizer_lr': 0.0025373088365618184, 'batch_size': 32}. Best is trial 390 with value: 16.963969438912468.
Trial 691 finished with value: 129.76270713754695 and parameters: {'input_dropout': 0.05, 'hidden_layers': 3, 'hidden_units': 160, 'kernel_initializer': 'he_uniform', 'hidden_activation': 'leaky_relu', 'hidden_dropout': 0.3, 'batch_norm': 'off', 'optimizer_type': 'adam', 'optimizer_lr': 0.006571533768207528, 'batch_size': 32}. Best is trial 390 with value: 16.963969438912468.
Trial 692 finished with value: 1115.441535762966 and parameters: {'input_dropout': 0.2, 'hidden_layers': 7, 'hidden_units': 64, 'kernel_initializer': 'he_normal', 'hidden_activation': 'prelu', 'hidden_dropout': 0.15000000000000002, 'batch_norm': 'off', 'optimizer_type': 'adam', 'optimizer_lr': 0.0003001744498194758, 'batch_size': 64}. Best is trial 390 with value: 16.963969438912468.
Trial 693 finished with value: 5400.588115998898 and parameters: {'input_dropout': 0.2, 'hidden_layers': 10, 'hidden_units': 96, 'kernel_initializer': 'he_uniform', 'hidden_activation': 'leaky_relu', 'hidden_dropout': 0.25, 'batch_norm': 'off', 'optimizer_type': 'rmsprop', 'optimizer_lr': 0.0008630250990492809, 'batch_size': 96}. Best is trial 390 with value: 16.963969438912468.
Trial 694 finished with value: 520.7321230492298 and parameters: {'input_dropout': 0.1, 'hidden_layers': 9, 'hidden_units': 256, 'kernel_initializer': 'he_uniform', 'hidden_activation': 'prelu', 'hidden_dropout': 0.15000000000000002, 'batch_norm': 'off', 'optimizer_type': 'rmsprop', 'optimizer_lr': 0.0009714551431478027, 'batch_size': 32}. Best is trial 390 with value: 16.963969438912468.
Trial 695 finished with value: 3247.9201117197076 and parameters: {'input_dropout': 0.1, 'hidden_layers': 9, 'hidden_units': 96, 'kernel_initializer': 'he_uniform', 'hidden_activation': 'relu', 'hidden_dropout': 0.3, 'batch_norm': 'off', 'optimizer_type': 'adam', 'optimizer_lr': 0.0037883755024348464, 'batch_size': 64}. Best is trial 390 with value: 16.963969438912468.
Trial 696 finished with value: 121.03088102210008 and parameters: {'input_dropout': 0.0, 'hidden_layers': 3, 'hidden_units': 128, 'kernel_initializer': 'he_uniform', 'hidden_activation': 'prelu', 'hidden_dropout': 0.15000000000000002, 'batch_norm': 'off', 'optimizer_type': 'adam', 'optimizer_lr': 0.0010301612165322977, 'batch_size': 128}. Best is trial 390 with value: 16.963969438912468.
Trial 697 finished with value: 129.16764584425272 and parameters: {'input_dropout': 0.1, 'hidden_layers': 4, 'hidden_units': 128, 'kernel_initializer': 'random_normal', 'hidden_activation': 'relu', 'hidden_dropout': 0.05, 'batch_norm': 'off', 'optimizer_type': 'rmsprop', 'optimizer_lr': 0.002890825018956752, 'batch_size': 96}. Best is trial 390 with value: 16.963969438912468.
Trial 698 finished with value: 263.7570512506072 and parameters: {'input_dropout': 0.15000000000000002, 'hidden_layers': 8, 'hidden_units': 64, 'kernel_initializer': 'he_normal', 'hidden_activation': 'leaky_relu', 'hidden_dropout': 0.3, 'batch_norm': 'on', 'optimizer_type': 'adam', 'optimizer_lr': 0.008285398761549526, 'batch_size': 96}. Best is trial 390 with value: 16.963969438912468.
Trial 699 finished with value: 165.60509848609593 and parameters: {'input_dropout': 0.05, 'hidden_layers': 7, 'hidden_units': 160, 'kernel_initializer': 'random_normal', 'hidden_activation': 'prelu', 'hidden_dropout': 0.25, 'batch_norm': 'on', 'optimizer_type': 'rmsprop', 'optimizer_lr': 0.0009820933696659826, 'batch_size': 64}. Best is trial 390 with value: 16.963969438912468.
Trial 700 finished with value: 640.805927290271 and parameters: {'input_dropout': 0.2, 'hidden_layers': 6, 'hidden_units': 32, 'kernel_initializer': 'he_normal', 'hidden_activation': 'prelu', 'hidden_dropout': 0.1, 'batch_norm': 'off', 'optimizer_type': 'adam', 'optimizer_lr': 0.007088130148771345, 'batch_size': 64}. Best is trial 390 with value: 16.963969438912468.
Trial 701 finished with value: 20552.30600380445 and parameters: {'input_dropout': 0.05, 'hidden_layers': 6, 'hidden_units': 96, 'kernel_initializer': 'he_uniform', 'hidden_activation': 'relu', 'hidden_dropout': 0.2, 'batch_norm': 'on', 'optimizer_type': 'rmsprop', 'optimizer_lr': 0.00010184484080944069, 'batch_size': 96}. Best is trial 390 with value: 16.963969438912468.
Trial 702 finished with value: 177.55701685019457 and parameters: {'input_dropout': 0.2, 'hidden_layers': 4, 'hidden_units': 128, 'kernel_initializer': 'random_normal', 'hidden_activation': 'relu', 'hidden_dropout': 0.25, 'batch_norm': 'off', 'optimizer_type': 'rmsprop', 'optimizer_lr': 0.005198805771438043, 'batch_size': 96}. Best is trial 390 with value: 16.963969438912468.
Trial 703 finished with value: 465.58103501158104 and parameters: {'input_dropout': 0.0, 'hidden_layers': 8, 'hidden_units': 256, 'kernel_initializer': 'he_normal', 'hidden_activation': 'leaky_relu', 'hidden_dropout': 0.2, 'batch_norm': 'off', 'optimizer_type': 'adam', 'optimizer_lr': 0.0005242419390480962, 'batch_size': 128}. Best is trial 390 with value: 16.963969438912468.
Trial 704 finished with value: 150.70714767026405 and parameters: {'input_dropout': 0.15000000000000002, 'hidden_layers': 4, 'hidden_units': 192, 'kernel_initializer': 'random_normal', 'hidden_activation': 'relu', 'hidden_dropout': 0.25, 'batch_norm': 'on', 'optimizer_type': 'rmsprop', 'optimizer_lr': 0.00857476681612012, 'batch_size': 32}. Best is trial 390 with value: 16.963969438912468.
Trial 705 finished with value: 7173.210646826137 and parameters: {'input_dropout': 0.0, 'hidden_layers': 9, 'hidden_units': 128, 'kernel_initializer': 'he_normal', 'hidden_activation': 'relu', 'hidden_dropout': 0.1, 'batch_norm': 'on', 'optimizer_type': 'rmsprop', 'optimizer_lr': 0.0009431434161748429, 'batch_size': 128}. Best is trial 390 with value: 16.963969438912468.
Trial 706 finished with value: 229.51411613625638 and parameters: {'input_dropout': 0.2, 'hidden_layers': 9, 'hidden_units': 256, 'kernel_initializer': 'random_normal', 'hidden_activation': 'prelu', 'hidden_dropout': 0.3, 'batch_norm': 'off', 'optimizer_type': 'rmsprop', 'optimizer_lr': 0.0038836215217465057, 'batch_size': 128}. Best is trial 390 with value: 16.963969438912468.
Trial 707 finished with value: 199.81108428276283 and parameters: {'input_dropout': 0.15000000000000002, 'hidden_layers': 8, 'hidden_units': 256, 'kernel_initializer': 'he_uniform', 'hidden_activation': 'relu', 'hidden_dropout': 0.3, 'batch_norm': 'on', 'optimizer_type': 'rmsprop', 'optimizer_lr': 0.0010469436154914187, 'batch_size': 96}. Best is trial 390 with value: 16.963969438912468.
Trial 708 finished with value: 166.59478821638527 and parameters: {'input_dropout': 0.2, 'hidden_layers': 6, 'hidden_units': 160, 'kernel_initializer': 'random_normal', 'hidden_activation': 'relu', 'hidden_dropout': 0.05, 'batch_norm': 'off', 'optimizer_type': 'adam', 'optimizer_lr': 0.004751083098104335, 'batch_size': 96}. Best is trial 390 with value: 16.963969438912468.
Trial 709 finished with value: 328.9730069437558 and parameters: {'input_dropout': 0.0, 'hidden_layers': 7, 'hidden_units': 224, 'kernel_initializer': 'he_normal', 'hidden_activation': 'prelu', 'hidden_dropout': 0.15000000000000002, 'batch_norm': 'off', 'optimizer_type': 'adam', 'optimizer_lr': 0.001979952871796109, 'batch_size': 128}. Best is trial 390 with value: 16.963969438912468.
Trial 710 finished with value: 142.55166841258813 and parameters: {'input_dropout': 0.1, 'hidden_layers': 6, 'hidden_units': 160, 'kernel_initializer': 'random_normal', 'hidden_activation': 'prelu', 'hidden_dropout': 0.2, 'batch_norm': 'off', 'optimizer_type': 'adam', 'optimizer_lr': 0.00046146948823308487, 'batch_size': 96}. Best is trial 390 with value: 16.963969438912468.
Trial 711 finished with value: 176.1012537710584 and parameters: {'input_dropout': 0.15000000000000002, 'hidden_layers': 3, 'hidden_units': 96, 'kernel_initializer': 'random_normal', 'hidden_activation': 'prelu', 'hidden_dropout': 0.3, 'batch_norm': 'on', 'optimizer_type': 'rmsprop', 'optimizer_lr': 0.0008600568670311688, 'batch_size': 64}. Best is trial 390 with value: 16.963969438912468.
Trial 712 finished with value: 126.06770834920017 and parameters: {'input_dropout': 0.1, 'hidden_layers': 3, 'hidden_units': 160, 'kernel_initializer': 'he_uniform', 'hidden_activation': 'leaky_relu', 'hidden_dropout': 0.15000000000000002, 'batch_norm': 'on', 'optimizer_type': 'rmsprop', 'optimizer_lr': 0.0019225338225748523, 'batch_size': 96}. Best is trial 390 with value: 16.963969438912468.
Trial 713 finished with value: 370.83157360558914 and parameters: {'input_dropout': 0.15000000000000002, 'hidden_layers': 10, 'hidden_units': 64, 'kernel_initializer': 'he_normal', 'hidden_activation': 'leaky_relu', 'hidden_dropout': 0.3, 'batch_norm': 'off', 'optimizer_type': 'adam', 'optimizer_lr': 0.008993880912121168, 'batch_size': 64}. Best is trial 390 with value: 16.963969438912468.
Trial 714 finished with value: 114.11179559240159 and parameters: {'input_dropout': 0.0, 'hidden_layers': 5, 'hidden_units': 256, 'kernel_initializer': 'random_normal', 'hidden_activation': 'relu', 'hidden_dropout': 0.3, 'batch_norm': 'off', 'optimizer_type': 'adam', 'optimizer_lr': 0.004084218506338717, 'batch_size': 96}. Best is trial 390 with value: 16.963969438912468.
Trial 715 finished with value: 18338.837567086735 and parameters: {'input_dropout': 0.0, 'hidden_layers': 8, 'hidden_units': 32, 'kernel_initializer': 'he_uniform', 'hidden_activation': 'leaky_relu', 'hidden_dropout': 0.2, 'batch_norm': 'on', 'optimizer_type': 'rmsprop', 'optimizer_lr': 0.0001936949256783545, 'batch_size': 32}. Best is trial 390 with value: 16.963969438912468.
Trial 716 finished with value: 75.77895154009602 and parameters: {'input_dropout': 0.05, 'hidden_layers': 4, 'hidden_units': 224, 'kernel_initializer': 'he_uniform', 'hidden_activation': 'leaky_relu', 'hidden_dropout': 0.0, 'batch_norm': 'off', 'optimizer_type': 'adam', 'optimizer_lr': 0.002308505861497675, 'batch_size': 96}. Best is trial 390 with value: 16.963969438912468.
Trial 717 finished with value: 4202.347284512812 and parameters: {'input_dropout': 0.0, 'hidden_layers': 10, 'hidden_units': 96, 'kernel_initializer': 'he_normal', 'hidden_activation': 'relu', 'hidden_dropout': 0.3, 'batch_norm': 'on', 'optimizer_type': 'rmsprop', 'optimizer_lr': 0.0017802167333491497, 'batch_size': 64}. Best is trial 390 with value: 16.963969438912468.
Trial 718 finished with value: 1619.9436228674658 and parameters: {'input_dropout': 0.2, 'hidden_layers': 8, 'hidden_units': 256, 'kernel_initializer': 'he_normal', 'hidden_activation': 'prelu', 'hidden_dropout': 0.2, 'batch_norm': 'off', 'optimizer_type': 'adam', 'optimizer_lr': 0.0001281456231317854, 'batch_size': 128}. Best is trial 390 with value: 16.963969438912468.
Trial 719 finished with value: 545.222071504089 and parameters: {'input_dropout': 0.1, 'hidden_layers': 9, 'hidden_units': 192, 'kernel_initializer': 'he_uniform', 'hidden_activation': 'relu', 'hidden_dropout': 0.1, 'batch_norm': 'off', 'optimizer_type': 'adam', 'optimizer_lr': 0.0001253638346021821, 'batch_size': 96}. Best is trial 390 with value: 16.963969438912468.
Trial 720 finished with value: 128.11825262070477 and parameters: {'input_dropout': 0.0, 'hidden_layers': 5, 'hidden_units': 256, 'kernel_initializer': 'random_normal', 'hidden_activation': 'relu', 'hidden_dropout': 0.2, 'batch_norm': 'off', 'optimizer_type': 'rmsprop', 'optimizer_lr': 0.0001526855000654725, 'batch_size': 128}. Best is trial 390 with value: 16.963969438912468.
Trial 721 finished with value: 69.33285937640811 and parameters: {'input_dropout': 0.0, 'hidden_layers': 3, 'hidden_units': 160, 'kernel_initializer': 'he_normal', 'hidden_activation': 'leaky_relu', 'hidden_dropout': 0.1, 'batch_norm': 'on', 'optimizer_type': 'rmsprop', 'optimizer_lr': 0.0013028486538562197, 'batch_size': 32}. Best is trial 390 with value: 16.963969438912468.
Trial 722 finished with value: 346.81984523618735 and parameters: {'input_dropout': 0.05, 'hidden_layers': 8, 'hidden_units': 64, 'kernel_initializer': 'he_normal', 'hidden_activation': 'leaky_relu', 'hidden_dropout': 0.1, 'batch_norm': 'off', 'optimizer_type': 'rmsprop', 'optimizer_lr': 0.002977962315127016, 'batch_size': 96}. Best is trial 390 with value: 16.963969438912468.
Trial 723 finished with value: 143.14595294910774 and parameters: {'input_dropout': 0.1, 'hidden_layers': 4, 'hidden_units': 128, 'kernel_initializer': 'he_uniform', 'hidden_activation': 'leaky_relu', 'hidden_dropout': 0.0, 'batch_norm': 'off', 'optimizer_type': 'adam', 'optimizer_lr': 0.0011341171097203743, 'batch_size': 96}. Best is trial 390 with value: 16.963969438912468.
Trial 724 finished with value: 1644.7674977467827 and parameters: {'input_dropout': 0.0, 'hidden_layers': 8, 'hidden_units': 128, 'kernel_initializer': 'he_normal', 'hidden_activation': 'prelu', 'hidden_dropout': 0.25, 'batch_norm': 'off', 'optimizer_type': 'adam', 'optimizer_lr': 0.0001442638137725154, 'batch_size': 32}. Best is trial 390 with value: 16.963969438912468.
Trial 725 finished with value: 87.78541240175892 and parameters: {'input_dropout': 0.0, 'hidden_layers': 6, 'hidden_units': 32, 'kernel_initializer': 'random_normal', 'hidden_activation': 'prelu', 'hidden_dropout': 0.0, 'batch_norm': 'off', 'optimizer_type': 'adam', 'optimizer_lr': 0.006368563486831189, 'batch_size': 128}. Best is trial 390 with value: 16.963969438912468.
Trial 726 finished with value: 290.73812302792174 and parameters: {'input_dropout': 0.2, 'hidden_layers': 4, 'hidden_units': 192, 'kernel_initializer': 'random_normal', 'hidden_activation': 'leaky_relu', 'hidden_dropout': 0.25, 'batch_norm': 'on', 'optimizer_type': 'adam', 'optimizer_lr': 0.0005332208796056899, 'batch_size': 96}. Best is trial 390 with value: 16.963969438912468.
Trial 727 finished with value: 183.68222943453108 and parameters: {'input_dropout': 0.05, 'hidden_layers': 8, 'hidden_units': 96, 'kernel_initializer': 'he_normal', 'hidden_activation': 'leaky_relu', 'hidden_dropout': 0.2, 'batch_norm': 'on', 'optimizer_type': 'adam', 'optimizer_lr': 0.002484883411894085, 'batch_size': 128}. Best is trial 390 with value: 16.963969438912468.
Trial 728 finished with value: 141.8056218946939 and parameters: {'input_dropout': 0.0, 'hidden_layers': 8, 'hidden_units': 256, 'kernel_initializer': 'random_normal', 'hidden_activation': 'relu', 'hidden_dropout': 0.25, 'batch_norm': 'on', 'optimizer_type': 'adam', 'optimizer_lr': 0.0010913485670449718, 'batch_size': 32}. Best is trial 390 with value: 16.963969438912468.
Trial 729 finished with value: 3028.1185456553862 and parameters: {'input_dropout': 0.1, 'hidden_layers': 8, 'hidden_units': 256, 'kernel_initializer': 'he_normal', 'hidden_activation': 'relu', 'hidden_dropout': 0.3, 'batch_norm': 'off', 'optimizer_type': 'adam', 'optimizer_lr': 0.0013559818365190706, 'batch_size': 32}. Best is trial 390 with value: 16.963969438912468.
Trial 730 finished with value: 236.14544361262963 and parameters: {'input_dropout': 0.1, 'hidden_layers': 9, 'hidden_units': 32, 'kernel_initializer': 'he_normal', 'hidden_activation': 'prelu', 'hidden_dropout': 0.05, 'batch_norm': 'on', 'optimizer_type': 'adam', 'optimizer_lr': 0.0008557835892655101, 'batch_size': 64}. Best is trial 390 with value: 16.963969438912468.
Trial 731 finished with value: 477.60751920296104 and parameters: {'input_dropout': 0.0, 'hidden_layers': 9, 'hidden_units': 256, 'kernel_initializer': 'he_uniform', 'hidden_activation': 'prelu', 'hidden_dropout': 0.15000000000000002, 'batch_norm': 'on', 'optimizer_type': 'rmsprop', 'optimizer_lr': 0.006460894740458991, 'batch_size': 128}. Best is trial 390 with value: 16.963969438912468.
Trial 732 finished with value: 187.76647893585204 and parameters: {'input_dropout': 0.2, 'hidden_layers': 5, 'hidden_units': 128, 'kernel_initializer': 'random_normal', 'hidden_activation': 'prelu', 'hidden_dropout': 0.3, 'batch_norm': 'off', 'optimizer_type': 'rmsprop', 'optimizer_lr': 0.000494907975821631, 'batch_size': 96}. Best is trial 390 with value: 16.963969438912468.
Trial 733 finished with value: 368.5904753675151 and parameters: {'input_dropout': 0.0, 'hidden_layers': 8, 'hidden_units': 224, 'kernel_initializer': 'he_uniform', 'hidden_activation': 'relu', 'hidden_dropout': 0.15000000000000002, 'batch_norm': 'off', 'optimizer_type': 'adam', 'optimizer_lr': 0.0023648911449817337, 'batch_size': 64}. Best is trial 390 with value: 16.963969438912468.
Trial 734 finished with value: 4732.293743734944 and parameters: {'input_dropout': 0.2, 'hidden_layers': 9, 'hidden_units': 128, 'kernel_initializer': 'he_normal', 'hidden_activation': 'relu', 'hidden_dropout': 0.0, 'batch_norm': 'on', 'optimizer_type': 'rmsprop', 'optimizer_lr': 0.00032488745936758514, 'batch_size': 64}. Best is trial 390 with value: 16.963969438912468.
Trial 735 finished with value: 2348.941007451986 and parameters: {'input_dropout': 0.15000000000000002, 'hidden_layers': 8, 'hidden_units': 192, 'kernel_initializer': 'he_uniform', 'hidden_activation': 'prelu', 'hidden_dropout': 0.25, 'batch_norm': 'off', 'optimizer_type': 'adam', 'optimizer_lr': 0.000747808672579365, 'batch_size': 32}. Best is trial 390 with value: 16.963969438912468.
Trial 736 finished with value: 347.71637514046057 and parameters: {'input_dropout': 0.0, 'hidden_layers': 8, 'hidden_units': 128, 'kernel_initializer': 'he_normal', 'hidden_activation': 'leaky_relu', 'hidden_dropout': 0.1, 'batch_norm': 'off', 'optimizer_type': 'adam', 'optimizer_lr': 0.0009432152792487333, 'batch_size': 96}. Best is trial 390 with value: 16.963969438912468.
Trial 737 finished with value: 108.43598803695244 and parameters: {'input_dropout': 0.0, 'hidden_layers': 8, 'hidden_units': 224, 'kernel_initializer': 'he_uniform', 'hidden_activation': 'leaky_relu', 'hidden_dropout': 0.05, 'batch_norm': 'off', 'optimizer_type': 'rmsprop', 'optimizer_lr': 0.0026601228355540444, 'batch_size': 32}. Best is trial 390 with value: 16.963969438912468.
Trial 738 finished with value: 21817.51430273367 and parameters: {'input_dropout': 0.2, 'hidden_layers': 8, 'hidden_units': 64, 'kernel_initializer': 'he_uniform', 'hidden_activation': 'leaky_relu', 'hidden_dropout': 0.15000000000000002, 'batch_norm': 'on', 'optimizer_type': 'adam', 'optimizer_lr': 0.00013303576191296638, 'batch_size': 128}. Best is trial 390 with value: 16.963969438912468.
Trial 739 finished with value: 179.4910890687993 and parameters: {'input_dropout': 0.15000000000000002, 'hidden_layers': 4, 'hidden_units': 96, 'kernel_initializer': 'he_normal', 'hidden_activation': 'prelu', 'hidden_dropout': 0.05, 'batch_norm': 'off', 'optimizer_type': 'adam', 'optimizer_lr': 0.004889933146332533, 'batch_size': 64}. Best is trial 390 with value: 16.963969438912468.
Trial 740 finished with value: 538.0994472542455 and parameters: {'input_dropout': 0.0, 'hidden_layers': 7, 'hidden_units': 128, 'kernel_initializer': 'he_uniform', 'hidden_activation': 'leaky_relu', 'hidden_dropout': 0.25, 'batch_norm': 'off', 'optimizer_type': 'rmsprop', 'optimizer_lr': 0.0016728466247028834, 'batch_size': 128}. Best is trial 390 with value: 16.963969438912468.
Trial 741 finished with value: 133.5646707599115 and parameters: {'input_dropout': 0.2, 'hidden_layers': 5, 'hidden_units': 64, 'kernel_initializer': 'random_normal', 'hidden_activation': 'prelu', 'hidden_dropout': 0.0, 'batch_norm': 'off', 'optimizer_type': 'rmsprop', 'optimizer_lr': 0.0022153069606052588, 'batch_size': 32}. Best is trial 390 with value: 16.963969438912468.
Trial 742 finished with value: 132.62390510338818 and parameters: {'input_dropout': 0.05, 'hidden_layers': 4, 'hidden_units': 160, 'kernel_initializer': 'he_normal', 'hidden_activation': 'leaky_relu', 'hidden_dropout': 0.1, 'batch_norm': 'off', 'optimizer_type': 'rmsprop', 'optimizer_lr': 0.0007602398617863106, 'batch_size': 96}. Best is trial 390 with value: 16.963969438912468.
