Trial 115 finished with value: 258.20169908359134 and parameters: {'input_dropout': 0.2, 'hidden_layers': 3, 'hidden_units': 224, 'kernel_initializer': 'he_normal', 'hidden_activation': 'prelu', 'hidden_dropout': 0.05, 'batch_norm': 'off', 'optimizer_type': 'rmsprop', 'optimizer_lr': 0.00022750171498963435, 'batch_size': 96}. Best is trial 26 with value: 21.03031085049643.
Trial 116 finished with value: 249.4712466087492 and parameters: {'input_dropout': 0.15000000000000002, 'hidden_layers': 4, 'hidden_units': 32, 'kernel_initializer': 'he_uniform', 'hidden_activation': 'leaky_relu', 'hidden_dropout': 0.3, 'batch_norm': 'on', 'optimizer_type': 'adam', 'optimizer_lr': 0.0058712063981412625, 'batch_size': 64}. Best is trial 26 with value: 21.03031085049643.
Trial 117 finished with value: 3428.5044224620124 and parameters: {'input_dropout': 0.0, 'hidden_layers': 9, 'hidden_units': 192, 'kernel_initializer': 'he_normal', 'hidden_activation': 'leaky_relu', 'hidden_dropout': 0.3, 'batch_norm': 'off', 'optimizer_type': 'adam', 'optimizer_lr': 0.0032534195365664068, 'batch_size': 96}. Best is trial 26 with value: 21.03031085049643.
Trial 118 finished with value: 489.1267412140435 and parameters: {'input_dropout': 0.1, 'hidden_layers': 5, 'hidden_units': 128, 'kernel_initializer': 'he_uniform', 'hidden_activation': 'prelu', 'hidden_dropout': 0.25, 'batch_norm': 'off', 'optimizer_type': 'rmsprop', 'optimizer_lr': 0.00020233021489248745, 'batch_size': 128}. Best is trial 26 with value: 21.03031085049643.
Trial 119 finished with value: 17771.141468176487 and parameters: {'input_dropout': 0.1, 'hidden_layers': 10, 'hidden_units': 64, 'kernel_initializer': 'he_uniform', 'hidden_activation': 'prelu', 'hidden_dropout': 0.05, 'batch_norm': 'on', 'optimizer_type': 'adam', 'optimizer_lr': 0.00032118806358573415, 'batch_size': 128}. Best is trial 26 with value: 21.03031085049643.
Trial 120 finished with value: 4754.593442342971 and parameters: {'input_dropout': 0.2, 'hidden_layers': 9, 'hidden_units': 128, 'kernel_initializer': 'he_normal', 'hidden_activation': 'relu', 'hidden_dropout': 0.3, 'batch_norm': 'off', 'optimizer_type': 'rmsprop', 'optimizer_lr': 0.000880881433874151, 'batch_size': 96}. Best is trial 26 with value: 21.03031085049643.
Trial 121 finished with value: 136.18214074027577 and parameters: {'input_dropout': 0.05, 'hidden_layers': 7, 'hidden_units': 224, 'kernel_initializer': 'he_normal', 'hidden_activation': 'leaky_relu', 'hidden_dropout': 0.2, 'batch_norm': 'on', 'optimizer_type': 'adam', 'optimizer_lr': 0.0014349304882172013, 'batch_size': 64}. Best is trial 26 with value: 21.03031085049643.
Trial 122 finished with value: 2592.795580284778 and parameters: {'input_dropout': 0.1, 'hidden_layers': 7, 'hidden_units': 64, 'kernel_initializer': 'he_normal', 'hidden_activation': 'prelu', 'hidden_dropout': 0.25, 'batch_norm': 'off', 'optimizer_type': 'rmsprop', 'optimizer_lr': 0.00043426945208011297, 'batch_size': 128}. Best is trial 26 with value: 21.03031085049643.
Trial 123 finished with value: 292.6393637700346 and parameters: {'input_dropout': 0.0, 'hidden_layers': 3, 'hidden_units': 96, 'kernel_initializer': 'he_uniform', 'hidden_activation': 'prelu', 'hidden_dropout': 0.05, 'batch_norm': 'off', 'optimizer_type': 'adam', 'optimizer_lr': 0.00011315589803654432, 'batch_size': 96}. Best is trial 26 with value: 21.03031085049643.
Trial 124 finished with value: 176.45431855709396 and parameters: {'input_dropout': 0.05, 'hidden_layers': 10, 'hidden_units': 224, 'kernel_initializer': 'he_normal', 'hidden_activation': 'prelu', 'hidden_dropout': 0.1, 'batch_norm': 'on', 'optimizer_type': 'adam', 'optimizer_lr': 0.0005900901587028305, 'batch_size': 32}. Best is trial 26 with value: 21.03031085049643.
Trial 125 finished with value: 154.47369200328328 and parameters: {'input_dropout': 0.0, 'hidden_layers': 7, 'hidden_units': 160, 'kernel_initializer': 'random_normal', 'hidden_activation': 'prelu', 'hidden_dropout': 0.1, 'batch_norm': 'on', 'optimizer_type': 'rmsprop', 'optimizer_lr': 0.004939120969288232, 'batch_size': 64}. Best is trial 26 with value: 21.03031085049643.
Trial 126 finished with value: 22295.540309617227 and parameters: {'input_dropout': 0.2, 'hidden_layers': 7, 'hidden_units': 96, 'kernel_initializer': 'he_uniform', 'hidden_activation': 'prelu', 'hidden_dropout': 0.1, 'batch_norm': 'on', 'optimizer_type': 'adam', 'optimizer_lr': 0.00010356422691394019, 'batch_size': 128}. Best is trial 26 with value: 21.03031085049643.
Trial 127 finished with value: 160.9093382236596 and parameters: {'input_dropout': 0.15000000000000002, 'hidden_layers': 5, 'hidden_units': 160, 'kernel_initializer': 'he_uniform', 'hidden_activation': 'relu', 'hidden_dropout': 0.2, 'batch_norm': 'on', 'optimizer_type': 'rmsprop', 'optimizer_lr': 0.00184929948116434, 'batch_size': 32}. Best is trial 26 with value: 21.03031085049643.
Trial 128 finished with value: 129.84040721219438 and parameters: {'input_dropout': 0.05, 'hidden_layers': 7, 'hidden_units': 128, 'kernel_initializer': 'random_normal', 'hidden_activation': 'prelu', 'hidden_dropout': 0.0, 'batch_norm': 'on', 'optimizer_type': 'rmsprop', 'optimizer_lr': 0.004168433755399266, 'batch_size': 128}. Best is trial 26 with value: 21.03031085049643.
Trial 129 finished with value: 4699.458383161047 and parameters: {'input_dropout': 0.15000000000000002, 'hidden_layers': 10, 'hidden_units': 96, 'kernel_initializer': 'he_normal', 'hidden_activation': 'prelu', 'hidden_dropout': 0.25, 'batch_norm': 'off', 'optimizer_type': 'rmsprop', 'optimizer_lr': 0.003597315962427048, 'batch_size': 128}. Best is trial 26 with value: 21.03031085049643.
Trial 130 finished with value: 400.95567372891634 and parameters: {'input_dropout': 0.1, 'hidden_layers': 9, 'hidden_units': 256, 'kernel_initializer': 'he_uniform', 'hidden_activation': 'leaky_relu', 'hidden_dropout': 0.15000000000000002, 'batch_norm': 'off', 'optimizer_type': 'adam', 'optimizer_lr': 0.006582518140116671, 'batch_size': 64}. Best is trial 26 with value: 21.03031085049643.
Trial 131 finished with value: 5665.302025639815 and parameters: {'input_dropout': 0.2, 'hidden_layers': 9, 'hidden_units': 64, 'kernel_initializer': 'he_normal', 'hidden_activation': 'relu', 'hidden_dropout': 0.25, 'batch_norm': 'off', 'optimizer_type': 'adam', 'optimizer_lr': 0.00034106695106611774, 'batch_size': 32}. Best is trial 26 with value: 21.03031085049643.
Trial 132 finished with value: 145.63305235926632 and parameters: {'input_dropout': 0.0, 'hidden_layers': 6, 'hidden_units': 160, 'kernel_initializer': 'he_uniform', 'hidden_activation': 'leaky_relu', 'hidden_dropout': 0.15000000000000002, 'batch_norm': 'off', 'optimizer_type': 'rmsprop', 'optimizer_lr': 0.0017979897254768562, 'batch_size': 128}. Best is trial 26 with value: 21.03031085049643.
Trial 133 finished with value: 144.08727535121508 and parameters: {'input_dropout': 0.2, 'hidden_layers': 5, 'hidden_units': 192, 'kernel_initializer': 'he_normal', 'hidden_activation': 'relu', 'hidden_dropout': 0.05, 'batch_norm': 'on', 'optimizer_type': 'adam', 'optimizer_lr': 0.001756495825542208, 'batch_size': 96}. Best is trial 26 with value: 21.03031085049643.
Trial 134 finished with value: 104.19587322903122 and parameters: {'input_dropout': 0.2, 'hidden_layers': 4, 'hidden_units': 160, 'kernel_initializer': 'he_normal', 'hidden_activation': 'prelu', 'hidden_dropout': 0.0, 'batch_norm': 'on', 'optimizer_type': 'adam', 'optimizer_lr': 0.003762865534728595, 'batch_size': 96}. Best is trial 26 with value: 21.03031085049643.
Trial 135 finished with value: 160.4497288909185 and parameters: {'input_dropout': 0.2, 'hidden_layers': 9, 'hidden_units': 192, 'kernel_initializer': 'he_normal', 'hidden_activation': 'relu', 'hidden_dropout': 0.15000000000000002, 'batch_norm': 'on', 'optimizer_type': 'rmsprop', 'optimizer_lr': 0.0008580980916962352, 'batch_size': 32}. Best is trial 26 with value: 21.03031085049643.
Trial 136 finished with value: 213.86465881904363 and parameters: {'input_dropout': 0.15000000000000002, 'hidden_layers': 7, 'hidden_units': 160, 'kernel_initializer': 'he_normal', 'hidden_activation': 'prelu', 'hidden_dropout': 0.05, 'batch_norm': 'off', 'optimizer_type': 'rmsprop', 'optimizer_lr': 0.0001913457542128585, 'batch_size': 128}. Best is trial 26 with value: 21.03031085049643.
Trial 137 finished with value: 641.5099688569013 and parameters: {'input_dropout': 0.1, 'hidden_layers': 6, 'hidden_units': 64, 'kernel_initializer': 'he_uniform', 'hidden_activation': 'prelu', 'hidden_dropout': 0.2, 'batch_norm': 'off', 'optimizer_type': 'adam', 'optimizer_lr': 0.008741677779166119, 'batch_size': 64}. Best is trial 26 with value: 21.03031085049643.
Trial 138 finished with value: 134.35489634222122 and parameters: {'input_dropout': 0.0, 'hidden_layers': 4, 'hidden_units': 64, 'kernel_initializer': 'he_normal', 'hidden_activation': 'leaky_relu', 'hidden_dropout': 0.1, 'batch_norm': 'off', 'optimizer_type': 'rmsprop', 'optimizer_lr': 0.006129635261837654, 'batch_size': 96}. Best is trial 26 with value: 21.03031085049643.
Trial 139 finished with value: 168.1284351332555 and parameters: {'input_dropout': 0.1, 'hidden_layers': 3, 'hidden_units': 256, 'kernel_initializer': 'he_normal', 'hidden_activation': 'prelu', 'hidden_dropout': 0.3, 'batch_norm': 'off', 'optimizer_type': 'adam', 'optimizer_lr': 0.0024471561568902007, 'batch_size': 96}. Best is trial 26 with value: 21.03031085049643.
Trial 140 finished with value: 233.7570283435828 and parameters: {'input_dropout': 0.05, 'hidden_layers': 5, 'hidden_units': 64, 'kernel_initializer': 'he_uniform', 'hidden_activation': 'leaky_relu', 'hidden_dropout': 0.15000000000000002, 'batch_norm': 'off', 'optimizer_type': 'rmsprop', 'optimizer_lr': 0.0006443087261111418, 'batch_size': 64}. Best is trial 26 with value: 21.03031085049643.
Trial 141 finished with value: 16710.345842549577 and parameters: {'input_dropout': 0.05, 'hidden_layers': 9, 'hidden_units': 96, 'kernel_initializer': 'he_normal', 'hidden_activation': 'leaky_relu', 'hidden_dropout': 0.2, 'batch_norm': 'on', 'optimizer_type': 'adam', 'optimizer_lr': 0.0001274823872303719, 'batch_size': 64}. Best is trial 26 with value: 21.03031085049643.
Trial 142 finished with value: 158.8761470428155 and parameters: {'input_dropout': 0.05, 'hidden_layers': 6, 'hidden_units': 128, 'kernel_initializer': 'he_normal', 'hidden_activation': 'leaky_relu', 'hidden_dropout': 0.15000000000000002, 'batch_norm': 'off', 'optimizer_type': 'rmsprop', 'optimizer_lr': 0.002996267028096144, 'batch_size': 128}. Best is trial 26 with value: 21.03031085049643.
Trial 143 finished with value: 18384.43605420842 and parameters: {'input_dropout': 0.05, 'hidden_layers': 10, 'hidden_units': 96, 'kernel_initializer': 'he_normal', 'hidden_activation': 'prelu', 'hidden_dropout': 0.1, 'batch_norm': 'on', 'optimizer_type': 'adam', 'optimizer_lr': 0.00010177414946907112, 'batch_size': 64}. Best is trial 26 with value: 21.03031085049643.
Trial 144 finished with value: 178.58880698723897 and parameters: {'input_dropout': 0.1, 'hidden_layers': 5, 'hidden_units': 64, 'kernel_initializer': 'random_normal', 'hidden_activation': 'leaky_relu', 'hidden_dropout': 0.15000000000000002, 'batch_norm': 'on', 'optimizer_type': 'adam', 'optimizer_lr': 0.0007313226652098769, 'batch_size': 64}. Best is trial 26 with value: 21.03031085049643.
Trial 145 finished with value: 313.1108145586754 and parameters: {'input_dropout': 0.15000000000000002, 'hidden_layers': 5, 'hidden_units': 64, 'kernel_initializer': 'he_normal', 'hidden_activation': 'prelu', 'hidden_dropout': 0.1, 'batch_norm': 'off', 'optimizer_type': 'adam', 'optimizer_lr': 0.00011904306919078833, 'batch_size': 64}. Best is trial 26 with value: 21.03031085049643.
Trial 146 finished with value: 73.61441677388127 and parameters: {'input_dropout': 0.0, 'hidden_layers': 3, 'hidden_units': 224, 'kernel_initializer': 'random_normal', 'hidden_activation': 'prelu', 'hidden_dropout': 0.05, 'batch_norm': 'on', 'optimizer_type': 'rmsprop', 'optimizer_lr': 0.0012186448265369583, 'batch_size': 128}. Best is trial 26 with value: 21.03031085049643.
Trial 147 finished with value: 254.11974209519656 and parameters: {'input_dropout': 0.2, 'hidden_layers': 4, 'hidden_units': 64, 'kernel_initializer': 'random_normal', 'hidden_activation': 'leaky_relu', 'hidden_dropout': 0.25, 'batch_norm': 'off', 'optimizer_type': 'rmsprop', 'optimizer_lr': 0.0002313882358212215, 'batch_size': 32}. Best is trial 26 with value: 21.03031085049643.
Trial 148 finished with value: 147.70129034709814 and parameters: {'input_dropout': 0.15000000000000002, 'hidden_layers': 9, 'hidden_units': 256, 'kernel_initializer': 'random_normal', 'hidden_activation': 'relu', 'hidden_dropout': 0.0, 'batch_norm': 'off', 'optimizer_type': 'adam', 'optimizer_lr': 0.008193234613787426, 'batch_size': 64}. Best is trial 26 with value: 21.03031085049643.
Trial 149 finished with value: 174.76397069937298 and parameters: {'input_dropout': 0.0, 'hidden_layers': 9, 'hidden_units': 96, 'kernel_initializer': 'random_normal', 'hidden_activation': 'prelu', 'hidden_dropout': 0.2, 'batch_norm': 'off', 'optimizer_type': 'rmsprop', 'optimizer_lr': 0.002853543668958075, 'batch_size': 96}. Best is trial 26 with value: 21.03031085049643.
Trial 150 finished with value: 3361.778435773981 and parameters: {'input_dropout': 0.05, 'hidden_layers': 8, 'hidden_units': 128, 'kernel_initializer': 'he_uniform', 'hidden_activation': 'prelu', 'hidden_dropout': 0.3, 'batch_norm': 'off', 'optimizer_type': 'adam', 'optimizer_lr': 0.00011001991581827325, 'batch_size': 32}. Best is trial 26 with value: 21.03031085049643.
Trial 151 finished with value: 115.2628738346326 and parameters: {'input_dropout': 0.0, 'hidden_layers': 3, 'hidden_units': 192, 'kernel_initializer': 'random_normal', 'hidden_activation': 'relu', 'hidden_dropout': 0.25, 'batch_norm': 'on', 'optimizer_type': 'rmsprop', 'optimizer_lr': 0.003579038600972037, 'batch_size': 128}. Best is trial 26 with value: 21.03031085049643.
Trial 152 finished with value: 121.38412810331873 and parameters: {'input_dropout': 0.0, 'hidden_layers': 3, 'hidden_units': 96, 'kernel_initializer': 'he_uniform', 'hidden_activation': 'leaky_relu', 'hidden_dropout': 0.25, 'batch_norm': 'off', 'optimizer_type': 'adam', 'optimizer_lr': 0.004258864202163091, 'batch_size': 96}. Best is trial 26 with value: 21.03031085049643.
Trial 153 finished with value: 697.5227387407431 and parameters: {'input_dropout': 0.2, 'hidden_layers': 9, 'hidden_units': 160, 'kernel_initializer': 'he_normal', 'hidden_activation': 'leaky_relu', 'hidden_dropout': 0.1, 'batch_norm': 'off', 'optimizer_type': 'adam', 'optimizer_lr': 0.0003632112506605135, 'batch_size': 32}. Best is trial 26 with value: 21.03031085049643.
Trial 154 finished with value: 170.3024537148354 and parameters: {'input_dropout': 0.2, 'hidden_layers': 3, 'hidden_units': 96, 'kernel_initializer': 'he_normal', 'hidden_activation': 'prelu', 'hidden_dropout': 0.05, 'batch_norm': 'off', 'optimizer_type': 'rmsprop', 'optimizer_lr': 0.002114908098625526, 'batch_size': 32}. Best is trial 26 with value: 21.03031085049643.
Trial 155 finished with value: 7068.733028704926 and parameters: {'input_dropout': 0.1, 'hidden_layers': 10, 'hidden_units': 64, 'kernel_initializer': 'he_normal', 'hidden_activation': 'prelu', 'hidden_dropout': 0.3, 'batch_norm': 'off', 'optimizer_type': 'adam', 'optimizer_lr': 0.00039045557256416725, 'batch_size': 32}. Best is trial 26 with value: 21.03031085049643.
Trial 156 finished with value: 155.76836406154914 and parameters: {'input_dropout': 0.1, 'hidden_layers': 7, 'hidden_units': 192, 'kernel_initializer': 'random_normal', 'hidden_activation': 'leaky_relu', 'hidden_dropout': 0.3, 'batch_norm': 'off', 'optimizer_type': 'adam', 'optimizer_lr': 0.0005524056242310417, 'batch_size': 32}. Best is trial 26 with value: 21.03031085049643.
Trial 157 finished with value: 159.98323538920354 and parameters: {'input_dropout': 0.0, 'hidden_layers': 8, 'hidden_units': 64, 'kernel_initializer': 'random_normal', 'hidden_activation': 'leaky_relu', 'hidden_dropout': 0.1, 'batch_norm': 'off', 'optimizer_type': 'adam', 'optimizer_lr': 0.00023979159108305159, 'batch_size': 64}. Best is trial 26 with value: 21.03031085049643.
Trial 158 finished with value: 122.82651334480225 and parameters: {'input_dropout': 0.05, 'hidden_layers': 7, 'hidden_units': 64, 'kernel_initializer': 'random_normal', 'hidden_activation': 'relu', 'hidden_dropout': 0.05, 'batch_norm': 'on', 'optimizer_type': 'adam', 'optimizer_lr': 0.005543662839887196, 'batch_size': 96}. Best is trial 26 with value: 21.03031085049643.
Trial 159 finished with value: 241.06169195822278 and parameters: {'input_dropout': 0.15000000000000002, 'hidden_layers': 8, 'hidden_units': 160, 'kernel_initializer': 'he_uniform', 'hidden_activation': 'prelu', 'hidden_dropout': 0.1, 'batch_norm': 'off', 'optimizer_type': 'rmsprop', 'optimizer_lr': 0.0016896093166717987, 'batch_size': 64}. Best is trial 26 with value: 21.03031085049643.
Trial 160 finished with value: 212.60791013072435 and parameters: {'input_dropout': 0.2, 'hidden_layers': 3, 'hidden_units': 192, 'kernel_initializer': 'he_uniform', 'hidden_activation': 'prelu', 'hidden_dropout': 0.2, 'batch_norm': 'off', 'optimizer_type': 'adam', 'optimizer_lr': 0.006980691671531467, 'batch_size': 128}. Best is trial 26 with value: 21.03031085049643.
Trial 161 finished with value: 130.49609868828364 and parameters: {'input_dropout': 0.05, 'hidden_layers': 5, 'hidden_units': 64, 'kernel_initializer': 'random_normal', 'hidden_activation': 'leaky_relu', 'hidden_dropout': 0.1, 'batch_norm': 'off', 'optimizer_type': 'rmsprop', 'optimizer_lr': 0.00044583166563959286, 'batch_size': 32}. Best is trial 26 with value: 21.03031085049643.
Trial 162 finished with value: 160.4380211120451 and parameters: {'input_dropout': 0.05, 'hidden_layers': 8, 'hidden_units': 128, 'kernel_initializer': 'random_normal', 'hidden_activation': 'relu', 'hidden_dropout': 0.15000000000000002, 'batch_norm': 'off', 'optimizer_type': 'adam', 'optimizer_lr': 0.0002067434915086146, 'batch_size': 128}. Best is trial 26 with value: 21.03031085049643.
Trial 163 finished with value: 291.4569509069127 and parameters: {'input_dropout': 0.1, 'hidden_layers': 10, 'hidden_units': 256, 'kernel_initializer': 'random_normal', 'hidden_activation': 'prelu', 'hidden_dropout': 0.05, 'batch_norm': 'on', 'optimizer_type': 'rmsprop', 'optimizer_lr': 0.005237983071913621, 'batch_size': 96}. Best is trial 26 with value: 21.03031085049643.
Trial 164 finished with value: 143.1826662887953 and parameters: {'input_dropout': 0.05, 'hidden_layers': 8, 'hidden_units': 192, 'kernel_initializer': 'random_normal', 'hidden_activation': 'prelu', 'hidden_dropout': 0.3, 'batch_norm': 'off', 'optimizer_type': 'rmsprop', 'optimizer_lr': 0.00024216162653205948, 'batch_size': 96}. Best is trial 26 with value: 21.03031085049643.
Trial 165 finished with value: 8437.68888613191 and parameters: {'input_dropout': 0.1, 'hidden_layers': 7, 'hidden_units': 96, 'kernel_initializer': 'he_uniform', 'hidden_activation': 'relu', 'hidden_dropout': 0.25, 'batch_norm': 'on', 'optimizer_type': 'rmsprop', 'optimizer_lr': 0.0006189737304656799, 'batch_size': 32}. Best is trial 26 with value: 21.03031085049643.
Trial 166 finished with value: 60.57389224080895 and parameters: {'input_dropout': 0.05, 'hidden_layers': 3, 'hidden_units': 192, 'kernel_initializer': 'he_normal', 'hidden_activation': 'relu', 'hidden_dropout': 0.15000000000000002, 'batch_norm': 'on', 'optimizer_type': 'rmsprop', 'optimizer_lr': 0.0069073139047726335, 'batch_size': 64}. Best is trial 26 with value: 21.03031085049643.
Trial 167 finished with value: 188.7658988017383 and parameters: {'input_dropout': 0.2, 'hidden_layers': 9, 'hidden_units': 256, 'kernel_initializer': 'random_normal', 'hidden_activation': 'leaky_relu', 'hidden_dropout': 0.3, 'batch_norm': 'off', 'optimizer_type': 'adam', 'optimizer_lr': 0.002329335299354573, 'batch_size': 32}. Best is trial 26 with value: 21.03031085049643.
Trial 168 finished with value: 604.8165059483528 and parameters: {'input_dropout': 0.05, 'hidden_layers': 6, 'hidden_units': 192, 'kernel_initializer': 'he_normal', 'hidden_activation': 'relu', 'hidden_dropout': 0.25, 'batch_norm': 'off', 'optimizer_type': 'adam', 'optimizer_lr': 0.0005715943416529781, 'batch_size': 64}. Best is trial 26 with value: 21.03031085049643.
Trial 169 finished with value: 173.23012361577864 and parameters: {'input_dropout': 0.05, 'hidden_layers': 10, 'hidden_units': 96, 'kernel_initializer': 'random_normal', 'hidden_activation': 'leaky_relu', 'hidden_dropout': 0.2, 'batch_norm': 'off', 'optimizer_type': 'rmsprop', 'optimizer_lr': 0.00018008677000667692, 'batch_size': 64}. Best is trial 26 with value: 21.03031085049643.
Trial 170 finished with value: 221.2453706090918 and parameters: {'input_dropout': 0.1, 'hidden_layers': 5, 'hidden_units': 192, 'kernel_initializer': 'random_normal', 'hidden_activation': 'prelu', 'hidden_dropout': 0.25, 'batch_norm': 'off', 'optimizer_type': 'rmsprop', 'optimizer_lr': 0.008483386679973106, 'batch_size': 128}. Best is trial 26 with value: 21.03031085049643.
Trial 171 finished with value: 126.24285533817017 and parameters: {'input_dropout': 0.0, 'hidden_layers': 3, 'hidden_units': 128, 'kernel_initializer': 'he_uniform', 'hidden_activation': 'relu', 'hidden_dropout': 0.1, 'batch_norm': 'on', 'optimizer_type': 'rmsprop', 'optimizer_lr': 0.0008144451541272838, 'batch_size': 64}. Best is trial 26 with value: 21.03031085049643.
Trial 172 finished with value: 334.2801948487513 and parameters: {'input_dropout': 0.05, 'hidden_layers': 5, 'hidden_units': 256, 'kernel_initializer': 'he_uniform', 'hidden_activation': 'relu', 'hidden_dropout': 0.2, 'batch_norm': 'off', 'optimizer_type': 'adam', 'optimizer_lr': 0.0009881607746842715, 'batch_size': 96}. Best is trial 26 with value: 21.03031085049643.
