Trial 458 finished with value: 119.15557639204609 and parameters: {'input_dropout': 0.0, 'hidden_layers': 5, 'hidden_units': 160, 'kernel_initializer': 'he_uniform', 'hidden_activation': 'leaky_relu', 'hidden_dropout': 0.05, 'batch_norm': 'off', 'optimizer_type': 'rmsprop', 'optimizer_lr': 0.00010636016776529991, 'batch_size': 32}. Best is trial 390 with value: 16.963969438912468.
Trial 459 finished with value: 356.90887050711774 and parameters: {'input_dropout': 0.1, 'hidden_layers': 6, 'hidden_units': 256, 'kernel_initializer': 'he_uniform', 'hidden_activation': 'relu', 'hidden_dropout': 0.15000000000000002, 'batch_norm': 'off', 'optimizer_type': 'adam', 'optimizer_lr': 0.000765320728236877, 'batch_size': 128}. Best is trial 390 with value: 16.963969438912468.
Trial 460 finished with value: 176.55488184154132 and parameters: {'input_dropout': 0.2, 'hidden_layers': 3, 'hidden_units': 160, 'kernel_initializer': 'he_uniform', 'hidden_activation': 'leaky_relu', 'hidden_dropout': 0.25, 'batch_norm': 'on', 'optimizer_type': 'rmsprop', 'optimizer_lr': 0.0011112897456053894, 'batch_size': 128}. Best is trial 390 with value: 16.963969438912468.
Trial 461 finished with value: 186.01645052441498 and parameters: {'input_dropout': 0.15000000000000002, 'hidden_layers': 4, 'hidden_units': 32, 'kernel_initializer': 'he_normal', 'hidden_activation': 'relu', 'hidden_dropout': 0.0, 'batch_norm': 'off', 'optimizer_type': 'rmsprop', 'optimizer_lr': 0.0011871781791386066, 'batch_size': 96}. Best is trial 390 with value: 16.963969438912468.
Trial 462 finished with value: 104.25150583328248 and parameters: {'input_dropout': 0.1, 'hidden_layers': 5, 'hidden_units': 192, 'kernel_initializer': 'he_uniform', 'hidden_activation': 'leaky_relu', 'hidden_dropout': 0.05, 'batch_norm': 'on', 'optimizer_type': 'rmsprop', 'optimizer_lr': 0.0012751865285011346, 'batch_size': 128}. Best is trial 390 with value: 16.963969438912468.
Trial 463 finished with value: 182.63566179950013 and parameters: {'input_dropout': 0.15000000000000002, 'hidden_layers': 10, 'hidden_units': 96, 'kernel_initializer': 'random_normal', 'hidden_activation': 'leaky_relu', 'hidden_dropout': 0.1, 'batch_norm': 'off', 'optimizer_type': 'rmsprop', 'optimizer_lr': 0.00019129510213122908, 'batch_size': 128}. Best is trial 390 with value: 16.963969438912468.
Trial 464 finished with value: 151.25097145811637 and parameters: {'input_dropout': 0.05, 'hidden_layers': 3, 'hidden_units': 64, 'kernel_initializer': 'he_uniform', 'hidden_activation': 'prelu', 'hidden_dropout': 0.1, 'batch_norm': 'on', 'optimizer_type': 'rmsprop', 'optimizer_lr': 0.0010849334111611053, 'batch_size': 32}. Best is trial 390 with value: 16.963969438912468.
Trial 465 finished with value: 17474.2977361407 and parameters: {'input_dropout': 0.0, 'hidden_layers': 10, 'hidden_units': 96, 'kernel_initializer': 'he_normal', 'hidden_activation': 'relu', 'hidden_dropout': 0.3, 'batch_norm': 'on', 'optimizer_type': 'adam', 'optimizer_lr': 0.0003087410864430422, 'batch_size': 96}. Best is trial 390 with value: 16.963969438912468.
Trial 466 finished with value: 133.1248641024431 and parameters: {'input_dropout': 0.0, 'hidden_layers': 4, 'hidden_units': 160, 'kernel_initializer': 'random_normal', 'hidden_activation': 'leaky_relu', 'hidden_dropout': 0.2, 'batch_norm': 'off', 'optimizer_type': 'rmsprop', 'optimizer_lr': 0.0038815796669258436, 'batch_size': 32}. Best is trial 390 with value: 16.963969438912468.
Trial 467 finished with value: 741.1547670839632 and parameters: {'input_dropout': 0.1, 'hidden_layers': 7, 'hidden_units': 192, 'kernel_initializer': 'he_normal', 'hidden_activation': 'prelu', 'hidden_dropout': 0.25, 'batch_norm': 'off', 'optimizer_type': 'rmsprop', 'optimizer_lr': 0.001030982326035959, 'batch_size': 64}. Best is trial 390 with value: 16.963969438912468.
Trial 468 finished with value: 152.6946433485111 and parameters: {'input_dropout': 0.1, 'hidden_layers': 5, 'hidden_units': 224, 'kernel_initializer': 'he_normal', 'hidden_activation': 'prelu', 'hidden_dropout': 0.15000000000000002, 'batch_norm': 'on', 'optimizer_type': 'rmsprop', 'optimizer_lr': 0.0005401224757772018, 'batch_size': 64}. Best is trial 390 with value: 16.963969438912468.
Trial 469 finished with value: 111.30006781409027 and parameters: {'input_dropout': 0.0, 'hidden_layers': 3, 'hidden_units': 96, 'kernel_initializer': 'random_normal', 'hidden_activation': 'relu', 'hidden_dropout': 0.3, 'batch_norm': 'on', 'optimizer_type': 'rmsprop', 'optimizer_lr': 0.008558801422765553, 'batch_size': 32}. Best is trial 390 with value: 16.963969438912468.
Trial 470 finished with value: 3796.0412312108397 and parameters: {'input_dropout': 0.1, 'hidden_layers': 9, 'hidden_units': 128, 'kernel_initializer': 'he_uniform', 'hidden_activation': 'prelu', 'hidden_dropout': 0.25, 'batch_norm': 'off', 'optimizer_type': 'adam', 'optimizer_lr': 0.0017439465496247462, 'batch_size': 64}. Best is trial 390 with value: 16.963969438912468.
Trial 471 finished with value: 167.6651620821122 and parameters: {'input_dropout': 0.15000000000000002, 'hidden_layers': 8, 'hidden_units': 128, 'kernel_initializer': 'he_uniform', 'hidden_activation': 'prelu', 'hidden_dropout': 0.1, 'batch_norm': 'on', 'optimizer_type': 'rmsprop', 'optimizer_lr': 0.0015770580333636381, 'batch_size': 64}. Best is trial 390 with value: 16.963969438912468.
Trial 472 finished with value: 228.57452972166 and parameters: {'input_dropout': 0.1, 'hidden_layers': 8, 'hidden_units': 64, 'kernel_initializer': 'he_normal', 'hidden_activation': 'prelu', 'hidden_dropout': 0.15000000000000002, 'batch_norm': 'on', 'optimizer_type': 'rmsprop', 'optimizer_lr': 0.002418720536661219, 'batch_size': 64}. Best is trial 390 with value: 16.963969438912468.
Trial 473 finished with value: 22020.989716407847 and parameters: {'input_dropout': 0.05, 'hidden_layers': 3, 'hidden_units': 64, 'kernel_initializer': 'he_normal', 'hidden_activation': 'prelu', 'hidden_dropout': 0.1, 'batch_norm': 'on', 'optimizer_type': 'adam', 'optimizer_lr': 0.000100735128142618, 'batch_size': 128}. Best is trial 390 with value: 16.963969438912468.
Trial 474 finished with value: 131.20241199739803 and parameters: {'input_dropout': 0.15000000000000002, 'hidden_layers': 10, 'hidden_units': 96, 'kernel_initializer': 'he_uniform', 'hidden_activation': 'prelu', 'hidden_dropout': 0.0, 'batch_norm': 'off', 'optimizer_type': 'rmsprop', 'optimizer_lr': 0.0003909202948060357, 'batch_size': 64}. Best is trial 390 with value: 16.963969438912468.
Trial 475 finished with value: 151.3466872332745 and parameters: {'input_dropout': 0.2, 'hidden_layers': 8, 'hidden_units': 160, 'kernel_initializer': 'random_normal', 'hidden_activation': 'prelu', 'hidden_dropout': 0.0, 'batch_norm': 'on', 'optimizer_type': 'rmsprop', 'optimizer_lr': 0.0009711382975451768, 'batch_size': 64}. Best is trial 390 with value: 16.963969438912468.
Trial 476 finished with value: 130.54679777440066 and parameters: {'input_dropout': 0.2, 'hidden_layers': 3, 'hidden_units': 256, 'kernel_initializer': 'he_uniform', 'hidden_activation': 'relu', 'hidden_dropout': 0.15000000000000002, 'batch_norm': 'on', 'optimizer_type': 'rmsprop', 'optimizer_lr': 0.004252616622161757, 'batch_size': 32}. Best is trial 390 with value: 16.963969438912468.
Trial 477 finished with value: 106.56914795736148 and parameters: {'input_dropout': 0.0, 'hidden_layers': 3, 'hidden_units': 160, 'kernel_initializer': 'he_normal', 'hidden_activation': 'leaky_relu', 'hidden_dropout': 0.25, 'batch_norm': 'off', 'optimizer_type': 'adam', 'optimizer_lr': 0.007799140496963108, 'batch_size': 96}. Best is trial 390 with value: 16.963969438912468.
Trial 478 finished with value: 156.10292744537884 and parameters: {'input_dropout': 0.15000000000000002, 'hidden_layers': 6, 'hidden_units': 160, 'kernel_initializer': 'random_normal', 'hidden_activation': 'leaky_relu', 'hidden_dropout': 0.2, 'batch_norm': 'off', 'optimizer_type': 'adam', 'optimizer_lr': 0.0011348900623276265, 'batch_size': 96}. Best is trial 390 with value: 16.963969438912468.
Trial 479 finished with value: 658.169657861566 and parameters: {'input_dropout': 0.15000000000000002, 'hidden_layers': 8, 'hidden_units': 32, 'kernel_initializer': 'he_normal', 'hidden_activation': 'prelu', 'hidden_dropout': 0.15000000000000002, 'batch_norm': 'on', 'optimizer_type': 'rmsprop', 'optimizer_lr': 0.0024376309620172103, 'batch_size': 128}. Best is trial 390 with value: 16.963969438912468.
Trial 480 finished with value: 33.80322372898298 and parameters: {'input_dropout': 0.0, 'hidden_layers': 9, 'hidden_units': 160, 'kernel_initializer': 'he_normal', 'hidden_activation': 'relu', 'hidden_dropout': 0.05, 'batch_norm': 'on', 'optimizer_type': 'adam', 'optimizer_lr': 0.0033369955808151956, 'batch_size': 96}. Best is trial 390 with value: 16.963969438912468.
Trial 481 finished with value: 149.2030058069011 and parameters: {'input_dropout': 0.1, 'hidden_layers': 4, 'hidden_units': 96, 'kernel_initializer': 'he_normal', 'hidden_activation': 'leaky_relu', 'hidden_dropout': 0.0, 'batch_norm': 'off', 'optimizer_type': 'adam', 'optimizer_lr': 0.0003579692276931626, 'batch_size': 32}. Best is trial 390 with value: 16.963969438912468.
Trial 482 finished with value: 479.6196497982547 and parameters: {'input_dropout': 0.15000000000000002, 'hidden_layers': 5, 'hidden_units': 128, 'kernel_initializer': 'he_uniform', 'hidden_activation': 'leaky_relu', 'hidden_dropout': 0.25, 'batch_norm': 'off', 'optimizer_type': 'rmsprop', 'optimizer_lr': 0.0005305447196031926, 'batch_size': 32}. Best is trial 390 with value: 16.963969438912468.
Trial 483 finished with value: 466.5391481377143 and parameters: {'input_dropout': 0.15000000000000002, 'hidden_layers': 4, 'hidden_units': 96, 'kernel_initializer': 'he_normal', 'hidden_activation': 'leaky_relu', 'hidden_dropout': 0.3, 'batch_norm': 'off', 'optimizer_type': 'adam', 'optimizer_lr': 0.001730097090826073, 'batch_size': 32}. Best is trial 390 with value: 16.963969438912468.
Trial 484 finished with value: 120.50407301323118 and parameters: {'input_dropout': 0.1, 'hidden_layers': 3, 'hidden_units': 64, 'kernel_initializer': 'random_normal', 'hidden_activation': 'relu', 'hidden_dropout': 0.05, 'batch_norm': 'off', 'optimizer_type': 'rmsprop', 'optimizer_lr': 0.004964793132993226, 'batch_size': 64}. Best is trial 390 with value: 16.963969438912468.
Trial 485 finished with value: 8441.794963921868 and parameters: {'input_dropout': 0.1, 'hidden_layers': 10, 'hidden_units': 160, 'kernel_initializer': 'random_normal', 'hidden_activation': 'leaky_relu', 'hidden_dropout': 0.25, 'batch_norm': 'on', 'optimizer_type': 'rmsprop', 'optimizer_lr': 0.00019173160379575203, 'batch_size': 32}. Best is trial 390 with value: 16.963969438912468.
Trial 486 finished with value: 93.66674651527713 and parameters: {'input_dropout': 0.0, 'hidden_layers': 3, 'hidden_units': 224, 'kernel_initializer': 'random_normal', 'hidden_activation': 'relu', 'hidden_dropout': 0.05, 'batch_norm': 'off', 'optimizer_type': 'rmsprop', 'optimizer_lr': 0.0021068428834578163, 'batch_size': 96}. Best is trial 390 with value: 16.963969438912468.
Trial 487 finished with value: 200.92190937891914 and parameters: {'input_dropout': 0.2, 'hidden_layers': 8, 'hidden_units': 96, 'kernel_initializer': 'random_normal', 'hidden_activation': 'leaky_relu', 'hidden_dropout': 0.0, 'batch_norm': 'on', 'optimizer_type': 'adam', 'optimizer_lr': 0.007043043534620192, 'batch_size': 64}. Best is trial 390 with value: 16.963969438912468.
Trial 488 finished with value: 153.27103961048525 and parameters: {'input_dropout': 0.0, 'hidden_layers': 9, 'hidden_units': 128, 'kernel_initializer': 'he_uniform', 'hidden_activation': 'leaky_relu', 'hidden_dropout': 0.1, 'batch_norm': 'on', 'optimizer_type': 'rmsprop', 'optimizer_lr': 0.0004070472787519856, 'batch_size': 32}. Best is trial 390 with value: 16.963969438912468.
Trial 489 finished with value: 9684.885774843131 and parameters: {'input_dropout': 0.0, 'hidden_layers': 7, 'hidden_units': 160, 'kernel_initializer': 'he_normal', 'hidden_activation': 'relu', 'hidden_dropout': 0.15000000000000002, 'batch_norm': 'on', 'optimizer_type': 'adam', 'optimizer_lr': 0.00013156085192335426, 'batch_size': 32}. Best is trial 390 with value: 16.963969438912468.
Trial 490 finished with value: 172.61744199160998 and parameters: {'input_dropout': 0.1, 'hidden_layers': 5, 'hidden_units': 32, 'kernel_initializer': 'random_normal', 'hidden_activation': 'relu', 'hidden_dropout': 0.1, 'batch_norm': 'off', 'optimizer_type': 'adam', 'optimizer_lr': 0.000490940742637312, 'batch_size': 64}. Best is trial 390 with value: 16.963969438912468.
Trial 491 finished with value: 830.563486437454 and parameters: {'input_dropout': 0.0, 'hidden_layers': 7, 'hidden_units': 224, 'kernel_initializer': 'he_uniform', 'hidden_activation': 'relu', 'hidden_dropout': 0.25, 'batch_norm': 'off', 'optimizer_type': 'rmsprop', 'optimizer_lr': 0.00012933718537771867, 'batch_size': 32}. Best is trial 390 with value: 16.963969438912468.
Trial 492 finished with value: 105.43183643644286 and parameters: {'input_dropout': 0.0, 'hidden_layers': 4, 'hidden_units': 32, 'kernel_initializer': 'random_normal', 'hidden_activation': 'relu', 'hidden_dropout': 0.1, 'batch_norm': 'on', 'optimizer_type': 'rmsprop', 'optimizer_lr': 0.00886667091015262, 'batch_size': 64}. Best is trial 390 with value: 16.963969438912468.
Trial 493 finished with value: 2183.835065681243 and parameters: {'input_dropout': 0.1, 'hidden_layers': 8, 'hidden_units': 224, 'kernel_initializer': 'he_uniform', 'hidden_activation': 'relu', 'hidden_dropout': 0.25, 'batch_norm': 'off', 'optimizer_type': 'rmsprop', 'optimizer_lr': 0.00011139746081257505, 'batch_size': 64}. Best is trial 390 with value: 16.963969438912468.
Trial 494 finished with value: 75.74549129020406 and parameters: {'input_dropout': 0.05, 'hidden_layers': 4, 'hidden_units': 64, 'kernel_initializer': 'random_normal', 'hidden_activation': 'leaky_relu', 'hidden_dropout': 0.05, 'batch_norm': 'on', 'optimizer_type': 'adam', 'optimizer_lr': 0.002569416639709887, 'batch_size': 128}. Best is trial 390 with value: 16.963969438912468.
Trial 495 finished with value: 198.91759322721717 and parameters: {'input_dropout': 0.15000000000000002, 'hidden_layers': 6, 'hidden_units': 224, 'kernel_initializer': 'he_normal', 'hidden_activation': 'prelu', 'hidden_dropout': 0.15000000000000002, 'batch_norm': 'off', 'optimizer_type': 'rmsprop', 'optimizer_lr': 0.0013266620462069724, 'batch_size': 32}. Best is trial 390 with value: 16.963969438912468.
Trial 496 finished with value: 184.5828816804945 and parameters: {'input_dropout': 0.1, 'hidden_layers': 4, 'hidden_units': 96, 'kernel_initializer': 'he_uniform', 'hidden_activation': 'prelu', 'hidden_dropout': 0.25, 'batch_norm': 'on', 'optimizer_type': 'rmsprop', 'optimizer_lr': 0.001275875185932148, 'batch_size': 96}. Best is trial 390 with value: 16.963969438912468.
Trial 497 finished with value: 387.9969133705598 and parameters: {'input_dropout': 0.15000000000000002, 'hidden_layers': 3, 'hidden_units': 32, 'kernel_initializer': 'he_uniform', 'hidden_activation': 'leaky_relu', 'hidden_dropout': 0.0, 'batch_norm': 'off', 'optimizer_type': 'adam', 'optimizer_lr': 0.00020506948939531052, 'batch_size': 96}. Best is trial 390 with value: 16.963969438912468.
Trial 498 finished with value: 145.7390325786108 and parameters: {'input_dropout': 0.15000000000000002, 'hidden_layers': 5, 'hidden_units': 96, 'kernel_initializer': 'he_uniform', 'hidden_activation': 'relu', 'hidden_dropout': 0.0, 'batch_norm': 'off', 'optimizer_type': 'adam', 'optimizer_lr': 0.005251426937570519, 'batch_size': 64}. Best is trial 390 with value: 16.963969438912468.
Trial 499 finished with value: 259.85058338013056 and parameters: {'input_dropout': 0.15000000000000002, 'hidden_layers': 3, 'hidden_units': 192, 'kernel_initializer': 'he_uniform', 'hidden_activation': 'relu', 'hidden_dropout': 0.3, 'batch_norm': 'off', 'optimizer_type': 'adam', 'optimizer_lr': 0.00040192394782657606, 'batch_size': 64}. Best is trial 390 with value: 16.963969438912468.
Trial 500 finished with value: 4454.990369506608 and parameters: {'input_dropout': 0.15000000000000002, 'hidden_layers': 7, 'hidden_units': 64, 'kernel_initializer': 'he_uniform', 'hidden_activation': 'relu', 'hidden_dropout': 0.25, 'batch_norm': 'on', 'optimizer_type': 'adam', 'optimizer_lr': 0.0013699184033984873, 'batch_size': 128}. Best is trial 390 with value: 16.963969438912468.
Trial 501 finished with value: 212.06778042006297 and parameters: {'input_dropout': 0.0, 'hidden_layers': 6, 'hidden_units': 224, 'kernel_initializer': 'he_normal', 'hidden_activation': 'leaky_relu', 'hidden_dropout': 0.15000000000000002, 'batch_norm': 'off', 'optimizer_type': 'rmsprop', 'optimizer_lr': 0.00034910202960620546, 'batch_size': 128}. Best is trial 390 with value: 16.963969438912468.
Trial 502 finished with value: 94.05458358957179 and parameters: {'input_dropout': 0.15000000000000002, 'hidden_layers': 5, 'hidden_units': 128, 'kernel_initializer': 'he_normal', 'hidden_activation': 'relu', 'hidden_dropout': 0.1, 'batch_norm': 'on', 'optimizer_type': 'rmsprop', 'optimizer_lr': 0.005789788690157671, 'batch_size': 128}. Best is trial 390 with value: 16.963969438912468.
Trial 503 finished with value: 544.3924143904499 and parameters: {'input_dropout': 0.05, 'hidden_layers': 10, 'hidden_units': 160, 'kernel_initializer': 'he_normal', 'hidden_activation': 'leaky_relu', 'hidden_dropout': 0.1, 'batch_norm': 'off', 'optimizer_type': 'adam', 'optimizer_lr': 0.002144586799934518, 'batch_size': 64}. Best is trial 390 with value: 16.963969438912468.
Trial 504 finished with value: 259.1803081283499 and parameters: {'input_dropout': 0.1, 'hidden_layers': 10, 'hidden_units': 64, 'kernel_initializer': 'he_normal', 'hidden_activation': 'leaky_relu', 'hidden_dropout': 0.15000000000000002, 'batch_norm': 'on', 'optimizer_type': 'rmsprop', 'optimizer_lr': 0.0016890152810699638, 'batch_size': 32}. Best is trial 390 with value: 16.963969438912468.
Trial 505 finished with value: 108.74487792879052 and parameters: {'input_dropout': 0.1, 'hidden_layers': 5, 'hidden_units': 224, 'kernel_initializer': 'random_normal', 'hidden_activation': 'prelu', 'hidden_dropout': 0.25, 'batch_norm': 'on', 'optimizer_type': 'rmsprop', 'optimizer_lr': 0.004722398744613869, 'batch_size': 32}. Best is trial 390 with value: 16.963969438912468.
Trial 506 finished with value: 1152.1747446171619 and parameters: {'input_dropout': 0.1, 'hidden_layers': 8, 'hidden_units': 192, 'kernel_initializer': 'he_normal', 'hidden_activation': 'relu', 'hidden_dropout': 0.2, 'batch_norm': 'off', 'optimizer_type': 'adam', 'optimizer_lr': 0.0004923649448536442, 'batch_size': 96}. Best is trial 390 with value: 16.963969438912468.
Trial 507 finished with value: 1078.4995961782517 and parameters: {'input_dropout': 0.15000000000000002, 'hidden_layers': 7, 'hidden_units': 192, 'kernel_initializer': 'he_uniform', 'hidden_activation': 'leaky_relu', 'hidden_dropout': 0.25, 'batch_norm': 'off', 'optimizer_type': 'rmsprop', 'optimizer_lr': 0.001423537521086315, 'batch_size': 96}. Best is trial 390 with value: 16.963969438912468.
Trial 508 finished with value: 90.93362097829353 and parameters: {'input_dropout': 0.0, 'hidden_layers': 4, 'hidden_units': 224, 'kernel_initializer': 'random_normal', 'hidden_activation': 'leaky_relu', 'hidden_dropout': 0.2, 'batch_norm': 'on', 'optimizer_type': 'adam', 'optimizer_lr': 0.005822526361173317, 'batch_size': 64}. Best is trial 390 with value: 16.963969438912468.
Trial 509 finished with value: 2789.1602671800656 and parameters: {'input_dropout': 0.05, 'hidden_layers': 9, 'hidden_units': 32, 'kernel_initializer': 'he_uniform', 'hidden_activation': 'prelu', 'hidden_dropout': 0.2, 'batch_norm': 'off', 'optimizer_type': 'adam', 'optimizer_lr': 0.0092743331314889, 'batch_size': 96}. Best is trial 390 with value: 16.963969438912468.
Trial 510 finished with value: 1834.2187381215663 and parameters: {'input_dropout': 0.05, 'hidden_layers': 10, 'hidden_units': 32, 'kernel_initializer': 'he_uniform', 'hidden_activation': 'leaky_relu', 'hidden_dropout': 0.1, 'batch_norm': 'off', 'optimizer_type': 'rmsprop', 'optimizer_lr': 0.0010326239557274068, 'batch_size': 128}. Best is trial 390 with value: 16.963969438912468.
Trial 511 finished with value: 1971.5316382920828 and parameters: {'input_dropout': 0.05, 'hidden_layers': 7, 'hidden_units': 96, 'kernel_initializer': 'he_uniform', 'hidden_activation': 'prelu', 'hidden_dropout': 0.0, 'batch_norm': 'on', 'optimizer_type': 'rmsprop', 'optimizer_lr': 0.00024300109844679053, 'batch_size': 32}. Best is trial 390 with value: 16.963969438912468.
Trial 512 finished with value: 101.9164590995337 and parameters: {'input_dropout': 0.1, 'hidden_layers': 3, 'hidden_units': 256, 'kernel_initializer': 'he_normal', 'hidden_activation': 'leaky_relu', 'hidden_dropout': 0.05, 'batch_norm': 'off', 'optimizer_type': 'adam', 'optimizer_lr': 0.009584591843619717, 'batch_size': 96}. Best is trial 390 with value: 16.963969438912468.
Trial 513 finished with value: 330.2673868079345 and parameters: {'input_dropout': 0.0, 'hidden_layers': 7, 'hidden_units': 192, 'kernel_initializer': 'he_uniform', 'hidden_activation': 'relu', 'hidden_dropout': 0.15000000000000002, 'batch_norm': 'off', 'optimizer_type': 'adam', 'optimizer_lr': 0.00010975009923806263, 'batch_size': 96}. Best is trial 390 with value: 16.963969438912468.
Trial 514 finished with value: 162.49498246091625 and parameters: {'input_dropout': 0.15000000000000002, 'hidden_layers': 5, 'hidden_units': 96, 'kernel_initializer': 'he_uniform', 'hidden_activation': 'leaky_relu', 'hidden_dropout': 0.1, 'batch_norm': 'off', 'optimizer_type': 'rmsprop', 'optimizer_lr': 0.0035773854280067045, 'batch_size': 96}. Best is trial 390 with value: 16.963969438912468.
