Trial 800 finished with value: 105.47099613404717 and parameters: {'input_dropout': 0.1, 'hidden_layers': 7, 'hidden_units': 160, 'kernel_initializer': 'he_normal', 'hidden_activation': 'prelu', 'hidden_dropout': 0.0, 'batch_norm': 'off', 'optimizer_type': 'rmsprop', 'optimizer_lr': 0.0015379003623879341, 'batch_size': 128}. Best is trial 390 with value: 16.963969438912468.
Trial 801 finished with value: 147.42369496264774 and parameters: {'input_dropout': 0.0, 'hidden_layers': 5, 'hidden_units': 64, 'kernel_initializer': 'he_uniform', 'hidden_activation': 'prelu', 'hidden_dropout': 0.1, 'batch_norm': 'on', 'optimizer_type': 'rmsprop', 'optimizer_lr': 0.0033634554437449453, 'batch_size': 64}. Best is trial 390 with value: 16.963969438912468.
Trial 802 finished with value: 15444.108598175977 and parameters: {'input_dropout': 0.1, 'hidden_layers': 3, 'hidden_units': 256, 'kernel_initializer': 'he_normal', 'hidden_activation': 'prelu', 'hidden_dropout': 0.2, 'batch_norm': 'on', 'optimizer_type': 'rmsprop', 'optimizer_lr': 0.0001701082042199286, 'batch_size': 128}. Best is trial 390 with value: 16.963969438912468.
Trial 803 finished with value: 11724.663883918704 and parameters: {'input_dropout': 0.0, 'hidden_layers': 8, 'hidden_units': 96, 'kernel_initializer': 'he_normal', 'hidden_activation': 'leaky_relu', 'hidden_dropout': 0.15000000000000002, 'batch_norm': 'on', 'optimizer_type': 'adam', 'optimizer_lr': 0.00012049623930835375, 'batch_size': 32}. Best is trial 390 with value: 16.963969438912468.
Trial 804 finished with value: 5049.668656148347 and parameters: {'input_dropout': 0.15000000000000002, 'hidden_layers': 8, 'hidden_units': 32, 'kernel_initializer': 'he_uniform', 'hidden_activation': 'relu', 'hidden_dropout': 0.3, 'batch_norm': 'off', 'optimizer_type': 'rmsprop', 'optimizer_lr': 0.0003780240011337781, 'batch_size': 32}. Best is trial 390 with value: 16.963969438912468.
Trial 805 finished with value: 170.90625204180876 and parameters: {'input_dropout': 0.2, 'hidden_layers': 6, 'hidden_units': 96, 'kernel_initializer': 'random_normal', 'hidden_activation': 'relu', 'hidden_dropout': 0.3, 'batch_norm': 'off', 'optimizer_type': 'adam', 'optimizer_lr': 0.008412963082680396, 'batch_size': 128}. Best is trial 390 with value: 16.963969438912468.
Trial 806 finished with value: 167.82777148377443 and parameters: {'input_dropout': 0.15000000000000002, 'hidden_layers': 6, 'hidden_units': 192, 'kernel_initializer': 'he_uniform', 'hidden_activation': 'leaky_relu', 'hidden_dropout': 0.2, 'batch_norm': 'on', 'optimizer_type': 'adam', 'optimizer_lr': 0.0014480143917095746, 'batch_size': 128}. Best is trial 390 with value: 16.963969438912468.
Trial 807 finished with value: 13353.808701437454 and parameters: {'input_dropout': 0.0, 'hidden_layers': 4, 'hidden_units': 160, 'kernel_initializer': 'he_normal', 'hidden_activation': 'leaky_relu', 'hidden_dropout': 0.2, 'batch_norm': 'on', 'optimizer_type': 'rmsprop', 'optimizer_lr': 0.0002360461450913446, 'batch_size': 96}. Best is trial 390 with value: 16.963969438912468.
Trial 808 finished with value: 132.44952317174668 and parameters: {'input_dropout': 0.05, 'hidden_layers': 3, 'hidden_units': 256, 'kernel_initializer': 'random_normal', 'hidden_activation': 'leaky_relu', 'hidden_dropout': 0.3, 'batch_norm': 'off', 'optimizer_type': 'adam', 'optimizer_lr': 0.00035120298123778824, 'batch_size': 96}. Best is trial 390 with value: 16.963969438912468.
Trial 809 finished with value: 130.28954692910995 and parameters: {'input_dropout': 0.05, 'hidden_layers': 7, 'hidden_units': 224, 'kernel_initializer': 'he_uniform', 'hidden_activation': 'leaky_relu', 'hidden_dropout': 0.25, 'batch_norm': 'on', 'optimizer_type': 'rmsprop', 'optimizer_lr': 0.0021180676539087335, 'batch_size': 64}. Best is trial 390 with value: 16.963969438912468.
Trial 810 finished with value: 227.87038057324224 and parameters: {'input_dropout': 0.15000000000000002, 'hidden_layers': 3, 'hidden_units': 32, 'kernel_initializer': 'he_uniform', 'hidden_activation': 'prelu', 'hidden_dropout': 0.25, 'batch_norm': 'on', 'optimizer_type': 'rmsprop', 'optimizer_lr': 0.007420461304131598, 'batch_size': 64}. Best is trial 390 with value: 16.963969438912468.
Trial 811 finished with value: 127.0506362611848 and parameters: {'input_dropout': 0.0, 'hidden_layers': 4, 'hidden_units': 128, 'kernel_initializer': 'random_normal', 'hidden_activation': 'prelu', 'hidden_dropout': 0.25, 'batch_norm': 'off', 'optimizer_type': 'adam', 'optimizer_lr': 0.00022379974977568647, 'batch_size': 32}. Best is trial 390 with value: 16.963969438912468.
Trial 812 finished with value: 8964.59806059916 and parameters: {'input_dropout': 0.05, 'hidden_layers': 4, 'hidden_units': 128, 'kernel_initializer': 'he_normal', 'hidden_activation': 'leaky_relu', 'hidden_dropout': 0.2, 'batch_norm': 'on', 'optimizer_type': 'adam', 'optimizer_lr': 0.00029205729761512604, 'batch_size': 32}. Best is trial 390 with value: 16.963969438912468.
Trial 813 finished with value: 167.5929986266498 and parameters: {'input_dropout': 0.05, 'hidden_layers': 6, 'hidden_units': 64, 'kernel_initializer': 'random_normal', 'hidden_activation': 'relu', 'hidden_dropout': 0.15000000000000002, 'batch_norm': 'on', 'optimizer_type': 'rmsprop', 'optimizer_lr': 0.0005476151983485649, 'batch_size': 32}. Best is trial 390 with value: 16.963969438912468.
Trial 814 finished with value: 1705.739782444384 and parameters: {'input_dropout': 0.0, 'hidden_layers': 9, 'hidden_units': 96, 'kernel_initializer': 'he_normal', 'hidden_activation': 'relu', 'hidden_dropout': 0.2, 'batch_norm': 'off', 'optimizer_type': 'adam', 'optimizer_lr': 0.0001624420423826268, 'batch_size': 32}. Best is trial 390 with value: 16.963969438912468.
Trial 815 finished with value: 8302.753928466716 and parameters: {'input_dropout': 0.2, 'hidden_layers': 8, 'hidden_units': 256, 'kernel_initializer': 'he_normal', 'hidden_activation': 'prelu', 'hidden_dropout': 0.25, 'batch_norm': 'on', 'optimizer_type': 'adam', 'optimizer_lr': 0.00011257014161490793, 'batch_size': 32}. Best is trial 390 with value: 16.963969438912468.
Trial 816 finished with value: 4065.792485391166 and parameters: {'input_dropout': 0.2, 'hidden_layers': 9, 'hidden_units': 160, 'kernel_initializer': 'random_normal', 'hidden_activation': 'leaky_relu', 'hidden_dropout': 0.0, 'batch_norm': 'on', 'optimizer_type': 'rmsprop', 'optimizer_lr': 0.0006939582775722387, 'batch_size': 96}. Best is trial 390 with value: 16.963969438912468.
Trial 817 finished with value: 1087.1760830481076 and parameters: {'input_dropout': 0.15000000000000002, 'hidden_layers': 10, 'hidden_units': 160, 'kernel_initializer': 'he_normal', 'hidden_activation': 'prelu', 'hidden_dropout': 0.25, 'batch_norm': 'on', 'optimizer_type': 'rmsprop', 'optimizer_lr': 0.0008978712510752242, 'batch_size': 96}. Best is trial 390 with value: 16.963969438912468.
Trial 818 finished with value: 249.14791201808708 and parameters: {'input_dropout': 0.15000000000000002, 'hidden_layers': 3, 'hidden_units': 160, 'kernel_initializer': 'he_uniform', 'hidden_activation': 'prelu', 'hidden_dropout': 0.3, 'batch_norm': 'off', 'optimizer_type': 'adam', 'optimizer_lr': 0.003320687353767096, 'batch_size': 96}. Best is trial 390 with value: 16.963969438912468.
Trial 819 finished with value: 169.40185823509634 and parameters: {'input_dropout': 0.1, 'hidden_layers': 6, 'hidden_units': 192, 'kernel_initializer': 'he_normal', 'hidden_activation': 'prelu', 'hidden_dropout': 0.15000000000000002, 'batch_norm': 'off', 'optimizer_type': 'rmsprop', 'optimizer_lr': 0.008188367547733184, 'batch_size': 128}. Best is trial 390 with value: 16.963969438912468.
Trial 820 finished with value: 96.96288237231386 and parameters: {'input_dropout': 0.0, 'hidden_layers': 3, 'hidden_units': 160, 'kernel_initializer': 'random_normal', 'hidden_activation': 'relu', 'hidden_dropout': 0.25, 'batch_norm': 'on', 'optimizer_type': 'rmsprop', 'optimizer_lr': 0.0034864658309583306, 'batch_size': 32}. Best is trial 390 with value: 16.963969438912468.
Trial 821 finished with value: 113.71625105731673 and parameters: {'input_dropout': 0.0, 'hidden_layers': 6, 'hidden_units': 192, 'kernel_initializer': 'random_normal', 'hidden_activation': 'relu', 'hidden_dropout': 0.05, 'batch_norm': 'off', 'optimizer_type': 'rmsprop', 'optimizer_lr': 0.00013240489897352014, 'batch_size': 96}. Best is trial 390 with value: 16.963969438912468.
Trial 822 finished with value: 7243.7769280709645 and parameters: {'input_dropout': 0.05, 'hidden_layers': 8, 'hidden_units': 96, 'kernel_initializer': 'he_normal', 'hidden_activation': 'leaky_relu', 'hidden_dropout': 0.05, 'batch_norm': 'on', 'optimizer_type': 'rmsprop', 'optimizer_lr': 0.0005226445805028066, 'batch_size': 96}. Best is trial 390 with value: 16.963969438912468.
Trial 823 finished with value: 1032.61924810931 and parameters: {'input_dropout': 0.05, 'hidden_layers': 7, 'hidden_units': 192, 'kernel_initializer': 'he_normal', 'hidden_activation': 'relu', 'hidden_dropout': 0.3, 'batch_norm': 'off', 'optimizer_type': 'adam', 'optimizer_lr': 0.004251248543743746, 'batch_size': 128}. Best is trial 390 with value: 16.963969438912468.
Trial 824 finished with value: 20959.88511304946 and parameters: {'input_dropout': 0.1, 'hidden_layers': 5, 'hidden_units': 64, 'kernel_initializer': 'he_normal', 'hidden_activation': 'prelu', 'hidden_dropout': 0.0, 'batch_norm': 'on', 'optimizer_type': 'rmsprop', 'optimizer_lr': 0.00013600411802501235, 'batch_size': 96}. Best is trial 390 with value: 16.963969438912468.
Trial 825 finished with value: 116.27504824966641 and parameters: {'input_dropout': 0.0, 'hidden_layers': 10, 'hidden_units': 224, 'kernel_initializer': 'random_normal', 'hidden_activation': 'leaky_relu', 'hidden_dropout': 0.15000000000000002, 'batch_norm': 'off', 'optimizer_type': 'adam', 'optimizer_lr': 0.002841199470994643, 'batch_size': 96}. Best is trial 390 with value: 16.963969438912468.
Trial 826 finished with value: 451.86422710959414 and parameters: {'input_dropout': 0.15000000000000002, 'hidden_layers': 3, 'hidden_units': 32, 'kernel_initializer': 'he_uniform', 'hidden_activation': 'prelu', 'hidden_dropout': 0.3, 'batch_norm': 'off', 'optimizer_type': 'rmsprop', 'optimizer_lr': 0.00017980966668654488, 'batch_size': 32}. Best is trial 390 with value: 16.963969438912468.
Trial 827 finished with value: 102.64444703048395 and parameters: {'input_dropout': 0.15000000000000002, 'hidden_layers': 4, 'hidden_units': 192, 'kernel_initializer': 'he_uniform', 'hidden_activation': 'leaky_relu', 'hidden_dropout': 0.15000000000000002, 'batch_norm': 'on', 'optimizer_type': 'rmsprop', 'optimizer_lr': 0.0054587830267843725, 'batch_size': 96}. Best is trial 390 with value: 16.963969438912468.
Trial 828 finished with value: 17317.29726254827 and parameters: {'input_dropout': 0.05, 'hidden_layers': 5, 'hidden_units': 96, 'kernel_initializer': 'he_normal', 'hidden_activation': 'leaky_relu', 'hidden_dropout': 0.05, 'batch_norm': 'on', 'optimizer_type': 'adam', 'optimizer_lr': 0.0002058980637776888, 'batch_size': 96}. Best is trial 390 with value: 16.963969438912468.
Trial 829 finished with value: 1329.671440973439 and parameters: {'input_dropout': 0.2, 'hidden_layers': 9, 'hidden_units': 256, 'kernel_initializer': 'he_uniform', 'hidden_activation': 'relu', 'hidden_dropout': 0.2, 'batch_norm': 'off', 'optimizer_type': 'adam', 'optimizer_lr': 0.0012504081311174287, 'batch_size': 64}. Best is trial 390 with value: 16.963969438912468.
Trial 830 finished with value: 14517.34348274468 and parameters: {'input_dropout': 0.15000000000000002, 'hidden_layers': 9, 'hidden_units': 224, 'kernel_initializer': 'he_uniform', 'hidden_activation': 'leaky_relu', 'hidden_dropout': 0.25, 'batch_norm': 'on', 'optimizer_type': 'rmsprop', 'optimizer_lr': 0.0003034162364021028, 'batch_size': 96}. Best is trial 390 with value: 16.963969438912468.
Trial 831 finished with value: 4458.9686202787925 and parameters: {'input_dropout': 0.0, 'hidden_layers': 10, 'hidden_units': 32, 'kernel_initializer': 'he_uniform', 'hidden_activation': 'prelu', 'hidden_dropout': 0.25, 'batch_norm': 'off', 'optimizer_type': 'adam', 'optimizer_lr': 0.0047806577988444895, 'batch_size': 64}. Best is trial 390 with value: 16.963969438912468.
Trial 832 finished with value: 132.7283929787928 and parameters: {'input_dropout': 0.2, 'hidden_layers': 3, 'hidden_units': 160, 'kernel_initializer': 'random_normal', 'hidden_activation': 'leaky_relu', 'hidden_dropout': 0.15000000000000002, 'batch_norm': 'on', 'optimizer_type': 'rmsprop', 'optimizer_lr': 0.008224691679790983, 'batch_size': 128}. Best is trial 390 with value: 16.963969438912468.
Trial 833 finished with value: 520.8905816507872 and parameters: {'input_dropout': 0.15000000000000002, 'hidden_layers': 8, 'hidden_units': 160, 'kernel_initializer': 'he_uniform', 'hidden_activation': 'leaky_relu', 'hidden_dropout': 0.2, 'batch_norm': 'off', 'optimizer_type': 'rmsprop', 'optimizer_lr': 0.0036464738283171105, 'batch_size': 96}. Best is trial 390 with value: 16.963969438912468.
Trial 834 finished with value: 68.16619325056145 and parameters: {'input_dropout': 0.05, 'hidden_layers': 3, 'hidden_units': 64, 'kernel_initializer': 'random_normal', 'hidden_activation': 'leaky_relu', 'hidden_dropout': 0.0, 'batch_norm': 'on', 'optimizer_type': 'rmsprop', 'optimizer_lr': 0.0016418266296982368, 'batch_size': 64}. Best is trial 390 with value: 16.963969438912468.
Trial 835 finished with value: 154.6953534778786 and parameters: {'input_dropout': 0.1, 'hidden_layers': 6, 'hidden_units': 32, 'kernel_initializer': 'he_normal', 'hidden_activation': 'prelu', 'hidden_dropout': 0.0, 'batch_norm': 'off', 'optimizer_type': 'adam', 'optimizer_lr': 0.0010223520256864664, 'batch_size': 64}. Best is trial 390 with value: 16.963969438912468.
Trial 836 finished with value: 119.5343435764042 and parameters: {'input_dropout': 0.15000000000000002, 'hidden_layers': 10, 'hidden_units': 256, 'kernel_initializer': 'random_normal', 'hidden_activation': 'prelu', 'hidden_dropout': 0.0, 'batch_norm': 'off', 'optimizer_type': 'adam', 'optimizer_lr': 0.0008029630539438008, 'batch_size': 32}. Best is trial 390 with value: 16.963969438912468.
Trial 837 finished with value: 267.34643026109893 and parameters: {'input_dropout': 0.0, 'hidden_layers': 8, 'hidden_units': 192, 'kernel_initializer': 'he_normal', 'hidden_activation': 'prelu', 'hidden_dropout': 0.3, 'batch_norm': 'on', 'optimizer_type': 'rmsprop', 'optimizer_lr': 0.00026858775168724796, 'batch_size': 32}. Best is trial 390 with value: 16.963969438912468.
Trial 838 finished with value: 143.4447326939263 and parameters: {'input_dropout': 0.15000000000000002, 'hidden_layers': 5, 'hidden_units': 224, 'kernel_initializer': 'random_normal', 'hidden_activation': 'relu', 'hidden_dropout': 0.1, 'batch_norm': 'off', 'optimizer_type': 'rmsprop', 'optimizer_lr': 0.0009642948698130137, 'batch_size': 128}. Best is trial 390 with value: 16.963969438912468.
Trial 839 finished with value: 169.43896019343515 and parameters: {'input_dropout': 0.05, 'hidden_layers': 9, 'hidden_units': 96, 'kernel_initializer': 'random_normal', 'hidden_activation': 'leaky_relu', 'hidden_dropout': 0.1, 'batch_norm': 'on', 'optimizer_type': 'adam', 'optimizer_lr': 0.000964127236621365, 'batch_size': 96}. Best is trial 390 with value: 16.963969438912468.
Trial 840 finished with value: 52.28820070985545 and parameters: {'input_dropout': 0.05, 'hidden_layers': 6, 'hidden_units': 160, 'kernel_initializer': 'random_normal', 'hidden_activation': 'prelu', 'hidden_dropout': 0.0, 'batch_norm': 'on', 'optimizer_type': 'adam', 'optimizer_lr': 0.007916984359551096, 'batch_size': 128}. Best is trial 390 with value: 16.963969438912468.
Trial 841 finished with value: 134.47908274790422 and parameters: {'input_dropout': 0.0, 'hidden_layers': 7, 'hidden_units': 160, 'kernel_initializer': 'random_normal', 'hidden_activation': 'leaky_relu', 'hidden_dropout': 0.3, 'batch_norm': 'off', 'optimizer_type': 'rmsprop', 'optimizer_lr': 0.00028545165307222427, 'batch_size': 32}. Best is trial 390 with value: 16.963969438912468.
Trial 842 finished with value: 162.83101014796057 and parameters: {'input_dropout': 0.05, 'hidden_layers': 4, 'hidden_units': 64, 'kernel_initializer': 'he_uniform', 'hidden_activation': 'relu', 'hidden_dropout': 0.2, 'batch_norm': 'on', 'optimizer_type': 'adam', 'optimizer_lr': 0.0017968683332541017, 'batch_size': 32}. Best is trial 390 with value: 16.963969438912468.
Trial 843 finished with value: 170.5085616010538 and parameters: {'input_dropout': 0.2, 'hidden_layers': 9, 'hidden_units': 128, 'kernel_initializer': 'random_normal', 'hidden_activation': 'leaky_relu', 'hidden_dropout': 0.1, 'batch_norm': 'on', 'optimizer_type': 'rmsprop', 'optimizer_lr': 0.0026477315748596407, 'batch_size': 64}. Best is trial 390 with value: 16.963969438912468.
Trial 844 finished with value: 683.6510345527637 and parameters: {'input_dropout': 0.0, 'hidden_layers': 10, 'hidden_units': 32, 'kernel_initializer': 'he_normal', 'hidden_activation': 'leaky_relu', 'hidden_dropout': 0.05, 'batch_norm': 'off', 'optimizer_type': 'rmsprop', 'optimizer_lr': 0.00010771549042910058, 'batch_size': 96}. Best is trial 390 with value: 16.963969438912468.
Trial 845 finished with value: 99.12573631273393 and parameters: {'input_dropout': 0.05, 'hidden_layers': 5, 'hidden_units': 96, 'kernel_initializer': 'he_uniform', 'hidden_activation': 'relu', 'hidden_dropout': 0.15000000000000002, 'batch_norm': 'on', 'optimizer_type': 'rmsprop', 'optimizer_lr': 0.00470821821752347, 'batch_size': 96}. Best is trial 390 with value: 16.963969438912468.
Trial 846 finished with value: 44.25416401945734 and parameters: {'input_dropout': 0.0, 'hidden_layers': 7, 'hidden_units': 128, 'kernel_initializer': 'he_uniform', 'hidden_activation': 'leaky_relu', 'hidden_dropout': 0.0, 'batch_norm': 'on', 'optimizer_type': 'adam', 'optimizer_lr': 0.0005443272640107116, 'batch_size': 32}. Best is trial 390 with value: 16.963969438912468.
Trial 847 finished with value: 622.8335540230796 and parameters: {'input_dropout': 0.1, 'hidden_layers': 7, 'hidden_units': 224, 'kernel_initializer': 'he_normal', 'hidden_activation': 'relu', 'hidden_dropout': 0.25, 'batch_norm': 'off', 'optimizer_type': 'adam', 'optimizer_lr': 0.002450966044459428, 'batch_size': 96}. Best is trial 390 with value: 16.963969438912468.
Trial 848 finished with value: 188.19130697203488 and parameters: {'input_dropout': 0.2, 'hidden_layers': 9, 'hidden_units': 128, 'kernel_initializer': 'random_normal', 'hidden_activation': 'prelu', 'hidden_dropout': 0.1, 'batch_norm': 'off', 'optimizer_type': 'rmsprop', 'optimizer_lr': 0.00014131475413419167, 'batch_size': 64}. Best is trial 390 with value: 16.963969438912468.
Trial 849 finished with value: 743.3488765718869 and parameters: {'input_dropout': 0.2, 'hidden_layers': 10, 'hidden_units': 224, 'kernel_initializer': 'he_uniform', 'hidden_activation': 'leaky_relu', 'hidden_dropout': 0.2, 'batch_norm': 'off', 'optimizer_type': 'rmsprop', 'optimizer_lr': 0.0029002210065512905, 'batch_size': 32}. Best is trial 390 with value: 16.963969438912468.
Trial 850 finished with value: 150.859476087512 and parameters: {'input_dropout': 0.1, 'hidden_layers': 7, 'hidden_units': 256, 'kernel_initializer': 'he_normal', 'hidden_activation': 'prelu', 'hidden_dropout': 0.25, 'batch_norm': 'on', 'optimizer_type': 'rmsprop', 'optimizer_lr': 0.002953845238417215, 'batch_size': 96}. Best is trial 390 with value: 16.963969438912468.
Trial 851 finished with value: 234.24426231216543 and parameters: {'input_dropout': 0.15000000000000002, 'hidden_layers': 8, 'hidden_units': 96, 'kernel_initializer': 'he_normal', 'hidden_activation': 'leaky_relu', 'hidden_dropout': 0.0, 'batch_norm': 'on', 'optimizer_type': 'adam', 'optimizer_lr': 0.006406940367878747, 'batch_size': 96}. Best is trial 390 with value: 16.963969438912468.
Trial 852 finished with value: 2642.8429511833247 and parameters: {'input_dropout': 0.0, 'hidden_layers': 8, 'hidden_units': 64, 'kernel_initializer': 'random_normal', 'hidden_activation': 'leaky_relu', 'hidden_dropout': 0.2, 'batch_norm': 'on', 'optimizer_type': 'rmsprop', 'optimizer_lr': 0.0024456396244648473, 'batch_size': 64}. Best is trial 390 with value: 16.963969438912468.
Trial 853 finished with value: 132.35375304445782 and parameters: {'input_dropout': 0.2, 'hidden_layers': 6, 'hidden_units': 128, 'kernel_initializer': 'random_normal', 'hidden_activation': 'leaky_relu', 'hidden_dropout': 0.1, 'batch_norm': 'on', 'optimizer_type': 'rmsprop', 'optimizer_lr': 0.004001085232168071, 'batch_size': 128}. Best is trial 390 with value: 16.963969438912468.
Trial 854 finished with value: 4672.548668564057 and parameters: {'input_dropout': 0.2, 'hidden_layers': 9, 'hidden_units': 224, 'kernel_initializer': 'he_normal', 'hidden_activation': 'relu', 'hidden_dropout': 0.3, 'batch_norm': 'on', 'optimizer_type': 'rmsprop', 'optimizer_lr': 0.0007807825187045292, 'batch_size': 96}. Best is trial 390 with value: 16.963969438912468.
Trial 855 finished with value: 82.00727267512733 and parameters: {'input_dropout': 0.1, 'hidden_layers': 3, 'hidden_units': 256, 'kernel_initializer': 'he_normal', 'hidden_activation': 'leaky_relu', 'hidden_dropout': 0.15000000000000002, 'batch_norm': 'on', 'optimizer_type': 'adam', 'optimizer_lr': 0.00521034182921513, 'batch_size': 128}. Best is trial 390 with value: 16.963969438912468.
Trial 856 finished with value: 187.18368980220868 and parameters: {'input_dropout': 0.0, 'hidden_layers': 9, 'hidden_units': 160, 'kernel_initializer': 'random_normal', 'hidden_activation': 'relu', 'hidden_dropout': 0.15000000000000002, 'batch_norm': 'off', 'optimizer_type': 'rmsprop', 'optimizer_lr': 0.002855012224812938, 'batch_size': 128}. Best is trial 390 with value: 16.963969438912468.
