Trial 344 finished with value: 154.208098443004 and parameters: {'input_dropout': 0.2, 'hidden_layers': 8, 'hidden_units': 96, 'kernel_initializer': 'random_normal', 'hidden_activation': 'prelu', 'hidden_dropout': 0.0, 'batch_norm': 'off', 'optimizer_type': 'rmsprop', 'optimizer_lr': 0.00348759906943028, 'batch_size': 32}. Best is trial 26 with value: 21.03031085049643.
Trial 345 finished with value: 98.5294118767491 and parameters: {'input_dropout': 0.05, 'hidden_layers': 3, 'hidden_units': 128, 'kernel_initializer': 'random_normal', 'hidden_activation': 'prelu', 'hidden_dropout': 0.05, 'batch_norm': 'off', 'optimizer_type': 'rmsprop', 'optimizer_lr': 0.0013462342694765736, 'batch_size': 32}. Best is trial 26 with value: 21.03031085049643.
Trial 346 finished with value: 134.81544664017824 and parameters: {'input_dropout': 0.15000000000000002, 'hidden_layers': 3, 'hidden_units': 256, 'kernel_initializer': 'random_normal', 'hidden_activation': 'relu', 'hidden_dropout': 0.2, 'batch_norm': 'on', 'optimizer_type': 'rmsprop', 'optimizer_lr': 0.000654824691661348, 'batch_size': 32}. Best is trial 26 with value: 21.03031085049643.
Trial 347 finished with value: 234.21095133887948 and parameters: {'input_dropout': 0.1, 'hidden_layers': 6, 'hidden_units': 32, 'kernel_initializer': 'he_normal', 'hidden_activation': 'leaky_relu', 'hidden_dropout': 0.05, 'batch_norm': 'off', 'optimizer_type': 'adam', 'optimizer_lr': 0.00450332907663585, 'batch_size': 32}. Best is trial 26 with value: 21.03031085049643.
Trial 348 finished with value: 254.594463868074 and parameters: {'input_dropout': 0.05, 'hidden_layers': 10, 'hidden_units': 32, 'kernel_initializer': 'random_normal', 'hidden_activation': 'prelu', 'hidden_dropout': 0.05, 'batch_norm': 'on', 'optimizer_type': 'adam', 'optimizer_lr': 0.001520511093556278, 'batch_size': 64}. Best is trial 26 with value: 21.03031085049643.
Trial 349 finished with value: 121.99387388094158 and parameters: {'input_dropout': 0.1, 'hidden_layers': 7, 'hidden_units': 224, 'kernel_initializer': 'random_normal', 'hidden_activation': 'leaky_relu', 'hidden_dropout': 0.15000000000000002, 'batch_norm': 'off', 'optimizer_type': 'rmsprop', 'optimizer_lr': 0.0008079734829155128, 'batch_size': 32}. Best is trial 26 with value: 21.03031085049643.
Trial 350 finished with value: 206.5104259795367 and parameters: {'input_dropout': 0.15000000000000002, 'hidden_layers': 3, 'hidden_units': 96, 'kernel_initializer': 'he_normal', 'hidden_activation': 'leaky_relu', 'hidden_dropout': 0.0, 'batch_norm': 'off', 'optimizer_type': 'rmsprop', 'optimizer_lr': 0.0003192671301206853, 'batch_size': 96}. Best is trial 26 with value: 21.03031085049643.
Trial 351 finished with value: 194.77603158344854 and parameters: {'input_dropout': 0.2, 'hidden_layers': 4, 'hidden_units': 64, 'kernel_initializer': 'random_normal', 'hidden_activation': 'leaky_relu', 'hidden_dropout': 0.25, 'batch_norm': 'off', 'optimizer_type': 'adam', 'optimizer_lr': 0.0007507099139005158, 'batch_size': 32}. Best is trial 26 with value: 21.03031085049643.
Trial 352 finished with value: 161.22521298524956 and parameters: {'input_dropout': 0.15000000000000002, 'hidden_layers': 9, 'hidden_units': 128, 'kernel_initializer': 'he_uniform', 'hidden_activation': 'relu', 'hidden_dropout': 0.1, 'batch_norm': 'on', 'optimizer_type': 'adam', 'optimizer_lr': 0.002559125706427096, 'batch_size': 32}. Best is trial 26 with value: 21.03031085049643.
Trial 353 finished with value: 9472.580970356647 and parameters: {'input_dropout': 0.2, 'hidden_layers': 7, 'hidden_units': 224, 'kernel_initializer': 'random_normal', 'hidden_activation': 'leaky_relu', 'hidden_dropout': 0.05, 'batch_norm': 'on', 'optimizer_type': 'rmsprop', 'optimizer_lr': 0.0002974673638859472, 'batch_size': 128}. Best is trial 26 with value: 21.03031085049643.
Trial 354 finished with value: 2186.17351157777 and parameters: {'input_dropout': 0.2, 'hidden_layers': 9, 'hidden_units': 192, 'kernel_initializer': 'he_normal', 'hidden_activation': 'prelu', 'hidden_dropout': 0.2, 'batch_norm': 'off', 'optimizer_type': 'rmsprop', 'optimizer_lr': 0.00010327820457525648, 'batch_size': 32}. Best is trial 26 with value: 21.03031085049643.
Trial 355 finished with value: 18636.575485328307 and parameters: {'input_dropout': 0.05, 'hidden_layers': 4, 'hidden_units': 192, 'kernel_initializer': 'he_normal', 'hidden_activation': 'prelu', 'hidden_dropout': 0.15000000000000002, 'batch_norm': 'on', 'optimizer_type': 'rmsprop', 'optimizer_lr': 0.00013074854756672244, 'batch_size': 128}. Best is trial 26 with value: 21.03031085049643.
Trial 356 finished with value: 201.66819589800917 and parameters: {'input_dropout': 0.0, 'hidden_layers': 4, 'hidden_units': 96, 'kernel_initializer': 'he_normal', 'hidden_activation': 'prelu', 'hidden_dropout': 0.15000000000000002, 'batch_norm': 'off', 'optimizer_type': 'adam', 'optimizer_lr': 0.00046022967997086286, 'batch_size': 96}. Best is trial 26 with value: 21.03031085049643.
Trial 357 finished with value: 157.1673742193712 and parameters: {'input_dropout': 0.15000000000000002, 'hidden_layers': 3, 'hidden_units': 160, 'kernel_initializer': 'random_normal', 'hidden_activation': 'relu', 'hidden_dropout': 0.3, 'batch_norm': 'on', 'optimizer_type': 'adam', 'optimizer_lr': 0.0012129460904448668, 'batch_size': 96}. Best is trial 26 with value: 21.03031085049643.
Trial 358 finished with value: 144.0929957883772 and parameters: {'input_dropout': 0.15000000000000002, 'hidden_layers': 10, 'hidden_units': 192, 'kernel_initializer': 'he_uniform', 'hidden_activation': 'relu', 'hidden_dropout': 0.2, 'batch_norm': 'on', 'optimizer_type': 'rmsprop', 'optimizer_lr': 0.001586922209574223, 'batch_size': 64}. Best is trial 26 with value: 21.03031085049643.
Trial 359 finished with value: 173.14250562242464 and parameters: {'input_dropout': 0.15000000000000002, 'hidden_layers': 3, 'hidden_units': 192, 'kernel_initializer': 'he_uniform', 'hidden_activation': 'prelu', 'hidden_dropout': 0.2, 'batch_norm': 'on', 'optimizer_type': 'rmsprop', 'optimizer_lr': 0.0008340582436818706, 'batch_size': 32}. Best is trial 26 with value: 21.03031085049643.
Trial 360 finished with value: 131.40037646702626 and parameters: {'input_dropout': 0.05, 'hidden_layers': 10, 'hidden_units': 160, 'kernel_initializer': 'random_normal', 'hidden_activation': 'leaky_relu', 'hidden_dropout': 0.15000000000000002, 'batch_norm': 'off', 'optimizer_type': 'adam', 'optimizer_lr': 0.00030404046297043786, 'batch_size': 64}. Best is trial 26 with value: 21.03031085049643.
Trial 361 finished with value: 137.75812125885 and parameters: {'input_dropout': 0.1, 'hidden_layers': 3, 'hidden_units': 224, 'kernel_initializer': 'he_normal', 'hidden_activation': 'relu', 'hidden_dropout': 0.05, 'batch_norm': 'off', 'optimizer_type': 'adam', 'optimizer_lr': 0.0005871194303545961, 'batch_size': 32}. Best is trial 26 with value: 21.03031085049643.
Trial 362 finished with value: 4905.984076059251 and parameters: {'input_dropout': 0.15000000000000002, 'hidden_layers': 10, 'hidden_units': 128, 'kernel_initializer': 'he_normal', 'hidden_activation': 'prelu', 'hidden_dropout': 0.05, 'batch_norm': 'on', 'optimizer_type': 'adam', 'optimizer_lr': 0.00021004094002020422, 'batch_size': 32}. Best is trial 26 with value: 21.03031085049643.
Trial 363 finished with value: 107.1046390421587 and parameters: {'input_dropout': 0.0, 'hidden_layers': 5, 'hidden_units': 160, 'kernel_initializer': 'random_normal', 'hidden_activation': 'prelu', 'hidden_dropout': 0.25, 'batch_norm': 'off', 'optimizer_type': 'rmsprop', 'optimizer_lr': 0.0007662233955867471, 'batch_size': 32}. Best is trial 26 with value: 21.03031085049643.
Trial 364 finished with value: 165.0426403843445 and parameters: {'input_dropout': 0.2, 'hidden_layers': 9, 'hidden_units': 256, 'kernel_initializer': 'random_normal', 'hidden_activation': 'leaky_relu', 'hidden_dropout': 0.05, 'batch_norm': 'on', 'optimizer_type': 'adam', 'optimizer_lr': 0.0008588095973119592, 'batch_size': 32}. Best is trial 26 with value: 21.03031085049643.
Trial 365 finished with value: 273.1782076175679 and parameters: {'input_dropout': 0.15000000000000002, 'hidden_layers': 8, 'hidden_units': 256, 'kernel_initializer': 'he_uniform', 'hidden_activation': 'prelu', 'hidden_dropout': 0.25, 'batch_norm': 'off', 'optimizer_type': 'rmsprop', 'optimizer_lr': 0.008954983583141639, 'batch_size': 128}. Best is trial 26 with value: 21.03031085049643.
Trial 366 finished with value: 11834.715088945679 and parameters: {'input_dropout': 0.0, 'hidden_layers': 10, 'hidden_units': 128, 'kernel_initializer': 'he_normal', 'hidden_activation': 'prelu', 'hidden_dropout': 0.0, 'batch_norm': 'on', 'optimizer_type': 'adam', 'optimizer_lr': 0.00023819283748187663, 'batch_size': 96}. Best is trial 26 with value: 21.03031085049643.
Trial 367 finished with value: 206.5525210917429 and parameters: {'input_dropout': 0.15000000000000002, 'hidden_layers': 4, 'hidden_units': 160, 'kernel_initializer': 'he_uniform', 'hidden_activation': 'leaky_relu', 'hidden_dropout': 0.3, 'batch_norm': 'off', 'optimizer_type': 'rmsprop', 'optimizer_lr': 0.007203448975778769, 'batch_size': 96}. Best is trial 26 with value: 21.03031085049643.
Trial 368 finished with value: 18388.175021491556 and parameters: {'input_dropout': 0.15000000000000002, 'hidden_layers': 8, 'hidden_units': 192, 'kernel_initializer': 'he_normal', 'hidden_activation': 'leaky_relu', 'hidden_dropout': 0.05, 'batch_norm': 'on', 'optimizer_type': 'rmsprop', 'optimizer_lr': 0.00012116822913523802, 'batch_size': 96}. Best is trial 26 with value: 21.03031085049643.
Trial 369 finished with value: 51.27539077360541 and parameters: {'input_dropout': 0.05, 'hidden_layers': 4, 'hidden_units': 224, 'kernel_initializer': 'he_normal', 'hidden_activation': 'leaky_relu', 'hidden_dropout': 0.1, 'batch_norm': 'on', 'optimizer_type': 'rmsprop', 'optimizer_lr': 0.004284024016138453, 'batch_size': 96}. Best is trial 26 with value: 21.03031085049643.
Trial 370 finished with value: 2457.8680922934795 and parameters: {'input_dropout': 0.15000000000000002, 'hidden_layers': 7, 'hidden_units': 160, 'kernel_initializer': 'he_normal', 'hidden_activation': 'leaky_relu', 'hidden_dropout': 0.3, 'batch_norm': 'off', 'optimizer_type': 'rmsprop', 'optimizer_lr': 0.0008461764368354798, 'batch_size': 32}. Best is trial 26 with value: 21.03031085049643.
Trial 371 finished with value: 229.87411969721535 and parameters: {'input_dropout': 0.2, 'hidden_layers': 8, 'hidden_units': 224, 'kernel_initializer': 'he_uniform', 'hidden_activation': 'prelu', 'hidden_dropout': 0.0, 'batch_norm': 'off', 'optimizer_type': 'adam', 'optimizer_lr': 0.0006854846331914586, 'batch_size': 64}. Best is trial 26 with value: 21.03031085049643.
Trial 372 finished with value: 138.26217340473934 and parameters: {'input_dropout': 0.0, 'hidden_layers': 10, 'hidden_units': 64, 'kernel_initializer': 'he_uniform', 'hidden_activation': 'leaky_relu', 'hidden_dropout': 0.05, 'batch_norm': 'on', 'optimizer_type': 'adam', 'optimizer_lr': 0.00312652346858777, 'batch_size': 64}. Best is trial 26 with value: 21.03031085049643.
Trial 373 finished with value: 18739.95313978471 and parameters: {'input_dropout': 0.1, 'hidden_layers': 10, 'hidden_units': 192, 'kernel_initializer': 'random_normal', 'hidden_activation': 'relu', 'hidden_dropout': 0.0, 'batch_norm': 'on', 'optimizer_type': 'adam', 'optimizer_lr': 0.0001241227349182276, 'batch_size': 128}. Best is trial 26 with value: 21.03031085049643.
Trial 374 finished with value: 588.7304563538733 and parameters: {'input_dropout': 0.2, 'hidden_layers': 5, 'hidden_units': 96, 'kernel_initializer': 'random_normal', 'hidden_activation': 'relu', 'hidden_dropout': 0.1, 'batch_norm': 'on', 'optimizer_type': 'rmsprop', 'optimizer_lr': 0.0006376987201560845, 'batch_size': 96}. Best is trial 26 with value: 21.03031085049643.
Trial 375 finished with value: 120.21495753552529 and parameters: {'input_dropout': 0.05, 'hidden_layers': 3, 'hidden_units': 192, 'kernel_initializer': 'random_normal', 'hidden_activation': 'leaky_relu', 'hidden_dropout': 0.15000000000000002, 'batch_norm': 'on', 'optimizer_type': 'rmsprop', 'optimizer_lr': 0.0006471437050261968, 'batch_size': 96}. Best is trial 26 with value: 21.03031085049643.
Trial 376 finished with value: 183.3839419053325 and parameters: {'input_dropout': 0.2, 'hidden_layers': 10, 'hidden_units': 224, 'kernel_initializer': 'random_normal', 'hidden_activation': 'leaky_relu', 'hidden_dropout': 0.2, 'batch_norm': 'off', 'optimizer_type': 'adam', 'optimizer_lr': 0.00691111550328631, 'batch_size': 96}. Best is trial 26 with value: 21.03031085049643.
Trial 377 finished with value: 170.9985144382842 and parameters: {'input_dropout': 0.2, 'hidden_layers': 9, 'hidden_units': 96, 'kernel_initializer': 'random_normal', 'hidden_activation': 'leaky_relu', 'hidden_dropout': 0.15000000000000002, 'batch_norm': 'off', 'optimizer_type': 'rmsprop', 'optimizer_lr': 0.0009911285417556614, 'batch_size': 32}. Best is trial 26 with value: 21.03031085049643.
Trial 378 finished with value: 226.0034393206084 and parameters: {'input_dropout': 0.1, 'hidden_layers': 3, 'hidden_units': 128, 'kernel_initializer': 'he_normal', 'hidden_activation': 'prelu', 'hidden_dropout': 0.15000000000000002, 'batch_norm': 'off', 'optimizer_type': 'adam', 'optimizer_lr': 0.0001260195662606529, 'batch_size': 32}. Best is trial 26 with value: 21.03031085049643.
Trial 379 finished with value: 137.45170241610478 and parameters: {'input_dropout': 0.1, 'hidden_layers': 10, 'hidden_units': 160, 'kernel_initializer': 'he_normal', 'hidden_activation': 'prelu', 'hidden_dropout': 0.0, 'batch_norm': 'off', 'optimizer_type': 'rmsprop', 'optimizer_lr': 0.0015655956650433484, 'batch_size': 64}. Best is trial 26 with value: 21.03031085049643.
Trial 380 finished with value: 138.94789310797455 and parameters: {'input_dropout': 0.0, 'hidden_layers': 9, 'hidden_units': 128, 'kernel_initializer': 'random_normal', 'hidden_activation': 'leaky_relu', 'hidden_dropout': 0.2, 'batch_norm': 'off', 'optimizer_type': 'adam', 'optimizer_lr': 0.007101513066490023, 'batch_size': 32}. Best is trial 26 with value: 21.03031085049643.
Trial 381 finished with value: 21167.704749072265 and parameters: {'input_dropout': 0.15000000000000002, 'hidden_layers': 6, 'hidden_units': 32, 'kernel_initializer': 'he_uniform', 'hidden_activation': 'relu', 'hidden_dropout': 0.25, 'batch_norm': 'on', 'optimizer_type': 'rmsprop', 'optimizer_lr': 0.000222904462835632, 'batch_size': 64}. Best is trial 26 with value: 21.03031085049643.
Trial 382 finished with value: 115.54642017413991 and parameters: {'input_dropout': 0.05, 'hidden_layers': 5, 'hidden_units': 192, 'kernel_initializer': 'he_uniform', 'hidden_activation': 'leaky_relu', 'hidden_dropout': 0.1, 'batch_norm': 'off', 'optimizer_type': 'adam', 'optimizer_lr': 0.008745617981405858, 'batch_size': 64}. Best is trial 26 with value: 21.03031085049643.
Trial 383 finished with value: 195.88812100417297 and parameters: {'input_dropout': 0.05, 'hidden_layers': 5, 'hidden_units': 32, 'kernel_initializer': 'random_normal', 'hidden_activation': 'prelu', 'hidden_dropout': 0.25, 'batch_norm': 'off', 'optimizer_type': 'rmsprop', 'optimizer_lr': 0.0010391581811362606, 'batch_size': 128}. Best is trial 26 with value: 21.03031085049643.
Trial 384 finished with value: 17613.571523558338 and parameters: {'input_dropout': 0.15000000000000002, 'hidden_layers': 6, 'hidden_units': 96, 'kernel_initializer': 'random_normal', 'hidden_activation': 'relu', 'hidden_dropout': 0.3, 'batch_norm': 'on', 'optimizer_type': 'rmsprop', 'optimizer_lr': 0.0002647219479143746, 'batch_size': 128}. Best is trial 26 with value: 21.03031085049643.
Trial 385 finished with value: 9669.122263460129 and parameters: {'input_dropout': 0.1, 'hidden_layers': 7, 'hidden_units': 64, 'kernel_initializer': 'he_normal', 'hidden_activation': 'relu', 'hidden_dropout': 0.25, 'batch_norm': 'on', 'optimizer_type': 'rmsprop', 'optimizer_lr': 0.00021955480634220723, 'batch_size': 32}. Best is trial 26 with value: 21.03031085049643.
Trial 386 finished with value: 788.4527416184372 and parameters: {'input_dropout': 0.2, 'hidden_layers': 8, 'hidden_units': 256, 'kernel_initializer': 'random_normal', 'hidden_activation': 'leaky_relu', 'hidden_dropout': 0.05, 'batch_norm': 'on', 'optimizer_type': 'adam', 'optimizer_lr': 0.009985344595904473, 'batch_size': 128}. Best is trial 26 with value: 21.03031085049643.
Trial 387 finished with value: 218.6812657722885 and parameters: {'input_dropout': 0.2, 'hidden_layers': 8, 'hidden_units': 128, 'kernel_initializer': 'random_normal', 'hidden_activation': 'leaky_relu', 'hidden_dropout': 0.05, 'batch_norm': 'off', 'optimizer_type': 'adam', 'optimizer_lr': 0.00013707568036535204, 'batch_size': 64}. Best is trial 26 with value: 21.03031085049643.
Trial 388 finished with value: 120.26105832190059 and parameters: {'input_dropout': 0.0, 'hidden_layers': 5, 'hidden_units': 256, 'kernel_initializer': 'he_uniform', 'hidden_activation': 'relu', 'hidden_dropout': 0.05, 'batch_norm': 'off', 'optimizer_type': 'rmsprop', 'optimizer_lr': 0.0009419581336097784, 'batch_size': 96}. Best is trial 26 with value: 21.03031085049643.
Trial 389 finished with value: 16673.44981343642 and parameters: {'input_dropout': 0.15000000000000002, 'hidden_layers': 10, 'hidden_units': 128, 'kernel_initializer': 'he_normal', 'hidden_activation': 'relu', 'hidden_dropout': 0.2, 'batch_norm': 'on', 'optimizer_type': 'rmsprop', 'optimizer_lr': 0.00015306874627945207, 'batch_size': 96}. Best is trial 26 with value: 21.03031085049643.
Trial 390 finished with value: 16.963969438912468 and parameters: {'input_dropout': 0.0, 'hidden_layers': 9, 'hidden_units': 224, 'kernel_initializer': 'he_uniform', 'hidden_activation': 'relu', 'hidden_dropout': 0.0, 'batch_norm': 'on', 'optimizer_type': 'rmsprop', 'optimizer_lr': 0.0014261315114980893, 'batch_size': 64}. Best is trial 390 with value: 16.963969438912468.
Trial 391 finished with value: 298.62652395544023 and parameters: {'input_dropout': 0.0, 'hidden_layers': 3, 'hidden_units': 32, 'kernel_initializer': 'he_normal', 'hidden_activation': 'relu', 'hidden_dropout': 0.3, 'batch_norm': 'off', 'optimizer_type': 'adam', 'optimizer_lr': 0.00043640033188622785, 'batch_size': 64}. Best is trial 390 with value: 16.963969438912468.
Trial 392 finished with value: 9372.49037022331 and parameters: {'input_dropout': 0.2, 'hidden_layers': 4, 'hidden_units': 96, 'kernel_initializer': 'he_normal', 'hidden_activation': 'leaky_relu', 'hidden_dropout': 0.0, 'batch_norm': 'on', 'optimizer_type': 'adam', 'optimizer_lr': 0.00019744003257243743, 'batch_size': 32}. Best is trial 390 with value: 16.963969438912468.
Trial 393 finished with value: 149.36977034003945 and parameters: {'input_dropout': 0.05, 'hidden_layers': 9, 'hidden_units': 224, 'kernel_initializer': 'random_normal', 'hidden_activation': 'prelu', 'hidden_dropout': 0.15000000000000002, 'batch_norm': 'on', 'optimizer_type': 'rmsprop', 'optimizer_lr': 0.0008523751225441794, 'batch_size': 32}. Best is trial 390 with value: 16.963969438912468.
Trial 394 finished with value: 166.8904172244354 and parameters: {'input_dropout': 0.2, 'hidden_layers': 8, 'hidden_units': 96, 'kernel_initializer': 'random_normal', 'hidden_activation': 'prelu', 'hidden_dropout': 0.2, 'batch_norm': 'off', 'optimizer_type': 'rmsprop', 'optimizer_lr': 0.001879854659362432, 'batch_size': 96}. Best is trial 390 with value: 16.963969438912468.
Trial 395 finished with value: 6115.077102672806 and parameters: {'input_dropout': 0.05, 'hidden_layers': 3, 'hidden_units': 224, 'kernel_initializer': 'random_normal', 'hidden_activation': 'leaky_relu', 'hidden_dropout': 0.0, 'batch_norm': 'on', 'optimizer_type': 'adam', 'optimizer_lr': 0.00031324338726555366, 'batch_size': 96}. Best is trial 390 with value: 16.963969438912468.
Trial 396 finished with value: 205.25937736569827 and parameters: {'input_dropout': 0.2, 'hidden_layers': 6, 'hidden_units': 256, 'kernel_initializer': 'random_normal', 'hidden_activation': 'leaky_relu', 'hidden_dropout': 0.0, 'batch_norm': 'on', 'optimizer_type': 'rmsprop', 'optimizer_lr': 0.005253546386400544, 'batch_size': 64}. Best is trial 390 with value: 16.963969438912468.
Trial 397 finished with value: 229.19079317931636 and parameters: {'input_dropout': 0.15000000000000002, 'hidden_layers': 5, 'hidden_units': 96, 'kernel_initializer': 'he_normal', 'hidden_activation': 'relu', 'hidden_dropout': 0.3, 'batch_norm': 'on', 'optimizer_type': 'rmsprop', 'optimizer_lr': 0.001057759125950619, 'batch_size': 64}. Best is trial 390 with value: 16.963969438912468.
Trial 398 finished with value: 135.22374801626006 and parameters: {'input_dropout': 0.1, 'hidden_layers': 8, 'hidden_units': 256, 'kernel_initializer': 'random_normal', 'hidden_activation': 'leaky_relu', 'hidden_dropout': 0.15000000000000002, 'batch_norm': 'off', 'optimizer_type': 'adam', 'optimizer_lr': 0.0063721240452774405, 'batch_size': 128}. Best is trial 390 with value: 16.963969438912468.
Trial 399 finished with value: 125.10693088870119 and parameters: {'input_dropout': 0.0, 'hidden_layers': 5, 'hidden_units': 64, 'kernel_initializer': 'random_normal', 'hidden_activation': 'relu', 'hidden_dropout': 0.05, 'batch_norm': 'off', 'optimizer_type': 'rmsprop', 'optimizer_lr': 0.001998531210945297, 'batch_size': 128}. Best is trial 390 with value: 16.963969438912468.
Trial 400 finished with value: 95.055870774871 and parameters: {'input_dropout': 0.05, 'hidden_layers': 3, 'hidden_units': 64, 'kernel_initializer': 'he_uniform', 'hidden_activation': 'leaky_relu', 'hidden_dropout': 0.0, 'batch_norm': 'off', 'optimizer_type': 'adam', 'optimizer_lr': 0.006623888781658557, 'batch_size': 96}. Best is trial 390 with value: 16.963969438912468.
