Trial 971 finished with value: 109.6219494298802 and parameters: {'input_dropout': 0.15000000000000002, 'hidden_layers': 3, 'hidden_units': 128, 'kernel_initializer': 'random_normal', 'hidden_activation': 'relu', 'hidden_dropout': 0.05, 'batch_norm': 'on', 'optimizer_type': 'rmsprop', 'optimizer_lr': 0.003743376947695594, 'batch_size': 64}. Best is trial 390 with value: 16.963969438912468.
Trial 972 finished with value: 2637.5370441836108 and parameters: {'input_dropout': 0.15000000000000002, 'hidden_layers': 9, 'hidden_units': 32, 'kernel_initializer': 'he_normal', 'hidden_activation': 'relu', 'hidden_dropout': 0.3, 'batch_norm': 'on', 'optimizer_type': 'adam', 'optimizer_lr': 0.001866636659760707, 'batch_size': 128}. Best is trial 390 with value: 16.963969438912468.
Trial 973 finished with value: 123.07450784255931 and parameters: {'input_dropout': 0.0, 'hidden_layers': 8, 'hidden_units': 192, 'kernel_initializer': 'random_normal', 'hidden_activation': 'prelu', 'hidden_dropout': 0.25, 'batch_norm': 'off', 'optimizer_type': 'rmsprop', 'optimizer_lr': 0.00024371298014151666, 'batch_size': 64}. Best is trial 390 with value: 16.963969438912468.
Trial 974 finished with value: 375.5254682811786 and parameters: {'input_dropout': 0.1, 'hidden_layers': 9, 'hidden_units': 96, 'kernel_initializer': 'random_normal', 'hidden_activation': 'relu', 'hidden_dropout': 0.0, 'batch_norm': 'on', 'optimizer_type': 'adam', 'optimizer_lr': 0.0004861970644032899, 'batch_size': 64}. Best is trial 390 with value: 16.963969438912468.
Trial 975 finished with value: 2365.100392266971 and parameters: {'input_dropout': 0.05, 'hidden_layers': 10, 'hidden_units': 32, 'kernel_initializer': 'he_normal', 'hidden_activation': 'prelu', 'hidden_dropout': 0.15000000000000002, 'batch_norm': 'off', 'optimizer_type': 'rmsprop', 'optimizer_lr': 0.0032972914763357685, 'batch_size': 96}. Best is trial 390 with value: 16.963969438912468.
Trial 976 finished with value: 117.62470707778192 and parameters: {'input_dropout': 0.1, 'hidden_layers': 4, 'hidden_units': 160, 'kernel_initializer': 'he_normal', 'hidden_activation': 'prelu', 'hidden_dropout': 0.15000000000000002, 'batch_norm': 'on', 'optimizer_type': 'adam', 'optimizer_lr': 0.0049732958348657225, 'batch_size': 128}. Best is trial 390 with value: 16.963969438912468.
Trial 977 finished with value: 72.49280596231948 and parameters: {'input_dropout': 0.0, 'hidden_layers': 4, 'hidden_units': 160, 'kernel_initializer': 'he_uniform', 'hidden_activation': 'prelu', 'hidden_dropout': 0.05, 'batch_norm': 'off', 'optimizer_type': 'adam', 'optimizer_lr': 0.00699119254089262, 'batch_size': 96}. Best is trial 390 with value: 16.963969438912468.
Trial 978 finished with value: 170.4379451775424 and parameters: {'input_dropout': 0.05, 'hidden_layers': 10, 'hidden_units': 64, 'kernel_initializer': 'he_uniform', 'hidden_activation': 'relu', 'hidden_dropout': 0.1, 'batch_norm': 'on', 'optimizer_type': 'rmsprop', 'optimizer_lr': 0.001894130883224553, 'batch_size': 32}. Best is trial 390 with value: 16.963969438912468.
Trial 979 finished with value: 122.02392657445321 and parameters: {'input_dropout': 0.1, 'hidden_layers': 4, 'hidden_units': 256, 'kernel_initializer': 'he_uniform', 'hidden_activation': 'relu', 'hidden_dropout': 0.3, 'batch_norm': 'on', 'optimizer_type': 'adam', 'optimizer_lr': 0.0034935153369960933, 'batch_size': 32}. Best is trial 390 with value: 16.963969438912468.
Trial 980 finished with value: 268.5246035431866 and parameters: {'input_dropout': 0.15000000000000002, 'hidden_layers': 4, 'hidden_units': 32, 'kernel_initializer': 'he_normal', 'hidden_activation': 'prelu', 'hidden_dropout': 0.1, 'batch_norm': 'off', 'optimizer_type': 'rmsprop', 'optimizer_lr': 0.0008050565983166446, 'batch_size': 64}. Best is trial 390 with value: 16.963969438912468.
Trial 981 finished with value: 104.78320406804409 and parameters: {'input_dropout': 0.2, 'hidden_layers': 8, 'hidden_units': 160, 'kernel_initializer': 'random_normal', 'hidden_activation': 'leaky_relu', 'hidden_dropout': 0.0, 'batch_norm': 'on', 'optimizer_type': 'adam', 'optimizer_lr': 0.0023763746400399595, 'batch_size': 64}. Best is trial 390 with value: 16.963969438912468.
Trial 982 finished with value: 4760.610955882461 and parameters: {'input_dropout': 0.15000000000000002, 'hidden_layers': 4, 'hidden_units': 96, 'kernel_initializer': 'he_normal', 'hidden_activation': 'relu', 'hidden_dropout': 0.0, 'batch_norm': 'on', 'optimizer_type': 'adam', 'optimizer_lr': 0.0007999495755037807, 'batch_size': 96}. Best is trial 390 with value: 16.963969438912468.
Trial 983 finished with value: 161.62641867768144 and parameters: {'input_dropout': 0.1, 'hidden_layers': 8, 'hidden_units': 64, 'kernel_initializer': 'he_uniform', 'hidden_activation': 'relu', 'hidden_dropout': 0.1, 'batch_norm': 'on', 'optimizer_type': 'rmsprop', 'optimizer_lr': 0.0012594580592543063, 'batch_size': 32}. Best is trial 390 with value: 16.963969438912468.
Trial 984 finished with value: 571.998994730961 and parameters: {'input_dropout': 0.05, 'hidden_layers': 6, 'hidden_units': 96, 'kernel_initializer': 'he_uniform', 'hidden_activation': 'leaky_relu', 'hidden_dropout': 0.3, 'batch_norm': 'off', 'optimizer_type': 'rmsprop', 'optimizer_lr': 0.0016913674485192695, 'batch_size': 128}. Best is trial 390 with value: 16.963969438912468.
Trial 985 finished with value: 121.69985515338676 and parameters: {'input_dropout': 0.2, 'hidden_layers': 4, 'hidden_units': 32, 'kernel_initializer': 'random_normal', 'hidden_activation': 'prelu', 'hidden_dropout': 0.0, 'batch_norm': 'on', 'optimizer_type': 'rmsprop', 'optimizer_lr': 0.003066841769156634, 'batch_size': 64}. Best is trial 390 with value: 16.963969438912468.
Trial 986 finished with value: 166.14579351938892 and parameters: {'input_dropout': 0.05, 'hidden_layers': 8, 'hidden_units': 128, 'kernel_initializer': 'he_normal', 'hidden_activation': 'prelu', 'hidden_dropout': 0.05, 'batch_norm': 'on', 'optimizer_type': 'rmsprop', 'optimizer_lr': 0.0006309742264156817, 'batch_size': 96}. Best is trial 390 with value: 16.963969438912468.
Trial 987 finished with value: 4780.206886213465 and parameters: {'input_dropout': 0.15000000000000002, 'hidden_layers': 10, 'hidden_units': 32, 'kernel_initializer': 'he_normal', 'hidden_activation': 'relu', 'hidden_dropout': 0.3, 'batch_norm': 'off', 'optimizer_type': 'rmsprop', 'optimizer_lr': 0.005826618267733064, 'batch_size': 96}. Best is trial 390 with value: 16.963969438912468.
Trial 988 finished with value: 121.32127304573785 and parameters: {'input_dropout': 0.15000000000000002, 'hidden_layers': 10, 'hidden_units': 128, 'kernel_initializer': 'random_normal', 'hidden_activation': 'relu', 'hidden_dropout': 0.0, 'batch_norm': 'off', 'optimizer_type': 'adam', 'optimizer_lr': 0.0084023205564368, 'batch_size': 32}. Best is trial 390 with value: 16.963969438912468.
Trial 989 finished with value: 2896.6695840057937 and parameters: {'input_dropout': 0.2, 'hidden_layers': 10, 'hidden_units': 96, 'kernel_initializer': 'he_uniform', 'hidden_activation': 'relu', 'hidden_dropout': 0.2, 'batch_norm': 'off', 'optimizer_type': 'rmsprop', 'optimizer_lr': 0.0037089475386414177, 'batch_size': 32}. Best is trial 390 with value: 16.963969438912468.
Trial 990 finished with value: 146.55320476858716 and parameters: {'input_dropout': 0.15000000000000002, 'hidden_layers': 6, 'hidden_units': 256, 'kernel_initializer': 'he_normal', 'hidden_activation': 'relu', 'hidden_dropout': 0.0, 'batch_norm': 'off', 'optimizer_type': 'rmsprop', 'optimizer_lr': 0.0005666327731052525, 'batch_size': 96}. Best is trial 390 with value: 16.963969438912468.
Trial 991 finished with value: 154.16722721125856 and parameters: {'input_dropout': 0.2, 'hidden_layers': 8, 'hidden_units': 64, 'kernel_initializer': 'random_normal', 'hidden_activation': 'leaky_relu', 'hidden_dropout': 0.0, 'batch_norm': 'on', 'optimizer_type': 'adam', 'optimizer_lr': 0.0011100535030563901, 'batch_size': 32}. Best is trial 390 with value: 16.963969438912468.
Trial 992 finished with value: 119.55817735181883 and parameters: {'input_dropout': 0.1, 'hidden_layers': 8, 'hidden_units': 256, 'kernel_initializer': 'random_normal', 'hidden_activation': 'prelu', 'hidden_dropout': 0.1, 'batch_norm': 'off', 'optimizer_type': 'adam', 'optimizer_lr': 0.0014950950891283593, 'batch_size': 128}. Best is trial 390 with value: 16.963969438912468.
Trial 993 finished with value: 90.98127198619581 and parameters: {'input_dropout': 0.0, 'hidden_layers': 7, 'hidden_units': 224, 'kernel_initializer': 'random_normal', 'hidden_activation': 'relu', 'hidden_dropout': 0.1, 'batch_norm': 'off', 'optimizer_type': 'adam', 'optimizer_lr': 0.0003378649786668782, 'batch_size': 32}. Best is trial 390 with value: 16.963969438912468.
Trial 994 finished with value: 370.4279281095809 and parameters: {'input_dropout': 0.05, 'hidden_layers': 7, 'hidden_units': 32, 'kernel_initializer': 'random_normal', 'hidden_activation': 'prelu', 'hidden_dropout': 0.25, 'batch_norm': 'on', 'optimizer_type': 'adam', 'optimizer_lr': 0.0033268308140128734, 'batch_size': 96}. Best is trial 390 with value: 16.963969438912468.
Trial 995 finished with value: 4197.202665920782 and parameters: {'input_dropout': 0.0, 'hidden_layers': 9, 'hidden_units': 224, 'kernel_initializer': 'he_normal', 'hidden_activation': 'prelu', 'hidden_dropout': 0.3, 'batch_norm': 'off', 'optimizer_type': 'adam', 'optimizer_lr': 0.00027339893160215474, 'batch_size': 32}. Best is trial 390 with value: 16.963969438912468.
Trial 996 finished with value: 42.21296922870224 and parameters: {'input_dropout': 0.0, 'hidden_layers': 6, 'hidden_units': 96, 'kernel_initializer': 'he_normal', 'hidden_activation': 'relu', 'hidden_dropout': 0.05, 'batch_norm': 'on', 'optimizer_type': 'rmsprop', 'optimizer_lr': 0.0020006876317261836, 'batch_size': 96}. Best is trial 390 with value: 16.963969438912468.
Trial 997 finished with value: 227.8852180199338 and parameters: {'input_dropout': 0.0, 'hidden_layers': 6, 'hidden_units': 160, 'kernel_initializer': 'he_normal', 'hidden_activation': 'prelu', 'hidden_dropout': 0.2, 'batch_norm': 'on', 'optimizer_type': 'adam', 'optimizer_lr': 0.0004563938027672703, 'batch_size': 32}. Best is trial 390 with value: 16.963969438912468.
Trial 998 finished with value: 149.15121281820686 and parameters: {'input_dropout': 0.05, 'hidden_layers': 4, 'hidden_units': 128, 'kernel_initializer': 'random_normal', 'hidden_activation': 'leaky_relu', 'hidden_dropout': 0.25, 'batch_norm': 'off', 'optimizer_type': 'rmsprop', 'optimizer_lr': 0.00035123615523539176, 'batch_size': 128}. Best is trial 390 with value: 16.963969438912468.
Trial 999 finished with value: 719.6593528660666 and parameters: {'input_dropout': 0.0, 'hidden_layers': 6, 'hidden_units': 32, 'kernel_initializer': 'he_uniform', 'hidden_activation': 'leaky_relu', 'hidden_dropout': 0.2, 'batch_norm': 'off', 'optimizer_type': 'adam', 'optimizer_lr': 0.005057527405544268, 'batch_size': 96}. Best is trial 390 with value: 16.963969438912468.
