Trial 914 finished with value: 1622.5288618110355 and parameters: {'input_dropout': 0.0, 'hidden_layers': 6, 'hidden_units': 32, 'kernel_initializer': 'he_normal', 'hidden_activation': 'relu', 'hidden_dropout': 0.3, 'batch_norm': 'off', 'optimizer_type': 'rmsprop', 'optimizer_lr': 0.0019252917754862095, 'batch_size': 96}. Best is trial 390 with value: 16.963969438912468.
Trial 915 finished with value: 2106.9114065443773 and parameters: {'input_dropout': 0.15000000000000002, 'hidden_layers': 8, 'hidden_units': 32, 'kernel_initializer': 'he_normal', 'hidden_activation': 'relu', 'hidden_dropout': 0.2, 'batch_norm': 'off', 'optimizer_type': 'rmsprop', 'optimizer_lr': 0.002647028867493881, 'batch_size': 96}. Best is trial 390 with value: 16.963969438912468.
Trial 916 finished with value: 249.02302338175525 and parameters: {'input_dropout': 0.2, 'hidden_layers': 4, 'hidden_units': 224, 'kernel_initializer': 'he_uniform', 'hidden_activation': 'relu', 'hidden_dropout': 0.2, 'batch_norm': 'off', 'optimizer_type': 'adam', 'optimizer_lr': 0.0014531966877605505, 'batch_size': 32}. Best is trial 390 with value: 16.963969438912468.
Trial 917 finished with value: 163.3311303075556 and parameters: {'input_dropout': 0.2, 'hidden_layers': 3, 'hidden_units': 128, 'kernel_initializer': 'random_normal', 'hidden_activation': 'prelu', 'hidden_dropout': 0.2, 'batch_norm': 'off', 'optimizer_type': 'rmsprop', 'optimizer_lr': 0.0007589239457404588, 'batch_size': 32}. Best is trial 390 with value: 16.963969438912468.
Trial 918 finished with value: 252.1655883773747 and parameters: {'input_dropout': 0.05, 'hidden_layers': 8, 'hidden_units': 256, 'kernel_initializer': 'he_normal', 'hidden_activation': 'prelu', 'hidden_dropout': 0.05, 'batch_norm': 'off', 'optimizer_type': 'adam', 'optimizer_lr': 0.0001545547815367773, 'batch_size': 64}. Best is trial 390 with value: 16.963969438912468.
Trial 919 finished with value: 274.35427238464035 and parameters: {'input_dropout': 0.2, 'hidden_layers': 5, 'hidden_units': 64, 'kernel_initializer': 'he_normal', 'hidden_activation': 'prelu', 'hidden_dropout': 0.2, 'batch_norm': 'on', 'optimizer_type': 'adam', 'optimizer_lr': 0.007283356167969889, 'batch_size': 64}. Best is trial 390 with value: 16.963969438912468.
Trial 920 finished with value: 173.05577649644874 and parameters: {'input_dropout': 0.2, 'hidden_layers': 6, 'hidden_units': 96, 'kernel_initializer': 'he_uniform', 'hidden_activation': 'prelu', 'hidden_dropout': 0.2, 'batch_norm': 'on', 'optimizer_type': 'adam', 'optimizer_lr': 0.005482332682375616, 'batch_size': 32}. Best is trial 390 with value: 16.963969438912468.
Trial 921 finished with value: 618.1158442217602 and parameters: {'input_dropout': 0.2, 'hidden_layers': 4, 'hidden_units': 64, 'kernel_initializer': 'he_normal', 'hidden_activation': 'leaky_relu', 'hidden_dropout': 0.2, 'batch_norm': 'off', 'optimizer_type': 'adam', 'optimizer_lr': 0.0001076464244383873, 'batch_size': 128}. Best is trial 390 with value: 16.963969438912468.
Trial 922 finished with value: 129.63228872568098 and parameters: {'input_dropout': 0.0, 'hidden_layers': 7, 'hidden_units': 256, 'kernel_initializer': 'he_uniform', 'hidden_activation': 'leaky_relu', 'hidden_dropout': 0.0, 'batch_norm': 'on', 'optimizer_type': 'adam', 'optimizer_lr': 0.006245684818845914, 'batch_size': 128}. Best is trial 390 with value: 16.963969438912468.
Trial 923 finished with value: 110.03408081743486 and parameters: {'input_dropout': 0.15000000000000002, 'hidden_layers': 6, 'hidden_units': 160, 'kernel_initializer': 'he_normal', 'hidden_activation': 'prelu', 'hidden_dropout': 0.0, 'batch_norm': 'on', 'optimizer_type': 'rmsprop', 'optimizer_lr': 0.0005792339345279655, 'batch_size': 96}. Best is trial 390 with value: 16.963969438912468.
Trial 924 finished with value: 25.765426273050064 and parameters: {'input_dropout': 0.0, 'hidden_layers': 5, 'hidden_units': 32, 'kernel_initializer': 'he_normal', 'hidden_activation': 'prelu', 'hidden_dropout': 0.0, 'batch_norm': 'off', 'optimizer_type': 'adam', 'optimizer_lr': 0.008514685201816108, 'batch_size': 32}. Best is trial 390 with value: 16.963969438912468.
Trial 925 finished with value: 129.46271029414262 and parameters: {'input_dropout': 0.2, 'hidden_layers': 9, 'hidden_units': 224, 'kernel_initializer': 'he_normal', 'hidden_activation': 'leaky_relu', 'hidden_dropout': 0.0, 'batch_norm': 'on', 'optimizer_type': 'adam', 'optimizer_lr': 0.00033075879039354446, 'batch_size': 32}. Best is trial 390 with value: 16.963969438912468.
Trial 926 finished with value: 9101.44243086411 and parameters: {'input_dropout': 0.15000000000000002, 'hidden_layers': 6, 'hidden_units': 224, 'kernel_initializer': 'he_uniform', 'hidden_activation': 'prelu', 'hidden_dropout': 0.15000000000000002, 'batch_norm': 'on', 'optimizer_type': 'rmsprop', 'optimizer_lr': 0.0001363269631817627, 'batch_size': 32}. Best is trial 390 with value: 16.963969438912468.
Trial 927 finished with value: 272.55209006649835 and parameters: {'input_dropout': 0.1, 'hidden_layers': 10, 'hidden_units': 128, 'kernel_initializer': 'he_normal', 'hidden_activation': 'leaky_relu', 'hidden_dropout': 0.15000000000000002, 'batch_norm': 'on', 'optimizer_type': 'adam', 'optimizer_lr': 0.005361439995960914, 'batch_size': 96}. Best is trial 390 with value: 16.963969438912468.
Trial 928 finished with value: 201.89809910448645 and parameters: {'input_dropout': 0.2, 'hidden_layers': 10, 'hidden_units': 256, 'kernel_initializer': 'he_normal', 'hidden_activation': 'prelu', 'hidden_dropout': 0.3, 'batch_norm': 'on', 'optimizer_type': 'rmsprop', 'optimizer_lr': 0.001133781804008592, 'batch_size': 64}. Best is trial 390 with value: 16.963969438912468.
Trial 929 finished with value: 143.5073341112856 and parameters: {'input_dropout': 0.0, 'hidden_layers': 3, 'hidden_units': 64, 'kernel_initializer': 'random_normal', 'hidden_activation': 'leaky_relu', 'hidden_dropout': 0.25, 'batch_norm': 'off', 'optimizer_type': 'adam', 'optimizer_lr': 0.0015131405877773258, 'batch_size': 64}. Best is trial 390 with value: 16.963969438912468.
Trial 930 finished with value: 194.88964085385828 and parameters: {'input_dropout': 0.2, 'hidden_layers': 9, 'hidden_units': 224, 'kernel_initializer': 'he_uniform', 'hidden_activation': 'prelu', 'hidden_dropout': 0.05, 'batch_norm': 'off', 'optimizer_type': 'rmsprop', 'optimizer_lr': 0.000711892366569499, 'batch_size': 128}. Best is trial 390 with value: 16.963969438912468.
Trial 931 finished with value: 52.63748991089283 and parameters: {'input_dropout': 0.0, 'hidden_layers': 3, 'hidden_units': 96, 'kernel_initializer': 'random_normal', 'hidden_activation': 'leaky_relu', 'hidden_dropout': 0.1, 'batch_norm': 'on', 'optimizer_type': 'rmsprop', 'optimizer_lr': 0.009263302685329778, 'batch_size': 96}. Best is trial 390 with value: 16.963969438912468.
Trial 932 finished with value: 15228.72864993513 and parameters: {'input_dropout': 0.2, 'hidden_layers': 8, 'hidden_units': 224, 'kernel_initializer': 'random_normal', 'hidden_activation': 'leaky_relu', 'hidden_dropout': 0.25, 'batch_norm': 'on', 'optimizer_type': 'rmsprop', 'optimizer_lr': 0.0002172425704620075, 'batch_size': 96}. Best is trial 390 with value: 16.963969438912468.
Trial 933 finished with value: 172.4391717089911 and parameters: {'input_dropout': 0.05, 'hidden_layers': 8, 'hidden_units': 192, 'kernel_initializer': 'he_uniform', 'hidden_activation': 'relu', 'hidden_dropout': 0.3, 'batch_norm': 'on', 'optimizer_type': 'adam', 'optimizer_lr': 0.001698929017615432, 'batch_size': 64}. Best is trial 390 with value: 16.963969438912468.
Trial 934 finished with value: 254.0756864521243 and parameters: {'input_dropout': 0.1, 'hidden_layers': 3, 'hidden_units': 64, 'kernel_initializer': 'he_uniform', 'hidden_activation': 'prelu', 'hidden_dropout': 0.1, 'batch_norm': 'on', 'optimizer_type': 'rmsprop', 'optimizer_lr': 0.00032652753011493737, 'batch_size': 32}. Best is trial 390 with value: 16.963969438912468.
Trial 935 finished with value: 189.0340390433876 and parameters: {'input_dropout': 0.2, 'hidden_layers': 7, 'hidden_units': 128, 'kernel_initializer': 'random_normal', 'hidden_activation': 'prelu', 'hidden_dropout': 0.0, 'batch_norm': 'off', 'optimizer_type': 'adam', 'optimizer_lr': 0.00044111563659133033, 'batch_size': 64}. Best is trial 390 with value: 16.963969438912468.
Trial 936 finished with value: 14029.373932079143 and parameters: {'input_dropout': 0.2, 'hidden_layers': 3, 'hidden_units': 256, 'kernel_initializer': 'he_normal', 'hidden_activation': 'leaky_relu', 'hidden_dropout': 0.0, 'batch_norm': 'on', 'optimizer_type': 'rmsprop', 'optimizer_lr': 0.000197486526793706, 'batch_size': 128}. Best is trial 390 with value: 16.963969438912468.
Trial 937 finished with value: 195.90780107083532 and parameters: {'input_dropout': 0.2, 'hidden_layers': 6, 'hidden_units': 96, 'kernel_initializer': 'he_uniform', 'hidden_activation': 'relu', 'hidden_dropout': 0.3, 'batch_norm': 'on', 'optimizer_type': 'adam', 'optimizer_lr': 0.005834292027732083, 'batch_size': 128}. Best is trial 390 with value: 16.963969438912468.
Trial 938 finished with value: 4875.292253253785 and parameters: {'input_dropout': 0.0, 'hidden_layers': 10, 'hidden_units': 256, 'kernel_initializer': 'he_uniform', 'hidden_activation': 'leaky_relu', 'hidden_dropout': 0.1, 'batch_norm': 'on', 'optimizer_type': 'adam', 'optimizer_lr': 0.0001811272417711235, 'batch_size': 32}. Best is trial 390 with value: 16.963969438912468.
Trial 939 finished with value: 203.77964403769755 and parameters: {'input_dropout': 0.2, 'hidden_layers': 5, 'hidden_units': 256, 'kernel_initializer': 'he_uniform', 'hidden_activation': 'prelu', 'hidden_dropout': 0.05, 'batch_norm': 'off', 'optimizer_type': 'rmsprop', 'optimizer_lr': 0.0002747865491485374, 'batch_size': 64}. Best is trial 390 with value: 16.963969438912468.
Trial 940 finished with value: 16351.46892353599 and parameters: {'input_dropout': 0.15000000000000002, 'hidden_layers': 3, 'hidden_units': 96, 'kernel_initializer': 'random_normal', 'hidden_activation': 'leaky_relu', 'hidden_dropout': 0.05, 'batch_norm': 'on', 'optimizer_type': 'adam', 'optimizer_lr': 0.00019712799657303342, 'batch_size': 96}. Best is trial 390 with value: 16.963969438912468.
Trial 941 finished with value: 329.22510551823683 and parameters: {'input_dropout': 0.15000000000000002, 'hidden_layers': 3, 'hidden_units': 32, 'kernel_initializer': 'he_uniform', 'hidden_activation': 'prelu', 'hidden_dropout': 0.05, 'batch_norm': 'off', 'optimizer_type': 'adam', 'optimizer_lr': 0.0006805463262203713, 'batch_size': 128}. Best is trial 390 with value: 16.963969438912468.
Trial 942 finished with value: 140.8561268496445 and parameters: {'input_dropout': 0.1, 'hidden_layers': 4, 'hidden_units': 160, 'kernel_initializer': 'random_normal', 'hidden_activation': 'prelu', 'hidden_dropout': 0.25, 'batch_norm': 'off', 'optimizer_type': 'rmsprop', 'optimizer_lr': 0.000640928909644902, 'batch_size': 64}. Best is trial 390 with value: 16.963969438912468.
Trial 943 finished with value: 215.99994287057206 and parameters: {'input_dropout': 0.15000000000000002, 'hidden_layers': 8, 'hidden_units': 256, 'kernel_initializer': 'he_uniform', 'hidden_activation': 'leaky_relu', 'hidden_dropout': 0.05, 'batch_norm': 'off', 'optimizer_type': 'rmsprop', 'optimizer_lr': 0.00013050869376386053, 'batch_size': 64}. Best is trial 390 with value: 16.963969438912468.
Trial 944 finished with value: 97.11775298256391 and parameters: {'input_dropout': 0.0, 'hidden_layers': 3, 'hidden_units': 224, 'kernel_initializer': 'he_normal', 'hidden_activation': 'leaky_relu', 'hidden_dropout': 0.2, 'batch_norm': 'off', 'optimizer_type': 'adam', 'optimizer_lr': 0.005263746029855269, 'batch_size': 64}. Best is trial 390 with value: 16.963969438912468.
Trial 945 finished with value: 126.29951034042112 and parameters: {'input_dropout': 0.2, 'hidden_layers': 3, 'hidden_units': 96, 'kernel_initializer': 'he_uniform', 'hidden_activation': 'leaky_relu', 'hidden_dropout': 0.1, 'batch_norm': 'on', 'optimizer_type': 'adam', 'optimizer_lr': 0.009441345898476462, 'batch_size': 96}. Best is trial 390 with value: 16.963969438912468.
Trial 946 finished with value: 324.6532378647126 and parameters: {'input_dropout': 0.2, 'hidden_layers': 6, 'hidden_units': 256, 'kernel_initializer': 'random_normal', 'hidden_activation': 'leaky_relu', 'hidden_dropout': 0.0, 'batch_norm': 'off', 'optimizer_type': 'rmsprop', 'optimizer_lr': 0.0010828681203886362, 'batch_size': 96}. Best is trial 390 with value: 16.963969438912468.
Trial 947 finished with value: 119.58321514687803 and parameters: {'input_dropout': 0.1, 'hidden_layers': 7, 'hidden_units': 224, 'kernel_initializer': 'random_normal', 'hidden_activation': 'prelu', 'hidden_dropout': 0.15000000000000002, 'batch_norm': 'on', 'optimizer_type': 'rmsprop', 'optimizer_lr': 0.003802106882726332, 'batch_size': 128}. Best is trial 390 with value: 16.963969438912468.
Trial 948 finished with value: 106.41855921499021 and parameters: {'input_dropout': 0.0, 'hidden_layers': 6, 'hidden_units': 192, 'kernel_initializer': 'random_normal', 'hidden_activation': 'leaky_relu', 'hidden_dropout': 0.1, 'batch_norm': 'off', 'optimizer_type': 'rmsprop', 'optimizer_lr': 0.00023753379581419187, 'batch_size': 64}. Best is trial 390 with value: 16.963969438912468.
Trial 949 finished with value: 138.73797721683528 and parameters: {'input_dropout': 0.15000000000000002, 'hidden_layers': 7, 'hidden_units': 256, 'kernel_initializer': 'random_normal', 'hidden_activation': 'relu', 'hidden_dropout': 0.0, 'batch_norm': 'off', 'optimizer_type': 'rmsprop', 'optimizer_lr': 0.0030961942051154654, 'batch_size': 32}. Best is trial 390 with value: 16.963969438912468.
Trial 950 finished with value: 133.37533301578188 and parameters: {'input_dropout': 0.05, 'hidden_layers': 8, 'hidden_units': 224, 'kernel_initializer': 'he_uniform', 'hidden_activation': 'relu', 'hidden_dropout': 0.1, 'batch_norm': 'on', 'optimizer_type': 'adam', 'optimizer_lr': 0.00221367381341757, 'batch_size': 128}. Best is trial 390 with value: 16.963969438912468.
Trial 951 finished with value: 1012.2442150548711 and parameters: {'input_dropout': 0.05, 'hidden_layers': 6, 'hidden_units': 160, 'kernel_initializer': 'he_uniform', 'hidden_activation': 'relu', 'hidden_dropout': 0.3, 'batch_norm': 'off', 'optimizer_type': 'rmsprop', 'optimizer_lr': 0.00036102095942142125, 'batch_size': 32}. Best is trial 390 with value: 16.963969438912468.
Trial 952 finished with value: 4683.28638248901 and parameters: {'input_dropout': 0.2, 'hidden_layers': 8, 'hidden_units': 96, 'kernel_initializer': 'he_normal', 'hidden_activation': 'relu', 'hidden_dropout': 0.3, 'batch_norm': 'off', 'optimizer_type': 'rmsprop', 'optimizer_lr': 0.00173158314256808, 'batch_size': 96}. Best is trial 390 with value: 16.963969438912468.
Trial 953 finished with value: 160.00112399958817 and parameters: {'input_dropout': 0.1, 'hidden_layers': 8, 'hidden_units': 256, 'kernel_initializer': 'he_uniform', 'hidden_activation': 'relu', 'hidden_dropout': 0.0, 'batch_norm': 'off', 'optimizer_type': 'rmsprop', 'optimizer_lr': 0.004339127196713094, 'batch_size': 64}. Best is trial 390 with value: 16.963969438912468.
Trial 954 finished with value: 253.91213948015127 and parameters: {'input_dropout': 0.05, 'hidden_layers': 8, 'hidden_units': 96, 'kernel_initializer': 'he_normal', 'hidden_activation': 'prelu', 'hidden_dropout': 0.05, 'batch_norm': 'off', 'optimizer_type': 'adam', 'optimizer_lr': 0.00023330449709515203, 'batch_size': 32}. Best is trial 390 with value: 16.963969438912468.
Trial 955 finished with value: 207.99381281206536 and parameters: {'input_dropout': 0.2, 'hidden_layers': 8, 'hidden_units': 64, 'kernel_initializer': 'random_normal', 'hidden_activation': 'relu', 'hidden_dropout': 0.15000000000000002, 'batch_norm': 'off', 'optimizer_type': 'adam', 'optimizer_lr': 0.0003447666595711358, 'batch_size': 96}. Best is trial 390 with value: 16.963969438912468.
Trial 956 finished with value: 205.65339587383417 and parameters: {'input_dropout': 0.0, 'hidden_layers': 10, 'hidden_units': 32, 'kernel_initializer': 'he_uniform', 'hidden_activation': 'relu', 'hidden_dropout': 0.2, 'batch_norm': 'on', 'optimizer_type': 'rmsprop', 'optimizer_lr': 0.007387826704203079, 'batch_size': 32}. Best is trial 390 with value: 16.963969438912468.
Trial 957 finished with value: 14260.260519441395 and parameters: {'input_dropout': 0.1, 'hidden_layers': 9, 'hidden_units': 160, 'kernel_initializer': 'he_normal', 'hidden_activation': 'prelu', 'hidden_dropout': 0.25, 'batch_norm': 'on', 'optimizer_type': 'adam', 'optimizer_lr': 0.00010987850504792853, 'batch_size': 64}. Best is trial 390 with value: 16.963969438912468.
Trial 958 finished with value: 37.41018594468777 and parameters: {'input_dropout': 0.05, 'hidden_layers': 4, 'hidden_units': 128, 'kernel_initializer': 'random_normal', 'hidden_activation': 'prelu', 'hidden_dropout': 0.0, 'batch_norm': 'on', 'optimizer_type': 'adam', 'optimizer_lr': 0.0017382092610801461, 'batch_size': 64}. Best is trial 390 with value: 16.963969438912468.
Trial 959 finished with value: 125.25346397640138 and parameters: {'input_dropout': 0.0, 'hidden_layers': 5, 'hidden_units': 128, 'kernel_initializer': 'random_normal', 'hidden_activation': 'leaky_relu', 'hidden_dropout': 0.2, 'batch_norm': 'off', 'optimizer_type': 'adam', 'optimizer_lr': 0.0005682597233326294, 'batch_size': 128}. Best is trial 390 with value: 16.963969438912468.
Trial 960 finished with value: 127.58311912925673 and parameters: {'input_dropout': 0.1, 'hidden_layers': 7, 'hidden_units': 64, 'kernel_initializer': 'random_normal', 'hidden_activation': 'prelu', 'hidden_dropout': 0.0, 'batch_norm': 'on', 'optimizer_type': 'adam', 'optimizer_lr': 0.005464935596655407, 'batch_size': 128}. Best is trial 390 with value: 16.963969438912468.
Trial 961 finished with value: 196.59331666315575 and parameters: {'input_dropout': 0.0, 'hidden_layers': 6, 'hidden_units': 160, 'kernel_initializer': 'he_uniform', 'hidden_activation': 'prelu', 'hidden_dropout': 0.3, 'batch_norm': 'off', 'optimizer_type': 'rmsprop', 'optimizer_lr': 0.008641737493563437, 'batch_size': 128}. Best is trial 390 with value: 16.963969438912468.
Trial 962 finished with value: 15263.66840544579 and parameters: {'input_dropout': 0.15000000000000002, 'hidden_layers': 9, 'hidden_units': 160, 'kernel_initializer': 'he_normal', 'hidden_activation': 'prelu', 'hidden_dropout': 0.15000000000000002, 'batch_norm': 'on', 'optimizer_type': 'rmsprop', 'optimizer_lr': 0.00012825789410436975, 'batch_size': 64}. Best is trial 390 with value: 16.963969438912468.
Trial 963 finished with value: 189.87324978570152 and parameters: {'input_dropout': 0.05, 'hidden_layers': 8, 'hidden_units': 224, 'kernel_initializer': 'he_uniform', 'hidden_activation': 'leaky_relu', 'hidden_dropout': 0.0, 'batch_norm': 'off', 'optimizer_type': 'rmsprop', 'optimizer_lr': 0.0024893175845835014, 'batch_size': 64}. Best is trial 390 with value: 16.963969438912468.
Trial 964 finished with value: 1904.320160391717 and parameters: {'input_dropout': 0.15000000000000002, 'hidden_layers': 8, 'hidden_units': 96, 'kernel_initializer': 'he_normal', 'hidden_activation': 'leaky_relu', 'hidden_dropout': 0.2, 'batch_norm': 'on', 'optimizer_type': 'rmsprop', 'optimizer_lr': 0.001009189141874925, 'batch_size': 64}. Best is trial 390 with value: 16.963969438912468.
Trial 965 finished with value: 259.3811172827466 and parameters: {'input_dropout': 0.2, 'hidden_layers': 6, 'hidden_units': 224, 'kernel_initializer': 'random_normal', 'hidden_activation': 'prelu', 'hidden_dropout': 0.3, 'batch_norm': 'on', 'optimizer_type': 'adam', 'optimizer_lr': 0.0013135634500630006, 'batch_size': 96}. Best is trial 390 with value: 16.963969438912468.
Trial 966 finished with value: 137.8802073317592 and parameters: {'input_dropout': 0.2, 'hidden_layers': 4, 'hidden_units': 160, 'kernel_initializer': 'he_normal', 'hidden_activation': 'relu', 'hidden_dropout': 0.05, 'batch_norm': 'on', 'optimizer_type': 'adam', 'optimizer_lr': 0.006220367033437491, 'batch_size': 128}. Best is trial 390 with value: 16.963969438912468.
Trial 967 finished with value: 145.39564111742428 and parameters: {'input_dropout': 0.1, 'hidden_layers': 6, 'hidden_units': 64, 'kernel_initializer': 'he_uniform', 'hidden_activation': 'prelu', 'hidden_dropout': 0.1, 'batch_norm': 'on', 'optimizer_type': 'rmsprop', 'optimizer_lr': 0.004399374647520069, 'batch_size': 64}. Best is trial 390 with value: 16.963969438912468.
Trial 968 finished with value: 14331.139105243841 and parameters: {'input_dropout': 0.2, 'hidden_layers': 10, 'hidden_units': 160, 'kernel_initializer': 'he_normal', 'hidden_activation': 'relu', 'hidden_dropout': 0.05, 'batch_norm': 'on', 'optimizer_type': 'adam', 'optimizer_lr': 0.0002801874709772745, 'batch_size': 128}. Best is trial 390 with value: 16.963969438912468.
Trial 969 finished with value: 854.0580857297515 and parameters: {'input_dropout': 0.2, 'hidden_layers': 6, 'hidden_units': 32, 'kernel_initializer': 'he_normal', 'hidden_activation': 'prelu', 'hidden_dropout': 0.25, 'batch_norm': 'off', 'optimizer_type': 'adam', 'optimizer_lr': 0.0027428888452025483, 'batch_size': 128}. Best is trial 390 with value: 16.963969438912468.
Trial 970 finished with value: 85.53239892799938 and parameters: {'input_dropout': 0.05, 'hidden_layers': 4, 'hidden_units': 192, 'kernel_initializer': 'he_uniform', 'hidden_activation': 'leaky_relu', 'hidden_dropout': 0.25, 'batch_norm': 'on', 'optimizer_type': 'rmsprop', 'optimizer_lr': 0.0073270156077941745, 'batch_size': 64}. Best is trial 390 with value: 16.963969438912468.
