Trial 857 finished with value: 153.42982174332124 and parameters: {'input_dropout': 0.05, 'hidden_layers': 8, 'hidden_units': 224, 'kernel_initializer': 'random_normal', 'hidden_activation': 'prelu', 'hidden_dropout': 0.2, 'batch_norm': 'off', 'optimizer_type': 'rmsprop', 'optimizer_lr': 0.0007447092924370704, 'batch_size': 128}. Best is trial 390 with value: 16.963969438912468.
Trial 858 finished with value: 167.70779677311225 and parameters: {'input_dropout': 0.2, 'hidden_layers': 3, 'hidden_units': 256, 'kernel_initializer': 'he_uniform', 'hidden_activation': 'relu', 'hidden_dropout': 0.25, 'batch_norm': 'on', 'optimizer_type': 'adam', 'optimizer_lr': 0.0015102230329128764, 'batch_size': 128}. Best is trial 390 with value: 16.963969438912468.
Trial 859 finished with value: 99.58359700223056 and parameters: {'input_dropout': 0.15000000000000002, 'hidden_layers': 4, 'hidden_units': 256, 'kernel_initializer': 'random_normal', 'hidden_activation': 'leaky_relu', 'hidden_dropout': 0.1, 'batch_norm': 'on', 'optimizer_type': 'rmsprop', 'optimizer_lr': 0.0010398530826878974, 'batch_size': 96}. Best is trial 390 with value: 16.963969438912468.
Trial 860 finished with value: 14472.57707776656 and parameters: {'input_dropout': 0.1, 'hidden_layers': 6, 'hidden_units': 96, 'kernel_initializer': 'random_normal', 'hidden_activation': 'prelu', 'hidden_dropout': 0.0, 'batch_norm': 'on', 'optimizer_type': 'rmsprop', 'optimizer_lr': 0.0002302030999241787, 'batch_size': 96}. Best is trial 390 with value: 16.963969438912468.
Trial 861 finished with value: 174.98963586204803 and parameters: {'input_dropout': 0.2, 'hidden_layers': 8, 'hidden_units': 224, 'kernel_initializer': 'random_normal', 'hidden_activation': 'prelu', 'hidden_dropout': 0.2, 'batch_norm': 'on', 'optimizer_type': 'adam', 'optimizer_lr': 0.008147823162670072, 'batch_size': 32}. Best is trial 390 with value: 16.963969438912468.
Trial 862 finished with value: 230.42562638942033 and parameters: {'input_dropout': 0.05, 'hidden_layers': 10, 'hidden_units': 128, 'kernel_initializer': 'random_normal', 'hidden_activation': 'prelu', 'hidden_dropout': 0.25, 'batch_norm': 'off', 'optimizer_type': 'rmsprop', 'optimizer_lr': 0.005339967824923973, 'batch_size': 64}. Best is trial 390 with value: 16.963969438912468.
Trial 863 finished with value: 14377.717531023625 and parameters: {'input_dropout': 0.05, 'hidden_layers': 4, 'hidden_units': 224, 'kernel_initializer': 'he_uniform', 'hidden_activation': 'relu', 'hidden_dropout': 0.15000000000000002, 'batch_norm': 'on', 'optimizer_type': 'rmsprop', 'optimizer_lr': 0.0002223506474919959, 'batch_size': 128}. Best is trial 390 with value: 16.963969438912468.
Trial 864 finished with value: 151.9881879611602 and parameters: {'input_dropout': 0.15000000000000002, 'hidden_layers': 8, 'hidden_units': 160, 'kernel_initializer': 'random_normal', 'hidden_activation': 'leaky_relu', 'hidden_dropout': 0.1, 'batch_norm': 'off', 'optimizer_type': 'adam', 'optimizer_lr': 0.0004938955390557965, 'batch_size': 64}. Best is trial 390 with value: 16.963969438912468.
Trial 865 finished with value: 477.1896139511882 and parameters: {'input_dropout': 0.15000000000000002, 'hidden_layers': 6, 'hidden_units': 256, 'kernel_initializer': 'he_uniform', 'hidden_activation': 'leaky_relu', 'hidden_dropout': 0.3, 'batch_norm': 'off', 'optimizer_type': 'rmsprop', 'optimizer_lr': 0.002311981251956775, 'batch_size': 32}. Best is trial 390 with value: 16.963969438912468.
Trial 866 finished with value: 3518.8027669563608 and parameters: {'input_dropout': 0.1, 'hidden_layers': 8, 'hidden_units': 192, 'kernel_initializer': 'he_normal', 'hidden_activation': 'leaky_relu', 'hidden_dropout': 0.3, 'batch_norm': 'off', 'optimizer_type': 'adam', 'optimizer_lr': 0.00019026580440754883, 'batch_size': 32}. Best is trial 390 with value: 16.963969438912468.
Trial 867 finished with value: 164.2735576853967 and parameters: {'input_dropout': 0.0, 'hidden_layers': 4, 'hidden_units': 96, 'kernel_initializer': 'random_normal', 'hidden_activation': 'leaky_relu', 'hidden_dropout': 0.25, 'batch_norm': 'off', 'optimizer_type': 'rmsprop', 'optimizer_lr': 0.00022698727759340538, 'batch_size': 64}. Best is trial 390 with value: 16.963969438912468.
Trial 868 finished with value: 16370.452826867111 and parameters: {'input_dropout': 0.05, 'hidden_layers': 8, 'hidden_units': 128, 'kernel_initializer': 'he_normal', 'hidden_activation': 'prelu', 'hidden_dropout': 0.25, 'batch_norm': 'on', 'optimizer_type': 'adam', 'optimizer_lr': 0.00010124369916134642, 'batch_size': 64}. Best is trial 390 with value: 16.963969438912468.
Trial 869 finished with value: 7188.118294277656 and parameters: {'input_dropout': 0.1, 'hidden_layers': 8, 'hidden_units': 160, 'kernel_initializer': 'he_normal', 'hidden_activation': 'relu', 'hidden_dropout': 0.25, 'batch_norm': 'on', 'optimizer_type': 'rmsprop', 'optimizer_lr': 0.0009131326693791887, 'batch_size': 96}. Best is trial 390 with value: 16.963969438912468.
Trial 870 finished with value: 171.664404926373 and parameters: {'input_dropout': 0.05, 'hidden_layers': 4, 'hidden_units': 192, 'kernel_initializer': 'he_uniform', 'hidden_activation': 'prelu', 'hidden_dropout': 0.3, 'batch_norm': 'off', 'optimizer_type': 'rmsprop', 'optimizer_lr': 0.004007861066441013, 'batch_size': 32}. Best is trial 390 with value: 16.963969438912468.
Trial 871 finished with value: 254.67972719004413 and parameters: {'input_dropout': 0.15000000000000002, 'hidden_layers': 10, 'hidden_units': 32, 'kernel_initializer': 'he_uniform', 'hidden_activation': 'leaky_relu', 'hidden_dropout': 0.15000000000000002, 'batch_norm': 'on', 'optimizer_type': 'rmsprop', 'optimizer_lr': 0.005721820012069826, 'batch_size': 64}. Best is trial 390 with value: 16.963969438912468.
Trial 872 finished with value: 132.9128044203954 and parameters: {'input_dropout': 0.15000000000000002, 'hidden_layers': 6, 'hidden_units': 160, 'kernel_initializer': 'random_normal', 'hidden_activation': 'relu', 'hidden_dropout': 0.15000000000000002, 'batch_norm': 'off', 'optimizer_type': 'adam', 'optimizer_lr': 0.006868594830226953, 'batch_size': 128}. Best is trial 390 with value: 16.963969438912468.
Trial 873 finished with value: 9122.41336975299 and parameters: {'input_dropout': 0.15000000000000002, 'hidden_layers': 4, 'hidden_units': 160, 'kernel_initializer': 'he_uniform', 'hidden_activation': 'leaky_relu', 'hidden_dropout': 0.25, 'batch_norm': 'on', 'optimizer_type': 'adam', 'optimizer_lr': 0.0007598050487995843, 'batch_size': 96}. Best is trial 390 with value: 16.963969438912468.
Trial 874 finished with value: 160.76441514969622 and parameters: {'input_dropout': 0.1, 'hidden_layers': 4, 'hidden_units': 96, 'kernel_initializer': 'random_normal', 'hidden_activation': 'prelu', 'hidden_dropout': 0.15000000000000002, 'batch_norm': 'off', 'optimizer_type': 'rmsprop', 'optimizer_lr': 0.009525713650470181, 'batch_size': 64}. Best is trial 390 with value: 16.963969438912468.
Trial 875 finished with value: 8901.059676537097 and parameters: {'input_dropout': 0.1, 'hidden_layers': 6, 'hidden_units': 192, 'kernel_initializer': 'he_normal', 'hidden_activation': 'relu', 'hidden_dropout': 0.2, 'batch_norm': 'on', 'optimizer_type': 'rmsprop', 'optimizer_lr': 0.0001834595402553197, 'batch_size': 32}. Best is trial 390 with value: 16.963969438912468.
Trial 876 finished with value: 132.59454537294215 and parameters: {'input_dropout': 0.1, 'hidden_layers': 3, 'hidden_units': 256, 'kernel_initializer': 'random_normal', 'hidden_activation': 'prelu', 'hidden_dropout': 0.0, 'batch_norm': 'off', 'optimizer_type': 'rmsprop', 'optimizer_lr': 0.0001948287801895855, 'batch_size': 64}. Best is trial 390 with value: 16.963969438912468.
Trial 877 finished with value: 116.57365630401573 and parameters: {'input_dropout': 0.2, 'hidden_layers': 6, 'hidden_units': 256, 'kernel_initializer': 'random_normal', 'hidden_activation': 'leaky_relu', 'hidden_dropout': 0.05, 'batch_norm': 'on', 'optimizer_type': 'adam', 'optimizer_lr': 0.006516039460706324, 'batch_size': 96}. Best is trial 390 with value: 16.963969438912468.
Trial 878 finished with value: 160.92312963336724 and parameters: {'input_dropout': 0.15000000000000002, 'hidden_layers': 4, 'hidden_units': 64, 'kernel_initializer': 'random_normal', 'hidden_activation': 'prelu', 'hidden_dropout': 0.15000000000000002, 'batch_norm': 'off', 'optimizer_type': 'adam', 'optimizer_lr': 0.0006464449906120355, 'batch_size': 64}. Best is trial 390 with value: 16.963969438912468.
Trial 879 finished with value: 139.26304837704552 and parameters: {'input_dropout': 0.1, 'hidden_layers': 4, 'hidden_units': 224, 'kernel_initializer': 'random_normal', 'hidden_activation': 'prelu', 'hidden_dropout': 0.25, 'batch_norm': 'off', 'optimizer_type': 'rmsprop', 'optimizer_lr': 0.0014054623886159564, 'batch_size': 128}. Best is trial 390 with value: 16.963969438912468.
Trial 880 finished with value: 4033.0737292037657 and parameters: {'input_dropout': 0.0, 'hidden_layers': 10, 'hidden_units': 32, 'kernel_initializer': 'he_normal', 'hidden_activation': 'leaky_relu', 'hidden_dropout': 0.15000000000000002, 'batch_norm': 'on', 'optimizer_type': 'rmsprop', 'optimizer_lr': 0.004264779063937233, 'batch_size': 128}. Best is trial 390 with value: 16.963969438912468.
Trial 881 finished with value: 11484.691115827158 and parameters: {'input_dropout': 0.1, 'hidden_layers': 9, 'hidden_units': 256, 'kernel_initializer': 'he_normal', 'hidden_activation': 'relu', 'hidden_dropout': 0.25, 'batch_norm': 'on', 'optimizer_type': 'rmsprop', 'optimizer_lr': 0.0007470019400934075, 'batch_size': 128}. Best is trial 390 with value: 16.963969438912468.
Trial 882 finished with value: 441.7163602938015 and parameters: {'input_dropout': 0.15000000000000002, 'hidden_layers': 5, 'hidden_units': 160, 'kernel_initializer': 'he_normal', 'hidden_activation': 'leaky_relu', 'hidden_dropout': 0.25, 'batch_norm': 'off', 'optimizer_type': 'rmsprop', 'optimizer_lr': 0.00033671342658819634, 'batch_size': 96}. Best is trial 390 with value: 16.963969438912468.
Trial 883 finished with value: 8168.113756991546 and parameters: {'input_dropout': 0.05, 'hidden_layers': 10, 'hidden_units': 256, 'kernel_initializer': 'random_normal', 'hidden_activation': 'leaky_relu', 'hidden_dropout': 0.05, 'batch_norm': 'on', 'optimizer_type': 'adam', 'optimizer_lr': 0.0002015700850747412, 'batch_size': 64}. Best is trial 390 with value: 16.963969438912468.
Trial 884 finished with value: 338.7346638608806 and parameters: {'input_dropout': 0.05, 'hidden_layers': 7, 'hidden_units': 64, 'kernel_initializer': 'random_normal', 'hidden_activation': 'relu', 'hidden_dropout': 0.1, 'batch_norm': 'on', 'optimizer_type': 'adam', 'optimizer_lr': 0.006651681875911188, 'batch_size': 128}. Best is trial 390 with value: 16.963969438912468.
Trial 885 finished with value: 164.5329515742665 and parameters: {'input_dropout': 0.0, 'hidden_layers': 10, 'hidden_units': 192, 'kernel_initializer': 'he_uniform', 'hidden_activation': 'leaky_relu', 'hidden_dropout': 0.25, 'batch_norm': 'on', 'optimizer_type': 'adam', 'optimizer_lr': 0.001960359067881224, 'batch_size': 64}. Best is trial 390 with value: 16.963969438912468.
Trial 886 finished with value: 15186.988908772679 and parameters: {'input_dropout': 0.2, 'hidden_layers': 10, 'hidden_units': 256, 'kernel_initializer': 'he_uniform', 'hidden_activation': 'leaky_relu', 'hidden_dropout': 0.2, 'batch_norm': 'on', 'optimizer_type': 'rmsprop', 'optimizer_lr': 0.0003204637775765981, 'batch_size': 128}. Best is trial 390 with value: 16.963969438912468.
Trial 887 finished with value: 78.31064630672907 and parameters: {'input_dropout': 0.05, 'hidden_layers': 5, 'hidden_units': 224, 'kernel_initializer': 'he_uniform', 'hidden_activation': 'prelu', 'hidden_dropout': 0.05, 'batch_norm': 'on', 'optimizer_type': 'rmsprop', 'optimizer_lr': 0.0010661692641537532, 'batch_size': 64}. Best is trial 390 with value: 16.963969438912468.
Trial 888 finished with value: 530.7386972123521 and parameters: {'input_dropout': 0.05, 'hidden_layers': 5, 'hidden_units': 192, 'kernel_initializer': 'he_normal', 'hidden_activation': 'leaky_relu', 'hidden_dropout': 0.3, 'batch_norm': 'off', 'optimizer_type': 'adam', 'optimizer_lr': 0.0023205684072256268, 'batch_size': 64}. Best is trial 390 with value: 16.963969438912468.
Trial 889 finished with value: 208.40313402286105 and parameters: {'input_dropout': 0.0, 'hidden_layers': 3, 'hidden_units': 160, 'kernel_initializer': 'he_normal', 'hidden_activation': 'prelu', 'hidden_dropout': 0.05, 'batch_norm': 'off', 'optimizer_type': 'rmsprop', 'optimizer_lr': 0.00020358445808992085, 'batch_size': 128}. Best is trial 390 with value: 16.963969438912468.
Trial 890 finished with value: 221.3141283959869 and parameters: {'input_dropout': 0.2, 'hidden_layers': 6, 'hidden_units': 128, 'kernel_initializer': 'random_normal', 'hidden_activation': 'leaky_relu', 'hidden_dropout': 0.0, 'batch_norm': 'off', 'optimizer_type': 'adam', 'optimizer_lr': 0.00013356883468595488, 'batch_size': 32}. Best is trial 390 with value: 16.963969438912468.
Trial 891 finished with value: 493.25346346558644 and parameters: {'input_dropout': 0.0, 'hidden_layers': 6, 'hidden_units': 128, 'kernel_initializer': 'he_normal', 'hidden_activation': 'prelu', 'hidden_dropout': 0.2, 'batch_norm': 'off', 'optimizer_type': 'adam', 'optimizer_lr': 0.002637873200643176, 'batch_size': 64}. Best is trial 390 with value: 16.963969438912468.
Trial 892 finished with value: 656.8963422179933 and parameters: {'input_dropout': 0.2, 'hidden_layers': 4, 'hidden_units': 224, 'kernel_initializer': 'random_normal', 'hidden_activation': 'relu', 'hidden_dropout': 0.1, 'batch_norm': 'on', 'optimizer_type': 'adam', 'optimizer_lr': 0.00039368828101067095, 'batch_size': 96}. Best is trial 390 with value: 16.963969438912468.
Trial 893 finished with value: 169.37763463229336 and parameters: {'input_dropout': 0.2, 'hidden_layers': 6, 'hidden_units': 128, 'kernel_initializer': 'random_normal', 'hidden_activation': 'relu', 'hidden_dropout': 0.05, 'batch_norm': 'on', 'optimizer_type': 'adam', 'optimizer_lr': 0.007377005034920891, 'batch_size': 96}. Best is trial 390 with value: 16.963969438912468.
Trial 894 finished with value: 210.94806126726033 and parameters: {'input_dropout': 0.2, 'hidden_layers': 7, 'hidden_units': 224, 'kernel_initializer': 'random_normal', 'hidden_activation': 'prelu', 'hidden_dropout': 0.3, 'batch_norm': 'off', 'optimizer_type': 'rmsprop', 'optimizer_lr': 0.00022386254725230867, 'batch_size': 96}. Best is trial 390 with value: 16.963969438912468.
Trial 895 finished with value: 177.81398478843167 and parameters: {'input_dropout': 0.05, 'hidden_layers': 5, 'hidden_units': 160, 'kernel_initializer': 'random_normal', 'hidden_activation': 'prelu', 'hidden_dropout': 0.15000000000000002, 'batch_norm': 'off', 'optimizer_type': 'rmsprop', 'optimizer_lr': 0.00443275836162753, 'batch_size': 32}. Best is trial 390 with value: 16.963969438912468.
Trial 896 finished with value: 383.190487288635 and parameters: {'input_dropout': 0.2, 'hidden_layers': 9, 'hidden_units': 64, 'kernel_initializer': 'random_normal', 'hidden_activation': 'relu', 'hidden_dropout': 0.25, 'batch_norm': 'off', 'optimizer_type': 'rmsprop', 'optimizer_lr': 0.00010989536460997943, 'batch_size': 128}. Best is trial 390 with value: 16.963969438912468.
Trial 897 finished with value: 114.90337901862895 and parameters: {'input_dropout': 0.1, 'hidden_layers': 3, 'hidden_units': 256, 'kernel_initializer': 'random_normal', 'hidden_activation': 'prelu', 'hidden_dropout': 0.15000000000000002, 'batch_norm': 'off', 'optimizer_type': 'rmsprop', 'optimizer_lr': 0.0017252736433131719, 'batch_size': 64}. Best is trial 390 with value: 16.963969438912468.
Trial 898 finished with value: 68.70524259948117 and parameters: {'input_dropout': 0.0, 'hidden_layers': 10, 'hidden_units': 32, 'kernel_initializer': 'he_uniform', 'hidden_activation': 'prelu', 'hidden_dropout': 0.0, 'batch_norm': 'on', 'optimizer_type': 'rmsprop', 'optimizer_lr': 0.004105070724047407, 'batch_size': 64}. Best is trial 390 with value: 16.963969438912468.
Trial 899 finished with value: 135.74478050466575 and parameters: {'input_dropout': 0.05, 'hidden_layers': 10, 'hidden_units': 160, 'kernel_initializer': 'he_normal', 'hidden_activation': 'relu', 'hidden_dropout': 0.1, 'batch_norm': 'on', 'optimizer_type': 'rmsprop', 'optimizer_lr': 0.0012993625294369547, 'batch_size': 32}. Best is trial 390 with value: 16.963969438912468.
Trial 900 finished with value: 39.0316020160783 and parameters: {'input_dropout': 0.0, 'hidden_layers': 7, 'hidden_units': 96, 'kernel_initializer': 'random_normal', 'hidden_activation': 'leaky_relu', 'hidden_dropout': 0.0, 'batch_norm': 'on', 'optimizer_type': 'rmsprop', 'optimizer_lr': 0.0007701631563465663, 'batch_size': 32}. Best is trial 390 with value: 16.963969438912468.
Trial 901 finished with value: 14784.620420197683 and parameters: {'input_dropout': 0.05, 'hidden_layers': 10, 'hidden_units': 128, 'kernel_initializer': 'random_normal', 'hidden_activation': 'leaky_relu', 'hidden_dropout': 0.05, 'batch_norm': 'on', 'optimizer_type': 'adam', 'optimizer_lr': 0.00022151880854336234, 'batch_size': 96}. Best is trial 390 with value: 16.963969438912468.
Trial 902 finished with value: 172.17717402765498 and parameters: {'input_dropout': 0.0, 'hidden_layers': 8, 'hidden_units': 64, 'kernel_initializer': 'random_normal', 'hidden_activation': 'relu', 'hidden_dropout': 0.2, 'batch_norm': 'on', 'optimizer_type': 'rmsprop', 'optimizer_lr': 0.005437043568085407, 'batch_size': 64}. Best is trial 390 with value: 16.963969438912468.
Trial 903 finished with value: 113.63101798670343 and parameters: {'input_dropout': 0.15000000000000002, 'hidden_layers': 8, 'hidden_units': 256, 'kernel_initializer': 'he_normal', 'hidden_activation': 'relu', 'hidden_dropout': 0.1, 'batch_norm': 'on', 'optimizer_type': 'adam', 'optimizer_lr': 0.0028814369504790915, 'batch_size': 96}. Best is trial 390 with value: 16.963969438912468.
Trial 904 finished with value: 126.93332505154414 and parameters: {'input_dropout': 0.05, 'hidden_layers': 9, 'hidden_units': 256, 'kernel_initializer': 'random_normal', 'hidden_activation': 'leaky_relu', 'hidden_dropout': 0.15000000000000002, 'batch_norm': 'off', 'optimizer_type': 'adam', 'optimizer_lr': 0.0026113078310513694, 'batch_size': 96}. Best is trial 390 with value: 16.963969438912468.
Trial 905 finished with value: 67.96850447715927 and parameters: {'input_dropout': 0.0, 'hidden_layers': 9, 'hidden_units': 64, 'kernel_initializer': 'he_normal', 'hidden_activation': 'relu', 'hidden_dropout': 0.0, 'batch_norm': 'off', 'optimizer_type': 'adam', 'optimizer_lr': 0.00012039542484907538, 'batch_size': 32}. Best is trial 390 with value: 16.963969438912468.
Trial 906 finished with value: 115.50892026774258 and parameters: {'input_dropout': 0.05, 'hidden_layers': 8, 'hidden_units': 192, 'kernel_initializer': 'he_uniform', 'hidden_activation': 'relu', 'hidden_dropout': 0.1, 'batch_norm': 'on', 'optimizer_type': 'rmsprop', 'optimizer_lr': 0.00482506731669856, 'batch_size': 64}. Best is trial 390 with value: 16.963969438912468.
Trial 907 finished with value: 73.86109661481058 and parameters: {'input_dropout': 0.0, 'hidden_layers': 4, 'hidden_units': 128, 'kernel_initializer': 'he_uniform', 'hidden_activation': 'relu', 'hidden_dropout': 0.15000000000000002, 'batch_norm': 'on', 'optimizer_type': 'rmsprop', 'optimizer_lr': 0.007803262242523682, 'batch_size': 64}. Best is trial 390 with value: 16.963969438912468.
Trial 908 finished with value: 1898.6691474995912 and parameters: {'input_dropout': 0.0, 'hidden_layers': 6, 'hidden_units': 64, 'kernel_initializer': 'he_normal', 'hidden_activation': 'relu', 'hidden_dropout': 0.3, 'batch_norm': 'on', 'optimizer_type': 'adam', 'optimizer_lr': 0.0016356520410182186, 'batch_size': 64}. Best is trial 390 with value: 16.963969438912468.
Trial 909 finished with value: 199.67192625731712 and parameters: {'input_dropout': 0.1, 'hidden_layers': 8, 'hidden_units': 192, 'kernel_initializer': 'he_uniform', 'hidden_activation': 'leaky_relu', 'hidden_dropout': 0.05, 'batch_norm': 'off', 'optimizer_type': 'rmsprop', 'optimizer_lr': 0.00015457298851942098, 'batch_size': 96}. Best is trial 390 with value: 16.963969438912468.
Trial 910 finished with value: 178.84301719627376 and parameters: {'input_dropout': 0.15000000000000002, 'hidden_layers': 6, 'hidden_units': 160, 'kernel_initializer': 'he_uniform', 'hidden_activation': 'prelu', 'hidden_dropout': 0.2, 'batch_norm': 'on', 'optimizer_type': 'adam', 'optimizer_lr': 0.001397766236544161, 'batch_size': 32}. Best is trial 390 with value: 16.963969438912468.
Trial 911 finished with value: 132.7962512238367 and parameters: {'input_dropout': 0.15000000000000002, 'hidden_layers': 3, 'hidden_units': 224, 'kernel_initializer': 'he_uniform', 'hidden_activation': 'relu', 'hidden_dropout': 0.15000000000000002, 'batch_norm': 'off', 'optimizer_type': 'rmsprop', 'optimizer_lr': 0.003911869396094666, 'batch_size': 128}. Best is trial 390 with value: 16.963969438912468.
Trial 912 finished with value: 110.59217842368048 and parameters: {'input_dropout': 0.1, 'hidden_layers': 6, 'hidden_units': 128, 'kernel_initializer': 'random_normal', 'hidden_activation': 'leaky_relu', 'hidden_dropout': 0.1, 'batch_norm': 'on', 'optimizer_type': 'adam', 'optimizer_lr': 0.004529577721756395, 'batch_size': 64}. Best is trial 390 with value: 16.963969438912468.
Trial 913 finished with value: 12466.38035810193 and parameters: {'input_dropout': 0.1, 'hidden_layers': 3, 'hidden_units': 128, 'kernel_initializer': 'he_uniform', 'hidden_activation': 'prelu', 'hidden_dropout': 0.15000000000000002, 'batch_norm': 'on', 'optimizer_type': 'rmsprop', 'optimizer_lr': 0.0003088500555733759, 'batch_size': 96}. Best is trial 390 with value: 16.963969438912468.
