Trial 287 finished with value: 104.88689004755724 and parameters: {'input_dropout': 0.15000000000000002, 'hidden_layers': 7, 'hidden_units': 64, 'kernel_initializer': 'he_uniform', 'hidden_activation': 'leaky_relu', 'hidden_dropout': 0.0, 'batch_norm': 'off', 'optimizer_type': 'adam', 'optimizer_lr': 0.00444893260758535, 'batch_size': 32}. Best is trial 26 with value: 21.03031085049643.
Trial 288 finished with value: 173.0167748917347 and parameters: {'input_dropout': 0.15000000000000002, 'hidden_layers': 9, 'hidden_units': 128, 'kernel_initializer': 'he_normal', 'hidden_activation': 'relu', 'hidden_dropout': 0.0, 'batch_norm': 'off', 'optimizer_type': 'rmsprop', 'optimizer_lr': 0.0024238256475909987, 'batch_size': 128}. Best is trial 26 with value: 21.03031085049643.
Trial 289 finished with value: 147.05463072764758 and parameters: {'input_dropout': 0.05, 'hidden_layers': 5, 'hidden_units': 96, 'kernel_initializer': 'random_normal', 'hidden_activation': 'relu', 'hidden_dropout': 0.05, 'batch_norm': 'off', 'optimizer_type': 'rmsprop', 'optimizer_lr': 0.007720428876201601, 'batch_size': 64}. Best is trial 26 with value: 21.03031085049643.
Trial 290 finished with value: 667.1735112194672 and parameters: {'input_dropout': 0.1, 'hidden_layers': 3, 'hidden_units': 32, 'kernel_initializer': 'he_uniform', 'hidden_activation': 'relu', 'hidden_dropout': 0.25, 'batch_norm': 'off', 'optimizer_type': 'adam', 'optimizer_lr': 0.00018728908318067504, 'batch_size': 128}. Best is trial 26 with value: 21.03031085049643.
Trial 291 finished with value: 590.7044012260676 and parameters: {'input_dropout': 0.05, 'hidden_layers': 10, 'hidden_units': 160, 'kernel_initializer': 'he_normal', 'hidden_activation': 'leaky_relu', 'hidden_dropout': 0.1, 'batch_norm': 'off', 'optimizer_type': 'adam', 'optimizer_lr': 0.0010382534149391209, 'batch_size': 32}. Best is trial 26 with value: 21.03031085049643.
Trial 292 finished with value: 232.72944080789884 and parameters: {'input_dropout': 0.2, 'hidden_layers': 7, 'hidden_units': 192, 'kernel_initializer': 'random_normal', 'hidden_activation': 'leaky_relu', 'hidden_dropout': 0.25, 'batch_norm': 'off', 'optimizer_type': 'adam', 'optimizer_lr': 0.0002118874908722367, 'batch_size': 96}. Best is trial 26 with value: 21.03031085049643.
Trial 293 finished with value: 338.57243097677025 and parameters: {'input_dropout': 0.2, 'hidden_layers': 6, 'hidden_units': 128, 'kernel_initializer': 'he_normal', 'hidden_activation': 'leaky_relu', 'hidden_dropout': 0.05, 'batch_norm': 'off', 'optimizer_type': 'adam', 'optimizer_lr': 0.0006999406186908581, 'batch_size': 128}. Best is trial 26 with value: 21.03031085049643.
Trial 294 finished with value: 176.582134821556 and parameters: {'input_dropout': 0.1, 'hidden_layers': 4, 'hidden_units': 128, 'kernel_initializer': 'he_normal', 'hidden_activation': 'relu', 'hidden_dropout': 0.3, 'batch_norm': 'off', 'optimizer_type': 'rmsprop', 'optimizer_lr': 0.0023707491734487325, 'batch_size': 128}. Best is trial 26 with value: 21.03031085049643.
Trial 295 finished with value: 10981.385054849046 and parameters: {'input_dropout': 0.2, 'hidden_layers': 10, 'hidden_units': 160, 'kernel_initializer': 'he_normal', 'hidden_activation': 'relu', 'hidden_dropout': 0.2, 'batch_norm': 'on', 'optimizer_type': 'rmsprop', 'optimizer_lr': 0.0001884287619961988, 'batch_size': 64}. Best is trial 26 with value: 21.03031085049643.
Trial 296 finished with value: 198.43400036659168 and parameters: {'input_dropout': 0.2, 'hidden_layers': 5, 'hidden_units': 128, 'kernel_initializer': 'random_normal', 'hidden_activation': 'relu', 'hidden_dropout': 0.0, 'batch_norm': 'off', 'optimizer_type': 'adam', 'optimizer_lr': 0.0012620396367588518, 'batch_size': 96}. Best is trial 26 with value: 21.03031085049643.
Trial 297 finished with value: 204.2311918616744 and parameters: {'input_dropout': 0.05, 'hidden_layers': 5, 'hidden_units': 32, 'kernel_initializer': 'random_normal', 'hidden_activation': 'prelu', 'hidden_dropout': 0.1, 'batch_norm': 'off', 'optimizer_type': 'rmsprop', 'optimizer_lr': 0.00038823460931837977, 'batch_size': 128}. Best is trial 26 with value: 21.03031085049643.
Trial 298 finished with value: 1221.023002777188 and parameters: {'input_dropout': 0.1, 'hidden_layers': 7, 'hidden_units': 192, 'kernel_initializer': 'he_uniform', 'hidden_activation': 'prelu', 'hidden_dropout': 0.25, 'batch_norm': 'off', 'optimizer_type': 'adam', 'optimizer_lr': 0.0004364298004266299, 'batch_size': 96}. Best is trial 26 with value: 21.03031085049643.
Trial 299 finished with value: 122.20951614274885 and parameters: {'input_dropout': 0.1, 'hidden_layers': 6, 'hidden_units': 256, 'kernel_initializer': 'random_normal', 'hidden_activation': 'leaky_relu', 'hidden_dropout': 0.05, 'batch_norm': 'off', 'optimizer_type': 'rmsprop', 'optimizer_lr': 0.0001534543340680444, 'batch_size': 64}. Best is trial 26 with value: 21.03031085049643.
Trial 300 finished with value: 1567.1802407405153 and parameters: {'input_dropout': 0.1, 'hidden_layers': 10, 'hidden_units': 160, 'kernel_initializer': 'he_uniform', 'hidden_activation': 'relu', 'hidden_dropout': 0.2, 'batch_norm': 'off', 'optimizer_type': 'adam', 'optimizer_lr': 0.0031232505652626294, 'batch_size': 32}. Best is trial 26 with value: 21.03031085049643.
Trial 301 finished with value: 311.7217568850965 and parameters: {'input_dropout': 0.0, 'hidden_layers': 10, 'hidden_units': 224, 'kernel_initializer': 'he_uniform', 'hidden_activation': 'relu', 'hidden_dropout': 0.3, 'batch_norm': 'off', 'optimizer_type': 'rmsprop', 'optimizer_lr': 0.005312788403428106, 'batch_size': 64}. Best is trial 26 with value: 21.03031085049643.
Trial 302 finished with value: 379.5516038644052 and parameters: {'input_dropout': 0.15000000000000002, 'hidden_layers': 10, 'hidden_units': 128, 'kernel_initializer': 'he_uniform', 'hidden_activation': 'relu', 'hidden_dropout': 0.25, 'batch_norm': 'off', 'optimizer_type': 'rmsprop', 'optimizer_lr': 0.009714001537920895, 'batch_size': 96}. Best is trial 26 with value: 21.03031085049643.
Trial 303 finished with value: 153.53725678378356 and parameters: {'input_dropout': 0.2, 'hidden_layers': 7, 'hidden_units': 128, 'kernel_initializer': 'he_uniform', 'hidden_activation': 'prelu', 'hidden_dropout': 0.1, 'batch_norm': 'on', 'optimizer_type': 'adam', 'optimizer_lr': 0.009925938772771897, 'batch_size': 32}. Best is trial 26 with value: 21.03031085049643.
Trial 304 finished with value: 196.10157413398287 and parameters: {'input_dropout': 0.05, 'hidden_layers': 3, 'hidden_units': 128, 'kernel_initializer': 'he_normal', 'hidden_activation': 'leaky_relu', 'hidden_dropout': 0.1, 'batch_norm': 'off', 'optimizer_type': 'rmsprop', 'optimizer_lr': 0.00018246630407866142, 'batch_size': 128}. Best is trial 26 with value: 21.03031085049643.
Trial 305 finished with value: 150.06517353745562 and parameters: {'input_dropout': 0.15000000000000002, 'hidden_layers': 4, 'hidden_units': 32, 'kernel_initializer': 'he_normal', 'hidden_activation': 'relu', 'hidden_dropout': 0.05, 'batch_norm': 'off', 'optimizer_type': 'rmsprop', 'optimizer_lr': 0.004823270808077726, 'batch_size': 32}. Best is trial 26 with value: 21.03031085049643.
Trial 306 finished with value: 160.02009502185524 and parameters: {'input_dropout': 0.1, 'hidden_layers': 7, 'hidden_units': 64, 'kernel_initializer': 'he_uniform', 'hidden_activation': 'relu', 'hidden_dropout': 0.1, 'batch_norm': 'on', 'optimizer_type': 'rmsprop', 'optimizer_lr': 0.002713392311783615, 'batch_size': 32}. Best is trial 26 with value: 21.03031085049643.
Trial 307 finished with value: 161.8997279283959 and parameters: {'input_dropout': 0.15000000000000002, 'hidden_layers': 5, 'hidden_units': 64, 'kernel_initializer': 'he_uniform', 'hidden_activation': 'relu', 'hidden_dropout': 0.15000000000000002, 'batch_norm': 'on', 'optimizer_type': 'rmsprop', 'optimizer_lr': 0.009392064350980774, 'batch_size': 64}. Best is trial 26 with value: 21.03031085049643.
Trial 308 finished with value: 6740.2491049747 and parameters: {'input_dropout': 0.2, 'hidden_layers': 10, 'hidden_units': 96, 'kernel_initializer': 'he_uniform', 'hidden_activation': 'leaky_relu', 'hidden_dropout': 0.25, 'batch_norm': 'on', 'optimizer_type': 'adam', 'optimizer_lr': 0.0005361946485707246, 'batch_size': 32}. Best is trial 26 with value: 21.03031085049643.
Trial 309 finished with value: 56.69432213085117 and parameters: {'input_dropout': 0.0, 'hidden_layers': 4, 'hidden_units': 256, 'kernel_initializer': 'he_uniform', 'hidden_activation': 'prelu', 'hidden_dropout': 0.1, 'batch_norm': 'on', 'optimizer_type': 'rmsprop', 'optimizer_lr': 0.003937575926763599, 'batch_size': 128}. Best is trial 26 with value: 21.03031085049643.
Trial 310 finished with value: 157.86117780303567 and parameters: {'input_dropout': 0.2, 'hidden_layers': 10, 'hidden_units': 224, 'kernel_initializer': 'he_uniform', 'hidden_activation': 'prelu', 'hidden_dropout': 0.05, 'batch_norm': 'off', 'optimizer_type': 'adam', 'optimizer_lr': 0.0070924149659668196, 'batch_size': 32}. Best is trial 26 with value: 21.03031085049643.
Trial 311 finished with value: 12325.146521084094 and parameters: {'input_dropout': 0.2, 'hidden_layers': 10, 'hidden_units': 128, 'kernel_initializer': 'he_uniform', 'hidden_activation': 'leaky_relu', 'hidden_dropout': 0.1, 'batch_norm': 'on', 'optimizer_type': 'rmsprop', 'optimizer_lr': 0.00021207519962313434, 'batch_size': 64}. Best is trial 26 with value: 21.03031085049643.
Trial 312 finished with value: 140.0209170665891 and parameters: {'input_dropout': 0.0, 'hidden_layers': 8, 'hidden_units': 128, 'kernel_initializer': 'he_uniform', 'hidden_activation': 'relu', 'hidden_dropout': 0.1, 'batch_norm': 'on', 'optimizer_type': 'rmsprop', 'optimizer_lr': 0.007734390216942759, 'batch_size': 96}. Best is trial 26 with value: 21.03031085049643.
Trial 313 finished with value: 142.75792678401464 and parameters: {'input_dropout': 0.1, 'hidden_layers': 6, 'hidden_units': 64, 'kernel_initializer': 'random_normal', 'hidden_activation': 'leaky_relu', 'hidden_dropout': 0.1, 'batch_norm': 'on', 'optimizer_type': 'rmsprop', 'optimizer_lr': 0.001299330118256043, 'batch_size': 96}. Best is trial 26 with value: 21.03031085049643.
Trial 314 finished with value: 22076.804022075205 and parameters: {'input_dropout': 0.15000000000000002, 'hidden_layers': 8, 'hidden_units': 64, 'kernel_initializer': 'he_normal', 'hidden_activation': 'leaky_relu', 'hidden_dropout': 0.25, 'batch_norm': 'on', 'optimizer_type': 'rmsprop', 'optimizer_lr': 0.0001841141589599671, 'batch_size': 128}. Best is trial 26 with value: 21.03031085049643.
Trial 315 finished with value: 5527.503630091385 and parameters: {'input_dropout': 0.05, 'hidden_layers': 10, 'hidden_units': 64, 'kernel_initializer': 'he_normal', 'hidden_activation': 'relu', 'hidden_dropout': 0.25, 'batch_norm': 'off', 'optimizer_type': 'rmsprop', 'optimizer_lr': 0.0002813971663349058, 'batch_size': 96}. Best is trial 26 with value: 21.03031085049643.
Trial 316 finished with value: 164.19383828382414 and parameters: {'input_dropout': 0.15000000000000002, 'hidden_layers': 7, 'hidden_units': 160, 'kernel_initializer': 'he_normal', 'hidden_activation': 'relu', 'hidden_dropout': 0.0, 'batch_norm': 'off', 'optimizer_type': 'adam', 'optimizer_lr': 0.0015055451836029827, 'batch_size': 64}. Best is trial 26 with value: 21.03031085049643.
Trial 317 finished with value: 6278.056016887749 and parameters: {'input_dropout': 0.0, 'hidden_layers': 10, 'hidden_units': 192, 'kernel_initializer': 'he_normal', 'hidden_activation': 'relu', 'hidden_dropout': 0.25, 'batch_norm': 'on', 'optimizer_type': 'adam', 'optimizer_lr': 0.0006325355262984247, 'batch_size': 128}. Best is trial 26 with value: 21.03031085049643.
Trial 318 finished with value: 6184.720347596115 and parameters: {'input_dropout': 0.1, 'hidden_layers': 10, 'hidden_units': 32, 'kernel_initializer': 'random_normal', 'hidden_activation': 'prelu', 'hidden_dropout': 0.3, 'batch_norm': 'on', 'optimizer_type': 'adam', 'optimizer_lr': 0.000501779979456409, 'batch_size': 96}. Best is trial 26 with value: 21.03031085049643.
Trial 319 finished with value: 141.6284355103271 and parameters: {'input_dropout': 0.15000000000000002, 'hidden_layers': 3, 'hidden_units': 160, 'kernel_initializer': 'he_normal', 'hidden_activation': 'prelu', 'hidden_dropout': 0.15000000000000002, 'batch_norm': 'off', 'optimizer_type': 'rmsprop', 'optimizer_lr': 0.004459052609021096, 'batch_size': 96}. Best is trial 26 with value: 21.03031085049643.
Trial 320 finished with value: 17518.826604115988 and parameters: {'input_dropout': 0.15000000000000002, 'hidden_layers': 3, 'hidden_units': 96, 'kernel_initializer': 'he_uniform', 'hidden_activation': 'leaky_relu', 'hidden_dropout': 0.15000000000000002, 'batch_norm': 'on', 'optimizer_type': 'adam', 'optimizer_lr': 0.0002695721687892919, 'batch_size': 128}. Best is trial 26 with value: 21.03031085049643.
Trial 321 finished with value: 560.6246534434714 and parameters: {'input_dropout': 0.2, 'hidden_layers': 6, 'hidden_units': 256, 'kernel_initializer': 'he_normal', 'hidden_activation': 'prelu', 'hidden_dropout': 0.15000000000000002, 'batch_norm': 'off', 'optimizer_type': 'adam', 'optimizer_lr': 0.00028264073779326617, 'batch_size': 128}. Best is trial 26 with value: 21.03031085049643.
Trial 322 finished with value: 305.3713518299208 and parameters: {'input_dropout': 0.2, 'hidden_layers': 4, 'hidden_units': 32, 'kernel_initializer': 'he_uniform', 'hidden_activation': 'relu', 'hidden_dropout': 0.1, 'batch_norm': 'off', 'optimizer_type': 'adam', 'optimizer_lr': 0.0015083507040738104, 'batch_size': 96}. Best is trial 26 with value: 21.03031085049643.
Trial 323 finished with value: 1038.878598769299 and parameters: {'input_dropout': 0.2, 'hidden_layers': 10, 'hidden_units': 224, 'kernel_initializer': 'he_uniform', 'hidden_activation': 'leaky_relu', 'hidden_dropout': 0.1, 'batch_norm': 'off', 'optimizer_type': 'adam', 'optimizer_lr': 0.0004473548238327983, 'batch_size': 32}. Best is trial 26 with value: 21.03031085049643.
Trial 324 finished with value: 319.66358032664766 and parameters: {'input_dropout': 0.0, 'hidden_layers': 8, 'hidden_units': 96, 'kernel_initializer': 'random_normal', 'hidden_activation': 'leaky_relu', 'hidden_dropout': 0.15000000000000002, 'batch_norm': 'off', 'optimizer_type': 'adam', 'optimizer_lr': 0.000100599252804151, 'batch_size': 96}. Best is trial 26 with value: 21.03031085049643.
Trial 325 finished with value: 152.49717898087096 and parameters: {'input_dropout': 0.2, 'hidden_layers': 9, 'hidden_units': 256, 'kernel_initializer': 'he_uniform', 'hidden_activation': 'relu', 'hidden_dropout': 0.05, 'batch_norm': 'off', 'optimizer_type': 'rmsprop', 'optimizer_lr': 0.0031829296441520543, 'batch_size': 96}. Best is trial 26 with value: 21.03031085049643.
Trial 326 finished with value: 4809.5599223379295 and parameters: {'input_dropout': 0.1, 'hidden_layers': 10, 'hidden_units': 96, 'kernel_initializer': 'he_normal', 'hidden_activation': 'relu', 'hidden_dropout': 0.0, 'batch_norm': 'on', 'optimizer_type': 'adam', 'optimizer_lr': 0.0003543202525558545, 'batch_size': 32}. Best is trial 26 with value: 21.03031085049643.
Trial 327 finished with value: 16486.481747223344 and parameters: {'input_dropout': 0.2, 'hidden_layers': 9, 'hidden_units': 256, 'kernel_initializer': 'random_normal', 'hidden_activation': 'relu', 'hidden_dropout': 0.15000000000000002, 'batch_norm': 'on', 'optimizer_type': 'adam', 'optimizer_lr': 0.00013673873613681062, 'batch_size': 96}. Best is trial 26 with value: 21.03031085049643.
Trial 328 finished with value: 162.94616694966422 and parameters: {'input_dropout': 0.05, 'hidden_layers': 7, 'hidden_units': 160, 'kernel_initializer': 'he_normal', 'hidden_activation': 'relu', 'hidden_dropout': 0.25, 'batch_norm': 'on', 'optimizer_type': 'rmsprop', 'optimizer_lr': 0.000974492581267752, 'batch_size': 32}. Best is trial 26 with value: 21.03031085049643.
Trial 329 finished with value: 473.572736006772 and parameters: {'input_dropout': 0.15000000000000002, 'hidden_layers': 5, 'hidden_units': 128, 'kernel_initializer': 'he_normal', 'hidden_activation': 'relu', 'hidden_dropout': 0.15000000000000002, 'batch_norm': 'off', 'optimizer_type': 'adam', 'optimizer_lr': 0.00010455276276862586, 'batch_size': 128}. Best is trial 26 with value: 21.03031085049643.
Trial 330 finished with value: 8725.499838324937 and parameters: {'input_dropout': 0.05, 'hidden_layers': 5, 'hidden_units': 32, 'kernel_initializer': 'he_uniform', 'hidden_activation': 'leaky_relu', 'hidden_dropout': 0.1, 'batch_norm': 'on', 'optimizer_type': 'adam', 'optimizer_lr': 0.0008749945672683894, 'batch_size': 64}. Best is trial 26 with value: 21.03031085049643.
Trial 331 finished with value: 155.8871348621681 and parameters: {'input_dropout': 0.15000000000000002, 'hidden_layers': 6, 'hidden_units': 192, 'kernel_initializer': 'he_normal', 'hidden_activation': 'relu', 'hidden_dropout': 0.05, 'batch_norm': 'off', 'optimizer_type': 'adam', 'optimizer_lr': 0.003009812821653096, 'batch_size': 32}. Best is trial 26 with value: 21.03031085049643.
Trial 332 finished with value: 7682.663421226443 and parameters: {'input_dropout': 0.15000000000000002, 'hidden_layers': 10, 'hidden_units': 64, 'kernel_initializer': 'he_normal', 'hidden_activation': 'relu', 'hidden_dropout': 0.3, 'batch_norm': 'off', 'optimizer_type': 'adam', 'optimizer_lr': 0.00018968823478883717, 'batch_size': 128}. Best is trial 26 with value: 21.03031085049643.
Trial 333 finished with value: 20670.058168975305 and parameters: {'input_dropout': 0.1, 'hidden_layers': 8, 'hidden_units': 192, 'kernel_initializer': 'he_normal', 'hidden_activation': 'relu', 'hidden_dropout': 0.15000000000000002, 'batch_norm': 'on', 'optimizer_type': 'adam', 'optimizer_lr': 0.00011735191027172342, 'batch_size': 128}. Best is trial 26 with value: 21.03031085049643.
Trial 334 finished with value: 431.3277742394608 and parameters: {'input_dropout': 0.1, 'hidden_layers': 10, 'hidden_units': 160, 'kernel_initializer': 'he_uniform', 'hidden_activation': 'prelu', 'hidden_dropout': 0.1, 'batch_norm': 'off', 'optimizer_type': 'adam', 'optimizer_lr': 0.0015495050119899675, 'batch_size': 128}. Best is trial 26 with value: 21.03031085049643.
Trial 335 finished with value: 125.3501213641563 and parameters: {'input_dropout': 0.05, 'hidden_layers': 10, 'hidden_units': 64, 'kernel_initializer': 'random_normal', 'hidden_activation': 'leaky_relu', 'hidden_dropout': 0.05, 'batch_norm': 'off', 'optimizer_type': 'adam', 'optimizer_lr': 0.0006794625036804737, 'batch_size': 96}. Best is trial 26 with value: 21.03031085049643.
Trial 336 finished with value: 214.57115271683796 and parameters: {'input_dropout': 0.05, 'hidden_layers': 4, 'hidden_units': 32, 'kernel_initializer': 'he_uniform', 'hidden_activation': 'relu', 'hidden_dropout': 0.3, 'batch_norm': 'on', 'optimizer_type': 'rmsprop', 'optimizer_lr': 0.007210438808046514, 'batch_size': 64}. Best is trial 26 with value: 21.03031085049643.
Trial 337 finished with value: 263.66259051384134 and parameters: {'input_dropout': 0.1, 'hidden_layers': 9, 'hidden_units': 256, 'kernel_initializer': 'random_normal', 'hidden_activation': 'leaky_relu', 'hidden_dropout': 0.25, 'batch_norm': 'off', 'optimizer_type': 'adam', 'optimizer_lr': 0.0003636335364598815, 'batch_size': 128}. Best is trial 26 with value: 21.03031085049643.
Trial 338 finished with value: 167.86875559321902 and parameters: {'input_dropout': 0.2, 'hidden_layers': 4, 'hidden_units': 96, 'kernel_initializer': 'random_normal', 'hidden_activation': 'leaky_relu', 'hidden_dropout': 0.3, 'batch_norm': 'off', 'optimizer_type': 'rmsprop', 'optimizer_lr': 0.0020261396373574265, 'batch_size': 32}. Best is trial 26 with value: 21.03031085049643.
Trial 339 finished with value: 125.98480370896877 and parameters: {'input_dropout': 0.15000000000000002, 'hidden_layers': 7, 'hidden_units': 192, 'kernel_initializer': 'random_normal', 'hidden_activation': 'relu', 'hidden_dropout': 0.1, 'batch_norm': 'off', 'optimizer_type': 'adam', 'optimizer_lr': 0.001674678084061702, 'batch_size': 96}. Best is trial 26 with value: 21.03031085049643.
Trial 340 finished with value: 95.3156781980175 and parameters: {'input_dropout': 0.0, 'hidden_layers': 5, 'hidden_units': 96, 'kernel_initializer': 'random_normal', 'hidden_activation': 'relu', 'hidden_dropout': 0.0, 'batch_norm': 'off', 'optimizer_type': 'adam', 'optimizer_lr': 0.0005793740293386953, 'batch_size': 128}. Best is trial 26 with value: 21.03031085049643.
Trial 341 finished with value: 182.03646561924248 and parameters: {'input_dropout': 0.05, 'hidden_layers': 5, 'hidden_units': 224, 'kernel_initializer': 'he_normal', 'hidden_activation': 'relu', 'hidden_dropout': 0.05, 'batch_norm': 'off', 'optimizer_type': 'adam', 'optimizer_lr': 0.00014031213897197897, 'batch_size': 96}. Best is trial 26 with value: 21.03031085049643.
Trial 342 finished with value: 152.45076065279585 and parameters: {'input_dropout': 0.1, 'hidden_layers': 10, 'hidden_units': 96, 'kernel_initializer': 'he_normal', 'hidden_activation': 'leaky_relu', 'hidden_dropout': 0.0, 'batch_norm': 'off', 'optimizer_type': 'adam', 'optimizer_lr': 0.0010343161986611526, 'batch_size': 128}. Best is trial 26 with value: 21.03031085049643.
Trial 343 finished with value: 90.98038551303218 and parameters: {'input_dropout': 0.05, 'hidden_layers': 8, 'hidden_units': 64, 'kernel_initializer': 'he_uniform', 'hidden_activation': 'relu', 'hidden_dropout': 0.0, 'batch_norm': 'on', 'optimizer_type': 'adam', 'optimizer_lr': 0.0006266896483774395, 'batch_size': 32}. Best is trial 26 with value: 21.03031085049643.
