Trial 9 finished with value: 0.7728060333835753 and parameters: {'degree': 1}. Best is trial 9 with value: 0.7728060333835753.
Trial 11 failed because of the following error: ValueError('\nAll the 10 fits failed.\nIt is very likely that your model is misconfigured.\nYou can try to debug the error by setting error_score=\'raise\'.\n\nBelow are more details about the failures:\n--------------------------------------------------------------------------------\n5 fits failed with the following error:\nTraceback (most recent call last):\n  File "/usr/local/lib/python3.8/dist-packages/sklearn/model_selection/_validation.py", line 686, in _fit_and_score\n    estimator.fit(X_train, y_train, **fit_params)\n  File "/usr/local/lib/python3.8/dist-packages/sklearn/pipeline.py", line 378, in fit\n    Xt = self._fit(X, y, **fit_params_steps)\n  File "/usr/local/lib/python3.8/dist-packages/sklearn/pipeline.py", line 336, in _fit\n    X, fitted_transformer = fit_transform_one_cached(\n  File "/usr/local/lib/python3.8/dist-packages/joblib/memory.py", line 349, in __call__\n    return self.func(*args, **kwargs)\n  File "/usr/local/lib/python3.8/dist-packages/sklearn/pipeline.py", line 870, in _fit_transform_one\n    res = transformer.fit_transform(X, y, **fit_params)\n  File "/usr/local/lib/python3.8/dist-packages/sklearn/base.py", line 870, in fit_transform\n    return self.fit(X, y, **fit_params).transform(X)\n  File "/usr/local/lib/python3.8/dist-packages/sklearn/preprocessing/_polynomial.py", line 432, in transform\n    XP = np.empty(\nnumpy.core._exceptions._ArrayMemoryError: Unable to allocate 22.2 PiB for an array with shape (211, 14833897694226) and data type float64\n\n--------------------------------------------------------------------------------\n5 fits failed with the following error:\nTraceback (most recent call last):\n  File "/usr/local/lib/python3.8/dist-packages/sklearn/model_selection/_validation.py", line 686, in _fit_and_score\n    estimator.fit(X_train, y_train, **fit_params)\n  File "/usr/local/lib/python3.8/dist-packages/sklearn/pipeline.py", line 378, in fit\n    Xt = self._fit(X, y, **fit_params_steps)\n  File "/usr/local/lib/python3.8/dist-packages/sklearn/pipeline.py", line 336, in _fit\n    X, fitted_transformer = fit_transform_one_cached(\n  File "/usr/local/lib/python3.8/dist-packages/joblib/memory.py", line 349, in __call__\n    return self.func(*args, **kwargs)\n  File "/usr/local/lib/python3.8/dist-packages/sklearn/pipeline.py", line 870, in _fit_transform_one\n    res = transformer.fit_transform(X, y, **fit_params)\n  File "/usr/local/lib/python3.8/dist-packages/sklearn/base.py", line 870, in fit_transform\n    return self.fit(X, y, **fit_params).transform(X)\n  File "/usr/local/lib/python3.8/dist-packages/sklearn/preprocessing/_polynomial.py", line 432, in transform\n    XP = np.empty(\nnumpy.core._exceptions._ArrayMemoryError: Unable to allocate 22.3 PiB for an array with shape (212, 14833897694226) and data type float64\n')
Traceback (most recent call last):
  File "/usr/local/lib/python3.8/dist-packages/optuna/study/_optimize.py", line 196, in _run_trial
    value_or_values = func(trial)
  File "/tmp/ipykernel_7443/2264325072.py", line 23, in __call__
    scores = cross_validate(estimator=model, scoring=metrics,
  File "/usr/local/lib/python3.8/dist-packages/sklearn/model_selection/_validation.py", line 285, in cross_validate
    _warn_or_raise_about_fit_failures(results, error_score)
  File "/usr/local/lib/python3.8/dist-packages/sklearn/model_selection/_validation.py", line 367, in _warn_or_raise_about_fit_failures
    raise ValueError(all_fits_failed_message)
ValueError: 
All the 10 fits failed.
It is very likely that your model is misconfigured.
You can try to debug the error by setting error_score='raise'.

Below are more details about the failures:
--------------------------------------------------------------------------------
5 fits failed with the following error:
Traceback (most recent call last):
  File "/usr/local/lib/python3.8/dist-packages/sklearn/model_selection/_validation.py", line 686, in _fit_and_score
    estimator.fit(X_train, y_train, **fit_params)
  File "/usr/local/lib/python3.8/dist-packages/sklearn/pipeline.py", line 378, in fit
    Xt = self._fit(X, y, **fit_params_steps)
  File "/usr/local/lib/python3.8/dist-packages/sklearn/pipeline.py", line 336, in _fit
    X, fitted_transformer = fit_transform_one_cached(
  File "/usr/local/lib/python3.8/dist-packages/joblib/memory.py", line 349, in __call__
    return self.func(*args, **kwargs)
  File "/usr/local/lib/python3.8/dist-packages/sklearn/pipeline.py", line 870, in _fit_transform_one
    res = transformer.fit_transform(X, y, **fit_params)
  File "/usr/local/lib/python3.8/dist-packages/sklearn/base.py", line 870, in fit_transform
    return self.fit(X, y, **fit_params).transform(X)
  File "/usr/local/lib/python3.8/dist-packages/sklearn/preprocessing/_polynomial.py", line 432, in transform
    XP = np.empty(
numpy.core._exceptions._ArrayMemoryError: Unable to allocate 22.2 PiB for an array with shape (211, 14833897694226) and data type float64

--------------------------------------------------------------------------------
5 fits failed with the following error:
Traceback (most recent call last):
  File "/usr/local/lib/python3.8/dist-packages/sklearn/model_selection/_validation.py", line 686, in _fit_and_score
    estimator.fit(X_train, y_train, **fit_params)
  File "/usr/local/lib/python3.8/dist-packages/sklearn/pipeline.py", line 378, in fit
    Xt = self._fit(X, y, **fit_params_steps)
  File "/usr/local/lib/python3.8/dist-packages/sklearn/pipeline.py", line 336, in _fit
    X, fitted_transformer = fit_transform_one_cached(
  File "/usr/local/lib/python3.8/dist-packages/joblib/memory.py", line 349, in __call__
    return self.func(*args, **kwargs)
  File "/usr/local/lib/python3.8/dist-packages/sklearn/pipeline.py", line 870, in _fit_transform_one
    res = transformer.fit_transform(X, y, **fit_params)
  File "/usr/local/lib/python3.8/dist-packages/sklearn/base.py", line 870, in fit_transform
    return self.fit(X, y, **fit_params).transform(X)
  File "/usr/local/lib/python3.8/dist-packages/sklearn/preprocessing/_polynomial.py", line 432, in transform
    XP = np.empty(
numpy.core._exceptions._ArrayMemoryError: Unable to allocate 22.3 PiB for an array with shape (212, 14833897694226) and data type float64

Trial 10 failed because of the following error: ValueError('\nAll the 10 fits failed.\nIt is very likely that your model is misconfigured.\nYou can try to debug the error by setting error_score=\'raise\'.\n\nBelow are more details about the failures:\n--------------------------------------------------------------------------------\n10 fits failed with the following error:\nTraceback (most recent call last):\n  File "/usr/local/lib/python3.8/dist-packages/sklearn/model_selection/_validation.py", line 686, in _fit_and_score\n    estimator.fit(X_train, y_train, **fit_params)\n  File "/usr/local/lib/python3.8/dist-packages/sklearn/pipeline.py", line 378, in fit\n    Xt = self._fit(X, y, **fit_params_steps)\n  File "/usr/local/lib/python3.8/dist-packages/sklearn/pipeline.py", line 336, in _fit\n    X, fitted_transformer = fit_transform_one_cached(\n  File "/usr/local/lib/python3.8/dist-packages/joblib/memory.py", line 349, in __call__\n    return self.func(*args, **kwargs)\n  File "/usr/local/lib/python3.8/dist-packages/sklearn/pipeline.py", line 870, in _fit_transform_one\n    res = transformer.fit_transform(X, y, **fit_params)\n  File "/usr/local/lib/python3.8/dist-packages/sklearn/base.py", line 870, in fit_transform\n    return self.fit(X, y, **fit_params).transform(X)\n  File "/usr/local/lib/python3.8/dist-packages/sklearn/preprocessing/_polynomial.py", line 432, in transform\n    XP = np.empty(\nValueError: array is too big; `arr.size * arr.dtype.itemsize` is larger than the maximum possible size.\n')
Traceback (most recent call last):
  File "/usr/local/lib/python3.8/dist-packages/optuna/study/_optimize.py", line 196, in _run_trial
    value_or_values = func(trial)
  File "/tmp/ipykernel_7443/2264325072.py", line 23, in __call__
    scores = cross_validate(estimator=model, scoring=metrics,
  File "/usr/local/lib/python3.8/dist-packages/sklearn/model_selection/_validation.py", line 285, in cross_validate
    _warn_or_raise_about_fit_failures(results, error_score)
  File "/usr/local/lib/python3.8/dist-packages/sklearn/model_selection/_validation.py", line 367, in _warn_or_raise_about_fit_failures
    raise ValueError(all_fits_failed_message)
ValueError: 
All the 10 fits failed.
It is very likely that your model is misconfigured.
You can try to debug the error by setting error_score='raise'.

Below are more details about the failures:
--------------------------------------------------------------------------------
10 fits failed with the following error:
Traceback (most recent call last):
  File "/usr/local/lib/python3.8/dist-packages/sklearn/model_selection/_validation.py", line 686, in _fit_and_score
    estimator.fit(X_train, y_train, **fit_params)
  File "/usr/local/lib/python3.8/dist-packages/sklearn/pipeline.py", line 378, in fit
    Xt = self._fit(X, y, **fit_params_steps)
  File "/usr/local/lib/python3.8/dist-packages/sklearn/pipeline.py", line 336, in _fit
    X, fitted_transformer = fit_transform_one_cached(
  File "/usr/local/lib/python3.8/dist-packages/joblib/memory.py", line 349, in __call__
    return self.func(*args, **kwargs)
  File "/usr/local/lib/python3.8/dist-packages/sklearn/pipeline.py", line 870, in _fit_transform_one
    res = transformer.fit_transform(X, y, **fit_params)
  File "/usr/local/lib/python3.8/dist-packages/sklearn/base.py", line 870, in fit_transform
    return self.fit(X, y, **fit_params).transform(X)
  File "/usr/local/lib/python3.8/dist-packages/sklearn/preprocessing/_polynomial.py", line 432, in transform
    XP = np.empty(
ValueError: array is too big; `arr.size * arr.dtype.itemsize` is larger than the maximum possible size.

Trial 15 failed because of the following error: ValueError('\nAll the 10 fits failed.\nIt is very likely that your model is misconfigured.\nYou can try to debug the error by setting error_score=\'raise\'.\n\nBelow are more details about the failures:\n--------------------------------------------------------------------------------\n10 fits failed with the following error:\nTraceback (most recent call last):\n  File "/usr/local/lib/python3.8/dist-packages/sklearn/model_selection/_validation.py", line 686, in _fit_and_score\n    estimator.fit(X_train, y_train, **fit_params)\n  File "/usr/local/lib/python3.8/dist-packages/sklearn/pipeline.py", line 378, in fit\n    Xt = self._fit(X, y, **fit_params_steps)\n  File "/usr/local/lib/python3.8/dist-packages/sklearn/pipeline.py", line 336, in _fit\n    X, fitted_transformer = fit_transform_one_cached(\n  File "/usr/local/lib/python3.8/dist-packages/joblib/memory.py", line 349, in __call__\n    return self.func(*args, **kwargs)\n  File "/usr/local/lib/python3.8/dist-packages/sklearn/pipeline.py", line 870, in _fit_transform_one\n    res = transformer.fit_transform(X, y, **fit_params)\n  File "/usr/local/lib/python3.8/dist-packages/sklearn/base.py", line 870, in fit_transform\n    return self.fit(X, y, **fit_params).transform(X)\n  File "/usr/local/lib/python3.8/dist-packages/sklearn/preprocessing/_polynomial.py", line 432, in transform\n    XP = np.empty(\nValueError: array is too big; `arr.size * arr.dtype.itemsize` is larger than the maximum possible size.\n')
Traceback (most recent call last):
  File "/usr/local/lib/python3.8/dist-packages/optuna/study/_optimize.py", line 196, in _run_trial
    value_or_values = func(trial)
  File "/tmp/ipykernel_7443/2264325072.py", line 23, in __call__
    scores = cross_validate(estimator=model, scoring=metrics,
  File "/usr/local/lib/python3.8/dist-packages/sklearn/model_selection/_validation.py", line 285, in cross_validate
    _warn_or_raise_about_fit_failures(results, error_score)
  File "/usr/local/lib/python3.8/dist-packages/sklearn/model_selection/_validation.py", line 367, in _warn_or_raise_about_fit_failures
    raise ValueError(all_fits_failed_message)
ValueError: 
All the 10 fits failed.
It is very likely that your model is misconfigured.
You can try to debug the error by setting error_score='raise'.

Below are more details about the failures:
--------------------------------------------------------------------------------
10 fits failed with the following error:
Traceback (most recent call last):
  File "/usr/local/lib/python3.8/dist-packages/sklearn/model_selection/_validation.py", line 686, in _fit_and_score
    estimator.fit(X_train, y_train, **fit_params)
  File "/usr/local/lib/python3.8/dist-packages/sklearn/pipeline.py", line 378, in fit
    Xt = self._fit(X, y, **fit_params_steps)
  File "/usr/local/lib/python3.8/dist-packages/sklearn/pipeline.py", line 336, in _fit
    X, fitted_transformer = fit_transform_one_cached(
  File "/usr/local/lib/python3.8/dist-packages/joblib/memory.py", line 349, in __call__
    return self.func(*args, **kwargs)
  File "/usr/local/lib/python3.8/dist-packages/sklearn/pipeline.py", line 870, in _fit_transform_one
    res = transformer.fit_transform(X, y, **fit_params)
  File "/usr/local/lib/python3.8/dist-packages/sklearn/base.py", line 870, in fit_transform
    return self.fit(X, y, **fit_params).transform(X)
  File "/usr/local/lib/python3.8/dist-packages/sklearn/preprocessing/_polynomial.py", line 432, in transform
    XP = np.empty(
ValueError: array is too big; `arr.size * arr.dtype.itemsize` is larger than the maximum possible size.

Trial 13 failed because of the following error: ValueError('\nAll the 10 fits failed.\nIt is very likely that your model is misconfigured.\nYou can try to debug the error by setting error_score=\'raise\'.\n\nBelow are more details about the failures:\n--------------------------------------------------------------------------------\n10 fits failed with the following error:\nTraceback (most recent call last):\n  File "/usr/local/lib/python3.8/dist-packages/sklearn/model_selection/_validation.py", line 686, in _fit_and_score\n    estimator.fit(X_train, y_train, **fit_params)\n  File "/usr/local/lib/python3.8/dist-packages/sklearn/pipeline.py", line 378, in fit\n    Xt = self._fit(X, y, **fit_params_steps)\n  File "/usr/local/lib/python3.8/dist-packages/sklearn/pipeline.py", line 336, in _fit\n    X, fitted_transformer = fit_transform_one_cached(\n  File "/usr/local/lib/python3.8/dist-packages/joblib/memory.py", line 349, in __call__\n    return self.func(*args, **kwargs)\n  File "/usr/local/lib/python3.8/dist-packages/sklearn/pipeline.py", line 870, in _fit_transform_one\n    res = transformer.fit_transform(X, y, **fit_params)\n  File "/usr/local/lib/python3.8/dist-packages/sklearn/base.py", line 870, in fit_transform\n    return self.fit(X, y, **fit_params).transform(X)\n  File "/usr/local/lib/python3.8/dist-packages/sklearn/preprocessing/_polynomial.py", line 432, in transform\n    XP = np.empty(\nValueError: Maximum allowed dimension exceeded\n')
Traceback (most recent call last):
  File "/usr/local/lib/python3.8/dist-packages/optuna/study/_optimize.py", line 196, in _run_trial
    value_or_values = func(trial)
  File "/tmp/ipykernel_7443/2264325072.py", line 23, in __call__
    scores = cross_validate(estimator=model, scoring=metrics,
  File "/usr/local/lib/python3.8/dist-packages/sklearn/model_selection/_validation.py", line 285, in cross_validate
    _warn_or_raise_about_fit_failures(results, error_score)
  File "/usr/local/lib/python3.8/dist-packages/sklearn/model_selection/_validation.py", line 367, in _warn_or_raise_about_fit_failures
    raise ValueError(all_fits_failed_message)
ValueError: 
All the 10 fits failed.
It is very likely that your model is misconfigured.
You can try to debug the error by setting error_score='raise'.

Below are more details about the failures:
--------------------------------------------------------------------------------
10 fits failed with the following error:
Traceback (most recent call last):
  File "/usr/local/lib/python3.8/dist-packages/sklearn/model_selection/_validation.py", line 686, in _fit_and_score
    estimator.fit(X_train, y_train, **fit_params)
  File "/usr/local/lib/python3.8/dist-packages/sklearn/pipeline.py", line 378, in fit
    Xt = self._fit(X, y, **fit_params_steps)
  File "/usr/local/lib/python3.8/dist-packages/sklearn/pipeline.py", line 336, in _fit
    X, fitted_transformer = fit_transform_one_cached(
  File "/usr/local/lib/python3.8/dist-packages/joblib/memory.py", line 349, in __call__
    return self.func(*args, **kwargs)
  File "/usr/local/lib/python3.8/dist-packages/sklearn/pipeline.py", line 870, in _fit_transform_one
    res = transformer.fit_transform(X, y, **fit_params)
  File "/usr/local/lib/python3.8/dist-packages/sklearn/base.py", line 870, in fit_transform
    return self.fit(X, y, **fit_params).transform(X)
  File "/usr/local/lib/python3.8/dist-packages/sklearn/preprocessing/_polynomial.py", line 432, in transform
    XP = np.empty(
ValueError: Maximum allowed dimension exceeded

Trial 19 failed because of the following error: ValueError('\nAll the 10 fits failed.\nIt is very likely that your model is misconfigured.\nYou can try to debug the error by setting error_score=\'raise\'.\n\nBelow are more details about the failures:\n--------------------------------------------------------------------------------\n10 fits failed with the following error:\nTraceback (most recent call last):\n  File "/usr/local/lib/python3.8/dist-packages/sklearn/model_selection/_validation.py", line 686, in _fit_and_score\n    estimator.fit(X_train, y_train, **fit_params)\n  File "/usr/local/lib/python3.8/dist-packages/sklearn/pipeline.py", line 378, in fit\n    Xt = self._fit(X, y, **fit_params_steps)\n  File "/usr/local/lib/python3.8/dist-packages/sklearn/pipeline.py", line 336, in _fit\n    X, fitted_transformer = fit_transform_one_cached(\n  File "/usr/local/lib/python3.8/dist-packages/joblib/memory.py", line 349, in __call__\n    return self.func(*args, **kwargs)\n  File "/usr/local/lib/python3.8/dist-packages/sklearn/pipeline.py", line 870, in _fit_transform_one\n    res = transformer.fit_transform(X, y, **fit_params)\n  File "/usr/local/lib/python3.8/dist-packages/sklearn/base.py", line 870, in fit_transform\n    return self.fit(X, y, **fit_params).transform(X)\n  File "/usr/local/lib/python3.8/dist-packages/sklearn/preprocessing/_polynomial.py", line 432, in transform\n    XP = np.empty(\nValueError: array is too big; `arr.size * arr.dtype.itemsize` is larger than the maximum possible size.\n')
Traceback (most recent call last):
  File "/usr/local/lib/python3.8/dist-packages/optuna/study/_optimize.py", line 196, in _run_trial
    value_or_values = func(trial)
  File "/tmp/ipykernel_7443/2264325072.py", line 23, in __call__
    scores = cross_validate(estimator=model, scoring=metrics,
  File "/usr/local/lib/python3.8/dist-packages/sklearn/model_selection/_validation.py", line 285, in cross_validate
    _warn_or_raise_about_fit_failures(results, error_score)
  File "/usr/local/lib/python3.8/dist-packages/sklearn/model_selection/_validation.py", line 367, in _warn_or_raise_about_fit_failures
    raise ValueError(all_fits_failed_message)
ValueError: 
All the 10 fits failed.
It is very likely that your model is misconfigured.
You can try to debug the error by setting error_score='raise'.

Below are more details about the failures:
--------------------------------------------------------------------------------
10 fits failed with the following error:
Traceback (most recent call last):
  File "/usr/local/lib/python3.8/dist-packages/sklearn/model_selection/_validation.py", line 686, in _fit_and_score
    estimator.fit(X_train, y_train, **fit_params)
  File "/usr/local/lib/python3.8/dist-packages/sklearn/pipeline.py", line 378, in fit
    Xt = self._fit(X, y, **fit_params_steps)
  File "/usr/local/lib/python3.8/dist-packages/sklearn/pipeline.py", line 336, in _fit
    X, fitted_transformer = fit_transform_one_cached(
  File "/usr/local/lib/python3.8/dist-packages/joblib/memory.py", line 349, in __call__
    return self.func(*args, **kwargs)
  File "/usr/local/lib/python3.8/dist-packages/sklearn/pipeline.py", line 870, in _fit_transform_one
    res = transformer.fit_transform(X, y, **fit_params)
  File "/usr/local/lib/python3.8/dist-packages/sklearn/base.py", line 870, in fit_transform
    return self.fit(X, y, **fit_params).transform(X)
  File "/usr/local/lib/python3.8/dist-packages/sklearn/preprocessing/_polynomial.py", line 432, in transform
    XP = np.empty(
ValueError: array is too big; `arr.size * arr.dtype.itemsize` is larger than the maximum possible size.

Trial 20 failed because of the following error: ValueError('\nAll the 10 fits failed.\nIt is very likely that your model is misconfigured.\nYou can try to debug the error by setting error_score=\'raise\'.\n\nBelow are more details about the failures:\n--------------------------------------------------------------------------------\n10 fits failed with the following error:\nTraceback (most recent call last):\n  File "/usr/local/lib/python3.8/dist-packages/sklearn/model_selection/_validation.py", line 686, in _fit_and_score\n    estimator.fit(X_train, y_train, **fit_params)\n  File "/usr/local/lib/python3.8/dist-packages/sklearn/pipeline.py", line 378, in fit\n    Xt = self._fit(X, y, **fit_params_steps)\n  File "/usr/local/lib/python3.8/dist-packages/sklearn/pipeline.py", line 336, in _fit\n    X, fitted_transformer = fit_transform_one_cached(\n  File "/usr/local/lib/python3.8/dist-packages/joblib/memory.py", line 349, in __call__\n    return self.func(*args, **kwargs)\n  File "/usr/local/lib/python3.8/dist-packages/sklearn/pipeline.py", line 870, in _fit_transform_one\n    res = transformer.fit_transform(X, y, **fit_params)\n  File "/usr/local/li