Trial 39 finished with value: 0.7713273539189683 and parameters: {'alpha': 0.21510931023757707, 'max_iter': 93048}. Best is trial 10 with value: 0.7724504046344387.
Trial 32 finished with value: 0.7714333563877155 and parameters: {'alpha': 0.5874527204881834, 'max_iter': 58675}. Best is trial 10 with value: 0.7724504046344387.
Trial 43 finished with value: 0.7718357437047653 and parameters: {'alpha': 2.1058352421111937, 'max_iter': 64830}. Best is trial 10 with value: 0.7724504046344387.
Trial 40 finished with value: 0.7715973262111309 and parameters: {'alpha': 1.1847883466243214, 'max_iter': 78084}. Best is trial 10 with value: 0.7724504046344387.
Trial 44 finished with value: 0.7712648192551591 and parameters: {'alpha': 0.00016646328602127854, 'max_iter': 69705}. Best is trial 10 with value: 0.7724504046344387.
Trial 30 finished with value: 0.7712687800851621 and parameters: {'alpha': 0.013680442873166571, 'max_iter': 6896}. Best is trial 10 with value: 0.7724504046344387.
Trial 41 finished with value: 0.7712964136004821 and parameters: {'alpha': 0.10833758002651883, 'max_iter': 46264}. Best is trial 10 with value: 0.7724504046344387.
Trial 46 finished with value: 0.7714920664612113 and parameters: {'alpha': 0.7982313190090485, 'max_iter': 1325}. Best is trial 10 with value: 0.7724504046344387.
Trial 47 finished with value: 0.7712648442674921 and parameters: {'alpha': 0.00025176110862624605, 'max_iter': 33505}. Best is trial 10 with value: 0.7724504046344387.
Trial 48 finished with value: 0.7712649753806071 and parameters: {'alpha': 0.0006988957690739357, 'max_iter': 77383}. Best is trial 10 with value: 0.7724504046344387.
Trial 51 finished with value: 0.7712652869732921 and parameters: {'alpha': 0.001761578040298435, 'max_iter': 67440}. Best is trial 10 with value: 0.7724504046344387.
Trial 45 finished with value: 0.7721854853786903 and parameters: {'alpha': 3.595633702649185, 'max_iter': 24401}. Best is trial 10 with value: 0.7724504046344387.
Trial 53 finished with value: 0.7714320774408419 and parameters: {'alpha': 0.5828980967858853, 'max_iter': 89943}. Best is trial 10 with value: 0.7724504046344387.
Trial 56 finished with value: 0.7712648727619186 and parameters: {'alpha': 0.0003489343215634345, 'max_iter': 91088}. Best is trial 10 with value: 0.7724504046344387.
Trial 49 finished with value: 0.7712653339910552 and parameters: {'alpha': 0.0019219386036126902, 'max_iter': 75330}. Best is trial 10 with value: 0.7724504046344387.
Trial 54 finished with value: 0.7712717931981795 and parameters: {'alpha': 0.02396985952027221, 'max_iter': 4041}. Best is trial 10 with value: 0.7724504046344387.
Trial 50 finished with value: 0.7712648390513043 and parameters: {'alpha': 0.00023397266156916646, 'max_iter': 87569}. Best is trial 10 with value: 0.7724504046344387.
Trial 52 finished with value: 0.7713079891298145 and parameters: {'alpha': 0.14818528174849008, 'max_iter': 1104}. Best is trial 10 with value: 0.7724504046344387.
Trial 63 finished with value: 0.7714508138443013 and parameters: {'alpha': 0.6497789681351914, 'max_iter': 6407}. Best is trial 10 with value: 0.7724504046344387.
Trial 59 finished with value: 0.771333106068431 and parameters: {'alpha': 0.23505234675696224, 'max_iter': 14300}. Best is trial 60 with value: 0.7725352853325771.
Trial 60 finished with value: 0.7725352853325771 and parameters: {'alpha': 5.310099612295626, 'max_iter': 96637}. Best is trial 60 with value: 0.7725352853325771.
Trial 62 finished with value: 0.771266556773979 and parameters: {'alpha': 0.006093069111839462, 'max_iter': 75013}. Best is trial 60 with value: 0.7725352853325771.
Trial 58 finished with value: 0.7712662677688795 and parameters: {'alpha': 0.005107106333250134, 'max_iter': 92998}. Best is trial 60 with value: 0.7725352853325771.
Trial 55 finished with value: 0.7712707855395673 and parameters: {'alpha': 0.020527964583445267, 'max_iter': 3901}. Best is trial 60 with value: 0.7725352853325771.
Trial 57 finished with value: 0.7713404005304614 and parameters: {'alpha': 0.260385003816925, 'max_iter': 53185}. Best is trial 60 with value: 0.7725352853325771.
Trial 64 finished with value: 0.7712719565303358 and parameters: {'alpha': 0.024527840603812315, 'max_iter': 61286}. Best is trial 60 with value: 0.7725352853325771.
Trial 67 finished with value: 0.77240522730571 and parameters: {'alpha': 4.640590145537478, 'max_iter': 28355}. Best is trial 60 with value: 0.7725352853325771.
Trial 65 finished with value: 0.7712653983223003 and parameters: {'alpha': 0.0021413522310025305, 'max_iter': 45030}. Best is trial 60 with value: 0.7725352853325771.
Trial 70 finished with value: 0.7712653563158989 and parameters: {'alpha': 0.001998081219197575, 'max_iter': 52708}. Best is trial 60 with value: 0.7725352853325771.
Trial 69 finished with value: 0.7712681894707456 and parameters: {'alpha': 0.011664474084890386, 'max_iter': 53534}. Best is trial 60 with value: 0.7725352853325771.
Trial 66 finished with value: 0.7713485527757523 and parameters: {'alpha': 0.28875290121438696, 'max_iter': 85624}. Best is trial 60 with value: 0.7725352853325771.
Trial 68 finished with value: 0.7712649095197646 and parameters: {'alpha': 0.0004742889083471188, 'max_iter': 23341}. Best is trial 60 with value: 0.7725352853325771.
Trial 73 finished with value: 0.7724977714815199 and parameters: {'alpha': 5.112566690653939, 'max_iter': 97715}. Best is trial 60 with value: 0.7725352853325771.
Trial 61 finished with value: 0.7712659891330366 and parameters: {'alpha': 0.004156586391618543, 'max_iter': 10195}. Best is trial 60 with value: 0.7725352853325771.
Trial 74 finished with value: 0.7712659096382543 and parameters: {'alpha': 0.003885415251517215, 'max_iter': 67035}. Best is trial 77 with value: 0.7726025237206751.
Trial 72 finished with value: 0.7713048356539043 and parameters: {'alpha': 0.13731814986719054, 'max_iter': 4221}. Best is trial 77 with value: 0.7726025237206751.
Trial 77 finished with value: 0.7726025237206751 and parameters: {'alpha': 5.6739554776167935, 'max_iter': 23214}. Best is trial 77 with value: 0.7726025237206751.
Trial 76 finished with value: 0.771267798277961 and parameters: {'alpha': 0.010329363174838499, 'max_iter': 19082}. Best is trial 77 with value: 0.7726025237206751.
Trial 75 finished with value: 0.771264932077378 and parameters: {'alpha': 0.0005512172801822199, 'max_iter': 21872}. Best is trial 77 with value: 0.7726025237206751.
Trial 78 finished with value: 0.7721724666857617 and parameters: {'alpha': 3.5366702076818766, 'max_iter': 15903}. Best is trial 77 with value: 0.7726025237206751.
Trial 86 finished with value: 0.7712783024805315 and parameters: {'alpha': 0.046224773125751746, 'max_iter': 59024}. Best is trial 77 with value: 0.7726025237206751.
Trial 81 finished with value: 0.7712650324644372 and parameters: {'alpha': 0.0008935731526147192, 'max_iter': 16067}. Best is trial 77 with value: 0.7726025237206751.
Trial 71 finished with value: 0.7712650924512628 and parameters: {'alpha': 0.0010981538319232373, 'max_iter': 26037}. Best is trial 77 with value: 0.7726025237206751.
Trial 85 finished with value: 0.7712654956919631 and parameters: {'alpha': 0.0024734562016899973, 'max_iter': 55958}. Best is trial 77 with value: 0.7726025237206751.
Trial 79 finished with value: 0.771266716837455 and parameters: {'alpha': 0.006639168383528238, 'max_iter': 22225}. Best is trial 77 with value: 0.7726025237206751.
Trial 89 finished with value: 0.7714560138555386 and parameters: {'alpha': 0.6684005285162687, 'max_iter': 62000}. Best is trial 77 with value: 0.7726025237206751.
Trial 84 finished with value: 0.7714834432735168 and parameters: {'alpha': 0.7670618823657651, 'max_iter': 91715}. Best is trial 77 with value: 0.7726025237206751.
Trial 82 finished with value: 0.7712648687520648 and parameters: {'alpha': 0.00033525966273002046, 'max_iter': 73727}. Best is trial 77 with value: 0.7726025237206751.
Trial 83 finished with value: 0.7712652716620372 and parameters: {'alpha': 0.0017093573010231358, 'max_iter': 76116}. Best is trial 77 with value: 0.7726025237206751.
Trial 92 finished with value: 0.7712886071953471 and parameters: {'alpha': 0.0815304781904921, 'max_iter': 63855}. Best is trial 77 with value: 0.7726025237206751.
Trial 91 finished with value: 0.7712657561050051 and parameters: {'alpha': 0.0033617006815437334, 'max_iter': 4376}. Best is trial 77 with value: 0.7726025237206751.
Trial 87 finished with value: 0.7724930884206922 and parameters: {'alpha': 5.088168988677075, 'max_iter': 36868}. Best is trial 77 with value: 0.7726025237206751.
Trial 96 finished with value: 0.7713596964632325 and parameters: {'alpha': 0.32762698135616264, 'max_iter': 90740}. Best is trial 77 with value: 0.7726025237206751.
Trial 95 finished with value: 0.7712654034951776 and parameters: {'alpha': 0.002158995439967939, 'max_iter': 49156}. Best is trial 77 with value: 0.7726025237206751.
Trial 94 finished with value: 0.7712648075181694 and parameters: {'alpha': 0.0001264376280705562, 'max_iter': 43806}. Best is trial 77 with value: 0.7726025237206751.
Trial 99 finished with value: 0.7713970274067411 and parameters: {'alpha': 0.45867760389358536, 'max_iter': 2640}. Best is trial 77 with value: 0.7726025237206751.
Trial 80 finished with value: 0.7713863248767924 and parameters: {'alpha': 0.4209754188436816, 'max_iter': 35004}. Best is trial 77 with value: 0.7726025237206751.
Trial 101 finished with value: 0.7712687117634541 and parameters: {'alpha': 0.01344722232810551, 'max_iter': 94049}. Best is trial 77 with value: 0.7726025237206751.
Trial 88 finished with value: 0.7712926891130143 and parameters: {'alpha': 0.09554115150199635, 'max_iter': 46369}. Best is trial 77 with value: 0.7726025237206751.
Trial 100 finished with value: 0.7712648503275259 and parameters: {'alpha': 0.0002724273014298237, 'max_iter': 74124}. Best is trial 77 with value: 0.7726025237206751.
Trial 90 finished with value: 0.7719037645315638 and parameters: {'alpha': 2.3815062594268728, 'max_iter': 3580}. Best is trial 77 with value: 0.7726025237206751.
Trial 107 finished with value: 0.7713219167038929 and parameters: {'alpha': 0.1962851223743647, 'max_iter': 27371}. Best is trial 77 with value: 0.7726025237206751.
Trial 98 finished with value: 0.7714355131075228 and parameters: {'alpha': 0.5951368220547452, 'max_iter': 59379}. Best is trial 77 with value: 0.7726025237206751.
Trial 97 finished with value: 0.7712657368938813 and parameters: {'alpha': 0.0032961713670665335, 'max_iter': 34909}. Best is trial 77 with value: 0.7726025237206751.
Trial 93 finished with value: 0.7713124607811459 and parameters: {'alpha': 0.16360987014273964, 'max_iter': 36180}. Best is trial 77 with value: 0.7726025237206751.
Trial 102 finished with value: 0.771265108790141 and parameters: {'alpha': 0.0011538769107786626, 'max_iter': 42134}. Best is trial 77 with value: 0.7726025237206751.
Trial 103 finished with value: 0.7712921499572185 and parameters: {'alpha': 0.09368974013976249, 'max_iter': 20532}. Best is trial 77 with value: 0.7726025237206751.
Trial 110 finished with value: 0.7712820613328146 and parameters: {'alpha': 0.05909265188480336, 'max_iter': 5730}. Best is trial 77 with value: 0.7726025237206751.
Trial 105 finished with value: 0.7714364982142465 and parameters: {'alpha': 0.5986480989578844, 'max_iter': 93698}. Best is trial 77 with value: 0.7726025237206751.
Trial 106 finished with value: 0.7712658413779131 and parameters: {'alpha': 0.0036525711237172377, 'max_iter': 76292}. Best is trial 77 with value: 0.7726025237206751.
Trial 109 finished with value: 0.7712648036094145 and parameters: {'alpha': 0.00011310795984427635, 'max_iter': 97535}. Best is trial 77 with value: 0.7726025237206751.
Trial 104 finished with value: 0.7712871197967445 and parameters: {'alpha': 0.07642874776995759, 'max_iter': 4213}. Best is trial 77 with value: 0.7726025237206751.
