Trial 25 finished with value: 0.47106385661789363 and parameters: {'alpha': 0.8826668777215501, 'max_iter': 78260}. Best is trial 20 with value: 0.4739804617344876.
Trial 23 finished with value: 0.470783325118053 and parameters: {'alpha': 0.0017777354058271886, 'max_iter': 15491}. Best is trial 20 with value: 0.4739804617344876.
Trial 20 finished with value: 0.4739804617344876 and parameters: {'alpha': 4.961922866909209, 'max_iter': 39693}. Best is trial 20 with value: 0.4739804617344876.
Trial 28 finished with value: 0.47188777133622406 and parameters: {'alpha': 1.1244296194248673, 'max_iter': 46821}. Best is trial 20 with value: 0.4739804617344876.
Trial 31 finished with value: 0.4707832686989086 and parameters: {'alpha': 0.0015639279713810128, 'max_iter': 17801}. Best is trial 20 with value: 0.4739804617344876.
Trial 29 finished with value: 0.47408152903745204 and parameters: {'alpha': 3.165264696537331, 'max_iter': 42144}. Best is trial 29 with value: 0.47408152903745204.
Trial 22 finished with value: 0.47082109716237797 and parameters: {'alpha': 0.11375860466107847, 'max_iter': 60994}. Best is trial 29 with value: 0.47408152903745204.
Trial 27 finished with value: 0.473968180364988 and parameters: {'alpha': 1.6470753259066617, 'max_iter': 5191}. Best is trial 29 with value: 0.47408152903745204.
Trial 26 finished with value: 0.4707828923502905 and parameters: {'alpha': 0.00013757580225150904, 'max_iter': 94618}. Best is trial 29 with value: 0.47408152903745204.
Trial 32 finished with value: 0.47078289377852867 and parameters: {'alpha': 0.00014298922226206687, 'max_iter': 71777}. Best is trial 29 with value: 0.47408152903745204.
Trial 30 finished with value: 0.47080296248011333 and parameters: {'alpha': 0.05162768144203773, 'max_iter': 17296}. Best is trial 29 with value: 0.47408152903745204.
Trial 33 finished with value: 0.4707839194877653 and parameters: {'alpha': 0.004029858227346169, 'max_iter': 54738}. Best is trial 29 with value: 0.47408152903745204.
Trial 37 finished with value: 0.4708059709862539 and parameters: {'alpha': 0.06214654061858248, 'max_iter': 41167}. Best is trial 29 with value: 0.47408152903745204.
Trial 35 finished with value: 0.47078299803863527 and parameters: {'alpha': 0.0005381551584777781, 'max_iter': 9675}. Best is trial 29 with value: 0.47408152903745204.
Trial 34 finished with value: 0.4707849936531415 and parameters: {'alpha': 0.008098486167132305, 'max_iter': 61636}. Best is trial 29 with value: 0.47408152903745204.
Trial 44 finished with value: 0.4707830296473956 and parameters: {'alpha': 0.000657955005043093, 'max_iter': 69101}. Best is trial 29 with value: 0.47408152903745204.
Trial 47 finished with value: 0.4707829694785281 and parameters: {'alpha': 0.0004299085770780785, 'max_iter': 32453}. Best is trial 29 with value: 0.47408152903745204.
Trial 36 finished with value: 0.470784988425912 and parameters: {'alpha': 0.008078691632149004, 'max_iter': 31511}. Best is trial 29 with value: 0.47408152903745204.
Trial 45 finished with value: 0.47078515493298784 and parameters: {'alpha': 0.008709199771879353, 'max_iter': 30033}. Best is trial 29 with value: 0.47408152903745204.
Trial 38 finished with value: 0.47078388701885104 and parameters: {'alpha': 0.003906845432167765, 'max_iter': 32521}. Best is trial 29 with value: 0.47408152903745204.
Trial 40 finished with value: 0.4736638509890311 and parameters: {'alpha': 5.731445029202253, 'max_iter': 68011}. Best is trial 29 with value: 0.47408152903745204.
Trial 24 finished with value: 0.4708973944000852 and parameters: {'alpha': 0.3431655672965885, 'max_iter': 94912}. Best is trial 29 with value: 0.47408152903745204.
Trial 39 finished with value: 0.470783264158512 and parameters: {'alpha': 0.0015467213429865997, 'max_iter': 76673}. Best is trial 29 with value: 0.47408152903745204.
Trial 46 finished with value: 0.4707849881209592 and parameters: {'alpha': 0.008077536832192657, 'max_iter': 95087}. Best is trial 29 with value: 0.47408152903745204.
Trial 41 finished with value: 0.4707830534838086 and parameters: {'alpha': 0.0007482959394417457, 'max_iter': 85461}. Best is trial 29 with value: 0.47408152903745204.
Trial 48 finished with value: 0.4740721172854844 and parameters: {'alpha': 3.1375904612189234, 'max_iter': 89656}. Best is trial 29 with value: 0.47408152903745204.
Trial 42 finished with value: 0.4707835800789031 and parameters: {'alpha': 0.002743876938446561, 'max_iter': 15242}. Best is trial 29 with value: 0.47408152903745204.
Trial 53 finished with value: 0.47078289109824845 and parameters: {'alpha': 0.0001328302115502797, 'max_iter': 38675}. Best is trial 29 with value: 0.47408152903745204.
Trial 49 finished with value: 0.4708054913904121 and parameters: {'alpha': 0.06049295579701551, 'max_iter': 86517}. Best is trial 29 with value: 0.47408152903745204.
Trial 52 finished with value: 0.4709248237471123 and parameters: {'alpha': 0.4320415150358024, 'max_iter': 51787}. Best is trial 29 with value: 0.47408152903745204.
Trial 55 finished with value: 0.47078289819891755 and parameters: {'alpha': 0.00015974370445812067, 'max_iter': 20154}. Best is trial 29 with value: 0.47408152903745204.
Trial 57 finished with value: 0.47078288372273025 and parameters: {'alpha': 0.00010487487978126455, 'max_iter': 99900}. Best is trial 29 with value: 0.47408152903745204.
Trial 50 finished with value: 0.47078290499166087 and parameters: {'alpha': 0.0001854899974126647, 'max_iter': 11669}. Best is trial 29 with value: 0.47408152903745204.
Trial 43 finished with value: 0.4707829559629067 and parameters: {'alpha': 0.00037868212730689845, 'max_iter': 75876}. Best is trial 29 with value: 0.47408152903745204.
Trial 58 finished with value: 0.4707832129652173 and parameters: {'alpha': 0.0013527130742691297, 'max_iter': 73242}. Best is trial 29 with value: 0.47408152903745204.
Trial 60 finished with value: 0.47078288402540586 and parameters: {'alpha': 0.00010602210885529682, 'max_iter': 30815}. Best is trial 29 with value: 0.47408152903745204.
Trial 56 finished with value: 0.4740714242308002 and parameters: {'alpha': 3.306193884830832, 'max_iter': 93502}. Best is trial 29 with value: 0.47408152903745204.
Trial 54 finished with value: 0.4710780801165567 and parameters: {'alpha': 0.9431327819793526, 'max_iter': 58364}. Best is trial 29 with value: 0.47408152903745204.
Trial 51 finished with value: 0.4707980142643137 and parameters: {'alpha': 0.03422717548821374, 'max_iter': 76503}. Best is trial 29 with value: 0.47408152903745204.
Trial 61 finished with value: 0.4707832966251283 and parameters: {'alpha': 0.0016697585350632653, 'max_iter': 46862}. Best is trial 29 with value: 0.47408152903745204.
Trial 63 finished with value: 0.4707832811418827 and parameters: {'alpha': 0.0016110826289651224, 'max_iter': 54392}. Best is trial 29 with value: 0.47408152903745204.
Trial 59 finished with value: 0.473958389830082 and parameters: {'alpha': 5.016821045267771, 'max_iter': 69179}. Best is trial 29 with value: 0.47408152903745204.
Trial 62 finished with value: 0.4707829524292019 and parameters: {'alpha': 0.00036528875105753535, 'max_iter': 57587}. Best is trial 29 with value: 0.47408152903745204.
Trial 69 finished with value: 0.4708052319472046 and parameters: {'alpha': 0.05958433610987707, 'max_iter': 65266}. Best is trial 72 with value: 0.4744770237730605.
Trial 65 finished with value: 0.47081396604106107 and parameters: {'alpha': 0.08950982963618612, 'max_iter': 26354}. Best is trial 72 with value: 0.4744770237730605.
Trial 68 finished with value: 0.4707830406106419 and parameters: {'alpha': 0.0006995062497696354, 'max_iter': 86867}. Best is trial 72 with value: 0.4744770237730605.
Trial 66 finished with value: 0.47093654408746544 and parameters: {'alpha': 0.46995223244485834, 'max_iter': 97409}. Best is trial 72 with value: 0.4744770237730605.
Trial 72 finished with value: 0.4744770237730605 and parameters: {'alpha': 2.0517255989015806, 'max_iter': 28714}. Best is trial 72 with value: 0.4744770237730605.
Trial 70 finished with value: 0.4707834406556465 and parameters: {'alpha': 0.002215563473890372, 'max_iter': 98309}. Best is trial 72 with value: 0.4744770237730605.
Trial 67 finished with value: 0.47078294070455184 and parameters: {'alpha': 0.00032085007568367853, 'max_iter': 82813}. Best is trial 72 with value: 0.4744770237730605.
Trial 71 finished with value: 0.47079864937537047 and parameters: {'alpha': 0.03646450117868318, 'max_iter': 21220}. Best is trial 72 with value: 0.4744770237730605.
Trial 64 finished with value: 0.47401094672665317 and parameters: {'alpha': 1.71850837067151, 'max_iter': 47002}. Best is trial 72 with value: 0.4744770237730605.
Trial 74 finished with value: 0.4707829573400761 and parameters: {'alpha': 0.00038390184180898056, 'max_iter': 18383}. Best is trial 72 with value: 0.4744770237730605.
Trial 73 finished with value: 0.4707828834007938 and parameters: {'alpha': 0.00010365464643358839, 'max_iter': 34814}. Best is trial 72 with value: 0.4744770237730605.
Trial 76 finished with value: 0.47079720103598294 and parameters: {'alpha': 0.03136072032383584, 'max_iter': 64434}. Best is trial 72 with value: 0.4744770237730605.
Trial 77 finished with value: 0.47389558585539293 and parameters: {'alpha': 1.4904285788969664, 'max_iter': 7597}. Best is trial 72 with value: 0.4744770237730605.
Trial 78 finished with value: 0.4708412233576539 and parameters: {'alpha': 0.18139823435209737, 'max_iter': 83085}. Best is trial 72 with value: 0.4744770237730605.
Trial 79 finished with value: 0.47084577375928893 and parameters: {'alpha': 0.19657621700325767, 'max_iter': 4517}. Best is trial 72 with value: 0.4744770237730605.
Trial 82 finished with value: 0.4707829079660025 and parameters: {'alpha': 0.00019676351540907084, 'max_iter': 7593}. Best is trial 72 with value: 0.4744770237730605.
Trial 86 finished with value: 0.4707829097954533 and parameters: {'alpha': 0.00020369759541383192, 'max_iter': 35799}. Best is trial 72 with value: 0.4744770237730605.
Trial 75 finished with value: 0.47078295218229566 and parameters: {'alpha': 0.0003643529318262613, 'max_iter': 67963}. Best is trial 72 with value: 0.4744770237730605.
Trial 80 finished with value: 0.47078342845262205 and parameters: {'alpha': 0.0021693213130964356, 'max_iter': 59583}. Best is trial 72 with value: 0.4744770237730605.
Trial 81 finished with value: 0.4707970331519776 and parameters: {'alpha': 0.03076873274753438, 'max_iter': 69579}. Best is trial 72 with value: 0.4744770237730605.
Trial 87 finished with value: 0.47078302792047017 and parameters: {'alpha': 0.0006514098543270769, 'max_iter': 91851}. Best is trial 72 with value: 0.4744770237730605.
Trial 85 finished with value: 0.47098743563529466 and parameters: {'alpha': 0.7181451340666759, 'max_iter': 38163}. Best is trial 72 with value: 0.4744770237730605.
Trial 88 finished with value: 0.47086360276000977 and parameters: {'alpha': 0.2315740147035847, 'max_iter': 64531}. Best is trial 72 with value: 0.4744770237730605.
Trial 84 finished with value: 0.47393160656218125 and parameters: {'alpha': 1.5669865451025402, 'max_iter': 10564}. Best is trial 72 with value: 0.4744770237730605.
Trial 94 finished with value: 0.47098457642329156 and parameters: {'alpha': 0.7050955564628903, 'max_iter': 77167}. Best is trial 72 with value: 0.4744770237730605.
Trial 91 finished with value: 0.470809900822352 and parameters: {'alpha': 0.07561953233403075, 'max_iter': 81660}. Best is trial 72 with value: 0.4744770237730605.
Trial 92 finished with value: 0.47078338665616115 and parameters: {'alpha': 0.0020109358971914233, 'max_iter': 60748}. Best is trial 72 with value: 0.4744770237730605.
Trial 83 finished with value: 0.4707835527456913 and parameters: {'alpha': 0.0026403063065567767, 'max_iter': 64607}. Best is trial 72 with value: 0.4744770237730605.
Trial 90 finished with value: 0.4707828999944509 and parameters: {'alpha': 0.000166549257199192, 'max_iter': 56398}. Best is trial 72 with value: 0.4744770237730605.
Trial 95 finished with value: 0.47078288793530687 and parameters: {'alpha': 0.00012084176531800124, 'max_iter': 87310}. Best is trial 72 with value: 0.4744770237730605.
Trial 100 finished with value: 0.47078293518800535 and parameters: {'alpha': 0.000299941228334175, 'max_iter': 25029}. Best is trial 72 with value: 0.4744770237730605.
Trial 97 finished with value: 0.4707851784331588 and parameters: {'alpha': 0.008798183473843216, 'max_iter': 41828}. Best is trial 72 with value: 0.4744770237730605.
Trial 93 finished with value: 0.4707945563463524 and parameters: {'alpha': 0.022025937084738805, 'max_iter': 57539}. Best is trial 72 with value: 0.4744770237730605.
Trial 102 finished with value: 0.4712048547734559 and parameters: {'alpha': 6.708740687974438, 'max_iter': 71638}. Best is trial 72 with value: 0.4744770237730605.
Trial 99 finished with value: 0.4707828898856394 and parameters: {'alpha': 0.00012823408130373877, 'max_iter': 71570}. Best is trial 72 with value: 0.4744770237730605.
Trial 96 finished with value: 0.4709672933854542 and parameters: {'alpha': 0.6286758453805206, 'max_iter': 99163}. Best is trial 72 with value: 0.4744770237730605.
Trial 103 finished with value: 0.47078377608994204 and parameters: {'alpha': 0.003486563411757557, 'max_iter': 45764}. Best is trial 72 with value: 0.4744770237730605.
Trial 98 finished with value: 0.4707829977002923 and parameters: {'alpha': 0.000536872801476724, 'max_iter': 82373}. Best is trial 72 with value: 0.4744770237730605.
Trial 104 finished with value: 0.4729455245410838 and parameters: {'alpha': 4.12602602891581, 'max_iter': 56996}. Best is trial 72 with value: 0.4744770237730605.
Trial 108 finished with value: 0.4707851389159787 and parameters: {'alpha': 0.00864855061913855, 'max_iter': 66229}. Best is trial 72 with value: 0.4744770237730605.
Trial 101 finished with value: 0.4707831390041898 and parameters: {'alpha': 0.0010724139661441973, 'max_iter': 15526}. Best is trial 72 with value: 0.4744770237730605.
Trial 112 finished with value: 0.4707829707330829 and parameters: {'alpha': 0.0004346635328486257, 'max_iter': 14570}. Best is trial 72 with value: 0.4744770237730605.
Trial 105 finished with value: 0.4700122646472197 and parameters: {'alpha': 7.000039739844046, 'max_iter': 72724}. Best is trial 72 with value: 0.4744770237730605.
Trial 114 finished with value: 0.47185212067404814 and parameters: {'alpha': 9.23488559636242, 'max_iter': 38015}. Best is trial 72 with value: 0.4744770237730605.
Trial 109 finished with value: 0.47078375049087445 and parameters: {'alpha': 0.003389572040902021, 'max_iter': 70186}. Best is trial 72 with value: 0.4744770237730605.
Trial 113 finished with value: 0.4708028577415272 and parameters: {'alpha': 0.051260104252268006, 'max_iter': 47894}. Best is trial 72 with value: 0.4744770237730605.
Trial 110 finished with value: 0.4707829322780371 and parameters: {'alpha': 0.00028891182969014215, 'max_iter': 97651}. Best is trial 72 with value: 0.4744770237730605.
Trial 106 finished with value: 0.47122935170537766 and parameters: {'alpha': 6.654820958369367, 'max_iter': 81278}. Best is trial 72 with value: 0.4744770237730605.
Trial 111 finished with value: 0.47078365529088845 and parameters: {'alpha': 0.003028862850868924, 'max_iter': 49196}. Best is trial 72 with value: 0.4744770237730605.
Trial 89 finished with value: 0.47078330108735245 and parameters: {'alpha': 0.001686668679430961, 'max_iter': 86016}. Best is trial 72 with value: 0.4744770237730605.
Trial 107 finished with value: 0.47111915765389556 and parameters: {'alpha': 1.112142938001387, 'max_iter': 74270}. Best is trial 72 with value: 0.4744770237730605.
A new study created in RDB with name: Ridge_83311
Trial 0 finished with value: 0.7712648433069431 and parameters: {'alpha': 0.0002484854048319034, 'max_iter': 62323}. Best is trial 10 with value: 0.7724504046344387.
Trial 2 finished with value: 0.7719957599674768 and parameters: {'alpha': 2.764520808555929, 'max_iter': 31420}. Best is trial 10 with value: 0.7724504046344387.
Trial 5 finished with value: 0.7719061501323881 and parameters: {'alpha': 2.391287585396468, 'max_iter': 90594}. Best is trial 10 with value: 0.7724504046344387.
Trial 3 finished with value: 0.7712668033974213 and parameters: {'alpha': 0.006934499903390365, 'max_iter': 53611}. Best is trial 10 with value: 0.7724504046344387.
Trial 4 finished with value: 0.7712766447049504 and parameters: {'alpha': 0.04055347611653866, 'max_iter': 85510}. Best is trial 10 with value: 0.7724504046344387.
Trial 13 finished with value: 0.771298595750779 and parameters: {'alpha': 0.11584050831787042, 'max_iter': 10799}. Best is trial 10 with value: 0.7724504046344387.
Trial 19 finished with value: 0.771956863960594 and parameters: {'alpha': 2.601100627354027, 'max_iter': 29306}. Best is trial 10 with value: 0.7724504046344387.
Trial 14 finished with value: 0.7717890545671965 and parameters: {'alpha': 1.920103934774352, 'max_iter': 99462}. Best is trial 10 with value: 0.7724504046344387.
Trial 1 finished with value: 0.7712648599736869 and parameters: {'alpha': 0.0003053231265037185, 'max_iter': 78837}. Best is trial 10 with value: 0.7724504046344387.
Trial 18 finished with value: 0.7722673190277053 and parameters: {'alpha': 3.9734282821482783, 'max_iter': 4360}. Best is trial 10 with value: 0.7724504046344387.
Trial 16 finished with value: 0.7713835872304645 and parameters: {'alpha': 0.41134839942393053, 'max_iter': 8718}. Best is trial 10 with value: 0.7724504046344387.
Trial 15 finished with value: 0.7712934675176571 and parameters: {'alpha': 0.09821456553072576, 'max_iter': 92542}. Best is trial 10 with value: 0.7724504046344387.
Trial 10 finished with value: 0.7724504046344387 and parameters: {'alpha': 4.8683711175471105, 'max_iter': 17937}. Best is trial 10 with value: 0.7724504046344387.
Trial 20 finished with value: 0.7712663469236192 and parameters: {'alpha': 0.005377141648459176, 'max_iter': 41231}. Best is trial 10 with value: 0.7724504046344387.
Trial 23 finished with value: 0.771342995394909 and parameters: {'alpha': 0.2694080632677061, 'max_iter': 50467}. Best is trial 10 with value: 0.7724504046344387.
Trial 22 finished with value: 0.7712705961414303 and parameters: {'alpha': 0.01988112752669349, 'max_iter': 67849}. Best is trial 10 with value: 0.7724504046344387.
Trial 9 finished with value: 0.7712752915399961 and parameters: {'alpha': 0.03592600688811101, 'max_iter': 1137}. Best is trial 10 with value: 0.7724504046344387.
Trial 6 finished with value: 0.7712804709263403 and parameters: {'alpha': 0.05364664740472624, 'max_iter': 17685}. Best is trial 10 with value: 0.7724504046344387.
Trial 8 finished with value: 0.7714676417092772 and parameters: {'alpha': 0.710135321896089, 'max_iter': 9222}. Best is trial 10 with value: 0.7724504046344387.
Trial 17 finished with value: 0.7714285196293525 and parameters: {'alpha': 0.5702360897802145, 'max_iter': 59745}. Best is trial 10 with value: 0.7724504046344387.
Trial 21 finished with value: 0.7713601123707504 and parameters: {'alpha': 0.3290800204186513, 'max_iter': 45740}. Best is trial 10 with value: 0.7724504046344387.
Trial 11 finished with value: 0.7716322019144799 and parameters: {'alpha': 1.3154386194764738, 'max_iter': 60990}. Best is trial 10 with value: 0.7724504046344387.
Trial 12 finished with value: 0.771265680064151 and parameters: {'alpha': 0.0031023264883893757, 'max_iter': 50551}. Best is trial 10 with value: 0.7724504046344387.
Trial 7 finished with value: 0.7712736925030519 and parameters: {'alpha': 0.030459741208456986, 'max_iter': 82022}. Best is trial 10 with value: 0.7724504046344387.
Trial 26 finished with value: 0.7712661913202705 and parameters: {'alpha': 0.004846308009662848, 'max_iter': 21144}. Best is trial 10 with value: 0.7724504046344387.
Trial 35 finished with value: 0.7712668252485372 and parameters: {'alpha': 0.00700905412195799, 'max_iter': 7475}. Best is trial 10 with value: 0.7724504046344387.
Trial 24 finished with value: 0.7712662492327318 and parameters: {'alpha': 0.0050438712885541095, 'max_iter': 40345}. Best is trial 10 with value: 0.7724504046344387.
Trial 29 finished with value: 0.771437918061281 and parameters: {'alpha': 0.6037105762845347, 'max_iter': 81991}. Best is trial 10 with value: 0.7724504046344387.
Trial 37 finished with value: 0.7712930792061777 and parameters: {'alpha': 0.09688085248078229, 'max_iter': 94574}. Best is trial 10 with value: 0.7724504046344387.
Trial 36 finished with value: 0.771833484327421 and parameters: {'alpha': 2.096783270731441, 'max_iter': 11035}. Best is trial 10 with value: 0.7724504046344387.
Trial 27 finished with value: 0.7716271107254159 and parameters: {'alpha': 1.2962836542427558, 'max_iter': 73114}. Best is trial 10 with value: 0.7724504046344387.
Trial 28 finished with value: 0.7712648533514164 and parameters: {'alpha': 0.00028273951646682954, 'max_iter': 68356}. Best is trial 10 with value: 0.7724504046344387.
Trial 33 finished with value: 0.7712721804619985 and parameters: {'alpha': 0.025292880917356146, 'max_iter': 36050}. Best is trial 10 with value: 0.7724504046344387.
Trial 42 finished with value: 0.7712648070576756 and parameters: {'alpha': 0.00012486724790917173, 'max_iter': 11224}. Best is trial 10 with value: 0.7724504046344387.
Trial 31 finished with value: 0.7713146122189933 and parameters: {'alpha': 0.1710373231241302, 'max_iter': 39297}. Best is trial 10 with value: 0.7724504046344387.
Trial 38 finished with value: 0.7712751954329925 and parameters: {'alpha': 0.035597405800595304, 'max_iter': 75735}. Best is trial 10 with value: 0.7724504046344387.
Trial 25 finished with value: 0.7712648336613257 and parameters: {'alpha': 0.0002155915705343287, 'max_iter': 71491}. Best is trial 10 with value: 0.7724504046344387.
Trial 34 finished with value: 0.7712649063240381 and parameters: {'alpha': 0.00046339053751066336, 'max_iter': 42872}. Best is trial 10 with value: 0.7724504046344387.
