A new study created in RDB with name: Ridge_81445
Trial 0 finished with value: 0.7715713544761709 and parameters: {'alpha': 1.088341847479919, 'max_iter': 76923, 'solver': 'svd'}. Best is trial 0 with value: 0.7715713544761709.
Trial 14 failed because of the following error: ValueError('\nAll the 10 fits failed.\nIt is very likely that your model is misconfigured.\nYou can try to debug the error by setting error_score=\'raise\'.\n\nBelow are more details about the failures:\n--------------------------------------------------------------------------------\n10 fits failed with the following error:\nTraceback (most recent call last):\n  File "/usr/local/lib/python3.8/dist-packages/sklearn/model_selection/_validation.py", line 686, in _fit_and_score\n    estimator.fit(X_train, y_train, **fit_params)\n  File "/usr/local/lib/python3.8/dist-packages/sklearn/linear_model/_ridge.py", line 1130, in fit\n    return super().fit(X, y, sample_weight=sample_weight)\n  File "/usr/local/lib/python3.8/dist-packages/sklearn/linear_model/_ridge.py", line 806, in fit\n    raise ValueError(\nValueError: \'lbfgs\' solver can be used only when positive=True. Please use another solver.\n')
Traceback (most recent call last):
  File "/usr/local/lib/python3.8/dist-packages/optuna/study/_optimize.py", line 196, in _run_trial
    value_or_values = func(trial)
  File "/tmp/ipykernel_7443/3813527409.py", line 24, in __call__
    scores = cross_validate(estimator=model, scoring=metrics,
  File "/usr/local/lib/python3.8/dist-packages/sklearn/model_selection/_validation.py", line 285, in cross_validate
    _warn_or_raise_about_fit_failures(results, error_score)
  File "/usr/local/lib/python3.8/dist-packages/sklearn/model_selection/_validation.py", line 367, in _warn_or_raise_about_fit_failures
    raise ValueError(all_fits_failed_message)
ValueError: 
All the 10 fits failed.
It is very likely that your model is misconfigured.
You can try to debug the error by setting error_score='raise'.

Below are more details about the failures:
--------------------------------------------------------------------------------
10 fits failed with the following error:
Traceback (most recent call last):
  File "/usr/local/lib/python3.8/dist-packages/sklearn/model_selection/_validation.py", line 686, in _fit_and_score
    estimator.fit(X_train, y_train, **fit_params)
  File "/usr/local/lib/python3.8/dist-packages/sklearn/linear_model/_ridge.py", line 1130, in fit
    return super().fit(X, y, sample_weight=sample_weight)
  File "/usr/local/lib/python3.8/dist-packages/sklearn/linear_model/_ridge.py", line 806, in fit
    raise ValueError(
ValueError: 'lbfgs' solver can be used only when positive=True. Please use another solver.

Trial 2 finished with value: 0.7712656556707917 and parameters: {'alpha': 0.0030191221566381915, 'max_iter': 888, 'solver': 'svd'}. Best is trial 0 with value: 0.7715713544761709.
Trial 9 finished with value: 0.7712648541614996 and parameters: {'alpha': 0.00028550210349302717, 'max_iter': 14646, 'solver': 'svd'}. Best is trial 11 with value: 0.7717140342149615.
Trial 15 failed because of the following error: ValueError('\nAll the 10 fits failed.\nIt is very likely that your model is misconfigured.\nYou can try to debug the error by setting error_score=\'raise\'.\n\nBelow are more details about the failures:\n--------------------------------------------------------------------------------\n10 fits failed with the following error:\nTraceback (most recent call last):\n  File "/usr/local/lib/python3.8/dist-packages/sklearn/model_selection/_validation.py", line 686, in _fit_and_score\n    estimator.fit(X_train, y_train, **fit_params)\n  File "/usr/local/lib/python3.8/dist-packages/sklearn/linear_model/_ridge.py", line 1130, in fit\n    return super().fit(X, y, sample_weight=sample_weight)\n  File "/usr/local/lib/python3.8/dist-packages/sklearn/linear_model/_ridge.py", line 806, in fit\n    raise ValueError(\nValueError: \'lbfgs\' solver can be used only when positive=True. Please use another solver.\n')
Traceback (most recent call last):
  File "/usr/local/lib/python3.8/dist-packages/optuna/study/_optimize.py", line 196, in _run_trial
    value_or_values = func(trial)
  File "/tmp/ipykernel_7443/3813527409.py", line 24, in __call__
    scores = cross_validate(estimator=model, scoring=metrics,
  File "/usr/local/lib/python3.8/dist-packages/sklearn/model_selection/_validation.py", line 285, in cross_validate
    _warn_or_raise_about_fit_failures(results, error_score)
  File "/usr/local/lib/python3.8/dist-packages/sklearn/model_selection/_validation.py", line 367, in _warn_or_raise_about_fit_failures
    raise ValueError(all_fits_failed_message)
ValueError: 
All the 10 fits failed.
It is very likely that your model is misconfigured.
You can try to debug the error by setting error_score='raise'.

Below are more details about the failures:
--------------------------------------------------------------------------------
10 fits failed with the following error:
Traceback (most recent call last):
  File "/usr/local/lib/python3.8/dist-packages/sklearn/model_selection/_validation.py", line 686, in _fit_and_score
    estimator.fit(X_train, y_train, **fit_params)
  File "/usr/local/lib/python3.8/dist-packages/sklearn/linear_model/_ridge.py", line 1130, in fit
    return super().fit(X, y, sample_weight=sample_weight)
  File "/usr/local/lib/python3.8/dist-packages/sklearn/linear_model/_ridge.py", line 806, in fit
    raise ValueError(
ValueError: 'lbfgs' solver can be used only when positive=True. Please use another solver.

Trial 1 failed because of the following error: ValueError('\nAll the 10 fits failed.\nIt is very likely that your model is misconfigured.\nYou can try to debug the error by setting error_score=\'raise\'.\n\nBelow are more details about the failures:\n--------------------------------------------------------------------------------\n10 fits failed with the following error:\nTraceback (most recent call last):\n  File "/usr/local/lib/python3.8/dist-packages/sklearn/model_selection/_validation.py", line 686, in _fit_and_score\n    estimator.fit(X_train, y_train, **fit_params)\n  File "/usr/local/lib/python3.8/dist-packages/sklearn/linear_model/_ridge.py", line 1130, in fit\n    return super().fit(X, y, sample_weight=sample_weight)\n  File "/usr/local/lib/python3.8/dist-packages/sklearn/linear_model/_ridge.py", line 806, in fit\n    raise ValueError(\nValueError: \'lbfgs\' solver can be used only when positive=True. Please use another solver.\n')
Traceback (most recent call last):
  File "/usr/local/lib/python3.8/dist-packages/optuna/study/_optimize.py", line 196, in _run_trial
    value_or_values = func(trial)
  File "/tmp/ipykernel_7443/3813527409.py", line 24, in __call__
    scores = cross_validate(estimator=model, scoring=metrics,
  File "/usr/local/lib/python3.8/dist-packages/sklearn/model_selection/_validation.py", line 285, in cross_validate
    _warn_or_raise_about_fit_failures(results, error_score)
  File "/usr/local/lib/python3.8/dist-packages/sklearn/model_selection/_validation.py", line 367, in _warn_or_raise_about_fit_failures
    raise ValueError(all_fits_failed_message)
ValueError: 
All the 10 fits failed.
It is very likely that your model is misconfigured.
You can try to debug the error by setting error_score='raise'.

Below are more details about the failures:
--------------------------------------------------------------------------------
10 fits failed with the following error:
Traceback (most recent call last):
  File "/usr/local/lib/python3.8/dist-packages/sklearn/model_selection/_validation.py", line 686, in _fit_and_score
    estimator.fit(X_train, y_train, **fit_params)
  File "/usr/local/lib/python3.8/dist-packages/sklearn/linear_model/_ridge.py", line 1130, in fit
    return super().fit(X, y, sample_weight=sample_weight)
  File "/usr/local/lib/python3.8/dist-packages/sklearn/linear_model/_ridge.py", line 806, in fit
    raise ValueError(
ValueError: 'lbfgs' solver can be used only when positive=True. Please use another solver.

Trial 11 finished with value: 0.7717140342149615 and parameters: {'alpha': 1.6273101999329806, 'max_iter': 71772, 'solver': 'svd'}. Best is trial 20 with value: 0.772555805898368.
Trial 20 finished with value: 0.772555805898368 and parameters: {'alpha': 5.31035363079781, 'max_iter': 33690, 'solver': 'sag'}. Best is trial 20 with value: 0.772555805898368.
Trial 8 finished with value: 0.7712563973674287 and parameters: {'alpha': 0.0011010026887791173, 'max_iter': 2796, 'solver': 'sag'}. Best is trial 20 with value: 0.772555805898368.
Trial 10 failed because of the following error: ValueError('\nAll the 10 fits failed.\nIt is very likely that your model is misconfigured.\nYou can try to debug the error by setting error_score=\'raise\'.\n\nBelow are more details about the failures:\n--------------------------------------------------------------------------------\n10 fits failed with the following error:\nTraceback (most recent call last):\n  File "/usr/local/lib/python3.8/dist-packages/sklearn/model_selection/_validation.py", line 686, in _fit_and_score\n    estimator.fit(X_train, y_train, **fit_params)\n  File "/usr/local/lib/python3.8/dist-packages/sklearn/linear_model/_ridge.py", line 1130, in fit\n    return super().fit(X, y, sample_weight=sample_weight)\n  File "/usr/local/lib/python3.8/dist-packages/sklearn/linear_model/_ridge.py", line 806, in fit\n    raise ValueError(\nValueError: \'lbfgs\' solver can be used only when positive=True. Please use another solver.\n')
Traceback (most recent call last):
  File "/usr/local/lib/python3.8/dist-packages/optuna/study/_optimize.py", line 196, in _run_trial
    value_or_values = func(trial)
  File "/tmp/ipykernel_7443/3813527409.py", line 24, in __call__
    scores = cross_validate(estimator=model, scoring=metrics,
  File "/usr/local/lib/python3.8/dist-packages/sklearn/model_selection/_validation.py", line 285, in cross_validate
    _warn_or_raise_about_fit_failures(results, error_score)
  File "/usr/local/lib/python3.8/dist-packages/sklearn/model_selection/_validation.py", line 367, in _warn_or_raise_about_fit_failures
    raise ValueError(all_fits_failed_message)
ValueError: 
All the 10 fits failed.
It is very likely that your model is misconfigured.
You can try to debug the error by setting error_score='raise'.

Below are more details about the failures:
--------------------------------------------------------------------------------
10 fits failed with the following error:
Traceback (most recent call last):
  File "/usr/local/lib/python3.8/dist-packages/sklearn/model_selection/_validation.py", line 686, in _fit_and_score
    estimator.fit(X_train, y_train, **fit_params)
  File "/usr/local/lib/python3.8/dist-packages/sklearn/linear_model/_ridge.py", line 1130, in fit
    return super().fit(X, y, sample_weight=sample_weight)
  File "/usr/local/lib/python3.8/dist-packages/sklearn/linear_model/_ridge.py", line 806, in fit
    raise ValueError(
ValueError: 'lbfgs' solver can be used only when positive=True. Please use another solver.

Trial 16 finished with value: 0.7712800960644908 and parameters: {'alpha': 0.14932306230909503, 'max_iter': 83784, 'solver': 'sag'}. Best is trial 20 with value: 0.772555805898368.
Trial 17 finished with value: 0.7712815664917894 and parameters: {'alpha': 0.032469704544288935, 'max_iter': 40296, 'solver': 'sag'}. Best is trial 20 with value: 0.772555805898368.
Trial 13 finished with value: 0.7712689501120253 and parameters: {'alpha': 0.014260857790476714, 'max_iter': 57841, 'solver': 'svd'}. Best is trial 20 with value: 0.772555805898368.
Trial 5 finished with value: 0.7718004013936749 and parameters: {'alpha': 1.9716783976889438, 'max_iter': 36880, 'solver': 'sag'}. Best is trial 20 with value: 0.772555805898368.
Trial 3 finished with value: 0.7722162455371986 and parameters: {'alpha': 3.7361700123582082, 'max_iter': 54266, 'solver': 'svd'}. Best is trial 20 with value: 0.772555805898368.
Trial 7 finished with value: 0.771261536508624 and parameters: {'alpha': 0.002535792550546463, 'max_iter': 45229, 'solver': 'sag'}. Best is trial 21 with value: 0.7728004357847761.
Trial 6 finished with value: 0.7712732473226345 and parameters: {'alpha': 0.028938293050244125, 'max_iter': 30588, 'solver': 'svd'}. Best is trial 20 with value: 0.772555805898368.
Trial 21 finished with value: 0.7728004357847761 and parameters: {'alpha': 6.830207465380436, 'max_iter': 16334, 'solver': 'svd'}. Best is trial 21 with value: 0.7728004357847761.
Trial 23 failed because of the following error: ValueError('\nAll the 10 fits failed.\nIt is very likely that your model is misconfigured.\nYou can try to debug the error by setting error_score=\'raise\'.\n\nBelow are more details about the failures:\n--------------------------------------------------------------------------------\n10 fits failed with the following error:\nTraceback (most recent call last):\n  File "/usr/local/lib/python3.8/dist-packages/sklearn/model_selection/_validation.py", line 686, in _fit_and_score\n    estimator.fit(X_train, y_train, **fit_params)\n  File "/usr/local/lib/python3.8/dist-packages/sklearn/linear_model/_ridge.py", line 1130, in fit\n    return super().fit(X, y, sample_weight=sample_weight)\n  File "/usr/local/lib/python3.8/dist-packages/sklearn/linear_model/_ridge.py", line 806, in fit\n    raise ValueError(\nValueError: \'lbfgs\' solver can be used only when positive=True. Please use another solver.\n')
Traceback (most recent call last):
  File "/usr/local/lib/python3.8/dist-packages/optuna/study/_optimize.py", line 196, in _run_trial
    value_or_values = func(trial)
  File "/tmp/ipykernel_7443/3813527409.py", line 24, in __call__
    scores = cross_validate(estimator=model, scoring=metrics,
  File "/usr/local/lib/python3.8/dist-packages/sklearn/model_selection/_validation.py", line 285, in cross_validate
    _warn_or_raise_about_fit_failures(results, error_score)
  File "/usr/local/lib/python3.8/dist-packages/sklearn/model_selection/_validation.py", line 367, in _warn_or_raise_about_fit_failures
    raise ValueError(all_fits_failed_message)
ValueError: 
All the 10 fits failed.
It is very likely that your model is misconfigured.
You can try to debug the error by setting error_score='raise'.

Below are more details about the failures:
--------------------------------------------------------------------------------
10 fits failed with the following error:
Traceback (most recent call last):
  File "/usr/local/lib/python3.8/dist-packages/sklearn/model_selection/_validation.py", line 686, in _fit_and_score
    estimator.fit(X_train, y_train, **fit_params)
  File "/usr/local/lib/python3.8/dist-packages/sklearn/linear_model/_ridge.py", line 1130, in fit
    return super().fit(X, y, sample_weight=sample_weight)
  File "/usr/local/lib/python3.8/dist-packages/sklearn/linear_model/_ridge.py", line 806, in fit
    raise ValueError(
ValueError: 'lbfgs' solver can be used only when positive=True. Please use another solver.

Trial 19 finished with value: 0.7712952915104931 and parameters: {'alpha': 0.0005054098375225821, 'max_iter': 65258, 'solver': 'sag'}. Best is trial 21 with value: 0.7728004357847761.
Trial 12 finished with value: 0.7714143519545039 and parameters: {'alpha': 0.4415702860777677, 'max_iter': 69354, 'solver': 'sag'}. Best is trial 21 with value: 0.7728004357847761.
Trial 24 failed because of the following error: ValueError('\nAll the 10 fits failed.\nIt is very likely that your model is misconfigured.\nYou can try to debug the error by setting error_score=\'raise\'.\n\nBelow are more details about the failures:\n--------------------------------------------------------------------------------\n10 fits failed with the following error:\nTraceback (most recent call last):\n  File "/usr/local/lib/python3.8/dist-packages/sklearn/model_selection/_validation.py", line 686, in _fit_and_score\n    estimator.fit(X_train, y_train, **fit_params)\n  File "/usr/local/lib/python3.8/dist-packages/sklearn/linear_model/_ridge.py", line 1130, in fit\n    return super().fit(X, y, sample_weight=sample_weight)\n  File "/usr/local/lib/python3.8/dist-packages/sklearn/linear_model/_ridge.py", line 806, in fit\n    raise ValueError(\nValueError: \'lbfgs\' solver can be used only when positive=True. Please use another solver.\n')
Traceback (most recent call last):
  File "/usr/local/lib/python3.8/dist-packages/optuna/study/_optimize.py", line 196, in _run_trial
    value_or_values = func(trial)
  File "/tmp/ipykernel_7443/3813527409.py", line 24, in __call__
    scores = cross_validate(estimator=model, scoring=metrics,
  File "/usr/local/lib/python3.8/dist-packages/sklearn/model_selection/_validation.py", line 285, in cross_validate
    _warn_or_raise_about_fit_failures(results, error_score)
  File "/usr/local/lib/python3.8/dist-packages/sklearn/model_selection/_validation.py", line 367, in _warn_or_raise_about_fit_failures
    raise ValueError(all_fits_failed_message)
ValueError: 
All the 10 fits failed.
It is very likely that your model is misconfigured.
You can try to debug the error by setting error_score='raise'.

Below are more details about the failures:
--------------------------------------------------------------------------------
10 fits failed with the following error:
Traceback (most recent call last):
  File "/usr/local/lib/python3.8/dist-packages/sklearn/model_selection/_validation.py", line 686, in _fit_and_score
    estimator.fit(X_train, y_train, **fit_params)
  File "/usr/local/lib/python3.8/dist-packages/sklearn/linear_model/_ridge.py", line 1130, in fit
    return super().fit(X, y, sample_weight=sample_weight)
  File "/usr/local/lib/python3.8/dist-packages/sklearn/linear_model/_ridge.py", line 806, in fit
    raise ValueError(
ValueError: 'lbfgs' solver can be used only when positive=True. Please use another solver.

Trial 4 finished with value: 0.7712695250546693 and parameters: {'alpha': 0.016223702595831554, 'max_iter': 98009, 'solver': 'svd'}. Best is trial 21 with value: 0.7728004357847761.
Trial 22 finished with value: 0.7713474146719649 and parameters: {'alpha': 0.4317785501100936, 'max_iter': 25260, 'solver': 'sag'}. Best is trial 21 with value: 0.7728004357847761.
Trial 18 finished with value: 0.7712126038196001 and parameters: {'alpha': 0.00013631452690665894, 'max_iter': 72187, 'solver': 'sag'}. Best is trial 21 with value: 0.7728004357847761.
A new study created in RDB with name: Ridge_8314
Trial 0 finished with value: 0.470796169103215 and parameters: {'alpha': 0.027720697513396293, 'max_iter': 79287}. Best is trial 0 with value: 0.470796169103215.
Trial 7 finished with value: 0.47080137421479346 and parameters: {'alpha': 0.046050250350257935, 'max_iter': 70217}. Best is trial 11 with value: 0.47092850540767167.
Trial 1 finished with value: 0.4708037705635686 and parameters: {'alpha': 0.05446253958302775, 'max_iter': 62604}. Best is trial 11 with value: 0.47092850540767167.
Trial 3 finished with value: 0.4708050247194159 and parameters: {'alpha': 0.05885844013257605, 'max_iter': 57106}. Best is trial 21 with value: 0.47093442432802324.
Trial 6 finished with value: 0.4707828842305036 and parameters: {'alpha': 0.00010679948871921715, 'max_iter': 82557}. Best is trial 11 with value: 0.47092850540767167.
Trial 11 finished with value: 0.47092850540767167 and parameters: {'alpha': 0.4439636074694024, 'max_iter': 62686}. Best is trial 21 with value: 0.47093442432802324.
Trial 18 finished with value: 0.47078289099331166 and parameters: {'alpha': 0.00013243247201101793, 'max_iter': 2755}. Best is trial 21 with value: 0.47093442432802324.
Trial 2 finished with value: 0.47079687923421953 and parameters: {'alpha': 0.030225922835312023, 'max_iter': 94722}. Best is trial 21 with value: 0.47093442432802324.
Trial 21 finished with value: 0.47093442432802324 and parameters: {'alpha': 0.4631047259964954, 'max_iter': 7073}. Best is trial 21 with value: 0.47093442432802324.
Trial 16 finished with value: 0.47078515112533 and parameters: {'alpha': 0.008694781937153466, 'max_iter': 2470}. Best is trial 21 with value: 0.47093442432802324.
Trial 9 finished with value: 0.4707918433725604 and parameters: {'alpha': 0.012430118102323176, 'max_iter': 46427}. Best is trial 21 with value: 0.47093442432802324.
Trial 4 finished with value: 0.4707841503393969 and parameters: {'alpha': 0.0049044200322959615, 'max_iter': 51740}. Best is trial 21 with value: 0.47093442432802324.
Trial 12 finished with value: 0.47078317321846697 and parameters: {'alpha': 0.001202081077623103, 'max_iter': 77711}. Best is trial 21 with value: 0.47093442432802324.
Trial 17 finished with value: 0.47078289173547416 and parameters: {'alpha': 0.00013524547577550594, 'max_iter': 43230}. Best is trial 21 with value: 0.47093442432802324.
Trial 19 finished with value: 0.4707962330706053 and parameters: {'alpha': 0.027946421805830096, 'max_iter': 61803}. Best is trial 21 with value: 0.47093442432802324.
Trial 8 finished with value: 0.47082304775754336 and parameters: {'alpha': 0.12036515653281724, 'max_iter': 75227}. Best is trial 21 with value: 0.47093442432802324.
Trial 10 finished with value: 0.4710567417241891 and parameters: {'alpha': 0.8519440548291722, 'max_iter': 94906}. Best is trial 10 with value: 0.4710567417241891.
Trial 15 finished with value: 0.47078389006756727 and parameters: {'alpha': 0.003918395971909958, 'max_iter': 29043}. Best is trial 10 with value: 0.4710567417241891.
Trial 14 finished with value: 0.47085824905910423 and parameters: {'alpha': 0.21365698484223122, 'max_iter': 85417}. Best is trial 10 with value: 0.4710567417241891.
Trial 5 finished with value: 0.47078452562890466 and parameters: {'alpha': 0.00632598329921279, 'max_iter': 49207}. Best is trial 20 with value: 0.4739804617344876.
Trial 13 finished with value: 0.47192623522480626 and parameters: {'alpha': 1.3141661300530347, 'max_iter': 20721}. Best is trial 20 with value: 0.4739804617344876.
