Trial 108 finished with value: 0.7712954115106515 and parameters: {'alpha': 0.10489346127994584, 'max_iter': 72529}. Best is trial 77 with value: 0.7726025237206751.
A new study created in RDB with name: Poly_Linear_911
Trial 2 failed because of the following error: TypeError('PolynomialRegression() argument after * must be an iterable, not int')
Traceback (most recent call last):
  File "/usr/local/lib/python3.8/dist-packages/optuna/study/_optimize.py", line 196, in _run_trial
    value_or_values = func(trial)
  File "/tmp/ipykernel_7443/3357385256.py", line 14, in __call__
    model = PolynomialRegression(*args, **kwargs)
TypeError: PolynomialRegression() argument after * must be an iterable, not int
Trial 4 failed because of the following error: TypeError('PolynomialRegression() argument after * must be an iterable, not int')
Traceback (most recent call last):
  File "/usr/local/lib/python3.8/dist-packages/optuna/study/_optimize.py", line 196, in _run_trial
    value_or_values = func(trial)
  File "/tmp/ipykernel_7443/3357385256.py", line 14, in __call__
    model = PolynomialRegression(*args, **kwargs)
TypeError: PolynomialRegression() argument after * must be an iterable, not int
Trial 14 failed because of the following error: TypeError('PolynomialRegression() argument after * must be an iterable, not int')
Traceback (most recent call last):
  File "/usr/local/lib/python3.8/dist-packages/optuna/study/_optimize.py", line 196, in _run_trial
    value_or_values = func(trial)
  File "/tmp/ipykernel_7443/3357385256.py", line 14, in __call__
    model = PolynomialRegression(*args, **kwargs)
TypeError: PolynomialRegression() argument after * must be an iterable, not int
Trial 22 failed because of the following error: TypeError('PolynomialRegression() argument after * must be an iterable, not int')
Traceback (most recent call last):
  File "/usr/local/lib/python3.8/dist-packages/optuna/study/_optimize.py", line 196, in _run_trial
    value_or_values = func(trial)
  File "/tmp/ipykernel_7443/3357385256.py", line 14, in __call__
    model = PolynomialRegression(*args, **kwargs)
TypeError: PolynomialRegression() argument after * must be an iterable, not int
Trial 21 failed because of the following error: TypeError('PolynomialRegression() argument after * must be an iterable, not int')
Traceback (most recent call last):
  File "/usr/local/lib/python3.8/dist-packages/optuna/study/_optimize.py", line 196, in _run_trial
    value_or_values = func(trial)
  File "/tmp/ipykernel_7443/3357385256.py", line 14, in __call__
    model = PolynomialRegression(*args, **kwargs)
TypeError: PolynomialRegression() argument after * must be an iterable, not int
Trial 16 failed because of the following error: TypeError('PolynomialRegression() argument after * must be an iterable, not int')
Traceback (most recent call last):
  File "/usr/local/lib/python3.8/dist-packages/optuna/study/_optimize.py", line 196, in _run_trial
    value_or_values = func(trial)
  File "/tmp/ipykernel_7443/3357385256.py", line 14, in __call__
    model = PolynomialRegression(*args, **kwargs)
TypeError: PolynomialRegression() argument after * must be an iterable, not int
Trial 20 failed because of the following error: TypeError('PolynomialRegression() argument after * must be an iterable, not int')
Traceback (most recent call last):
  File "/usr/local/lib/python3.8/dist-packages/optuna/study/_optimize.py", line 196, in _run_trial
    value_or_values = func(trial)
  File "/tmp/ipykernel_7443/3357385256.py", line 14, in __call__
    model = PolynomialRegression(*args, **kwargs)
TypeError: PolynomialRegression() argument after * must be an iterable, not int
Trial 19 failed because of the following error: TypeError('PolynomialRegression() argument after * must be an iterable, not int')
Traceback (most recent call last):
  File "/usr/local/lib/python3.8/dist-packages/optuna/study/_optimize.py", line 196, in _run_trial
    value_or_values = func(trial)
  File "/tmp/ipykernel_7443/3357385256.py", line 14, in __call__
    model = PolynomialRegression(*args, **kwargs)
TypeError: PolynomialRegression() argument after * must be an iterable, not int
Trial 1 failed because of the following error: TypeError('PolynomialRegression() argument after * must be an iterable, not int')
Traceback (most recent call last):
  File "/usr/local/lib/python3.8/dist-packages/optuna/study/_optimize.py", line 196, in _run_trial
    value_or_values = func(trial)
  File "/tmp/ipykernel_7443/3357385256.py", line 14, in __call__
    model = PolynomialRegression(*args, **kwargs)
TypeError: PolynomialRegression() argument after * must be an iterable, not int
Trial 0 failed because of the following error: TypeError('PolynomialRegression() argument after * must be an iterable, not int')
Traceback (most recent call last):
  File "/usr/local/lib/python3.8/dist-packages/optuna/study/_optimize.py", line 196, in _run_trial
    value_or_values = func(trial)
  File "/tmp/ipykernel_7443/3357385256.py", line 14, in __call__
    model = PolynomialRegression(*args, **kwargs)
TypeError: PolynomialRegression() argument after * must be an iterable, not int
Trial 18 failed because of the following error: TypeError('PolynomialRegression() argument after * must be an iterable, not int')
Traceback (most recent call last):
  File "/usr/local/lib/python3.8/dist-packages/optuna/study/_optimize.py", line 196, in _run_trial
    value_or_values = func(trial)
  File "/tmp/ipykernel_7443/3357385256.py", line 14, in __call__
    model = PolynomialRegression(*args, **kwargs)
TypeError: PolynomialRegression() argument after * must be an iterable, not int
Trial 5 failed because of the following error: TypeError('PolynomialRegression() argument after * must be an iterable, not int')
Traceback (most recent call last):
  File "/usr/local/lib/python3.8/dist-packages/optuna/study/_optimize.py", line 196, in _run_trial
    value_or_values = func(trial)
  File "/tmp/ipykernel_7443/3357385256.py", line 14, in __call__
    model = PolynomialRegression(*args, **kwargs)
TypeError: PolynomialRegression() argument after * must be an iterable, not int
Trial 6 failed because of the following error: TypeError('PolynomialRegression() argument after * must be an iterable, not int')
Traceback (most recent call last):
  File "/usr/local/lib/python3.8/dist-packages/optuna/study/_optimize.py", line 196, in _run_trial
    value_or_values = func(trial)
  File "/tmp/ipykernel_7443/3357385256.py", line 14, in __call__
    model = PolynomialRegression(*args, **kwargs)
TypeError: PolynomialRegression() argument after * must be an iterable, not int
Trial 9 failed because of the following error: TypeError('PolynomialRegression() argument after * must be an iterable, not int')
Traceback (most recent call last):
  File "/usr/local/lib/python3.8/dist-packages/optuna/study/_optimize.py", line 196, in _run_trial
    value_or_values = func(trial)
  File "/tmp/ipykernel_7443/3357385256.py", line 14, in __call__
    model = PolynomialRegression(*args, **kwargs)
TypeError: PolynomialRegression() argument after * must be an iterable, not int
Trial 12 failed because of the following error: TypeError('PolynomialRegression() argument after * must be an iterable, not int')
Traceback (most recent call last):
  File "/usr/local/lib/python3.8/dist-packages/optuna/study/_optimize.py", line 196, in _run_trial
    value_or_values = func(trial)
  File "/tmp/ipykernel_7443/3357385256.py", line 14, in __call__
    model = PolynomialRegression(*args, **kwargs)
TypeError: PolynomialRegression() argument after * must be an iterable, not int
Trial 10 failed because of the following error: TypeError('PolynomialRegression() argument after * must be an iterable, not int')
Traceback (most recent call last):
  File "/usr/local/lib/python3.8/dist-packages/optuna/study/_optimize.py", line 196, in _run_trial
    value_or_values = func(trial)
  File "/tmp/ipykernel_7443/3357385256.py", line 14, in __call__
    model = PolynomialRegression(*args, **kwargs)
TypeError: PolynomialRegression() argument after * must be an iterable, not int
Trial 11 failed because of the following error: TypeError('PolynomialRegression() argument after * must be an iterable, not int')
Traceback (most recent call last):
  File "/usr/local/lib/python3.8/dist-packages/optuna/study/_optimize.py", line 196, in _run_trial
    value_or_values = func(trial)
  File "/tmp/ipykernel_7443/3357385256.py", line 14, in __call__
    model = PolynomialRegression(*args, **kwargs)
TypeError: PolynomialRegression() argument after * must be an iterable, not int
Trial 23 failed because of the following error: TypeError('PolynomialRegression() argument after * must be an iterable, not int')
Traceback (most recent call last):
  File "/usr/local/lib/python3.8/dist-packages/optuna/study/_optimize.py", line 196, in _run_trial
    value_or_values = func(trial)
  File "/tmp/ipykernel_7443/3357385256.py", line 14, in __call__
    model = PolynomialRegression(*args, **kwargs)
TypeError: PolynomialRegression() argument after * must be an iterable, not int
Trial 13 failed because of the following error: TypeError('PolynomialRegression() argument after * must be an iterable, not int')
Traceback (most recent call last):
  File "/usr/local/lib/python3.8/dist-packages/optuna/study/_optimize.py", line 196, in _run_trial
    value_or_values = func(trial)
  File "/tmp/ipykernel_7443/3357385256.py", line 14, in __call__
    model = PolynomialRegression(*args, **kwargs)
TypeError: PolynomialRegression() argument after * must be an iterable, not int
Trial 7 failed because of the following error: TypeError('PolynomialRegression() argument after * must be an iterable, not int')
Traceback (most recent call last):
  File "/usr/local/lib/python3.8/dist-packages/optuna/study/_optimize.py", line 196, in _run_trial
    value_or_values = func(trial)
  File "/tmp/ipykernel_7443/3357385256.py", line 14, in __call__
    model = PolynomialRegression(*args, **kwargs)
TypeError: PolynomialRegression() argument after * must be an iterable, not int
Trial 15 failed because of the following error: TypeError('PolynomialRegression() argument after * must be an iterable, not int')
Traceback (most recent call last):
  File "/usr/local/lib/python3.8/dist-packages/optuna/study/_optimize.py", line 196, in _run_trial
    value_or_values = func(trial)
  File "/tmp/ipykernel_7443/3357385256.py", line 14, in __call__
    model = PolynomialRegression(*args, **kwargs)
TypeError: PolynomialRegression() argument after * must be an iterable, not int
Trial 3 failed because of the following error: TypeError('PolynomialRegression() argument after * must be an iterable, not int')
Traceback (most recent call last):
  File "/usr/local/lib/python3.8/dist-packages/optuna/study/_optimize.py", line 196, in _run_trial
    value_or_values = func(trial)
  File "/tmp/ipykernel_7443/3357385256.py", line 14, in __call__
    model = PolynomialRegression(*args, **kwargs)
TypeError: PolynomialRegression() argument after * must be an iterable, not int
Trial 8 failed because of the following error: TypeError('PolynomialRegression() argument after * must be an iterable, not int')
Traceback (most recent call last):
  File "/usr/local/lib/python3.8/dist-packages/optuna/study/_optimize.py", line 196, in _run_trial
    value_or_values = func(trial)
  File "/tmp/ipykernel_7443/3357385256.py", line 14, in __call__
    model = PolynomialRegression(*args, **kwargs)
TypeError: PolynomialRegression() argument after * must be an iterable, not int
Trial 17 failed because of the following error: TypeError('PolynomialRegression() argument after * must be an iterable, not int')
Traceback (most recent call last):
  File "/usr/local/lib/python3.8/dist-packages/optuna/study/_optimize.py", line 196, in _run_trial
    value_or_values = func(trial)
  File "/tmp/ipykernel_7443/3357385256.py", line 14, in __call__
    model = PolynomialRegression(*args, **kwargs)
TypeError: PolynomialRegression() argument after * must be an iterable, not int
A new study created in RDB with name: Poly_Linear_9238
Trial 3 failed because of the following error: TypeError("suggest_int() missing 1 required positional argument: 'high'")
Traceback (most recent call last):
  File "/usr/local/lib/python3.8/dist-packages/optuna/study/_optimize.py", line 196, in _run_trial
    value_or_values = func(trial)
  File "/tmp/ipykernel_7443/3653713586.py", line 8, in __call__
    args = trial.suggest_int(1, 100)
TypeError: suggest_int() missing 1 required positional argument: 'high'
Trial 7 failed because of the following error: TypeError("suggest_int() missing 1 required positional argument: 'high'")
Traceback (most recent call last):
  File "/usr/local/lib/python3.8/dist-packages/optuna/study/_optimize.py", line 196, in _run_trial
    value_or_values = func(trial)
  File "/tmp/ipykernel_7443/3653713586.py", line 8, in __call__
    args = trial.suggest_int(1, 100)
TypeError: suggest_int() missing 1 required positional argument: 'high'
Trial 11 failed because of the following error: TypeError("suggest_int() missing 1 required positional argument: 'high'")
Traceback (most recent call last):
  File "/usr/local/lib/python3.8/dist-packages/optuna/study/_optimize.py", line 196, in _run_trial
    value_or_values = func(trial)
  File "/tmp/ipykernel_7443/3653713586.py", line 8, in __call__
    args = trial.suggest_int(1, 100)
TypeError: suggest_int() missing 1 required positional argument: 'high'
Trial 18 failed because of the following error: TypeError("suggest_int() missing 1 required positional argument: 'high'")
Traceback (most recent call last):
  File "/usr/local/lib/python3.8/dist-packages/optuna/study/_optimize.py", line 196, in _run_trial
    value_or_values = func(trial)
  File "/tmp/ipykernel_7443/3653713586.py", line 8, in __call__
    args = trial.suggest_int(1, 100)
TypeError: suggest_int() missing 1 required positional argument: 'high'
Trial 1 failed because of the following error: TypeError("suggest_int() missing 1 required positional argument: 'high'")
Traceback (most recent call last):
  File "/usr/local/lib/python3.8/dist-packages/optuna/study/_optimize.py", line 196, in _run_trial
    value_or_values = func(trial)
  File "/tmp/ipykernel_7443/3653713586.py", line 8, in __call__
    args = trial.suggest_int(1, 100)
TypeError: suggest_int() missing 1 required positional argument: 'high'
Trial 14 failed because of the following error: TypeError("suggest_int() missing 1 required positional argument: 'high'")
Traceback (most recent call last):
  File "/usr/local/lib/python3.8/dist-packages/optuna/study/_optimize.py", line 196, in _run_trial
    value_or_values = func(trial)
  File "/tmp/ipykernel_7443/3653713586.py", line 8, in __call__
    args = trial.suggest_int(1, 100)
TypeError: suggest_int() missing 1 required positional argument: 'high'
Trial 12 failed because of the following error: TypeError("suggest_int() missing 1 required positional argument: 'high'")
Traceback (most recent call last):
  File "/usr/local/lib/python3.8/dist-packages/optuna/study/_optimize.py", line 196, in _run_trial
    value_or_values = func(trial)
  File "/tmp/ipykernel_7443/3653713586.py", line 8, in __call__
    args = trial.suggest_int(1, 100)
TypeError: suggest_int() missing 1 required positional argument: 'high'
Trial 6 failed because of the following error: TypeError("suggest_int() missing 1 required positional argument: 'high'")
Traceback (most recent call last):
  File "/usr/local/lib/python3.8/dist-packages/optuna/study/_optimize.py", line 196, in _run_trial
    value_or_values = func(trial)
  File "/tmp/ipykernel_7443/3653713586.py", line 8, in __call__
    args = trial.suggest_int(1, 100)
TypeError: suggest_int() missing 1 required positional argument: 'high'
Trial 8 failed because of the following error: TypeError("suggest_int() missing 1 required positional argument: 'high'")
Traceback (most recent call last):
  File "/usr/local/lib/python3.8/dist-packages/optuna/study/_optimize.py", line 196, in _run_trial
    value_or_values = func(trial)
  File "/tmp/ipykernel_7443/3653713586.py", line 8, in __call__
    args = trial.suggest_int(1, 100)
TypeError: suggest_int() missing 1 required positional argument: 'high'
Trial 2 failed because of the following error: TypeError("suggest_int() missing 1 required positional argument: 'high'")
Traceback (most recent call last):
  File "/usr/local/lib/python3.8/dist-packages/optuna/study/_optimize.py", line 196, in _run_trial
    value_or_values = func(trial)
  File "/tmp/ipykernel_7443/3653713586.py", line 8, in __call__
    args = trial.suggest_int(1, 100)
TypeError: suggest_int() missing 1 required positional argument: 'high'
Trial 13 failed because of the following error: TypeError("suggest_int() missing 1 required positional argument: 'high'")
Traceback (most recent call last):
  File "/usr/local/lib/python3.8/dist-packages/optuna/study/_optimize.py", line 196, in _run_trial
    value_or_values = func(trial)
  File "/tmp/ipykernel_7443/3653713586.py", line 8, in __call__
    args = trial.suggest_int(1, 100)
TypeError: suggest_int() missing 1 required positional argument: 'high'
Trial 15 failed because of the following error: TypeError("suggest_int() missing 1 required positional argument: 'high'")
Traceback (most recent call last):
  File "/usr/local/lib/python3.8/dist-packages/optuna/study/_optimize.py", line 196, in _run_trial
    value_or_values = func(trial)
  File "/tmp/ipykernel_7443/3653713586.py", line 8, in __call__
    args = trial.suggest_int(1, 100)
TypeError: suggest_int() missing 1 required positional argument: 'high'
Trial 0 failed because of the following error: TypeError("suggest_int() missing 1 required positional argument: 'high'")
Traceback (most recent call last):
  File "/usr/local/lib/python3.8/dist-packages/optuna/study/_optimize.py", line 196, in _run_trial
    value_or_values = func(trial)
  File "/tmp/ipykernel_7443/3653713586.py", line 8, in __call__
    args = trial.suggest_int(1, 100)
TypeError: suggest_int() missing 1 required positional argument: 'high'
Trial 5 failed because of the following error: TypeError("suggest_int() missing 1 required positional argument: 'high'")
Traceback (most recent call last):
  File "/usr/local/lib/python3.8/dist-packages/optuna/study/_optimize.py", line 196, in _run_trial
    value_or_values = func(trial)
  File "/tmp/ipykernel_7443/3653713586.py", line 8, in __call__
    args = trial.suggest_int(1, 100)
TypeError: suggest_int() missing 1 required positional argument: 'high'
Trial 16 failed because of the following error: TypeError("suggest_int() missing 1 required positional argument: 'high'")
Traceback (most recent call last):
  File "/usr/local/lib/python3.8/dist-packages/optuna/study/_optimize.py", line 196, in _run_trial
    value_or_values = func(trial)
  File "/tmp/ipykernel_7443/3653713586.py", line 8, in __call__
    args = trial.suggest_int(1, 100)
TypeError: suggest_int() missing 1 required positional argument: 'high'
Trial 17 failed because of the following error: TypeError("suggest_int() missing 1 required positional argument: 'high'")
Traceback (most recent call last):
  File "/usr/local/lib/python3.8/dist-packages/optuna/study/_optimize.py", line 196, in _run_trial
    value_or_values = func(trial)
  File "/tmp/ipykernel_7443/3653713586.py", line 8, in __call__
    args = trial.suggest_int(1, 100)
TypeError: suggest_int() missing 1 required positional argument: 'high'
Trial 22 failed because of the following error: TypeError("suggest_int() missing 1 required positional argument: 'high'")
Traceback (most recent call last):
  File "/usr/local/lib/python3.8/dist-packages/optuna/study/_optimize.py", line 196, in _run_trial
    value_or_values = func(trial)
  File "/tmp/ipykernel_7443/3653713586.py", line 8, in __call__
    args = trial.suggest_int(1, 100)
TypeError: suggest_int() missing 1 required positional argument: 'high'
Trial 9 failed because of the following error: TypeError("suggest_int() missing 1 required positional argument: 'high'")
Traceback (most recent call last):
  File "/usr/local/lib/python3.8/dist-packages/optuna/study/_optimize.py", line 196, in _run_trial
    value_or_values = func(trial)
  File "/tmp/ipykernel_7443/3653713586.py", line 8, in __call__
    args = trial.suggest_int(1, 100)
TypeError: suggest_int() missing 1 required positional argument: 'high'
Trial 21 failed because of the following error: TypeError("suggest_int() missing 1 required positional argument: 'high'")
Traceback (most recent call last):
  File "/usr/local/lib/python3.8/dist-packages/optuna/study/_optimize.py", line 196, in _run_trial
    value_or_values = func(trial)
  File "/tmp/ipykernel_7443/3653713586.py", line 8, in __call__
    args = trial.suggest_int(1, 100)
TypeError: suggest_int() missing 1 required positional argument: 'high'
Trial 19 failed because of the following error: TypeError("suggest_int() missing 1 required positional argument: 'high'")
Traceback (most recent call last):
  File "/usr/local/lib/python3.8/dist-packages/optuna/study/_optimize.py", line 196, in _run_trial
    value_or_values = func(trial)
  File "/tmp/ipykernel_7443/3653713586.py", line 8, in __call__
    args = trial.suggest_int(1, 100)
TypeError: suggest_int() missing 1 required positional argument: 'high'
Trial 10 failed because of the following error: TypeError("suggest_int() missing 1 required positional argument: 'high'")
Traceback (most recent call last):
  File "/usr/local/lib/python3.8/dist-packages/optuna/study/_optimize.py", line 196, in _run_trial
    value_or_values = func(trial)
  File "/tmp/ipykernel_7443/3653713586.py", line 8, in __call__
    args = trial.suggest_int(1, 100)
TypeError: suggest_int() missing 1 required positional argument: 'high'
Trial 20 failed because of the following error: TypeError("suggest_int() missing 1 required positional argument: 'high'")
Traceback (most recent call last):
  File "/usr/local/lib/python3.8